CVE ID	Published Date	Last Modified Date	Description	Base Score	Base Severity	Vector String	Vendor	Product
CVE-2015-1728	2015-06-10T01:59:09.647	2025-04-12T10:46:40.837	"Microsoft Windows Media Player 10 through 12 allows remote attackers to execute arbitrary code via a crafted DataObject on a web site, aka ""Windows Media Player RCE via DataObject Vulnerability."""	9.3	HIGH	AV:N/AC:M/Au:N/C:C/I:C/A:C		
CVE-2015-1730	2015-06-10T01:59:10.883	2025-04-12T10:46:40.837	"Microsoft Internet Explorer 9 allows remote attackers to execute arbitrary code or cause a denial of service (memory corruption) via a crafted web site, aka ""Internet Explorer Memory Corruption Vulnerability."""	9.3	HIGH	AV:N/AC:M/Au:N/C:C/I:C/A:C		
CVE-2015-1731	2015-06-10T01:59:11.900	2025-04-12T10:46:40.837	"Microsoft Internet Explorer 10 and 11 allows remote attackers to execute arbitrary code or cause a denial of service (memory corruption) via a crafted web site, aka ""Internet Explorer Memory Corruption Vulnerability,"" a different vulnerability than CVE-2015-1736, CVE-2015-1737, and CVE-2015-1755."	9.3	HIGH	AV:N/AC:M/Au:N/C:C/I:C/A:C		
CVE-2015-1732	2015-06-10T01:59:12.757	2025-04-12T10:46:40.837	"Microsoft Internet Explorer 11 allows remote attackers to execute arbitrary code or cause a denial of service (memory corruption) via a crafted web site, aka ""Internet Explorer Memory Corruption Vulnerability,"" a different vulnerability than CVE-2015-1742, CVE-2015-1747, CVE-2015-1750, and CVE-2015-1753."	9.3	HIGH	AV:N/AC:M/Au:N/C:C/I:C/A:C		
CVE-2015-1735	2015-06-10T01:59:13.557	2025-04-12T10:46:40.837	"Microsoft Internet Explorer 6 through 11 allows remote attackers to execute arbitrary code or cause a denial of service (memory corruption) via a crafted web site, aka ""Internet Explorer Memory Corruption Vulnerability,"" a different vulnerability than CVE-2015-1740, CVE-2015-1744, CVE-2015-1745, and CVE-2015-1766."	9.3	HIGH	AV:N/AC:M/Au:N/C:C/I:C/A:C		
CVE-2015-1736	2015-06-10T01:59:14.570	2025-04-12T10:46:40.837	"Microsoft Internet Explorer 10 and 11 allows remote attackers to execute arbitrary code or cause a denial of service (memory corruption) via a crafted web site, aka ""Internet Explorer Memory Corruption Vulnerability,"" a different vulnerability than CVE-2015-1731, CVE-2015-1737, and CVE-2015-1755."	9.3	HIGH	AV:N/AC:M/Au:N/C:C/I:C/A:C		
CVE-2015-1737	2015-06-10T01:59:15.430	2025-04-12T10:46:40.837	"Microsoft Internet Explorer 10 and 11 allows remote attackers to execute arbitrary code or cause a denial of service (memory corruption) via a crafted web site, aka ""Internet Explorer Memory Corruption Vulnerability,"" a different vulnerability than CVE-2015-1731, CVE-2015-1736, and CVE-2015-1755."	9.3	HIGH	AV:N/AC:M/Au:N/C:C/I:C/A:C		
CVE-2015-1739	2015-06-10T01:59:16.197	2025-04-12T10:46:40.837	"Microsoft Internet Explorer 10 and 11 allows remote attackers to gain privileges via a crafted web site, aka ""Internet Explorer Elevation of Privilege Vulnerability."""	6.8	MEDIUM	AV:N/AC:M/Au:N/C:P/I:P/A:P		
CVE-2015-1740	2015-06-10T01:59:16.977	2025-04-12T10:46:40.837	"Microsoft Internet Explorer 6 through 11 allows remote attackers to execute arbitrary code or cause a denial of service (memory corruption) via a crafted web site, aka ""Internet Explorer Memory Corruption Vulnerability,"" a different vulnerability than CVE-2015-1735, CVE-2015-1744, CVE-2015-1745, and CVE-2015-1766."	9.3	HIGH	AV:N/AC:M/Au:N/C:C/I:C/A:C		
CVE-2015-1741	2015-06-10T01:59:17.823	2025-04-12T10:46:40.837	"Microsoft Internet Explorer 9 through 11 allows remote attackers to execute arbitrary code or cause a denial of service (memory corruption) via a crafted web site, aka ""Internet Explorer Memory Corruption Vulnerability,"" a different vulnerability than CVE-2015-1752."	9.3	HIGH	AV:N/AC:M/Au:N/C:C/I:C/A:C		
CVE-2015-1742	2015-06-10T01:59:18.587	2025-04-12T10:46:40.837	"Microsoft Internet Explorer 11 allows remote attackers to execute arbitrary code or cause a denial of service (memory corruption) via a crafted web site, aka ""Internet Explorer Memory Corruption Vulnerability,"" a different vulnerability than CVE-2015-1732, CVE-2015-1747, CVE-2015-1750, and CVE-2015-1753."	9.3	HIGH	AV:N/AC:M/Au:N/C:C/I:C/A:C		
CVE-2015-1743	2015-06-10T01:59:19.400	2025-04-12T10:46:40.837	"Microsoft Internet Explorer 7 through 11 allows remote attackers to gain privileges via a crafted web site, aka ""Internet Explorer Elevation of Privilege Vulnerability,"" a different vulnerability than CVE-2015-1748."	5.1	MEDIUM	AV:N/AC:H/Au:N/C:P/I:P/A:P		
CVE-2015-1744	2015-06-10T01:59:20.260	2025-04-12T10:46:40.837	"Microsoft Internet Explorer 6 through 11 allows remote attackers to execute arbitrary code or cause a denial of service (memory corruption) via a crafted web site, aka ""Internet Explorer Memory Corruption Vulnerability,"" a different vulnerability than CVE-2015-1735, CVE-2015-1740, CVE-2015-1745, and CVE-2015-1766."	9.3	HIGH	AV:N/AC:M/Au:N/C:C/I:C/A:C		
CVE-2015-1745	2015-06-10T01:59:21.057	2025-04-12T10:46:40.837	"Microsoft Internet Explorer 6 through 11 allows remote attackers to execute arbitrary code or cause a denial of service (memory corruption) via a crafted web site, aka ""Internet Explorer Memory Corruption Vulnerability,"" a different vulnerability than CVE-2015-1735, CVE-2015-1740, CVE-2015-1744, and CVE-2015-1766."	9.3	HIGH	AV:N/AC:M/Au:N/C:C/I:C/A:C		
CVE-2015-1747	2015-06-10T01:59:21.917	2025-04-12T10:46:40.837	"Microsoft Internet Explorer 11 allows remote attackers to execute arbitrary code or cause a denial of service (memory corruption) via a crafted web site, aka ""Internet Explorer Memory Corruption Vulnerability,"" a different vulnerability than CVE-2015-1732, CVE-2015-1742, CVE-2015-1750, and CVE-2015-1753."	9.3	HIGH	AV:N/AC:M/Au:N/C:C/I:C/A:C		
CVE-2015-1748	2015-06-10T01:59:22.840	2025-04-12T10:46:40.837	"Microsoft Internet Explorer 7 through 11 allows remote attackers to gain privileges via a crafted web site, aka ""Internet Explorer Elevation of Privilege Vulnerability,"" a different vulnerability than CVE-2015-1743."	6.8	MEDIUM	AV:N/AC:M/Au:N/C:P/I:P/A:P		
CVE-2015-1750	2015-06-10T01:59:23.637	2025-04-12T10:46:40.837	"Microsoft Internet Explorer 11 allows remote attackers to execute arbitrary code or cause a denial of service (memory corruption) via a crafted web site, aka ""Internet Explorer Memory Corruption Vulnerability,"" a different vulnerability than CVE-2015-1732, CVE-2015-1742, CVE-2015-1747, and CVE-2015-1753."	9.3	HIGH	AV:N/AC:M/Au:N/C:C/I:C/A:C		
CVE-2015-1751	2015-06-10T01:59:24.513	2025-04-12T10:46:40.837	"Microsoft Internet Explorer 10 allows remote attackers to execute arbitrary code or cause a denial of service (memory corruption) via a crafted web site, aka ""Internet Explorer Memory Corruption Vulnerability."""	9.3	HIGH	AV:N/AC:M/Au:N/C:C/I:C/A:C		
CVE-2015-1752	2015-06-10T01:59:25.293	2025-04-12T10:46:40.837	"Microsoft Internet Explorer 9 through 11 allows remote attackers to execute arbitrary code or cause a denial of service (memory corruption) via a crafted web site, aka ""Internet Explorer Memory Corruption Vulnerability,"" a different vulnerability than CVE-2015-1741."	9.3	HIGH	AV:N/AC:M/Au:N/C:C/I:C/A:C		
CVE-2015-1753	2015-06-10T01:59:26.060	2025-04-12T10:46:40.837	"Microsoft Internet Explorer 11 allows remote attackers to execute arbitrary code or cause a denial of service (memory corruption) via a crafted web site, aka ""Internet Explorer Memory Corruption Vulnerability,"" a different vulnerability than CVE-2015-1732, CVE-2015-1742, CVE-2015-1747, and CVE-2015-1750."	9.3	HIGH	AV:N/AC:M/Au:N/C:C/I:C/A:C		
CVE-2015-1754	2015-06-10T01:59:26.827	2025-04-12T10:46:40.837	"Microsoft Internet Explorer 8 allows remote attackers to execute arbitrary code or cause a denial of service (memory corruption) via a crafted web site, aka ""Internet Explorer Memory Corruption Vulnerability."""	9.3	HIGH	AV:N/AC:M/Au:N/C:C/I:C/A:C		
CVE-2015-1755	2015-06-10T01:59:27.810	2025-04-12T10:46:40.837	"Microsoft Internet Explorer 10 and 11 allows remote attackers to execute arbitrary code or cause a denial of service (memory corruption) via a crafted web site, aka ""Internet Explorer Memory Corruption Vulnerability,"" a different vulnerability than CVE-2015-1731, CVE-2015-1736, and CVE-2015-1737."	9.3	HIGH	AV:N/AC:M/Au:N/C:C/I:C/A:C		
CVE-2015-1756	2015-06-10T01:59:28.717	2025-04-12T10:46:40.837	"Use-after-free vulnerability in Microsoft Common Controls in Microsoft Windows Vista SP2, Windows Server 2008 SP2 and R2 SP1, Windows 7 SP1, Windows 8, Windows 8.1, Windows Server 2012 Gold and R2, and Windows RT Gold and 8.1 allows user-assisted remote attackers to execute arbitrary code via a crafted web site that is accessed with the F12 Developer Tools feature of Internet Explorer, aka ""Microsoft Common Control Use After Free Vulnerability."""	9.3	HIGH	AV:N/AC:M/Au:N/C:C/I:C/A:C		
CVE-2015-1757	2015-06-10T01:59:29.483	2025-04-12T10:46:40.837	"Cross-site scripting (XSS) vulnerability in adfs/ls in Active Directory Federation Services (AD FS) in Microsoft Windows Server 2008 SP2 and R2 SP1 and Server 2012 allows remote attackers to inject arbitrary web script or HTML via the wct parameter, aka ""ADFS XSS Elevation of Privilege Vulnerability."""	4.3	MEDIUM	AV:N/AC:M/Au:N/C:N/I:P/A:N		
CVE-2015-1758	2015-06-10T01:59:30.467	2025-04-12T10:46:40.837	"Untrusted search path vulnerability in the LoadLibrary function in the kernel in Microsoft Windows Vista SP2, Windows Server 2008 SP2 and R2 SP1, Windows 7 SP1, Windows 8, Windows Server 2012, and Windows RT allows local users to gain privileges via a Trojan horse DLL in an unspecified directory, aka ""Windows LoadLibrary EoP Vulnerability."""	6.9	MEDIUM	AV:L/AC:M/Au:N/C:C/I:C/A:C		
CVE-2015-1759	2015-06-10T01:59:31.373	2025-04-12T10:46:40.837	"Microsoft Office Compatibility Pack SP3 allows remote attackers to execute arbitrary code via a crafted Office document, aka ""Microsoft Office Memory Corruption Vulnerability."""	9.3	HIGH	AV:N/AC:M/Au:N/C:C/I:C/A:C		
CVE-2015-1760	2015-06-10T01:59:32.263	2025-04-12T10:46:40.837	"Microsoft Office Compatibility Pack SP3, Office 2010 SP2, Office 2013 SP1, and Office 2013 RT SP1 allow remote attackers to execute arbitrary code via a crafted Office document, aka ""Microsoft Office Memory Corruption Vulnerability."""	9.3	HIGH	AV:N/AC:M/Au:N/C:C/I:C/A:C		
CVE-2015-1764	2015-06-10T01:59:33.123	2025-04-12T10:46:40.837	"The web applications in Microsoft Exchange Server 2013 SP1 and Cumulative Update 8 allow remote attackers to bypass the Same Origin Policy and send HTTP traffic to intranet servers via a crafted request, related to a Server-Side Request Forgery (SSRF) issue, aka ""Exchange Server-Side Request Forgery Vulnerability."""	4.3	MEDIUM	AV:N/AC:M/Au:N/C:N/I:P/A:N		
CVE-2015-1765	2015-06-10T01:59:33.920	2025-04-12T10:46:40.837	Microsoft Internet Explorer 9 through 11 allows remote attackers to read the browser history via a crafted web site.	4.3	MEDIUM	AV:N/AC:M/Au:N/C:P/I:N/A:N		
CVE-2015-1766	2015-06-10T01:59:34.780	2025-04-12T10:46:40.837	"Microsoft Internet Explorer 6 through 11 allows remote attackers to execute arbitrary code or cause a denial of service (memory corruption) via a crafted web site, aka ""Internet Explorer Memory Corruption Vulnerability,"" a different vulnerability than CVE-2015-1735, CVE-2015-1740, CVE-2015-1744, and CVE-2015-1745."	9.3	HIGH	AV:N/AC:M/Au:N/C:C/I:C/A:C		
CVE-2015-1768	2015-06-10T01:59:35.563	2025-04-12T10:46:40.837	"win32k.sys in the kernel-mode drivers in Microsoft Windows Server 2003 SP2 and R2 SP2 allows local users to gain privileges or cause a denial of service (memory corruption) via a crafted application, aka ""Win32k Memory Corruption Elevation of Privilege Vulnerability."""	7.2	HIGH	AV:L/AC:L/Au:N/C:C/I:C/A:C		
CVE-2015-1770	2015-06-10T01:59:36.483	2025-04-12T10:46:40.837	"Microsoft Office 2013 SP1 and 2013 RT SP1 allows remote attackers to execute arbitrary code via a crafted Office document, aka ""Microsoft Office Uninitialized Memory Use Vulnerability."""	8.8	HIGH	CVSS:3.1/AV:N/AC:L/PR:N/UI:R/S:U/C:H/I:H/A:H		
CVE-2015-1771	2015-06-10T01:59:37.360	2025-04-12T10:46:40.837	"Cross-site request forgery (CSRF) vulnerability in the web applications in Microsoft Exchange Server 2013 SP1 and Cumulative Update 8 allows remote attackers to hijack the authentication of arbitrary users, aka ""Exchange Cross-Site Request Forgery Vulnerability."""	6.8	MEDIUM	AV:N/AC:M/Au:N/C:P/I:P/A:P		
CVE-2015-2359	2015-06-10T01:59:38.110	2025-04-12T10:46:40.837	"Cross-site scripting (XSS) vulnerability in the web applications in Microsoft Exchange Server 2013 Cumulative Update 8 allows remote attackers to inject arbitrary web script or HTML via unspecified vectors, aka ""Exchange HTML Injection Vulnerability."""	4.3	MEDIUM	AV:N/AC:M/Au:N/C:N/I:P/A:N		
CVE-2015-2360	2015-06-10T01:59:38.890	2025-04-12T10:46:40.837	"win32k.sys in the kernel-mode drivers in Microsoft Windows Server 2003 SP2 and R2 SP2, Windows Vista SP2, Windows Server 2008 SP2 and R2 SP1, Windows 7 SP1, Windows 8, Windows 8.1, Windows Server 2012 Gold and R2, and Windows RT Gold and 8.1 allows local users to gain privileges or cause a denial of service (memory corruption) via a crafted application, aka ""Win32k Elevation of Privilege Vulnerability."""	8.8	HIGH	CVSS:3.1/AV:N/AC:L/PR:L/UI:N/S:U/C:H/I:H/A:H		
CVE-2015-3096	2015-06-10T01:59:39.720	2025-04-12T10:46:40.837	Adobe Flash Player before 13.0.0.292 and 14.x through 18.x before 18.0.0.160 on Windows and OS X and before 11.2.202.466 on Linux, Adobe AIR before 18.0.0.144 on Windows and before 18.0.0.143 on OS X and Android, Adobe AIR SDK before 18.0.0.144 on Windows and before 18.0.0.143 on OS X, and Adobe AIR SDK & Compiler before 18.0.0.144 on Windows and before 18.0.0.143 on OS X allow remote attackers to bypass a CVE-2014-5333 protection mechanism via unspecified vectors.	6.8	MEDIUM	AV:N/AC:M/Au:N/C:P/I:P/A:P		
CVE-2015-3097	2015-06-10T01:59:40.703	2025-04-12T10:46:40.837	Adobe Flash Player before 13.0.0.292 and 14.x through 18.x before 18.0.0.160, Adobe AIR before 18.0.0.144, Adobe AIR SDK before 18.0.0.144, and Adobe AIR SDK & Compiler before 18.0.0.144 on 64-bit Windows 7 systems do not properly select a random memory address for the Flash heap, which makes it easier for attackers to conduct unspecified attacks by predicting this address.	5.0	MEDIUM	AV:N/AC:L/Au:N/C:P/I:N/A:N		
CVE-2015-3098	2015-06-10T01:59:41.547	2025-04-12T10:46:40.837	Adobe Flash Player before 13.0.0.292 and 14.x through 18.x before 18.0.0.160 on Windows and OS X and before 11.2.202.466 on Linux, Adobe AIR before 18.0.0.144 on Windows and before 18.0.0.143 on OS X and Android, Adobe AIR SDK before 18.0.0.144 on Windows and before 18.0.0.143 on OS X, and Adobe AIR SDK & Compiler before 18.0.0.144 on Windows and before 18.0.0.143 on OS X allow remote attackers to bypass the Same Origin Policy via unspecified vectors, a different vulnerability than CVE-2015-3099 and CVE-2015-3102.	5.0	MEDIUM	AV:N/AC:L/Au:N/C:P/I:N/A:N		
CVE-2015-3099	2015-06-10T01:59:42.457	2025-04-12T10:46:40.837	Adobe Flash Player before 13.0.0.292 and 14.x through 18.x before 18.0.0.160 on Windows and OS X and before 11.2.202.466 on Linux, Adobe AIR before 18.0.0.144 on Windows and before 18.0.0.143 on OS X and Android, Adobe AIR SDK before 18.0.0.144 on Windows and before 18.0.0.143 on OS X, and Adobe AIR SDK & Compiler before 18.0.0.144 on Windows and before 18.0.0.143 on OS X allow remote attackers to bypass the Same Origin Policy via unspecified vectors, a different vulnerability than CVE-2015-3098 and CVE-2015-3102.	5.0	MEDIUM	AV:N/AC:L/Au:N/C:P/I:N/A:N		
CVE-2015-3100	2015-06-10T01:59:43.237	2025-04-12T10:46:40.837	Stack-based buffer overflow in Adobe Flash Player before 13.0.0.292 and 14.x through 18.x before 18.0.0.160 on Windows and OS X and before 11.2.202.466 on Linux, Adobe AIR before 18.0.0.144 on Windows and before 18.0.0.143 on OS X and Android, Adobe AIR SDK before 18.0.0.144 on Windows and before 18.0.0.143 on OS X, and Adobe AIR SDK & Compiler before 18.0.0.144 on Windows and before 18.0.0.143 on OS X allows attackers to execute arbitrary code via unspecified vectors.	10.0	HIGH	AV:N/AC:L/Au:N/C:C/I:C/A:C		
CVE-2015-3101	2015-06-10T01:59:43.987	2025-04-12T10:46:40.837	The Flash broker in Adobe Flash Player before 13.0.0.292 and 14.x through 18.x before 18.0.0.160 on Windows and OS X and before 11.2.202.466 on Linux, Adobe AIR before 18.0.0.144 on Windows and before 18.0.0.143 on OS X and Android, Adobe AIR SDK before 18.0.0.144 on Windows and before 18.0.0.143 on OS X, and Adobe AIR SDK & Compiler before 18.0.0.144 on Windows and before 18.0.0.143 on OS X, when Internet Explorer is used, allows attackers to perform a transition from Low Integrity to Medium Integrity via unspecified vectors.	4.3	MEDIUM	AV:N/AC:M/Au:N/C:N/I:P/A:N		
CVE-2015-3102	2015-06-10T01:59:44.737	2025-04-12T10:46:40.837	Adobe Flash Player before 13.0.0.292 and 14.x through 18.x before 18.0.0.160 on Windows and OS X and before 11.2.202.466 on Linux, Adobe AIR before 18.0.0.144 on Windows and before 18.0.0.143 on OS X and Android, Adobe AIR SDK before 18.0.0.144 on Windows and before 18.0.0.143 on OS X, and Adobe AIR SDK & Compiler before 18.0.0.144 on Windows and before 18.0.0.143 on OS X allow remote attackers to bypass the Same Origin Policy via unspecified vectors, a different vulnerability than CVE-2015-3098 and CVE-2015-3099.	5.0	MEDIUM	AV:N/AC:L/Au:N/C:P/I:N/A:N		
CVE-2015-3103	2015-06-10T01:59:45.550	2025-04-12T10:46:40.837	Use-after-free vulnerability in Adobe Flash Player before 13.0.0.292 and 14.x through 18.x before 18.0.0.160 on Windows and OS X and before 11.2.202.466 on Linux, Adobe AIR before 18.0.0.144 on Windows and before 18.0.0.143 on OS X and Android, Adobe AIR SDK before 18.0.0.144 on Windows and before 18.0.0.143 on OS X, and Adobe AIR SDK & Compiler before 18.0.0.144 on Windows and before 18.0.0.143 on OS X allows attackers to execute arbitrary code via unspecified vectors, a different vulnerability than CVE-2015-3106 and CVE-2015-3107.	10.0	HIGH	AV:N/AC:L/Au:N/C:C/I:C/A:C		
CVE-2015-3104	2015-06-10T01:59:46.317	2025-04-12T10:46:40.837	Integer overflow in Adobe Flash Player before 13.0.0.292 and 14.x through 18.x before 18.0.0.160 on Windows and OS X and before 11.2.202.466 on Linux, Adobe AIR before 18.0.0.144 on Windows and before 18.0.0.143 on OS X and Android, Adobe AIR SDK before 18.0.0.144 on Windows and before 18.0.0.143 on OS X, and Adobe AIR SDK & Compiler before 18.0.0.144 on Windows and before 18.0.0.143 on OS X allows attackers to execute arbitrary code via unspecified vectors.	10.0	HIGH	AV:N/AC:L/Au:N/C:C/I:C/A:C		
CVE-2015-3105	2015-06-10T01:59:47.097	2025-04-12T10:46:40.837	Adobe Flash Player before 13.0.0.292 and 14.x through 18.x before 18.0.0.160 on Windows and OS X and before 11.2.202.466 on Linux, Adobe AIR before 18.0.0.144 on Windows and before 18.0.0.143 on OS X and Android, Adobe AIR SDK before 18.0.0.144 on Windows and before 18.0.0.143 on OS X, and Adobe AIR SDK & Compiler before 18.0.0.144 on Windows and before 18.0.0.143 on OS X allow attackers to execute arbitrary code or cause a denial of service (memory corruption) via unspecified vectors.	10.0	HIGH	AV:N/AC:L/Au:N/C:C/I:C/A:C		
CVE-2015-3106	2015-06-10T01:59:47.863	2025-04-12T10:46:40.837	Use-after-free vulnerability in Adobe Flash Player before 13.0.0.292 and 14.x through 18.x before 18.0.0.160 on Windows and OS X and before 11.2.202.466 on Linux, Adobe AIR before 18.0.0.144 on Windows and before 18.0.0.143 on OS X and Android, Adobe AIR SDK before 18.0.0.144 on Windows and before 18.0.0.143 on OS X, and Adobe AIR SDK & Compiler before 18.0.0.144 on Windows and before 18.0.0.143 on OS X allows attackers to execute arbitrary code via unspecified vectors, a different vulnerability than CVE-2015-3103 and CVE-2015-3107.	10.0	HIGH	AV:N/AC:L/Au:N/C:C/I:C/A:C		
CVE-2015-3107	2015-06-10T01:59:48.630	2025-04-12T10:46:40.837	Use-after-free vulnerability in Adobe Flash Player before 13.0.0.292 and 14.x through 18.x before 18.0.0.160 on Windows and OS X and before 11.2.202.466 on Linux, Adobe AIR before 18.0.0.144 on Windows and before 18.0.0.143 on OS X and Android, Adobe AIR SDK before 18.0.0.144 on Windows and before 18.0.0.143 on OS X, and Adobe AIR SDK & Compiler before 18.0.0.144 on Windows and before 18.0.0.143 on OS X allows attackers to execute arbitrary code via unspecified vectors, a different vulnerability than CVE-2015-3103 and CVE-2015-3106.	10.0	HIGH	AV:N/AC:L/Au:N/C:C/I:C/A:C		
CVE-2015-3108	2015-06-10T01:59:49.503	2025-04-12T10:46:40.837	Adobe Flash Player before 13.0.0.292 and 14.x through 18.x before 18.0.0.160 on Windows and OS X and before 11.2.202.466 on Linux, Adobe AIR before 18.0.0.144 on Windows and before 18.0.0.143 on OS X and Android, Adobe AIR SDK before 18.0.0.144 on Windows and before 18.0.0.143 on OS X, and Adobe AIR SDK & Compiler before 18.0.0.144 on Windows and before 18.0.0.143 on OS X do not properly restrict discovery of memory addresses, which allows attackers to bypass the ASLR protection mechanism via unspecified vectors.	5.0	MEDIUM	AV:N/AC:L/Au:N/C:P/I:N/A:N		
CVE-2015-3935	2015-06-10T14:59:00.090	2025-04-12T10:46:40.837	Multiple cross-site scripting (XSS) vulnerabilities in Dolibarr ERP/CRM 3.5 and 3.6 allow remote attackers to inject arbitrary web script or HTML via the Business Search (search_nom) field to (1) htdocs/societe/societe.php or (2) htdocs/societe/admin/societe.php.	4.3	MEDIUM	AV:N/AC:M/Au:N/C:N/I:P/A:N		
CVE-2015-4415	2015-06-10T14:59:01.390	2025-04-12T10:46:40.837	Multiple directory traversal vulnerabilities in func.php in Magnifica Webscripts Anima Gallery 2.6 allow remote attackers to include and execute arbitrary local files via a .. (dot dot) in the (1) theme or (2) lang cookie parameter to AnimaGallery/.	5.0	MEDIUM	AV:N/AC:L/Au:N/C:P/I:N/A:N		
CVE-2014-8603	2015-06-10T18:59:00.067	2025-04-12T10:46:40.837	cloner.functions.php in the XCloner plugin 3.1.1 for WordPress and 3.5.1 for Joomla! allows remote administrators to execute arbitrary code via shell metacharacters in the (1) file name when creating a backup or vectors related to the (2) $_CONFIG[tarpath], (3) $exclude, (4) $_CONFIG['tarcompress'], (5) $_CONFIG['filename'], (6) $_CONFIG['exfile_tar'], (7) $_CONFIG[sqldump], (8) $_CONFIG['mysql_host'], (9) $_CONFIG['mysql_pass'], (10) $_CONFIG['mysql_user'], (11) $database_name, or (12) $sqlfile variable.	6.5	MEDIUM	AV:N/AC:L/Au:S/C:P/I:P/A:P		
CVE-2014-8604	2015-06-10T18:59:01.270	2025-04-12T10:46:40.837	The XCloner plugin 3.1.1 for WordPress and 3.5.1 for Joomla! returns the MySQL password in cleartext to a text box in the configuration panel, which allows remote attackers to obtain sensitive information via unspecified vectors.	5.0	MEDIUM	AV:N/AC:L/Au:N/C:P/I:N/A:N		
CVE-2014-8605	2015-06-10T18:59:02.597	2025-04-12T10:46:40.837	The XCloner plugin 3.1.1 for WordPress and 3.5.1 for Joomla! stores database backup files with predictable names under the web root with insufficient access control, which allows remote attackers to obtain sensitive information via a direct request to a backup file in administrators/backups/.	5.0	MEDIUM	AV:N/AC:L/Au:N/C:P/I:N/A:N		
CVE-2014-8606	2015-06-10T18:59:03.660	2025-04-12T10:46:40.837	Directory traversal vulnerability in the XCloner plugin 3.1.1 for WordPress and 3.5.1 for Joomla! allows remote administrators to read arbitrary files via a .. (dot dot) in the file parameter in a json_return action in the xcloner_show page to wp-admin/admin-ajax.php.	4.0	MEDIUM	AV:N/AC:L/Au:S/C:P/I:N/A:N		
CVE-2014-8607	2015-06-10T18:59:04.753	2025-04-12T10:46:40.837	The XCloner plugin 3.1.1 for WordPress and 3.5.1 for Joomla! provides the MySQL username and password on the command line, which allows local users to obtain sensitive information via the ps command.	2.1	LOW	AV:L/AC:L/Au:N/C:P/I:N/A:N		
CVE-2015-3923	2015-06-10T18:59:05.770	2025-04-12T10:46:40.837	Coppermine Photo Gallery before 1.5.36 allows remote attackers to enumerate directories via a full path in the folder parameter to minibrowser.php.	5.0	MEDIUM	AV:N/AC:L/Au:N/C:P/I:N/A:N		
CVE-2015-4108	2015-06-10T18:59:06.927	2025-04-12T10:46:40.837	Multiple cross-site request forgery (CSRF) vulnerabilities in Wing FTP Server before 4.4.7 allow remote attackers to hijack the authentication of administrators for requests that (1) execute arbitrary code via a crafted request to admin_lua_script.html or (2) add a domain administrator via a crafted request to admin_addadmin.html.	6.8	MEDIUM	AV:N/AC:M/Au:N/C:P/I:P/A:P		
CVE-2015-4153	2015-06-10T18:59:07.927	2025-04-12T10:46:40.837	Directory traversal vulnerability in the zM Ajax Login & Register plugin before 1.1.0 for WordPress allows remote attackers to include and execute arbitrary php files via a relative path in the template parameter in a load_template action to wp-admin/admin-ajax.php.	5.0	MEDIUM	AV:N/AC:L/Au:N/C:P/I:N/A:N		
CVE-2015-4171	2015-06-10T18:59:09.097	2025-04-12T10:46:40.837	strongSwan 4.3.0 through 5.x before 5.3.2 and strongSwan VPN Client before 1.4.6, when using EAP or pre-shared keys for authenticating an IKEv2 connection, does not enforce server authentication restrictions until the entire authentication process is complete, which allows remote servers to obtain credentials by using a valid certificate and then reading the responses.	2.6	LOW	AV:N/AC:H/Au:N/C:P/I:N/A:N		
CVE-2015-4465	2015-06-10T18:59:10.487	2025-04-12T10:46:40.837	Cross-site scripting (XSS) vulnerability in the zM Ajax Login & Register plugin before 1.1.0 for WordPress allows remote attackers to inject arbitrary web script or HTML via unspecified vectors.	4.3	MEDIUM	AV:N/AC:M/Au:N/C:N/I:P/A:N		
