CVE ID	Published Date	Last Modified Date	Description	Base Score	Base Severity	Vector String	Vendor	Product
CVE-2015-4336	2015-06-17T18:59:04.737	2025-04-12T10:46:40.837	cloner.functions.php in the XCloner plugin 3.1.2 for WordPress allows remote authenticated users to execute arbitrary commands via a file containing filenames with shell metacharacters, as demonstrated by using the backup comments feature to create the file.	6.5	MEDIUM	AV:N/AC:L/Au:S/C:P/I:P/A:P		
CVE-2015-4337	2015-06-17T18:59:05.673	2025-04-12T10:46:40.837	Cross-site scripting (XSS) vulnerability in the XCloner plugin 3.1.2 for WordPress allows remote authenticated users to inject arbitrary web script or HTML via the excl_manual parameter in the xcloner_show page to wpadmin/plugins.php.	3.5	LOW	AV:N/AC:M/Au:S/C:N/I:P/A:N		
CVE-2015-4338	2015-06-17T18:59:06.643	2025-04-12T10:46:40.837	Static code injection vulnerability in the XCloner plugin 3.1.2 for WordPress allows remote authenticated users to inject arbitrary PHP code into the language files via a Translation LM_FRONT_* field for a language, as demonstrated by language/italian.php.	6.5	MEDIUM	AV:N/AC:L/Au:S/C:P/I:P/A:P		
CVE-2015-4342	2015-06-17T18:59:07.407	2025-04-12T10:46:40.837	SQL injection vulnerability in Cacti before 0.8.8d allows remote attackers to execute arbitrary SQL commands via unspecified vectors involving a cdef id.	7.5	HIGH	AV:N/AC:L/Au:N/C:P/I:P/A:P		
CVE-2015-4414	2015-06-17T18:59:08.407	2025-04-12T10:46:40.837	Directory traversal vulnerability in download_audio.php in the SE HTML5 Album Audio Player (se-html5-album-audio-player) plugin 1.1.0 and earlier for WordPress allows remote attackers to read arbitrary files via a .. (dot dot) in the file parameter.	5.0	MEDIUM	AV:N/AC:L/Au:N/C:P/I:N/A:N		
CVE-2015-4454	2015-06-17T18:59:09.517	2025-04-12T10:46:40.837	SQL injection vulnerability in the get_hash_graph_template function in lib/functions.php in Cacti before 0.8.8d allows remote attackers to execute arbitrary SQL commands via the graph_template_id parameter to graph_templates.php.	7.5	HIGH	AV:N/AC:L/Au:N/C:P/I:P/A:P		
CVE-2015-2861	2015-06-18T10:59:00.077	2025-04-12T10:46:40.837	Cross-site request forgery (CSRF) vulnerability in Vesta Control Panel before 0.9.8-14 allows remote attackers to hijack the authentication of arbitrary users.	6.8	MEDIUM	AV:N/AC:M/Au:N/C:P/I:P/A:P		
CVE-2015-4628	2015-06-18T10:59:01.327	2025-04-12T10:46:40.837	SQL injection vulnerability in application/controllers/admin/questiongroups.php in LimeSurvey before 2.06+ Build 150618 allows remote authenticated administrators to execute arbitrary SQL commands via the sid parameter.	6.5	MEDIUM	AV:N/AC:L/Au:S/C:P/I:P/A:P		
CVE-2015-3422	2015-06-18T18:59:00.100	2025-04-12T10:46:40.837	Cross-site scripting (XSS) vulnerability in SearchBlox before 8.2.1 allows remote attackers to inject arbitrary web script or HTML via the menu2 parameter to admin/main.jsp.	4.3	MEDIUM	AV:N/AC:M/Au:N/C:N/I:P/A:N		
CVE-2015-3897	2015-06-18T18:59:01.303	2025-04-12T10:46:40.837	Directory traversal vulnerability in Bonita BPM Portal before 6.5.3 allows remote attackers to read arbitrary files via a .. (dot dot) in the theme parameter and a file path in the location parameter to bonita/portal/themeResource.	5.0	MEDIUM	AV:N/AC:L/Au:N/C:P/I:N/A:N		
CVE-2015-4139	2015-06-18T18:59:02.193	2025-04-12T10:46:40.837	Cross-site scripting (XSS) vulnerability in smilies4wp.php in the WP Smiley plugin 1.4.1 for WordPress allows remote authenticated users to inject arbitrary web script or HTML via the s4w-more parameter to wp-admin/options-general.php.	3.5	LOW	AV:N/AC:M/Au:S/C:N/I:P/A:N		
CVE-2015-4140	2015-06-18T18:59:03.147	2025-04-12T10:46:40.837	Cross-site request forgery (CSRF) vulnerability in the WP Smiley plugin 1.4.1 for WordPress allows remote attackers to hijack the authentication of editors for requests that conduct cross-site scripting (XSS) attacks via the s4w-more parameter to the smilies4wp.php page to wp-admin/options-general.php.	6.8	MEDIUM	AV:N/AC:M/Au:N/C:P/I:P/A:P		
CVE-2015-4420	2015-06-18T18:59:04.147	2025-04-12T10:46:40.837	Multiple cross-site scripting (XSS) vulnerabilities in Opsview 4.6.2 and earlier allow remote attackers to inject arbitrary web script or HTML via a (1) crafted check plugin, the (2) description in a host profile, or the (3) plugin_args parameter to a Test service check page.	4.3	MEDIUM	AV:N/AC:M/Au:N/C:N/I:P/A:N		
CVE-2015-4587	2015-06-18T18:59:05.130	2025-04-12T10:46:40.837	"Cross-site scripting (XSS) vulnerability in the Alcatel-Lucent CellPipe 7130 router with firmware 1.0.0.20h.HOL allows remote attackers to inject arbitrary web script or HTML via the ""Custom application"" field in the ""port triggering"" menu."	4.3	MEDIUM	AV:N/AC:M/Au:N/C:N/I:P/A:N		
CVE-2015-4654	2015-06-18T18:59:06.037	2025-04-12T10:46:40.837	SQL injection vulnerability in the EQ Event Calendar component for Joomla! allows remote attackers to execute arbitrary SQL commands via the id parameter to eqfullevent.	7.5	HIGH	AV:N/AC:L/Au:N/C:P/I:P/A:P		
CVE-2015-4655	2015-06-18T18:59:06.910	2025-04-12T10:46:40.837	"Cross-site scripting (XSS) vulnerability in Synology DiskStation Manager (DSM) before 5.2-5565 Update 1 allows remote attackers to inject arbitrary web script or HTML via the ""compound"" parameter to entry.cgi."	4.3	MEDIUM	AV:N/AC:M/Au:N/C:N/I:P/A:N		
CVE-2015-4656	2015-06-18T18:59:09.007	2025-04-12T10:46:40.837	Multiple cross-site scripting (XSS) vulnerabilities in Synology Photo Station before 6.3-2945 allow remote attackers to inject arbitrary web script or HTML via the (1) success parameter to login.php or (2) crafted URL parameters to index.php, as demonstrated by the t parameter to photo/.	4.3	MEDIUM	AV:N/AC:M/Au:N/C:N/I:P/A:N		
CVE-2015-4657	2015-06-18T18:59:09.910	2025-04-12T10:46:40.837	Cross-site scripting (XSS) vulnerability in Mailbird 2.0.16.0 and earlier allows remote attackers to inject arbitrary web script or HTML via an e-mail message body with a crafted URL.	4.3	MEDIUM	AV:N/AC:M/Au:N/C:N/I:P/A:N		
CVE-2015-4658	2015-06-18T18:59:10.677	2025-04-12T10:46:40.837	Multiple SQL injection vulnerabilities in admin/login.php in Milw0rm Clone Script 1.0 allow remote attackers to execute arbitrary SQL commands via the (1) usr or (2) pwd parameter.	7.5	HIGH	AV:N/AC:L/Au:N/C:P/I:P/A:P		
CVE-2015-4659	2015-06-18T18:59:11.520	2025-04-12T10:46:40.837	Cross-site request forgery (CSRF) vulnerability in ClickHeat 1.14 and earlier allows remote attackers to hijack the authentication of administrators for requests that change the administrator password via a config action to index.php.	6.8	MEDIUM	AV:N/AC:M/Au:N/C:P/I:P/A:P		
CVE-2015-4660	2015-06-18T18:59:12.443	2025-04-12T10:46:40.837	Cross-site scripting (XSS) vulnerability in Enhanced SQL Portal 5.0.7961 allows remote attackers to inject arbitrary web script or HTML via the id parameter to iframe.php.	4.3	MEDIUM	AV:N/AC:M/Au:N/C:N/I:P/A:N		
CVE-2015-4661	2015-06-18T18:59:13.583	2025-04-12T10:46:40.837	Cross-site scripting (XSS) vulnerability in Symphony CMS 2.6.2 allows remote attackers to inject arbitrary web script or HTML via the sort parameter to system/authors.	4.3	MEDIUM	AV:N/AC:M/Au:N/C:N/I:P/A:N		
CVE-2015-4191	2015-06-19T01:59:00.070	2025-04-12T10:46:40.837	Cisco IOS XR 5.2.1 allows remote attackers to cause a denial of service (ipv6_io service reload) via a malformed IPv6 packet, aka Bug ID CSCuq95565.	5.0	MEDIUM	AV:N/AC:L/Au:N/C:N/I:N/A:P		
CVE-2015-4194	2015-06-19T01:59:01.023	2025-04-12T10:46:40.837	The web-based administrative interface in Cisco WebEx Meeting Center provides different error messages for failed login attempts depending on whether the username exists or corresponds to a privileged account, which allows remote attackers to enumerate account names and obtain sensitive information via a series of requests, aka Bug ID CSCuf28861.	5.0	MEDIUM	AV:N/AC:L/Au:N/C:P/I:N/A:N		
CVE-2015-4195	2015-06-19T01:59:01.930	2025-04-12T10:46:40.837	Cisco IOS XR 5.1.1.K9SEC allows remote authenticated users to cause a denial of service (vty error, and SSH and TELNET outage) via a crafted disconnect action within an SSH session, aka Bug ID CSCul63127.	4.0	MEDIUM	AV:N/AC:L/Au:S/C:N/I:N/A:P		
CVE-2015-2797	2015-06-19T14:59:00.067	2025-04-12T10:46:40.837	Stack-based buffer overflow in AirTies Air 6372, 5760, 5750, 5650TT, 5453, 5444TT, 5443, 5442, 5343, 5342, 5341, and 5021 DSL modems with firmware 1.0.2.0 and earlier allows remote attackers to execute arbitrary code via a long string in the redirect parameter to cgi-bin/login.	10.0	HIGH	AV:N/AC:L/Au:N/C:C/I:C/A:C		
CVE-2015-2865	2015-06-19T14:59:01.287	2023-11-07T02:25:26.910	Rejected reason: DO NOT USE THIS CANDIDATE NUMBER.  ConsultIDs: CVE-2015-4640, CVE-2015-4641.  Reason: this ID was intended for one issue, but was associated with two issues.  Notes: All CVE users should consult CVE-2015-4640 and CVE-2015-4641 to identify the ID or IDs of interest. All references and descriptions in this candidate have been removed to prevent accidental usage					
CVE-2015-4640	2015-06-19T14:59:01.347	2025-04-12T10:46:40.837	The SwiftKey language-pack update implementation on Samsung Galaxy S4, S4 Mini, S5, and S6 devices relies on an HTTP connection to the skslm.swiftkey.net server, which allows man-in-the-middle attackers to write to language-pack files by modifying an HTTP response.  NOTE: CVE-2015-4640 exploitation can be combined with CVE-2015-4641 exploitation for man-in-the-middle code execution.	2.9	LOW	AV:A/AC:M/Au:N/C:N/I:P/A:N		
CVE-2015-4641	2015-06-19T14:59:02.630	2025-04-12T10:46:40.837	Directory traversal vulnerability in the SwiftKey language-pack update implementation on Samsung Galaxy S4, S4 Mini, S5, and S6 devices allows remote web servers to write to arbitrary files, and consequently execute arbitrary code in a privileged context, by leveraging control of the skslm.swiftkey.net domain name and providing a .. (dot dot) in an entry in a ZIP archive, as demonstrated by a traversal to the /data/dalvik-cache directory.	6.4	MEDIUM	AV:N/AC:L/Au:N/C:N/I:P/A:P		
CVE-2015-4675	2015-06-19T14:59:03.487	2025-04-12T10:46:40.837	Buffer overflow in the Tiny SRP library (aka TinySRP) allows remote attackers to cause a denial of service (crash) or possibly execute arbitrary code via a crafted size value for the username field.	7.5	HIGH	AV:N/AC:L/Au:N/C:P/I:P/A:P		
CVE-2015-4676	2015-06-19T14:59:04.380	2025-04-12T10:46:40.837	SQL injection vulnerability in ticket.php in TickFa 1.x allows remote authenticated users to execute arbitrary SQL commands via the tid parameter in a read action.	6.5	MEDIUM	AV:N/AC:L/Au:S/C:P/I:P/A:P		
CVE-2015-4677	2015-06-19T14:59:05.223	2025-04-12T10:46:40.837	Cross-site request forgery (CSRF) vulnerability in FiverrScript (aka Fiverr Script) 7.2 allows remote attackers to hijack the authentication of administrators for requests that create a new admin via a request to administrator/admins_create.php.	6.8	MEDIUM	AV:N/AC:M/Au:N/C:P/I:P/A:P		
CVE-2015-4678	2015-06-19T14:59:06.097	2025-04-12T10:46:40.837	SQL injection vulnerability in Persian Car CMS 1.0 allows remote attackers to execute arbitrary SQL commands via the cat_id parameter to the default URI.	7.5	HIGH	AV:N/AC:L/Au:N/C:P/I:P/A:P		
CVE-2015-4679	2015-06-19T14:59:06.973	2025-04-12T10:46:40.837	Multiple cross-site scripting (XSS) vulnerabilities in the web interface in Airties RT-210 allow remote attackers to inject arbitrary web script or HTML via the (1) ddns_domainame or (2) ddns_account parameter to ddns.stm.	4.3	MEDIUM	AV:N/AC:M/Au:N/C:N/I:P/A:N		
CVE-2015-4201	2015-06-20T10:59:00.077	2025-04-12T10:46:40.837	The Gateway General Packet Radio Service Support Node (GGSN) component on Cisco ASR 5000 devices with software 17.2.0.59184 and 18.0.L0.59219 allows remote attackers to cause a denial of service (Session Manager restart) via an invalid TCP/IP header, aka Bug ID CSCut68058.	5.0	MEDIUM	AV:N/AC:L/Au:N/C:N/I:N/A:P		
CVE-2015-2723	2015-06-20T14:59:00.073	2023-11-07T02:25:25.303	Rejected reason: DO NOT USE THIS CANDIDATE NUMBER.  ConsultIDs: CVE-2015-4000.  Reason: This candidate is a duplicate of CVE-2015-4000.  Notes: All CVE users should reference CVE-2015-4000 instead of this candidate.  All references and descriptions in this candidate have been removed to prevent accidental usage					
CVE-2015-4197	2015-06-20T14:59:00.087	2025-04-12T10:46:40.837	Cisco NX-OS 5.2(5) on Nexus 7000 devices allows remote attackers to cause a denial of service (device crash) by sending a malformed LLDP packet on the local network, aka Bug ID CSCud89415.	6.1	MEDIUM	AV:A/AC:L/Au:N/C:N/I:N/A:C		
CVE-2015-4198	2015-06-20T14:59:01.027	2025-04-12T10:46:40.837	Cross-site scripting (XSS) vulnerability in the web framework on Cisco Web Security Appliance (WSA) devices with software 8.5.0-497 allows remote attackers to inject arbitrary web script or HTML via an unspecified HTTP header, aka Bug ID CSCuu24409.	4.3	MEDIUM	AV:N/AC:M/Au:N/C:N/I:P/A:N		
CVE-2015-4202	2015-06-20T14:59:01.947	2025-04-12T10:46:40.837	Cisco IOS 12.2SCH on uBR10000 router Cable Modem Termination Systems (CMTS) does not properly restrict access to the IP Detail Record (IPDR) service, which allows remote attackers to obtain potentially sensitive MAC address and network-utilization information via crafted IPDR packets, aka Bug ID CSCua39203.	5.0	MEDIUM	AV:N/AC:L/Au:N/C:P/I:N/A:N		
CVE-2015-0526	2015-06-22T15:59:00.070	2025-04-12T10:46:40.837	Multiple cross-site scripting (XSS) vulnerabilities in EMC RSA Validation Manager (RVM) 3.2 before build 201 allow remote attackers to inject arbitrary web script or HTML via the (1) displayMode or (2) wrapPreDisplayMode parameter.	4.3	MEDIUM	AV:N/AC:M/Au:N/C:N/I:P/A:N		
CVE-2015-4590	2015-06-22T18:59:00.073	2025-04-12T10:46:40.837	"The extractFrom function in Internals/QuotedString.cpp in Arduino JSON before 4.5 allows remote attackers to cause a denial of service (crash) via a JSON string with a \ (backslash) followed by a terminator, as demonstrated by ""\\\0"", which triggers a buffer overflow and over-read."	5.0	MEDIUM	AV:N/AC:L/Au:N/C:N/I:N/A:P		
CVE-2015-4713	2015-06-22T18:59:01.167	2025-04-12T10:46:40.837	SQL injection vulnerability in ApPHP Hotel Site 3.x.x allows remote editors to execute arbitrary SQL commands via the pid parameter to index.php.	6.5	MEDIUM	AV:N/AC:L/Au:S/C:P/I:P/A:P		
CVE-2015-4714	2015-06-22T18:59:02.120	2025-04-12T10:46:40.837	Cross-site scripting (XSS) vulnerability in the DreamBox DM500-S allows remote attackers to inject arbitrary web script or HTML via the mode parameter to /body.	4.3	MEDIUM	AV:N/AC:M/Au:N/C:N/I:P/A:N		
CVE-2015-3231	2015-06-22T19:59:00.077	2025-04-12T10:46:40.837	The Render cache system in Drupal 7.x before 7.38, when used to cache content by user role, allows remote authenticated users to obtain private content viewed by user 1 by reading the cache.	4.0	MEDIUM	AV:N/AC:L/Au:S/C:P/I:N/A:N		
CVE-2015-3232	2015-06-22T19:59:00.997	2025-04-12T10:46:40.837	Open redirect vulnerability in the Field UI module in Drupal 7.x before 7.38 allows remote attackers to redirect users to arbitrary web sites and conduct phishing attacks via a URL in the destinations parameter.	5.8	MEDIUM	AV:N/AC:M/Au:N/C:P/I:P/A:N		
CVE-2015-3233	2015-06-22T19:59:01.827	2025-04-12T10:46:40.837	Open redirect vulnerability in the Overlay module in Drupal 7.x before 7.38 allows remote attackers to redirect users to arbitrary web sites and conduct phishing attacks via unspecified vectors.	5.8	MEDIUM	AV:N/AC:M/Au:N/C:P/I:P/A:N		
CVE-2015-3234	2015-06-22T19:59:02.810	2025-04-12T10:46:40.837	The OpenID module in Drupal 6.x before 6.36 and 7.x before 7.38 allows remote attackers to log into other users' accounts by leveraging an OpenID identity from certain providers, as demonstrated by the Verisign, LiveJournal, and StackExchange providers.	4.3	MEDIUM	AV:N/AC:M/Au:N/C:N/I:P/A:N		
CVE-2015-3236	2015-06-22T19:59:03.683	2025-04-12T10:46:40.837	cURL and libcurl 7.40.0 through 7.42.1 send the HTTP Basic authentication credentials for a previous connection when reusing a reset (curl_easy_reset) connection handle to send a request to the same host name, which allows remote attackers to obtain sensitive information via unspecified vectors.	5.0	MEDIUM	AV:N/AC:L/Au:N/C:P/I:N/A:N		
CVE-2015-3237	2015-06-22T19:59:04.653	2025-04-12T10:46:40.837	The smb_request_state function in cURL and libcurl 7.40.0 through 7.42.1 allows remote SMB servers to obtain sensitive information from memory or cause a denial of service (out-of-bounds read and crash) via crafted length and offset values.	6.4	MEDIUM	AV:N/AC:L/Au:N/C:P/I:N/A:P		
CVE-2015-4200	2015-06-23T12:59:00.100	2025-04-12T10:46:40.837	Memory leak in the IPv6-to-IPv4 functionality in Cisco IOS 15.3S in the Performance Routing Engine (PRE) module on UBR devices allows remote attackers to cause a denial of service (memory consumption) by triggering an error during CPE negotiation, aka Bug ID CSCug00885.	7.8	HIGH	AV:N/AC:L/Au:N/C:N/I:N/A:C		
CVE-2015-4204	2015-06-23T12:59:01.367	2025-04-12T10:46:40.837	Memory leak in Cisco IOS 12.2 in the Performance Routing Engine (PRE) module on uBR10000 devices allows remote authenticated users to cause a denial of service (memory consumption or PXF process crash) by sending docsIfMCmtsMib SNMP requests quickly, aka Bug ID CSCue65051.	6.8	MEDIUM	AV:N/AC:L/Au:S/C:N/I:N/A:C		
CVE-2015-4189	2015-06-23T14:59:00.087	2025-04-12T10:46:40.837	Cross-site request forgery (CSRF) vulnerability in Cisco Data Center Analytics Framework (DCAF) 1.4 allows remote attackers to hijack the authentication of arbitrary users, aka Bug ID CSCun26807.	6.8	MEDIUM	AV:N/AC:M/Au:N/C:P/I:P/A:P		
CVE-2015-4203	2015-06-23T14:59:01.370	2025-04-12T10:46:40.837	Race condition in Cisco IOS 12.2SCH in the Performance Routing Engine (PRE) module on uBR10000 devices, when NetFlow and an MPLS IPv6 VPN are configured, allows remote attackers to cause a denial of service (PXF process crash) by sending malformed MPLS 6VPE packets quickly, aka Bug ID CSCud83396.	5.4	MEDIUM	AV:N/AC:H/Au:N/C:N/I:N/A:C		
CVE-2015-4205	2015-06-23T14:59:02.743	2025-04-12T10:46:40.837	Cisco IOS XR 5.3.1 on ASR 9000 devices allows remote attackers to cause a denial of service (NPU chip reset or line-card reload) by sending crafted IEEE 802.3x flow-control PAUSE frames on the local network, aka Bug ID CSCut19959.	5.7	MEDIUM	AV:A/AC:M/Au:N/C:N/I:N/A:C		
CVE-2015-4207	2015-06-23T14:59:03.633	2025-04-12T10:46:40.837	Cisco WebEx Meeting Center places a meeting's access number in a URL, which allows remote attackers to obtain sensitive information and bypass intended attendance restrictions by visiting a meeting-registration page, aka Bug ID CSCus62147.	5.0	MEDIUM	AV:N/AC:L/Au:N/C:P/I:N/A:N		
CVE-2015-4209	2015-06-23T14:59:04.557	2025-04-12T10:46:40.837	Cisco WebEx Meeting Center does not properly determine authorization for reading a host calendar, which allows remote attackers to obtain sensitive information by obtaining a list of all meetings and then sending a calendar request for each one, aka Bug ID CSCur23913.	6.4	MEDIUM	AV:N/AC:L/Au:N/C:P/I:N/A:P		
CVE-2015-4210	2015-06-23T14:59:05.337	2025-04-12T10:46:40.837	Cross-site scripting (XSS) vulnerability in Cisco WebEx Meeting Center allows remote attackers to inject arbitrary web script or HTML via a crafted URL, aka Bug ID CSCur03806.	4.3	MEDIUM	AV:N/AC:M/Au:N/C:N/I:P/A:N		
CVE-2015-4586	2015-06-23T14:59:06.213	2025-04-12T10:46:40.837	Cross-site request forgery (CSRF) vulnerability in Alcatel-Lucent CellPipe 7130 RG 5Ae.M2013 HOL with firmware 1.0.0.20h.HOL allows remote attackers to hijack the authentication of administrators for requests that create a user account via an add_user action in a request to password.cmd.	6.8	MEDIUM	AV:N/AC:M/Au:N/C:P/I:P/A:P		
CVE-2015-4725	2015-06-23T14:59:07.307	2025-04-12T10:46:40.837	Cross-site scripting (XSS) vulnerability in forgot.php in AudioShare 2.0.2 allows remote attackers to inject arbitrary web script or HTML via the email parameter.	4.3	MEDIUM	AV:N/AC:M/Au:N/C:N/I:P/A:N		
CVE-2015-4726	2015-06-23T14:59:08.180	2025-04-12T10:46:40.837	PHP remote file inclusion vulnerability in ajax/myajaxphp.php in AudioShare 2.0.2 allows remote attackers to execute arbitrary PHP code via a URL in the config['basedir'] parameter.	7.5	HIGH	AV:N/AC:L/Au:N/C:P/I:P/A:P		
CVE-2014-4882	2015-06-23T16:59:00.123	2025-04-12T10:46:40.837	Aptexx Resident Anywhere does not require authentication, which allows remote attackers to obtain sensitive information or modify data via a direct request.	7.5	HIGH	AV:N/AC:L/Au:N/C:P/I:P/A:P		
CVE-2015-0972	2015-06-23T16:59:01.170	2025-04-12T10:46:40.837	Pearson ProctorCache before 2015.1.17 uses the same hardcoded password across different customers' installations, which allows remote attackers to modify test metadata or cause a denial of service (test disruption) by leveraging knowledge of this password.	5.0	MEDIUM	AV:N/AC:L/Au:N/C:P/I:N/A:N		
CVE-2015-2860	2015-06-23T16:59:02.090	2025-04-12T10:46:40.837	Directory traversal vulnerability in Avigilon Control Center (ACC) 4 before 4.12.0.54 and 5 before 5.4.2.22 allows remote attackers to read arbitrary files via a crafted help/ URL.	7.8	HIGH	AV:N/AC:L/Au:N/C:C/I:N/A:N		
CVE-2015-2859	2015-06-23T21:59:00.240	2025-04-12T10:46:40.837	Intel McAfee ePolicy Orchestrator (ePO) 4.x through 4.6.9 and 5.x through 5.1.2 does not validate server names and Certification Authority names in X.509 certificates from SSL servers, which allows man-in-the-middle attackers to spoof servers and obtain sensitive information via a crafted certificate.	5.8	MEDIUM	AV:N/AC:M/Au:N/C:P/I:P/A:N		
CVE-2015-3113	2015-06-23T21:59:01.960	2025-04-12T10:46:40.837	Heap-based buffer overflow in Adobe Flash Player before 13.0.0.296 and 14.x through 18.x before 18.0.0.194 on Windows and OS X and before 11.2.202.468 on Linux allows remote attackers to execute arbitrary code via unspecified vectors, as exploited in the wild in June 2015.	9.8	CRITICAL	CVSS:3.1/AV:N/AC:L/PR:N/UI:N/S:U/C:H/I:H/A:H		
CVE-2014-4875	2015-06-24T10:59:00.120	2025-04-12T10:46:40.837	CreateBossCredentials.jar in Toshiba CHEC before 6.6 build 4014 and 6.7 before build 4329 contains a hardcoded AES key, which allows attackers to discover Back Office System Server (BOSS) DB2 database credentials by leveraging knowledge of this key in conjunction with bossinfo.pro read access.	5.0	MEDIUM	AV:N/AC:L/Au:N/C:P/I:N/A:N		
CVE-2015-2308	2015-06-24T10:59:01.103	2025-04-12T10:46:40.837	"Eval injection vulnerability in the HttpCache class in HttpKernel in Symfony 2.x before 2.3.27, 2.4.x and 2.5.x before 2.5.11, and 2.6.x before 2.6.6 allows remote attackers to execute arbitrary PHP code via a language=""php"" attribute of a SCRIPT element."	6.8	MEDIUM	AV:N/AC:M/Au:N/C:P/I:P/A:P		
CVE-2015-3109	2015-06-24T10:59:02.040	2025-04-12T10:46:40.837	Adobe Photoshop CC before 16.0 (aka 2015.0.0) allows attackers to execute arbitrary code or cause a denial of service (memory corruption) via unspecified vectors.	10.0	HIGH	AV:N/AC:L/Au:N/C:C/I:C/A:C		
CVE-2015-3110	2015-06-24T10:59:03.027	2025-04-12T10:46:40.837	Integer overflow in Adobe Photoshop CC before 16.0 (aka 2015.0.0) and Adobe Bridge CC before 6.11 allows attackers to execute arbitrary code via unspecified vectors.	10.0	HIGH	AV:N/AC:L/Au:N/C:C/I:C/A:C		
CVE-2015-3111	2015-06-24T10:59:04.027	2025-04-12T10:46:40.837	Heap-based buffer overflow in Adobe Photoshop CC before 16.0 (aka 2015.0.0) and Adobe Bridge CC before 6.11 allows attackers to execute arbitrary code via unspecified vectors.	10.0	HIGH	AV:N/AC:L/Au:N/C:C/I:C/A:C		
CVE-2015-3112	2015-06-24T10:59:04.993	2025-04-12T10:46:40.837	Adobe Photoshop CC before 16.0 (aka 2015.0.0) and Adobe Bridge CC before 6.11 allow attackers to execute arbitrary code or cause a denial of service (memory corruption) via unspecified vectors.	10.0	HIGH	AV:N/AC:L/Au:N/C:C/I:C/A:C		
CVE-2015-4208	2015-06-24T10:59:05.930	2025-04-12T10:46:40.837	Cisco WebEx Meeting Center does not properly restrict the content of URLs in GET requests, which allows remote attackers to obtain sensitive information or conduct SQL injection attacks via vectors involving read access to a request, aka Bug ID CSCup88398.	7.5	HIGH	AV:N/AC:L/Au:N/C:P/I:P/A:P		
CVE-2015-4211	2015-06-24T10:59:07.243	2025-04-12T10:46:40.837	Cisco AnyConnect Secure Mobility Client 3.1(60) on Windows does not properly validate pathnames, which allows local users to gain privileges via a crafted INF file, aka Bug ID CSCus65862.	7.2	HIGH	AV:L/AC:L/Au:N/C:C/I:C/A:C		
CVE-2015-4212	2015-06-24T10:59:08.087	2025-04-12T10:46:40.837	Cisco WebEx Meeting Center allows remote attackers to obtain sensitive information via unspecified vectors, as demonstrated by discovering credentials, aka Bug ID CSCut17466.	5.0	MEDIUM	AV:N/AC:L/Au:N/C:P/I:N/A:N		
CVE-2015-4213	2015-06-24T10:59:09.073	2025-04-12T10:46:40.837	Cisco NX-OS 1.1(1g) on Nexus 9000 devices allows remote authenticated users to discover cleartext passwords by leveraging the existence of a decryption mechanism, aka Bug ID CSCuu84391.	4.0	MEDIUM	AV:N/AC:L/Au:S/C:P/I:N/A:N		
CVE-2015-4214	2015-06-24T10:59:09.977	2025-04-12T10:46:40.837	Cisco Unified MeetingPlace 8.6(1.2) and 8.6(1.9) allows remote authenticated users to discover cleartext passwords by reading HTML source code, aka Bug ID CSCuu33050.	4.0	MEDIUM	AV:N/AC:L/Au:S/C:P/I:N/A:N		
CVE-2015-4215	2015-06-24T10:59:10.917	2025-04-12T10:46:40.837	Cisco Wireless LAN Controller (WLC) devices with software 7.5(102.0) and 7.6(1.62) allow remote attackers to cause a denial of service (device crash) by triggering an exception during attempted forwarding of unspecified IPv6 packets to a non-IPv6 device, aka Bug ID CSCuj01046.	6.1	MEDIUM	AV:A/AC:L/Au:N/C:N/I:N/A:C		
