CVE ID	Published Date	Last Modified Date	Description	Base Score	Base Severity	Vector String	Vendor	Product
CVE-2015-0211	2015-06-01T19:59:00.073	2025-04-12T10:46:40.837	mod/lti/ajax.php in Moodle through 2.5.9, 2.6.x before 2.6.7, 2.7.x before 2.7.4, and 2.8.x before 2.8.2 does not consider the moodle/course:manageactivities and mod/lti:addinstance capabilities before proceeding with registered-tool list searches, which allows remote authenticated users to obtain sensitive information via requests to the LTI Ajax service.	4.0	MEDIUM	AV:N/AC:L/Au:S/C:P/I:N/A:N		
CVE-2015-0212	2015-06-01T19:59:01.637	2025-04-12T10:46:40.837	Cross-site scripting (XSS) vulnerability in course/pending.php in Moodle through 2.5.9, 2.6.x before 2.6.7, 2.7.x before 2.7.4, and 2.8.x before 2.8.2 allows remote authenticated users to inject arbitrary web script or HTML via a crafted course summary.	3.5	LOW	AV:N/AC:M/Au:S/C:N/I:P/A:N		
CVE-2015-0213	2015-06-01T19:59:02.837	2025-04-12T10:46:40.837	Multiple cross-site request forgery (CSRF) vulnerabilities in (1) editcategories.html and (2) editcategories.php in the Glossary module in Moodle through 2.5.9, 2.6.x before 2.6.7, 2.7.x before 2.7.4, and 2.8.x before 2.8.2 allow remote attackers to hijack the authentication of unspecified victims.	6.8	MEDIUM	AV:N/AC:M/Au:N/C:P/I:P/A:P		
CVE-2015-0214	2015-06-01T19:59:03.900	2025-04-12T10:46:40.837	message/externallib.php in Moodle through 2.5.9, 2.6.x before 2.6.7, 2.7.x before 2.7.4, and 2.8.x before 2.8.2 allows remote authenticated users to bypass a messaging-disabled setting via a web-services request, as demonstrated by a people-search request.	4.0	MEDIUM	AV:N/AC:L/Au:S/C:N/I:P/A:N		
CVE-2015-0215	2015-06-01T19:59:04.777	2025-04-12T10:46:40.837	calendar/externallib.php in Moodle through 2.5.9, 2.6.x before 2.6.7, 2.7.x before 2.7.4, and 2.8.x before 2.8.2 allows remote authenticated users to obtain sensitive calendar-event information via a web-services request.	4.0	MEDIUM	AV:N/AC:L/Au:S/C:P/I:N/A:N		
CVE-2015-0216	2015-06-01T19:59:05.637	2025-04-12T10:46:40.837	access.php in the Lesson module in Moodle 2.8.x before 2.8.2 does not set the RISK_XSS bit for graders, which allows remote authenticated users to conduct cross-site scripting (XSS) attacks via crafted essay feedback.	3.5	LOW	AV:N/AC:M/Au:S/C:N/I:P/A:N		
CVE-2015-0217	2015-06-01T19:59:06.650	2025-04-12T10:46:40.837	filter/mediaplugin/filter.php in Moodle through 2.5.9, 2.6.x before 2.6.7, 2.7.x before 2.7.4, and 2.8.x before 2.8.2 allows remote authenticated users to cause a denial of service (CPU consumption or partial outage) via a crafted string that is matched against an improper regular expression.	6.8	MEDIUM	AV:N/AC:L/Au:S/C:N/I:N/A:C		
CVE-2015-0218	2015-06-01T19:59:07.480	2025-04-12T10:46:40.837	Cross-site request forgery (CSRF) vulnerability in auth/shibboleth/logout.php in Moodle through 2.5.9, 2.6.x before 2.6.7, 2.7.x before 2.7.4, and 2.8.x before 2.8.2 allows remote attackers to hijack the authentication of arbitrary users for requests that trigger a logout.	6.8	MEDIUM	AV:N/AC:M/Au:N/C:P/I:P/A:P		
CVE-2015-1493	2015-06-01T19:59:08.603	2025-04-12T10:46:40.837	Directory traversal vulnerability in the min_get_slash_argument function in lib/configonlylib.php in Moodle through 2.5.9, 2.6.x before 2.6.8, 2.7.x before 2.7.5, and 2.8.x before 2.8.3 allows remote authenticated users to read arbitrary files via a .. (dot dot) in the file parameter, as demonstrated by reading PHP scripts.	6.8	MEDIUM	AV:N/AC:L/Au:S/C:C/I:N/A:N		
CVE-2015-2266	2015-06-01T19:59:09.463	2025-04-12T10:46:40.837	message/index.php in Moodle through 2.5.9, 2.6.x before 2.6.9, 2.7.x before 2.7.6, and 2.8.x before 2.8.4 does not consider the moodle/site:readallmessages capability before accessing arbitrary conversations, which allows remote authenticated users to obtain sensitive personal-contact and unread-message-count information via a modified URL.	4.0	MEDIUM	AV:N/AC:L/Au:S/C:P/I:N/A:N		
CVE-2015-2267	2015-06-01T19:59:10.417	2025-04-12T10:46:40.837	mdeploy.php in Moodle through 2.5.9, 2.6.x before 2.6.9, 2.7.x before 2.7.6, and 2.8.x before 2.8.4 allows remote authenticated users to bypass intended access restrictions and extract archives to arbitrary directories via a crafted dataroot value.	4.0	MEDIUM	AV:N/AC:L/Au:S/C:N/I:P/A:N		
CVE-2015-2268	2015-06-01T19:59:11.433	2025-04-12T10:46:40.837	filter/urltolink/filter.php in Moodle through 2.5.9, 2.6.x before 2.6.9, 2.7.x before 2.7.6, and 2.8.x before 2.8.4 allows remote authenticated users to cause a denial of service (CPU consumption or partial outage) via a crafted string that is matched against an improper regular expression.	6.8	MEDIUM	AV:N/AC:L/Au:S/C:N/I:N/A:C		
CVE-2015-2269	2015-06-01T19:59:12.620	2025-04-12T10:46:40.837	Multiple cross-site scripting (XSS) vulnerabilities in lib/javascript-static.js in Moodle through 2.5.9, 2.6.x before 2.6.9, 2.7.x before 2.7.6, and 2.8.x before 2.8.4 allow remote authenticated users to inject arbitrary web script or HTML via a (1) alt or (2) title attribute in an IMG element.	3.5	LOW	AV:N/AC:M/Au:S/C:N/I:P/A:N		
CVE-2015-2270	2015-06-01T19:59:13.480	2025-04-12T10:46:40.837	lib/moodlelib.php in Moodle through 2.5.9, 2.6.x before 2.6.9, 2.7.x before 2.7.6, and 2.8.x before 2.8.4, when the theme uses the blocks-regions feature, establishes the course state at an incorrect point in the login-validation process, which allows remote attackers to obtain sensitive course information via unspecified vectors.	4.3	MEDIUM	AV:N/AC:M/Au:N/C:P/I:N/A:N		
CVE-2015-2271	2015-06-01T19:59:14.480	2025-04-12T10:46:40.837	"tag/user.php in Moodle through 2.5.9, 2.6.x before 2.6.9, 2.7.x before 2.7.6, and 2.8.x before 2.8.4 does not consider the moodle/tag:flag capability before proceeding with a flaginappropriate action, which allows remote authenticated users to bypass intended access restrictions via the ""Flag as inappropriate"" feature."	4.0	MEDIUM	AV:N/AC:L/Au:S/C:N/I:P/A:N		
CVE-2015-2272	2015-06-01T19:59:15.447	2025-04-12T10:46:40.837	login/token.php in Moodle through 2.5.9, 2.6.x before 2.6.9, 2.7.x before 2.7.6, and 2.8.x before 2.8.4 allows remote authenticated users to bypass a forced-password-change requirement by creating a web-services token.	4.0	MEDIUM	AV:N/AC:L/Au:S/C:N/I:P/A:N		
CVE-2015-2273	2015-06-01T19:59:16.323	2025-04-12T10:46:40.837	Cross-site scripting (XSS) vulnerability in mod/quiz/report/statistics/statistics_question_table.php in Moodle through 2.5.9, 2.6.x before 2.6.9, 2.7.x before 2.7.6, and 2.8.x before 2.8.4 allows remote authenticated users to inject arbitrary web script or HTML by leveraging the student role for a crafted quiz response.	3.5	LOW	AV:N/AC:M/Au:S/C:N/I:P/A:N		
CVE-2015-3174	2015-06-01T19:59:17.243	2025-04-12T10:46:40.837	mod/quiz/db/access.php in Moodle through 2.5.9, 2.6.x before 2.6.11, 2.7.x before 2.7.8, and 2.8.x before 2.8.6 does not set the RISK_XSS bit for graders, which allows remote authenticated users to conduct cross-site scripting (XSS) attacks via crafted gradebook feedback during manual quiz grading.	3.5	LOW	AV:N/AC:M/Au:S/C:N/I:P/A:N		
CVE-2015-3175	2015-06-01T19:59:18.243	2025-04-12T10:46:40.837	Multiple open redirect vulnerabilities in Moodle through 2.5.9, 2.6.x before 2.6.11, 2.7.x before 2.7.8, and 2.8.x before 2.8.6 allow remote attackers to redirect users to arbitrary web sites and conduct phishing attacks via vectors involving an error page that links to a URL from an HTTP Referer header.	5.8	MEDIUM	AV:N/AC:M/Au:N/C:P/I:P/A:N		
CVE-2015-3176	2015-06-01T19:59:19.183	2025-04-12T10:46:40.837	The account-confirmation feature in login/confirm.php in Moodle through 2.5.9, 2.6.x before 2.6.11, 2.7.x before 2.7.8, and 2.8.x before 2.8.6 allows remote attackers to obtain sensitive full-name information by attempting to self-register.	4.3	MEDIUM	AV:N/AC:M/Au:N/C:P/I:N/A:N		
CVE-2015-3177	2015-06-01T19:59:20.087	2025-04-12T10:46:40.837	Moodle 2.8.x before 2.8.6 does not consider the tool/monitor:subscribe capability before entering subscriptions to site-wide event-monitor rules, which allows remote authenticated users to obtain sensitive information via a subscription request.	3.5	LOW	AV:N/AC:M/Au:S/C:P/I:N/A:N		
CVE-2015-3178	2015-06-01T19:59:21.120	2025-04-12T10:46:40.837	Cross-site scripting (XSS) vulnerability in the external_format_text function in lib/externallib.php in Moodle through 2.5.9, 2.6.x before 2.6.11, 2.7.x before 2.7.8, and 2.8.x before 2.8.6 allows remote authenticated users to inject arbitrary web script or HTML into an external application via a crafted string that is visible to web services.	3.5	LOW	AV:N/AC:M/Au:S/C:N/I:P/A:N		
CVE-2015-3179	2015-06-01T19:59:22.087	2025-04-12T10:46:40.837	login/confirm.php in Moodle through 2.5.9, 2.6.x before 2.6.11, 2.7.x before 2.7.8, and 2.8.x before 2.8.6 allows remote authenticated users to bypass intended login restrictions by leveraging access to an unconfirmed suspended account.	3.5	LOW	AV:N/AC:M/Au:S/C:N/I:P/A:N		
CVE-2015-3180	2015-06-01T19:59:22.947	2025-04-12T10:46:40.837	lib/navigationlib.php in Moodle through 2.5.9, 2.6.x before 2.6.11, 2.7.x before 2.7.8, and 2.8.x before 2.8.6 allows remote authenticated users to obtain sensitive course-structure information by leveraging access to a student account with a suspended enrolment.	4.0	MEDIUM	AV:N/AC:L/Au:S/C:P/I:N/A:N		
CVE-2015-3181	2015-06-01T19:59:23.743	2025-04-12T10:46:40.837	files/externallib.php in Moodle through 2.5.9, 2.6.x before 2.6.11, 2.7.x before 2.7.8, and 2.8.x before 2.8.6 does not consider the moodle/user:manageownfiles capability before approving a private-file upload, which allows remote authenticated users to bypass intended file-management restrictions by using web services to perform uploads after this capability has been revoked.	4.0	MEDIUM	AV:N/AC:L/Au:S/C:N/I:P/A:N		
CVE-2014-0999	2015-06-02T14:59:00.067	2025-04-12T10:46:40.837	Sendio before 7.2.4 includes the session identifier in URLs in emails, which allows remote attackers to obtain sensitive information and hijack sessions by reading the jsessionid parameter in the Referrer HTTP header.	5.0	MEDIUM	AV:N/AC:L/Au:N/C:P/I:N/A:N		
CVE-2014-8391	2015-06-02T14:59:01.833	2025-04-12T10:46:40.837	The Web interface in Sendio before 7.2.4 does not properly handle sessions, which allows remote authenticated users to obtain sensitive information from other users' sessions via a large number of requests.	4.0	MEDIUM	AV:N/AC:L/Au:S/C:P/I:N/A:N		
CVE-2015-0759	2015-06-02T14:59:02.927	2025-04-12T10:46:40.837	Cross-site request forgery (CSRF) vulnerability in Cisco Headend Digital Broadband Delivery System allows remote attackers to hijack the authentication of arbitrary users.	6.8	MEDIUM	AV:N/AC:M/Au:N/C:P/I:P/A:P		
CVE-2015-0850	2015-06-02T14:59:05.427	2025-04-12T10:46:40.837	The Git plugin for FusionForge before 6.0rc4 allows remote attackers to execute arbitrary code via an unspecified parameter when creating a secondary Git repository.	10.0	HIGH	AV:N/AC:L/Au:N/C:C/I:C/A:C		
CVE-2015-1945	2015-06-02T14:59:06.537	2025-04-12T10:46:40.837	Unspecified vulnerability in the Reference Data Management component in IBM InfoSphere Master Data Management 10.1, 11.0, 11.3 before FP3, and 11.4 allows remote authenticated users to gain privileges via unknown vectors.	6.5	MEDIUM	AV:N/AC:L/Au:S/C:P/I:P/A:P		
CVE-2015-2278	2015-06-02T14:59:07.537	2025-04-12T10:46:40.837	The LZH decompression implementation (CsObjectInt::BuildHufTree function in vpa108csulzh.cpp) in SAP MaxDB 7.5 and 7.6, Netweaver Application Server ABAP, Netweaver Application Server Java, Netweaver RFC SDK, GUI, RFC SDK, SAPCAR archive tool, and other products allows context-dependent attackers to cause a denial of service (out-of-bounds read) via unspecified vectors, related to look-ups of non-simple codes, aka SAP Security Note 2124806, 2121661, 2127995, and 2125316.	5.0	MEDIUM	AV:N/AC:L/Au:N/C:N/I:N/A:P		
CVE-2015-2282	2015-06-02T14:59:08.880	2025-04-12T10:46:40.837	Stack-based buffer overflow in the LZC decompression implementation (CsObjectInt::CsDecomprLZC function in vpa106cslzc.cpp) in SAP MaxDB 7.5 and 7.6, Netweaver Application Server ABAP, Netweaver Application Server Java, Netweaver RFC SDK, GUI, RFC SDK, SAPCAR archive tool, and other products allows context-dependent attackers to cause a denial of service (crash) or possibly execute arbitrary code via unspecified vectors, aka SAP Security Note 2124806, 2121661, 2127995, and 2125316.	7.5	HIGH	AV:N/AC:L/Au:N/C:P/I:P/A:P		
CVE-2015-2944	2015-06-02T14:59:09.863	2025-04-12T10:46:40.837	Multiple cross-site scripting (XSS) vulnerabilities in Apache Sling API before 2.2.2 and Apache Sling Servlets Post before 2.1.2 allow remote attackers to inject arbitrary web script or HTML via the URI, related to (1) org/apache/sling/api/servlets/HtmlResponse and (2) org/apache/sling/servlets/post/HtmlResponse.	4.3	MEDIUM	AV:N/AC:M/Au:N/C:N/I:P/A:N		
CVE-2015-3982	2015-06-02T14:59:10.987	2025-04-12T10:46:40.837	The session.flush function in the cached_db backend in Django 1.8.x before 1.8.2 does not properly flush the session, which allows remote attackers to hijack user sessions via an empty string in the session key.	5.0	MEDIUM	AV:N/AC:L/Au:N/C:N/I:P/A:N		
CVE-2015-4050	2015-06-02T14:59:12.253	2025-04-12T10:46:40.837	FragmentListener in the HttpKernel component in Symfony 2.3.19 through 2.3.28, 2.4.9 through 2.4.10, 2.5.4 through 2.5.11, and 2.6.0 through 2.6.7, when ESI or SSI support enabled, does not check if the _controller attribute is set, which allows remote attackers to bypass URL signing and security rules by including (1) no hash or (2) an invalid hash in a request to /_fragment.	4.3	MEDIUM	AV:N/AC:M/Au:N/C:N/I:P/A:N		
CVE-2015-4094	2015-06-02T14:59:13.630	2025-04-12T10:46:40.837	The Thycotic Password Manager Secret Server application through 2.3 for iOS does not verify X.509 certificates from SSL servers, which allows man-in-the-middle attackers to spoof servers and obtain sensitive information via a crafted certificate.	5.8	MEDIUM	AV:N/AC:M/Au:N/C:P/I:P/A:N		
CVE-2015-4155	2015-06-02T14:59:14.973	2025-04-12T10:46:40.837	GNU Parallel before 20150422, when using (1) --pipe, (2) --tmux, (3) --cat, (4) --fifo, or (5) --compress, allows local users to write to arbitrary files via a symlink attack on a temporary file.	3.6	LOW	AV:L/AC:L/Au:N/C:N/I:P/A:P		
CVE-2015-4156	2015-06-02T14:59:16.333	2025-04-12T10:46:40.837	GNU Parallel before 20150522 (Nepal), when using (1) --cat or (2) --fifo with --sshlogin, allows local users to write to arbitrary files via a symlink attack on a temporary file.	3.6	LOW	AV:L/AC:L/Au:N/C:N/I:P/A:P		
CVE-2015-4157	2015-06-02T14:59:17.770	2025-04-12T10:46:40.837	SAP Content Server allows remote attackers to cause a denial of service (service termination) via unspecified vectors, aka SAP Security Note 2127995.	5.0	MEDIUM	AV:N/AC:L/Au:N/C:N/I:N/A:P		
CVE-2015-4158	2015-06-02T14:59:18.583	2025-04-12T10:46:40.837	SAP ABAP & Java Server allows remote attackers to cause a denial of service (service termination) via unspecified vectors, aka SAP Security Note 2121661.	5.0	MEDIUM	AV:N/AC:L/Au:N/C:N/I:N/A:P		
CVE-2015-4159	2015-06-02T14:59:19.347	2025-04-12T10:46:40.837	SQL injection vulnerability in SAP HANA Web-based Development Workbench allows remote attackers to execute arbitrary SQL commands via unspecified vectors, aka SAP Security Notes 2153892.	7.5	HIGH	AV:N/AC:L/Au:N/C:P/I:P/A:P		
CVE-2015-4160	2015-06-02T14:59:20.237	2025-04-12T10:46:40.837	SQL injection vulnerability in SAP ASE Database Platform allows remote attackers to execute arbitrary SQL commands via unspecified vectors, aka SAP Security Notes: 2152278.	7.5	HIGH	AV:N/AC:L/Au:N/C:P/I:P/A:P		
CVE-2015-4161	2015-06-02T14:59:21.143	2025-04-12T10:46:40.837	SAP Afaria does not properly restrict access to unspecified functionality, which allows remote attackers to obtain sensitive information, gain privileges, or have other unspecified impact via unknown vectors, SAP Security Note 2155690.	7.5	HIGH	AV:N/AC:L/Au:N/C:P/I:P/A:P		
CVE-2015-4162	2015-06-02T14:59:21.940	2025-04-12T10:46:40.837	XML external entity (XXE) vulnerability in the management interface in PAN-OS before 5.0.16, 6.x before 6.0.8, and 6.1.x before 6.1.4 allows remote authenticated administrators to obtain sensitive information via crafted XML data.	4.0	MEDIUM	AV:N/AC:L/Au:S/C:P/I:N/A:N		
CVE-2014-9721	2015-06-03T20:59:00.090	2025-04-12T10:46:40.837	libzmq before 4.0.6 and 4.1.x before 4.1.1 allows remote attackers to conduct downgrade attacks and bypass ZMTP v3 protocol security mechanisms via a ZMTP v2 or earlier header.	4.3	MEDIUM	AV:N/AC:M/Au:N/C:N/I:P/A:N		
CVE-2015-0263	2015-06-03T20:59:02.917	2025-04-12T10:46:40.837	XML external entity (XXE) vulnerability in the XML converter setup in converter/jaxp/XmlConverter.java in Apache Camel before 2.13.4 and 2.14.x before 2.14.2 allows remote attackers to read arbitrary files via an external entity in an SAXSource.	5.0	MEDIUM	AV:N/AC:L/Au:N/C:P/I:N/A:N		
CVE-2015-0264	2015-06-03T20:59:04.403	2025-04-12T10:46:40.837	Multiple XML external entity (XXE) vulnerabilities in builder/xml/XPathBuilder.java in Apache Camel before 2.13.4 and 2.14.x before 2.14.2 allow remote attackers to read arbitrary files via an external entity in an invalid XML (1) String or (2) GenericFile object in an XPath query.	5.0	MEDIUM	AV:N/AC:L/Au:N/C:P/I:N/A:N		
CVE-2015-4038	2015-06-03T20:59:05.480	2025-04-12T10:46:40.837	The WP Membership plugin 1.2.3 for WordPress allows remote authenticated users to gain administrator privileges via an iv_membership_update_user_settings action to wp-admin/admin-ajax.php.	6.5	MEDIUM	AV:N/AC:L/Au:S/C:P/I:P/A:P		
CVE-2015-4103	2015-06-03T20:59:06.747	2025-04-12T10:46:40.837	Xen 3.3.x through 4.5.x does not properly restrict write access to the host MSI message data field, which allows local x86 HVM guest administrators to cause a denial of service (host interrupt handling confusion) via vectors related to qemu and accessing spanning multiple fields.	4.9	MEDIUM	AV:L/AC:L/Au:N/C:N/I:N/A:C		
CVE-2015-4104	2015-06-03T20:59:07.667	2025-04-12T10:46:40.837	Xen 3.3.x through 4.5.x does not properly restrict access to PCI MSI mask bits, which allows local x86 HVM guest users to cause a denial of service (unexpected interrupt and host crash) via unspecified vectors.	7.8	HIGH	AV:N/AC:L/Au:N/C:N/I:N/A:C		
CVE-2015-4105	2015-06-03T20:59:08.560	2025-04-12T10:46:40.837	Xen 3.3.x through 4.5.x enables logging for PCI MSI-X pass-through error messages, which allows local x86 HVM guests to cause a denial of service (host disk consumption) via certain invalid operations.	4.9	MEDIUM	AV:L/AC:L/Au:N/C:N/I:N/A:C		
CVE-2015-4106	2015-06-03T20:59:09.573	2025-04-12T10:46:40.837	QEMU does not properly restrict write access to the PCI config space for certain PCI pass-through devices, which might allow local x86 HVM guests to gain privileges, cause a denial of service (host crash), obtain sensitive information, or possibly have other unspecified impact via unknown vectors.	4.6	MEDIUM	AV:L/AC:L/Au:N/C:P/I:P/A:P		
CVE-2015-0760	2015-06-04T10:59:00.067	2025-04-12T10:46:40.837	The IKEv1 implementation in Cisco ASA Software 7.x, 8.0.x, 8.1.x, and 8.2.x before 8.2.2.13 allows remote authenticated users to bypass XAUTH authentication via crafted IKEv1 packets, aka Bug ID CSCus47259.	4.0	MEDIUM	AV:N/AC:L/Au:S/C:P/I:N/A:N		
CVE-2015-0761	2015-06-04T10:59:01.520	2025-04-12T10:46:40.837	Cisco AnyConnect Secure Mobility Client before 3.1(8009) and 4.x before 4.0(2052) on Linux does not properly implement unspecified internal functions, which allows local users to obtain root privileges via crafted vpnagent options, aka Bug ID CSCus86790.	7.2	HIGH	AV:L/AC:L/Au:N/C:C/I:C/A:C		
CVE-2015-0762	2015-06-04T10:59:02.707	2025-04-12T10:46:40.837	Cross-site scripting (XSS) vulnerability in the management interface in Cisco Unified MeetingPlace 8.6(1.2) and 8.6(1.9) for Microsoft Outlook allows remote attackers to inject arbitrary web script or HTML via a crafted value in a URL, aka Bug ID CSCuu51400.	4.3	MEDIUM	AV:N/AC:M/Au:N/C:N/I:P/A:N		
CVE-2015-0763	2015-06-04T10:59:03.800	2025-04-12T10:46:40.837	Cisco Unified MeetingPlace 8.6(1.2) does not properly validate session IDs in http URLs, which allows remote attackers to obtain sensitive session information via a crafted URL, aka Bug ID CSCuu60338.	5.0	MEDIUM	AV:N/AC:L/Au:N/C:P/I:N/A:N		
CVE-2015-0764	2015-06-04T10:59:04.833	2025-04-12T10:46:40.837	Cisco Unified MeetingPlace 8.6(1.9) allows remote attackers to read arbitrary files via a crafted resource request, aka Bug ID CSCus95603.	5.0	MEDIUM	AV:N/AC:L/Au:N/C:P/I:N/A:N		
CVE-2015-0765	2015-06-04T10:59:05.957	2025-04-12T10:46:40.837	Cisco ONS 15454 System Software 10.30 and 10.301 allows remote attackers to cause a denial of service (tNetTask CPU consumption or card reset) via a flood of (1) IP or (2) Ethernet traffic, aka Bug ID CSCus57263.	5.0	MEDIUM	AV:N/AC:L/Au:N/C:N/I:N/A:P		
CVE-2015-0766	2015-06-04T10:59:06.863	2025-04-12T10:46:40.837	Multiple cross-site scripting (XSS) vulnerabilities in the administrative web interface in the Management Center component in Cisco FireSIGHT System Software 6.0.0 allow remote attackers to inject arbitrary web script or HTML via unspecified fields, aka Bug IDs CSCus93566, CSCut31557, and CSCut47196.	4.3	MEDIUM	AV:N/AC:M/Au:N/C:N/I:P/A:N		
CVE-2014-9201	2015-06-05T10:59:00.083	2025-04-12T10:46:40.837	Beckwith Electric M-6200 Digital Voltage Regulator Control with firmware before D-0198V04.07.00, M-6200A Digital Voltage Regulator Control with firmware before D-0228V02.01.07, M-2001D Digital Tapchanger Control with firmware before D-0214V01.10.04, M-6283A Three Phase Digital Capacitor Bank Control with firmware before D-0346V03.00.02, M-6280A Digital Capacitor Bank Control with firmware before D-0254V03.05.05, and M-6280 Digital Capacitor Bank Control do not properly generate TCP initial sequence number (ISN) values, which makes it easier for remote attackers to spoof TCP sessions by predicting an ISN value.	6.4	MEDIUM	AV:N/AC:L/Au:N/C:P/I:N/A:P		
CVE-2015-0541	2015-06-05T10:59:01.380	2025-04-12T10:46:40.837	Cross-site request forgery (CSRF) vulnerability in EMC RSA Web Threat Detection before 5.1 allows remote attackers to hijack the authentication of arbitrary users.	6.8	MEDIUM	AV:N/AC:M/Au:N/C:P/I:P/A:P		
CVE-2015-1000	2015-06-05T10:59:02.287	2025-04-12T10:46:40.837	Stack-based buffer overflow in the OpenForIPCamTest method in the RTSPVIDEO.rtspvideoCtrl.1 (aka SStreamVideo) ActiveX control in Moxa SoftCMS before 1.3 allows remote attackers to execute arbitrary code via the StrRtspPath parameter.	6.8	MEDIUM	AV:N/AC:M/Au:N/C:P/I:P/A:P		
CVE-2015-2124	2015-06-05T10:59:03.270	2025-04-12T10:46:40.837	Unspecified vulnerability in Easy Setup Wizard in HP ThinPro Linux 4.1 through 5.1 and Smart Zero Core 4.3 and 4.4 allows local users to bypass intended access restrictions and gain privileges via unknown vectors.	7.2	HIGH	AV:L/AC:L/Au:N/C:C/I:C/A:C		
CVE-2015-2950	2015-06-05T10:59:04.440	2025-04-12T10:46:40.837	Directory traversal vulnerability in the Brandon Bowles Open Explorer application before 0.254 Beta for Android allows remote attackers to write to arbitrary files via a crafted filename.	6.4	MEDIUM	AV:N/AC:L/Au:N/C:N/I:P/A:P		
CVE-2015-2951	2015-06-05T10:59:05.380	2025-04-12T10:46:40.837	JWT.php in F21 JWT before 2.0 allows remote attackers to bypass signature verification via crafted tokens.	5.0	MEDIUM	AV:N/AC:L/Au:N/C:N/I:P/A:N		
CVE-2015-3950	2015-06-05T10:59:06.363	2025-04-12T10:46:40.837	Cross-site request forgery (CSRF) vulnerability in XZERES 442SR OS on 442SR wind turbines allows remote attackers to hijack the authentication of admins for requests that select a different default admin user via a GET request.	6.8	MEDIUM	AV:N/AC:M/Au:N/C:P/I:P/A:P		
CVE-2014-6175	2015-06-07T18:59:00.063	2025-04-12T10:46:40.837	Cross-site scripting (XSS) vulnerability in IBM Marketing Operations 7.x and 8.x before 8.5.0.7.2, 8.6.x before 8.6.0.8, 9.0.x before 9.0.0.4.1, 9.1.0.x before 9.1.0.5, and 9.1.1.x before 9.1.1.2 allows remote authenticated users to inject arbitrary web script or HTML via unspecified vectors.	3.5	LOW	AV:N/AC:M/Au:S/C:N/I:P/A:N		
CVE-2014-6222	2015-06-07T18:59:01.297	2025-04-12T10:46:40.837	Directory traversal vulnerability in IBM Marketing Operations 7.x and 8.x before 8.5.0.7.2, 8.6.x before 8.6.0.8, 9.0.x before 9.0.0.4.1, 9.1.0.x before 9.1.0.5, and 9.1.1.x before 9.1.1.2 allows remote authenticated users to read arbitrary files via a .. (dot dot) in a URL.	4.0	MEDIUM	AV:N/AC:L/Au:S/C:P/I:N/A:N		
CVE-2014-8887	2015-06-07T18:59:02.470	2025-04-12T10:46:40.837	IBM Marketing Operations 7.x and 8.x before 8.5.0.7.2, 8.6.x before 8.6.0.8, 9.0.x before 9.0.0.4.1, 9.1.0.x before 9.1.0.5, and 9.1.1.x before 9.1.1.2 allows remote authenticated users to upload arbitrary GIFAR files, and consequently modify data, via unspecified vectors.	4.0	MEDIUM	AV:N/AC:L/Au:S/C:N/I:P/A:N		
