CVE ID	Published Date	Last Modified Date	Description	Base Score	Base Severity	Vector String	Vendor	Product
CVE-2016-7395	2016-09-11T10:59:25.337	2025-04-12T10:46:40.837	SkPath.cpp in Skia, as used in Google Chrome before 53.0.2785.89 on Windows and OS X and before 53.0.2785.92 on Linux, does not properly validate the return values of ChopMonoAtY calls, which allows remote attackers to cause a denial of service (uninitialized memory access and application crash) or possibly have unspecified other impact via crafted graphics data.	6.8	MEDIUM	AV:N/AC:M/Au:N/C:P/I:P/A:P		
CVE-2016-3858	2016-09-11T21:59:00.133	2025-04-12T10:46:40.837	Buffer overflow in drivers/soc/qcom/subsystem_restart.c in the Qualcomm subsystem driver in Android before 2016-09-05 on Nexus 5X and 6P devices allows attackers to gain privileges via a crafted application that provides a long string, aka Android internal bug 28675151 and Qualcomm internal bug CR1022641.	9.3	HIGH	AV:N/AC:M/Au:N/C:C/I:C/A:C		
CVE-2016-3859	2016-09-11T21:59:01.977	2025-04-12T10:46:40.837	The Qualcomm camera driver in Android before 2016-09-05 on Nexus 5, 5X, 6, and 6P devices allows attackers to gain privileges via a crafted application, aka Android internal bug 28815326 and Qualcomm internal bug CR1034641.	9.3	HIGH	AV:N/AC:M/Au:N/C:C/I:C/A:C		
CVE-2016-3861	2016-09-11T21:59:03.100	2025-04-12T10:46:40.837	LibUtils in Android 4.x before 4.4.4, 5.0.x before 5.0.2, 5.1.x before 5.1.1, 6.x before 2016-09-01, and 7.0 before 2016-09-01 mishandles conversions between Unicode character encodings with different encoding widths, which allows remote attackers to execute arbitrary code or cause a denial of service (heap-based buffer overflow) via a crafted file, aka internal bug 29250543.	9.3	HIGH	AV:N/AC:M/Au:N/C:C/I:C/A:C		
CVE-2016-3862	2016-09-11T21:59:04.210	2025-04-12T10:46:40.837	media/ExifInterface.java in mediaserver in Android 4.x before 4.4.4, 5.0.x before 5.0.2, 5.1.x before 5.1.1, and 6.x before 2016-09-01 does not properly interact with the use of static variables in libjhead_jni, which allows remote attackers to execute arbitrary code or cause a denial of service (memory corruption) via a crafted media file, aka internal bug 29270469.	9.3	HIGH	AV:N/AC:M/Au:N/C:C/I:C/A:C		
CVE-2016-3863	2016-09-11T21:59:05.350	2025-04-12T10:46:40.837	Multiple stack-based buffer overflows in the AVCC reassembly implementation in Utils.cpp in libstagefright in MediaMuxer in Android 4.x before 4.4.4, 5.0.x before 5.0.2, 5.1.x before 5.1.1, 6.x before 2016-09-01, and 7.0 before 2016-09-01 allow remote attackers to execute arbitrary code via a crafted media file, aka internal bug 29161888.	6.8	MEDIUM	AV:N/AC:M/Au:N/C:P/I:P/A:P		
CVE-2016-3864	2016-09-11T21:59:06.383	2025-04-12T10:46:40.837	The Qualcomm radio interface layer in Android before 2016-09-05 on Nexus 5, Nexus 5X, Nexus 6, Nexus 6P, and Android One devices allows attackers to gain privileges via a crafted application, aka Android internal bug 28823714 and Qualcomm internal bug CR913117.	9.3	HIGH	AV:N/AC:M/Au:N/C:C/I:C/A:C		
CVE-2016-3865	2016-09-11T21:59:07.883	2025-04-12T10:46:40.837	The Synaptics touchscreen driver in Android before 2016-09-05 on Nexus 5X and 9 devices allows attackers to gain privileges via a crafted application, aka internal bug 28799389.	9.3	HIGH	AV:N/AC:M/Au:N/C:C/I:C/A:C		
CVE-2016-3866	2016-09-11T21:59:09.103	2025-04-12T10:46:40.837	The Qualcomm sound driver in Android before 2016-09-05 on Nexus 5X, 6, and 6P devices allows attackers to gain privileges via a crafted application, aka Android internal bug 28868303 and Qualcomm internal bug CR1032820.	9.3	HIGH	AV:N/AC:M/Au:N/C:C/I:C/A:C		
CVE-2016-3867	2016-09-11T21:59:10.150	2025-04-12T10:46:40.837	The Qualcomm IPA driver in Android before 2016-09-05 on Nexus 5X and 6P devices allows attackers to gain privileges via a crafted application, aka Android internal bug 28919863 and Qualcomm internal bug CR1037897.	9.3	HIGH	AV:N/AC:M/Au:N/C:C/I:C/A:C		
CVE-2016-3868	2016-09-11T21:59:11.070	2025-04-12T10:46:40.837	The Qualcomm power driver in Android before 2016-09-05 on Nexus 5X and 6P devices allows attackers to gain privileges via a crafted application, aka Android internal bug 28967028 and Qualcomm internal bug CR1032875.	9.3	HIGH	AV:N/AC:M/Au:N/C:C/I:C/A:C		
CVE-2016-3869	2016-09-11T21:59:12.057	2025-04-12T10:46:40.837	The Broadcom Wi-Fi driver in Android before 2016-09-05 on Nexus 5, Nexus 6, Nexus 6P, Nexus 9, Nexus Player, and Pixel C devices allows attackers to gain privileges via a crafted application, aka Android internal bug 29009982 and Broadcom internal bug RB#96070.	9.3	HIGH	AV:N/AC:M/Au:N/C:C/I:C/A:C		
CVE-2016-3870	2016-09-11T21:59:13.367	2025-04-12T10:46:40.837	omx/SimpleSoftOMXComponent.cpp in libstagefright in mediaserver in Android 4.x before 4.4.4, 5.0.x before 5.0.2, 5.1.x before 5.1.1, 6.x before 2016-09-01, and 7.0 before 2016-09-01 does not prevent input-port changes, which allows attackers to gain privileges via a crafted application, aka internal bug 29421804.	9.3	HIGH	AV:N/AC:M/Au:N/C:C/I:C/A:C		
CVE-2016-3871	2016-09-11T21:59:14.447	2025-04-12T10:46:40.837	Multiple buffer overflows in codecs/mp3dec/SoftMP3.cpp in libstagefright in mediaserver in Android 4.x before 4.4.4, 5.0.x before 5.0.2, 5.1.x before 5.1.1, 6.x before 2016-09-01, and 7.0 before 2016-09-01 allow attackers to gain privileges via a crafted application, aka internal bug 29422022.	9.3	HIGH	AV:N/AC:M/Au:N/C:C/I:C/A:C		
CVE-2016-3872	2016-09-11T21:59:15.463	2025-04-12T10:46:40.837	Buffer overflow in codecs/on2/dec/SoftVPX.cpp in libstagefright in mediaserver in Android 4.x before 4.4.4, 5.0.x before 5.0.2, 5.1.x before 5.1.1, 6.x before 2016-09-01, and 7.0 before 2016-09-01 allows attackers to gain privileges via a crafted application, aka internal bug 29421675.	9.3	HIGH	AV:N/AC:M/Au:N/C:C/I:C/A:C		
CVE-2016-3873	2016-09-11T21:59:16.493	2025-04-12T10:46:40.837	The NVIDIA kernel in Android before 2016-09-05 on Nexus 9 devices allows attackers to gain privileges via a crafted application, aka internal bug 29518457.	9.3	HIGH	AV:N/AC:M/Au:N/C:C/I:C/A:C		
CVE-2016-3874	2016-09-11T21:59:17.477	2025-04-12T10:46:40.837	CORE/HDD/src/wlan_hdd_wext.c in the Qualcomm Wi-Fi driver in Android before 2016-09-05 on Nexus 5X devices does not properly validate the arguments array, which allows attackers to gain privileges via a crafted application that sends a WE_UNIT_TEST_CMD command, aka Android internal bug 29944562 and Qualcomm internal bug CR997797.	9.3	HIGH	AV:N/AC:M/Au:N/C:C/I:C/A:C		
CVE-2016-3875	2016-09-11T21:59:18.557	2025-04-12T10:46:40.837	server/wm/WindowManagerService.java in Android 6.x before 2016-09-01 does not enforce the DISALLOW_SAFE_BOOT setting, which allows physically proximate attackers to bypass intended access restrictions and boot to safe mode via unspecified vectors, aka internal bug 26251884.	7.2	HIGH	AV:L/AC:L/Au:N/C:C/I:C/A:C		
CVE-2016-3876	2016-09-11T21:59:19.777	2025-04-12T10:46:40.837	providers/settings/SettingsProvider.java in Android 6.x before 2016-09-01 and 7.0 before 2016-09-01 allows physically proximate attackers to bypass the SAFE_BOOT_DISALLOWED protection mechanism and boot to safe mode via the Android Debug Bridge (adb) tool, aka internal bug 29900345.	7.2	HIGH	AV:L/AC:L/Au:N/C:C/I:C/A:C		
CVE-2016-3877	2016-09-11T21:59:21.103	2025-04-12T10:46:40.837	Unspecified vulnerability in Android before 2016-09-01 has unknown impact and attack vectors.	10.0	HIGH	AV:N/AC:L/Au:N/C:C/I:C/A:C		
CVE-2016-3878	2016-09-11T21:59:22.227	2025-04-12T10:46:40.837	decoder/ih264d_api.c in mediaserver in Android 6.x before 2016-09-01 mishandles the case of decoding zero MBs, which allows remote attackers to cause a denial of service (device hang or reboot) via a crafted media file, aka internal bug 29493002.	7.1	HIGH	AV:N/AC:M/Au:N/C:N/I:N/A:C		
CVE-2016-3879	2016-09-11T21:59:23.277	2025-04-12T10:46:40.837	arm-wt-22k/lib_src/eas_mdls.c in mediaserver in Android 4.x before 4.4.4, 5.0.x before 5.0.2, 5.1.x before 5.1.1, and 6.x before 2016-09-01 allows remote attackers to cause a denial of service (NULL pointer dereference, and device hang or reboot) via a crafted media file, aka internal bug 29770686.	7.1	HIGH	AV:N/AC:M/Au:N/C:N/I:N/A:C		
CVE-2016-3880	2016-09-11T21:59:24.730	2025-04-12T10:46:40.837	Multiple buffer overflows in rtsp/ASessionDescription.cpp in libstagefright in mediaserver in Android 4.x before 4.4.4, 5.0.x before 5.0.2, 5.1.x before 5.1.1, 6.x before 2016-09-01, and 7.0 before 2016-09-01 allow remote attackers to cause a denial of service (device hang or reboot) via a crafted media file, aka internal bug 25747670.	7.1	HIGH	AV:N/AC:M/Au:N/C:N/I:N/A:C		
CVE-2016-3881	2016-09-11T21:59:25.887	2025-04-12T10:46:40.837	The decoder_peek_si_internal function in vp9/vp9_dx_iface.c in libvpx in mediaserver in Android 4.x before 4.4.4, 5.0.x before 5.0.2, 5.1.x before 5.1.1, 6.x before 2016-09-01, and 7.0 before 2016-09-01 allows remote attackers to cause a denial of service (buffer over-read, and device hang or reboot) via a crafted media file, aka internal bug 30013856.	7.1	HIGH	AV:N/AC:M/Au:N/C:N/I:N/A:C		
CVE-2016-3883	2016-09-11T21:59:27.040	2025-04-12T10:46:40.837	internal/telephony/SMSDispatcher.java in Telephony in Android 4.x before 4.4.4, 5.0.x before 5.0.2, 5.1.x before 5.1.1, 6.x before 2016-09-01, and 7.0 before 2016-09-01 does not properly construct warnings about premium SMS messages, which allows attackers to spoof the premium-payment confirmation dialog via a crafted application, aka internal bug 28557603.	4.3	MEDIUM	AV:N/AC:M/Au:N/C:N/I:P/A:N		
CVE-2016-3884	2016-09-11T21:59:28.073	2025-04-12T10:46:40.837	server/notification/NotificationManagerService.java in the Notification Manager Service in Android 6.x before 2016-09-01 and 7.0 before 2016-09-01 lacks uid checks, which allows attackers to bypass intended restrictions on method calls via a crafted application, aka internal bug 29421441.	4.3	MEDIUM	AV:N/AC:M/Au:N/C:N/I:P/A:N		
CVE-2016-3885	2016-09-11T21:59:29.247	2025-04-12T10:46:40.837	debuggerd/debuggerd.cpp in Debuggerd in Android 5.0.x before 5.0.2, 5.1.x before 5.1.1, 6.x before 2016-09-01, and 7.0 before 2016-09-01 mishandles the interaction between PTRACE_ATTACH operations and thread exits, which allows attackers to gain privileges via a crafted application, aka internal bug 29555636.	9.3	HIGH	AV:N/AC:M/Au:N/C:C/I:C/A:C		
CVE-2016-3886	2016-09-11T21:59:30.683	2025-04-12T10:46:40.837	systemui/statusbar/phone/QuickStatusBarHeader.java in the System UI Tuner in Android 7.0 before 2016-09-01 does not prevent tuner changes on the lockscreen, which allows physically proximate attackers to gain privileges by modifying a setting, aka internal bug 30107438.	7.2	HIGH	AV:L/AC:L/Au:N/C:C/I:C/A:C		
CVE-2016-3887	2016-09-11T21:59:31.870	2025-04-12T10:46:40.837	providers/settings/SettingsProvider.java in Android 7.0 before 2016-09-01 does not properly enforce the DISALLOW_CONFIG_VPN setting, which allows attackers to bypass an intended always-on VPN state via a crafted application, aka internal bug 29899712.	6.8	MEDIUM	AV:N/AC:M/Au:N/C:P/I:P/A:P		
CVE-2016-3888	2016-09-11T21:59:32.840	2025-04-12T10:46:40.837	internal/telephony/SMSDispatcher.java in Android 4.x before 4.4.4, 5.0.x before 5.0.2, 5.1.x before 5.1.1, 6.x before 2016-09-01, and 7.0 before 2016-09-01 allows physically proximate attackers to bypass the Factory Reset Protection protection mechanism, and send premium SMS messages during the Setup Wizard provisioning stage, via unspecified vectors, aka internal bug 29420123.	2.1	LOW	AV:L/AC:L/Au:N/C:N/I:P/A:N		
CVE-2016-3889	2016-09-11T21:59:33.887	2025-04-12T10:46:40.837	Android 6.x before 2016-09-01 and 7.0 before 2016-09-01 allows physically proximate attackers to bypass the Factory Reset Protection protection mechanism by accessing (1) an external tile from a system application, (2) the help feature, or (3) the Settings application during a pre-setup stage, aka internal bug 29194585.	7.2	HIGH	AV:L/AC:L/Au:N/C:C/I:C/A:C		
CVE-2016-3890	2016-09-11T21:59:35.277	2025-04-12T10:46:40.837	The Java Debug Wire Protocol (JDWP) implementation in adb/sockets.cpp in Android 4.x before 4.4.4, 5.0.x before 5.0.2, 5.1.x before 5.1.1, and 6.x before 2016-09-01 mishandles socket close operations, which allows attackers to gain privileges via a crafted application, aka internal bug 28347842.	7.6	HIGH	AV:N/AC:H/Au:N/C:C/I:C/A:C		
CVE-2016-3892	2016-09-11T21:59:36.247	2025-04-12T10:46:40.837	The Qualcomm SPMI driver in Android before 2016-09-05 on Nexus 5, 5X, 6, and 6P devices allows attackers to obtain sensitive information via a crafted application, aka Android internal bug 28760543 and Qualcomm internal bug CR1024197.	4.3	MEDIUM	AV:N/AC:M/Au:N/C:P/I:N/A:N		
CVE-2016-3893	2016-09-11T21:59:37.637	2025-04-12T10:46:40.837	The wcdcal_hwdep_ioctl_shared function in sound/soc/codecs/wcdcal-hwdep.c in the Qualcomm sound codec in Android before 2016-09-05 on Nexus 6P devices does not properly copy firmware data, which allows attackers to obtain sensitive information via a crafted application, aka Android internal bug 29512527 and Qualcomm internal bug CR856400.	4.3	MEDIUM	AV:N/AC:M/Au:N/C:P/I:N/A:N		
CVE-2016-3894	2016-09-11T21:59:38.620	2025-04-12T10:46:40.837	The Qualcomm DMA component in Android before 2016-09-05 on Nexus 6 devices allows attackers to obtain sensitive information via a crafted application, aka Android internal bug 29618014 and Qualcomm internal bug CR1042033.	4.3	MEDIUM	AV:N/AC:M/Au:N/C:P/I:N/A:N		
CVE-2016-3895	2016-09-11T21:59:39.543	2025-04-12T10:46:40.837	Integer overflow in the Region::unflatten function in libs/ui/Region.cpp in mediaserver in Android 6.x before 2016-09-01 and 7.0 before 2016-09-01 allows attackers to obtain sensitive information via a crafted application, aka internal bug 29983260.	4.3	MEDIUM	AV:N/AC:M/Au:N/C:P/I:N/A:N		
CVE-2016-3896	2016-09-11T21:59:40.950	2025-04-12T10:46:40.837	AOSP Mail in Android 4.x before 4.4.4, 5.0.x before 5.0.2, 5.1.x before 5.1.1, and 6.x before 2016-09-01 allows attackers to obtain sensitive EmailAccountCacheProvider information via a crafted application, aka internal bug 29767043.	4.3	MEDIUM	AV:N/AC:M/Au:N/C:P/I:N/A:N		
CVE-2016-3897	2016-09-11T21:59:42.183	2025-04-12T10:46:40.837	The WifiEnterpriseConfig class in net/wifi/WifiEnterpriseConfig.java in Wi-Fi in Android 4.x before 4.4.4, 5.0.x before 5.0.2, 5.1.x before 5.1.1, and 6.x before 2016-09-01 includes a password in the return value of a toString method call, which allows attackers to obtain sensitive information via a crafted application, aka internal bug 25624963.	4.3	MEDIUM	AV:N/AC:M/Au:N/C:P/I:N/A:N		
CVE-2016-3898	2016-09-11T21:59:43.217	2025-04-12T10:46:40.837	Telephony in Android 5.0.x before 5.0.2, 5.1.x before 5.1.1, 6.x before 2016-09-01, and 7.0 before 2016-09-01 allows attackers to cause a denial of service (loss of locked-screen 911 TTY functionality) via a crafted application that modifies the TTY mode by broadcasting an intent, aka internal bug 29832693.	4.3	MEDIUM	AV:N/AC:M/Au:N/C:N/I:N/A:P		
CVE-2016-3899	2016-09-11T21:59:44.373	2025-04-12T10:46:40.837	OMXCodec.cpp in libstagefright in mediaserver in Android 4.x before 4.4.4, 5.0.x before 5.0.2, 5.1.x before 5.1.1, 6.x before 2016-09-01, and 7.0 before 2016-09-01 does not validate a certain pointer, which allows remote attackers to cause a denial of service (device hang or reboot) via a crafted media file, aka internal bug 29421811.	7.1	HIGH	AV:N/AC:M/Au:N/C:N/I:N/A:C		
CVE-2016-1469	2016-09-12T01:59:00.130	2025-04-12T10:46:40.837	The HTTP framework on Cisco SPA300, SPA500, and SPA51x devices allows remote attackers to cause a denial of service (device outage) via a series of malformed HTTP requests, aka Bug ID CSCut67385.	7.5	HIGH	CVSS:3.1/AV:N/AC:L/PR:N/UI:N/S:U/C:N/I:N/A:H		
CVE-2016-6375	2016-09-12T01:59:01.130	2025-04-12T10:46:40.837	Cisco Wireless LAN Controller (WLC) devices before 8.0.140.0, 8.1.x and 8.2.x before 8.2.121.0, and 8.3.x before 8.3.102.0 allow remote attackers to cause a denial of service (device reload) by sending crafted Inter-Access Point Protocol (IAPP) packets and then sending a traffic stream metrics (TSM) information request over SNMP, aka Bug ID CSCuz40221.	5.7	MEDIUM	AV:A/AC:M/Au:N/C:N/I:N/A:C		
CVE-2016-7124	2016-09-12T01:59:02.287	2025-04-12T10:46:40.837	ext/standard/var_unserializer.c in PHP before 5.6.25 and 7.x before 7.0.10 mishandles certain invalid objects, which allows remote attackers to cause a denial of service or possibly have unspecified other impact via crafted serialized data that leads to a (1) __destruct call or (2) magic method call.	7.5	HIGH	AV:N/AC:L/Au:N/C:P/I:P/A:P		
CVE-2016-7125	2016-09-12T01:59:03.427	2025-04-12T10:46:40.837	ext/session/session.c in PHP before 5.6.25 and 7.x before 7.0.10 skips invalid session names in a way that triggers incorrect parsing, which allows remote attackers to inject arbitrary-type session data by leveraging control of a session name, as demonstrated by object injection.	5.0	MEDIUM	AV:N/AC:L/Au:N/C:N/I:P/A:N		
CVE-2016-7126	2016-09-12T01:59:04.723	2025-04-12T10:46:40.837	The imagetruecolortopalette function in ext/gd/gd.c in PHP before 5.6.25 and 7.x before 7.0.10 does not properly validate the number of colors, which allows remote attackers to cause a denial of service (select_colors allocation error and out-of-bounds write) or possibly have unspecified other impact via a large value in the third argument.	9.8	CRITICAL	CVSS:3.1/AV:N/AC:L/PR:N/UI:N/S:U/C:H/I:H/A:H		
CVE-2016-7127	2016-09-12T01:59:05.707	2025-04-12T10:46:40.837	The imagegammacorrect function in ext/gd/gd.c in PHP before 5.6.25 and 7.x before 7.0.10 does not properly validate gamma values, which allows remote attackers to cause a denial of service (out-of-bounds write) or possibly have unspecified other impact by providing different signs for the second and third arguments.	7.5	HIGH	AV:N/AC:L/Au:N/C:P/I:P/A:P		
CVE-2016-7128	2016-09-12T01:59:06.770	2025-04-12T10:46:40.837	The exif_process_IFD_in_TIFF function in ext/exif/exif.c in PHP before 5.6.25 and 7.x before 7.0.10 mishandles the case of a thumbnail offset that exceeds the file size, which allows remote attackers to obtain sensitive information from process memory via a crafted TIFF image.	5.0	MEDIUM	AV:N/AC:L/Au:N/C:P/I:N/A:N		
CVE-2016-7129	2016-09-12T01:59:07.817	2025-04-12T10:46:40.837	The php_wddx_process_data function in ext/wddx/wddx.c in PHP before 5.6.25 and 7.x before 7.0.10 allows remote attackers to cause a denial of service (segmentation fault) or possibly have unspecified other impact via an invalid ISO 8601 time value, as demonstrated by a wddx_deserialize call that mishandles a dateTime element in a wddxPacket XML document.	7.5	HIGH	AV:N/AC:L/Au:N/C:P/I:P/A:P		
CVE-2016-7130	2016-09-12T01:59:08.833	2025-04-12T10:46:40.837	The php_wddx_pop_element function in ext/wddx/wddx.c in PHP before 5.6.25 and 7.x before 7.0.10 allows remote attackers to cause a denial of service (NULL pointer dereference and application crash) or possibly have unspecified other impact via an invalid base64 binary value, as demonstrated by a wddx_deserialize call that mishandles a binary element in a wddxPacket XML document.	5.0	MEDIUM	AV:N/AC:L/Au:N/C:N/I:N/A:P		
CVE-2016-7131	2016-09-12T01:59:09.787	2025-04-12T10:46:40.837	ext/wddx/wddx.c in PHP before 5.6.25 and 7.x before 7.0.10 allows remote attackers to cause a denial of service (NULL pointer dereference and application crash) or possibly have unspecified other impact via a malformed wddxPacket XML document that is mishandled in a wddx_deserialize call, as demonstrated by a tag that lacks a < (less than) character.	7.5	HIGH	CVSS:3.1/AV:N/AC:L/PR:N/UI:N/S:U/C:N/I:N/A:H		
CVE-2016-7132	2016-09-12T01:59:10.803	2025-04-12T10:46:40.837	ext/wddx/wddx.c in PHP before 5.6.25 and 7.x before 7.0.10 allows remote attackers to cause a denial of service (NULL pointer dereference and application crash) or possibly have unspecified other impact via an invalid wddxPacket XML document that is mishandled in a wddx_deserialize call, as demonstrated by a stray element inside a boolean element, leading to incorrect pop processing.	7.5	HIGH	CVSS:3.1/AV:N/AC:L/PR:N/UI:N/S:U/C:N/I:N/A:H		
CVE-2016-7133	2016-09-12T01:59:11.787	2025-04-12T10:46:40.837	Zend/zend_alloc.c in PHP 7.x before 7.0.10, when open_basedir is enabled, mishandles huge realloc operations, which allows remote attackers to cause a denial of service (integer overflow) or possibly have unspecified other impact via a long pathname.	6.8	MEDIUM	AV:N/AC:M/Au:N/C:P/I:P/A:P		
CVE-2016-7134	2016-09-12T01:59:12.803	2025-04-12T10:46:40.837	ext/curl/interface.c in PHP 7.x before 7.0.10 does not work around a libcurl integer overflow, which allows remote attackers to cause a denial of service (allocation error and heap-based buffer overflow) or possibly have unspecified other impact via a long string that is mishandled in a curl_escape call.	7.5	HIGH	AV:N/AC:L/Au:N/C:P/I:P/A:P		
CVE-2016-0331	2016-09-12T10:59:00.130	2025-04-12T10:46:40.837	Cross-site scripting (XSS) vulnerability in IBM Rational Team Concert 6.0.1 and 6.0.2 before 6.0.2 iFix2 and Rational Collaborative Lifecycle Management 6.0.1 and 6.0.2 before 6.0.2 iFix2 allows remote authenticated users to inject arbitrary web script or HTML via a crafted URL.	3.5	LOW	AV:N/AC:M/Au:S/C:N/I:P/A:N		
CVE-2016-4852	2016-09-12T10:59:01.210	2025-04-12T10:46:40.837	YoruFukurou (NightOwl) before 2.85 relies on support for emoji skin-tone modifiers even though this support is missing from the CoreText CTFramesetter API on OS X 10.9, which allows remote attackers to cause a denial of service (application crash) via a crafted emoji character sequence.	4.3	MEDIUM	AV:N/AC:M/Au:N/C:N/I:N/A:P		
CVE-2016-5927	2016-09-12T10:59:02.647	2025-04-12T10:46:40.837	IBM Tivoli Storage Manager for Space Management (aka Spectrum Protect for Space Management) 6.3.x before 6.3.2.6, 6.4.x before 6.4.3.3, and 7.1.x before 7.1.6, when certain dsmsetpw tracing is configured, allows local users to discover an encrypted password by reading application-trace output.	2.1	LOW	AV:L/AC:L/Au:N/C:P/I:N/A:N		
CVE-2016-5954	2016-09-12T10:59:04.177	2025-04-12T10:46:40.837	IBM WebSphere Portal 6.1.0 through 6.1.0.6 CF27, 6.1.5 through 6.1.5.3 CF27, 7.0.0 through 7.0.0.2 CF30, 8.0.0 through 8.0.0.1 CF21, and 8.5.0 before CF12 allows remote authenticated users to cause a denial of service by uploading temporary files.	4.0	MEDIUM	AV:N/AC:L/Au:S/C:N/I:N/A:P		
CVE-2016-6370	2016-09-12T10:59:05.273	2025-04-12T10:46:40.837	Directory traversal vulnerability in the web interface in Cisco Hosted Collaboration Mediation Fulfillment (HCM-F) 10.6(3) and earlier allows remote authenticated users to read arbitrary files via a crafted pathname in an HTTP request, aka Bug ID CSCuz27255.	4.0	MEDIUM	AV:N/AC:L/Au:S/C:P/I:N/A:N		
CVE-2016-6371	2016-09-12T10:59:06.350	2025-04-12T10:46:40.837	Directory traversal vulnerability in the web interface in Cisco Hosted Collaboration Mediation Fulfillment (HCM-F) 10.6(3) and earlier allows remote attackers to write to arbitrary files via a crafted URL, aka Bug ID CSCuz64717.	5.0	MEDIUM	AV:N/AC:L/Au:N/C:N/I:P/A:N		
CVE-2016-6394	2016-09-12T10:59:07.287	2025-04-12T10:46:40.837	Session fixation vulnerability in Cisco Firepower Management Center and Cisco FireSIGHT System Software through 6.1.0 allows remote attackers to hijack web sessions via a session identifier, aka Bug ID CSCuz80503.	5.8	MEDIUM	AV:N/AC:M/Au:N/C:P/I:P/A:N		
CVE-2016-6395	2016-09-12T10:59:08.227	2025-04-12T10:46:40.837	Cross-site scripting (XSS) vulnerability in the web-based management interface in Cisco Firepower Management Center before 6.1 and FireSIGHT System Software before 6.1 allows remote authenticated users to inject arbitrary web script or HTML via a crafted URL, aka Bug ID CSCuz58658.	3.5	LOW	AV:N/AC:M/Au:S/C:N/I:P/A:N		
CVE-2016-6396	2016-09-12T10:59:09.523	2025-04-12T10:46:40.837	Cisco Firepower Management Center before 6.1 and FireSIGHT System Software before 6.1, when certain malware blocking options are enabled, allow remote attackers to bypass malware detection via crafted fields in HTTP headers, aka Bug ID CSCuz44482.	5.0	MEDIUM	AV:N/AC:L/Au:N/C:N/I:P/A:N		
CVE-2016-6398	2016-09-12T10:59:10.507	2025-04-12T10:46:40.837	The PPTP server in Cisco IOS 15.5(3)M does not properly initialize packet buffers, which allows remote attackers to obtain sensitive information from earlier network communication by reading packet data, aka Bug ID CSCvb16274.	5.0	MEDIUM	AV:N/AC:L/Au:N/C:P/I:N/A:N		
CVE-2016-6399	2016-09-12T10:59:11.507	2025-04-12T10:46:40.837	Cisco ACE30 Application Control Engine Module through A5 3.3 and ACE 4700 Application Control Engine appliances through A5 3.3 allow remote attackers to cause a denial of service (device reload) via crafted (1) SSL or (2) TLS packets, aka Bug ID CSCvb16317.	7.8	HIGH	AV:N/AC:L/Au:N/C:N/I:N/A:C		
CVE-2016-0137	2016-09-14T10:59:00.180	2025-04-12T10:46:40.837	"The Click-to-Run (C2R) implementation in Microsoft Office 2013 SP1 and 2016 allows local users to bypass the ASLR protection mechanism via a crafted application, aka ""Microsoft APP-V ASLR Bypass."""	4.3	MEDIUM	AV:N/AC:M/Au:N/C:P/I:N/A:N		
CVE-2016-0138	2016-09-14T10:59:02.133	2025-04-12T10:46:40.837	"Microsoft Exchange Server 2007 SP3, 2010 SP3, 2013 SP1, 2013 Cumulative Update 12, 2013 Cumulative Update 13, 2016 Cumulative Update 1, and 2016 Cumulative Update 2 misparses e-mail messages, which allows remote authenticated users to obtain sensitive Outlook application information by leveraging the Send As right, aka ""Microsoft Exchange Information Disclosure Vulnerability."""	4.0	MEDIUM	AV:N/AC:L/Au:S/C:P/I:N/A:N		
