CVE ID	Published Date	Last Modified Date	Description	Base Score	Base Severity	Vector String	Vendor	Product
CVE-2016-4284	2016-09-14T18:59:14.750	2025-04-12T10:46:40.837	Adobe Flash Player before 18.0.0.375 and 19.x through 23.x before 23.0.0.162 on Windows and OS X and before 11.2.202.635 on Linux allows attackers to execute arbitrary code or cause a denial of service (memory corruption) via unspecified vectors, a different vulnerability than CVE-2016-4274, CVE-2016-4275, CVE-2016-4276, CVE-2016-4280, CVE-2016-4281, CVE-2016-4282, CVE-2016-4283, CVE-2016-4285, CVE-2016-6922, and CVE-2016-6924.	8.8	HIGH	CVSS:3.1/AV:N/AC:L/PR:N/UI:R/S:U/C:H/I:H/A:H		
CVE-2016-4285	2016-09-14T18:59:15.670	2025-04-12T10:46:40.837	Adobe Flash Player before 18.0.0.375 and 19.x through 23.x before 23.0.0.162 on Windows and OS X and before 11.2.202.635 on Linux allows attackers to execute arbitrary code or cause a denial of service (memory corruption) via unspecified vectors, a different vulnerability than CVE-2016-4274, CVE-2016-4275, CVE-2016-4276, CVE-2016-4280, CVE-2016-4281, CVE-2016-4282, CVE-2016-4283, CVE-2016-4284, CVE-2016-6922, and CVE-2016-6924.	8.8	HIGH	CVSS:3.1/AV:N/AC:L/PR:N/UI:R/S:U/C:H/I:H/A:H		
CVE-2016-4287	2016-09-14T18:59:16.607	2025-04-12T10:46:40.837	Integer overflow in Adobe Flash Player before 18.0.0.375 and 19.x through 23.x before 23.0.0.162 on Windows and OS X and before 11.2.202.635 on Linux allows attackers to execute arbitrary code via unspecified vectors.	8.8	HIGH	CVSS:3.1/AV:N/AC:L/PR:N/UI:R/S:U/C:H/I:H/A:H		
CVE-2016-6921	2016-09-14T18:59:17.593	2025-04-12T10:46:40.837	Use-after-free vulnerability in Adobe Flash Player before 18.0.0.375 and 19.x through 23.x before 23.0.0.162 on Windows and OS X and before 11.2.202.635 on Linux allows attackers to execute arbitrary code via unspecified vectors, a different vulnerability than CVE-2016-4272, CVE-2016-4279, CVE-2016-6923, CVE-2016-6925, CVE-2016-6926, CVE-2016-6927, CVE-2016-6929, CVE-2016-6930, CVE-2016-6931, and CVE-2016-6932.	8.8	HIGH	CVSS:3.1/AV:N/AC:L/PR:N/UI:R/S:U/C:H/I:H/A:H		
CVE-2016-6922	2016-09-14T18:59:18.873	2025-04-12T10:46:40.837	Adobe Flash Player before 18.0.0.375 and 19.x through 23.x before 23.0.0.162 on Windows and OS X and before 11.2.202.635 on Linux allows attackers to execute arbitrary code or cause a denial of service (memory corruption) via unspecified vectors, a different vulnerability than CVE-2016-4274, CVE-2016-4275, CVE-2016-4276, CVE-2016-4280, CVE-2016-4281, CVE-2016-4282, CVE-2016-4283, CVE-2016-4284, CVE-2016-4285, and CVE-2016-6924.	8.8	HIGH	CVSS:3.1/AV:N/AC:L/PR:N/UI:R/S:U/C:H/I:H/A:H		
CVE-2016-6923	2016-09-14T18:59:19.920	2025-04-12T10:46:40.837	Use-after-free vulnerability in Adobe Flash Player before 18.0.0.375 and 19.x through 23.x before 23.0.0.162 on Windows and OS X and before 11.2.202.635 on Linux allows attackers to execute arbitrary code via unspecified vectors, a different vulnerability than CVE-2016-4272, CVE-2016-4279, CVE-2016-6921, CVE-2016-6925, CVE-2016-6926, CVE-2016-6927, CVE-2016-6929, CVE-2016-6930, CVE-2016-6931, and CVE-2016-6932.	8.8	HIGH	CVSS:3.1/AV:N/AC:L/PR:N/UI:R/S:U/C:H/I:H/A:H		
CVE-2016-6924	2016-09-14T18:59:20.827	2025-04-12T10:46:40.837	Adobe Flash Player before 18.0.0.375 and 19.x through 23.x before 23.0.0.162 on Windows and OS X and before 11.2.202.635 on Linux allows attackers to execute arbitrary code or cause a denial of service (memory corruption) via unspecified vectors, a different vulnerability than CVE-2016-4274, CVE-2016-4275, CVE-2016-4276, CVE-2016-4280, CVE-2016-4281, CVE-2016-4282, CVE-2016-4283, CVE-2016-4284, CVE-2016-4285, and CVE-2016-6922.	8.8	HIGH	CVSS:3.1/AV:N/AC:L/PR:N/UI:R/S:U/C:H/I:H/A:H		
CVE-2016-6925	2016-09-14T18:59:21.843	2025-04-12T10:46:40.837	Use-after-free vulnerability in Adobe Flash Player before 18.0.0.375 and 19.x through 23.x before 23.0.0.162 on Windows and OS X and before 11.2.202.635 on Linux allows attackers to execute arbitrary code via unspecified vectors, a different vulnerability than CVE-2016-4272, CVE-2016-4279, CVE-2016-6921, CVE-2016-6923, CVE-2016-6926, CVE-2016-6927, CVE-2016-6929, CVE-2016-6930, CVE-2016-6931, and CVE-2016-6932.	8.8	HIGH	CVSS:3.1/AV:N/AC:L/PR:N/UI:R/S:U/C:H/I:H/A:H		
CVE-2016-6926	2016-09-14T18:59:23.127	2025-04-12T10:46:40.837	Use-after-free vulnerability in Adobe Flash Player before 18.0.0.375 and 19.x through 23.x before 23.0.0.162 on Windows and OS X and before 11.2.202.635 on Linux allows attackers to execute arbitrary code via unspecified vectors, a different vulnerability than CVE-2016-4272, CVE-2016-4279, CVE-2016-6921, CVE-2016-6923, CVE-2016-6925, CVE-2016-6927, CVE-2016-6929, CVE-2016-6930, CVE-2016-6931, and CVE-2016-6932.	8.8	HIGH	CVSS:3.1/AV:N/AC:L/PR:N/UI:R/S:U/C:H/I:H/A:H		
CVE-2016-6927	2016-09-14T18:59:24.110	2025-04-12T10:46:40.837	Use-after-free vulnerability in Adobe Flash Player before 18.0.0.375 and 19.x through 23.x before 23.0.0.162 on Windows and OS X and before 11.2.202.635 on Linux allows attackers to execute arbitrary code via unspecified vectors, a different vulnerability than CVE-2016-4272, CVE-2016-4279, CVE-2016-6921, CVE-2016-6923, CVE-2016-6925, CVE-2016-6926, CVE-2016-6929, CVE-2016-6930, CVE-2016-6931, and CVE-2016-6932.	8.8	HIGH	CVSS:3.1/AV:N/AC:L/PR:N/UI:R/S:U/C:H/I:H/A:H		
CVE-2016-6929	2016-09-14T18:59:25.047	2025-04-12T10:46:40.837	Use-after-free vulnerability in Adobe Flash Player before 18.0.0.375 and 19.x through 23.x before 23.0.0.162 on Windows and OS X and before 11.2.202.635 on Linux allows attackers to execute arbitrary code via unspecified vectors, a different vulnerability than CVE-2016-4272, CVE-2016-4279, CVE-2016-6921, CVE-2016-6923, CVE-2016-6925, CVE-2016-6926, CVE-2016-6927, CVE-2016-6930, CVE-2016-6931, and CVE-2016-6932.	8.8	HIGH	CVSS:3.1/AV:N/AC:L/PR:N/UI:R/S:U/C:H/I:H/A:H		
CVE-2016-6930	2016-09-14T18:59:26.063	2025-04-12T10:46:40.837	Use-after-free vulnerability in Adobe Flash Player before 18.0.0.375 and 19.x through 23.x before 23.0.0.162 on Windows and OS X and before 11.2.202.635 on Linux allows attackers to execute arbitrary code via unspecified vectors, a different vulnerability than CVE-2016-4272, CVE-2016-4279, CVE-2016-6921, CVE-2016-6923, CVE-2016-6925, CVE-2016-6926, CVE-2016-6927, CVE-2016-6929, CVE-2016-6931, and CVE-2016-6932.	8.8	HIGH	CVSS:3.1/AV:N/AC:L/PR:N/UI:R/S:U/C:H/I:H/A:H		
CVE-2016-6931	2016-09-14T18:59:26.970	2025-04-12T10:46:40.837	Use-after-free vulnerability in Adobe Flash Player before 18.0.0.375 and 19.x through 23.x before 23.0.0.162 on Windows and OS X and before 11.2.202.635 on Linux allows attackers to execute arbitrary code via unspecified vectors, a different vulnerability than CVE-2016-4272, CVE-2016-4279, CVE-2016-6921, CVE-2016-6923, CVE-2016-6925, CVE-2016-6926, CVE-2016-6927, CVE-2016-6929, CVE-2016-6930, and CVE-2016-6932.	8.8	HIGH	CVSS:3.1/AV:N/AC:L/PR:N/UI:R/S:U/C:H/I:H/A:H		
CVE-2016-6932	2016-09-14T18:59:28.220	2025-04-12T10:46:40.837	Use-after-free vulnerability in Adobe Flash Player before 18.0.0.375 and 19.x through 23.x before 23.0.0.162 on Windows and OS X and before 11.2.202.635 on Linux allows attackers to execute arbitrary code via unspecified vectors, a different vulnerability than CVE-2016-4272, CVE-2016-4279, CVE-2016-6921, CVE-2016-6923, CVE-2016-6925, CVE-2016-6926, CVE-2016-6927, CVE-2016-6929, CVE-2016-6930, and CVE-2016-6931.	8.8	HIGH	CVSS:3.1/AV:N/AC:L/PR:N/UI:R/S:U/C:H/I:H/A:H		
CVE-2016-2179	2016-09-16T05:59:00.143	2025-04-12T10:46:40.837	The DTLS implementation in OpenSSL before 1.1.0 does not properly restrict the lifetime of queue entries associated with unused out-of-order messages, which allows remote attackers to cause a denial of service (memory consumption) by maintaining many crafted DTLS sessions simultaneously, related to d1_lib.c, statem_dtls.c, statem_lib.c, and statem_srvr.c.	5.0	MEDIUM	AV:N/AC:L/Au:N/C:N/I:N/A:P		
CVE-2016-2181	2016-09-16T05:59:01.347	2025-04-12T10:46:40.837	The Anti-Replay feature in the DTLS implementation in OpenSSL before 1.1.0 mishandles early use of a new epoch number in conjunction with a large sequence number, which allows remote attackers to cause a denial of service (false-positive packet drops) via spoofed DTLS records, related to rec_layer_d1.c and ssl3_record.c.	5.0	MEDIUM	AV:N/AC:L/Au:N/C:N/I:N/A:P		
CVE-2016-2182	2016-09-16T05:59:02.627	2025-04-12T10:46:40.837	The BN_bn2dec function in crypto/bn/bn_print.c in OpenSSL before 1.1.0 does not properly validate division results, which allows remote attackers to cause a denial of service (out-of-bounds write and application crash) or possibly have unspecified other impact via unknown vectors.	7.5	HIGH	AV:N/AC:L/Au:N/C:P/I:P/A:P		
CVE-2016-4256	2016-09-16T05:59:03.627	2025-04-12T10:46:40.837	Adobe Digital Editions before 4.5.2 allows attackers to execute arbitrary code or cause a denial of service (memory corruption) via unspecified vectors, a different vulnerability than CVE-2016-4257, CVE-2016-4258, CVE-2016-4259, CVE-2016-4260, CVE-2016-4261, and CVE-2016-4262.	10.0	HIGH	AV:N/AC:L/Au:N/C:C/I:C/A:C		
CVE-2016-4257	2016-09-16T05:59:04.767	2025-04-12T10:46:40.837	Adobe Digital Editions before 4.5.2 allows attackers to execute arbitrary code or cause a denial of service (memory corruption) via unspecified vectors, a different vulnerability than CVE-2016-4256, CVE-2016-4258, CVE-2016-4259, CVE-2016-4260, CVE-2016-4261, and CVE-2016-4262.	10.0	HIGH	AV:N/AC:L/Au:N/C:C/I:C/A:C		
CVE-2016-4258	2016-09-16T05:59:05.800	2025-04-12T10:46:40.837	Adobe Digital Editions before 4.5.2 allows attackers to execute arbitrary code or cause a denial of service (memory corruption) via unspecified vectors, a different vulnerability than CVE-2016-4256, CVE-2016-4257, CVE-2016-4259, CVE-2016-4260, CVE-2016-4261, and CVE-2016-4262.	10.0	HIGH	AV:N/AC:L/Au:N/C:C/I:C/A:C		
CVE-2016-4259	2016-09-16T05:59:06.877	2025-04-12T10:46:40.837	Adobe Digital Editions before 4.5.2 allows attackers to execute arbitrary code or cause a denial of service (memory corruption) via unspecified vectors, a different vulnerability than CVE-2016-4256, CVE-2016-4257, CVE-2016-4258, CVE-2016-4260, CVE-2016-4261, and CVE-2016-4262.	10.0	HIGH	AV:N/AC:L/Au:N/C:C/I:C/A:C		
CVE-2016-4260	2016-09-16T05:59:08.080	2025-04-12T10:46:40.837	Adobe Digital Editions before 4.5.2 allows attackers to execute arbitrary code or cause a denial of service (memory corruption) via unspecified vectors, a different vulnerability than CVE-2016-4256, CVE-2016-4257, CVE-2016-4258, CVE-2016-4259, CVE-2016-4261, and CVE-2016-4262.	10.0	HIGH	AV:N/AC:L/Au:N/C:C/I:C/A:C		
CVE-2016-4261	2016-09-16T05:59:09.097	2025-04-12T10:46:40.837	Adobe Digital Editions before 4.5.2 allows attackers to execute arbitrary code or cause a denial of service (memory corruption) via unspecified vectors, a different vulnerability than CVE-2016-4256, CVE-2016-4257, CVE-2016-4258, CVE-2016-4259, CVE-2016-4260, and CVE-2016-4262.	10.0	HIGH	AV:N/AC:L/Au:N/C:C/I:C/A:C		
CVE-2016-4262	2016-09-16T05:59:10.113	2025-04-12T10:46:40.837	Adobe Digital Editions before 4.5.2 allows attackers to execute arbitrary code or cause a denial of service (memory corruption) via unspecified vectors, a different vulnerability than CVE-2016-4256, CVE-2016-4257, CVE-2016-4258, CVE-2016-4259, CVE-2016-4260, and CVE-2016-4261.	10.0	HIGH	AV:N/AC:L/Au:N/C:C/I:C/A:C		
CVE-2016-4263	2016-09-16T05:59:11.067	2025-04-12T10:46:40.837	Use-after-free vulnerability in Adobe Digital Editions before 4.5.2 allows attackers to execute arbitrary code via unspecified vectors.	10.0	HIGH	AV:N/AC:L/Au:N/C:C/I:C/A:C		
CVE-2016-6302	2016-09-16T05:59:12.003	2025-04-12T10:46:40.837	The tls_decrypt_ticket function in ssl/t1_lib.c in OpenSSL before 1.1.0 does not consider the HMAC size during validation of the ticket length, which allows remote attackers to cause a denial of service via a ticket that is too short.	5.0	MEDIUM	AV:N/AC:L/Au:N/C:N/I:N/A:P		
CVE-2016-6303	2016-09-16T05:59:13.363	2025-04-12T10:46:40.837	Integer overflow in the MDC2_Update function in crypto/mdc2/mdc2dgst.c in OpenSSL before 1.1.0 allows remote attackers to cause a denial of service (out-of-bounds write and application crash) or possibly have unspecified other impact via unknown vectors.	9.8	CRITICAL	CVSS:3.1/AV:N/AC:L/PR:N/UI:N/S:U/C:H/I:H/A:H		
CVE-2016-6936	2016-09-16T05:59:14.377	2025-04-12T10:46:40.837	Adobe AIR SDK & Compiler before 23.0.0.257 on Windows does not support Android runtime-analytics transport security, which might allow remote attackers to obtain sensitive information by leveraging access to a network over which analytics data is sent.	5.0	MEDIUM	AV:N/AC:L/Au:N/C:P/I:N/A:N		
CVE-2016-7420	2016-09-16T05:59:15.427	2025-04-12T10:46:40.837	Crypto++ (aka cryptopp) through 5.6.4 does not document the requirement for a compile-time NDEBUG definition disabling the many assert calls that are unintended in production use, which might allow context-dependent attackers to obtain sensitive information by leveraging access to process memory after an assertion failure, as demonstrated by reading a core dump.	4.3	MEDIUM	AV:N/AC:M/Au:N/C:P/I:N/A:N		
CVE-2016-5843	2016-09-17T02:59:00.147	2025-04-12T10:46:40.837	Multiple SQL injection vulnerabilities in the FAQ package 2.x before 2.3.6, 4.x before 4.0.5, and 5.x before 5.0.5 in Open Ticket Request System (OTRS) allow remote attackers to execute arbitrary SQL commands via crafted search parameters.	9.0	HIGH	AV:N/AC:L/Au:N/C:C/I:P/A:P		
CVE-2016-6401	2016-09-17T02:59:01.617	2025-04-12T10:46:40.837	Cisco Carrier Routing System (CRS) 5.1 and 5.1.4, as used in CRS Carrier Grade Services for CRS-1 and CRS-3 devices, allows remote attackers to cause a denial of service (line-card reload) via crafted IPv6-over-MPLS packets, aka Bug ID CSCva32494.	5.7	MEDIUM	AV:A/AC:M/Au:N/C:N/I:N/A:C		
CVE-2016-6407	2016-09-17T02:59:02.647	2025-04-12T10:46:40.837	Cisco AsyncOS through 9.5.0-444 on Web Security Appliance (WSA) devices allows remote attackers to cause a denial of service (link saturation) by making many HTTP requests for overlapping byte ranges simultaneously, aka Bug ID CSCuz27219.	5.0	MEDIUM	AV:N/AC:L/Au:N/C:N/I:N/A:P		
CVE-2016-6937	2016-09-17T02:59:03.663	2025-04-12T10:46:40.837	Adobe Reader and Acrobat before 11.0.17, Acrobat and Acrobat Reader DC Classic before 15.006.30198, and Acrobat and Acrobat Reader DC Continuous before 15.017.20050 on Windows and OS X allow attackers to execute arbitrary code or cause a denial of service (memory corruption) via unspecified vectors, a different vulnerability than CVE-2016-4191, CVE-2016-4192, CVE-2016-4193, CVE-2016-4194, CVE-2016-4195, CVE-2016-4196, CVE-2016-4197, CVE-2016-4198, CVE-2016-4199, CVE-2016-4200, CVE-2016-4201, CVE-2016-4202, CVE-2016-4203, CVE-2016-4204, CVE-2016-4205, CVE-2016-4206, CVE-2016-4207, CVE-2016-4208, CVE-2016-4211, CVE-2016-4212, CVE-2016-4213, CVE-2016-4214, CVE-2016-4250, CVE-2016-4251, CVE-2016-4252, CVE-2016-4254, CVE-2016-4265, CVE-2016-4266, CVE-2016-4267, CVE-2016-4268, CVE-2016-4269, and CVE-2016-4270.	10.0	HIGH	AV:N/AC:L/Au:N/C:C/I:C/A:C		
CVE-2016-6938	2016-09-17T02:59:04.617	2025-04-12T10:46:40.837	Use-after-free vulnerability in Adobe Reader and Acrobat before 11.0.17, Acrobat and Acrobat Reader DC Classic before 15.006.30198, and Acrobat and Acrobat Reader DC Continuous before 15.017.20050 on Windows and OS X allows attackers to execute arbitrary code via unspecified vectors, a different vulnerability than CVE-2016-4255.	10.0	HIGH	AV:N/AC:L/Au:N/C:C/I:C/A:C		
CVE-2016-1482	2016-09-17T21:59:00.167	2025-04-12T10:46:40.837	Cisco WebEx Meetings Server 2.6 allows remote attackers to execute arbitrary commands by injecting these commands into an application script, aka Bug ID CSCuy83130.	9.3	HIGH	AV:N/AC:M/Au:N/C:C/I:C/A:C		
CVE-2016-6644	2016-09-17T21:59:01.543	2025-04-12T10:46:40.837	EMC Documentum D2 4.5 before patch 15 and 4.6 before patch 03 allows remote attackers to read arbitrary Docbase documents by leveraging knowledge of an r_object_id value.	5.0	MEDIUM	AV:N/AC:L/Au:N/C:P/I:N/A:N		
CVE-2016-7411	2016-09-17T21:59:02.573	2025-04-12T10:46:40.837	ext/standard/var_unserializer.re in PHP before 5.6.26 mishandles object-deserialization failures, which allows remote attackers to cause a denial of service (memory corruption) or possibly have unspecified other impact via an unserialize call that references a partially constructed object.	7.5	HIGH	AV:N/AC:L/Au:N/C:P/I:P/A:P		
CVE-2016-7412	2016-09-17T21:59:03.900	2025-04-12T10:46:40.837	ext/mysqlnd/mysqlnd_wireprotocol.c in PHP before 5.6.26 and 7.x before 7.0.11 does not verify that a BIT field has the UNSIGNED_FLAG flag, which allows remote MySQL servers to cause a denial of service (heap-based buffer overflow) or possibly have unspecified other impact via crafted field metadata.	6.8	MEDIUM	AV:N/AC:M/Au:N/C:P/I:P/A:P		
CVE-2016-7413	2016-09-17T21:59:04.963	2025-04-12T10:46:40.837	Use-after-free vulnerability in the wddx_stack_destroy function in ext/wddx/wddx.c in PHP before 5.6.26 and 7.x before 7.0.11 allows remote attackers to cause a denial of service or possibly have unspecified other impact via a wddxPacket XML document that lacks an end-tag for a recordset field element, leading to mishandling in a wddx_deserialize call.	7.5	HIGH	AV:N/AC:L/Au:N/C:P/I:P/A:P		
CVE-2016-7414	2016-09-17T21:59:06.027	2025-04-12T10:46:40.837	The ZIP signature-verification feature in PHP before 5.6.26 and 7.x before 7.0.11 does not ensure that the uncompressed_filesize field is large enough, which allows remote attackers to cause a denial of service (out-of-bounds memory access) or possibly have unspecified other impact via a crafted PHAR archive, related to ext/phar/util.c and ext/phar/zip.c.	7.5	HIGH	AV:N/AC:L/Au:N/C:P/I:P/A:P		
CVE-2016-7415	2016-09-17T21:59:07.090	2025-04-12T10:46:40.837	Stack-based buffer overflow in the Locale class in common/locid.cpp in International Components for Unicode (ICU) through 57.1 for C/C++ allows remote attackers to cause a denial of service (application crash) or possibly have unspecified other impact via a long locale string.	7.5	HIGH	AV:N/AC:L/Au:N/C:P/I:P/A:P		
CVE-2016-7416	2016-09-17T21:59:08.107	2025-04-12T10:46:40.837	ext/intl/msgformat/msgformat_format.c in PHP before 5.6.26 and 7.x before 7.0.11 does not properly restrict the locale length provided to the Locale class in the ICU library, which allows remote attackers to cause a denial of service (application crash) or possibly have unspecified other impact via a MessageFormatter::formatMessage call with a long first argument.	5.0	MEDIUM	AV:N/AC:L/Au:N/C:N/I:N/A:P		
CVE-2016-7417	2016-09-17T21:59:09.573	2025-04-12T10:46:40.837	ext/spl/spl_array.c in PHP before 5.6.26 and 7.x before 7.0.11 proceeds with SplArray unserialization without validating a return value and data type, which allows remote attackers to cause a denial of service or possibly have unspecified other impact via crafted serialized data.	7.5	HIGH	AV:N/AC:L/Au:N/C:P/I:P/A:P		
CVE-2016-7418	2016-09-17T21:59:10.590	2025-04-12T10:46:40.837	The php_wddx_push_element function in ext/wddx/wddx.c in PHP before 5.6.26 and 7.x before 7.0.11 allows remote attackers to cause a denial of service (invalid pointer access and out-of-bounds read) or possibly have unspecified other impact via an incorrect boolean element in a wddxPacket XML document, leading to mishandling in a wddx_deserialize call.	5.0	MEDIUM	AV:N/AC:L/Au:N/C:N/I:N/A:P		
CVE-2016-7419	2016-09-17T21:59:11.777	2025-04-12T10:46:40.837	Cross-site scripting (XSS) vulnerability in share.js in the gallery application in ownCloud Server before 9.0.4 and Nextcloud Server before 9.0.52 allows remote authenticated users to inject arbitrary web script or HTML via a crafted directory name.	3.5	LOW	AV:N/AC:M/Au:S/C:N/I:P/A:N		
CVE-2016-0883	2016-09-18T02:59:00.150	2025-04-12T10:46:40.837	Pivotal Cloud Foundry (PCF) Ops Manager before 1.5.14 and 1.6.x before 1.6.9 uses the same cookie-encryption key across different customers' installations, which allows remote attackers to bypass session authentication by leveraging knowledge of this key from another installation.	5.0	MEDIUM	AV:N/AC:L/Au:N/C:P/I:N/A:N		
CVE-2016-0896	2016-09-18T02:59:01.637	2025-04-12T10:46:40.837	Pivotal Cloud Foundry (PCF) Elastic Runtime before 1.6.34 and 1.7.x before 1.7.12 places 169.254.0.0/16 in the all_open Application Security Group, which might allow remote attackers to bypass intended network-connectivity restrictions by leveraging access to the 169.254.169.254 address.	7.5	HIGH	AV:N/AC:L/Au:N/C:P/I:P/A:P		
CVE-2016-0897	2016-09-18T02:59:02.870	2025-04-12T10:46:40.837	Pivotal Cloud Foundry (PCF) Ops Manager before 1.6.17 and 1.7.x before 1.7.8, when vCloud or vSphere is used, does not properly enable SSH access for operators, which has unspecified impact and remote attack vectors.	7.5	HIGH	AV:N/AC:L/Au:N/C:P/I:P/A:P		
CVE-2016-0922	2016-09-18T02:59:03.963	2025-04-12T10:46:40.837	EMC ViPR SRM before 3.7.2 does not restrict the number of password-authentication attempts, which makes it easier for remote attackers to obtain access via a brute-force guessing attack.	5.0	MEDIUM	AV:N/AC:L/Au:N/C:P/I:N/A:N		
CVE-2016-0923	2016-09-18T02:59:04.980	2025-04-12T10:46:40.837	The client in EMC RSA BSAFE Micro Edition Suite (MES) 4.0.x before 4.0.9 and 4.1.x before 4.1.5 places the weakest algorithms first in a signature-algorithm list transmitted to a server, which makes it easier for remote attackers to defeat cryptographic protection mechanisms by leveraging server behavior in which the first algorithm is used.	7.5	HIGH	CVSS:3.1/AV:N/AC:L/PR:N/UI:N/S:U/C:H/I:N/A:N		
CVE-2016-0924	2016-09-18T02:59:06.010	2023-11-07T02:29:24.600	Rejected reason: DO NOT USE THIS CANDIDATE NUMBER.  ConsultIDs: CVE-2004-2761.  Reason: This candidate is subsumed by CVE-2004-2761.  Notes: All CVE users should reference CVE-2004-2761 instead of this candidate.  All references and descriptions in this candidate have been removed to prevent accidental usage					
CVE-2016-0926	2016-09-18T02:59:06.933	2025-04-12T10:46:40.837	Cross-site scripting (XSS) vulnerability in Apps Manager in Pivotal Cloud Foundry (PCF) Elastic Runtime before 1.6.32 and 1.7.x before 1.7.8 allows remote attackers to inject arbitrary web script or HTML via unspecified input that improperly interacts with the AngularJS framework.	4.3	MEDIUM	AV:N/AC:M/Au:N/C:N/I:P/A:N		
CVE-2016-0927	2016-09-18T02:59:07.947	2025-04-12T10:46:40.837	Cross-site scripting (XSS) vulnerability in Pivotal Cloud Foundry (PCF) Ops Manager before 1.6.17 allows remote attackers to inject arbitrary web script or HTML via unspecified vectors.	4.3	MEDIUM	AV:N/AC:M/Au:N/C:N/I:P/A:N		
CVE-2016-0928	2016-09-18T02:59:08.997	2025-04-12T10:46:40.837	Multiple open redirect vulnerabilities in Pivotal Cloud Foundry (PCF) Elastic Runtime before 1.6.30 and 1.7.x before 1.7.8 allow remote attackers to redirect users to arbitrary web sites and conduct phishing attacks via unspecified vectors.	5.8	MEDIUM	AV:N/AC:M/Au:N/C:P/I:P/A:N		
CVE-2016-0929	2016-09-18T02:59:09.980	2025-04-12T10:46:40.837	The metrics-collection component in RabbitMQ for Pivotal Cloud Foundry (PCF) 1.6.x before 1.6.4 logs command lines of failed commands, which might allow context-dependent attackers to obtain sensitive information by reading the log data, as demonstrated by a syslog message that contains credentials from a command line.	5.0	MEDIUM	AV:N/AC:L/Au:N/C:P/I:N/A:N		
CVE-2016-0930	2016-09-18T02:59:11.497	2025-04-12T10:46:40.837	Pivotal Cloud Foundry (PCF) Ops Manager before 1.6.19 and 1.7.x before 1.7.10, when vCloud or vSphere is used, has a default password for compilation VMs, which allows remote attackers to obtain SSH access by connecting within an installation-time period during which these VMs exist.	5.0	MEDIUM	AV:N/AC:L/Au:N/C:P/I:N/A:N		
CVE-2016-6639	2016-09-18T02:59:12.463	2025-04-12T10:46:40.837	Cloud Foundry PHP Buildpack (aka php-buildpack) before 4.3.18 and PHP Buildpack Cf-release before 242, as used in Pivotal Cloud Foundry (PCF) Elastic Runtime before 1.6.38 and 1.7.x before 1.7.19 and other products, place the .profile file in the htdocs directory, which might allow remote attackers to obtain sensitive information via an HTTP GET request for this file.	7.5	HIGH	CVSS:3.1/AV:N/AC:L/PR:N/UI:N/S:U/C:H/I:N/A:N		
CVE-2016-6641	2016-09-18T02:59:13.510	2025-04-12T10:46:40.837	Cross-site scripting (XSS) vulnerability in EMC ViPR SRM before 3.7.2 allows remote authenticated users to inject arbitrary web script or HTML via unspecified vectors.	3.5	LOW	AV:N/AC:M/Au:S/C:N/I:P/A:N		
CVE-2016-6642	2016-09-18T02:59:14.497	2025-04-12T10:46:40.837	Cross-site request forgery (CSRF) vulnerability in EMC ViPR SRM before 3.7.2 allows remote attackers to hijack the authentication of administrators for requests that upload files.	5.8	MEDIUM	AV:N/AC:M/Au:N/C:P/I:P/A:N		
CVE-2016-6643	2016-09-18T02:59:15.793	2025-04-12T10:46:40.837	Cross-site scripting (XSS) vulnerability in EMC ViPR SRM before 3.7.2 allows remote attackers to inject arbitrary web script or HTML via unspecified vectors.	4.3	MEDIUM	AV:N/AC:M/Au:N/C:N/I:P/A:N		
CVE-2016-1433	2016-09-18T22:59:00.140	2025-04-12T10:46:40.837	Cisco IOS XR 6.0 and 6.0.1 on NCS 6000 devices allows remote attackers to cause a denial of service (OSPFv3 process reload) via crafted OSPFv3 packets, aka Bug ID CSCuz66289.	5.0	MEDIUM	AV:N/AC:L/Au:N/C:N/I:N/A:P		
CVE-2016-4620	2016-09-18T22:59:01.283	2025-04-12T10:46:40.837	The Sandbox Profiles component in Apple iOS before 10 does not properly restrict access to directory metadata for SMS draft directories, which allows attackers to discover text-message recipients via a crafted app.	4.3	MEDIUM	AV:N/AC:M/Au:N/C:P/I:N/A:N		
