CVE ID	Published Date	Last Modified Date	Description	Base Score	Base Severity	Vector String	Vendor	Product
CVE-2016-6696	2016-10-10T11:00:12.777	2025-04-12T10:46:40.837	sound/soc/msm/qdsp6v2/msm-ds2-dap-config.c in a Qualcomm QDSP6v2 driver in Android before 2016-10-05 allows attackers to cause a denial of service or possibly have unspecified other impact via a large negative value for the data length, aka Qualcomm internal bug CR 1041130.	7.5	HIGH	AV:N/AC:L/Au:N/C:P/I:P/A:P		
CVE-2016-7117	2016-10-10T11:00:13.670	2025-04-12T10:46:40.837	Use-after-free vulnerability in the __sys_recvmmsg function in net/socket.c in the Linux kernel before 4.5.2 allows remote attackers to execute arbitrary code via vectors involving a recvmmsg system call that is mishandled during error processing.	9.8	CRITICAL	CVSS:3.1/AV:N/AC:L/PR:N/UI:N/S:U/C:H/I:H/A:H		
CVE-2016-5325	2016-10-10T16:59:00.200	2025-04-12T10:46:40.837	CRLF injection vulnerability in the ServerResponse#writeHead function in Node.js 0.10.x before 0.10.47, 0.12.x before 0.12.16, 4.x before 4.6.0, and 6.x before 6.7.0 allows remote attackers to inject arbitrary HTTP headers and conduct HTTP response splitting attacks via the reason argument.	4.3	MEDIUM	AV:N/AC:M/Au:N/C:N/I:P/A:N		
CVE-2016-7099	2016-10-10T16:59:01.277	2025-04-12T10:46:40.837	The tls.checkServerIdentity function in Node.js 0.10.x before 0.10.47, 0.12.x before 0.12.16, 4.x before 4.6.0, and 6.x before 6.7.0 does not properly handle wildcards in name fields of X.509 certificates, which allows man-in-the-middle attackers to spoof servers via a crafted certificate.	4.3	MEDIUM	AV:N/AC:M/Au:N/C:N/I:P/A:N		
CVE-2016-7423	2016-10-10T16:59:02.340	2025-04-12T10:46:40.837	The mptsas_process_scsi_io_request function in QEMU (aka Quick Emulator), when built with LSI SAS1068 Host Bus emulation support, allows local guest OS administrators to cause a denial of service (out-of-bounds write and QEMU process crash) via vectors involving MPTSASRequest objects.	4.4	MEDIUM	CVSS:3.1/AV:L/AC:L/PR:H/UI:N/S:U/C:N/I:N/A:H		
CVE-2016-8100	2016-10-10T16:59:03.577	2025-04-12T10:46:40.837	Intel Integrated Performance Primitives (aka IPP) Cryptography before 9.0.4 makes it easier for local users to discover RSA private keys via a side-channel attack.	2.1	LOW	AV:L/AC:L/Au:N/C:P/I:N/A:N		
CVE-2016-8101	2016-10-10T16:59:04.730	2025-04-12T10:46:40.837	The updater subsystem in Intel SSD Toolbox before 3.3.7 allows local users to gain privileges via unspecified vectors.	7.2	HIGH	AV:L/AC:L/Au:N/C:C/I:C/A:C		
CVE-2016-1000126	2016-10-10T20:59:00.173	2025-04-12T10:46:40.837	Reflected XSS in wordpress plugin admin-font-editor v1.8	4.3	MEDIUM	AV:N/AC:M/Au:N/C:N/I:P/A:N		
CVE-2016-1000127	2016-10-10T20:59:01.563	2025-04-12T10:46:40.837	Reflected XSS in wordpress plugin ajax-random-post v2.00	4.3	MEDIUM	AV:N/AC:M/Au:N/C:N/I:P/A:N		
CVE-2016-1000128	2016-10-10T20:59:03.000	2025-04-12T10:46:40.837	Reflected XSS in wordpress plugin anti-plagiarism v3.60	4.3	MEDIUM	AV:N/AC:M/Au:N/C:N/I:P/A:N		
CVE-2016-1000129	2016-10-10T20:59:04.080	2025-04-12T10:46:40.837	Reflected XSS in wordpress plugin defa-online-image-protector v3.3	4.3	MEDIUM	AV:N/AC:M/Au:N/C:N/I:P/A:N		
CVE-2016-1000130	2016-10-10T20:59:05.220	2025-04-12T10:46:40.837	Reflected XSS in wordpress plugin e-search v1.0	4.3	MEDIUM	AV:N/AC:M/Au:N/C:N/I:P/A:N		
CVE-2016-1000131	2016-10-10T20:59:06.457	2025-04-12T10:46:40.837	Reflected XSS in wordpress plugin e-search v1.0	4.3	MEDIUM	AV:N/AC:M/Au:N/C:N/I:P/A:N		
CVE-2016-1000132	2016-10-10T20:59:07.783	2025-04-12T10:46:40.837	Reflected XSS in wordpress plugin enhanced-tooltipglossary v3.2.8	4.3	MEDIUM	AV:N/AC:M/Au:N/C:N/I:P/A:N		
CVE-2016-1000133	2016-10-10T20:59:09.080	2025-04-12T10:46:40.837	Reflected XSS in wordpress plugin forget-about-shortcode-buttons v1.1.1	4.3	MEDIUM	AV:N/AC:M/Au:N/C:N/I:P/A:N		
CVE-2016-1000134	2016-10-10T20:59:10.190	2025-04-12T10:46:40.837	Reflected XSS in wordpress plugin hdw-tube v1.2	4.3	MEDIUM	AV:N/AC:M/Au:N/C:N/I:P/A:N		
CVE-2016-1000135	2016-10-10T20:59:11.313	2025-04-12T10:46:40.837	Reflected XSS in wordpress plugin hdw-tube v1.2	4.3	MEDIUM	AV:N/AC:M/Au:N/C:N/I:P/A:N		
CVE-2016-1000136	2016-10-10T20:59:12.517	2025-04-12T10:46:40.837	Reflected XSS in wordpress plugin heat-trackr v1.0	4.3	MEDIUM	AV:N/AC:M/Au:N/C:N/I:P/A:N		
CVE-2016-1000137	2016-10-10T20:59:13.550	2025-04-12T10:46:40.837	Reflected XSS in wordpress plugin hero-maps-pro v2.1.0	4.3	MEDIUM	AV:N/AC:M/Au:N/C:N/I:P/A:N		
CVE-2016-1000138	2016-10-10T20:59:14.643	2025-04-12T10:46:40.837	Reflected XSS in wordpress plugin indexisto v1.0.5	4.3	MEDIUM	AV:N/AC:M/Au:N/C:N/I:P/A:N		
CVE-2016-1000139	2016-10-10T20:59:15.753	2025-04-12T10:46:40.837	Reflected XSS in wordpress plugin infusionsoft v1.5.11	4.3	MEDIUM	AV:N/AC:M/Au:N/C:N/I:P/A:N		
CVE-2016-1000140	2016-10-10T20:59:17.003	2025-04-12T10:46:40.837	Reflected XSS in wordpress plugin new-year-firework v1.1.9	4.3	MEDIUM	AV:N/AC:M/Au:N/C:N/I:P/A:N		
CVE-2016-1000141	2016-10-10T20:59:18.097	2025-04-12T10:46:40.837	Reflected XSS in wordpress plugin page-layout-builder v1.9.3	4.3	MEDIUM	AV:N/AC:M/Au:N/C:N/I:P/A:N		
CVE-2016-1000142	2016-10-10T20:59:19.300	2025-04-12T10:46:40.837	Reflected XSS in wordpress plugin parsi-font v4.2.5	4.3	MEDIUM	AV:N/AC:M/Au:N/C:N/I:P/A:N		
CVE-2016-1000143	2016-10-10T20:59:20.470	2025-04-12T10:46:40.837	Reflected XSS in wordpress plugin photoxhibit v2.1.8	4.3	MEDIUM	AV:N/AC:M/Au:N/C:N/I:P/A:N		
CVE-2016-1000144	2016-10-10T20:59:21.957	2025-04-12T10:46:40.837	Reflected XSS in wordpress plugin photoxhibit v2.1.8	4.3	MEDIUM	AV:N/AC:M/Au:N/C:N/I:P/A:N		
CVE-2016-1000145	2016-10-10T20:59:23.067	2025-04-12T10:46:40.837	Reflected XSS in wordpress plugin pondol-carousel v1.0	4.3	MEDIUM	AV:N/AC:M/Au:N/C:N/I:P/A:N		
CVE-2016-1000146	2016-10-10T20:59:24.160	2025-04-12T10:46:40.837	Reflected XSS in wordpress plugin pondol-formmail v1.1	4.3	MEDIUM	AV:N/AC:M/Au:N/C:N/I:P/A:N		
CVE-2016-1000147	2016-10-10T20:59:25.190	2025-04-12T10:46:40.837	Reflected XSS in wordpress plugin recipes-writer v1.0.4	4.3	MEDIUM	AV:N/AC:M/Au:N/C:N/I:P/A:N		
CVE-2016-1000148	2016-10-10T20:59:26.567	2025-04-12T10:46:40.837	Reflected XSS in wordpress plugin s3-video v0.983	4.3	MEDIUM	AV:N/AC:M/Au:N/C:N/I:P/A:N		
CVE-2016-1000149	2016-10-10T20:59:27.567	2025-04-12T10:46:40.837	Reflected XSS in wordpress plugin simpel-reserveren v3.5.2	4.3	MEDIUM	AV:N/AC:M/Au:N/C:N/I:P/A:N		
CVE-2016-1000150	2016-10-10T20:59:28.643	2025-04-12T10:46:40.837	Reflected XSS in wordpress plugin simplified-content v1.0.0	4.3	MEDIUM	AV:N/AC:M/Au:N/C:N/I:P/A:N		
CVE-2016-1000151	2016-10-10T20:59:29.613	2025-04-12T10:46:40.837	Reflected XSS in wordpress plugin tera-charts v1.0	4.3	MEDIUM	AV:N/AC:M/Au:N/C:N/I:P/A:N		
CVE-2016-1000152	2016-10-10T20:59:30.673	2025-04-12T10:46:40.837	Reflected XSS in wordpress plugin tidio-form v1.0	4.3	MEDIUM	AV:N/AC:M/Au:N/C:N/I:P/A:N		
CVE-2016-1000153	2016-10-10T20:59:31.877	2025-04-12T10:46:40.837	Reflected XSS in wordpress plugin tidio-gallery v1.1	4.3	MEDIUM	AV:N/AC:M/Au:N/C:N/I:P/A:N		
CVE-2016-1000154	2016-10-10T20:59:32.940	2025-04-12T10:46:40.837	Reflected XSS in wordpress plugin whizz v1.0.7	4.3	MEDIUM	AV:N/AC:M/Au:N/C:N/I:P/A:N		
CVE-2016-1000155	2016-10-10T20:59:33.940	2025-04-12T10:46:40.837	Reflected XSS in wordpress plugin wpsolr-search-engine v7.6	4.3	MEDIUM	AV:N/AC:M/Au:N/C:N/I:P/A:N		
CVE-2016-1000216	2016-10-10T20:59:35.003	2025-04-12T10:46:40.837	Ruckus Wireless H500 web management interface authenticated command injection	9.0	HIGH	AV:N/AC:L/Au:S/C:C/I:C/A:C		
CVE-2016-7959	2016-10-13T10:59:00.143	2025-04-12T10:46:40.837	Siemens SIMATIC STEP 7 (TIA Portal) before 14 improperly stores pre-shared key data in TIA project files, which makes it easier for local users to obtain sensitive information by leveraging access to a file and conducting a brute-force attack.	1.9	LOW	AV:L/AC:M/Au:N/C:P/I:N/A:N		
CVE-2016-7960	2016-10-13T10:59:01.817	2025-04-12T10:46:40.837	Siemens SIMATIC STEP 7 (TIA Portal) before 14 uses an improper format for managing TIA project files during version updates, which makes it easier for local users to obtain sensitive configuration information via unspecified vectors.	1.9	LOW	AV:L/AC:M/Au:N/C:P/I:N/A:N		
CVE-2016-8563	2016-10-13T10:59:03.190	2025-04-12T10:46:40.837	Siemens Automation License Manager (ALM) before 5.3 SP3 Update 1 allows remote attackers to cause a denial of service (ALM service outage) via crafted packets to TCP port 4410.	5.0	MEDIUM	AV:N/AC:L/Au:N/C:N/I:N/A:P		
CVE-2016-8564	2016-10-13T10:59:04.253	2025-04-12T10:46:40.837	SQL injection vulnerability in Siemens Automation License Manager (ALM) before 5.3 SP3 Update 1 allows remote attackers to execute arbitrary SQL commands via crafted traffic to TCP port 4410.	6.4	MEDIUM	AV:N/AC:L/Au:N/C:P/I:P/A:N		
CVE-2016-8565	2016-10-13T10:59:05.613	2025-04-12T10:46:40.837	Siemens Automation License Manager (ALM) before 5.3 SP3 allows remote attackers to write to files, rename files, create directories, or delete directories via crafted packets.	6.4	MEDIUM	AV:N/AC:L/Au:N/C:N/I:P/A:P		
CVE-2016-3635	2016-10-13T14:59:00.220	2025-04-12T10:46:40.837	SAP Netweaver 7.4 allows remote authenticated users to bypass an intended Unified Connectivity (UCON) access control list and execute arbitrary Remote Function Modules (RFM) by leveraging a connection created from earlier execution of an anonymous RFM included in a Communication Assembly, aka SAP Security Note 2139366.	6.0	MEDIUM	AV:N/AC:M/Au:S/C:P/I:P/A:P		
CVE-2016-3638	2016-10-13T14:59:03.690	2025-04-12T10:46:40.837	SAP SLD Registration Program (aka SLDREG) allows local users to cause a denial of service (memory corruption and process termination) via a crafted HOST parameter, aka SAP Security Note 2125623.	2.1	LOW	AV:L/AC:L/Au:N/C:N/I:N/A:P		
CVE-2016-3946	2016-10-13T14:59:05.033	2025-04-12T10:46:40.837	SAP Console (aka SAPConsole) 7.30 allows local users to discover SAP Server login credentials by reading the Windows registry, aka SAP Security Note 2121461.	4.6	MEDIUM	AV:L/AC:L/Au:N/C:P/I:P/A:P		
CVE-2016-4407	2016-10-13T14:59:06.190	2025-04-12T10:46:40.837	The DSA algorithm implementation in SAP SAPCRYPTOLIB 5.555.38 does not properly check signatures, which allows remote authenticated users to impersonate arbitrary users via unspecified vectors, aka SAP Security Note 2223008.	4.0	MEDIUM	AV:N/AC:L/Au:S/C:N/I:P/A:N		
CVE-2016-5425	2016-10-13T14:59:07.517	2025-04-12T10:46:40.837	The Tomcat package on Red Hat Enterprise Linux (RHEL) 7, Fedora, CentOS, Oracle Linux, and possibly other Linux distributions uses weak permissions for /usr/lib/tmpfiles.d/tomcat.conf, which allows local users to gain root privileges by leveraging membership in the tomcat group.	7.8	HIGH	CVSS:3.1/AV:L/AC:L/PR:L/UI:N/S:U/C:H/I:H/A:H		
CVE-2016-6325	2016-10-13T14:59:09.127	2025-04-12T10:46:40.837	The Tomcat package on Red Hat Enterprise Linux (RHEL) 5 through 7, JBoss Web Server 3.0, and JBoss EWS 2 uses weak permissions for (1) /etc/sysconfig/tomcat and (2) /etc/tomcat/tomcat.conf, which allows local users to gain privileges by leveraging membership in the tomcat group.	7.2	HIGH	AV:L/AC:L/Au:N/C:C/I:C/A:C		
CVE-2016-7065	2016-10-13T14:59:11.080	2025-04-12T10:46:40.837	The JMX servlet in Red Hat JBoss Enterprise Application Platform (EAP) 4 and 5 allows remote authenticated users to cause a denial of service and possibly execute arbitrary code via a crafted serialized Java object.	6.5	MEDIUM	AV:N/AC:L/Au:S/C:P/I:P/A:P		
CVE-2016-7437	2016-10-13T14:59:12.237	2025-04-12T10:46:40.837	SAP Netweaver 7.40 improperly logs (1) DUI and (2) DUJ events in the SAP Security Audit Log as non-critical, which might allow local users to hide rejected attempts to execute RFC function callbacks by leveraging filtering of non-critical events in audit analysis reports, aka SAP Security Note 2252312.	2.1	LOW	AV:L/AC:L/Au:N/C:N/I:P/A:N		
CVE-2016-7795	2016-10-13T14:59:13.473	2025-04-12T10:46:40.837	The manager_invoke_notify_message function in systemd 231 and earlier allows local users to cause a denial of service (assertion failure and PID 1 hang) via a zero-length message received over a notify socket.	4.9	MEDIUM	AV:L/AC:L/Au:N/C:N/I:N/A:C		
CVE-2016-7796	2016-10-13T14:59:14.567	2025-04-12T10:46:40.837	The manager_dispatch_notify_fd function in systemd allows local users to cause a denial of service (system hang) via a zero-length message received over a notify socket, which causes an error to be returned and the notification handler to be disabled.	4.9	MEDIUM	AV:L/AC:L/Au:N/C:N/I:N/A:C		
CVE-2016-1089	2016-10-13T19:59:00.267	2025-04-12T10:46:40.837	Use-after-free vulnerability in Adobe Reader and Acrobat before 11.0.18, Acrobat and Acrobat Reader DC Classic before 15.006.30243, and Acrobat and Acrobat Reader DC Continuous before 15.020.20039 on Windows and OS X allows attackers to execute arbitrary code via unspecified vectors, a different vulnerability than CVE-2016-1091, CVE-2016-6944, CVE-2016-6945, CVE-2016-6946, CVE-2016-6949, CVE-2016-6952, CVE-2016-6953, CVE-2016-6961, CVE-2016-6962, CVE-2016-6963, CVE-2016-6964, CVE-2016-6965, CVE-2016-6967, CVE-2016-6968, CVE-2016-6969, CVE-2016-6971, CVE-2016-6979, CVE-2016-6988, and CVE-2016-6993.	10.0	HIGH	AV:N/AC:L/Au:N/C:C/I:C/A:C		
CVE-2016-1091	2016-10-13T19:59:03.540	2025-04-12T10:46:40.837	Use-after-free vulnerability in Adobe Reader and Acrobat before 11.0.18, Acrobat and Acrobat Reader DC Classic before 15.006.30243, and Acrobat and Acrobat Reader DC Continuous before 15.020.20039 on Windows and OS X allows attackers to execute arbitrary code via unspecified vectors, a different vulnerability than CVE-2016-1089, CVE-2016-6944, CVE-2016-6945, CVE-2016-6946, CVE-2016-6949, CVE-2016-6952, CVE-2016-6953, CVE-2016-6961, CVE-2016-6962, CVE-2016-6963, CVE-2016-6964, CVE-2016-6965, CVE-2016-6967, CVE-2016-6968, CVE-2016-6969, CVE-2016-6971, CVE-2016-6979, CVE-2016-6988, and CVE-2016-6993.	10.0	HIGH	AV:N/AC:L/Au:N/C:C/I:C/A:C		
CVE-2016-4273	2016-10-13T19:59:04.483	2025-04-12T10:46:40.837	Adobe Flash Player before 18.0.0.382 and 19.x through 23.x before 23.0.0.185 on Windows and OS X and before 11.2.202.637 on Linux allows attackers to execute arbitrary code or cause a denial of service (memory corruption) via unspecified vectors, a different vulnerability than CVE-2016-6982, CVE-2016-6983, CVE-2016-6984, CVE-2016-6985, CVE-2016-6986, CVE-2016-6989, and CVE-2016-6990.	8.8	HIGH	CVSS:3.1/AV:N/AC:L/PR:N/UI:R/S:U/C:H/I:H/A:H		
CVE-2016-4286	2016-10-13T19:59:05.473	2025-04-12T10:46:40.837	Adobe Flash Player before 18.0.0.382 and 19.x through 23.x before 23.0.0.185 on Windows and OS X and before 11.2.202.637 on Linux allows attackers to bypass intended access restrictions via unspecified vectors.	9.3	HIGH	AV:N/AC:M/Au:N/C:C/I:C/A:C		
CVE-2016-6935	2016-10-13T19:59:06.477	2025-04-12T10:46:40.837	Unquoted Windows search path vulnerability in Adobe Creative Cloud Desktop Application before 3.8.0.310 on Windows allows local users to gain privileges via a Trojan horse executable file in the %SYSTEMDRIVE% directory.	7.2	HIGH	AV:L/AC:L/Au:N/C:C/I:C/A:C		
CVE-2016-6939	2016-10-13T19:59:07.467	2025-04-12T10:46:40.837	Heap-based buffer overflow in Adobe Reader and Acrobat before 11.0.18, Acrobat and Acrobat Reader DC Classic before 15.006.30243, and Acrobat and Acrobat Reader DC Continuous before 15.020.20039 on Windows and OS X allows attackers to execute arbitrary code via unspecified vectors, a different vulnerability than CVE-2016-6994.	10.0	HIGH	AV:N/AC:L/Au:N/C:C/I:C/A:C		
CVE-2016-6940	2016-10-13T19:59:08.517	2025-04-12T10:46:40.837	Adobe Reader and Acrobat before 11.0.18, Acrobat and Acrobat Reader DC Classic before 15.006.30243, and Acrobat and Acrobat Reader DC Continuous before 15.020.20039 on Windows and OS X allow attackers to execute arbitrary code or cause a denial of service (memory corruption) via unspecified vectors, a different vulnerability than CVE-2016-6941, CVE-2016-6942, CVE-2016-6943, CVE-2016-6947, CVE-2016-6948, CVE-2016-6950, CVE-2016-6951, CVE-2016-6954, CVE-2016-6955, CVE-2016-6956, CVE-2016-6959, CVE-2016-6960, CVE-2016-6966, CVE-2016-6970, CVE-2016-6972, CVE-2016-6973, CVE-2016-6974, CVE-2016-6975, CVE-2016-6976, CVE-2016-6977, CVE-2016-6978, CVE-2016-6995, CVE-2016-6996, CVE-2016-6997, CVE-2016-6998, CVE-2016-7000, CVE-2016-7001, CVE-2016-7002, CVE-2016-7003, CVE-2016-7004, CVE-2016-7005, CVE-2016-7006, CVE-2016-7007, CVE-2016-7008, CVE-2016-7009, CVE-2016-7010, CVE-2016-7011, CVE-2016-7012, CVE-2016-7013, CVE-2016-7014, CVE-2016-7015, CVE-2016-7016, CVE-2016-7017, CVE-2016-7018, and CVE-2016-7019.	10.0	HIGH	AV:N/AC:L/Au:N/C:C/I:C/A:C		
CVE-2016-6941	2016-10-13T19:59:09.580	2025-04-12T10:46:40.837	Adobe Reader and Acrobat before 11.0.18, Acrobat and Acrobat Reader DC Classic before 15.006.30243, and Acrobat and Acrobat Reader DC Continuous before 15.020.20039 on Windows and OS X allow attackers to execute arbitrary code or cause a denial of service (memory corruption) via unspecified vectors, a different vulnerability than CVE-2016-6940, CVE-2016-6942, CVE-2016-6943, CVE-2016-6947, CVE-2016-6948, CVE-2016-6950, CVE-2016-6951, CVE-2016-6954, CVE-2016-6955, CVE-2016-6956, CVE-2016-6959, CVE-2016-6960, CVE-2016-6966, CVE-2016-6970, CVE-2016-6972, CVE-2016-6973, CVE-2016-6974, CVE-2016-6975, CVE-2016-6976, CVE-2016-6977, CVE-2016-6978, CVE-2016-6995, CVE-2016-6996, CVE-2016-6997, CVE-2016-6998, CVE-2016-7000, CVE-2016-7001, CVE-2016-7002, CVE-2016-7003, CVE-2016-7004, CVE-2016-7005, CVE-2016-7006, CVE-2016-7007, CVE-2016-7008, CVE-2016-7009, CVE-2016-7010, CVE-2016-7011, CVE-2016-7012, CVE-2016-7013, CVE-2016-7014, CVE-2016-7015, CVE-2016-7016, CVE-2016-7017, CVE-2016-7018, and CVE-2016-7019.	10.0	HIGH	AV:N/AC:L/Au:N/C:C/I:C/A:C		
CVE-2016-6942	2016-10-13T19:59:11.033	2025-04-12T10:46:40.837	Adobe Reader and Acrobat before 11.0.18, Acrobat and Acrobat Reader DC Classic before 15.006.30243, and Acrobat and Acrobat Reader DC Continuous before 15.020.20039 on Windows and OS X allow attackers to execute arbitrary code or cause a denial of service (memory corruption) via unspecified vectors, a different vulnerability than CVE-2016-6940, CVE-2016-6941, CVE-2016-6943, CVE-2016-6947, CVE-2016-6948, CVE-2016-6950, CVE-2016-6951, CVE-2016-6954, CVE-2016-6955, CVE-2016-6956, CVE-2016-6959, CVE-2016-6960, CVE-2016-6966, CVE-2016-6970, CVE-2016-6972, CVE-2016-6973, CVE-2016-6974, CVE-2016-6975, CVE-2016-6976, CVE-2016-6977, CVE-2016-6978, CVE-2016-6995, CVE-2016-6996, CVE-2016-6997, CVE-2016-6998, CVE-2016-7000, CVE-2016-7001, CVE-2016-7002, CVE-2016-7003, CVE-2016-7004, CVE-2016-7005, CVE-2016-7006, CVE-2016-7007, CVE-2016-7008, CVE-2016-7009, CVE-2016-7010, CVE-2016-7011, CVE-2016-7012, CVE-2016-7013, CVE-2016-7014, CVE-2016-7015, CVE-2016-7016, CVE-2016-7017, CVE-2016-7018, and CVE-2016-7019.	10.0	HIGH	AV:N/AC:L/Au:N/C:C/I:C/A:C		
CVE-2016-6943	2016-10-13T19:59:12.100	2025-04-12T10:46:40.837	Adobe Reader and Acrobat before 11.0.18, Acrobat and Acrobat Reader DC Classic before 15.006.30243, and Acrobat and Acrobat Reader DC Continuous before 15.020.20039 on Windows and OS X allow attackers to execute arbitrary code or cause a denial of service (memory corruption) via unspecified vectors, a different vulnerability than CVE-2016-6940, CVE-2016-6941, CVE-2016-6942, CVE-2016-6947, CVE-2016-6948, CVE-2016-6950, CVE-2016-6951, CVE-2016-6954, CVE-2016-6955, CVE-2016-6956, CVE-2016-6959, CVE-2016-6960, CVE-2016-6966, CVE-2016-6970, CVE-2016-6972, CVE-2016-6973, CVE-2016-6974, CVE-2016-6975, CVE-2016-6976, CVE-2016-6977, CVE-2016-6978, CVE-2016-6995, CVE-2016-6996, CVE-2016-6997, CVE-2016-6998, CVE-2016-7000, CVE-2016-7001, CVE-2016-7002, CVE-2016-7003, CVE-2016-7004, CVE-2016-7005, CVE-2016-7006, CVE-2016-7007, CVE-2016-7008, CVE-2016-7009, CVE-2016-7010, CVE-2016-7011, CVE-2016-7012, CVE-2016-7013, CVE-2016-7014, CVE-2016-7015, CVE-2016-7016, CVE-2016-7017, CVE-2016-7018, and CVE-2016-7019.	10.0	HIGH	AV:N/AC:L/Au:N/C:C/I:C/A:C		
CVE-2016-6944	2016-10-13T19:59:13.290	2025-04-12T10:46:40.837	Use-after-free vulnerability in Adobe Reader and Acrobat before 11.0.18, Acrobat and Acrobat Reader DC Classic before 15.006.30243, and Acrobat and Acrobat Reader DC Continuous before 15.020.20039 on Windows and OS X allows attackers to execute arbitrary code via unspecified vectors, a different vulnerability than CVE-2016-1089, CVE-2016-1091, CVE-2016-6945, CVE-2016-6946, CVE-2016-6949, CVE-2016-6952, CVE-2016-6953, CVE-2016-6961, CVE-2016-6962, CVE-2016-6963, CVE-2016-6964, CVE-2016-6965, CVE-2016-6967, CVE-2016-6968, CVE-2016-6969, CVE-2016-6971, CVE-2016-6979, CVE-2016-6988, and CVE-2016-6993.	10.0	HIGH	AV:N/AC:L/Au:N/C:C/I:C/A:C		
CVE-2016-6945	2016-10-13T19:59:14.230	2025-04-12T10:46:40.837	Use-after-free vulnerability in Adobe Reader and Acrobat before 11.0.18, Acrobat and Acrobat Reader DC Classic before 15.006.30243, and Acrobat and Acrobat Reader DC Continuous before 15.020.20039 on Windows and OS X allows attackers to execute arbitrary code via unspecified vectors, a different vulnerability than CVE-2016-1089, CVE-2016-1091, CVE-2016-6944, CVE-2016-6946, CVE-2016-6949, CVE-2016-6952, CVE-2016-6953, CVE-2016-6961, CVE-2016-6962, CVE-2016-6963, CVE-2016-6964, CVE-2016-6965, CVE-2016-6967, CVE-2016-6968, CVE-2016-6969, CVE-2016-6971, CVE-2016-6979, CVE-2016-6988, and CVE-2016-6993.	10.0	HIGH	AV:N/AC:L/Au:N/C:C/I:C/A:C		
CVE-2016-6946	2016-10-13T19:59:15.157	2025-04-12T10:46:40.837	Use-after-free vulnerability in Adobe Reader and Acrobat before 11.0.18, Acrobat and Acrobat Reader DC Classic before 15.006.30243, and Acrobat and Acrobat Reader DC Continuous before 15.020.20039 on Windows and OS X allows attackers to execute arbitrary code via unspecified vectors, a different vulnerability than CVE-2016-1089, CVE-2016-1091, CVE-2016-6944, CVE-2016-6945, CVE-2016-6949, CVE-2016-6952, CVE-2016-6953, CVE-2016-6961, CVE-2016-6962, CVE-2016-6963, CVE-2016-6964, CVE-2016-6965, CVE-2016-6967, CVE-2016-6968, CVE-2016-6969, CVE-2016-6971, CVE-2016-6979, CVE-2016-6988, and CVE-2016-6993.	10.0	HIGH	AV:N/AC:L/Au:N/C:C/I:C/A:C		
CVE-2016-6947	2016-10-13T19:59:17.630	2025-04-12T10:46:40.837	Adobe Reader and Acrobat before 11.0.18, Acrobat and Acrobat Reader DC Classic before 15.006.30243, and Acrobat and Acrobat Reader DC Continuous before 15.020.20039 on Windows and OS X allow attackers to execute arbitrary code or cause a denial of service (memory corruption) via unspecified vectors, a different vulnerability than CVE-2016-6940, CVE-2016-6941, CVE-2016-6942, CVE-2016-6943, CVE-2016-6948, CVE-2016-6950, CVE-2016-6951, CVE-2016-6954, CVE-2016-6955, CVE-2016-6956, CVE-2016-6959, CVE-2016-6960, CVE-2016-6966, CVE-2016-6970, CVE-2016-6972, CVE-2016-6973, CVE-2016-6974, CVE-2016-6975, CVE-2016-6976, CVE-2016-6977, CVE-2016-6978, CVE-2016-6995, CVE-2016-6996, CVE-2016-6997, CVE-2016-6998, CVE-2016-7000, CVE-2016-7001, CVE-2016-7002, CVE-2016-7003, CVE-2016-7004, CVE-2016-7005, CVE-2016-7006, CVE-2016-7007, CVE-2016-7008, CVE-2016-7009, CVE-2016-7010, CVE-2016-7011, CVE-2016-7012, CVE-2016-7013, CVE-2016-7014, CVE-2016-7015, CVE-2016-7016, CVE-2016-7017, CVE-2016-7018, and CVE-2016-7019.	10.0	HIGH	AV:N/AC:L/Au:N/C:C/I:C/A:C		
CVE-2016-6948	2016-10-13T19:59:18.617	2025-04-12T10:46:40.837	Adobe Reader and Acrobat before 11.0.18, Acrobat and Acrobat Reader DC Classic before 15.006.30243, and Acrobat and Acrobat Reader DC Continuous before 15.020.20039 on Windows and OS X allow attackers to execute arbitrary code or cause a denial of service (memory corruption) via unspecified vectors, a different vulnerability than CVE-2016-6940, CVE-2016-6941, CVE-2016-6942, CVE-2016-6943, CVE-2016-6947, CVE-2016-6950, CVE-2016-6951, CVE-2016-6954, CVE-2016-6955, CVE-2016-6956, CVE-2016-6959, CVE-2016-6960, CVE-2016-6966, CVE-2016-6970, CVE-2016-6972, CVE-2016-6973, CVE-2016-6974, CVE-2016-6975, CVE-2016-6976, CVE-2016-6977, CVE-2016-6978, CVE-2016-6995, CVE-2016-6996, CVE-2016-6997, CVE-2016-6998, CVE-2016-7000, CVE-2016-7001, CVE-2016-7002, CVE-2016-7003, CVE-2016-7004, CVE-2016-7005, CVE-2016-7006, CVE-2016-7007, CVE-2016-7008, CVE-2016-7009, CVE-2016-7010, CVE-2016-7011, CVE-2016-7012, CVE-2016-7013, CVE-2016-7014, CVE-2016-7015, CVE-2016-7016, CVE-2016-7017, CVE-2016-7018, and CVE-2016-7019.	10.0	HIGH	AV:N/AC:L/Au:N/C:C/I:C/A:C		
CVE-2016-6949	2016-10-13T19:59:19.530	2025-04-12T10:46:40.837	Use-after-free vulnerability in Adobe Reader and Acrobat before 11.0.18, Acrobat and Acrobat Reader DC Classic before 15.006.30243, and Acrobat and Acrobat Reader DC Continuous before 15.020.20039 on Windows and OS X allows attackers to execute arbitrary code via unspecified vectors, a different vulnerability than CVE-2016-1089, CVE-2016-1091, CVE-2016-6944, CVE-2016-6945, CVE-2016-6946, CVE-2016-6952, CVE-2016-6953, CVE-2016-6961, CVE-2016-6962, CVE-2016-6963, CVE-2016-6964, CVE-2016-6965, CVE-2016-6967, CVE-2016-6968, CVE-2016-6969, CVE-2016-6971, CVE-2016-6979, CVE-2016-6988, and CVE-2016-6993.	10.0	HIGH	AV:N/AC:L/Au:N/C:C/I:C/A:C		
