CVE ID	Published Date	Last Modified Date	Description	Base Score	Base Severity	Vector String	Vendor	Product
CVE-2016-2183	2016-09-01T00:59:00.137	2025-04-12T10:46:40.837	"The DES and Triple DES ciphers, as used in the TLS, SSH, and IPSec protocols and other protocols and products, have a birthday bound of approximately four billion blocks, which makes it easier for remote attackers to obtain cleartext data via a birthday attack against a long-duration encrypted session, as demonstrated by an HTTPS session using Triple DES in CBC mode, aka a ""Sweet32"" attack."	7.5	HIGH	CVSS:3.1/AV:N/AC:L/PR:N/UI:N/S:U/C:H/I:N/A:N		
CVE-2016-0293	2016-09-01T01:59:01.177	2025-04-12T10:46:40.837	Cross-site scripting (XSS) vulnerability in IBM BigFix Platform (formerly Tivoli Endpoint Manager) 9.x before 9.1.8 and 9.2.x before 9.2.8 allows remote attackers to inject arbitrary web script or HTML via a modified .beswrpt file.	4.3	MEDIUM	AV:N/AC:M/Au:N/C:N/I:P/A:N		
CVE-2016-0370	2016-09-01T01:59:02.193	2025-04-12T10:46:40.837	Cross-site scripting (XSS) vulnerability in IBM Forms Experience Builder 8.5.x and 8.6.x before 8.6.3 allows remote authenticated users to inject arbitrary web script or HTML via crafted input to an application that was built with this product.	3.5	LOW	AV:N/AC:M/Au:S/C:N/I:P/A:N		
CVE-2016-3064	2016-09-01T01:59:05.727	2025-04-12T10:46:40.837	NetApp Clustered Data ONTAP before 8.2.4P4 and 8.3.x before 8.3.2P2 allows remote authenticated users to obtain sensitive cluster and tenant information via unspecified vectors.	4.0	MEDIUM	AV:N/AC:L/Au:S/C:P/I:N/A:N		
CVE-2016-0385	2016-09-01T10:59:00.140	2025-04-12T10:46:40.837	Buffer overflow in IBM WebSphere Application Server (WAS) 7.0 before 7.0.0.43, 8.0 before 8.0.0.13, 8.5 before 8.5.5.10, 9.0 before 9.0.0.1, and Liberty before 16.0.0.3, when HttpSessionIdReuse is enabled, allows remote authenticated users to obtain sensitive information via unspecified vectors.	3.5	LOW	AV:N/AC:M/Au:S/C:P/I:N/A:N		
CVE-2016-2954	2016-09-01T10:59:01.343	2025-04-12T10:46:40.837	Cross-site scripting (XSS) vulnerability in the Web UI in IBM Connections 5.0 before CR4 and 5.5 before CR1 allows remote authenticated users to inject arbitrary web script or HTML via unspecified vectors, a different vulnerability than CVE-2016-2956 and CVE-2016-3008.	3.5	LOW	AV:N/AC:M/Au:S/C:N/I:P/A:N		
CVE-2016-2956	2016-09-01T10:59:02.607	2025-04-12T10:46:40.837	Cross-site scripting (XSS) vulnerability in the Web UI in IBM Connections 5.0 before CR4 and 5.5 before CR1 allows remote authenticated users to inject arbitrary web script or HTML via unspecified vectors, a different vulnerability than CVE-2016-2954 and CVE-2016-3008.	3.5	LOW	AV:N/AC:M/Au:S/C:N/I:P/A:N		
CVE-2016-2995	2016-09-01T10:59:03.920	2025-04-12T10:46:40.837	Cross-site scripting (XSS) vulnerability in the Web UI in IBM Connections 4.0 through CR4, 4.5 through CR5, 5.0 before CR4, and 5.5 before CR1 allows remote authenticated users to inject arbitrary web script or HTML via unspecified vectors, a different vulnerability than CVE-2016-2997, CVE-2016-3005, and CVE-2016-3010.	3.5	LOW	AV:N/AC:M/Au:S/C:N/I:P/A:N		
CVE-2016-2997	2016-09-01T10:59:05.123	2025-04-12T10:46:40.837	Cross-site scripting (XSS) vulnerability in the Web UI in IBM Connections 4.0 through CR4, 4.5 through CR5, 5.0 before CR4, and 5.5 before CR1 allows remote authenticated users to inject arbitrary web script or HTML via unspecified vectors, a different vulnerability than CVE-2016-2995, CVE-2016-3005, and CVE-2016-3010.	3.5	LOW	AV:N/AC:M/Au:S/C:N/I:P/A:N		
CVE-2016-2998	2016-09-01T10:59:06.123	2025-04-12T10:46:40.837	Cross-site request forgery (CSRF) vulnerability in IBM Connections 4.0 through CR4, 4.5 through CR5, 5.0 before CR4, and 5.5 before CR1 allows remote authenticated users to hijack the authentication of arbitrary users for requests that update data.	3.5	LOW	AV:N/AC:M/Au:S/C:N/I:P/A:N		
CVE-2016-3005	2016-09-01T10:59:07.123	2025-04-12T10:46:40.837	Cross-site scripting (XSS) vulnerability in the Web UI in IBM Connections 4.0 through CR4, 4.5 through CR5, 5.0 before CR4, and 5.5 before CR1 allows remote authenticated users to inject arbitrary web script or HTML via unspecified vectors, a different vulnerability than CVE-2016-2995, CVE-2016-2997, and CVE-2016-3010.	3.5	LOW	AV:N/AC:M/Au:S/C:N/I:P/A:N		
CVE-2016-3008	2016-09-01T10:59:08.217	2025-04-12T10:46:40.837	Cross-site scripting (XSS) vulnerability in the Web UI in IBM Connections 5.0 before CR4 and 5.5 before CR1 allows remote authenticated users to inject arbitrary web script or HTML via unspecified vectors, a different vulnerability than CVE-2016-2954 and CVE-2016-2956.	3.5	LOW	AV:N/AC:M/Au:S/C:N/I:P/A:N		
CVE-2016-3010	2016-09-01T10:59:09.343	2025-04-12T10:46:40.837	Cross-site scripting (XSS) vulnerability in the Web UI in IBM Connections 4.0 through CR4, 4.5 through CR5, 5.0 before CR4, and 5.5 before CR1 allows remote authenticated users to inject arbitrary web script or HTML via unspecified vectors, a different vulnerability than CVE-2016-2995, CVE-2016-2997, and CVE-2016-3005.	3.5	LOW	AV:N/AC:M/Au:S/C:N/I:P/A:N		
CVE-2016-5047	2016-09-01T10:59:10.407	2025-04-12T10:46:40.837	NetApp OnCommand System Manager 8.3.x before 8.3.2P5 allows remote authenticated users to cause a denial of service via unspecified vectors.	4.0	MEDIUM	AV:N/AC:L/Au:S/C:N/I:N/A:P		
CVE-2016-4264	2016-09-01T23:59:00.130	2025-04-12T10:46:40.837	The Office Open XML (OOXML) feature in Adobe ColdFusion 10 before Update 21 and 11 before Update 10 allows remote attackers to read arbitrary files or send TCP requests to intranet servers via a crafted OOXML spreadsheet containing an external entity declaration in conjunction with an entity reference, related to an XML External Entity (XXE) issue.	6.4	MEDIUM	AV:N/AC:L/Au:N/C:P/I:P/A:N		
CVE-2016-6298	2016-09-01T23:59:01.160	2025-04-12T10:46:40.837	The _Rsa15 class in the RSA 1.5 algorithm implementation in jwa.py in jwcrypto before 0.3.2 lacks the Random Filling protection mechanism, which makes it easier for remote attackers to obtain cleartext data via a Million Message Attack (MMA).	5.3	MEDIUM	CVSS:3.1/AV:N/AC:H/PR:L/UI:N/S:U/C:H/I:N/A:N		
CVE-2016-1470	2016-09-02T00:59:00.137	2025-04-12T10:46:40.837	Cross-site request forgery (CSRF) vulnerability in the web-based management interface on Cisco Small Business 220 devices with firmware before 1.0.1.1 allows remote attackers to hijack the authentication of arbitrary users, aka Bug ID CSCuz76230.	6.8	MEDIUM	AV:N/AC:M/Au:N/C:P/I:P/A:P		
CVE-2016-1471	2016-09-02T00:59:01.310	2025-04-12T10:46:40.837	Cross-site scripting (XSS) vulnerability in the web-based management interface on Cisco Small Business 220 devices with firmware before 1.0.1.1 allows remote attackers to inject arbitrary web script or HTML via a crafted URL, aka Bug ID CSCuz76232.	4.3	MEDIUM	AV:N/AC:M/Au:N/C:N/I:P/A:N		
CVE-2016-1472	2016-09-02T00:59:02.403	2025-04-12T10:46:40.837	The web-based management interface on Cisco Small Business 220 devices with firmware before 1.0.1.1 allows remote attackers to cause a denial of service (interface outage) via a crafted HTTP request, aka Bug ID CSCuz76238.	5.0	MEDIUM	AV:N/AC:L/Au:N/C:N/I:N/A:P		
CVE-2016-1473	2016-09-02T00:59:03.497	2025-04-12T10:46:40.837	Cisco Small Business 220 devices with firmware before 1.0.1.1 have a hardcoded SNMP community, which allows remote attackers to read or modify SNMP objects by leveraging knowledge of this community, aka Bug ID CSCuz76216.	10.0	HIGH	AV:N/AC:L/Au:N/C:C/I:C/A:C		
CVE-2016-6376	2016-09-02T00:59:04.420	2025-04-12T10:46:40.837	The Adaptive Wireless Intrusion Prevention System (wIPS) feature on Cisco Wireless LAN Controller (WLC) devices before 8.0.140.0, 8.1.x and 8.2.x before 8.2.121.0, and 8.3.x before 8.3.102.0 allows remote attackers to cause a denial of service (device restart) via a malformed wIPS packet, aka Bug ID CSCuz40263.	6.1	MEDIUM	AV:A/AC:L/Au:N/C:N/I:N/A:C		
CVE-2016-4848	2016-09-02T01:59:00.133	2025-04-12T10:46:40.837	Cross-site scripting (XSS) vulnerability in ClipBucket before 2.8.1 RC2 allows remote attackers to inject arbitrary web script or HTML via unspecified vectors.	4.3	MEDIUM	AV:N/AC:M/Au:N/C:N/I:P/A:N		
CVE-2016-4851	2016-09-02T01:59:01.320	2025-04-12T10:46:40.837	Cross-site scripting (XSS) vulnerability in Let's PHP! simple chat before 2016-08-15 allows remote attackers to inject arbitrary web script or HTML via unspecified vectors.	4.3	MEDIUM	AV:N/AC:M/Au:N/C:N/I:P/A:N		
CVE-2016-4853	2016-09-02T01:59:02.507	2025-04-12T10:46:40.837	AKABEi SOFT2 games allow remote attackers to execute arbitrary OS commands via crafted saved data, as demonstrated by Happy Wardrobe.	6.8	MEDIUM	AV:N/AC:M/Au:N/C:P/I:P/A:P		
CVE-2016-6483	2016-09-02T01:59:03.600	2025-04-12T10:46:40.837	The media-file upload feature in vBulletin before 3.8.7 Patch Level 6, 3.8.8 before Patch Level 2, 3.8.9 before Patch Level 1, 4.x before 4.2.2 Patch Level 6, 4.2.3 before Patch Level 2, 5.x before 5.2.0 Patch Level 3, 5.2.1 before Patch Level 1, and 5.2.2 before Patch Level 1 allows remote attackers to conduct SSRF attacks via a crafted URL that results in a Redirection HTTP status code.	5.0	MEDIUM	AV:N/AC:L/Au:N/C:N/I:P/A:N		
CVE-2016-0772	2016-09-02T14:59:00.127	2025-04-12T10:46:40.837	"The smtplib library in CPython (aka Python) before 2.7.12, 3.x before 3.4.5, and 3.5.x before 3.5.2 does not return an error when StartTLS fails, which might allow man-in-the-middle attackers to bypass the TLS protections by leveraging a network position between the client and the registry to block the StartTLS command, aka a ""StartTLS stripping attack."""	5.8	MEDIUM	AV:N/AC:M/Au:N/C:P/I:P/A:N		
CVE-2016-4952	2016-09-02T14:59:01.330	2025-04-12T10:46:40.837	QEMU (aka Quick Emulator), when built with VMWARE PVSCSI paravirtual SCSI bus emulation support, allows local guest OS administrators to cause a denial of service (out-of-bounds array access) via vectors related to the (1) PVSCSI_CMD_SETUP_RINGS or (2) PVSCSI_CMD_SETUP_MSG_RING SCSI command.	6.0	MEDIUM	CVSS:3.1/AV:L/AC:L/PR:H/UI:N/S:C/C:N/I:N/A:H		
CVE-2016-5105	2016-09-02T14:59:02.503	2025-04-12T10:46:40.837	The megasas_dcmd_cfg_read function in hw/scsi/megasas.c in QEMU, when built with MegaRAID SAS 8708EM2 Host Bus Adapter emulation support, uses an uninitialized variable, which allows local guest administrators to read host memory via vectors involving a MegaRAID Firmware Interface (MFI) command.	4.4	MEDIUM	CVSS:3.1/AV:L/AC:L/PR:H/UI:N/S:U/C:H/I:N/A:N		
CVE-2016-5106	2016-09-02T14:59:03.597	2025-04-12T10:46:40.837	The megasas_dcmd_set_properties function in hw/scsi/megasas.c in QEMU, when built with MegaRAID SAS 8708EM2 Host Bus Adapter emulation support, allows local guest administrators to cause a denial of service (out-of-bounds write access) via vectors involving a MegaRAID Firmware Interface (MFI) command.	6.0	MEDIUM	CVSS:3.1/AV:L/AC:L/PR:H/UI:N/S:C/C:N/I:N/A:H		
CVE-2016-5107	2016-09-02T14:59:04.877	2025-04-12T10:46:40.837	The megasas_lookup_frame function in QEMU, when built with MegaRAID SAS 8708EM2 Host Bus Adapter emulation support, allows local guest OS administrators to cause a denial of service (out-of-bounds read and crash) via unspecified vectors.	6.0	MEDIUM	CVSS:3.1/AV:L/AC:L/PR:H/UI:N/S:C/C:N/I:N/A:H		
CVE-2016-5636	2016-09-02T14:59:06.003	2025-04-12T10:46:40.837	Integer overflow in the get_data function in zipimport.c in CPython (aka Python) before 2.7.12, 3.x before 3.4.5, and 3.5.x before 3.5.2 allows remote attackers to have unspecified impact via a negative data size value, which triggers a heap-based buffer overflow.	10.0	HIGH	AV:N/AC:L/Au:N/C:C/I:C/A:C		
CVE-2016-5699	2016-09-02T14:59:07.003	2025-04-12T10:46:40.837	CRLF injection vulnerability in the HTTPConnection.putheader function in urllib2 and urllib in CPython (aka Python) before 2.7.10 and 3.x before 3.4.4 allows remote attackers to inject arbitrary HTTP headers via CRLF sequences in a URL.	4.3	MEDIUM	AV:N/AC:M/Au:N/C:N/I:P/A:N		
CVE-2016-5879	2016-09-02T14:59:08.160	2025-04-12T10:46:40.837	MQCLI on IBM MQ Appliance M2000 and M2001 devices allows local users to execute arbitrary shell commands via a crafted (1) Disaster Recovery or (2) High Availability command.	4.6	MEDIUM	AV:L/AC:L/Au:N/C:P/I:P/A:P		
CVE-2016-6893	2016-09-02T14:59:09.283	2025-04-12T10:46:40.837	Cross-site request forgery (CSRF) vulnerability in the user options page in GNU Mailman 2.1.x before 2.1.23 allows remote attackers to hijack the authentication of arbitrary users for requests that modify an option, as demonstrated by gaining access to the credentials of a victim's account.	6.8	MEDIUM	AV:N/AC:M/Au:N/C:P/I:P/A:P		
CVE-2016-7123	2016-09-02T14:59:10.427	2025-04-12T10:46:40.837	Cross-site request forgery (CSRF) vulnerability in the admin web interface in GNU Mailman before 2.1.15 allows remote attackers to hijack the authentication of administrators.	6.8	MEDIUM	AV:N/AC:M/Au:N/C:P/I:P/A:P		
CVE-2015-5719	2016-09-03T20:59:00.153	2025-04-12T10:46:40.837	app/Controller/TemplatesController.php in Malware Information Sharing Platform (MISP) before 2.3.92 does not properly restrict filenames under the tmp/files/ directory, which has unspecified impact and attack vectors.	10.0	HIGH	AV:N/AC:L/Au:N/C:C/I:C/A:C		
CVE-2015-5720	2016-09-03T20:59:01.483	2025-04-12T10:46:40.837	Multiple cross-site scripting (XSS) vulnerabilities in the template-creation feature in Malware Information Sharing Platform (MISP) before 2.3.90 allow remote attackers to inject arbitrary web script or HTML via vectors involving (1) add.ctp, (2) edit.ctp, and (3) ajaxification.js.	4.3	MEDIUM	AV:N/AC:M/Au:N/C:N/I:P/A:N		
CVE-2015-5721	2016-09-03T20:59:02.733	2025-04-12T10:46:40.837	Malware Information Sharing Platform (MISP) before 2.3.90 allows remote attackers to conduct PHP object injection attacks via crafted serialized data, related to TemplatesController.php and populate_event_from_template_attributes.ctp.	7.5	HIGH	AV:N/AC:L/Au:N/C:P/I:P/A:P		
CVE-2016-1415	2016-09-03T20:59:03.843	2025-04-12T10:46:40.837	Cisco WebEx Meetings Player T29.10, when WRF file support is enabled, allows remote attackers to cause a denial of service (application crash) via a crafted file, aka Bug ID CSCuz80455.	4.3	MEDIUM	AV:N/AC:M/Au:N/C:N/I:N/A:P		
CVE-2016-1464	2016-09-03T20:59:05.140	2025-04-12T10:46:40.837	Cisco WebEx Meetings Player T29.10, when WRF file support is enabled, allows remote attackers to execute arbitrary code via a crafted file, aka Bug ID CSCva09375.	9.3	HIGH	AV:N/AC:M/Au:N/C:C/I:C/A:C		
CVE-2016-5429	2016-09-03T20:59:06.250	2025-04-12T10:46:40.837	jose-php before 2.2.1 does not use constant-time operations for HMAC comparison, which makes it easier for remote attackers to obtain sensitive information via a timing attack, related to JWE.php and JWS.php.	3.7	LOW	CVSS:3.1/AV:N/AC:H/PR:N/UI:N/S:U/C:L/I:N/A:N		
CVE-2016-5430	2016-09-03T20:59:07.280	2025-04-12T10:46:40.837	The RSA 1.5 algorithm implementation in the JOSE_JWE class in JWE.php in jose-php before 2.2.1 lacks the Random Filling protection mechanism, which makes it easier for remote attackers to obtain cleartext data via a Million Message Attack (MMA).	5.3	MEDIUM	CVSS:3.1/AV:N/AC:L/PR:N/UI:N/S:U/C:L/I:N/A:N		
CVE-2016-6377	2016-09-03T20:59:08.310	2025-04-12T10:46:40.837	Media Origination System Suite Software 2.6 and earlier in Cisco Virtual Media Packager (VMP) allows remote attackers to bypass authentication and make arbitrary Platform and Applications Manager (PAM) API calls via unspecified vectors, aka Bug ID CSCuz52110.	6.8	MEDIUM	AV:N/AC:M/Au:N/C:P/I:P/A:P		
CVE-2016-7112	2016-09-06T00:59:00.117	2025-04-12T10:46:40.837	A vulnerability has been identified in Firmware variant PROFINET IO for EN100 Ethernet module : All versions < V1.04.01; Firmware variant Modbus TCP for EN100 Ethernet module : All versions < V1.11.00; Firmware variant DNP3 TCP for EN100 Ethernet module : All versions < V1.03; Firmware variant IEC 104 for EN100 Ethernet module : All versions < V1.21; EN100 Ethernet module included in SIPROTEC Merging Unit 6MU80 : All versions < 1.02.02. Attackers with network access to the device's web interface (port 80/tcp) could possibly circumvent authentication and perform certain administrative operations.	10.0	HIGH	AV:N/AC:L/Au:N/C:C/I:C/A:C		
CVE-2016-7113	2016-09-06T00:59:01.883	2025-04-12T10:46:40.837	A vulnerability has been identified in Firmware variant PROFINET IO for EN100 Ethernet module : All versions < V1.04.01; Firmware variant Modbus TCP for EN100 Ethernet module : All versions < V1.11.00; Firmware variant DNP3 TCP for EN100 Ethernet module : All versions < V1.03; Firmware variant IEC 104 for EN100 Ethernet module : All versions < V1.21; EN100 Ethernet module included in SIPROTEC Merging Unit 6MU80 : All versions < 1.02.02. Specially crafted packets sent to port 80/tcp could cause the affected device to go into defect mode.	7.8	HIGH	AV:N/AC:L/Au:N/C:N/I:N/A:C		
CVE-2016-7114	2016-09-06T00:59:02.977	2025-04-12T10:46:40.837	A vulnerability has been identified in Firmware variant PROFINET IO for EN100 Ethernet module : All versions < V1.04.01; Firmware variant Modbus TCP for EN100 Ethernet module : All versions < V1.11.00; Firmware variant DNP3 TCP for EN100 Ethernet module : All versions < V1.03; Firmware variant IEC 104 for EN100 Ethernet module : All versions < V1.21; EN100 Ethernet module included in SIPROTEC Merging Unit 6MU80 : All versions < 1.02.02; SIPROTEC 7SJ686 : All versions < V 4.87; SIPROTEC 7UT686 : All versions < V 4.02; SIPROTEC 7SD686 : All versions < V 4.05; SIPROTEC 7SJ66 : All versions < V 4.30. Attackers with network access to the device's web interface (port 80/tcp) could possibly circumvent authentication and perform certain administrative operations. A legitimate user must be logged into the web interface for the attack to be successful.	9.0	HIGH	AV:N/AC:L/Au:S/C:C/I:C/A:C		
CVE-2016-7152	2016-09-06T10:59:00.133	2025-04-12T10:46:40.837	"The HTTPS protocol does not consider the role of the TCP congestion window in providing information about content length, which makes it easier for remote attackers to obtain cleartext data by leveraging a web-browser configuration in which third-party cookies are sent, aka a ""HEIST"" attack."	5.0	MEDIUM	AV:N/AC:L/Au:N/C:P/I:N/A:N		
CVE-2016-7153	2016-09-06T10:59:01.493	2025-04-12T10:46:40.837	"The HTTP/2 protocol does not consider the role of the TCP congestion window in providing information about content length, which makes it easier for remote attackers to obtain cleartext data by leveraging a web-browser configuration in which third-party cookies are sent, aka a ""HEIST"" attack."	5.0	MEDIUM	AV:N/AC:L/Au:N/C:P/I:N/A:N		
CVE-2016-6344	2016-09-07T18:59:00.140	2025-04-12T10:46:40.837	Red Hat JBoss BPM Suite 6.3.x does not include the HTTPOnly flag in a Set-Cookie header for session cookies, which makes it easier for remote attackers to obtain potentially sensitive information via script access to the cookies.	5.0	MEDIUM	AV:N/AC:L/Au:N/C:P/I:N/A:N		
CVE-2016-6345	2016-09-07T18:59:02.077	2025-04-12T10:46:40.837	"RESTEasy allows remote authenticated users to obtain sensitive information by leveraging ""insufficient use of random values"" in async jobs."	4.0	MEDIUM	AV:N/AC:L/Au:S/C:P/I:N/A:N		
CVE-2016-6346	2016-09-07T18:59:03.437	2025-04-12T10:46:40.837	RESTEasy enables GZIPInterceptor, which allows remote attackers to cause a denial of service via unspecified vectors.	5.0	MEDIUM	AV:N/AC:L/Au:N/C:N/I:N/A:P		
CVE-2016-6351	2016-09-07T18:59:04.640	2025-04-12T10:46:40.837	The esp_do_dma function in hw/scsi/esp.c in QEMU (aka Quick Emulator), when built with ESP/NCR53C9x controller emulation support, allows local guest OS administrators to cause a denial of service (out-of-bounds write and QEMU process crash) or execute arbitrary code on the QEMU host via vectors involving DMA read into ESP command buffer.	6.7	MEDIUM	CVSS:3.1/AV:L/AC:L/PR:H/UI:N/S:U/C:H/I:H/A:H		
CVE-2016-6855	2016-09-07T18:59:05.703	2025-04-12T10:46:40.837	Eye of GNOME (aka eog) 3.16.5, 3.17.x, 3.18.x before 3.18.3, 3.19.x, and 3.20.x before 3.20.4, when used with glib before 2.44.1, allow remote attackers to cause a denial of service (out-of-bounds write and crash) via vectors involving passing invalid UTF-8 to GMarkup.	5.0	MEDIUM	AV:N/AC:L/Au:N/C:N/I:N/A:P		
CVE-2016-7033	2016-09-07T18:59:06.733	2025-04-12T10:46:40.837	Multiple cross-site scripting (XSS) vulnerabilities in the admin pages in dashbuilder in Red Hat JBoss BPM Suite 6.3.2 allow remote attackers to inject arbitrary web script or HTML via unspecified vectors.	4.3	MEDIUM	AV:N/AC:M/Au:N/C:N/I:P/A:N		
CVE-2016-7034	2016-09-07T18:59:07.750	2025-04-12T10:46:40.837	The dashbuilder in Red Hat JBoss BPM Suite 6.3.2 does not properly handle CSRF tokens generated during an active session and includes them in query strings, which makes easier for remote attackers to (1) bypass CSRF protection mechanisms or (2) conduct cross-site request forgery (CSRF) attacks by obtaining an old token.	6.8	MEDIUM	AV:N/AC:M/Au:N/C:P/I:P/A:P		
CVE-2016-1241	2016-09-07T19:28:00.127	2025-04-12T10:46:40.837	Tryton 3.x before 3.2.17, 3.4.x before 3.4.14, 3.6.x before 3.6.12, 3.8.x before 3.8.8, and 4.x before 4.0.4 allow remote authenticated users to discover user password hashes via unspecified vectors.	3.5	LOW	AV:N/AC:M/Au:S/C:P/I:N/A:N		
CVE-2016-1242	2016-09-07T19:28:01.677	2025-04-12T10:46:40.837	file_open in Tryton before 3.2.17, 3.4.x before 3.4.14, 3.6.x before 3.6.12, 3.8.x before 3.8.8, and 4.x before 4.0.4 allows remote authenticated users with certain permissions to read arbitrary files via the name parameter or unspecified other vectors.	4.0	MEDIUM	AV:N/AC:L/Au:S/C:P/I:N/A:N		
CVE-2016-5022	2016-09-07T19:28:02.723	2025-04-12T10:46:40.837	F5 BIG-IP LTM, Analytics, APM, ASM, and Link Controller 11.2.x before 11.2.1 HF16, 11.3.x, 11.4.x, 11.5.x before 11.5.4 HF2, 11.6.x before 11.6.1 HF1, and 12.x before 12.0.0 HF3; BIG-IP AAM, AFM, and PEM 11.4.x, 11.5.x before 11.5.4 HF2, 11.6.x before 11.6.1 HF1, and 12.x before 12.0.0 HF3; BIG-IP DNS 12.x before 12.0.0 HF3; BIG-IP Edge Gateway, WebAccelerator, and WOM 11.2.x before 11.2.1 HF16 and 11.3.0; BIG-IP GTM 11.2.x before 11.2.1 HF16, 11.3.x, 11.4.x, 11.5.x before 11.5.4 HF2, and 11.6.x before 11.6.1 HF1; BIG-IP PSM 11.2.x before 11.2.1 HF16, 11.3.x, and 11.4.0 through 11.4.1; Enterprise Manager 3.1.1; BIG-IQ Cloud and Security 4.0.0 through 4.5.0; BIG-IQ Device 4.2.0 through 4.5.0; BIG-IQ ADC 4.5.0; BIG-IQ Centralized Management 5.0.0; BIG-IQ Cloud and Orchestration 1.0.0; and iWorkflow 2.0.0, when Packet Filtering is enabled on virtual servers and possibly self IP addresses, allow remote attackers to cause a denial of service (Traffic Management Microkernel restart) and possibly have unspecified other impact via crafted network traffic.	7.5	HIGH	AV:N/AC:L/Au:N/C:P/I:P/A:P		
CVE-2016-5422	2016-09-07T19:28:03.737	2025-04-12T10:46:40.837	The web console in Red Hat JBoss Operations Network (JON) before 3.3.7 does not properly authorize requests to add users with the super user role, which allows remote authenticated users to gain admin privileges via a crafted POST request.	6.5	MEDIUM	AV:N/AC:L/Au:S/C:P/I:P/A:P		
CVE-2016-6180	2016-09-07T19:28:04.723	2025-04-12T10:46:40.837	The Camera driver in Huawei Honor 4C smartphones with software CHM-UL00C00 before CHM-UL00C00B564, CHM-TL00C01 before CHM-TL00C01B564, and CHM-TL00C00 before CHM-TL00HC00B564 allows attackers to cause a denial of service (system crash) or gain privileges via a crafted application, a different vulnerability than CVE-2016-6181, CVE-2016-6182, CVE-2016-6183, and CVE-2016-6184.	6.9	MEDIUM	AV:L/AC:M/Au:N/C:C/I:C/A:C		
CVE-2016-6181	2016-09-07T19:28:05.830	2025-04-12T10:46:40.837	The Camera driver in Huawei Honor 4C smartphones with software CHM-UL00C00 before CHM-UL00C00B564, CHM-TL00C01 before CHM-TL00C01B564, and CHM-TL00C00 before CHM-TL00HC00B564 allows attackers to cause a denial of service (system crash) or gain privileges via a crafted application, a different vulnerability than CVE-2016-6180, CVE-2016-6182, CVE-2016-6183, and CVE-2016-6184.	6.9	MEDIUM	AV:L/AC:M/Au:N/C:C/I:C/A:C		
CVE-2016-6182	2016-09-07T19:28:06.833	2025-04-12T10:46:40.837	The Camera driver in Huawei Honor 4C smartphones with software CHM-UL00C00 before CHM-UL00C00B564, CHM-TL00C01 before CHM-TL00C01B564, and CHM-TL00C00 before CHM-TL00HC00B564 allows attackers to cause a denial of service (system crash) or gain privileges via a crafted application, a different vulnerability than CVE-2016-6180, CVE-2016-6181, CVE-2016-6183, and CVE-2016-6184.	9.3	HIGH	AV:N/AC:M/Au:N/C:C/I:C/A:C		
CVE-2016-6183	2016-09-07T19:28:07.847	2025-04-12T10:46:40.837	The Camera driver in Huawei Honor 4C smartphones with software CHM-UL00C00 before CHM-UL00C00B564, CHM-TL00C01 before CHM-TL00C01B564, and CHM-TL00C00 before CHM-TL00HC00B564 allows attackers to cause a denial of service (system crash) or gain privileges via a crafted application, a different vulnerability than CVE-2016-6180, CVE-2016-6181, CVE-2016-6182, and CVE-2016-6184.	6.9	MEDIUM	AV:L/AC:M/Au:N/C:C/I:C/A:C		
CVE-2016-6184	2016-09-07T19:28:08.893	2025-04-12T10:46:40.837	The Camera driver in Huawei Honor 4C smartphones with software CHM-UL00C00 before CHM-UL00C00B564, CHM-TL00C01 before CHM-TL00C01B564, and CHM-TL00C00 before CHM-TL00HC00B564 allows attackers to cause a denial of service (system crash) or gain privileges via a crafted application, a different vulnerability than CVE-2016-6180, CVE-2016-6181, CVE-2016-6182, and CVE-2016-6183.	6.9	MEDIUM	AV:L/AC:M/Au:N/C:C/I:C/A:C		
