CVE ID	Published Date	Last Modified Date	Description	Base Score	Base Severity	Vector String	Vendor	Product
CVE-2016-7143	2016-09-21T14:25:26.177	2025-04-12T10:46:40.837	The m_authenticate function in modules/m_sasl.c in Charybdis before 3.5.3 allows remote attackers to spoof certificate fingerprints and consequently log in as another user via a crafted AUTHENTICATE parameter.	6.8	MEDIUM	AV:N/AC:M/Au:N/C:P/I:P/A:P		
CVE-2016-7154	2016-09-21T14:25:27.160	2025-04-12T10:46:40.837	Use-after-free vulnerability in the FIFO event channel code in Xen 4.4.x allows local guest OS administrators to cause a denial of service (host crash) and possibly execute arbitrary code or obtain sensitive information via an invalid guest frame number.	7.2	HIGH	AV:L/AC:L/Au:N/C:C/I:C/A:C		
CVE-2016-7163	2016-09-21T14:25:28.550	2025-04-12T10:46:40.837	Integer overflow in the opj_pi_create_decode function in pi.c in OpenJPEG allows remote attackers to execute arbitrary code via a crafted JP2 file, which triggers an out-of-bounds read or write.	7.8	HIGH	CVSS:3.1/AV:L/AC:L/PR:N/UI:R/S:U/C:H/I:H/A:H		
CVE-2016-7166	2016-09-21T14:25:29.833	2025-04-12T10:46:40.837	libarchive before 3.2.0 does not limit the number of recursive decompressions, which allows remote attackers to cause a denial of service (memory consumption and application crash) via a crafted gzip file.	4.3	MEDIUM	AV:N/AC:M/Au:N/C:N/I:N/A:P		
CVE-2016-3632	2016-09-21T18:59:00.160	2025-04-12T10:46:40.837	The _TIFFVGetField function in tif_dirinfo.c in LibTIFF 4.0.6 and earlier allows remote attackers to cause a denial of service (out-of-bounds write) or execute arbitrary code via a crafted TIFF image.	6.8	MEDIUM	AV:N/AC:M/Au:N/C:P/I:P/A:P		
CVE-2016-3945	2016-09-21T18:59:01.677	2025-04-12T10:46:40.837	Multiple integer overflows in the (1) cvt_by_strip and (2) cvt_by_tile functions in the tiff2rgba tool in LibTIFF 4.0.6 and earlier, when -b mode is enabled, allow remote attackers to cause a denial of service (crash) or execute arbitrary code via a crafted TIFF image, which triggers an out-of-bounds write.	6.8	MEDIUM	AV:N/AC:M/Au:N/C:P/I:P/A:P		
CVE-2016-3990	2016-09-21T18:59:02.833	2025-04-12T10:46:40.837	Heap-based buffer overflow in the horizontalDifference8 function in tif_pixarlog.c in LibTIFF 4.0.6 and earlier allows remote attackers to cause a denial of service (crash) or execute arbitrary code via a crafted TIFF image to tiffcp.	6.8	MEDIUM	AV:N/AC:M/Au:N/C:P/I:P/A:P		
CVE-2016-3991	2016-09-21T18:59:03.863	2025-04-12T10:46:40.837	Heap-based buffer overflow in the loadImage function in the tiffcrop tool in LibTIFF 4.0.6 and earlier allows remote attackers to cause a denial of service (out-of-bounds write) or execute arbitrary code via a crafted TIFF image with zero tiles.	6.8	MEDIUM	AV:N/AC:M/Au:N/C:P/I:P/A:P		
CVE-2016-4464	2016-09-21T18:59:04.897	2025-04-12T10:46:40.837	The application plugins in Apache CXF Fediz 1.2.x before 1.2.3 and 1.3.x before 1.3.1 do not match SAML AudienceRestriction values against configured audience URIs, which might allow remote attackers to have bypass intended restrictions and have unspecified other impact via a crafted SAML token with a trusted signature.	7.5	HIGH	AV:N/AC:L/Au:N/C:P/I:P/A:P		
CVE-2016-5247	2016-09-22T15:59:00.147	2025-04-12T10:46:40.837	The BIOS for Lenovo ThinkCentre E93, M6500t/s, M6600, M6600q, M6600t/s, M73p, M800, M83, M8500t/s, M8600t/s, M900, M93, and M93P devices; ThinkServer RQ940, RS140, TS140, TS240, TS440, and TS540 devices; and ThinkStation E32, P300, and P310 devices might allow local users or physically proximate attackers to bypass the Secure Boot protection mechanism by leveraging an AMI test key.	7.2	HIGH	AV:L/AC:L/Au:N/C:C/I:C/A:C		
CVE-2016-6265	2016-09-22T15:59:01.583	2025-04-12T10:46:40.837	Use-after-free vulnerability in the pdf_load_xref function in pdf/pdf-xref.c in MuPDF allows remote attackers to cause a denial of service (crash) via a crafted PDF file.	4.3	MEDIUM	AV:N/AC:M/Au:N/C:N/I:N/A:P		
CVE-2016-6322	2016-09-22T15:59:02.787	2025-04-12T10:46:40.837	Red Hat QuickStart Cloud Installer (QCI) uses world-readable permissions for /etc/qci/answers, which allows local users to obtain the root password for the deployed system by reading the file.	7.2	HIGH	AV:L/AC:L/Au:N/C:C/I:C/A:C		
CVE-2016-6340	2016-09-22T15:59:03.817	2025-04-12T10:46:40.837	The kickstart file in Red Hat QuickStart Cloud Installer (QCI) forces use of MD5 passwords on deployed systems, which makes it easier for attackers to determine cleartext passwords via a brute-force attack.	2.1	LOW	AV:L/AC:L/Au:N/C:P/I:N/A:N		
CVE-2016-6525	2016-09-22T15:59:04.977	2025-04-12T10:46:40.837	Heap-based buffer overflow in the pdf_load_mesh_params function in pdf/pdf-shade.c in MuPDF allows remote attackers to cause a denial of service (crash) or execute arbitrary code via a large decode array.	7.5	HIGH	AV:N/AC:L/Au:N/C:P/I:P/A:P		
CVE-2016-6669	2016-09-22T15:59:05.977	2025-04-12T10:46:40.837	Buffer overflow in the Authentication, Authorization and Accounting (AAA) module in Huawei USG2100, USG2200, USG5100, and USG5500 unified security gateways with software before V300R001C10SPC600 allows remote authenticated RADIUS servers to execute arbitrary code by sending a crafted EAP packet.	7.1	HIGH	AV:N/AC:H/Au:S/C:C/I:C/A:C		
CVE-2016-6824	2016-09-22T15:59:07.443	2025-04-12T10:46:40.837	Huawei AC6003, AC6005, AC6605, and ACU2 access controllers with software before V200R006C10SPC200 allows remote authenticated users to cause a denial of service (device restart) via crafted CAPWAP packets.	6.8	MEDIUM	AV:N/AC:L/Au:S/C:N/I:N/A:C		
CVE-2014-2146	2016-09-22T17:59:00.133	2025-04-12T10:46:40.837	The Zone-Based Firewall (ZBFW) functionality in Cisco IOS, possibly 15.4 and earlier, and IOS XE, possibly 3.13 and earlier, mishandles zone checking for existing sessions, which allows remote attackers to bypass intended resource-access restrictions via spoofed traffic that matches one of these sessions, aka Bug IDs CSCun94946 and CSCun96847.	4.3	MEDIUM	AV:N/AC:M/Au:N/C:P/I:N/A:N		
CVE-2016-2827	2016-09-22T22:59:00.130	2025-04-12T10:46:40.837	The mozilla::net::IsValidReferrerPolicy function in Mozilla Firefox before 49.0 allows remote attackers to cause a denial of service (out-of-bounds read and application crash) via a Content Security Policy (CSP) referrer directive with zero values.	4.3	MEDIUM	AV:N/AC:M/Au:N/C:N/I:N/A:P		
CVE-2016-5256	2016-09-22T22:59:01.567	2025-04-12T10:46:40.837	Multiple unspecified vulnerabilities in the browser engine in Mozilla Firefox before 49.0 allow remote attackers to cause a denial of service (memory corruption and application crash) or possibly execute arbitrary code via unknown vectors.	7.5	HIGH	AV:N/AC:L/Au:N/C:P/I:P/A:P		
CVE-2016-5257	2016-09-22T22:59:02.647	2025-04-12T10:46:40.837	Multiple unspecified vulnerabilities in the browser engine in Mozilla Firefox before 49.0, Firefox ESR 45.x before 45.4 and Thunderbird < 45.4 allow remote attackers to cause a denial of service (memory corruption and application crash) or possibly execute arbitrary code via unknown vectors.	7.5	HIGH	AV:N/AC:L/Au:N/C:P/I:P/A:P		
CVE-2016-5270	2016-09-22T22:59:03.677	2025-04-12T10:46:40.837	Heap-based buffer overflow in the nsCaseTransformTextRunFactory::TransformString function in Mozilla Firefox before 49.0, Firefox ESR 45.x before 45.4, and Thunderbird < 45.4 allows remote attackers to cause a denial of service (boolean out-of-bounds write) or possibly have unspecified other impact via Unicode characters that are mishandled during text conversion.	7.5	HIGH	AV:N/AC:L/Au:N/C:P/I:P/A:P		
CVE-2016-5271	2016-09-22T22:59:04.770	2025-04-12T10:46:40.837	"The PropertyProvider::GetSpacingInternal function in Mozilla Firefox before 49.0 allows remote attackers to cause a denial of service (out-of-bounds read and application crash) via text runs in conjunction with a ""display: contents"" Cascading Style Sheets (CSS) property."	4.3	MEDIUM	AV:N/AC:M/Au:N/C:N/I:N/A:P		
CVE-2016-5272	2016-09-22T22:59:05.833	2025-04-12T10:46:40.837	The nsImageGeometryMixin class in Mozilla Firefox before 49.0, Firefox ESR 45.x before 45.4, and Thunderbird < 45.4 does not properly perform a cast of an unspecified variable during handling of INPUT elements, which allows remote attackers to execute arbitrary code via a crafted web site.	6.8	MEDIUM	AV:N/AC:M/Au:N/C:P/I:P/A:P		
CVE-2016-5273	2016-09-22T22:59:06.800	2025-04-12T10:46:40.837	The mozilla::a11y::HyperTextAccessible::GetChildOffset function in the accessibility implementation in Mozilla Firefox before 49.0 allows remote attackers to execute arbitrary code via a crafted web site.	6.8	MEDIUM	AV:N/AC:M/Au:N/C:P/I:P/A:P		
CVE-2016-5274	2016-09-22T22:59:07.817	2025-04-12T10:46:40.837	Use-after-free vulnerability in the nsFrameManager::CaptureFrameState function in Mozilla Firefox before 49.0, Firefox ESR 45.x before 45.4, and Thunderbird < 45.4 allows remote attackers to execute arbitrary code by leveraging improper interaction between restyling and the Web Animations model implementation.	7.5	HIGH	AV:N/AC:L/Au:N/C:P/I:P/A:P		
CVE-2016-5275	2016-09-22T22:59:08.973	2025-04-12T10:46:40.837	Buffer overflow in the mozilla::gfx::FilterSupport::ComputeSourceNeededRegions function in Mozilla Firefox before 49.0 allows remote attackers to execute arbitrary code by leveraging improper interaction between empty filters and CANVAS element rendering.	6.8	MEDIUM	AV:N/AC:M/Au:N/C:P/I:P/A:P		
CVE-2016-5276	2016-09-22T22:59:10.113	2025-04-12T10:46:40.837	Use-after-free vulnerability in the mozilla::a11y::DocAccessible::ProcessInvalidationList function in Mozilla Firefox before 49.0, Firefox ESR 45.x before 45.4, and Thunderbird < 45.4 allows remote attackers to execute arbitrary code or cause a denial of service (heap memory corruption) via an aria-owns attribute.	7.5	HIGH	AV:N/AC:L/Au:N/C:P/I:P/A:P		
CVE-2016-5277	2016-09-22T22:59:11.567	2025-04-12T10:46:40.837	Use-after-free vulnerability in the nsRefreshDriver::Tick function in Mozilla Firefox before 49.0, Firefox ESR 45.x before 45.4, and Thunderbird < 45.4 allows remote attackers to execute arbitrary code or cause a denial of service (heap memory corruption) by leveraging improper interaction between timeline destruction and the Web Animations model implementation.	7.5	HIGH	AV:N/AC:L/Au:N/C:P/I:P/A:P		
CVE-2016-5278	2016-09-22T22:59:12.757	2025-04-12T10:46:40.837	Heap-based buffer overflow in the nsBMPEncoder::AddImageFrame function in Mozilla Firefox before 49.0, Firefox ESR 45.x before 45.4, and Thunderbird < 45.4 allows remote attackers to execute arbitrary code via a crafted image data that is mishandled during the encoding of an image frame to an image.	6.8	MEDIUM	AV:N/AC:M/Au:N/C:P/I:P/A:P		
CVE-2016-5279	2016-09-22T22:59:13.850	2025-04-12T10:46:40.837	Mozilla Firefox before 49.0 allows user-assisted remote attackers to obtain sensitive full-pathname information during a local-file drag-and-drop operation via crafted JavaScript code.	4.3	MEDIUM	AV:N/AC:M/Au:N/C:P/I:N/A:N		
CVE-2016-5280	2016-09-22T22:59:14.850	2025-04-12T10:46:40.837	Use-after-free vulnerability in the mozilla::nsTextNodeDirectionalityMap::RemoveElementFromMap function in Mozilla Firefox before 49.0, Firefox ESR 45.x before 45.4, and Thunderbird < 45.4 allows remote attackers to execute arbitrary code via bidirectional text.	7.5	HIGH	AV:N/AC:L/Au:N/C:P/I:P/A:P		
CVE-2016-5281	2016-09-22T22:59:15.910	2025-04-12T10:46:40.837	Use-after-free vulnerability in the DOMSVGLength class in Mozilla Firefox before 49.0, Firefox ESR 45.x before 45.4, and Thunderbird < 45.4 allows remote attackers to execute arbitrary code by leveraging improper interaction between JavaScript code and an SVG document.	7.5	HIGH	AV:N/AC:L/Au:N/C:P/I:P/A:P		
CVE-2016-5282	2016-09-22T22:59:16.957	2025-04-12T10:46:40.837	Mozilla Firefox before 49.0 does not properly restrict the scheme in favicon requests, which might allow remote attackers to obtain sensitive information via unspecified vectors, as demonstrated by a jar: URL for a favicon resource.	4.3	MEDIUM	AV:N/AC:M/Au:N/C:P/I:N/A:N		
CVE-2016-5283	2016-09-22T22:59:18.007	2025-04-12T10:46:40.837	Mozilla Firefox before 49.0 allows remote attackers to bypass the Same Origin Policy via a crafted fragment identifier in the SRC attribute of an IFRAME element, leading to insufficient restrictions on link-color information after a document is resized.	6.8	MEDIUM	AV:N/AC:M/Au:N/C:P/I:P/A:P		
CVE-2016-5284	2016-09-22T22:59:18.973	2025-04-12T10:46:40.837	Mozilla Firefox before 49.0, Firefox ESR 45.x before 45.4, and Thunderbird < 45.4 rely on unintended expiration dates for Preloaded Public Key Pinning, which allows man-in-the-middle attackers to spoof add-on updates by leveraging possession of an X.509 server certificate for addons.mozilla.org signed by an arbitrary built-in Certification Authority.	4.3	MEDIUM	AV:N/AC:M/Au:N/C:P/I:N/A:N		
CVE-2016-6373	2016-09-22T22:59:19.867	2025-04-12T10:46:40.837	The web-based GUI in Cisco Cloud Services Platform (CSP) 2100 2.0 allows remote authenticated administrators to execute arbitrary OS commands as root via crafted platform commands, aka Bug ID CSCva00541.	9.0	HIGH	AV:N/AC:L/Au:S/C:C/I:C/A:C		
CVE-2016-6374	2016-09-22T22:59:21.223	2025-04-12T10:46:40.837	Cisco Cloud Services Platform (CSP) 2100 2.0 allows remote attackers to execute arbitrary code via a crafted dnslookup command in an HTTP request, aka Bug ID CSCuz89093.	9.8	CRITICAL	CVSS:3.1/AV:N/AC:L/PR:N/UI:N/S:U/C:H/I:H/A:H		
CVE-2016-6406	2016-09-22T22:59:22.193	2025-04-12T10:46:40.837	Cisco IronPort AsyncOS 9.1.2-023, 9.1.2-028, 9.1.2-036, 9.7.2-046, 9.7.2-047, 9.7.2-054, 10.0.0-124, and 10.0.0-125 on Email Security Appliance (ESA) devices, when Enrollment Client before 1.0.2-065 is installed, allows remote attackers to obtain root access via a connection to the testing/debugging interface, aka Bug ID CSCvb26017.	10.0	HIGH	AV:N/AC:L/Au:N/C:C/I:C/A:C		
CVE-2016-6414	2016-09-22T22:59:23.223	2025-04-12T10:46:40.837	iox in Cisco IOS, possibly 15.6 and earlier, and IOS XE, possibly 3.18 and earlier, allows local users to execute arbitrary IOx Linux commands on the guest OS via crafted iox command-line options, aka Bug ID CSCuz59223.	7.2	HIGH	AV:L/AC:L/Au:N/C:C/I:C/A:C		
CVE-2016-6408	2016-09-24T01:59:00.150	2025-04-12T10:46:40.837	Cisco Prime Home 5.2.0 allows remote attackers to read arbitrary files via an XML document containing an external entity declaration in conjunction with an entity reference, related to an XML External Entity (XXE) issue, aka Bug ID CSCvb17814.	4.3	MEDIUM	AV:N/AC:M/Au:N/C:P/I:N/A:N		
CVE-2016-6409	2016-09-24T01:59:01.650	2025-04-12T10:46:40.837	The Data in Motion (DMo) component in Cisco IOS 15.6(1)T and IOS XE, when the IOx feature set is enabled, allows remote attackers to cause a denial of service (out-of-bounds access) via crafted traffic, aka Bug ID CSCuy54015.	4.3	MEDIUM	AV:N/AC:M/Au:N/C:N/I:N/A:P		
CVE-2016-6410	2016-09-24T01:59:02.900	2025-04-12T10:46:40.837	The Cisco Application-hosting Framework (CAF) component in Cisco IOS 15.6(1)T1 and IOS XE, when the IOx feature set is enabled, allows remote authenticated users to read arbitrary files via unspecified vectors, aka Bug ID CSCuy19856.	6.8	MEDIUM	AV:N/AC:L/Au:S/C:C/I:N/A:N		
CVE-2016-6411	2016-09-24T01:59:04.057	2025-04-12T10:46:40.837	Cisco Firepower Management Center and FireSIGHT System Software 6.0.1 mishandle comparisons between URLs and X.509 certificates, which allows remote attackers to bypass intended do-not-decrypt settings via a crafted URL, aka Bug ID CSCva50585.	5.0	MEDIUM	AV:N/AC:L/Au:N/C:N/I:P/A:N		
CVE-2016-6412	2016-09-24T01:59:05.057	2025-04-12T10:46:40.837	The Cisco Application-hosting Framework (CAF) component in Cisco IOS 15.6(1)T1 and IOS XE, when the IOx feature set is enabled, allows man-in-the-middle attackers to trigger arbitrary downloads via crafted HTTP headers, aka Bug ID CSCuz84773.	4.3	MEDIUM	AV:N/AC:M/Au:N/C:N/I:P/A:N		
CVE-2016-6413	2016-09-24T01:59:06.120	2025-04-12T10:46:40.837	The installation procedure on Cisco Application Policy Infrastructure Controller (APIC) devices 1.3(2f) mishandles binary files, which allows local users to obtain root access via unspecified vectors, aka Bug ID CSCva50496.	6.8	MEDIUM	AV:L/AC:L/Au:S/C:C/I:C/A:C		
CVE-2016-0918	2016-09-24T10:59:00.137	2025-04-12T10:46:40.837	EMC RSA Identity Management and Governance before 6.8.1 P25 and 6.9.x before 6.9.1 P15 and RSA Via Lifecycle and Governance before 7.0.0 P04 allow remote authenticated users to obtain User Detail Popup information via a modified URL.	4.0	MEDIUM	AV:N/AC:L/Au:S/C:P/I:N/A:N		
CVE-2016-4845	2016-09-24T10:59:01.243	2025-04-12T10:46:40.837	Cross-site request forgery (CSRF) vulnerability on I-O DATA DEVICE HVL-A2.0, HVL-A3.0, HVL-A4.0, HVL-AT1.0S, HVL-AT2.0, HVL-AT3.0, HVL-AT4.0, HVL-AT2.0A, HVL-AT3.0A, and HVL-AT4.0A devices with firmware before 2.04 allows remote attackers to hijack the authentication of arbitrary users for requests that delete content.	6.8	MEDIUM	AV:N/AC:M/Au:N/C:P/I:P/A:P		
CVE-2016-5793	2016-09-24T10:59:02.603	2025-04-12T10:46:40.837	Unquoted Windows search path vulnerability in Moxa Active OPC Server before 2.4.19 allows local users to gain privileges via a Trojan horse executable file in the %SYSTEMDRIVE% directory.	7.2	HIGH	AV:L/AC:L/Au:N/C:C/I:C/A:C		
CVE-2016-6531	2016-09-24T10:59:03.650	2025-04-12T10:46:40.837	"Open Dental 16.1 and earlier has a hardcoded MySQL root password, which allows remote attackers to obtain administrative access by leveraging access to intranet TCP port 3306.  NOTE: the vendor disputes this issue, stating that the ""vulnerability note ... is factually false ... there is indeed a default blank password, but it can be changed ... We recommend that users change it, each customer receives direction."	9.8	CRITICAL	CVSS:3.1/AV:N/AC:L/PR:N/UI:N/S:U/C:H/I:H/A:H		
CVE-2016-6532	2016-09-24T10:59:05.027	2025-04-12T10:46:40.837	DEXIS Imaging Suite 10 has a hardcoded password for the sa account, which allows remote attackers to obtain administrative access by entering this password in a DEXIS_DATA SQL Server session.	10.0	HIGH	AV:N/AC:L/Au:N/C:C/I:C/A:C		
CVE-2016-4611	2016-09-25T10:59:00.137	2025-04-12T10:46:40.837	WebKit in Apple iOS before 10, Safari before 10, and tvOS before 10 allows remote attackers to execute arbitrary code or cause a denial of service (memory corruption) via a crafted web site, a different vulnerability than CVE-2016-4730, CVE-2016-4733, CVE-2016-4734, and CVE-2016-4735.	6.8	MEDIUM	AV:N/AC:M/Au:N/C:P/I:P/A:P		
CVE-2016-4618	2016-09-25T10:59:01.233	2025-04-12T10:46:40.837	"Cross-site scripting (XSS) vulnerability in Safari Reader in Apple iOS before 10 and Safari before 10 allows remote attackers to inject arbitrary web script or HTML via a crafted web site, aka ""Universal XSS (UXSS)."""	4.3	MEDIUM	AV:N/AC:M/Au:N/C:N/I:P/A:N		
CVE-2016-4658	2016-09-25T10:59:02.343	2025-04-12T10:46:40.837	xpointer.c in libxml2 before 2.9.5 (as used in Apple iOS before 10, OS X before 10.12, tvOS before 10, and watchOS before 3, and other products) does not forbid namespace nodes in XPointer ranges, which allows remote attackers to execute arbitrary code or cause a denial of service (use-after-free and memory corruption) via a crafted XML document.	10.0	HIGH	AV:N/AC:L/Au:N/C:C/I:C/A:C		
CVE-2016-4694	2016-09-25T10:59:03.450	2025-04-12T10:46:40.837	"The Apache HTTP Server in Apple OS X before 10.12 and OS X Server before 5.2 follows RFC 3875 section 4.1.18 and therefore does not protect applications from the presence of untrusted CGI client data in the HTTP_PROXY environment variable, which might allow remote attackers to redirect an application's outbound HTTP traffic to an arbitrary proxy server via a crafted Proxy header in an HTTP request, aka an ""httpoxy"" issue, a related issue to CVE-2016-5387."	7.5	HIGH	AV:N/AC:L/Au:N/C:P/I:P/A:P		
CVE-2016-4696	2016-09-25T10:59:04.890	2025-04-12T10:46:40.837	AppleEFIRuntime in Apple OS X before 10.12 allows attackers to execute arbitrary code in a privileged context or cause a denial of service (NULL pointer dereference) via a crafted app.	9.3	HIGH	AV:N/AC:M/Au:N/C:C/I:C/A:C		
CVE-2016-4697	2016-09-25T10:59:06.013	2025-04-12T10:46:40.837	Apple HSSPI Support in Apple OS X before 10.12 allows attackers to execute arbitrary code in a privileged context or cause a denial of service (memory corruption) via a crafted app.	9.3	HIGH	AV:N/AC:M/Au:N/C:C/I:C/A:C		
CVE-2016-4698	2016-09-25T10:59:06.967	2025-04-12T10:46:40.837	AppleMobileFileIntegrity in Apple iOS before 10 and OS X before 10.12 mishandles process entitlement and Team ID values in the task port inheritance policy, which allows attackers to execute arbitrary code in a privileged context via a crafted app.	9.3	HIGH	AV:N/AC:M/Au:N/C:C/I:C/A:C		
CVE-2016-4699	2016-09-25T10:59:07.907	2025-04-12T10:46:40.837	AppleUUC in Apple OS X before 10.12 allows attackers to execute arbitrary code in a privileged context or cause a denial of service (memory corruption) via a crafted app, a different vulnerability than CVE-2016-4700.	9.3	HIGH	AV:N/AC:M/Au:N/C:C/I:C/A:C		
CVE-2016-4700	2016-09-25T10:59:08.907	2025-04-12T10:46:40.837	AppleUUC in Apple OS X before 10.12 allows attackers to execute arbitrary code in a privileged context or cause a denial of service (memory corruption) via a crafted app, a different vulnerability than CVE-2016-4699.	9.3	HIGH	AV:N/AC:M/Au:N/C:C/I:C/A:C		
CVE-2016-4701	2016-09-25T10:59:09.890	2025-04-12T10:46:40.837	Application Firewall in Apple OS X before 10.12 allows local users to cause a denial of service via vectors involving a crafted SO_EXECPATH environment variable.	2.1	LOW	AV:L/AC:L/Au:N/C:N/I:N/A:P		
CVE-2016-4702	2016-09-25T10:59:11.030	2025-04-12T10:46:40.837	Audio in Apple iOS before 10, OS X before 10.12, tvOS before 10, and watchOS before 3 allows remote attackers to execute arbitrary code or cause a denial of service (memory corruption) via unspecified vectors.	10.0	HIGH	AV:N/AC:L/Au:N/C:C/I:C/A:C		
CVE-2016-4703	2016-09-25T10:59:12.077	2025-04-12T10:46:40.837	Bluetooth in Apple OS X before 10.12 allows attackers to execute arbitrary code in a privileged context or cause a denial of service (memory corruption) via a crafted app.	9.3	HIGH	AV:N/AC:M/Au:N/C:C/I:C/A:C		
CVE-2016-4706	2016-09-25T10:59:13.093	2025-04-12T10:46:40.837	cd9660 in Apple OS X before 10.12 allows local users to cause a denial of service via unspecified vectors.	4.9	MEDIUM	AV:L/AC:L/Au:N/C:N/I:N/A:C		
CVE-2016-4707	2016-09-25T10:59:14.157	2025-04-12T10:46:40.837	CFNetwork in Apple iOS before 10 and OS X before 10.12 mishandles Local Storage deletion, which allows local users to discover the visited web sites of arbitrary users via unspecified vectors.	2.1	LOW	AV:L/AC:L/Au:N/C:N/I:N/A:P		
CVE-2016-4708	2016-09-25T10:59:15.687	2025-04-12T10:46:40.837	CFNetwork in Apple iOS before 10, OS X before 10.12, tvOS before 10, and watchOS before 3 misparses the Set-Cookie header, which allows remote attackers to obtain sensitive information via a crafted HTTP response.	4.3	MEDIUM	AV:N/AC:M/Au:N/C:P/I:N/A:N		
CVE-2016-4709	2016-09-25T10:59:16.767	2025-04-12T10:46:40.837	"WindowServer in Apple OS X before 10.12 allows local users to obtain root access via vectors that leverage ""type confusion,"" a different vulnerability than CVE-2016-4710."	7.2	HIGH	AV:L/AC:L/Au:N/C:C/I:C/A:C		
CVE-2016-4710	2016-09-25T10:59:17.703	2025-04-12T10:46:40.837	"WindowServer in Apple OS X before 10.12 allows local users to obtain root access via vectors that leverage ""type confusion,"" a different vulnerability than CVE-2016-4709."	7.2	HIGH	AV:L/AC:L/Au:N/C:C/I:C/A:C		
CVE-2016-4711	2016-09-25T10:59:18.610	2025-04-12T10:46:40.837	CCrypt in corecrypto in CommonCrypto in Apple iOS before 10 and OS X before 10.12 allows attackers to discover cleartext information by leveraging a function call that specifies the same buffer for input and output.	5.0	MEDIUM	AV:N/AC:L/Au:N/C:P/I:N/A:N		
CVE-2016-4712	2016-09-25T10:59:19.657	2025-04-12T10:46:40.837	CoreCrypto in Apple iOS before 10, OS X before 10.12, tvOS before 10, and watchOS before 3 allows attackers to execute arbitrary code or cause a denial of service (out-of-bounds write) via a crafted app.	9.3	HIGH	AV:N/AC:M/Au:N/C:C/I:C/A:C		
CVE-2016-4713	2016-09-25T10:59:20.780	2025-04-12T10:46:40.837	CoreDisplay in Apple OS X before 10.12 allows attackers to view arbitrary users' screens by leveraging screen-sharing access.	4.3	MEDIUM	AV:N/AC:M/Au:N/C:P/I:N/A:N		
CVE-2016-4715	2016-09-25T10:59:21.843	2025-04-12T10:46:40.837	The Date & Time Pref Pane component in Apple OS X before 10.12 mishandles the .GlobalPreferences file, which allows attackers to discover a user's location via a crafted app.	4.3	MEDIUM	AV:N/AC:M/Au:N/C:P/I:N/A:N		
CVE-2016-4716	2016-09-25T10:59:22.843	2025-04-12T10:46:40.837	diskutil in DiskArbitration in Apple OS X before 10.12 allows local users to gain privileges via unspecified vectors.	7.2	HIGH	AV:L/AC:L/Au:N/C:C/I:C/A:C		
CVE-2016-4717	2016-09-25T10:59:23.797	2025-04-12T10:46:40.837	The File Bookmark component in Apple OS X before 10.12 mishandles scoped-bookmark file descriptors, which allows attackers to cause a denial of service via a crafted app.	5.0	MEDIUM	AV:N/AC:L/Au:N/C:N/I:N/A:P		
CVE-2016-4718	2016-09-25T10:59:25.110	2025-04-12T10:46:40.837	Buffer overflow in FontParser in Apple iOS before 10, OS X before 10.12, tvOS before 10, and watchOS before 3 allows remote attackers to obtain sensitive information from process memory via a crafted font file.	4.3	MEDIUM	AV:N/AC:M/Au:N/C:P/I:N/A:N		
CVE-2016-4722	2016-09-25T10:59:26.203	2025-04-12T10:46:40.837	The IDS - Connectivity component in Apple iOS before 10 and OS X before 10.12 allows man-in-the-middle attackers to conduct Call Relay spoofing attacks and cause a denial of service via unspecified vectors.	7.1	HIGH	AV:N/AC:M/Au:N/C:N/I:N/A:C		
