CVE ID	Published Date	Last Modified Date	Description	Base Score	Base Severity	Vector String	Vendor	Product
CVE-2016-3042	2016-10-01T01:59:02.037	2025-04-12T10:46:40.837	Cross-site scripting (XSS) vulnerability in the Web UI in IBM WebSphere Application Server (WAS) Liberty before 16.0.0.3 allows remote authenticated users to inject arbitrary web script or HTML via vectors involving OpenID Connect clients.	3.5	LOW	AV:N/AC:M/Au:S/C:N/I:P/A:N		
CVE-2016-5986	2016-10-01T01:59:07.320	2025-04-12T10:46:40.837	IBM WebSphere Application Server (WAS) 7.x before 7.0.0.43, 8.0.x before 8.0.0.13, 8.5.x before 8.5.5.11, 9.0.x before 9.0.0.2, and Liberty before 16.0.0.3 mishandles responses, which allows remote attackers to obtain sensitive information via unspecified vectors.	5.0	MEDIUM	AV:N/AC:L/Au:N/C:P/I:N/A:N		
CVE-2016-5995	2016-10-01T01:59:08.537	2025-04-12T10:46:40.837	Untrusted search path vulnerability in IBM DB2 9.7 through FP11, 10.1 through FP5, 10.5 before FP8, and 11.1 GA on Linux, AIX, and HP-UX allows local users to gain privileges via a Trojan horse library that is accessed by a setuid or setgid program.	6.9	MEDIUM	AV:L/AC:M/Au:N/C:C/I:C/A:C		
CVE-2016-1240	2016-10-03T15:59:00.207	2025-04-12T10:46:40.837	The Tomcat init script in the tomcat7 package before 7.0.56-3+deb8u4 and tomcat8 package before 8.0.14-1+deb8u3 on Debian jessie and the tomcat6 and libtomcat6-java packages before 6.0.35-1ubuntu3.8 on Ubuntu 12.04 LTS, the tomcat7 and libtomcat7-java packages before 7.0.52-1ubuntu0.7 on Ubuntu 14.04 LTS, and tomcat8 and libtomcat8-java packages before 8.0.32-1ubuntu1.2 on Ubuntu 16.04 LTS allows local users with access to the tomcat account to gain root privileges via a symlink attack on the Catalina log file, as demonstrated by /var/log/tomcat7/catalina.out.	7.2	HIGH	AV:L/AC:L/Au:N/C:C/I:C/A:C		
CVE-2016-4436	2016-10-03T15:59:01.913	2025-04-12T10:46:40.837	Apache Struts 2 before 2.3.29 and 2.5.x before 2.5.1 allow attackers to have unspecified impact via vectors related to improper action name clean up.	7.5	HIGH	AV:N/AC:L/Au:N/C:P/I:P/A:P		
CVE-2016-5180	2016-10-03T15:59:03.270	2025-04-12T10:46:40.837	Heap-based buffer overflow in the ares_create_query function in c-ares 1.x before 1.12.0 allows remote attackers to cause a denial of service (out-of-bounds write) or possibly execute arbitrary code via a hostname with an escaped trailing dot.	9.8	CRITICAL	CVSS:3.1/AV:N/AC:L/PR:N/UI:N/S:U/C:H/I:H/A:H		
CVE-2016-3619	2016-10-03T16:09:00.180	2025-04-12T10:46:40.837	"The DumpModeEncode function in tif_dumpmode.c in the bmp2tiff tool in LibTIFF 4.0.6 and earlier, when the ""-c none"" option is used, allows remote attackers to cause a denial of service (buffer over-read) via a crafted BMP image."	4.3	MEDIUM	AV:N/AC:M/Au:N/C:N/I:N/A:P		
CVE-2016-3620	2016-10-03T16:09:01.727	2025-04-12T10:46:40.837	"The ZIPEncode function in tif_zip.c in the bmp2tiff tool in LibTIFF 4.0.6 and earlier, when the ""-c zip"" option is used, allows remote attackers to cause a denial of service (buffer over-read) via a crafted BMP image."	5.0	MEDIUM	AV:N/AC:L/Au:N/C:N/I:N/A:P		
CVE-2016-3621	2016-10-03T16:09:02.897	2025-04-12T10:46:40.837	"The LZWEncode function in tif_lzw.c in the bmp2tiff tool in LibTIFF 4.0.6 and earlier, when the ""-c lzw"" option is used, allows remote attackers to cause a denial of service (buffer over-read) via a crafted BMP image."	6.8	MEDIUM	AV:N/AC:M/Au:N/C:P/I:P/A:P		
CVE-2016-3622	2016-10-03T16:09:04.133	2025-04-12T10:46:40.837	The fpAcc function in tif_predict.c in the tiff2rgba tool in LibTIFF 4.0.6 and earlier allows remote attackers to cause a denial of service (divide-by-zero error) via a crafted TIFF image.	4.3	MEDIUM	AV:N/AC:M/Au:N/C:N/I:N/A:P		
CVE-2016-3623	2016-10-03T16:09:05.557	2025-04-12T10:46:40.837	The rgb2ycbcr tool in LibTIFF 4.0.6 and earlier allows remote attackers to cause a denial of service (divide-by-zero) by setting the (1) v or (2) h parameter to 0.	5.0	MEDIUM	AV:N/AC:L/Au:N/C:N/I:N/A:P		
CVE-2016-3624	2016-10-03T16:09:06.790	2025-04-12T10:46:40.837	"The cvtClump function in the rgb2ycbcr tool in LibTIFF 4.0.6 and earlier allows remote attackers to cause a denial of service (out-of-bounds write) by setting the ""-v"" option to -1."	5.0	MEDIUM	AV:N/AC:L/Au:N/C:N/I:N/A:P		
CVE-2016-3625	2016-10-03T16:09:07.977	2025-04-12T10:46:40.837	tif_read.c in the tiff2bw tool in LibTIFF 4.0.6 and earlier allows remote attackers to cause a denial of service (out-of-bounds read) via a crafted TIFF image.	4.3	MEDIUM	AV:N/AC:M/Au:N/C:N/I:N/A:P		
CVE-2016-3631	2016-10-03T16:09:09.070	2025-04-12T10:46:40.837	The (1) cpStrips and (2) cpTiles functions in the thumbnail tool in LibTIFF 4.0.6 and earlier allow remote attackers to cause a denial of service (out-of-bounds read) via vectors related to the bytecounts[] array variable.	5.0	MEDIUM	AV:N/AC:L/Au:N/C:N/I:N/A:P		
CVE-2016-3633	2016-10-03T16:09:10.463	2025-04-12T10:46:40.837	The setrow function in the thumbnail tool in LibTIFF 4.0.6 and earlier allows remote attackers to cause a denial of service (out-of-bounds read) via vectors related to the src variable.	5.0	MEDIUM	AV:N/AC:L/Au:N/C:N/I:N/A:P		
CVE-2016-3634	2016-10-03T16:09:11.587	2025-04-12T10:46:40.837	The tagCompare function in tif_dirinfo.c in the thumbnail tool in LibTIFF 4.0.6 and earlier allows remote attackers to cause a denial of service (out-of-bounds read) via vectors related to field_tag matching.	5.0	MEDIUM	AV:N/AC:L/Au:N/C:N/I:N/A:P		
CVE-2016-3658	2016-10-03T16:09:12.697	2025-04-12T10:46:40.837	The TIFFWriteDirectoryTagLongLong8Array function in tif_dirwrite.c in the tiffset tool in LibTIFF 4.0.6 and earlier allows remote attackers to cause a denial of service (out-of-bounds read) via vectors involving the ma variable.	5.0	MEDIUM	AV:N/AC:L/Au:N/C:N/I:N/A:P		
CVE-2016-5700	2016-10-03T16:09:13.790	2025-04-12T10:46:40.837	Virtual servers in F5 BIG-IP systems 11.5.0, 11.5.1 before HF11, 11.5.2, 11.5.3, 11.5.4 before HF2, 11.6.0 before HF8, 11.6.1 before HF1, 12.0.0 before HF4, and 12.1.0 before HF2, when configured with the HTTP Explicit Proxy functionality or SOCKS profile, allow remote attackers to modify the system configuration, read system files, and possibly execute arbitrary code via unspecified vectors.	9.3	HIGH	AV:N/AC:M/Au:N/C:C/I:C/A:C		
CVE-2016-7397	2016-10-03T16:09:14.870	2025-04-12T10:46:40.837	"The Frontend component in Sophos UTM with firmware 9.405-5 and earlier allows local administrators to obtain sensitive password information by reading the ""value"" field of the SMTP user settings in the notifications configuration tab."	2.1	LOW	AV:L/AC:L/Au:N/C:P/I:N/A:N		
CVE-2016-7442	2016-10-03T16:09:16.167	2025-04-12T10:46:40.837	"The Frontend component in Sophos UTM with firmware 9.405-5 and earlier allows local administrators to obtain sensitive password information by reading the ""value"" field of the proxy user settings in ""system settings / scan settings / anti spam"" configuration tab."	2.1	LOW	AV:L/AC:L/Au:N/C:P/I:N/A:N		
CVE-2016-7445	2016-10-03T16:09:17.277	2025-04-12T10:46:40.837	convert.c in OpenJPEG before 2.1.2 allows remote attackers to cause a denial of service (NULL pointer dereference and application crash) via vectors involving the variable s.	5.0	MEDIUM	AV:N/AC:L/Au:N/C:N/I:N/A:P		
CVE-2016-1243	2016-10-03T18:59:00.417	2025-04-12T10:46:40.837	Stack-based buffer overflow in the extractTree function in unADF allows remote attackers to execute arbitrary code via a long pathname.	7.5	HIGH	AV:N/AC:L/Au:N/C:P/I:P/A:P		
CVE-2016-1244	2016-10-03T18:59:01.530	2025-04-12T10:46:40.837	The extractTree function in unADF allows remote attackers to execute arbitrary code via shell metacharacters in a directory name in an adf file.	9.3	HIGH	AV:N/AC:M/Au:N/C:C/I:C/A:C		
CVE-2016-1371	2016-10-03T18:59:02.733	2025-04-12T10:46:40.837	ClamAV (aka Clam AntiVirus) before 0.99.2 allows remote attackers to cause a denial of service (application crash) via a crafted mew packer executable.	4.3	MEDIUM	AV:N/AC:M/Au:N/C:N/I:N/A:P		
CVE-2016-1372	2016-10-03T18:59:03.797	2025-04-12T10:46:40.837	ClamAV (aka Clam AntiVirus) before 0.99.2 allows remote attackers to cause a denial of service (application crash) via a crafted 7z file.	4.3	MEDIUM	AV:N/AC:M/Au:N/C:N/I:N/A:P		
CVE-2016-5019	2016-10-03T18:59:04.970	2025-04-12T10:46:40.837	CoreResponseStateManager in Apache MyFaces Trinidad 1.0.0 through 1.0.13, 1.2.x before 1.2.15, 2.0.x before 2.0.2, and 2.1.x before 2.1.2 might allow attackers to conduct deserialization attacks via a crafted serialized view state string.	7.5	HIGH	AV:N/AC:L/Au:N/C:P/I:P/A:P		
CVE-2016-5398	2016-10-03T18:59:06.347	2025-04-12T10:46:40.837	Cross-site scripting (XSS) vulnerability in Business Process Editor in Red Hat JBoss BPM Suite before 6.3.3 allows remote authenticated users to inject arbitrary web script or HTML by levering permission to create business processes.	3.5	LOW	AV:N/AC:M/Au:S/C:N/I:P/A:N		
CVE-2016-5432	2016-10-03T18:59:07.677	2025-04-12T10:46:40.837	The ovirt-engine-provisiondb utility in Red Hat Enterprise Virtualization (RHEV) Engine 4.0 allows local users to obtain sensitive database provisioning information by reading log files.	2.1	LOW	AV:L/AC:L/Au:N/C:P/I:N/A:N		
CVE-2016-6352	2016-10-03T18:59:08.787	2025-04-12T10:46:40.837	The OneLine32 function in io-ico.c in gdk-pixbuf before 2.35.3 allows remote attackers to cause a denial of service (out-of-bounds write and crash) via crafted dimensions in an ICO file.	5.0	MEDIUM	AV:N/AC:L/Au:N/C:N/I:N/A:P		
CVE-2016-6494	2016-10-03T18:59:10.523	2025-04-12T10:46:40.837	The client in MongoDB uses world-readable permissions on .dbshell history files, which might allow local users to obtain sensitive information by reading these files.	2.1	LOW	AV:L/AC:L/Au:N/C:P/I:N/A:N		
CVE-2016-7031	2016-10-03T18:59:12.057	2025-04-12T10:46:40.837	The RGW code in Ceph before 10.0.1, when authenticated-read ACL is applied to a bucket, allows remote attackers to list the bucket contents via a URL.	4.3	MEDIUM	AV:N/AC:M/Au:N/C:P/I:N/A:N		
CVE-2016-7401	2016-10-03T18:59:13.137	2025-04-12T10:46:40.837	The cookie parsing code in Django before 1.8.15 and 1.9.x before 1.9.10, when used on a site with Google Analytics, allows remote attackers to bypass an intended CSRF protection mechanism by setting arbitrary cookies.	5.0	MEDIUM	AV:N/AC:L/Au:N/C:N/I:P/A:N		
CVE-2016-7405	2016-10-03T18:59:14.150	2025-04-12T10:46:40.837	The qstr method in the PDO driver in the ADOdb Library for PHP before 5.x before 5.20.7 might allow remote attackers to conduct SQL injection attacks via vectors related to incorrect quoting.	7.5	HIGH	AV:N/AC:L/Au:N/C:P/I:P/A:P		
CVE-2016-7570	2016-10-03T18:59:15.230	2025-04-12T10:46:40.837	"Drupal 8.x before 8.1.10 does not properly check for ""Administer comments"" permission, which allows remote authenticated users to set the visibility of comments for arbitrary nodes by leveraging rights to edit those nodes."	4.0	MEDIUM	AV:N/AC:L/Au:S/C:P/I:N/A:N		
CVE-2016-7571	2016-10-03T18:59:16.780	2025-04-12T10:46:40.837	Cross-site scripting (XSS) vulnerability in Drupal 8.x before 8.1.10 allows remote attackers to inject arbitrary web script or HTML via vectors involving an HTTP exception.	4.3	MEDIUM	AV:N/AC:M/Au:N/C:N/I:P/A:N		
CVE-2016-7572	2016-10-03T18:59:18.360	2025-04-12T10:46:40.837	"The system.temporary route in Drupal 8.x before 8.1.10 does not properly check for ""Export configuration"" permission, which allows remote authenticated users to bypass intended access restrictions and read a full config export via unspecified vectors."	4.0	MEDIUM	AV:N/AC:L/Au:S/C:P/I:N/A:N		
CVE-2013-4118	2016-10-03T21:59:00.317	2025-04-12T10:46:40.837	FreeRDP before 1.1.0-beta1 allows remote attackers to cause a denial of service (NULL pointer dereference and application crash) via unspecified vectors.	5.0	MEDIUM	AV:N/AC:L/Au:N/C:N/I:N/A:P		
CVE-2013-4119	2016-10-03T21:59:01.423	2025-04-12T10:46:40.837	FreeRDP before 1.1.0-beta+2013071101 allows remote attackers to cause a denial of service (NULL pointer dereference and application crash) by disconnecting before authentication has finished.	5.0	MEDIUM	AV:N/AC:L/Au:N/C:N/I:N/A:P		
CVE-2015-1832	2016-10-03T21:59:02.533	2025-04-12T10:46:40.837	XML external entity (XXE) vulnerability in the SqlXmlUtil code in Apache Derby before 10.12.1.1, when a Java Security Manager is not in place, allows context-dependent attackers to read arbitrary files or cause a denial of service (resource consumption) via vectors involving XmlVTI and the XML datatype.	6.4	MEDIUM	AV:N/AC:L/Au:N/C:P/I:N/A:P		
CVE-2015-8085	2016-10-03T21:59:03.800	2025-04-12T10:46:40.837	Huawei AR routers with software before V200R007C00SPC100; Quidway S9300 routers with software before V200R009C00; S12700 routers with software before V200R008C00SPC500; S9300, Quidway S5300, and S5300 routers with software before V200R007C00; and S5700 routers with software before V200R007C00SPC500 make it easier for remote authenticated administrators to obtain and decrypt passwords by leveraging selection of a reversible encryption algorithm.	4.0	MEDIUM	AV:N/AC:L/Au:S/C:P/I:N/A:N		
CVE-2015-8086	2016-10-03T21:59:04.893	2025-04-12T10:46:40.837	Huawei AR routers with software before V200R007C00SPC100; Quidway S9300 routers with software before V200R009C00; S12700 routers with software before V200R008C00SPC500; S9300, Quidway S5300, and S5300 routers with software before V200R007C00; and S5700 routers with software before V200R007C00SPC500 makes it easier for remote authenticated administrators to obtain encryption keys and ciphertext passwords via vectors related to key storage.	4.0	MEDIUM	AV:N/AC:L/Au:S/C:P/I:N/A:N		
CVE-2016-6905	2016-10-03T21:59:05.957	2025-04-12T10:46:40.837	The read_image_tga function in gd_tga.c in the GD Graphics Library (aka libgd) before 2.2.3 allows remote attackers to cause a denial of service (out-of-bounds read) via a crafted TGA image.	4.3	MEDIUM	AV:N/AC:M/Au:N/C:N/I:N/A:P		
CVE-2016-7046	2016-10-03T21:59:07.127	2025-04-12T10:46:40.837	Red Hat JBoss Enterprise Application Platform (EAP) 7, when operating as a reverse-proxy with default buffer sizes, allows remote attackers to cause a denial of service (CPU and disk consumption) via a long URL.	7.1	HIGH	AV:N/AC:M/Au:N/C:N/I:N/A:C		
CVE-2016-7141	2016-10-03T21:59:08.300	2025-04-12T10:46:40.837	curl and libcurl before 7.50.2, when built with NSS and the libnsspem.so library is available at runtime, allow remote attackers to hijack the authentication of a TLS connection by leveraging reuse of a previously loaded client certificate from file for a connection for which no certificate has been set, a different vulnerability than CVE-2016-5420.	5.0	MEDIUM	AV:N/AC:L/Au:N/C:N/I:P/A:N		
CVE-2016-8276	2016-10-03T21:59:09.457	2025-04-12T10:46:40.837	Buffer overflow in the Point-to-Point Protocol over Ethernet (PPPoE) module in Huawei USG2100, USG2200, USG5100, and USG5500 unified security gateways with software before V300R001C10SPC600, when CHAP authentication is configured on the server, allows remote attackers to cause a denial of service (server restart) or execute arbitrary code via crafted packets sent during authentication.	9.3	HIGH	AV:N/AC:M/Au:N/C:C/I:C/A:C		
CVE-2016-8277	2016-10-03T21:59:10.583	2025-04-12T10:46:40.837	Huawei USG9520, USG9560, and USG9580 unified security gateways with software before V300R001C01SPCa00 allow remote authenticated users to cause a denial of service (device restart) via an unspecified command parameter.	6.8	MEDIUM	AV:N/AC:L/Au:S/C:N/I:N/A:C		
CVE-2016-8278	2016-10-03T21:59:11.693	2025-04-12T10:46:40.837	Huawei USG9520, USG9560, and USG9580 unified security gateways with software before V300R001C01SPCa00 allow remote attackers to cause a denial of service (device restart) via an unspecified URL.	7.8	HIGH	AV:N/AC:L/Au:N/C:N/I:N/A:C		
CVE-2016-8280	2016-10-03T21:59:12.723	2025-04-12T10:46:40.837	Directory traversal vulnerability in Huawei eSight before V300R003C20SPC005 allows remote authenticated users to read arbitrary files via unspecified vectors.	4.0	MEDIUM	AV:N/AC:L/Au:S/C:P/I:N/A:N		
CVE-2016-4990	2016-10-04T14:59:00.220	2023-11-07T02:32:52.597	Rejected reason: DO NOT USE THIS CANDIDATE NUMBER.  ConsultIDs: none.  Reason: This candidate was withdrawn by its CNA.  Further investigation showed that it was not a security issue.  Notes: none					
CVE-2016-0913	2016-10-05T01:59:05.823	2025-04-12T10:46:40.837	The client in EMC Replication Manager (RM) before 5.5.3.0_01-PatchHotfix, EMC Network Module for Microsoft 3.x, and EMC Networker Module for Microsoft 8.2.x before 8.2.3.6 allows remote RM servers to execute arbitrary commands by placing a crafted script in an SMB share.	7.5	HIGH	AV:N/AC:L/Au:N/C:P/I:P/A:P		
CVE-2016-6550	2016-10-05T01:59:38.903	2025-04-12T10:46:40.837	The U by BB&T app 1.5.4 and earlier for iOS does not properly verify X.509 certificates from SSL servers, which allows man-in-the-middle attackers to spoof servers and obtain sensitive information via a crafted certificate.	4.3	MEDIUM	AV:A/AC:M/Au:N/C:P/I:P/A:N		
CVE-2016-6645	2016-10-05T01:59:40.170	2025-04-12T10:46:40.837	The vApp Managers web application in EMC Unisphere for VMAX Virtual Appliance 8.x before 8.3.0 and Solutions Enabler Virtual Appliance 8.x before 8.3.0 allows remote authenticated users to execute arbitrary code via crafted input to the (1) GeneralCmdRequest, (2) PersistantDataRequest, or (3) GetCommandExecRequest class.	9.0	HIGH	AV:N/AC:L/Au:S/C:C/I:C/A:C		
CVE-2016-6646	2016-10-05T01:59:41.217	2025-04-12T10:46:40.837	The vApp Managers web application in EMC Unisphere for VMAX Virtual Appliance 8.x before 8.3.0 and Solutions Enabler Virtual Appliance 8.x before 8.3.0 allows remote attackers to execute arbitrary code via crafted input to the (1) GetSymmCmdRequest or (2) RemoteServiceHandler class.	10.0	HIGH	AV:N/AC:L/Au:N/C:C/I:C/A:C		
CVE-2014-5414	2016-10-05T10:59:00.187	2025-04-12T10:46:40.837	Beckhoff Embedded PC images before 2014-10-22 and Automation Device Specification (ADS) TwinCAT components do not restrict the number of authentication attempts, which makes it easier for remote attackers to obtain access via a brute-force attack.	9.4	HIGH	AV:N/AC:L/Au:N/C:C/I:C/A:N		
CVE-2014-5415	2016-10-05T10:59:01.280	2025-04-12T10:46:40.837	Beckhoff Embedded PC images before 2014-10-22 and Automation Device Specification (ADS) TwinCAT components might allow remote attackers to obtain access via the (1) Windows CE Remote Configuration Tool, (2) CE Remote Display service, or (3) TELNET service.	9.4	HIGH	AV:N/AC:L/Au:N/C:C/I:C/A:N		
CVE-2016-2307	2016-10-05T10:59:02.280	2025-04-12T10:46:40.837	American Auto-Matrix Aspect-Nexus Building Automation Front-End Solutions application before 3.0.0 and Aspect-Matrix Building Automation Front-End Solutions application allow remote attackers to read arbitrary files via unspecified vectors, as demonstrated by the configuration file.	5.0	MEDIUM	AV:N/AC:L/Au:N/C:P/I:N/A:N		
CVE-2016-2308	2016-10-05T10:59:03.377	2025-04-12T10:46:40.837	American Auto-Matrix Aspect-Nexus Building Automation Front-End Solutions application before 3.0.0 and Aspect-Matrix Building Automation Front-End Solutions application store passwords in cleartext, which allows remote attackers to obtain sensitive information by reading a file.	7.5	HIGH	AV:N/AC:L/Au:N/C:P/I:P/A:P		
CVE-2016-4387	2016-10-05T10:59:04.937	2025-04-12T10:46:40.837	The Filter SDK in HPE KeyView 10.18 through 10.24 allows remote attackers to execute arbitrary code via unspecified vectors, a different vulnerability than CVE-2016-4388, CVE-2016-4389, and CVE-2016-4390.	6.8	MEDIUM	AV:N/AC:M/Au:N/C:P/I:P/A:P		
CVE-2016-4388	2016-10-05T10:59:06.267	2025-04-12T10:46:40.837	The Filter SDK in HPE KeyView 10.18 through 10.24 allows remote attackers to execute arbitrary code via unspecified vectors, a different vulnerability than CVE-2016-4387, CVE-2016-4389, and CVE-2016-4390.	6.8	MEDIUM	AV:N/AC:M/Au:N/C:P/I:P/A:P		
CVE-2016-4389	2016-10-05T10:59:07.720	2025-04-12T10:46:40.837	The Filter SDK in HPE KeyView 10.18 through 10.24 allows remote attackers to execute arbitrary code via unspecified vectors, a different vulnerability than CVE-2016-4387, CVE-2016-4388, and CVE-2016-4390.	6.8	MEDIUM	AV:N/AC:M/Au:N/C:P/I:P/A:P		
CVE-2016-4390	2016-10-05T10:59:09.173	2025-04-12T10:46:40.837	The Filter SDK in HPE KeyView 10.18 through 10.24 allows remote attackers to execute arbitrary code via unspecified vectors, a different vulnerability than CVE-2016-4387, CVE-2016-4388, and CVE-2016-4389.	6.8	MEDIUM	AV:N/AC:M/Au:N/C:P/I:P/A:P		
CVE-2016-5084	2016-10-05T10:59:10.640	2025-04-12T10:46:40.837	Johnson & Johnson Animas OneTouch Ping devices do not use encryption for certain data, which might allow remote attackers to obtain sensitive information by sniffing the network.	5.0	MEDIUM	AV:N/AC:L/Au:N/C:P/I:N/A:N		
CVE-2016-5085	2016-10-05T10:59:11.643	2025-04-12T10:46:40.837	Johnson & Johnson Animas OneTouch Ping devices do not properly generate random numbers, which makes it easier for remote attackers to spoof meters by sniffing the network and then engaging in an authentication handshake.	7.8	HIGH	AV:N/AC:L/Au:N/C:N/I:C/A:N		
CVE-2016-5086	2016-10-05T10:59:12.923	2025-04-12T10:46:40.837	Johnson & Johnson Animas OneTouch Ping devices allow remote attackers to bypass authentication via replay attacks.	9.3	HIGH	AV:N/AC:M/Au:N/C:C/I:C/A:C		
CVE-2016-5686	2016-10-05T10:59:14.267	2025-04-12T10:46:40.837	Johnson & Johnson Animas OneTouch Ping devices mishandle acknowledgements, which makes it easier for remote attackers to bypass authentication via a custom communication protocol.	9.3	HIGH	AV:N/AC:M/Au:N/C:C/I:C/A:C		
CVE-2016-5892	2016-10-05T10:59:15.547	2025-04-12T10:46:40.837	Cross-site scripting (XSS) vulnerability in IBM 10x, as used in Multi-Enterprise Integration Gateway 1.x through 1.0.0.1 and B2B Advanced Communications before 1.0.0.5_2, allows remote authenticated users to inject arbitrary web script or HTML via unspecified vectors.	3.5	LOW	AV:N/AC:M/Au:S/C:N/I:P/A:N		
CVE-2016-5901	2016-10-05T10:59:16.877	2025-04-12T10:46:40.837	Cross-site scripting (XSS) vulnerability in a test page in IBM Business Process Manager Advanced 8.5.6.0 through 8.5.7.0 before cumulative fix 2016.09 allows remote authenticated users to inject arbitrary web script or HTML via unspecified vectors.	3.5	LOW	AV:N/AC:M/Au:S/C:N/I:P/A:N		
CVE-2016-5983	2016-10-05T10:59:18.110	2025-04-12T10:46:40.837	IBM WebSphere Application Server (WAS) 7.0 before 7.0.0.43, 8.0 before 8.0.0.13, 8.5 before 8.5.5.11, 9.0 before 9.0.0.2, and Liberty before 16.0.0.4 allows remote authenticated users to execute arbitrary Java code via a crafted serialized object.	6.5	MEDIUM	AV:N/AC:L/Au:S/C:P/I:P/A:P		
CVE-2016-6419	2016-10-05T10:59:19.393	2025-04-12T10:46:40.837	SQL injection vulnerability in Cisco Firepower Management Center 4.10.3 through 5.4.0 allows remote authenticated users to execute arbitrary SQL commands via unspecified vectors, aka Bug ID CSCur25485.	6.0	MEDIUM	AV:N/AC:M/Au:S/C:P/I:P/A:P		
CVE-2016-6420	2016-10-05T10:59:20.550	2025-04-12T10:46:40.837	Cisco FireSIGHT System Software 4.10.3 through 5.4.0 in Firepower Management Center allows remote authenticated users to bypass authorization checks and gain privileges via a crafted HTTP request, aka Bug ID CSCur25467.	6.8	MEDIUM	AV:N/AC:L/Au:S/C:C/I:N/A:N		
CVE-2016-8343	2016-10-05T10:59:21.690	2025-04-12T10:46:40.837	Directory traversal vulnerability in INDAS Web SCADA before 3 allows remote attackers to read arbitrary files via unspecified vectors.	5.0	MEDIUM	AV:N/AC:L/Au:N/C:P/I:N/A:N		
CVE-2016-1246	2016-10-05T16:59:00.243	2025-04-12T10:46:40.837	Buffer overflow in the DBD::mysql module before 4.037 for Perl allows context-dependent attackers to cause a denial of service (crash) via vectors related to an error message.	5.0	MEDIUM	AV:N/AC:L/Au:N/C:N/I:N/A:P		
CVE-2016-4551	2016-10-05T16:59:02.757	2025-04-12T10:46:40.837	The (1) SAP_BASIS and (2) SAP_ABA components 7.00 SP Level 0031 in SAP NetWeaver 2004s might allow remote attackers to spoof IP addresses written to the Security Audit Log via vectors related to the network landscape, aka SAP Security Note 2190621.	5.0	MEDIUM	AV:N/AC:L/Au:N/C:N/I:P/A:N		
CVE-2016-5745	2016-10-05T16:59:03.790	2025-04-12T10:46:40.837	F5 BIG-IP LTM systems 11.x before 11.2.1 HF16, 11.3.x, 11.4.x before 11.4.1 HF11, 11.5.0, 11.5.1 before HF11, 11.5.2, 11.5.3, 11.5.4 before HF2, 11.6.0 before HF8, 11.6.1 before HF1, 12.0.0 before HF4, and 12.1.0 before HF2 allow remote attackers to modify or extract system configuration files via vectors involving NAT64.	10.0	HIGH	AV:N/AC:L/Au:N/C:C/I:C/A:C		
CVE-2016-6652	2016-10-05T16:59:04.757	2025-04-12T10:46:40.837	SQL injection vulnerability in Pivotal Spring Data JPA before 1.9.6 (Gosling SR6) and 1.10.x before 1.10.4 (Hopper SR4), when used with a repository that defines a String query using the @Query annotation, allows attackers to execute arbitrary JPQL commands via a sort instance with a function call.	6.8	MEDIUM	AV:N/AC:M/Au:N/C:P/I:P/A:P		
CVE-2016-7161	2016-10-05T16:59:05.743	2025-04-12T10:46:40.837	Heap-based buffer overflow in the .receive callback of xlnx.xps-ethernetlite in QEMU (aka Quick Emulator) allows attackers to execute arbitrary code on the QEMU host via a large ethlite packet.	9.8	CRITICAL	CVSS:3.1/AV:N/AC:L/PR:N/UI:N/S:U/C:H/I:H/A:H		
CVE-2016-7435	2016-10-05T16:59:06.807	2025-04-12T10:46:40.837	The (1) SCTC_REFRESH_EXPORT_TAB_COMP, (2) SCTC_REFRESH_CHECK_ENV, and (3) SCTC_TMS_MAINTAIN_ALOG functions in the SCTC subpackage in SAP Netweaver 7.40 SP 12 allow remote authenticated users with certain permissions to execute arbitrary commands via vectors involving a CALL 'SYSTEM' statement, aka SAP Security Note 2260344.	9.0	HIGH	AV:N/AC:L/Au:S/C:C/I:C/A:C		
