CVE ID	Published Date	Last Modified Date	Description	Base Score	Base Severity	Vector String	Vendor	Product
CVE-2017-14648	2017-09-21T17:29:00.510	2025-04-20T01:37:25.860	A global buffer overflow was discovered in the iteration_loop function in loop.c in BladeEnc version 0.94.2. The vulnerability causes an out-of-bounds write, which leads to remote denial of service or possibly code execution.	9.8	CRITICAL	CVSS:3.1/AV:N/AC:L/PR:N/UI:N/S:U/C:H/I:H/A:H		
CVE-2017-14649	2017-09-21T17:29:00.557	2025-04-20T01:37:25.860	ReadOneJNGImage in coders/png.c in GraphicsMagick version 1.3.26 does not properly validate JNG data, leading to a denial of service (assertion failure in magick/pixel_cache.c, and application crash).	4.3	MEDIUM	AV:N/AC:M/Au:N/C:N/I:N/A:P		
CVE-2017-14650	2017-09-21T17:29:00.590	2025-04-20T01:37:25.860	"A Remote Code Execution vulnerability has been found in the Horde_Image library when using the ""Im"" backend that utilizes ImageMagick's ""convert"" utility. It's not exploitable through any Horde application, because the code path to the vulnerability is not used by any Horde code. Custom applications using the Horde_Image library might be affected. This vulnerability affects all versions of Horde_Image from 2.0.0 to 2.5.1, and is fixed in 2.5.2. The problem is missing input validation of the index field in _raw() during construction of an ImageMagick command line."	6.8	MEDIUM	AV:N/AC:M/Au:N/C:P/I:P/A:P		
CVE-2017-14651	2017-09-21T18:29:00.167	2025-04-20T01:37:25.860	WSO2 Data Analytics Server 3.1.0 has XSS in carbon/resources/add_collection_ajaxprocessor.jsp via the collectionName or parentPath parameter.	4.8	MEDIUM	CVSS:3.1/AV:N/AC:L/PR:H/UI:R/S:C/C:L/I:L/A:N		
CVE-2017-14652	2017-09-21T20:29:00.287	2025-04-20T01:37:25.860	SQL Injection vulnerability in mobiquo/lib/classTTForum.php in the Tapatalk plugin before 4.5.8 for MyBB allows an unauthenticated remote attacker to inject arbitrary SQL commands via an XML-RPC encoded document sent as part of the user registration process.	7.5	HIGH	AV:N/AC:L/Au:N/C:P/I:P/A:P		
CVE-2017-12170	2017-09-21T21:29:00.213	2025-04-20T01:37:25.860	Downstream version 1.0.46-1 of pure-ftpd as shipped in Fedora was vulnerable to packaging error due to which the original configuration was ignored after update and service started running with default configuration. This has security implications because of overriding security-related configuration. This issue doesn't affect upstream version of pure-ftpd.	7.5	HIGH	AV:N/AC:L/Au:N/C:P/I:P/A:P		
CVE-2017-7544	2017-09-21T21:29:00.400	2025-04-20T01:37:25.860	libexif through 0.6.21 is vulnerable to out-of-bounds heap read vulnerability in exif_data_save_data_entry function in libexif/exif-data.c caused by improper length computation of the allocated data of an ExifMnote entry which can cause denial-of-service or possibly information disclosure.	6.4	MEDIUM	AV:N/AC:L/Au:N/C:P/I:N/A:P		
CVE-2017-7549	2017-09-21T21:29:00.447	2025-04-20T01:37:25.860	A flaw was found in instack-undercloud 7.2.0 as packaged in Red Hat OpenStack Platform Pike, 6.1.0 as packaged in Red Hat OpenStack Platform Oacta, 5.3.0 as packaged in Red Hat OpenStack Newton, where pre-install and security policy scripts used insecure temporary files. A local user could exploit this flaw to conduct a symbolic-link attack, allowing them to overwrite the contents of arbitrary files.	3.3	LOW	AV:L/AC:M/Au:N/C:P/I:P/A:N		
CVE-2017-9281	2017-09-21T22:29:00.190	2025-04-20T01:37:25.860	An integer overflow (CWE-190) potentially causing an out-of-bounds read (CWE-125) vulnerability in Micro Focus VisiBroker 8.5 can lead to a denial of service.	5.0	MEDIUM	AV:N/AC:L/Au:N/C:N/I:N/A:P		
CVE-2017-9282	2017-09-21T22:29:00.283	2025-04-20T01:37:25.860	An integer overflow (CWE-190) led to an out-of-bounds write (CWE-787) on a heap-allocated area, leading to heap corruption in Micro Focus VisiBroker 8.5. The feasibility of leveraging this vulnerability for further attacks was not assessed.	7.5	HIGH	AV:N/AC:L/Au:N/C:P/I:P/A:P		
CVE-2017-9283	2017-09-21T22:29:00.393	2025-04-20T01:37:25.860	An out-of-bounds read (CWE-125) vulnerability exists in Micro Focus VisiBroker 8.5. The feasibility of leveraging this vulnerability for further attacks was not assessed.	7.5	HIGH	AV:N/AC:L/Au:N/C:P/I:P/A:P		
CVE-2017-14680	2017-09-21T23:29:00.210	2025-04-20T01:37:25.860	ZKTeco ZKTime Web 2.0.1.12280 allows remote attackers to obtain sensitive employee metadata via a direct request for a PDF document.	5.0	MEDIUM	AV:N/AC:L/Au:N/C:P/I:N/A:N		
CVE-2017-14681	2017-09-21T23:29:00.273	2025-04-20T01:37:25.860	"The daemon in P3Scan 3.0_rc1 and earlier creates a p3scan.pid file after dropping privileges to a non-root account, which might allow local users to kill arbitrary processes by leveraging access to this non-root account for p3scan.pid modification before a root script executes a ""kill `cat /pathname/p3scan.pid`"" command, as demonstrated by etc/init.d/p3scan."	2.1	LOW	AV:L/AC:L/Au:N/C:N/I:N/A:P		
CVE-2017-14682	2017-09-21T23:29:00.303	2025-04-20T01:37:25.860	GetNextToken in MagickCore/token.c in ImageMagick 7.0.6 allows remote attackers to cause a denial of service (heap-based buffer overflow and application crash) or possibly have unspecified other impact via a crafted SVG document, a different vulnerability than CVE-2017-10928.	6.8	MEDIUM	AV:N/AC:M/Au:N/C:P/I:P/A:P		
CVE-2017-14684	2017-09-22T01:29:25.267	2025-04-20T01:37:25.860	In ImageMagick 7.0.7-4 Q16, a memory leak vulnerability was found in the function ReadVIPSImage in coders/vips.c, which allows attackers to cause a denial of service (memory consumption in ResizeMagickMemory in MagickCore/memory.c) via a crafted file.	7.1	HIGH	AV:N/AC:M/Au:N/C:N/I:N/A:C		
CVE-2017-8007	2017-09-22T01:29:25.467	2025-04-20T01:37:25.860	In EMC ViPR SRM, Storage M&R, VNX M&R, and M&R (Watch4Net) for SAS Solution Packs, the Webservice Gateway is affected by a directory traversal vulnerability. Attackers with knowledge of Webservice Gateway credentials could potentially exploit this vulnerability to access unauthorized information, and modify or delete data, by supplying specially crafted strings in input parameters of the web service call.	8.8	HIGH	CVSS:3.1/AV:N/AC:L/PR:L/UI:N/S:U/C:H/I:H/A:H		
CVE-2017-8012	2017-09-22T01:29:25.500	2025-04-20T01:37:25.860	In EMC ViPR SRM, Storage M&R, VNX M&R, and M&R (Watch4Net) for SAS Solution Packs, the Java Management Extensions (JMX) protocol used to communicate between components in the Alerting and/or Compliance components can be leveraged to create a denial of service (DoS) condition. Attackers with knowledge of JMX agent user credentials could potentially exploit this vulnerability to create arbitrary files on the affected system and create a DoS condition by leveraging inherent JMX protocol capabilities.	7.4	HIGH	CVSS:3.1/AV:N/AC:H/PR:N/UI:N/S:U/C:N/I:H/A:H		
CVE-2017-14685	2017-09-22T06:29:00.207	2025-04-20T01:37:25.860	"Artifex MuPDF 1.11 allows attackers to cause a denial of service or possibly have unspecified other impact via a crafted .xps file, related to ""Data from Faulting Address controls Branch Selection starting at mupdf+0x000000000016aa61"" on Windows. This occurs because xps_load_links_in_glyphs in xps/xps-link.c does not verify that an xps font could be loaded."	6.8	MEDIUM	AV:N/AC:M/Au:N/C:P/I:P/A:P		
CVE-2017-14686	2017-09-22T06:29:00.267	2025-04-20T01:37:25.860	"Artifex MuPDF 1.11 allows attackers to execute arbitrary code or cause a denial of service via a crafted .xps file, related to a ""User Mode Write AV near NULL starting at wow64!Wow64NotifyDebugger+0x000000000000001d"" on Windows. This occurs because read_zip_dir_imp in fitz/unzip.c does not check whether size fields in a ZIP entry are negative numbers."	6.8	MEDIUM	AV:N/AC:M/Au:N/C:P/I:P/A:P		
CVE-2017-14687	2017-09-22T06:29:00.317	2025-04-20T01:37:25.860	"Artifex MuPDF 1.11 allows attackers to cause a denial of service or possibly have unspecified other impact via a crafted .xps file, related to ""Data from Faulting Address controls Branch Selection starting at mupdf+0x000000000016cb4f"" on Windows. This occurs because of mishandling of XML tag name comparisons."	6.8	MEDIUM	AV:N/AC:M/Au:N/C:P/I:P/A:P		
CVE-2017-14636	2017-09-22T07:29:00.207	2025-04-20T01:37:25.860	Because of an integer overflow in sam2p 0.49.3, a loop executes 0xffffffff times, ending with an invalid read of size 1 in the Image::Indexed::sortPal function in image.cpp. However, this also causes memory corruption because of an attempted write to the invalid d[0xfffffffe] array element.	7.5	HIGH	AV:N/AC:L/Au:N/C:P/I:P/A:P		
CVE-2017-14637	2017-09-22T07:29:00.267	2025-04-20T01:37:25.860	In sam2p 0.49.3, there is an invalid read of size 2 in the parse_rgb function in in_xpm.cpp. However, this can also cause a write to an illegal address.	7.5	HIGH	AV:N/AC:L/Au:N/C:P/I:P/A:P		
CVE-2017-14653	2017-09-22T07:29:00.300	2025-04-20T01:37:25.860	member/Orderinfo.asp in ASP4CMS AspCMS 2.7.2 allows remote authenticated users to read arbitrary order information via a modified OrderNo parameter.	4.0	MEDIUM	AV:N/AC:L/Au:S/C:P/I:N/A:N		
CVE-2017-14688	2017-09-22T08:29:00.193	2025-04-20T01:37:25.860	"STDU Viewer 1.6.375 allows attackers to cause a denial of service or possibly have unspecified other impact via a crafted .djvu file, related to a ""Read Access Violation starting at STDUDjVuFile!DllUnregisterServer+0x000000000000d917."""	4.6	MEDIUM	AV:L/AC:L/Au:N/C:P/I:P/A:P		
CVE-2017-14689	2017-09-22T08:29:00.270	2025-04-20T01:37:25.860	"STDU Viewer 1.6.375 allows attackers to cause a denial of service or possibly have unspecified other impact via a crafted .djvu file, related to ""Data from Faulting Address is used as one or more arguments in a subsequent Function Call starting at STDUDjVuFile!DllUnregisterServer+0x000000000000328e."""	4.6	MEDIUM	AV:L/AC:L/Au:N/C:P/I:P/A:P		
CVE-2017-14690	2017-09-22T08:29:00.300	2025-04-20T01:37:25.860	"STDU Viewer 1.6.375 allows attackers to execute arbitrary code or cause a denial of service via a crafted .jb2 file, related to ""Data from Faulting Address controls subsequent Write Address starting at STDUJBIG2File!DllGetClassObject+0x00000000000064e7."""	4.6	MEDIUM	AV:L/AC:L/Au:N/C:P/I:P/A:P		
CVE-2017-14691	2017-09-22T08:29:00.347	2025-04-20T01:37:25.860	"STDU Viewer 1.6.375 allows attackers to cause a denial of service or possibly have unspecified other impact via a crafted .jb2 file, related to ""Data from Faulting Address controls Branch Selection starting at ntdll_773a0000!RtlAddAccessAllowedAce+0x000000000000027a."""	4.6	MEDIUM	AV:L/AC:L/Au:N/C:P/I:P/A:P		
CVE-2017-14692	2017-09-22T08:29:00.380	2025-04-20T01:37:25.860	"STDU Viewer 1.6.375 allows attackers to execute arbitrary code or cause a denial of service via a crafted .jb2 file, related to a ""User Mode Write AV starting at STDUJBIG2File!DllGetClassObject+0x000000000000653b."""	4.6	MEDIUM	AV:L/AC:L/Au:N/C:P/I:P/A:P		
CVE-2017-14693	2017-09-22T08:29:00.410	2025-04-20T01:37:25.860	"IrfanView 4.44 - 32bit allows attackers to cause a denial of service or possibly have unspecified other impact via a crafted .djvu file, related to ""Data from Faulting Address controls Branch Selection starting at DJVU!GetPlugInInfo+0x000000000001c613."""	4.6	MEDIUM	AV:L/AC:L/Au:N/C:P/I:P/A:P		
CVE-2017-3763	2017-09-22T14:29:00.197	2025-04-20T01:37:25.860	An attacker who obtains access to the location where the LXCA file system is stored may be able to access credentials of local LXCA accounts in LXCA versions earlier than 1.3.2.	2.1	LOW	AV:L/AC:L/Au:N/C:P/I:N/A:N		
CVE-2017-3770	2017-09-22T14:29:00.243	2025-04-20T01:37:25.860	Privilege escalation vulnerability in LXCA versions earlier than 1.3.2 where an authenticated user may be able to abuse certain web interface functionality to execute privileged commands within the underlying LXCA operating system.	6.5	MEDIUM	AV:N/AC:L/Au:S/C:P/I:P/A:P		
CVE-2017-9393	2017-09-22T14:29:00.273	2025-04-20T01:37:25.860	CA Identity Manager r12.6 to r12.6 SP8, 14.0, and 14.1 allows remote attackers to potentially identify passwords of locked accounts through an exhaustive search.	5.0	MEDIUM	AV:N/AC:L/Au:N/C:P/I:N/A:N		
CVE-2017-11395	2017-09-22T16:29:00.197	2025-04-20T01:37:25.860	Command injection vulnerability in Trend Micro Smart Protection Server (Standalone) 3.1 and 3.2 server administration UI allows attackers with authenticated access to execute arbitrary code on vulnerable installations.	6.5	MEDIUM	AV:N/AC:L/Au:S/C:P/I:P/A:P		
CVE-2017-11396	2017-09-22T16:29:00.247	2025-04-20T01:37:25.860	Vulnerability issues with the web service inspection of input parameters in Trend Micro Web Security Virtual Appliance 6.5 may allow potential attackers who already have administration rights to the console to implement remote code injections.	7.2	HIGH	CVSS:3.1/AV:N/AC:L/PR:H/UI:N/S:U/C:H/I:H/A:H		
CVE-2017-14078	2017-09-22T16:29:00.277	2025-04-20T01:37:25.860	SQL Injection vulnerabilities in Trend Micro Mobile Security (Enterprise) versions before 9.7 Patch 3 allow remote attackers to execute arbitrary code on vulnerable installations.	10.0	HIGH	AV:N/AC:L/Au:N/C:C/I:C/A:C		
CVE-2017-14079	2017-09-22T16:29:00.480	2025-04-20T01:37:25.860	Unrestricted file uploads in Trend Micro Mobile Security (Enterprise) versions before 9.7 Patch 3 allow remote attackers to execute arbitrary code on vulnerable installations.	6.5	MEDIUM	AV:N/AC:L/Au:S/C:P/I:P/A:P		
CVE-2017-14080	2017-09-22T16:29:00.557	2025-04-20T01:37:25.860	Authentication bypass vulnerability in Trend Micro Mobile Security (Enterprise) versions before 9.7 Patch 3 allows attackers to access a specific part of the console using a blank password.	7.5	HIGH	AV:N/AC:L/Au:N/C:P/I:P/A:P		
CVE-2017-14081	2017-09-22T16:29:00.603	2025-04-20T01:37:25.860	Proxy command injection vulnerabilities in Trend Micro Mobile Security (Enterprise) versions before 9.7 Patch 3 allow remote attackers to execute arbitrary code on vulnerable installations.	6.5	MEDIUM	AV:N/AC:L/Au:S/C:P/I:P/A:P		
CVE-2017-6266	2017-09-22T17:29:00.210	2025-04-20T01:37:25.860	NVIDIA GPU Display Driver contains a vulnerability in the kernel mode layer handler where improper access controls could allow unprivileged users to cause a denial of service.	4.9	MEDIUM	AV:L/AC:L/Au:N/C:N/I:N/A:C		
CVE-2017-6267	2017-09-22T17:29:00.243	2025-04-20T01:37:25.860	NVIDIA GPU Display Driver contains a vulnerability in the kernel mode layer handler where an incorrect initialization of internal objects can cause an infinite loop which may lead to a denial of service.	4.9	MEDIUM	AV:L/AC:L/Au:N/C:N/I:N/A:C		
CVE-2017-6268	2017-09-22T17:29:00.273	2025-04-20T01:37:25.860	NVIDIA Windows GPU Display Driver contains a vulnerability in the kernel mode layer (nvlddmkm.sys) handler for DxgkDdiEscape where a value passed from a user to the driver is not correctly validated and used as the index to an array which may lead to denial of service or possible escalation of privileges.	7.2	HIGH	AV:L/AC:L/Au:N/C:C/I:C/A:C		
CVE-2017-6269	2017-09-22T17:29:00.320	2025-04-20T01:37:25.860	NVIDIA Windows GPU Display Driver contains a vulnerability in the kernel mode layer (nvlddmkm.sys) handler for DxgkDdiEscape where a pointer passed from a user to the driver is used without validation which may lead to denial of service or possible escalation of privileges.	7.2	HIGH	AV:L/AC:L/Au:N/C:C/I:C/A:C		
CVE-2017-6270	2017-09-22T17:29:00.353	2025-04-20T01:37:25.860	NVIDIA Windows GPU Display Driver contains a vulnerability in the kernel mode layer handler for DxgkDdiCreateAllocation where untrusted user input is used as a divisor without validation during a calculation which may lead to a potential divide by zero and denial of service.	4.9	MEDIUM	AV:L/AC:L/Au:N/C:N/I:N/A:C		
CVE-2017-6271	2017-09-22T17:29:00.383	2025-04-20T01:37:25.860	NVIDIA Windows GPU Display Driver contains a vulnerability in the kernel mode layer handler for DxgkDdiCreateAllocation where untrusted user input is used as a divisor without validation while processing block linear information which may lead to a potential divide by zero and denial of service.	4.9	MEDIUM	AV:L/AC:L/Au:N/C:N/I:N/A:C		
CVE-2017-6272	2017-09-22T17:29:00.430	2025-04-20T01:37:25.860	NVIDIA GPU Display Driver contains a vulnerability in the kernel mode layer handler where a value passed from a user to the driver is not correctly validated and used as the index to an array which may lead to a denial of service or possible escalation of privileges.	7.2	HIGH	AV:L/AC:L/Au:N/C:C/I:C/A:C		
CVE-2017-6277	2017-09-22T17:29:00.460	2025-04-20T01:37:25.860	NVIDIA Windows GPU Display Driver contains a vulnerability in the kernel mode layer (nvlddmkm.sys) handler for DxgkDdiEscape where a value passed from a user to the driver is not correctly validated and used as the index to an array which may lead to denial of service or possible escalation of privileges.	7.2	HIGH	AV:L/AC:L/Au:N/C:C/I:C/A:C		
CVE-2017-14705	2017-09-22T18:29:00.187	2025-04-20T01:37:25.860	DenyAll WAF before 6.4.1 allows unauthenticated remote command execution via TCP port 3001 because shell metacharacters can be inserted into the type parameter to the tailDateFile function in /webservices/stream/tail.php. An iToken authentication parameter is required but can be obtained by exploiting CVE-2017-14706. This affects DenyAll i-Suite LTS 5.5.0 through 5.5.12, i-Suite 5.6, Web Application Firewall 5.7, and Web Application Firewall 6.x before 6.4.1, with On Premises or AWS/Azure cloud deployments.	9.3	HIGH	AV:N/AC:M/Au:N/C:C/I:C/A:C		
CVE-2017-14706	2017-09-22T18:29:00.250	2025-04-20T01:37:25.860	DenyAll WAF before 6.4.1 allows unauthenticated remote attackers to obtain authentication information by making a typeOf=debug request to /webservices/download/index.php, and then reading the iToken field in the reply. This affects DenyAll i-Suite LTS 5.5.0 through 5.5.12, i-Suite 5.6, Web Application Firewall 5.7, and Web Application Firewall 6.x before 6.4.1, with On Premises or AWS/Azure cloud deployments.	7.5	HIGH	AV:N/AC:L/Au:N/C:P/I:P/A:P		
CVE-2017-14694	2017-09-22T19:29:00.197	2025-04-20T01:37:25.860	"Foxit Reader 8.3.2.25013 and earlier and Foxit PhantomPDF 8.3.2.25013 and earlier, when running in single instance mode, allows attackers to execute arbitrary code or cause a denial of service via a crafted .pdf file, related to ""Data from Faulting Address controls Code Flow starting at tiptsf!CPenInputPanel::FinalRelease+0x000000000000002f.""."	4.6	MEDIUM	AV:L/AC:L/Au:N/C:P/I:P/A:P		
CVE-2017-14712	2017-09-22T19:29:00.243	2025-04-20T01:37:25.860	In EPESI 1.8.2 rev20170830, there is Stored XSS in the Tasks Phonecall Notes Title parameter.	3.5	LOW	AV:N/AC:M/Au:S/C:N/I:P/A:N		
CVE-2017-14713	2017-09-22T19:29:00.273	2025-04-20T01:37:25.860	In EPESI 1.8.2 rev20170830, there is Stored XSS in the Phonecalls Description parameter.	3.5	LOW	AV:N/AC:M/Au:S/C:N/I:P/A:N		
CVE-2017-14714	2017-09-22T19:29:00.307	2025-04-20T01:37:25.860	In EPESI 1.8.2 rev20170830, there is Stored XSS in the Phonecalls Subject parameter.	3.5	LOW	AV:N/AC:M/Au:S/C:N/I:P/A:N		
CVE-2017-14715	2017-09-22T19:29:00.353	2025-04-20T01:37:25.860	In EPESI 1.8.2 rev20170830, there is Stored XSS in the Tasks Alerts Title parameter.	3.5	LOW	AV:N/AC:M/Au:S/C:N/I:P/A:N		
CVE-2017-14716	2017-09-22T19:29:00.383	2025-04-20T01:37:25.860	In EPESI 1.8.2 rev20170830, there is Stored XSS in the Tasks Title parameter.	3.5	LOW	AV:N/AC:M/Au:S/C:N/I:P/A:N		
CVE-2017-14717	2017-09-22T19:29:00.417	2025-04-20T01:37:25.860	In EPESI 1.8.2 rev20170830, there is Stored XSS in the Tasks Description parameter.	3.5	LOW	AV:N/AC:M/Au:S/C:N/I:P/A:N		
CVE-2017-14627	2017-09-23T20:29:00.187	2025-04-20T01:37:25.860	Stack-based buffer overflows in CyberLink LabelPrint 2.5 allow remote attackers to execute arbitrary code via the (1) author (inside the INFORMATION tag), (2) name (inside the INFORMATION tag), (3) artist (inside the TRACK tag), or (4) default (inside the TEXT tag) parameter in an lpp project file.	6.8	MEDIUM	AV:N/AC:M/Au:N/C:P/I:P/A:P		
CVE-2017-14718	2017-09-23T20:29:00.247	2025-04-20T01:37:25.860	Before version 4.8.2, WordPress was susceptible to a Cross-Site Scripting attack in the link modal via a javascript: or data: URL.	4.3	MEDIUM	AV:N/AC:M/Au:N/C:N/I:P/A:N		
CVE-2017-14719	2017-09-23T20:29:00.280	2025-04-20T01:37:25.860	Before version 4.8.2, WordPress was vulnerable to a directory traversal attack during unzip operations in the ZipArchive and PclZip components.	5.0	MEDIUM	AV:N/AC:L/Au:N/C:P/I:N/A:N		
CVE-2017-14720	2017-09-23T20:29:00.310	2025-04-20T01:37:25.860	Before version 4.8.2, WordPress allowed a Cross-Site scripting attack in the template list view via a crafted template name.	4.3	MEDIUM	AV:N/AC:M/Au:N/C:N/I:P/A:N		
CVE-2017-14721	2017-09-23T20:29:00.343	2025-04-20T01:37:25.860	Before version 4.8.2, WordPress allowed Cross-Site scripting in the plugin editor via a crafted plugin name.	4.3	MEDIUM	AV:N/AC:M/Au:N/C:N/I:P/A:N		
CVE-2017-14722	2017-09-23T20:29:00.390	2025-04-20T01:37:25.860	Before version 4.8.2, WordPress allowed a Directory Traversal attack in the Customizer component via a crafted theme filename.	5.0	MEDIUM	AV:N/AC:L/Au:N/C:P/I:N/A:N		
CVE-2017-14723	2017-09-23T20:29:00.420	2025-04-20T01:37:25.860	Before version 4.8.2, WordPress mishandled % characters and additional placeholder values in $wpdb->prepare, and thus did not properly address the possibility of plugins and themes enabling SQL injection attacks.	7.5	HIGH	AV:N/AC:L/Au:N/C:P/I:P/A:P		
CVE-2017-14724	2017-09-23T20:29:00.467	2025-04-20T01:37:25.860	Before version 4.8.2, WordPress was vulnerable to cross-site scripting in oEmbed discovery.	4.3	MEDIUM	AV:N/AC:M/Au:N/C:N/I:P/A:N		
CVE-2017-14725	2017-09-23T20:29:00.513	2025-04-20T01:37:25.860	Before version 4.8.2, WordPress was susceptible to an open redirect attack in wp-admin/edit-tag-form.php and wp-admin/user-edit.php.	4.9	MEDIUM	AV:N/AC:M/Au:S/C:P/I:P/A:N		
CVE-2017-14726	2017-09-23T20:29:00.547	2025-04-20T01:37:25.860	Before version 4.8.2, WordPress was vulnerable to a cross-site scripting attack via shortcodes in the TinyMCE visual editor.	4.3	MEDIUM	AV:N/AC:M/Au:N/C:N/I:P/A:N		
CVE-2017-14727	2017-09-23T20:29:00.577	2025-04-20T01:37:25.860	logger.c in the logger plugin in WeeChat before 1.9.1 allows a crash via strftime date/time specifiers, because a buffer is not initialized.	5.0	MEDIUM	AV:N/AC:L/Au:N/C:N/I:N/A:P		
CVE-2017-14506	2017-09-25T08:29:00.200	2025-04-20T01:37:25.860	geminabox (aka Gem in a Box) before 0.13.6 has XSS, as demonstrated by uploading a gem file that has a crafted gem.homepage value in its .gemspec file.	5.4	MEDIUM	CVSS:3.1/AV:N/AC:L/PR:L/UI:R/S:C/C:L/I:L/A:N		
CVE-2017-14683	2017-09-25T08:29:00.247	2025-04-20T01:37:25.860	geminabox (aka Gem in a Box) before 0.13.7 has CSRF, as demonstrated by an unintended gem upload.	8.8	HIGH	CVSS:3.1/AV:N/AC:L/PR:N/UI:R/S:U/C:H/I:H/A:H		
CVE-2017-1235	2017-09-25T16:29:00.210	2025-04-20T01:37:25.860	IBM WebSphere MQ 8.0 could allow an authenticated user to cause a premature termination of a client application thread which could potentially cause denial of service. IBM X-Force ID: 123914.	4.0	MEDIUM	AV:N/AC:L/Au:S/C:N/I:N/A:P		
CVE-2017-1346	2017-09-25T16:29:00.257	2025-04-20T01:37:25.860	IBM Business Process Manager 7.5, 8.0, and 8.5 temporarily stores files in a temporary folder during offline installs which could be read by a local user within a short timespan. IBM X-Force ID: 126461.	1.9	LOW	AV:L/AC:M/Au:N/C:P/I:N/A:N		
CVE-2017-1362	2017-09-25T16:29:00.303	2025-04-20T01:37:25.860	IBM Security Identity Manager Adapters 6.0 and 7.0 stores user credentials in plain in clear text which can be read by a local user. IBM X-Force ID: 126801.	2.1	LOW	AV:L/AC:L/Au:N/C:P/I:N/A:N		
CVE-2017-1424	2017-09-25T16:29:00.333	2025-04-20T01:37:25.860	IBM Business Process Manager 8.5.7 is vulnerable to cross-site scripting. This vulnerability allows users to embed arbitrary JavaScript code in the Web UI thus altering the intended functionality potentially leading to credentials disclosure within a trusted session. IBM X-Force ID: 127477.	3.5	LOW	AV:N/AC:M/Au:S/C:N/I:P/A:N		
CVE-2017-14729	2017-09-25T16:29:00.380	2025-04-20T01:37:25.860	The *_get_synthetic_symtab functions in the Binary File Descriptor (BFD) library (aka libbfd), as distributed in GNU Binutils 2.29, do not ensure a unique PLT entry for a symbol, which allows remote attackers to cause a denial of service (heap-based buffer overflow and application crash) or possibly have unspecified other impact via a crafted ELF file, related to elf32-i386.c and elf64-x86-64.c.	6.8	MEDIUM	AV:N/AC:M/Au:N/C:P/I:P/A:P		
CVE-2017-1551	2017-09-25T16:29:00.413	2025-04-20T01:37:25.860	IBM API Connect 5.0.0.0 through 5.0.7.2 could allow a remote attacker to hijack the clicking action of the victim. By persuading a victim to visit a malicious Web site, a remote attacker could exploit this vulnerability to hijack the victim's click actions and possibly launch further attacks against the victim. IBM X-Force ID: 131291.	5.8	MEDIUM	AV:N/AC:M/Au:N/C:P/I:P/A:N		
CVE-2017-1555	2017-09-25T16:29:00.443	2025-04-20T01:37:25.860	IBM API Connect 5.0.0.0 through 5.0.7.2 could allow an authenticated user to generate an API token when not subscribed to the application plan. IBM X-Force ID: 131545.	4.0	MEDIUM	AV:N/AC:L/Au:S/C:N/I:P/A:N		
CVE-2017-9551	2017-09-25T16:29:00.507	2025-04-20T01:37:25.860	Mahara 15.04 before 15.04.14 and 16.04 before 16.04.8 and 16.10 before 16.10.5 and 17.04 before 17.04.3 are vulnerable to a user submitting potential dangerous payload, e.g. XSS code, to be saved as their name in the usr_registration table. The values are then emailed to the the user and administrator and if accepted become part of the new user's account.	4.3	MEDIUM	AV:N/AC:M/Au:N/C:N/I:P/A:N		
