CVE ID	Published Date	Last Modified Date	Description	Base Score	Base Severity	Vector String	Vendor	Product
CVE-2017-15254	2017-10-11T18:29:04.083	2025-04-20T01:37:25.860	"IrfanView version 4.44 (32bit) with PDF plugin version 4.43 allows attackers to cause a denial of service or possibly have unspecified other impact via a crafted .pdf file, related to a ""Read Access Violation starting at PDF!xmlGetGlobalState+0x000000000007dfa5."""	6.8	MEDIUM	AV:N/AC:M/Au:N/C:P/I:P/A:P		
CVE-2017-15255	2017-10-11T18:29:04.193	2025-04-20T01:37:25.860	"IrfanView version 4.44 (32bit) with PDF plugin version 4.43 allows attackers to cause a denial of service or possibly have unspecified other impact via a crafted .pdf file, related to a ""Read Access Violation starting at PDF!xmlParserInputRead+0x00000000001601b0."""	6.8	MEDIUM	AV:N/AC:M/Au:N/C:P/I:P/A:P		
CVE-2017-15256	2017-10-11T18:29:04.270	2025-04-20T01:37:25.860	"IrfanView version 4.44 (32bit) with PDF plugin version 4.43 allows attackers to cause a denial of service or possibly have unspecified other impact via a crafted .pdf file, related to ""Data from Faulting Address controls Branch Selection starting at PDF!xmlListWalk+0x0000000000019fc8."""	6.8	MEDIUM	AV:N/AC:M/Au:N/C:P/I:P/A:P		
CVE-2017-15257	2017-10-11T18:29:04.380	2025-04-20T01:37:25.860	"IrfanView version 4.44 (32bit) with PDF plugin version 4.43 allows attackers to execute arbitrary code or cause a denial of service via a crafted .pdf file, related to ""Data from Faulting Address controls Code Flow starting at PDF!xmlParserInputRead+0x000000000009174a."""	6.8	MEDIUM	AV:N/AC:M/Au:N/C:P/I:P/A:P		
CVE-2017-15258	2017-10-11T18:29:04.473	2025-04-20T01:37:25.860	"IrfanView version 4.44 (32bit) with PDF plugin version 4.43 allows attackers to cause a denial of service or possibly have unspecified other impact via a crafted .pdf file, related to a ""Read Access Violation starting at PDF!xmlParserInputRead+0x0000000000161a9c."""	6.8	MEDIUM	AV:N/AC:M/Au:N/C:P/I:P/A:P		
CVE-2017-15259	2017-10-11T18:29:04.490	2025-04-20T01:37:25.860	"IrfanView version 4.44 (32bit) with PDF plugin version 4.43 allows attackers to cause a denial of service or possibly have unspecified other impact via a crafted .pdf file, related to ""Data from Faulting Address controls Branch Selection starting at PDF!xmlParserInputRead+0x000000000011624a."""	6.8	MEDIUM	AV:N/AC:M/Au:N/C:P/I:P/A:P		
CVE-2017-15260	2017-10-11T18:29:04.567	2025-04-20T01:37:25.860	"IrfanView version 4.44 (32bit) with PDF plugin version 4.43 allows attackers to cause a denial of service or possibly have unspecified other impact via a crafted .pdf file, related to ""Data from Faulting Address may be used as a return value starting at PDF!xmlParserInputRead+0x0000000000129a59."""	6.8	MEDIUM	AV:N/AC:M/Au:N/C:P/I:P/A:P		
CVE-2017-15261	2017-10-11T18:29:04.677	2025-04-20T01:37:25.860	"IrfanView version 4.44 (32bit) with PDF plugin version 4.43 allows attackers to cause a denial of service or possibly have unspecified other impact via a crafted .pdf file, related to a ""Possible Stack Corruption starting at PDF!xmlGetGlobalState+0x0000000000057b35."""	6.8	MEDIUM	AV:N/AC:M/Au:N/C:P/I:P/A:P		
CVE-2017-15262	2017-10-11T18:29:04.800	2025-04-20T01:37:25.860	"IrfanView version 4.44 (32bit) with PDF plugin version 4.43 allows attackers to execute arbitrary code or cause a denial of service via a crafted .pdf file, related to ""Data from Faulting Address controls Code Flow starting at PDF!xmlParserInputRead+0x0000000000048d0c."""	6.8	MEDIUM	AV:N/AC:M/Au:N/C:P/I:P/A:P		
CVE-2017-15263	2017-10-11T18:29:04.880	2025-04-20T01:37:25.860	"IrfanView version 4.44 (32bit) with PDF plugin version 4.43 allows attackers to cause a denial of service or possibly have unspecified other impact via a crafted .pdf file, related to ""Data from Faulting Address controls Branch Selection starting at PDF!xmlListWalk+0x00000000000166c4."""	6.8	MEDIUM	AV:N/AC:M/Au:N/C:P/I:P/A:P		
CVE-2017-15264	2017-10-11T18:29:04.897	2025-04-20T01:37:25.860	"IrfanView version 4.44 (32bit) allows attackers to cause a denial of service or possibly have unspecified other impact via a crafted .tif file, related to ""Data from Faulting Address is used as one or more arguments in a subsequent Function Call starting at image00000000_00400000+0x00000000000236e4."""	6.8	MEDIUM	AV:N/AC:M/Au:N/C:P/I:P/A:P		
CVE-2017-2887	2017-10-11T18:29:04.943	2025-04-20T01:37:25.860	An exploitable buffer overflow vulnerability exists in the XCF property handling functionality of SDL_image 2.0.1. A specially crafted xcf file can cause a stack-based buffer overflow resulting in potential code execution. An attacker can provide a specially crafted XCF file to trigger this vulnerability.	8.8	HIGH	CVSS:3.1/AV:N/AC:L/PR:N/UI:R/S:U/C:H/I:H/A:H		
CVE-2017-2888	2017-10-11T18:29:05.083	2025-04-20T01:37:25.860	An exploitable integer overflow vulnerability exists when creating a new RGB Surface in SDL 2.0.5. A specially crafted file can cause an integer overflow resulting in too little memory being allocated which can lead to a buffer overflow and potential code execution. An attacker can provide a specially crafted image file to trigger this vulnerability.	8.8	HIGH	CVSS:3.1/AV:N/AC:L/PR:N/UI:R/S:U/C:H/I:H/A:H		
CVE-2017-14003	2017-10-11T19:29:00.177	2025-04-20T01:37:25.860	An Authentication Bypass by Spoofing issue was discovered in LAVA Ether-Serial Link (ESL) running firmware versions 6.01.00/29.03.2007 and prior versions. An improper authentication vulnerability has been identified, which, if exploited, would allow an attacker with the same IP address to bypass authentication by accessing a specific uniform resource locator.	7.5	HIGH	AV:N/AC:L/Au:N/C:P/I:P/A:P		
CVE-2017-14369	2017-10-11T19:29:00.223	2025-04-20T01:37:25.860	RSA Archer GRC Platform prior to 6.2.0.5 is affected by a privilege escalation vulnerability. A low privileged RSA Archer user may potentially exploit this vulnerability to elevate their privileges and export certain application records.	4.0	MEDIUM	AV:N/AC:L/Au:S/C:P/I:N/A:N		
CVE-2017-14370	2017-10-11T19:29:00.253	2025-04-20T01:37:25.860	RSA Archer GRC Platform prior to 6.2.0.5 is affected by stored cross-site scripting via the Source Asset ID field. An authenticated attacker may potentially exploit this to execute arbitrary HTML in the user's browser session in the context of the affected RSA Archer application.	3.5	LOW	AV:N/AC:M/Au:S/C:N/I:P/A:N		
CVE-2017-14371	2017-10-11T19:29:00.283	2025-04-20T01:37:25.860	RSA Archer GRC Platform prior to 6.2.0.5 is affected by reflected cross-site scripting via the request URL. Attackers could potentially exploit this to execute arbitrary HTML in the user's browser session in the context of the affected RSA Archer application.	4.3	MEDIUM	AV:N/AC:M/Au:N/C:N/I:P/A:N		
CVE-2017-14372	2017-10-11T19:29:00.317	2025-04-20T01:37:25.860	RSA Archer GRC Platform prior to 6.2.0.5 is affected by reflected cross-site scripting vulnerabilities via certain RSA Archer Help pages. Attackers could potentially exploit this to execute arbitrary HTML in the user's browser session in the context of the affected RSA Archer application.	4.3	MEDIUM	AV:N/AC:M/Au:N/C:N/I:P/A:N		
CVE-2017-8016	2017-10-11T19:29:00.363	2025-04-20T01:37:25.860	RSA Archer GRC Platform prior to 6.2.0.5 is affected by stored cross-site scripting via the Questionnaire ID field. An authenticated attacker may potentially exploit this to execute arbitrary HTML in the user's browser session in the context of the affected RSA Archer application.	3.5	LOW	AV:N/AC:M/Au:S/C:N/I:P/A:N		
CVE-2017-8017	2017-10-11T19:29:00.393	2025-04-20T01:37:25.860	EMC Network Configuration Manager (NCM) 9.3.x, 9.4.0.x, 9.4.1.x, and 9.4.2.x is affected by a reflected cross-site scripting Vulnerability that could potentially be exploited by malicious users to compromise the affected system.	4.3	MEDIUM	AV:N/AC:M/Au:N/C:N/I:P/A:N		
CVE-2017-8025	2017-10-11T19:29:00.427	2025-04-20T01:37:25.860	RSA Archer GRC Platform prior to 6.2.0.5 is affected by an arbitrary file upload vulnerability. A remote unauthenticated attacker may potentially exploit this vulnerability to upload malicious files via attachments to arbitrary paths on the web server.	6.8	MEDIUM	AV:N/AC:M/Au:N/C:P/I:P/A:P		
CVE-2017-5789	2017-10-11T21:29:00.213	2025-04-20T01:37:25.860	HPE LoadRunner before 12.53 Patch 4 and HPE Performance Center before 12.53 Patch 4 allow remote attackers to execute arbitrary code via unspecified vectors. At least in LoadRunner, this is a libxdrutil.dll mxdr_string heap-based buffer overflow.	7.5	HIGH	AV:N/AC:L/Au:N/C:P/I:P/A:P		
CVE-2017-5791	2017-10-11T21:29:00.277	2025-04-20T01:37:25.860	The doFilter method in UrlAccessController in HPE Intelligent Management Center (iMC) PLAT 7.2 E0403P06 allows remote bypass of authentication via unspecified strings in a URI.	10.0	HIGH	AV:N/AC:L/Au:N/C:C/I:C/A:C		
CVE-2017-12192	2017-10-12T00:29:00.207	2025-04-20T01:37:25.860	The keyctl_read_key function in security/keys/keyctl.c in the Key Management subcomponent in the Linux kernel before 4.13.5 does not properly consider that a key may be possessed but negatively instantiated, which allows local users to cause a denial of service (OOPS and system crash) via a crafted KEYCTL_READ operation.	4.9	MEDIUM	AV:L/AC:L/Au:N/C:N/I:N/A:C		
CVE-2017-15274	2017-10-12T00:29:00.283	2025-04-20T01:37:25.860	security/keys/keyctl.c in the Linux kernel before 4.11.5 does not consider the case of a NULL payload in conjunction with a nonzero length value, which allows local users to cause a denial of service (NULL pointer dereference and OOPS) via a crafted add_key or keyctl system call, a different vulnerability than CVE-2017-12192.	4.9	MEDIUM	AV:L/AC:L/Au:N/C:N/I:N/A:C		
CVE-2017-15277	2017-10-12T08:29:00.290	2025-04-20T01:37:25.860	ReadGIFImage in coders/gif.c in ImageMagick 7.0.6-1 and GraphicsMagick 1.3.26 leaves the palette uninitialized when processing a GIF file that has neither a global nor local palette. If the affected product is used as a library loaded into a process that operates on interesting data, this data sometimes can be leaked via the uninitialized palette.	4.3	MEDIUM	AV:N/AC:M/Au:N/C:P/I:N/A:N		
CVE-2017-15278	2017-10-12T08:29:00.353	2025-04-20T01:37:25.860	Cross-Site Scripting (XSS) was discovered in TeamPass before 2.1.27.9. The vulnerability exists due to insufficient filtration of data (in /sources/folders.queries.php). An attacker could execute arbitrary HTML and script code in a browser in the context of the vulnerable website.	3.5	LOW	AV:N/AC:M/Au:S/C:N/I:P/A:N		
CVE-2017-15279	2017-10-12T08:29:00.430	2025-04-20T01:37:25.860	"Cross-site scripting (XSS) vulnerability in Umbraco CMS before 7.7.3 allows remote attackers to inject arbitrary web script or HTML via the ""page name"" (aka nodename) parameter during the creation of a new page, related to Umbraco.Web.UI/umbraco/dialogs/Publish.aspx.cs and Umbraco.Web/umbraco.presentation/umbraco/dialogs/notifications.aspx.cs."	3.5	LOW	AV:N/AC:M/Au:S/C:N/I:P/A:N		
CVE-2017-15280	2017-10-12T08:29:00.510	2025-04-20T01:37:25.860	XML external entity (XXE) vulnerability in Umbraco CMS before 7.7.3 allows attackers to obtain sensitive information by reading files on the server or sending TCP requests to intranet hosts (aka SSRF), related to Umbraco.Web/umbraco.presentation/umbraco/dialogs/importDocumenttype.aspx.cs.	4.3	MEDIUM	AV:N/AC:M/Au:N/C:P/I:N/A:N		
CVE-2017-15281	2017-10-12T08:29:00.540	2025-04-20T01:37:25.860	"ReadPSDImage in coders/psd.c in ImageMagick 7.0.7-6 allows remote attackers to cause a denial of service (application crash) or possibly have unspecified other impact via a crafted file, related to ""Conditional jump or move depends on uninitialised value(s)."""	6.8	MEDIUM	AV:N/AC:M/Au:N/C:P/I:P/A:P		
CVE-2017-15284	2017-10-12T08:29:00.570	2025-04-20T01:37:25.860	Cross-Site Scripting exists in OctoberCMS 1.0.425 (aka Build 425), allowing a least privileged user to upload an SVG file containing malicious code as the Avatar for the profile. When this is opened by the Admin, it causes JavaScript execution in the context of the Admin account.	3.5	LOW	AV:N/AC:M/Au:S/C:N/I:P/A:N		
CVE-2017-15285	2017-10-12T08:29:00.617	2025-04-20T01:37:25.860	"X-Cart 5.2.23, 5.3.1.9, 5.3.2.13, and 5.3.3 is vulnerable to Remote Code Execution. This vulnerability exists because the application fails to check remote file extensions before saving locally. This vulnerability can be exploited by anyone with Vendor access or higher. One attack methodology is to upload an image file in the Attachments section of a product catalog, upload a .php file with an ""Add File Via URL"" action, and change the image's Description URL to reference the .php URL in the attachments/ directory."	6.5	MEDIUM	AV:N/AC:L/Au:S/C:P/I:P/A:P		
CVE-2017-15286	2017-10-12T08:29:00.650	2025-04-20T01:37:25.860	SQLite 3.20.1 has a NULL pointer dereference in tableColumnList in shell.c because it fails to consider certain cases where `sqlite3_step(pStmt)==SQLITE_ROW` is false and a data structure is never initialized.	5.0	MEDIUM	AV:N/AC:L/Au:N/C:N/I:N/A:P		
CVE-2017-9514	2017-10-12T13:29:00.200	2025-04-20T01:37:25.860	Bamboo before 6.0.5, 6.1.x before 6.1.4, and 6.2.x before 6.2.1 had a REST endpoint that parsed a YAML file and did not sufficiently restrict which classes could be loaded. An attacker who can log in to Bamboo as a user is able to exploit this vulnerability to execute Java code of their choice on systems that have vulnerable versions of Bamboo.	6.5	MEDIUM	AV:N/AC:L/Au:S/C:P/I:P/A:P		
CVE-2017-10857	2017-10-12T14:29:00.217	2025-04-20T01:37:25.860	"Cybozu Office 10.0.0 to 10.6.1 allows authenticated attackers to bypass access restriction to perform arbitrary actions via ""Cabinet"" function."	4.0	MEDIUM	AV:N/AC:L/Au:S/C:N/I:P/A:N		
CVE-2017-10862	2017-10-12T14:29:00.263	2025-04-20T01:37:25.860	jwt-scala 1.2.2 and earlier fails to verify token signatures correctly which may lead to an attacker being able to pass specially crafted JWT data as a correctly signed token.	5.0	MEDIUM	AV:N/AC:L/Au:N/C:N/I:P/A:N		
CVE-2017-10863	2017-10-12T14:29:00.293	2025-04-20T01:37:25.860	Untrusted search path vulnerability in HIBUN Confidential File Decryption program prior to 10.50.0.5 allows an attacker to gain privileges via a Trojan horse DLL in an unspecified directory. Note this is a separate vulnerability from CVE-2017-10865.	9.3	HIGH	AV:N/AC:M/Au:N/C:C/I:C/A:C		
CVE-2017-10864	2017-10-12T14:29:00.340	2025-04-20T01:37:25.860	Untrusted search path vulnerability in Installer of HIBUN Confidential File Viewer prior to 11.20.0001 allows an attacker to gain privileges via a Trojan horse DLL in an unspecified directory.	9.3	HIGH	AV:N/AC:M/Au:N/C:C/I:C/A:C		
CVE-2017-10865	2017-10-12T14:29:00.387	2025-04-20T01:37:25.860	Untrusted search path vulnerability in HIBUN Confidential File Decryption program prior to 10.50.0.5 allows an attacker to gain privileges via a Trojan horse DLL in an unspecified directory. Note this is a separate vulnerability from CVE-2017-10863.	9.3	HIGH	AV:N/AC:M/Au:N/C:C/I:C/A:C		
CVE-2015-6358	2017-10-12T15:29:00.217	2025-04-20T01:37:25.860	Multiple Cisco embedded devices use hardcoded X.509 certificates and SSH host keys embedded in the firmware, which allows remote attackers to defeat cryptographic protection mechanisms and conduct man-in-the-middle attacks by leveraging knowledge of these certificates and keys from another installation, aka Bug IDs CSCuw46610, CSCuw46620, CSCuw46637, CSCuw46654, CSCuw46665, CSCuw46672, CSCuw46677, CSCuw46682, CSCuw46705, CSCuw46716, CSCuw46979, CSCuw47005, CSCuw47028, CSCuw47040, CSCuw47048, CSCuw47061, CSCuw90860, CSCuw90869, CSCuw90875, CSCuw90881, CSCuw90899, and CSCuw90913.	4.3	MEDIUM	AV:N/AC:M/Au:N/C:P/I:N/A:N		
CVE-2017-12849	2017-10-12T15:29:00.310	2025-04-20T01:37:25.860	Response discrepancy in the login and password reset forms in SilverStripe CMS before 3.5.5 and 3.6.x before 3.6.1 allows remote attackers to enumerate users via timing attacks.	5.0	MEDIUM	AV:N/AC:L/Au:N/C:P/I:N/A:N		
CVE-2017-15268	2017-10-12T15:29:00.340	2025-04-20T01:37:25.860	Qemu through 2.10.0 allows remote attackers to cause a memory leak by triggering slow data-channel read operations, related to io/channel-websock.c.	5.0	MEDIUM	AV:N/AC:L/Au:N/C:N/I:N/A:P		
CVE-2017-15287	2017-10-12T15:29:00.373	2025-04-20T01:37:25.860	"There is XSS in the BouquetEditor WebPlugin for Dream Multimedia Dreambox devices, as demonstrated by the ""Name des Bouquets"" field, or the file parameter to the /file URI."	4.3	MEDIUM	AV:N/AC:M/Au:N/C:N/I:P/A:N		
CVE-2016-9263	2017-10-12T16:29:00.247	2025-04-20T01:37:25.860	WordPress through 4.8.2, when domain-based flashmediaelement.swf sandboxing is not used, allows remote attackers to conduct cross-domain Flash injection (XSF) attacks by leveraging code contained within the wp-includes/js/mediaelement/flashmediaelement.swf file.	2.6	LOW	AV:N/AC:H/Au:N/C:N/I:P/A:N		
CVE-2017-15290	2017-10-12T16:29:00.277	2025-04-20T01:37:25.860	Mirasys Video Management System (VMS) 6.x before 6.4.6, 7.x before 7.5.15, and 8.x before 8.1.1 has a login process in which cleartext data is sent from a server to a client, and not all of this data is required for the client functionality.	5.0	MEDIUM	AV:N/AC:L/Au:N/C:P/I:N/A:N		
CVE-2016-8736	2017-10-12T18:29:00.447	2025-04-20T01:37:25.860	Apache OpenMeetings before 3.1.2 is vulnerable to Remote Code Execution via RMI deserialization attack.	7.5	HIGH	AV:N/AC:L/Au:N/C:P/I:P/A:P		
CVE-2016-5789	2017-10-13T03:29:00.193	2025-04-20T01:37:25.860	A Cross-site Request Forgery issue was discovered in JanTek JTC-200, all versions. An attacker could perform actions with the same permissions as a victim user, provided the victim has an active session and is induced to trigger the malicious request.	6.0	MEDIUM	AV:N/AC:M/Au:S/C:P/I:P/A:P		
CVE-2016-5791	2017-10-13T03:29:00.240	2025-04-20T01:37:25.860	An Improper Authentication issue was discovered in JanTek JTC-200, all versions. The improper authentication could provide an undocumented BusyBox Linux shell accessible over the TELNET service without any authentication.	10.0	HIGH	AV:N/AC:L/Au:N/C:C/I:C/A:C		
CVE-2017-11762	2017-10-13T13:29:00.190	2025-04-20T01:37:25.860	"The Microsoft Graphics Component on Microsoft Windows Server 2008 SP2 and R2 SP1, Windows 7 SP1, Windows 8.1, Windows Server 2012 Gold and R2, Windows RT 8.1, Windows 10 Gold, 1511, 1607, and 1703, and Windows Server 2016 allows a remote code execution vulnerability in the way it handles specially crafted embedded fonts, aka ""Microsoft Graphics Remote Code Execution Vulnerability"". This CVE ID is unique from CVE-2017-11763."	6.8	MEDIUM	AV:N/AC:M/Au:N/C:P/I:P/A:P		
CVE-2017-11763	2017-10-13T13:29:00.223	2025-04-20T01:37:25.860	"The Microsoft Graphics Component on Microsoft Windows Server 2008 SP2 and R2 SP1, Windows 7 SP1, Windows 8.1, Windows Server 2012 Gold and R2, Windows RT 8.1, Windows 10 Gold, 1511, 1607, and 1703, and Windows Server 2016 allows a remote code execution vulnerability in the way it handles specially crafted embedded fonts, aka ""Microsoft Graphics Remote Code Execution Vulnerability"". This CVE ID is unique from CVE-2017-11763."	6.8	MEDIUM	AV:N/AC:M/Au:N/C:P/I:P/A:P		
CVE-2017-11765	2017-10-13T13:29:00.270	2025-04-20T01:37:25.860	"The Microsoft Windows Kernel component on Microsoft Windows Server 2008 SP2 and R2 SP1, Windows 7 SP1, Windows 8.1, Windows Server 2012 Gold and R2, Windows RT 8.1, Windows 10 Gold, 1511, 1607, and 1703, and Windows Server 2016, allows an information disclosure vulnerability when it improperly handles objects in memory, aka ""Windows Kernel Information Disclosure Vulnerability"". This CVE ID is unique from CVE-2017-11784, CVE-2017-11785, and CVE-2017-11814."	2.1	LOW	AV:L/AC:L/Au:N/C:P/I:N/A:N		
CVE-2017-11769	2017-10-13T13:29:00.317	2025-04-20T01:37:25.860	"The Microsoft Windows TRIE component on Microsoft Windows 10 Gold, 1511, 1607, and 1703, and Windows Server 2016 allows a remote code execution vulnerability in the way it handles loading dll files, aka ""TRIE Remote Code Execution Vulnerability""."	9.3	HIGH	AV:N/AC:M/Au:N/C:C/I:C/A:C		
CVE-2017-11771	2017-10-13T13:29:00.347	2025-04-20T01:37:25.860	"The Microsoft Windows Search component on Microsoft Windows Server 2008 SP2 and R2 SP1, Windows 7 SP1, Windows 8.1, Windows Server 2012 Gold and R2, Windows RT 8.1, Windows 10 Gold, 1511, 1607, and 1703, and Windows Server 2016 allows a remote code execution vulnerability when it fails to properly handle DNS responses, aka ""Windows Search Remote Code Execution Vulnerability""."	10.0	HIGH	AV:N/AC:L/Au:N/C:C/I:C/A:C		
CVE-2017-11772	2017-10-13T13:29:00.393	2025-04-20T01:37:25.860	"The Microsoft Windows Search component on Microsoft Windows Server 2008 SP2 and R2 SP1, Windows 7 SP1, Windows 8.1, Windows Server 2012 Gold and R2, Windows RT 8.1, Windows 10 Gold, 1511, 1607, and 1703, and Windows Server 2016 allows an information disclosure when it fails to properly handle objects in memory, aka ""Microsoft Search Information Disclosure Vulnerability""."	5.0	MEDIUM	AV:N/AC:L/Au:N/C:P/I:N/A:N		
CVE-2017-11774	2017-10-13T13:29:00.427	2025-04-20T01:37:25.860	"Microsoft Outlook 2010 SP2, Outlook 2013 SP1 and RT SP1, and Outlook 2016 allow an attacker to execute arbitrary commands, due to how Microsoft Office handles objects in memory, aka ""Microsoft Outlook Security Feature Bypass Vulnerability."""	7.8	HIGH	CVSS:3.1/AV:L/AC:L/PR:N/UI:R/S:U/C:H/I:H/A:H		
CVE-2017-11775	2017-10-13T13:29:00.473	2025-04-20T01:37:25.860	"Microsoft SharePoint Enterprise Server 2013 SP1 and Microsoft SharePoint Enterprise Server 2016 allow an attacker to exploit a cross-site scripting (XSS) vulnerability by sending a specially crafted request to an affected SharePoint server, due to how SharePoint Server sanitizes web requests, aka ""Microsoft Office SharePoint XSS Vulnerability"". This CVE ID is unique from CVE-2017-11777 and CVE-2017-11820."	3.5	LOW	AV:N/AC:M/Au:S/C:N/I:P/A:N		
CVE-2017-11776	2017-10-13T13:29:00.503	2025-04-20T01:37:25.860	"Microsoft Outlook 2016 allows an attacker to obtain the email content of a user, due to how Outlook 2016 discloses user email content, aka ""Microsoft Outlook Information Disclosure Vulnerability."""	5.0	MEDIUM	AV:N/AC:L/Au:N/C:P/I:N/A:N		
CVE-2017-11777	2017-10-13T13:29:00.537	2025-04-20T01:37:25.860	"Microsoft SharePoint Enterprise Server 2013 SP1 and Microsoft SharePoint Enterprise Server 2016 allow an attacker to exploit a cross-site scripting (XSS) vulnerability by sending a specially crafted request to an affected SharePoint server, due to how SharePoint Server sanitizes web requests, aka ""Microsoft Office SharePoint XSS Vulnerability"". This CVE ID is unique from CVE-2017-11775 and CVE-2017-11820."	3.5	LOW	AV:N/AC:M/Au:S/C:N/I:P/A:N		
CVE-2017-11779	2017-10-13T13:29:00.567	2025-04-20T01:37:25.860	"The Microsoft Windows Domain Name System (DNS) DNSAPI.dll on Microsoft Windows 8.1, Windows Server 2012 R2, Windows RT 8.1, Windows 10 Gold, 1511, 1607, and 1703, and Windows Server 2016 allows a remote code execution vulnerability when it fails to properly handle DNS responses, aka ""Windows DNSAPI Remote Code Execution Vulnerability""."	9.3	HIGH	AV:N/AC:M/Au:N/C:C/I:C/A:C		
CVE-2017-11780	2017-10-13T13:29:00.613	2025-04-20T01:37:25.860	"The Server Message Block 1.0 (SMBv1) on Microsoft Windows Server 2008 SP2 and R2 SP1, Windows 7 SP1, Windows 8.1, Windows Server 2012 Gold and R2, Windows RT 8.1, Windows 10 Gold, 1511, 1607, and 1703, and Windows Server 2016, allows a remote code execution vulnerability when it fails to properly handle certain requests, aka ""Windows SMB Remote Code Execution Vulnerability""."	6.8	MEDIUM	AV:N/AC:M/Au:N/C:P/I:P/A:P		
CVE-2017-11781	2017-10-13T13:29:00.643	2025-04-20T01:37:25.860	"The Microsoft Server Block Message (SMB) on Microsoft Windows Server 2008 SP2 and R2 SP1, Windows 7 SP1, Windows 8.1, Windows Server 2012 Gold and R2, Windows RT 8.1, Windows 10 Gold, 1511, 1607, and 1703, and Windows Server 2016, allows a denial of service vulnerability when an attacker sends specially crafted requests to the server, aka ""Windows SMB Denial of Service Vulnerability""."	7.8	HIGH	AV:N/AC:L/Au:N/C:N/I:N/A:C		
CVE-2017-11782	2017-10-13T13:29:00.677	2025-04-20T01:37:25.860	"The Microsoft Server Block Message (SMB) on Microsoft Windows 10 1607 and Windows Server 2016, allows an elevation of privilege vulnerability when an attacker sends specially crafted requests to the server, aka ""Windows SMB Elevation of Privilege Vulnerability""."	4.6	MEDIUM	AV:L/AC:L/Au:N/C:P/I:P/A:P		
CVE-2017-11783	2017-10-13T13:29:00.723	2025-04-20T01:37:25.860	"Microsoft Windows 8.1, Windows Server 2012 R2, Windows RT 8.1, Windows 10 Gold, 1511, 1607, and 1703, and Windows Server 2016 allows an elevation of privilege vulnerability in the way it handles calls to Advanced Local Procedure Call (ALPC), aka ""Windows Elevation of Privilege Vulnerability""."	6.9	MEDIUM	AV:L/AC:M/Au:N/C:C/I:C/A:C		
CVE-2017-11784	2017-10-13T13:29:00.753	2025-04-20T01:37:25.860	"The Microsoft Windows Kernel component on Microsoft Windows Server 2008 SP2 and R2 SP1, Windows 7 SP1, Windows 8.1, Windows Server 2012 Gold and R2, Windows RT 8.1, and Windows 10 Gold, allows an information disclosure vulnerability when it improperly handles objects in memory, aka ""Windows Kernel Information Disclosure Vulnerability"". This CVE ID is unique from CVE-2017-11765, CVE-2017-11785, and CVE-2017-11814."	2.1	LOW	AV:L/AC:L/Au:N/C:P/I:N/A:N		
