CVE ID	Published Date	Last Modified Date	Description	Base Score	Base Severity	Vector String	Vendor	Product
CVE-2017-14797	2017-10-01T01:29:00.723	2025-04-20T01:37:25.860	Lack of Transport Encryption in the public API in Philips Hue Bridge BSB002 SW 1707040932 allows remote attackers to read API keys (and consequently bypass the pushlink protection mechanism, and obtain complete control of the connected accessories) by leveraging the ability to sniff HTTP traffic on the local intranet network.	7.9	HIGH	AV:A/AC:M/Au:N/C:C/I:C/A:C		
CVE-2017-14941	2017-10-02T01:29:00.297	2025-04-20T01:37:25.860	Jaspersoft JasperReports 4.7 suffers from a saved credential disclosure vulnerability, which allows a remote authenticated user to retrieve stored Data Source passwords by accessing flow.html and reading the HTML source code of the page reached in an Edit action for a Data Source connector.	4.0	MEDIUM	AV:N/AC:L/Au:S/C:P/I:N/A:N		
CVE-2017-14954	2017-10-02T01:29:00.343	2025-04-20T01:37:25.860	The waitid implementation in kernel/exit.c in the Linux kernel through 4.13.4 accesses rusage data structures in unintended cases, which allows local users to obtain sensitive information, and bypass the KASLR protection mechanism, via a crafted system call.	2.1	LOW	AV:L/AC:L/Au:N/C:P/I:N/A:N		
CVE-2017-14955	2017-10-02T01:29:00.390	2025-04-20T01:37:25.860	Check_MK before 1.2.8p26 mishandles certain errors within the failed-login save feature because of a race condition, which allows remote attackers to obtain sensitive user information by reading a GUI crash report.	5.9	MEDIUM	CVSS:3.1/AV:N/AC:H/PR:N/UI:N/S:U/C:H/I:N/A:N		
CVE-2017-14957	2017-10-02T01:29:00.437	2025-04-20T01:37:25.860	Stored XSS vulnerability via a comment in inc/conv.php in BlogoText before 3.7.6 allows an unauthenticated attacker to inject JavaScript. If the victim is an administrator, an attacker can (for example) change global settings or create/delete posts. It is also possible to execute JavaScript against unauthenticated users of the blog.	4.3	MEDIUM	AV:N/AC:M/Au:N/C:N/I:P/A:N		
CVE-2017-14958	2017-10-02T01:29:00.470	2025-04-20T01:37:25.860	lib.php in PivotX 2.3.11 does not properly block uploads of dangerous file types by admin users, which allows remote PHP code execution via an upload of a .php file.	6.5	MEDIUM	AV:N/AC:L/Au:S/C:P/I:P/A:P		
CVE-2017-14970	2017-10-02T01:29:00.517	2025-04-20T01:37:25.860	"In lib/ofp-util.c in Open vSwitch (OvS) before 2.8.1, there are multiple memory leaks while parsing malformed OpenFlow group mod messages. NOTE: the vendor disputes the relevance of this report, stating ""it can only be triggered by an OpenFlow controller, but OpenFlow controllers have much more direct and powerful ways to force Open vSwitch to allocate memory, such as by inserting flows into the flow table."""	4.3	MEDIUM	AV:N/AC:M/Au:N/C:N/I:N/A:P		
CVE-2017-14974	2017-10-02T01:29:00.563	2025-04-20T01:37:25.860	The *_get_synthetic_symtab functions in the Binary File Descriptor (BFD) library (aka libbfd), as distributed in GNU Binutils 2.29, mishandle the failure of a certain canonicalization step, which allows remote attackers to cause a denial of service (NULL pointer dereference and application crash) via a crafted ELF file, related to elf32-i386.c and elf64-x86-64.c.	4.3	MEDIUM	AV:N/AC:M/Au:N/C:N/I:N/A:P		
CVE-2017-14975	2017-10-02T01:29:00.593	2025-04-20T01:37:25.860	The FoFiType1C::convertToType0 function in FoFiType1C.cc in Poppler 0.59.0 has a NULL pointer dereference vulnerability because a data structure is not initialized, which allows an attacker to launch a denial of service attack.	5.0	MEDIUM	AV:N/AC:L/Au:N/C:N/I:N/A:P		
CVE-2017-14976	2017-10-02T01:29:00.627	2025-04-20T01:37:25.860	The FoFiType1C::convertToType0 function in FoFiType1C.cc in Poppler 0.59.0 has a heap-based buffer over-read vulnerability if an out-of-bounds font dictionary index is encountered, which allows an attacker to launch a denial of service attack.	5.0	MEDIUM	AV:N/AC:L/Au:N/C:N/I:N/A:P		
CVE-2017-14977	2017-10-02T01:29:00.657	2025-04-20T01:37:25.860	The FoFiTrueType::getCFFBlock function in FoFiTrueType.cc in Poppler 0.59.0 has a NULL pointer dereference vulnerability due to lack of validation of a table pointer, which allows an attacker to launch a denial of service attack.	5.0	MEDIUM	AV:N/AC:L/Au:N/C:N/I:N/A:P		
CVE-2014-0043	2017-10-03T01:29:00.327	2025-04-20T01:37:25.860	In Apache Wicket 1.5.10 or 6.13.0, by issuing requests to special urls handled by Wicket, it is possible to check for the existence of particular classes in the classpath and thus check whether a third party library with a known security vulnerability is in use.	5.0	MEDIUM	AV:N/AC:L/Au:N/C:P/I:N/A:N		
CVE-2015-3321	2017-10-03T01:29:00.483	2025-04-20T01:37:25.860	Services and files in Lenovo Fingerprint Manager before 8.01.42 have incorrect ACLs, which allows local users to invalidate local checks and gain privileges via standard filesystem operations.	7.2	HIGH	AV:L/AC:L/Au:N/C:C/I:C/A:C		
CVE-2015-6576	2017-10-03T01:29:00.607	2025-04-20T01:37:25.860	Bamboo 2.2 before 5.8.5 and 5.9.x before 5.9.7 allows remote attackers with access to the Bamboo web interface to execute arbitrary Java code via an unspecified resource.	6.5	MEDIUM	AV:N/AC:L/Au:S/C:P/I:P/A:P		
CVE-2015-6971	2017-10-03T01:29:00.637	2025-04-20T01:37:25.860	Lenovo System Update (formerly ThinkVantage System Update) before 5.07.0013 allows local users to submit commands to the System Update service (SUService.exe) and gain privileges by launching signed Lenovo executables.	7.2	HIGH	AV:L/AC:L/Au:N/C:C/I:C/A:C		
CVE-2015-7357	2017-10-03T01:29:00.687	2025-04-20T01:37:25.860	Cross-site scripting (XSS) vulnerability in the uDesign (aka U-Design) theme 2.3.0 before 2.7.10 for WordPress allows remote attackers to inject arbitrary web script or HTML via a fragment identifier, as demonstrated by #<svg onload=alert(1)>.	4.3	MEDIUM	AV:N/AC:M/Au:N/C:N/I:P/A:N		
CVE-2015-7358	2017-10-03T01:29:00.717	2025-04-20T01:37:25.860	The IsDriveLetterAvailable method in Driver/Ntdriver.c in TrueCrypt 7.0, VeraCrypt before 1.15, and CipherShed, when running on Windows, does not properly validate drive letter symbolic links, which allows local users to mount an encrypted volume over an existing drive letter and gain privileges via an entry in the /GLOBAL?? directory.	7.2	HIGH	AV:L/AC:L/Au:N/C:C/I:C/A:C		
CVE-2015-7359	2017-10-03T01:29:00.763	2025-04-20T01:37:25.860	The (1) IsVolumeAccessibleByCurrentUser and (2) MountDevice methods in Ntdriver.c in TrueCrypt 7.0, VeraCrypt before 1.15, and CipherShed, when running on Windows, do not check the impersonation level of impersonation tokens, which allows local users to impersonate a user at SecurityIdentify level and gain access to other users' mounted encrypted volumes.	4.6	MEDIUM	AV:L/AC:L/Au:N/C:P/I:P/A:P		
CVE-2015-7841	2017-10-03T01:29:00.793	2025-04-20T01:37:25.860	"The login page of the server on Huawei FusionServer rack servers RH2288 V3 with software before V100R003C00SPC603, RH2288H V3 with software before V100R003C00SPC503, XH628 V3 with software before V100R003C00SPC602, RH1288 V3 with software before V100R003C00SPC602, RH2288A V2 with software before V100R002C00SPC701, RH1288A V2 with software before V100R002C00SPC502, RH8100 V3 with software before V100R003C00SPC110, CH222 V3 with software before V100R001C00SPC161, CH220 V3 with software before V100R001C00SPC161, and CH121 V3 with software before V100R001C00SPC161 allows remote attackers to bypass access restrictions and enter commands via unspecified parameters, as demonstrated by a ""user creation command."""	10.0	HIGH	AV:N/AC:L/Au:N/C:C/I:C/A:C		
CVE-2015-7843	2017-10-03T01:29:00.840	2025-04-20T01:37:25.860	The management interface on Huawei FusionServer rack servers RH2288 V3 with software before V100R003C00SPC603, RH2288H V3 with software before V100R003C00SPC503, XH628 V3 with software before V100R003C00SPC602, RH1288 V3 with software before V100R003C00SPC602, RH2288A V2 with software before V100R002C00SPC701, RH1288A V2 with software before V100R002C00SPC502, RH8100 V3 with software before V100R003C00SPC110, CH222 V3 with software before V100R001C00SPC161, CH220 V3 with software before V100R001C00SPC161, and CH121 V3 with software before V100R001C00SPC161 does not limit the number of query attempts, which allows remote authenticated users to obtain credentials of higher-level users via a brute force attack.	4.0	MEDIUM	AV:N/AC:L/Au:S/C:P/I:N/A:N		
CVE-2015-7980	2017-10-03T01:29:00.873	2025-04-20T01:37:25.860	"Cross-site scripting (XSS) vulnerability in the Compass Rose module 6.x-1.x before 6.x-1.1 for Drupal allows remote attackers to inject arbitrary web script or HTML via unspecified vectors, related to ""embedding a JavaScript library from an external source that was not reliable."""	4.3	MEDIUM	AV:N/AC:M/Au:N/C:N/I:P/A:N		
CVE-2016-6806	2017-10-03T01:29:00.967	2025-04-20T01:37:25.860	Apache Wicket 6.x before 6.25.0, 7.x before 7.5.0, and 8.0.0-M1 provide a CSRF prevention measure that fails to discover some cross origin requests. The mitigation is to not only check the Origin HTTP header, but also take the Referer HTTP header into account when no Origin was provided. Furthermore, not all Wicket server side targets were subjected to the CSRF check. This was also fixed.	6.8	MEDIUM	AV:N/AC:M/Au:N/C:P/I:P/A:P		
CVE-2017-11321	2017-10-03T01:29:00.997	2025-04-20T01:37:25.860	The restricted shell interface in UCOPIA Wireless Appliance before 5.1.8 allows remote authenticated users to gain 'admin' privileges via shell metacharacters in the less command.	7.2	HIGH	CVSS:3.1/AV:N/AC:L/PR:H/UI:N/S:U/C:H/I:H/A:H		
CVE-2017-11322	2017-10-03T01:29:01.043	2025-04-20T01:37:25.860	The chroothole_client executable in UCOPIA Wireless Appliance before 5.1.8 allows remote attackers to gain root privileges via a dollar sign ($) metacharacter in the argument to chroothole_client.	7.2	HIGH	AV:L/AC:L/Au:N/C:C/I:C/A:C		
CVE-2017-11496	2017-10-03T01:29:01.077	2025-04-20T01:37:25.860	Stack buffer overflow in hasplms in Gemalto ACC (Admin Control Center), all versions ranging from HASP SRM 2.10 to Sentinel LDK 7.50, allows remote attackers to execute arbitrary code via malformed ASN.1 streams in V2C and similar input files.	7.5	HIGH	AV:N/AC:L/Au:N/C:P/I:P/A:P		
CVE-2017-11497	2017-10-03T01:29:01.123	2025-04-20T01:37:25.860	Stack buffer overflow in hasplms in Gemalto ACC (Admin Control Center), all versions ranging from HASP SRM 2.10 to Sentinel LDK 7.50, allows remote attackers to execute arbitrary code via language packs containing filenames longer than 1024 characters.	7.5	HIGH	AV:N/AC:L/Au:N/C:P/I:P/A:P		
CVE-2017-11498	2017-10-03T01:29:01.153	2025-04-20T01:37:25.860	Buffer overflow in hasplms in Gemalto ACC (Admin Control Center), all versions ranging from HASP SRM 2.10 to Sentinel LDK 7.50, allows remote attackers to shut down the remote process (a denial of service) via a language pack (ZIP file) with invalid HTML files.	5.0	MEDIUM	AV:N/AC:L/Au:N/C:N/I:N/A:P		
CVE-2017-12620	2017-10-03T01:29:01.233	2025-04-20T01:37:25.860	When loading models or dictionaries that contain XML it is possible to perform an XXE attack, since Apache OpenNLP is a library, this only affects applications that load models or dictionaries from untrusted sources. The versions 1.5.0 to 1.5.3, 1.6.0, 1.7.0 to 1.7.2, 1.8.0 to 1.8.1 of Apache OpenNLP are affected.	7.5	HIGH	AV:N/AC:L/Au:N/C:P/I:P/A:P		
CVE-2017-12638	2017-10-03T01:29:01.263	2025-04-20T01:37:25.860	Stack based buffer overflow in Ipswitch IMail server up to and including 12.5.5 allows remote attackers to execute arbitrary code via unspecified vectors in IMmailSrv, aka ETBL or ETCETERABLUE.	7.5	HIGH	AV:N/AC:L/Au:N/C:P/I:P/A:P		
CVE-2017-12639	2017-10-03T01:29:01.293	2025-04-20T01:37:25.860	Stack based buffer overflow in Ipswitch IMail server up to and including 12.5.5 allows remote attackers to execute arbitrary code via unspecified vectors in IMmailSrv, aka ETRE or ETCTERARED.	7.5	HIGH	AV:N/AC:L/Au:N/C:P/I:P/A:P		
CVE-2017-12792	2017-10-03T01:29:01.340	2025-04-20T01:37:25.860	Multiple cross-site request forgery (CSRF) vulnerabilities in NexusPHP 1.5 allow remote attackers to hijack the authentication of administrators for requests that conduct cross-site scripting (XSS) attacks via the (1) linkname, (2) url, or (3) title parameter in an add action to linksmanage.php.	4.3	MEDIUM	AV:N/AC:M/Au:N/C:N/I:P/A:N		
CVE-2017-1311	2017-10-03T01:29:01.373	2025-04-20T01:37:25.860	IBM Insights Foundation for Energy 2.0 is vulnerable to SQL injection. A remote attacker could send specially-crafted SQL statements, which could allow the attacker to view, add, modify or delete information in the back-end database. IBM X-Force ID: 125719.	6.5	MEDIUM	AV:N/AC:L/Au:S/C:P/I:P/A:P		
CVE-2017-1324	2017-10-03T01:29:01.403	2025-04-20T01:37:25.860	IBM RELM 4.0, 5.0, and 6.0 is vulnerable to cross-site scripting. This vulnerability allows users to embed arbitrary JavaScript code in the Web UI thus altering the intended functionality potentially leading to credentials disclosure within a trusted session. IBM X-Force ID: 125975.	3.5	LOW	AV:N/AC:M/Au:S/C:N/I:P/A:N		
CVE-2017-1334	2017-10-03T01:29:01.437	2025-04-20T01:37:25.860	IBM RELM 4.0, 5.0, and 6.0 is vulnerable to cross-site scripting. This vulnerability allows users to embed arbitrary JavaScript code in the Web UI thus altering the intended functionality potentially leading to credentials disclosure within a trusted session. IBM X-Force ID: 126242.	3.5	LOW	AV:N/AC:M/Au:S/C:N/I:P/A:N		
CVE-2017-1335	2017-10-03T01:29:01.467	2025-04-20T01:37:25.860	IBM RELM 4.0, 5.0, and 6.0 is vulnerable to cross-site scripting. This vulnerability allows users to embed arbitrary JavaScript code in the Web UI thus altering the intended functionality potentially leading to credentials disclosure within a trusted session. IBM X-Force ID: 126243.	3.5	LOW	AV:N/AC:M/Au:S/C:N/I:P/A:N		
CVE-2017-1345	2017-10-03T01:29:01.497	2025-04-20T01:37:25.860	IBM Insights Foundation for Energy 2.0 is vulnerable to cross-site scripting. This vulnerability allows users to embed arbitrary JavaScript code in the Web UI thus altering the intended functionality potentially leading to credentials disclosure within a trusted session. IBM X-Force ID: 126460.	3.5	LOW	AV:N/AC:M/Au:S/C:N/I:P/A:N		
CVE-2017-1359	2017-10-03T01:29:01.527	2025-04-20T01:37:25.860	IBM RELM 4.0, 5.0, and 6.0 is vulnerable to cross-site scripting. This vulnerability allows users to embed arbitrary JavaScript code in the Web UI thus altering the intended functionality potentially leading to credentials disclosure within a trusted session. IBM X-Force ID: 126686.	3.5	LOW	AV:N/AC:M/Au:S/C:N/I:P/A:N		
CVE-2017-1364	2017-10-03T01:29:01.560	2025-04-20T01:37:25.860	IBM RELM 4.0, 5.0, and 6.0 is vulnerable to cross-site scripting. This vulnerability allows users to embed arbitrary JavaScript code in the Web UI thus altering the intended functionality potentially leading to credentials disclosure within a trusted session. IBM X-Force ID: 126857.	3.5	LOW	AV:N/AC:M/Au:S/C:N/I:P/A:N		
CVE-2017-1369	2017-10-03T01:29:01.607	2025-04-20T01:37:25.860	IBM RELM 4.0, 5.0, and 6.0 is vulnerable to cross-site scripting. This vulnerability allows users to embed arbitrary JavaScript code in the Web UI thus altering the intended functionality potentially leading to credentials disclosure within a trusted session. IBM X-Force ID: 126862.	3.5	LOW	AV:N/AC:M/Au:S/C:N/I:P/A:N		
CVE-2017-13704	2017-10-03T01:29:01.637	2025-04-20T01:37:25.860	In dnsmasq before 2.78, if the DNS packet size does not match the expected size, the size parameter in a memset call gets a negative value. As it is an unsigned value, memset ends up writing up to 0xffffffff zero's (0xffffffffffffffff in 64 bit platforms), making dnsmasq crash.	5.0	MEDIUM	AV:N/AC:L/Au:N/C:N/I:N/A:P		
CVE-2017-13997	2017-10-03T01:29:01.857	2025-04-20T01:37:25.860	A Missing Authentication for Critical Function issue was discovered in Schneider Electric InduSoft Web Studio v8.0 SP2 or prior, and InTouch Machine Edition v8.0 SP2 or prior. InduSoft Web Studio provides the capability for an HMI client to trigger script execution on the server for the purposes of performing customized calculations or actions. A remote malicious entity could bypass the server authentication and trigger the execution of an arbitrary command. The command is executed under high privileges and could lead to a complete compromise of the server.	10.0	HIGH	AV:N/AC:L/Au:N/C:C/I:C/A:C		
CVE-2017-1429	2017-10-03T01:29:01.903	2025-04-20T01:37:25.860	IBM RELM 4.0, 5.0, and 6.0 is vulnerable to cross-site scripting. This vulnerability allows users to embed arbitrary JavaScript code in the Web UI thus altering the intended functionality potentially leading to credentials disclosure within a trusted session. IBM X-Force ID: 127587.	3.5	LOW	AV:N/AC:M/Au:S/C:N/I:P/A:N		
CVE-2017-14492	2017-10-03T01:29:02.027	2025-04-20T01:37:25.860	Heap-based buffer overflow in dnsmasq before 2.78 allows remote attackers to cause a denial of service (crash) or execute arbitrary code via a crafted IPv6 router advertisement request.	7.5	HIGH	AV:N/AC:L/Au:N/C:P/I:P/A:P		
CVE-2017-14493	2017-10-03T01:29:02.077	2025-04-20T01:37:25.860	Stack-based buffer overflow in dnsmasq before 2.78 allows remote attackers to cause a denial of service (crash) or execute arbitrary code via a crafted DHCPv6 request.	7.5	HIGH	AV:N/AC:L/Au:N/C:P/I:P/A:P		
CVE-2017-14494	2017-10-03T01:29:02.107	2025-04-20T01:37:25.860	dnsmasq before 2.78, when configured as a relay, allows remote attackers to obtain sensitive memory information via vectors involving handling DHCPv6 forwarded requests.	4.3	MEDIUM	AV:N/AC:M/Au:N/C:P/I:N/A:N		
CVE-2017-14495	2017-10-03T01:29:02.153	2025-04-20T01:37:25.860	Memory leak in dnsmasq before 2.78, when the --add-mac, --add-cpe-id or --add-subnet option is specified, allows remote attackers to cause a denial of service (memory consumption) via vectors involving DNS response creation.	5.0	MEDIUM	AV:N/AC:L/Au:N/C:N/I:N/A:P		
CVE-2017-14496	2017-10-03T01:29:02.200	2025-04-20T01:37:25.860	Integer underflow in the add_pseudoheader function in dnsmasq before 2.78 , when the --add-mac, --add-cpe-id or --add-subnet option is specified, allows remote attackers to cause a denial of service via a crafted DNS request.	7.8	HIGH	AV:N/AC:L/Au:N/C:N/I:N/A:C		
CVE-2017-14754	2017-10-03T01:29:02.340	2025-04-20T01:37:25.860	OpenText Document Sciences xPression (formerly EMC Document Sciences xPression) v4.5SP1 Patch 13 (older versions might be affected as well) is prone to Arbitrary File Read: /xAdmin/html/cm_datasource_group_xsd.jsp, parameter: xsd_datasource_schema_file filename. In order for this vulnerability to be exploited, an attacker must authenticate to the application first.	6.8	MEDIUM	AV:N/AC:L/Au:S/C:C/I:N/A:N		
CVE-2017-14755	2017-10-03T01:29:02.373	2025-04-20T01:37:25.860	OpenText Document Sciences xPression (formerly EMC Document Sciences xPression) v4.5SP1 Patch 13 (older versions might be affected as well) is prone to Cross-Site Scripting: /xAdmin/html/XPressoDoc, parameter: categoryId.	4.3	MEDIUM	AV:N/AC:M/Au:N/C:N/I:P/A:N		
CVE-2017-14756	2017-10-03T01:29:02.403	2025-04-20T01:37:25.860	OpenText Document Sciences xPression (formerly EMC Document Sciences xPression) v4.5SP1 Patch 13 (older versions might be affected as well) is prone to Cross-Site Scripting: /xAdmin/html/Deployment (cat_id).	4.3	MEDIUM	AV:N/AC:M/Au:N/C:N/I:P/A:N		
CVE-2017-14757	2017-10-03T01:29:02.450	2025-04-20T01:37:25.860	OpenText Document Sciences xPression (formerly EMC Document Sciences xPression) v4.5SP1 Patch 13 (older versions might be affected as well) is prone to SQL Injection: /xDashboard/html/jobhistory/downloadSupportFile.action, parameter: jobRunId. In order for this vulnerability to be exploited, an attacker must authenticate to the application first.	6.5	MEDIUM	AV:N/AC:L/Au:S/C:P/I:P/A:P		
CVE-2017-14758	2017-10-03T01:29:02.483	2025-04-20T01:37:25.860	OpenText Document Sciences xPression (formerly EMC Document Sciences xPression) v4.5SP1 Patch 13 (older versions might be affected as well) is prone to SQL Injection: /xAdmin/html/cm_doclist_view_uc.jsp, parameter: documentId. In order for this vulnerability to be exploited, an attacker must authenticate to the application first.	6.5	MEDIUM	AV:N/AC:L/Au:S/C:P/I:P/A:P		
CVE-2017-14759	2017-10-03T01:29:02.513	2025-04-20T01:37:25.860	OpenText Document Sciences xPression (formerly EMC Document Sciences xPression) v4.5SP1 Patch 13 (older versions might be affected as well) is prone to an XML External Entity vulnerability: /xFramework/services/QuickDoc.QuickDocHttpSoap11Endpoint/. An unauthenticated user is able to read directory listings or system files, or cause SSRF or Denial of Service.	7.5	HIGH	AV:N/AC:L/Au:N/C:P/I:P/A:P		
CVE-2017-14770	2017-10-03T01:29:02.560	2025-04-20T01:37:25.860	Skybox Manager Client Application prior to 8.5.501 is prone to an information disclosure vulnerability of user password hashes. A local authenticated attacker can access the password hashes in a debugger-pause state during the authentication process.	2.1	LOW	AV:L/AC:L/Au:N/C:P/I:N/A:N		
CVE-2017-14771	2017-10-03T01:29:02.590	2025-04-20T01:37:25.860	Skybox Manager Client Application prior to 8.5.501 is prone to an arbitrary file upload vulnerability due to insufficient input validation of user-supplied files path when uploading files via the application. During a debugger-pause state, a local authenticated attacker can upload an arbitrary file and overwrite existing files within the scope of the affected application.	3.6	LOW	AV:L/AC:L/Au:N/C:N/I:P/A:P		
CVE-2017-14772	2017-10-03T01:29:02.623	2025-04-20T01:37:25.860	Skybox Manager Client Application is prone to information disclosure via a username enumeration attack. A local unauthenticated attacker could exploit the flaw to obtain valid usernames, by analyzing error messages upon valid and invalid account login attempts.	2.1	LOW	AV:L/AC:L/Au:N/C:P/I:N/A:N		
CVE-2017-14773	2017-10-03T01:29:02.653	2025-04-20T01:37:25.860	Skybox Manager Client Application prior to 8.5.501 is prone to an elevation of privileges vulnerability during authentication of a valid user in a debugger-pause state. The vulnerability can only be exploited by a local authenticated attacker.	4.6	MEDIUM	AV:L/AC:L/Au:N/C:P/I:P/A:P		
CVE-2017-14848	2017-10-03T01:29:02.700	2025-04-20T01:37:25.860	WPHRM Human Resource Management System for WordPress 1.0 allows SQL Injection via the employee_id parameter.	8.8	HIGH	CVSS:3.1/AV:N/AC:L/PR:L/UI:N/S:U/C:H/I:H/A:H		
CVE-2017-14979	2017-10-03T01:29:02.733	2025-04-20T01:37:25.860	Gxlcms uses an unsafe character-replacement approach in an attempt to restrict access, which allows remote attackers to read arbitrary files via modified pathnames in the s parameter to index.php, related to Lib/Admin/Action/TplAction.class.php and Lib/Admin/Common/function.php.	5.0	MEDIUM	AV:N/AC:L/Au:N/C:P/I:N/A:N		
CVE-2017-14981	2017-10-03T01:29:02.763	2025-04-20T01:37:25.860	Cross-Site Scripting (XSS) was discovered in ATutor before 2.2.3. The vulnerability exists due to insufficient filtration of data (url in /mods/_standard/rss_feeds/edit_feed.php). An attacker could inject arbitrary HTML and script code into a browser in the context of the vulnerable website.	3.5	LOW	AV:N/AC:M/Au:S/C:N/I:P/A:N		
CVE-2017-14983	2017-10-03T01:29:02.793	2025-04-20T01:37:25.860	Cross-site scripting (XSS) vulnerability in the EyesOfNetwork web interface (aka eonweb) 5.1-0 allows remote authenticated administrators to inject arbitrary web script or HTML via the object parameter to module/admin_conf/index.php.	3.5	LOW	AV:N/AC:M/Au:S/C:N/I:P/A:N		
CVE-2017-14984	2017-10-03T01:29:02.827	2025-04-20T01:37:25.860	Cross-site scripting (XSS) vulnerability in the EyesOfNetwork web interface (aka eonweb) 5.1-0 allows remote authenticated users to inject arbitrary web script or HTML via the bp_name parameter to /module/admin_bp/add_services.php.	3.5	LOW	AV:N/AC:M/Au:S/C:N/I:P/A:N		
CVE-2017-14985	2017-10-03T01:29:02.857	2025-04-20T01:37:25.860	Cross-site scripting (XSS) vulnerability in the EyesOfNetwork web interface (aka eonweb) 5.1-0 allows remote authenticated users to inject arbitrary web script or HTML via the url parameter to module/module_frame/index.php.	3.5	LOW	AV:N/AC:M/Au:S/C:N/I:P/A:N		
CVE-2017-14988	2017-10-03T01:29:02.903	2025-04-20T01:37:25.860	Header::readfrom in IlmImf/ImfHeader.cpp in OpenEXR 2.2.0 allows remote attackers to cause a denial of service (excessive memory allocation) via a crafted file that is accessed with the ImfOpenInputFile function in IlmImf/ImfCRgbaFile.cpp. NOTE: The maintainer and multiple third parties believe that this vulnerability isn't valid	4.3	MEDIUM	AV:N/AC:M/Au:N/C:N/I:N/A:P		
CVE-2017-14989	2017-10-03T01:29:02.967	2025-04-20T01:37:25.860	A use-after-free in RenderFreetype in MagickCore/annotate.c in ImageMagick 7.0.7-4 Q16 allows attackers to crash the application via a crafted font file, because the FT_Done_Glyph function (from FreeType 2) is called at an incorrect place in the ImageMagick code.	4.3	MEDIUM	AV:N/AC:M/Au:N/C:N/I:N/A:P		
CVE-2017-14990	2017-10-03T01:29:03.013	2025-04-20T01:37:25.860	WordPress 4.8.2 stores cleartext wp_signups.activation_key values (but stores the analogous wp_users.user_activation_key values as hashes), which might make it easier for remote attackers to hijack unactivated user accounts by leveraging database read access (such as access gained through an unspecified SQL injection vulnerability).	4.0	MEDIUM	AV:N/AC:L/Au:S/C:P/I:N/A:N		
CVE-2017-1569	2017-10-03T01:29:03.060	2025-04-20T01:37:25.860	IBM WebSphere Commerce 7.0 and 8.0 contains an unspecified vulnerability in Marketing ESpot's that could cause a denial of service. IBM X-Force ID: 131779.	5.0	MEDIUM	AV:N/AC:L/Au:N/C:N/I:N/A:P		
