CVE ID	Published Date	Last Modified Date	Description	Base Score	Base Severity	Vector String	Vendor	Product
CVE-2017-11281	2017-12-01T08:29:00.217	2025-04-20T01:37:25.860	Adobe Flash Player has an exploitable memory corruption vulnerability in the text handling function. Successful exploitation could lead to arbitrary code execution. This affects 26.0.0.151 and earlier.	7.5	HIGH	AV:N/AC:L/Au:N/C:P/I:P/A:P		
CVE-2017-11282	2017-12-01T08:29:00.263	2025-04-20T01:37:25.860	Adobe Flash Player has an exploitable memory corruption vulnerability in the MP4 atom parser. Successful exploitation could lead to arbitrary code execution. This affects 26.0.0.151 and earlier.	7.5	HIGH	AV:N/AC:L/Au:N/C:P/I:P/A:P		
CVE-2017-11283	2017-12-01T08:29:00.293	2025-04-20T01:37:25.860	Adobe ColdFusion has an Untrusted Data Deserialization vulnerability. This affects Update 4 and earlier versions for ColdFusion 2016, and Update 12 and earlier versions for ColdFusion 11.	9.8	CRITICAL	CVSS:3.1/AV:N/AC:L/PR:N/UI:N/S:U/C:H/I:H/A:H		
CVE-2017-11284	2017-12-01T08:29:00.327	2025-04-20T01:37:25.860	Adobe ColdFusion has an Untrusted Data Deserialization vulnerability. This affects Update 4 and earlier versions for ColdFusion 2016, and Update 12 and earlier versions for ColdFusion 11.	9.8	CRITICAL	CVSS:3.1/AV:N/AC:L/PR:N/UI:N/S:U/C:H/I:H/A:H		
CVE-2017-11285	2017-12-01T08:29:00.373	2025-04-20T01:37:25.860	Adobe ColdFusion has a cross-site scripting (XSS) vulnerability. This affects Update 4 and earlier versions for ColdFusion 2016, and Update 12 and earlier versions for ColdFusion 11.	6.1	MEDIUM	CVSS:3.1/AV:N/AC:L/PR:N/UI:R/S:C/C:L/I:L/A:N		
CVE-2017-11286	2017-12-01T08:29:00.420	2025-04-20T01:37:25.860	Adobe ColdFusion has an XML external entity (XXE) injection vulnerability. This affects Update 4 and earlier versions for ColdFusion 2016, and Update 12 and earlier versions for ColdFusion 11.	7.5	HIGH	CVSS:3.1/AV:N/AC:L/PR:N/UI:N/S:U/C:H/I:N/A:N		
CVE-2017-15607	2017-12-01T08:29:00.450	2025-04-20T01:37:25.860	Inedo Otter before 1.7.4 has directory traversal in filesystem-based rafts via vectors involving '/' characters or initial '.' characters, aka OT-181.	7.5	HIGH	AV:N/AC:L/Au:N/C:P/I:P/A:P		
CVE-2017-17083	2017-12-01T08:29:00.497	2025-04-20T01:37:25.860	In Wireshark 2.4.0 to 2.4.2 and 2.2.0 to 2.2.10, the NetBIOS dissector could crash. This was addressed in epan/dissectors/packet-netbios.c by ensuring that write operations are bounded by the beginning of a buffer.	5.0	MEDIUM	AV:N/AC:L/Au:N/C:N/I:N/A:P		
CVE-2017-17084	2017-12-01T08:29:00.543	2025-04-20T01:37:25.860	In Wireshark 2.4.0 to 2.4.2 and 2.2.0 to 2.2.10, the IWARP_MPA dissector could crash. This was addressed in epan/dissectors/packet-iwarp-mpa.c by validating a ULPDU length.	5.0	MEDIUM	AV:N/AC:L/Au:N/C:N/I:N/A:P		
CVE-2017-17085	2017-12-01T08:29:00.577	2025-04-20T01:37:25.860	In Wireshark 2.4.0 to 2.4.2 and 2.2.0 to 2.2.10, the CIP Safety dissector could crash. This was addressed in epan/dissectors/packet-cipsafety.c by validating the packet length.	5.0	MEDIUM	AV:N/AC:L/Au:N/C:N/I:N/A:P		
CVE-2017-17086	2017-12-01T08:29:00.623	2025-04-20T01:37:25.860	"Indeo Otter through 1.7.4 mishandles a ""</script>"" substring in an initial DP payload, which allows remote attackers to cause a denial of service (crash) or possibly have unspecified other impact, as demonstrated by the Plan Editor."	7.5	HIGH	AV:N/AC:L/Au:N/C:P/I:P/A:P		
CVE-2017-17087	2017-12-01T08:29:00.670	2025-04-20T01:37:25.860	fileio.c in Vim prior to 8.0.1263 sets the group ownership of a .swp file to the editor's primary group (which may be different from the group ownership of the original file), which allows local users to obtain sensitive information by leveraging an applicable group membership, as demonstrated by /etc/shadow owned by root:shadow mode 0640, but /etc/.shadow.swp owned by root:users mode 0640, a different vulnerability than CVE-2017-1000382.	5.5	MEDIUM	CVSS:3.1/AV:L/AC:L/PR:L/UI:N/S:U/C:H/I:N/A:N		
CVE-2017-3104	2017-12-01T08:29:00.700	2025-04-20T01:37:25.860	Adobe RoboHelp has a cross-site scripting (XSS) vulnerability. This affects versions before RH12.0.4.460 and RH2017 before RH2017.0.2.	4.3	MEDIUM	AV:N/AC:M/Au:N/C:N/I:P/A:N		
CVE-2017-3105	2017-12-01T08:29:00.733	2025-04-20T01:37:25.860	Adobe RoboHelp has an Open Redirect vulnerability. This affects versions before RH12.0.4.460 and RH2017 before RH2017.0.2.	5.8	MEDIUM	AV:N/AC:M/Au:N/C:P/I:P/A:N		
CVE-2017-10861	2017-12-01T14:29:00.193	2025-04-20T01:37:25.860	Directory traversal vulnerability in QND Advance/Standard allows an attacker to read arbitrary files via a specially crafted command.	6.4	MEDIUM	AV:N/AC:L/Au:N/C:P/I:P/A:N		
CVE-2017-10874	2017-12-01T14:29:00.240	2025-04-20T01:37:25.860	PWR-Q200 does not use random values for source ports of DNS query packets, which allows remote attackers to conduct DNS cache poisoning attacks.	5.0	MEDIUM	AV:N/AC:L/Au:N/C:N/I:P/A:N		
CVE-2017-10891	2017-12-01T14:29:00.277	2025-04-20T01:37:25.860	Untrusted search path vulnerability in Media Go version 3.2.0.191 and earlier allows an attacker to gain privileges via a Trojan horse DLL in an unspecified directory.	9.3	HIGH	AV:N/AC:M/Au:N/C:C/I:C/A:C		
CVE-2017-10892	2017-12-01T14:29:00.320	2025-04-20T01:37:25.860	Untrusted search path vulnerability in Music Center for PC version 1.0.00 allows an attacker to gain privileges via a Trojan horse DLL in an unspecified directory.	9.3	HIGH	AV:N/AC:M/Au:N/C:C/I:C/A:C		
CVE-2017-10894	2017-12-01T14:29:00.350	2025-04-20T01:37:25.860	StreamRelay.NET.exe ver2.14.0.7 and earlier allows remote attackers to cause a denial of service via unspecified vectors.	5.0	MEDIUM	AV:N/AC:L/Au:N/C:N/I:N/A:P		
CVE-2017-10895	2017-12-01T14:29:00.383	2025-04-20T01:37:25.860	sDNSProxy.exe ver1.1.0.0 and earlier allows remote attackers to cause a denial of service via unspecified vectors.	5.0	MEDIUM	AV:N/AC:L/Au:N/C:N/I:N/A:P		
CVE-2017-10898	2017-12-01T14:29:00.430	2025-04-20T01:37:25.860	SQL injection vulnerability in the A-Member and A-Member for MT cloud versions 3.8.6 and earlier allows an attacker to execute arbitrary SQL commands via unspecified vectors.	7.5	HIGH	AV:N/AC:L/Au:N/C:P/I:P/A:P		
CVE-2017-10899	2017-12-01T14:29:00.460	2025-04-20T01:37:25.860	SQL injection vulnerability in the A-Reserve and A-Reserve for MT cloud versions 3.8.6 and earlier allows an attacker to execute arbitrary SQL commands via unspecified vectors.	7.5	HIGH	AV:N/AC:L/Au:N/C:P/I:P/A:P		
CVE-2017-10900	2017-12-01T14:29:00.490	2025-04-20T01:37:25.860	PTW-WMS1 firmware version 2.000.012 allows remote attackers to bypass access restrictions to obtain or delete data on the disk via unspecified vectors.	7.5	HIGH	AV:N/AC:L/Au:N/C:P/I:P/A:P		
CVE-2017-10901	2017-12-01T14:29:00.537	2025-04-20T01:37:25.860	Buffer overflow in PTW-WMS1 firmware version 2.000.012 allows remote attackers to conduct denial-of-service attacks via unspecified vectors.	5.0	MEDIUM	AV:N/AC:L/Au:N/C:N/I:N/A:P		
CVE-2017-10902	2017-12-01T14:29:00.570	2025-04-20T01:37:25.860	PTW-WMS1 firmware version 2.000.012 allows remote attackers to execute arbitrary OS commands via unspecified vectors.	10.0	HIGH	AV:N/AC:L/Au:N/C:C/I:C/A:C		
CVE-2017-10903	2017-12-01T14:29:00.600	2025-04-20T01:37:25.860	Improper authentication issue in PTW-WMS1 firmware version 2.000.012 allows remote attackers to log in to the device with root privileges and conduct arbitrary operations via unspecified vectors.	10.0	HIGH	AV:N/AC:L/Au:N/C:C/I:C/A:C		
CVE-2017-15701	2017-12-01T15:29:00.213	2025-04-20T01:37:25.860	In Apache Qpid Broker-J versions 6.1.0 through 6.1.4 (inclusive) the broker does not properly enforce a maximum frame size in AMQP 1.0 frames. A remote unauthenticated attacker could exploit this to cause the broker to exhaust all available memory and eventually terminate. Older AMQP protocols are not affected.	7.5	HIGH	CVSS:3.1/AV:N/AC:L/PR:N/UI:N/S:U/C:N/I:N/A:H		
CVE-2017-15702	2017-12-01T15:29:00.260	2025-04-20T01:37:25.860	In Apache Qpid Broker-J 0.18 through 0.32, if the broker is configured with different authentication providers on different ports one of which is an HTTP port, then the broker can be tricked by a remote unauthenticated attacker connecting to the HTTP port into using an authentication provider that was configured on a different port. The attacker still needs valid credentials with the authentication provider on the spoofed port. This becomes an issue when the spoofed port has weaker authentication protection (e.g., anonymous access, default accounts) and is normally protected by firewall rules or similar which can be circumvented by this vulnerability. AMQP ports are not affected. Versions 6.0.0 and newer are not affected.	9.8	CRITICAL	CVSS:3.1/AV:N/AC:L/PR:N/UI:N/S:U/C:H/I:H/A:H		
CVE-2017-15707	2017-12-01T16:29:00.247	2025-04-20T01:37:25.860	In Apache Struts 2.5 to 2.5.14, the REST Plugin is using an outdated JSON-lib library which is vulnerable and allow perform a DoS attack using malicious request with specially crafted JSON payload.	5.0	MEDIUM	AV:N/AC:L/Au:N/C:N/I:N/A:P		
CVE-2017-13663	2017-12-01T17:29:00.230	2025-04-20T01:37:25.860	Encryption key exposure in firmware in iSmartAlarm CubeOne version 2.2.4.8 and earlier allows attackers to decrypt log files via an exposed key.	5.0	MEDIUM	AV:N/AC:L/Au:N/C:P/I:N/A:N		
CVE-2017-13664	2017-12-01T17:29:00.277	2025-04-20T01:37:25.860	Password file exposure in firmware in iSmartAlarm CubeOne version 2.2.4.8 and earlier allows attackers to execute arbitrary commands with administrative privileges by retrieving credentials from this file.	5.0	MEDIUM	AV:N/AC:L/Au:N/C:P/I:N/A:N		
CVE-2017-14486	2017-12-01T17:29:00.323	2025-04-20T01:37:25.860	The Vibease Wireless Remote Vibrator app for Android and the Vibease Chat app for iOS use cleartext to exchange messages with other apps and the PLAIN SASL mechanism to send auth tokens to Vibease servers, which allows remote attackers to obtain user credentials, messages, and other sensitive information by sniffing the network for XMPP traffic.	5.0	MEDIUM	AV:N/AC:L/Au:N/C:P/I:N/A:N		
CVE-2017-14487	2017-12-01T17:29:00.353	2025-04-20T01:37:25.860	The OhMiBod Remote app for Android and iOS allows remote attackers to impersonate users by sniffing network traffic for search responses from the OhMiBod API server and then editing the username, user_id, and token fields in data/data/com.ohmibod.remote2/shared_prefs/OMB.xml.	6.4	MEDIUM	AV:N/AC:L/Au:N/C:P/I:P/A:N		
CVE-2017-14953	2017-12-01T17:29:00.387	2025-04-20T01:37:25.860	HikVision Wi-Fi IP cameras, when used in a wired configuration, allow physically proximate attackers to trigger association with an arbitrary access point by leveraging a default SSID with no WiFi encryption or authentication. NOTE: Vendor states that this is not a vulnerability, but more an increase to the attack surface of the product	3.3	LOW	AV:A/AC:L/Au:N/C:N/I:P/A:N		
CVE-2017-15357	2017-12-01T17:29:00.433	2025-04-20T01:37:25.860	The setpermissions function in the auto-updater in Arq before 5.9.7 for Mac allows local users to gain root privileges via a symlink attack on the updater binary itself.	6.9	MEDIUM	AV:L/AC:M/Au:N/C:C/I:C/A:C		
CVE-2017-16611	2017-12-01T17:29:00.463	2025-04-20T01:37:25.860	In libXfont before 1.5.4 and libXfont2 before 2.0.3, a local attacker can open (but not read) files on the system as root, triggering tape rewinds, watchdogs, or similar mechanisms that can be triggered by opening files.	5.5	MEDIUM	CVSS:3.1/AV:L/AC:L/PR:L/UI:N/S:U/C:N/I:N/A:H		
CVE-2017-16612	2017-12-01T17:29:00.510	2025-04-20T01:37:25.860	libXcursor before 1.1.15 has various integer overflows that could lead to heap buffer overflows when processing malicious cursors, e.g., with programs like GIMP. It is also possible that an attack vector exists against the related code in cursor/xcursor.c in Wayland through 1.14.0.	5.0	MEDIUM	AV:N/AC:L/Au:N/C:N/I:N/A:P		
CVE-2017-16893	2017-12-01T17:29:00.543	2025-04-20T01:37:25.860	The application Piwigo is affected by an SQL injection vulnerability in version 2.9.2 and possibly prior. This vulnerability allows remote authenticated attackers to obtain information in the context of the user used by the application to retrieve data from the database. tags.php is affected: values of the edit_list parameters are not sanitized; these are used to construct an SQL query and retrieve a list of registered users into the application.	4.0	MEDIUM	AV:N/AC:L/Au:S/C:P/I:N/A:N		
CVE-2017-16895	2017-12-01T17:29:00.590	2025-04-20T01:37:25.860	The (1) arq_updater, (2) arqcommitter, (3) standardrestorer, (4) arqglacierrestorer, and (5) arqs3glacierrestorer helper apps in Arq 5.x before 5.10 for Mac allow local users to gain root privileges via a crafted data packet.	7.8	HIGH	CVSS:3.1/AV:L/AC:L/PR:L/UI:N/S:U/C:H/I:H/A:H		
CVE-2017-16953	2017-12-01T17:29:00.620	2025-04-20T01:37:25.860	connoppp.cgi on ZTE ZXDSL 831CII devices does not require HTTP Basic Authentication, which allows remote attackers to modify the PPPoE configuration or set up a malicious configuration via a GET request.	5.0	MEDIUM	AV:N/AC:L/Au:N/C:N/I:P/A:N		
CVE-2017-6679	2017-12-01T17:29:00.667	2025-04-20T01:37:25.860	The Cisco Umbrella Virtual Appliance Version 2.0.3 and prior contained an undocumented encrypted remote support tunnel (SSH) which auto initiated from the customer's appliance to Cisco's SSH Hubs in the Umbrella datacenters. These tunnels were primarily leveraged for remote support and allowed for authorized/authenticated personnel from the Cisco Umbrella team to access the appliance remotely and obtain full control without explicit customer approval. To address this vulnerability, the Umbrella Virtual Appliance version 2.1.0 now requires explicit customer approval before an SSH tunnel from the VA to the Cisco terminating server can be established.	6.0	MEDIUM	AV:L/AC:H/Au:S/C:C/I:C/A:C		
CVE-2017-17090	2017-12-02T00:29:00.247	2025-04-20T01:37:25.860	An issue was discovered in chan_skinny.c in Asterisk Open Source 13.18.2 and older, 14.7.2 and older, and 15.1.2 and older, and Certified Asterisk 13.13-cert7 and older. If the chan_skinny (aka SCCP protocol) channel driver is flooded with certain requests, it can cause the asterisk process to use excessive amounts of virtual memory, eventually causing asterisk to stop processing requests of any kind.	5.0	MEDIUM	AV:N/AC:L/Au:N/C:N/I:N/A:P		
CVE-2017-17091	2017-12-02T06:29:00.207	2025-04-20T01:37:25.860	wp-admin/user-new.php in WordPress before 4.9.1 sets the newbloguser key to a string that can be directly derived from the user ID, which allows remote attackers to bypass intended access restrictions by entering this string.	6.5	MEDIUM	AV:N/AC:L/Au:S/C:P/I:P/A:P		
CVE-2017-17092	2017-12-02T06:29:00.270	2025-04-20T01:37:25.860	wp-includes/functions.php in WordPress before 4.9.1 does not require the unfiltered_html capability for upload of .js files, which might allow remote attackers to conduct XSS attacks via a crafted file.	3.5	LOW	AV:N/AC:M/Au:S/C:N/I:P/A:N		
CVE-2017-17093	2017-12-02T06:29:00.300	2025-04-20T01:37:25.860	wp-includes/general-template.php in WordPress before 4.9.1 does not properly restrict the lang attribute of an HTML element, which might allow attackers to conduct XSS attacks via the language setting of a site.	3.5	LOW	AV:N/AC:M/Au:S/C:N/I:P/A:N		
CVE-2017-17094	2017-12-02T06:29:00.347	2025-04-20T01:37:25.860	wp-includes/feed.php in WordPress before 4.9.1 does not properly restrict enclosures in RSS and Atom fields, which might allow attackers to conduct XSS attacks via a crafted URL.	3.5	LOW	AV:N/AC:M/Au:S/C:N/I:P/A:N		
CVE-2017-17095	2017-12-02T06:29:00.377	2025-04-20T01:37:25.860	tools/pal2rgb.c in pal2rgb in LibTIFF 4.0.9 allows remote attackers to cause a denial of service (TIFFSetupStrips heap-based buffer overflow and application crash) or possibly have unspecified other impact via a crafted TIFF file.	6.8	MEDIUM	AV:N/AC:M/Au:N/C:P/I:P/A:P		
CVE-2017-14516	2017-12-03T07:29:00.210	2025-04-20T01:37:25.860	Cross-Site Scripting (XSS) exists in SAP Business Objects Financial Consolidation before 2017-06-13, aka SAP Security Note 2422292.	4.3	MEDIUM	AV:N/AC:M/Au:N/C:N/I:P/A:N		
CVE-2017-17082	2017-12-03T07:29:00.257	2023-11-07T02:41:10.250	Rejected reason: DO NOT USE THIS CANDIDATE NUMBER.  ConsultIDs: none.  Reason: This candidate was withdrawn by its CNA.  Further investigation showed that it was not a security issue.  Notes: none					
CVE-2017-8819	2017-12-03T07:29:00.303	2025-04-20T01:37:25.860	In Tor before 0.2.5.16, 0.2.6 through 0.2.8 before 0.2.8.17, 0.2.9 before 0.2.9.14, 0.3.0 before 0.3.0.13, and 0.3.1 before 0.3.1.9, the replay-cache protection mechanism is ineffective for v2 onion services, aka TROVE-2017-009. An attacker can send many INTRODUCE2 cells to trigger this issue.	5.0	MEDIUM	AV:N/AC:L/Au:N/C:N/I:N/A:P		
CVE-2017-8820	2017-12-03T07:29:00.333	2025-04-20T01:37:25.860	In Tor before 0.2.5.16, 0.2.6 through 0.2.8 before 0.2.8.17, 0.2.9 before 0.2.9.14, 0.3.0 before 0.3.0.13, and 0.3.1 before 0.3.1.9, remote attackers can cause a denial of service (NULL pointer dereference and application crash) against directory authorities via a malformed descriptor, aka TROVE-2017-010.	5.0	MEDIUM	AV:N/AC:L/Au:N/C:N/I:N/A:P		
CVE-2017-8821	2017-12-03T07:29:00.380	2025-04-20T01:37:25.860	In Tor before 0.2.5.16, 0.2.6 through 0.2.8 before 0.2.8.17, 0.2.9 before 0.2.9.14, 0.3.0 before 0.3.0.13, and 0.3.1 before 0.3.1.9, an attacker can cause a denial of service (application hang) via crafted PEM input that signifies a public key requiring a password, which triggers an attempt by the OpenSSL library to ask the user for the password, aka TROVE-2017-011.	5.0	MEDIUM	AV:N/AC:L/Au:N/C:N/I:N/A:P		
CVE-2017-8822	2017-12-03T07:29:00.413	2025-04-20T01:37:25.860	In Tor before 0.2.5.16, 0.2.6 through 0.2.8 before 0.2.8.17, 0.2.9 before 0.2.9.14, 0.3.0 before 0.3.0.13, and 0.3.1 before 0.3.1.9, relays (that have incompletely downloaded descriptors) can pick themselves in a circuit path, leading to a degradation of anonymity, aka TROVE-2017-012.	4.3	MEDIUM	AV:N/AC:M/Au:N/C:P/I:N/A:N		
CVE-2017-8823	2017-12-03T07:29:00.443	2025-04-20T01:37:25.860	In Tor before 0.2.5.16, 0.2.6 through 0.2.8 before 0.2.8.17, 0.2.9 before 0.2.9.14, 0.3.0 before 0.3.0.13, and 0.3.1 before 0.3.1.9, there is a use-after-free in onion service v2 during intro-point expiration because the expiring list is mismanaged in certain error cases, aka TROVE-2017-013.	6.8	MEDIUM	AV:N/AC:M/Au:N/C:P/I:P/A:P		
CVE-2017-17096	2017-12-03T19:29:00.190	2025-04-20T01:37:25.860	Cross-site scripting (XSS) vulnerability in the Content Cards plugin before 0.9.7 for WordPress allows remote attackers to inject arbitrary JavaScript via crafted OpenGraph data.	4.3	MEDIUM	AV:N/AC:M/Au:N/C:N/I:P/A:N		
CVE-2017-17099	2017-12-03T21:29:00.227	2025-04-20T01:37:25.860	There exists an unauthenticated SEH based Buffer Overflow vulnerability in the HTTP server of Flexense SyncBreeze Enterprise v10.1.16. When sending a GET request with an excessive length, it is possible for a malicious user to overwrite the SEH record and execute a payload that would run under the Windows SYSTEM account.	7.2	HIGH	AV:L/AC:L/Au:N/C:C/I:C/A:C		
CVE-2017-17102	2017-12-04T08:29:00.247	2025-04-20T01:37:25.860	Fiyo CMS 2.0.7 has SQL injection in /system/site.php via $_REQUEST['link'].	5.0	MEDIUM	AV:N/AC:L/Au:N/C:P/I:N/A:N		
CVE-2017-17103	2017-12-04T08:29:00.293	2025-04-20T01:37:25.860	Fiyo CMS 2.0.7 has SQL injection in /apps/app_user/sys_user.php via $_POST[name] or $_POST[email]. This vulnerability can lead to escalation from normal user privileges to administrator privileges.	6.5	MEDIUM	AV:N/AC:L/Au:S/C:P/I:P/A:P		
CVE-2017-17104	2017-12-04T08:29:00.340	2025-04-20T01:37:25.860	Fiyo CMS 2.0.7 has an arbitrary file read vulnerability in dapur/apps/app_theme/libs/check_file.php via $_GET['src'] or $_GET['name'].	7.8	HIGH	AV:N/AC:L/Au:N/C:C/I:N/A:N		
CVE-2017-17112	2017-12-04T08:29:00.373	2025-04-20T01:37:25.860	ntguard_x64.sys 0.18780.0.0 in IKARUS anti.virus 2.16.15 has a Pool Corruption vulnerability via a 0x83000058 DeviceIoControl request.	7.2	HIGH	AV:L/AC:L/Au:N/C:C/I:C/A:C		
CVE-2017-17113	2017-12-04T08:29:00.403	2025-04-20T01:37:25.860	ntguard_x64.sys 0.18780.0.0 in IKARUS anti.virus 2.16.15 has a NULL pointer dereference via a 0x830000c4 DeviceIoControl request.	2.1	LOW	AV:L/AC:L/Au:N/C:N/I:N/A:P		
CVE-2017-17114	2017-12-04T08:29:00.437	2025-04-20T01:37:25.860	ntguard.sys and ntguard_x64.sys 0.18780.0.0 in IKARUS anti.virus 2.16.15 have a Memory Corruption vulnerability via a 0x83000084 DeviceIoControl request.	7.2	HIGH	AV:L/AC:L/Au:N/C:C/I:C/A:C		
CVE-2017-17121	2017-12-04T08:29:00.483	2025-04-20T01:37:25.860	The Binary File Descriptor (BFD) library (aka libbfd), as distributed in GNU Binutils 2.29.1, allows remote attackers to cause a denial of service (memory access violation) or possibly have unspecified other impact via a COFF binary in which a relocation refers to a location after the end of the to-be-relocated section.	6.8	MEDIUM	AV:N/AC:M/Au:N/C:P/I:P/A:P		
CVE-2017-17122	2017-12-04T08:29:00.513	2025-04-20T01:37:25.860	The dump_relocs_in_section function in objdump.c in GNU Binutils 2.29.1 does not check for reloc count integer overflows, which allows remote attackers to cause a denial of service (excessive memory allocation, or heap-based buffer overflow and application crash) or possibly have unspecified other impact via a crafted PE file.	6.8	MEDIUM	AV:N/AC:M/Au:N/C:P/I:P/A:P		
CVE-2017-17123	2017-12-04T08:29:00.543	2025-04-20T01:37:25.860	The coff_slurp_reloc_table function in coffcode.h in the Binary File Descriptor (BFD) library (aka libbfd), as distributed in GNU Binutils 2.29.1, allows remote attackers to cause a denial of service (NULL pointer dereference and application crash) via a crafted COFF based file.	4.3	MEDIUM	AV:N/AC:M/Au:N/C:N/I:N/A:P		
CVE-2017-17124	2017-12-04T08:29:00.577	2025-04-20T01:37:25.860	The _bfd_coff_read_string_table function in coffgen.c in the Binary File Descriptor (BFD) library (aka libbfd), as distributed in GNU Binutils 2.29.1, does not properly validate the size of the external string table, which allows remote attackers to cause a denial of service (excessive memory consumption, or heap-based buffer overflow and application crash) or possibly have unspecified other impact via a crafted COFF binary.	6.8	MEDIUM	AV:N/AC:M/Au:N/C:P/I:P/A:P		
CVE-2017-17125	2017-12-04T08:29:00.623	2025-04-20T01:37:25.860	nm.c and objdump.c in GNU Binutils 2.29.1 mishandle certain global symbols, which allows remote attackers to cause a denial of service (_bfd_elf_get_symbol_version_string buffer over-read and application crash) or possibly have unspecified other impact via a crafted ELF file.	6.8	MEDIUM	AV:N/AC:M/Au:N/C:P/I:P/A:P		
CVE-2017-17126	2017-12-04T08:29:00.653	2025-04-20T01:37:25.860	The load_debug_section function in readelf.c in GNU Binutils 2.29.1 allows remote attackers to cause a denial of service (invalid memory access and application crash) or possibly have unspecified other impact via an ELF file that lacks section headers.	6.8	MEDIUM	AV:N/AC:M/Au:N/C:P/I:P/A:P		
CVE-2017-17127	2017-12-04T08:29:00.700	2025-04-20T01:37:25.860	The vc1_decode_frame function in libavcodec/vc1dec.c in Libav 12.2 allows remote attackers to cause a denial of service (NULL pointer dereference and application crash) via a crafted file.	4.3	MEDIUM	AV:N/AC:M/Au:N/C:N/I:N/A:P		
CVE-2017-17128	2017-12-04T08:29:00.733	2025-04-20T01:37:25.860	The h264_slice_init function in libavcodec/h264_slice.c in Libav 12.2 allows remote attackers to cause a denial of service (segmentation fault and application crash) via a crafted file.	4.3	MEDIUM	AV:N/AC:M/Au:N/C:N/I:N/A:P		
CVE-2017-17129	2017-12-04T08:29:00.763	2025-04-20T01:37:25.860	The ff_vc1_mc_4mv_chroma4 function in libavcodec/vc1_mc.c in Libav 12.2 allows remote attackers to cause a denial of service (segmentation fault and application crash) or possibly have unspecified other impact via a crafted file.	6.8	MEDIUM	AV:N/AC:M/Au:N/C:P/I:P/A:P		
CVE-2017-17130	2017-12-04T08:29:00.793	2025-04-20T01:37:25.860	The ff_free_picture_tables function in libavcodec/mpegpicture.c in Libav 12.2 allows remote attackers to cause a denial of service (heap-based buffer overflow and application crash) or possibly have unspecified other impact via a crafted file, related to vc1_decode_i_blocks_adv.	6.8	MEDIUM	AV:N/AC:M/Au:N/C:P/I:P/A:P		
CVE-2017-17056	2017-12-04T14:29:00.200	2025-04-20T01:37:25.860	The ZKTime Web Software 2.0.1.12280 allows the Administrator to elevate the privileges of the application user using a 'password_change()' function of the Modify Password component, reachable via the old_password, new_password1, and new_password2 parameters to the /accounts/password_change/ URI. An attacker takes advantage of this scenario and creates a crafted CSRF link to add himself as an administrator to the ZKTime Web Software. He then uses social engineering methods to trick the administrator into clicking the forged HTTP request. The request is executed and the attacker becomes the Administrator of the ZKTime Web Software. If the vulnerability is successfully exploited, then an attacker (who would be a normal user of the web application) can escalate his privileges and become the administrator of ZKTime Web Software.	6.8	MEDIUM	AV:N/AC:M/Au:N/C:P/I:P/A:P		
CVE-2017-17057	2017-12-04T14:29:00.263	2025-04-20T01:37:25.860	There is a reflected XSS vulnerability in ZKTime Web 2.0.1.12280. The vulnerability exists due to insufficient filtration of user-supplied data in the 'Range' field of the 'Department' module in a Personnel Advanced Query. A remote attacker can execute arbitrary HTML and script code in the browser in the context of the vulnerable application.	4.3	MEDIUM	AV:N/AC:M/Au:N/C:N/I:P/A:N		
