CVE ID	Published Date	Last Modified Date	Description	Base Score	Base Severity	Vector String	Vendor	Product
CVE-2017-12898	2017-09-14T06:29:00.387	2025-04-20T01:37:25.860	The NFS parser in tcpdump before 4.9.2 has a buffer over-read in print-nfs.c:interp_reply().	7.5	HIGH	AV:N/AC:L/Au:N/C:P/I:P/A:P		
CVE-2017-12899	2017-09-14T06:29:00.437	2025-04-20T01:37:25.860	The DECnet parser in tcpdump before 4.9.2 has a buffer over-read in print-decnet.c:decnet_print().	9.8	CRITICAL	CVSS:3.1/AV:N/AC:L/PR:N/UI:N/S:U/C:H/I:H/A:H		
CVE-2017-12900	2017-09-14T06:29:00.467	2025-04-20T01:37:25.860	Several protocol parsers in tcpdump before 4.9.2 could cause a buffer over-read in util-print.c:tok2strbuf().	7.5	HIGH	AV:N/AC:L/Au:N/C:P/I:P/A:P		
CVE-2017-12901	2017-09-14T06:29:00.513	2025-04-20T01:37:25.860	The EIGRP parser in tcpdump before 4.9.2 has a buffer over-read in print-eigrp.c:eigrp_print().	7.5	HIGH	AV:N/AC:L/Au:N/C:P/I:P/A:P		
CVE-2017-12902	2017-09-14T06:29:00.560	2025-04-20T01:37:25.860	The Zephyr parser in tcpdump before 4.9.2 has a buffer over-read in print-zephyr.c, several functions.	9.8	CRITICAL	CVSS:3.1/AV:N/AC:L/PR:N/UI:N/S:U/C:H/I:H/A:H		
CVE-2017-12985	2017-09-14T06:29:00.590	2025-04-20T01:37:25.860	The IPv6 parser in tcpdump before 4.9.2 has a buffer over-read in print-ip6.c:ip6_print().	7.5	HIGH	AV:N/AC:L/Au:N/C:P/I:P/A:P		
CVE-2017-12986	2017-09-14T06:29:00.623	2025-04-20T01:37:25.860	The IPv6 routing header parser in tcpdump before 4.9.2 has a buffer over-read in print-rt6.c:rt6_print().	7.5	HIGH	AV:N/AC:L/Au:N/C:P/I:P/A:P		
CVE-2017-12987	2017-09-14T06:29:00.653	2025-04-20T01:37:25.860	The IEEE 802.11 parser in tcpdump before 4.9.2 has a buffer over-read in print-802_11.c:parse_elements().	9.8	CRITICAL	CVSS:3.1/AV:N/AC:L/PR:N/UI:N/S:U/C:H/I:H/A:H		
CVE-2017-12988	2017-09-14T06:29:00.700	2025-04-20T01:37:25.860	The telnet parser in tcpdump before 4.9.2 has a buffer over-read in print-telnet.c:telnet_parse().	7.5	HIGH	AV:N/AC:L/Au:N/C:P/I:P/A:P		
CVE-2017-12989	2017-09-14T06:29:00.733	2025-04-20T01:37:25.860	The RESP parser in tcpdump before 4.9.2 could enter an infinite loop due to a bug in print-resp.c:resp_get_length().	5.0	MEDIUM	AV:N/AC:L/Au:N/C:N/I:N/A:P		
CVE-2017-12990	2017-09-14T06:29:00.763	2025-04-20T01:37:25.860	The ISAKMP parser in tcpdump before 4.9.2 could enter an infinite loop due to bugs in print-isakmp.c, several functions.	5.0	MEDIUM	AV:N/AC:L/Au:N/C:N/I:N/A:P		
CVE-2017-12991	2017-09-14T06:29:00.793	2025-04-20T01:37:25.860	The BGP parser in tcpdump before 4.9.2 has a buffer over-read in print-bgp.c:bgp_attr_print().	7.5	HIGH	AV:N/AC:L/Au:N/C:P/I:P/A:P		
CVE-2017-12992	2017-09-14T06:29:00.827	2025-04-20T01:37:25.860	The RIPng parser in tcpdump before 4.9.2 has a buffer over-read in print-ripng.c:ripng_print().	7.5	HIGH	AV:N/AC:L/Au:N/C:P/I:P/A:P		
CVE-2017-12993	2017-09-14T06:29:00.857	2025-04-20T01:37:25.860	The Juniper protocols parser in tcpdump before 4.9.2 has a buffer over-read in print-juniper.c, several functions.	7.5	HIGH	AV:N/AC:L/Au:N/C:P/I:P/A:P		
CVE-2017-12994	2017-09-14T06:29:00.903	2025-04-20T01:37:25.860	The BGP parser in tcpdump before 4.9.2 has a buffer over-read in print-bgp.c:bgp_attr_print().	7.5	HIGH	AV:N/AC:L/Au:N/C:P/I:P/A:P		
CVE-2017-12995	2017-09-14T06:29:00.937	2025-04-20T01:37:25.860	The DNS parser in tcpdump before 4.9.2 could enter an infinite loop due to a bug in print-domain.c:ns_print().	5.0	MEDIUM	AV:N/AC:L/Au:N/C:N/I:N/A:P		
CVE-2017-12996	2017-09-14T06:29:00.967	2025-04-20T01:37:25.860	The PIMv2 parser in tcpdump before 4.9.2 has a buffer over-read in print-pim.c:pimv2_print().	7.5	HIGH	AV:N/AC:L/Au:N/C:P/I:P/A:P		
CVE-2017-12997	2017-09-14T06:29:00.997	2025-04-20T01:37:25.860	The LLDP parser in tcpdump before 4.9.2 could enter an infinite loop due to a bug in print-lldp.c:lldp_private_8021_print().	5.0	MEDIUM	AV:N/AC:L/Au:N/C:N/I:N/A:P		
CVE-2017-12998	2017-09-14T06:29:01.043	2025-04-20T01:37:25.860	The IS-IS parser in tcpdump before 4.9.2 has a buffer over-read in print-isoclns.c:isis_print_extd_ip_reach().	7.5	HIGH	AV:N/AC:L/Au:N/C:P/I:P/A:P		
CVE-2017-12999	2017-09-14T06:29:01.077	2025-04-20T01:37:25.860	The IS-IS parser in tcpdump before 4.9.2 has a buffer over-read in print-isoclns.c:isis_print().	7.5	HIGH	AV:N/AC:L/Au:N/C:P/I:P/A:P		
CVE-2017-13000	2017-09-14T06:29:01.137	2025-04-20T01:37:25.860	The IEEE 802.15.4 parser in tcpdump before 4.9.2 has a buffer over-read in print-802_15_4.c:ieee802_15_4_if_print().	7.5	HIGH	AV:N/AC:L/Au:N/C:P/I:P/A:P		
CVE-2017-13001	2017-09-14T06:29:01.247	2025-04-20T01:37:25.860	The NFS parser in tcpdump before 4.9.2 has a buffer over-read in print-nfs.c:nfs_printfh().	7.5	HIGH	AV:N/AC:L/Au:N/C:P/I:P/A:P		
CVE-2017-13002	2017-09-14T06:29:01.280	2025-04-20T01:37:25.860	The AODV parser in tcpdump before 4.9.2 has a buffer over-read in print-aodv.c:aodv_extension().	7.5	HIGH	AV:N/AC:L/Au:N/C:P/I:P/A:P		
CVE-2017-13003	2017-09-14T06:29:01.310	2025-04-20T01:37:25.860	The LMP parser in tcpdump before 4.9.2 has a buffer over-read in print-lmp.c:lmp_print().	7.5	HIGH	AV:N/AC:L/Au:N/C:P/I:P/A:P		
CVE-2017-13004	2017-09-14T06:29:01.387	2025-04-20T01:37:25.860	The Juniper protocols parser in tcpdump before 4.9.2 has a buffer over-read in print-juniper.c:juniper_parse_header().	9.8	CRITICAL	CVSS:3.1/AV:N/AC:L/PR:N/UI:N/S:U/C:H/I:H/A:H		
CVE-2017-13005	2017-09-14T06:29:01.483	2025-04-20T01:37:25.860	The NFS parser in tcpdump before 4.9.2 has a buffer over-read in print-nfs.c:xid_map_enter().	7.5	HIGH	AV:N/AC:L/Au:N/C:P/I:P/A:P		
CVE-2017-13006	2017-09-14T06:29:01.513	2025-04-20T01:37:25.860	The L2TP parser in tcpdump before 4.9.2 has a buffer over-read in print-l2tp.c, several functions.	7.5	HIGH	AV:N/AC:L/Au:N/C:P/I:P/A:P		
CVE-2017-13007	2017-09-14T06:29:01.543	2025-04-20T01:37:25.860	The Apple PKTAP parser in tcpdump before 4.9.2 has a buffer over-read in print-pktap.c:pktap_if_print().	7.5	HIGH	AV:N/AC:L/Au:N/C:P/I:P/A:P		
CVE-2017-13008	2017-09-14T06:29:01.577	2025-04-20T01:37:25.860	The IEEE 802.11 parser in tcpdump before 4.9.2 has a buffer over-read in print-802_11.c:parse_elements().	7.5	HIGH	AV:N/AC:L/Au:N/C:P/I:P/A:P		
CVE-2017-13009	2017-09-14T06:29:01.607	2025-04-20T01:37:25.860	The IPv6 mobility parser in tcpdump before 4.9.2 has a buffer over-read in print-mobility.c:mobility_print().	7.5	HIGH	AV:N/AC:L/Au:N/C:P/I:P/A:P		
CVE-2017-13010	2017-09-14T06:29:01.637	2025-04-20T01:37:25.860	The BEEP parser in tcpdump before 4.9.2 has a buffer over-read in print-beep.c:l_strnstart().	7.5	HIGH	AV:N/AC:L/Au:N/C:P/I:P/A:P		
CVE-2017-13011	2017-09-14T06:29:01.670	2025-04-20T01:37:25.860	Several protocol parsers in tcpdump before 4.9.2 could cause a buffer overflow in util-print.c:bittok2str_internal().	7.5	HIGH	AV:N/AC:L/Au:N/C:P/I:P/A:P		
CVE-2017-13012	2017-09-14T06:29:01.700	2025-04-20T01:37:25.860	The ICMP parser in tcpdump before 4.9.2 has a buffer over-read in print-icmp.c:icmp_print().	7.5	HIGH	AV:N/AC:L/Au:N/C:P/I:P/A:P		
CVE-2017-13013	2017-09-14T06:29:01.733	2025-04-20T01:37:25.860	The ARP parser in tcpdump before 4.9.2 has a buffer over-read in print-arp.c, several functions.	7.5	HIGH	AV:N/AC:L/Au:N/C:P/I:P/A:P		
CVE-2017-13014	2017-09-14T06:29:01.763	2025-04-20T01:37:25.860	The White Board protocol parser in tcpdump before 4.9.2 has a buffer over-read in print-wb.c:wb_prep(), several functions.	7.5	HIGH	AV:N/AC:L/Au:N/C:P/I:P/A:P		
CVE-2017-13015	2017-09-14T06:29:01.793	2025-04-20T01:37:25.860	The EAP parser in tcpdump before 4.9.2 has a buffer over-read in print-eap.c:eap_print().	7.5	HIGH	AV:N/AC:L/Au:N/C:P/I:P/A:P		
CVE-2017-13016	2017-09-14T06:29:01.827	2025-04-20T01:37:25.860	The ISO ES-IS parser in tcpdump before 4.9.2 has a buffer over-read in print-isoclns.c:esis_print().	7.5	HIGH	AV:N/AC:L/Au:N/C:P/I:P/A:P		
CVE-2017-13017	2017-09-14T06:29:01.857	2025-04-20T01:37:25.860	The DHCPv6 parser in tcpdump before 4.9.2 has a buffer over-read in print-dhcp6.c:dhcp6opt_print().	7.5	HIGH	AV:N/AC:L/Au:N/C:P/I:P/A:P		
CVE-2017-13018	2017-09-14T06:29:01.887	2025-04-20T01:37:25.860	The PGM parser in tcpdump before 4.9.2 has a buffer over-read in print-pgm.c:pgm_print().	7.5	HIGH	AV:N/AC:L/Au:N/C:P/I:P/A:P		
CVE-2017-13019	2017-09-14T06:29:01.937	2025-04-20T01:37:25.860	The PGM parser in tcpdump before 4.9.2 has a buffer over-read in print-pgm.c:pgm_print().	7.5	HIGH	AV:N/AC:L/Au:N/C:P/I:P/A:P		
CVE-2017-13020	2017-09-14T06:29:01.967	2025-04-20T01:37:25.860	The VTP parser in tcpdump before 4.9.2 has a buffer over-read in print-vtp.c:vtp_print().	9.8	CRITICAL	CVSS:3.1/AV:N/AC:L/PR:N/UI:N/S:U/C:H/I:H/A:H		
CVE-2017-13021	2017-09-14T06:29:01.997	2025-04-20T01:37:25.860	The ICMPv6 parser in tcpdump before 4.9.2 has a buffer over-read in print-icmp6.c:icmp6_print().	7.5	HIGH	AV:N/AC:L/Au:N/C:P/I:P/A:P		
CVE-2017-13022	2017-09-14T06:29:02.030	2025-04-20T01:37:25.860	The IP parser in tcpdump before 4.9.2 has a buffer over-read in print-ip.c:ip_printroute().	7.5	HIGH	AV:N/AC:L/Au:N/C:P/I:P/A:P		
CVE-2017-13023	2017-09-14T06:29:02.077	2025-04-20T01:37:25.860	The IPv6 mobility parser in tcpdump before 4.9.2 has a buffer over-read in print-mobility.c:mobility_opt_print().	7.5	HIGH	AV:N/AC:L/Au:N/C:P/I:P/A:P		
CVE-2017-13024	2017-09-14T06:29:02.137	2025-04-20T01:37:25.860	The IPv6 mobility parser in tcpdump before 4.9.2 has a buffer over-read in print-mobility.c:mobility_opt_print().	9.8	CRITICAL	CVSS:3.1/AV:N/AC:L/PR:N/UI:N/S:U/C:H/I:H/A:H		
CVE-2017-13025	2017-09-14T06:29:02.187	2025-04-20T01:37:25.860	The IPv6 mobility parser in tcpdump before 4.9.2 has a buffer over-read in print-mobility.c:mobility_opt_print().	7.5	HIGH	AV:N/AC:L/Au:N/C:P/I:P/A:P		
CVE-2017-13026	2017-09-14T06:29:02.217	2025-04-20T01:37:25.860	The ISO IS-IS parser in tcpdump before 4.9.2 has a buffer over-read in print-isoclns.c, several functions.	7.5	HIGH	AV:N/AC:L/Au:N/C:P/I:P/A:P		
CVE-2017-13027	2017-09-14T06:29:02.247	2025-04-20T01:37:25.860	The LLDP parser in tcpdump before 4.9.2 has a buffer over-read in print-lldp.c:lldp_mgmt_addr_tlv_print().	7.5	HIGH	AV:N/AC:L/Au:N/C:P/I:P/A:P		
CVE-2017-13028	2017-09-14T06:29:02.280	2025-04-20T01:37:25.860	The BOOTP parser in tcpdump before 4.9.2 has a buffer over-read in print-bootp.c:bootp_print().	9.8	CRITICAL	CVSS:3.1/AV:N/AC:L/PR:N/UI:N/S:U/C:H/I:H/A:H		
CVE-2017-13029	2017-09-14T06:29:02.327	2025-04-20T01:37:25.860	The PPP parser in tcpdump before 4.9.2 has a buffer over-read in print-ppp.c:print_ccp_config_options().	7.5	HIGH	AV:N/AC:L/Au:N/C:P/I:P/A:P		
CVE-2017-13030	2017-09-14T06:29:02.357	2025-04-20T01:37:25.860	The PIM parser in tcpdump before 4.9.2 has a buffer over-read in print-pim.c, several functions.	7.5	HIGH	AV:N/AC:L/Au:N/C:P/I:P/A:P		
CVE-2017-13031	2017-09-14T06:29:02.387	2025-04-20T01:37:25.860	The IPv6 fragmentation header parser in tcpdump before 4.9.2 has a buffer over-read in print-frag6.c:frag6_print().	7.5	HIGH	AV:N/AC:L/Au:N/C:P/I:P/A:P		
CVE-2017-13032	2017-09-14T06:29:02.437	2025-04-20T01:37:25.860	The RADIUS parser in tcpdump before 4.9.2 has a buffer over-read in print-radius.c:print_attr_string().	7.5	HIGH	AV:N/AC:L/Au:N/C:P/I:P/A:P		
CVE-2017-13033	2017-09-14T06:29:02.467	2025-04-20T01:37:25.860	The VTP parser in tcpdump before 4.9.2 has a buffer over-read in print-vtp.c:vtp_print().	7.5	HIGH	AV:N/AC:L/Au:N/C:P/I:P/A:P		
CVE-2017-13034	2017-09-14T06:29:02.497	2025-04-20T01:37:25.860	The PGM parser in tcpdump before 4.9.2 has a buffer over-read in print-pgm.c:pgm_print().	7.5	HIGH	AV:N/AC:L/Au:N/C:P/I:P/A:P		
CVE-2017-13035	2017-09-14T06:29:02.547	2025-04-20T01:37:25.860	The ISO IS-IS parser in tcpdump before 4.9.2 has a buffer over-read in print-isoclns.c:isis_print_id().	7.5	HIGH	AV:N/AC:L/Au:N/C:P/I:P/A:P		
CVE-2017-13036	2017-09-14T06:29:02.577	2025-04-20T01:37:25.860	The OSPFv3 parser in tcpdump before 4.9.2 has a buffer over-read in print-ospf6.c:ospf6_decode_v3().	7.5	HIGH	AV:N/AC:L/Au:N/C:P/I:P/A:P		
CVE-2017-13037	2017-09-14T06:29:02.607	2025-04-20T01:37:25.860	The IP parser in tcpdump before 4.9.2 has a buffer over-read in print-ip.c:ip_printts().	7.5	HIGH	AV:N/AC:L/Au:N/C:P/I:P/A:P		
CVE-2017-13038	2017-09-14T06:29:02.637	2025-04-20T01:37:25.860	The PPP parser in tcpdump before 4.9.2 has a buffer over-read in print-ppp.c:handle_mlppp().	7.5	HIGH	AV:N/AC:L/Au:N/C:P/I:P/A:P		
CVE-2017-13039	2017-09-14T06:29:02.687	2025-04-20T01:37:25.860	The ISAKMP parser in tcpdump before 4.9.2 has a buffer over-read in print-isakmp.c, several functions.	7.5	HIGH	AV:N/AC:L/Au:N/C:P/I:P/A:P		
CVE-2017-13040	2017-09-14T06:29:02.717	2025-04-20T01:37:25.860	The MPTCP parser in tcpdump before 4.9.2 has a buffer over-read in print-mptcp.c, several functions.	7.5	HIGH	AV:N/AC:L/Au:N/C:P/I:P/A:P		
CVE-2017-13041	2017-09-14T06:29:02.747	2025-04-20T01:37:25.860	The ICMPv6 parser in tcpdump before 4.9.2 has a buffer over-read in print-icmp6.c:icmp6_nodeinfo_print().	7.5	HIGH	AV:N/AC:L/Au:N/C:P/I:P/A:P		
CVE-2017-13042	2017-09-14T06:29:02.780	2025-04-20T01:37:25.860	The HNCP parser in tcpdump before 4.9.2 has a buffer over-read in print-hncp.c:dhcpv6_print().	7.5	HIGH	AV:N/AC:L/Au:N/C:P/I:P/A:P		
CVE-2017-13043	2017-09-14T06:29:02.810	2025-04-20T01:37:25.860	The BGP parser in tcpdump before 4.9.2 has a buffer over-read in print-bgp.c:decode_multicast_vpn().	7.5	HIGH	AV:N/AC:L/Au:N/C:P/I:P/A:P		
CVE-2017-13044	2017-09-14T06:29:02.840	2025-04-20T01:37:25.860	The HNCP parser in tcpdump before 4.9.2 has a buffer over-read in print-hncp.c:dhcpv4_print().	7.5	HIGH	AV:N/AC:L/Au:N/C:P/I:P/A:P		
CVE-2017-13045	2017-09-14T06:29:02.887	2025-04-20T01:37:25.860	The VQP parser in tcpdump before 4.9.2 has a buffer over-read in print-vqp.c:vqp_print().	7.5	HIGH	AV:N/AC:L/Au:N/C:P/I:P/A:P		
CVE-2017-13046	2017-09-14T06:29:02.920	2025-04-20T01:37:25.860	The BGP parser in tcpdump before 4.9.2 has a buffer over-read in print-bgp.c:bgp_attr_print().	7.5	HIGH	AV:N/AC:L/Au:N/C:P/I:P/A:P		
CVE-2017-13047	2017-09-14T06:29:02.950	2025-04-20T01:37:25.860	The ISO ES-IS parser in tcpdump before 4.9.2 has a buffer over-read in print-isoclns.c:esis_print().	7.5	HIGH	AV:N/AC:L/Au:N/C:P/I:P/A:P		
CVE-2017-13048	2017-09-14T06:29:02.997	2025-04-20T01:37:25.860	The RSVP parser in tcpdump before 4.9.2 has a buffer over-read in print-rsvp.c:rsvp_obj_print().	7.5	HIGH	AV:N/AC:L/Au:N/C:P/I:P/A:P		
CVE-2017-13049	2017-09-14T06:29:03.030	2025-04-20T01:37:25.860	The Rx protocol parser in tcpdump before 4.9.2 has a buffer over-read in print-rx.c:ubik_print().	7.5	HIGH	AV:N/AC:L/Au:N/C:P/I:P/A:P		
CVE-2017-13050	2017-09-14T06:29:03.077	2025-04-20T01:37:25.860	The RPKI-Router parser in tcpdump before 4.9.2 has a buffer over-read in print-rpki-rtr.c:rpki_rtr_pdu_print().	7.5	HIGH	AV:N/AC:L/Au:N/C:P/I:P/A:P		
CVE-2017-13051	2017-09-14T06:29:03.123	2025-04-20T01:37:25.860	The RSVP parser in tcpdump before 4.9.2 has a buffer over-read in print-rsvp.c:rsvp_obj_print().	7.5	HIGH	AV:N/AC:L/Au:N/C:P/I:P/A:P		
CVE-2017-13052	2017-09-14T06:29:03.153	2025-04-20T01:37:25.860	The CFM parser in tcpdump before 4.9.2 has a buffer over-read in print-cfm.c:cfm_print().	7.5	HIGH	AV:N/AC:L/Au:N/C:P/I:P/A:P		
CVE-2017-13053	2017-09-14T06:29:03.187	2025-04-20T01:37:25.860	The BGP parser in tcpdump before 4.9.2 has a buffer over-read in print-bgp.c:decode_rt_routing_info().	7.5	HIGH	AV:N/AC:L/Au:N/C:P/I:P/A:P		
CVE-2017-13054	2017-09-14T06:29:03.217	2025-04-20T01:37:25.860	The LLDP parser in tcpdump before 4.9.2 has a buffer over-read in print-lldp.c:lldp_private_8023_print().	7.5	HIGH	AV:N/AC:L/Au:N/C:P/I:P/A:P		
CVE-2017-13055	2017-09-14T06:29:03.247	2025-04-20T01:37:25.860	The ISO IS-IS parser in tcpdump before 4.9.2 has a buffer over-read in print-isoclns.c:isis_print_is_reach_subtlv().	7.5	HIGH	AV:N/AC:L/Au:N/C:P/I:P/A:P		
CVE-2017-13687	2017-09-14T06:29:03.297	2025-04-20T01:37:25.860	The Cisco HDLC parser in tcpdump before 4.9.2 has a buffer over-read in print-chdlc.c:chdlc_print().	9.8	CRITICAL	CVSS:3.1/AV:N/AC:L/PR:N/UI:N/S:U/C:H/I:H/A:H		
CVE-2017-13688	2017-09-14T06:29:03.340	2025-04-20T01:37:25.860	The OLSR parser in tcpdump before 4.9.2 has a buffer over-read in print-olsr.c:olsr_print().	7.5	HIGH	AV:N/AC:L/Au:N/C:P/I:P/A:P		
CVE-2017-13689	2017-09-14T06:29:03.373	2025-04-20T01:37:25.860	The IKEv1 parser in tcpdump before 4.9.2 has a buffer over-read in print-isakmp.c:ikev1_id_print().	7.5	HIGH	AV:N/AC:L/Au:N/C:P/I:P/A:P		
CVE-2017-13690	2017-09-14T06:29:03.403	2025-04-20T01:37:25.860	The IKEv2 parser in tcpdump before 4.9.2 has a buffer over-read in print-isakmp.c, several functions.	7.5	HIGH	AV:N/AC:L/Au:N/C:P/I:P/A:P		
CVE-2017-13725	2017-09-14T06:29:03.437	2025-04-20T01:37:25.860	The IPv6 routing header parser in tcpdump before 4.9.2 has a buffer over-read in print-rt6.c:rt6_print().	9.8	CRITICAL	CVSS:3.1/AV:N/AC:L/PR:N/UI:N/S:U/C:H/I:H/A:H		
CVE-2017-13779	2017-09-14T06:29:03.483	2025-04-20T01:37:25.860	"GSTN_offline_tool in India Goods and Services Tax Network (GSTN) Offline Utility tool before 1.2 executes winstart-server.vbs from the ""C:\GST Offline Tool"" directory, which has insecure permissions. This allows local users to gain privileges by replacing winstart-server.vbs with arbitrary VBScript code. For example, a local user could create VBScript code for a TCP reverse shell, and use that later for Remote Command Execution."	7.8	HIGH	CVSS:3.1/AV:L/AC:L/PR:L/UI:N/S:U/C:H/I:H/A:H		
CVE-2017-1002000	2017-09-14T13:29:00.200	2025-04-20T01:37:25.860	Vulnerability in wordpress plugin mobile-friendly-app-builder-by-easytouch v3.0, The code in file ./mobile-friendly-app-builder-by-easytouch/server/images.php doesn't require authentication or check that the user is allowed to upload content.	7.5	HIGH	AV:N/AC:L/Au:N/C:P/I:P/A:P		
CVE-2017-1002001	2017-09-14T13:29:00.233	2025-04-20T01:37:25.860	Vulnerability in wordpress plugin mobile-app-builder-by-wappress v1.05, The plugin includes unlicensed vulnerable CMS software from http://www.invedion.com.	7.5	HIGH	AV:N/AC:L/Au:N/C:P/I:P/A:P		
CVE-2017-1002002	2017-09-14T13:29:00.280	2025-04-20T01:37:25.860	Vulnerability in wordpress plugin webapp-builder v2.0, The plugin includes unlicensed vulnerable CMS software from http://www.invedion.com/	7.5	HIGH	AV:N/AC:L/Au:N/C:P/I:P/A:P		
CVE-2017-1002003	2017-09-14T13:29:00.310	2025-04-20T01:37:25.860	Vulnerability in wordpress plugin wp2android-turn-wp-site-into-android-app v1.1.4, The plugin includes unlicensed vulnerable CMS software from http://www.invedion.com.	7.5	HIGH	AV:N/AC:L/Au:N/C:P/I:P/A:P		
CVE-2017-1002004	2017-09-14T13:29:00.357	2025-04-20T01:37:25.860	Vulnerability in wordpress plugin DTracker v1.5, In file ./dtracker/download.php user input isn't sanitized via the id variable before adding it to the end of an SQL query.	5.0	MEDIUM	AV:N/AC:L/Au:N/C:N/I:P/A:N		
CVE-2017-1002005	2017-09-14T13:29:00.390	2025-04-20T01:37:25.860	Vulnerability in wordpress plugin DTracker v1.5, In file ./dtracker/delete.php user input isn't sanitized via the contact_id variable before adding it to the end of an SQL query.	5.0	MEDIUM	AV:N/AC:L/Au:N/C:N/I:P/A:N		
CVE-2017-1002006	2017-09-14T13:29:00.420	2025-04-20T01:37:25.860	Vulnerability in wordpress plugin DTracker v1.5, The code dtracker/save_contact.php doesn't check that the user is authorized before injecting new contacts into the wp_contact table.	5.0	MEDIUM	AV:N/AC:L/Au:N/C:N/I:P/A:N		
CVE-2017-1002007	2017-09-14T13:29:00.467	2025-04-20T01:37:25.860	Vulnerability in wordpress plugin DTracker v1.5, The code dtracker/save_mail.php doesn't check that the user is authorized before injecting new contacts into the wp_contact table.	5.0	MEDIUM	AV:N/AC:L/Au:N/C:N/I:P/A:N		
CVE-2017-1002008	2017-09-14T13:29:00.497	2025-04-20T01:37:25.860	Vulnerability in wordpress plugin membership-simplified-for-oap-members-only v1.58, The file download code located membership-simplified-for-oap-members-only/download.php does not check whether a user is logged in and has download privileges.	9.8	CRITICAL	CVSS:3.1/AV:N/AC:L/PR:N/UI:N/S:U/C:H/I:H/A:H		
CVE-2017-1002009	2017-09-14T13:29:00.530	2025-04-20T01:37:25.860	Vulnerability in wordpress plugin Membership Simplified v1.58, The code in membership-simplified-for-oap-members-only/updateDB.php is vulnerable to blind SQL injection because it doesn't sanitize user input via recordId in the delete function.	7.5	HIGH	AV:N/AC:L/Au:N/C:P/I:P/A:P		
CVE-2017-1002010	2017-09-14T13:29:00.577	2025-04-20T01:37:25.860	Vulnerability in wordpress plugin Membership Simplified v1.58, The code in membership-simplified-for-oap-members-only/updateDB.php is vulnerable to blind SQL injection because it doesn't sanitize user input via recordId in the delete_media function.	7.5	HIGH	AV:N/AC:L/Au:N/C:P/I:P/A:P		
CVE-2017-1002011	2017-09-14T13:29:00.607	2025-04-20T01:37:25.860	Vulnerability in wordpress plugin image-gallery-with-slideshow v1.5.2, There is a stored XSS vulnerability via the $value->gallery_name and $value->gallery_description where anyone with privileges to modify or add galleries/images and inject javascript into the database.	3.5	LOW	AV:N/AC:M/Au:S/C:N/I:P/A:N		
CVE-2017-1002012	2017-09-14T13:29:00.640	2025-04-20T01:37:25.860	Vulnerability in wordpress plugin image-gallery-with-slideshow v1.5.2, In image-gallery-with-slideshow/admin_setting.php the following snippet of code does not sanitize input via the gid variable before passing it into an SQL statement.	7.5	HIGH	AV:N/AC:L/Au:N/C:P/I:P/A:P		
CVE-2017-1002013	2017-09-14T13:29:00.670	2025-04-20T01:37:25.860	Vulnerability in wordpress plugin image-gallery-with-slideshow v1.5.2, Blind SQL Injection via imgid parameter in image-gallery-with-slideshow/admin_setting.php.	7.5	HIGH	AV:N/AC:L/Au:N/C:P/I:P/A:P		
CVE-2017-1002014	2017-09-14T13:29:00.717	2025-04-20T01:37:25.860	Vulnerability in wordpress plugin image-gallery-with-slideshow v1.5.2, Blind SQL Injection in image-gallery-with-slideshow/admin_setting.php via gallery_name parameter.	7.5	HIGH	AV:N/AC:L/Au:N/C:P/I:P/A:P		
CVE-2017-1002015	2017-09-14T13:29:00.747	2025-04-20T01:37:25.860	Vulnerability in wordpress plugin image-gallery-with-slideshow v1.5.2, Blind SQL Injection in image-gallery-with-slideshow/admin_setting.php via selectMulGallery parameter.	7.5	HIGH	AV:N/AC:L/Au:N/C:P/I:P/A:P		
CVE-2017-1002016	2017-09-14T13:29:00.780	2025-04-20T01:37:25.860	Vulnerability in wordpress plugin flickr-picture-backup v0.7, The code in flickr-picture-download.php doesn't check to see if the user is authenticated or that they have permission to upload files.	9.8	CRITICAL	CVSS:3.1/AV:N/AC:L/PR:N/UI:N/S:U/C:H/I:H/A:H		
CVE-2017-1002017	2017-09-14T13:29:00.810	2025-04-20T01:37:25.860	Vulnerability in wordpress plugin gift-certificate-creator v1.0, The code in gc-list.php doesn't sanitize user input to prevent a stored XSS vulnerability.	4.3	MEDIUM	AV:N/AC:M/Au:N/C:N/I:P/A:N		
CVE-2017-1002018	2017-09-14T13:29:00.857	2025-04-20T01:37:25.860	Vulnerability in wordpress plugin eventr v1.02.2, The edit.php form and attendees.php code do not sanitize input, this allows for blind SQL injection via the event parameter.	7.5	HIGH	AV:N/AC:L/Au:N/C:P/I:P/A:P		
CVE-2017-1002019	2017-09-14T13:29:00.890	2025-04-20T01:37:25.860	Vulnerability in wordpress plugin eventr v1.02.2, The edit.php form and event_form.php code do not sanitize input, this allows for blind SQL injection via the event parameter.	7.5	HIGH	AV:N/AC:L/Au:N/C:P/I:P/A:P		
CVE-2017-1002020	2017-09-14T13:29:00.920	2025-04-20T01:37:25.860	Vulnerability in wordpress plugin surveys v1.01.8, The code in survey_form.php does not sanitize the action variable before placing it inside of an SQL query.	7.5	HIGH	AV:N/AC:L/Au:N/C:P/I:P/A:P		
CVE-2017-1002021	2017-09-14T13:29:00.950	2025-04-20T01:37:25.860	Vulnerability in wordpress plugin surveys v1.01.8, The code in individual_responses.php does not sanitize the survey_id variable before placing it inside of an SQL query.	7.5	HIGH	AV:N/AC:L/Au:N/C:P/I:P/A:P		
CVE-2017-1002022	2017-09-14T13:29:01.030	2025-04-20T01:37:25.860	Vulnerability in wordpress plugin surveys v1.01.8, The code in questions.php does not sanitize the survey variable before placing it inside of an SQL query.	7.5	HIGH	AV:N/AC:L/Au:N/C:P/I:P/A:P		
CVE-2017-1002023	2017-09-14T13:29:01.123	2025-04-20T01:37:25.860	Vulnerability in wordpress plugin Easy Team Manager v1.3.2, The code does not sanitize id before making it part of an SQL statement in file ./easy-team-manager/inc/easy_team_manager_desc_edit.php	7.5	HIGH	AV:N/AC:L/Au:N/C:P/I:P/A:P		
CVE-2017-1002024	2017-09-14T13:29:01.153	2025-04-20T01:37:25.860	Vulnerability in web application Kind Editor v4.1.12, kindeditor/php/upload_json.php does not check authentication before allow users to upload files.	4.0	MEDIUM	AV:N/AC:L/Au:S/C:N/I:P/A:N		
CVE-2017-1002025	2017-09-14T13:29:01.187	2025-04-20T01:37:25.860	Vulnerability in wordpress plugin add-edit-delete-listing-for-member-module v1.0, The plugin author does not sanitize user supplied input via $act before passing it into an SQL statement.	6.5	MEDIUM	AV:N/AC:L/Au:S/C:P/I:P/A:P		
CVE-2017-1002026	2017-09-14T13:29:01.233	2025-04-20T01:37:25.860	Vulnerability in wordpress plugin Event Expresso Free v3.1.37.11.L, The function edit_event_category does not sanitize user-supplied input via the $id parameter before passing it into an SQL statement.	6.5	MEDIUM	AV:N/AC:L/Au:S/C:P/I:P/A:P		
CVE-2017-1002027	2017-09-14T13:29:01.247	2025-04-20T01:37:25.860	Vulnerability in wordpress plugin rk-responsive-contact-form v1.0, The variable $delid isn't sanitized before being passed into an SQL query in file ./rk-responsive-contact-form/include/rk_user_list.php.	7.5	HIGH	AV:N/AC:L/Au:N/C:P/I:P/A:P		
CVE-2017-1002028	2017-09-14T13:29:01.327	2025-04-20T01:37:25.860	Vulnerability in wordpress plugin wordpress-gallery-transformation v1.0, SQL injection is in ./wordpress-gallery-transformation/gallery.php via $jpic parameter being unsanitized before being passed into an SQL query.	7.5	HIGH	AV:N/AC:L/Au:N/C:P/I:P/A:P		
