CVE ID	Published Date	Last Modified Date	Description	Base Score	Base Severity	Vector String	Vendor	Product
CVE-2017-14964	2017-12-20T18:29:00.683	2025-04-20T01:37:25.860	In IKARUS anti.virus before 2.16.18, the ntguard.sys driver contains an Arbitrary Write vulnerability because of not validating input values from IOCtl 0x8300005c.	7.2	HIGH	AV:L/AC:L/Au:N/C:C/I:C/A:C		
CVE-2017-14965	2017-12-20T18:29:00.730	2025-04-20T01:37:25.860	In IKARUS anti.virus before 2.16.18, the ntguard.sys driver contains an Arbitrary Write vulnerability because of not validating input values from IOCtl 0x830000cc.	7.2	HIGH	AV:L/AC:L/Au:N/C:C/I:C/A:C		
CVE-2017-14966	2017-12-20T18:29:00.777	2025-04-20T01:37:25.860	In IKARUS anti.virus before 2.16.18, the ntguard.sys driver contains an Arbitrary Write vulnerability because of not validating input values from IOCtl 0x830000c0.	7.2	HIGH	AV:L/AC:L/Au:N/C:C/I:C/A:C		
CVE-2017-14967	2017-12-20T18:29:00.840	2025-04-20T01:37:25.860	In IKARUS anti.virus before 2.16.18, the ntguard.sys driver contains an Arbitrary Write vulnerability because of not validating input values from IOCtl 0x83000080.	7.2	HIGH	AV:L/AC:L/Au:N/C:C/I:C/A:C		
CVE-2017-14968	2017-12-20T18:29:00.873	2025-04-20T01:37:25.860	In IKARUS anti.virus before 2.16.18, the ntguard.sys driver contains an Arbitrary Write vulnerability because of not validating input values from IOCtl 0x830000c4, a related issue to CVE-2017-17113.	7.2	HIGH	AV:L/AC:L/Au:N/C:C/I:C/A:C		
CVE-2017-14969	2017-12-20T18:29:00.917	2025-04-20T01:37:25.860	In IKARUS anti.virus before 2.16.18, the ntguard.sys driver contains an Arbitrary Write vulnerability because of not validating input values from IOCtl 0x83000084, a related issue to CVE-2017-17114.	7.2	HIGH	AV:L/AC:L/Au:N/C:C/I:C/A:C		
CVE-2017-15532	2017-12-20T18:29:00.950	2025-04-20T01:37:25.860	Prior to 10.6.4, Symantec Messaging Gateway may be susceptible to a path traversal attack (also known as directory traversal). These types of attacks aim to access files and directories that are stored outside the web root folder. By manipulating variables, it may be possible to access arbitrary files and directories stored on the file system including application source code or configuration and critical system files.	5.5	MEDIUM	AV:A/AC:L/Au:S/C:C/I:N/A:N		
CVE-2017-1595	2017-12-20T18:29:00.980	2025-04-20T01:37:25.860	IBM Security Guardium 10.0 Database Activity Monitor could allow a local attacker to obtain highly sensitive information via unspecified vectors. IBM X-Force ID: 132549.	2.1	LOW	AV:L/AC:L/Au:N/C:P/I:N/A:N		
CVE-2017-1596	2017-12-20T18:29:01.027	2025-04-20T01:37:25.860	IBM Security Guardium 10.0 Database Activity Monitor could allow a local attacker to obtain highly sensitive information via unspecified vectors. IBM X-Force ID: 132550.	2.1	LOW	AV:L/AC:L/Au:N/C:P/I:N/A:N		
CVE-2017-1598	2017-12-20T18:29:01.077	2025-04-20T01:37:25.860	IBM Security Guardium 10.0 Database Activity Monitor uses weaker than expected cryptographic algorithms that could allow an attacker to decrypt highly sensitive information. IBM X-Force ID: 132611.	5.0	MEDIUM	AV:N/AC:L/Au:N/C:P/I:N/A:N		
CVE-2017-1600	2017-12-20T18:29:01.123	2025-04-20T01:37:25.860	IBM Security Guardium 10.0 Database Activity Monitor is vulnerable to cross-site scripting. This vulnerability allows users to embed arbitrary JavaScript code in the Web UI thus altering the intended functionality potentially leading to credentials disclosure within a trusted session. IBM X-Force ID: 132613.	3.5	LOW	AV:N/AC:M/Au:S/C:N/I:P/A:N		
CVE-2017-1631	2017-12-20T18:29:01.167	2025-04-20T01:37:25.860	IBM Jazz for Service Management (IBM Tivoli Components 1.1.3) is vulnerable to cross-site request forgery which could allow an attacker to execute malicious and unauthorized actions transmitted from a user that the website trusts. IBM X-Force ID: 133140.	6.8	MEDIUM	AV:N/AC:M/Au:N/C:P/I:P/A:P		
CVE-2017-1694	2017-12-20T18:29:01.200	2025-04-20T01:37:25.860	IBM Integration Bus 9.0 and 10.0 transmits user credentials in plain in clear text which can be read by an attacker using man in the middle techniques. IBM X-Force ID: 134165.	4.3	MEDIUM	AV:N/AC:M/Au:N/C:P/I:N/A:N		
CVE-2017-1696	2017-12-20T18:29:01.247	2025-04-20T01:37:25.860	IBM QRadar 7.2 and 7.3 could allow a remote authenticated attacker to execute arbitrary commands on the system. By sending a specially-crafted request, an attacker could exploit this vulnerability to execute arbitrary commands on the system. IBM X-Force ID: 134178.	9.0	HIGH	AV:N/AC:L/Au:S/C:C/I:C/A:C		
CVE-2017-1746	2017-12-20T18:29:01.293	2025-04-20T01:37:25.860	IBM Jazz for Service Management (IBM Tivoli Components 1.1.3) is vulnerable to cross-site request forgery which could allow an attacker to execute malicious and unauthorized actions transmitted from a user that the website trusts. IBM X-Force ID: 135519.	6.8	MEDIUM	AV:N/AC:M/Au:N/C:P/I:P/A:P		
CVE-2017-1751	2017-12-20T18:29:01.387	2025-04-20T01:37:25.860	IBM Robotic Process Automation with Automation Anywhere 10.0.0 is vulnerable to cross-site scripting. This vulnerability allows users to embed arbitrary JavaScript code in the Web UI thus altering the intended functionality potentially leading to credentials disclosure within a trusted session. IBM X-Force ID: 135546.	3.5	LOW	AV:N/AC:M/Au:S/C:N/I:P/A:N		
CVE-2017-1757	2017-12-20T18:29:01.433	2025-04-20T01:37:25.860	IBM Security Guardium 10.0 is vulnerable to SQL injection. A remote attacker could send specially-crafted SQL statements, which could allow the attacker to view, add, modify or delete information in the back-end database. IBM X-Force ID: 135858.	6.5	MEDIUM	AV:N/AC:L/Au:S/C:P/I:P/A:P		
CVE-2017-16717	2017-12-20T19:29:00.207	2025-04-20T01:37:25.860	A Heap-based Buffer Overflow issue was discovered in WECON LeviStudio HMI. The heap-based buffer overflow vulnerability has been identified, which may allow remote code execution.	9.0	HIGH	AV:N/AC:L/Au:N/C:P/I:P/A:C		
CVE-2017-16725	2017-12-20T19:29:00.257	2025-04-20T01:37:25.860	A Stack-based Buffer Overflow issue was discovered in Xiongmai Technology IP Cameras and DVRs using the NetSurveillance Web interface. The stack-based buffer overflow vulnerability has been identified, which may allow an attacker to execute code remotely or crash the device. After rebooting, the device restores itself to a more vulnerable state in which Telnet is accessible.	10.0	HIGH	AV:N/AC:L/Au:N/C:C/I:C/A:C		
CVE-2017-16731	2017-12-20T19:29:00.287	2025-04-20T01:37:25.860	An Unprotected Transport of Credentials issue was discovered in ABB Ellipse 8.3 through Ellipse 8.9 released prior to December 2017 (including Ellipse Select). A vulnerability exists in the authentication of Ellipse to LDAP/AD using the LDAP protocol. An attacker could exploit the vulnerability by sniffing local network traffic, allowing the discovery of authentication credentials.	2.9	LOW	AV:A/AC:M/Au:N/C:P/I:N/A:N		
CVE-2017-16733	2017-12-20T19:29:00.317	2025-04-20T01:37:25.860	A SQL Injection issue was discovered in Ecava IntegraXor v 6.1.1030.1 and prior. The SQL Injection vulnerability has been identified, which an attacker can leverage to disclose sensitive information from the database.	5.0	MEDIUM	AV:N/AC:L/Au:N/C:P/I:N/A:N		
CVE-2017-16735	2017-12-20T19:29:00.350	2025-04-20T01:37:25.860	A SQL Injection issue was discovered in Ecava IntegraXor v 6.1.1030.1 and prior. The SQL Injection vulnerability has been identified, which generates an error in the database log.	5.0	MEDIUM	AV:N/AC:L/Au:N/C:N/I:N/A:P		
CVE-2017-17745	2017-12-20T20:29:00.217	2025-04-20T01:37:25.860	Cross-site scripting (XSS) vulnerability in system_name_set.cgi in TP-Link TL-SG108E 1.0.0 allows authenticated remote attackers to submit arbitrary java script via the 'sysName' parameter.	3.5	LOW	AV:N/AC:M/Au:S/C:N/I:P/A:N		
CVE-2017-17746	2017-12-20T20:29:00.340	2025-04-20T01:37:25.860	Weak access control methods on the TP-Link TL-SG108E 1.0.0 allow any user on a NAT network with an authenticated administrator to access the device without entering user credentials. The authentication record is stored on the device; thus if an administrator authenticates from a NAT network, the authentication applies to the IP address of the NAT gateway, and any user behind that NAT gateway is also treated as authenticated.	7.7	HIGH	AV:A/AC:L/Au:S/C:C/I:C/A:C		
CVE-2017-17747	2017-12-20T20:29:00.467	2025-04-20T01:37:25.860	Weak access controls in the Device Logout functionality on the TP-Link TL-SG108E v1.0.0 allow remote attackers to call the logout functionality, triggering a denial of service condition.	2.7	LOW	AV:A/AC:L/Au:S/C:N/I:N/A:P		
CVE-2017-6094	2017-12-20T20:29:00.573	2025-04-20T01:37:25.860	"CPEs used by subscribers on the access network receive their individual configuration settings from a central GAPS instance. A CPE identifies itself by the MAC address of its WAN interface and a certain ""chk"" value (48bit) derived from the MAC. The algorithm used to compute the ""chk"" was disclosed by reverse engineering the CPE's firmware. As a result, it is possible to forge valid ""chk"" values for any given MAC address and therefore receive the configuration settings of other subscribers' CPEs. The configuration settings often contain sensitive values, for example credentials (username/password) for VoIP services. This issue affects Genexis B.V. GAPS up to 7.2."	5.0	MEDIUM	AV:N/AC:L/Au:N/C:P/I:N/A:N		
CVE-2012-2576	2017-12-20T21:29:00.207	2025-04-20T01:37:25.860	SQL injection vulnerability in the LoginServlet page in SolarWinds Storage Manager before 5.1.2, SolarWinds Storage Profiler before 5.1.2, and SolarWinds Backup Profiler before 5.1.2 allows remote attackers to execute arbitrary SQL commands via the loginName field.	10.0	HIGH	AV:N/AC:L/Au:N/C:C/I:C/A:C		
CVE-2011-4955	2017-12-20T22:29:00.230	2025-04-20T01:37:25.860	Multiple cross-site scripting (XSS) vulnerabilities in ui_stats.php in the bSuite plugin before 5 alpha 3 for WordPress allow remote attackers to inject arbitrary web script or HTML via the (1) s or (2) p parameters to index.php.	4.3	MEDIUM	AV:N/AC:M/Au:N/C:N/I:P/A:N		
CVE-2017-5254	2017-12-20T22:29:00.307	2025-04-20T01:37:25.860	In version 3.5 and prior of Cambium Networks ePMP firmware, the non-administrative users 'installer' and 'home' have the capability of changing passwords for other accounts, including admin, after disabling a client-side protection mechanism.	9.0	HIGH	AV:N/AC:L/Au:S/C:C/I:C/A:C		
CVE-2017-5255	2017-12-20T22:29:00.353	2025-04-20T01:37:25.860	In version 3.5 and prior of Cambium Networks ePMP firmware, a lack of input sanitation for certain parameters on the web management console allows any authenticated user (including the otherwise low-privilege readonly user) to inject shell meta-characters as part of a specially-crafted POST request to the get_chart function and run OS-level commands, effectively as root.	9.0	HIGH	AV:N/AC:L/Au:S/C:C/I:C/A:C		
CVE-2017-5256	2017-12-20T22:29:00.400	2025-04-20T01:37:25.860	In version 3.5 and prior of Cambium Networks ePMP firmware, all authenticated users have the ability to update the Device Name and System Description fields in the web administration console, and those fields are vulnerable to persistent cross-site scripting (XSS) injection.	3.5	LOW	AV:N/AC:M/Au:S/C:N/I:P/A:N		
CVE-2017-5257	2017-12-20T22:29:00.433	2025-04-20T01:37:25.860	In version 3.5 and prior of Cambium Networks ePMP firmware, an attacker who knows (or guesses) the SNMP read/write (RW) community string can insert XSS strings in certain SNMP OIDs which will execute in the context of the currently-logged on user.	3.5	LOW	AV:N/AC:M/Au:S/C:N/I:P/A:N		
CVE-2017-5258	2017-12-20T22:29:00.480	2025-04-20T01:37:25.860	In version 3.5 and prior of Cambium Networks ePMP firmware, an attacker who knows or can guess the RW community string can provide a URL for a configuration file over SNMP with XSS strings in certain SNMP OIDs, serve it via HTTP, and the affected device will perform a configuration restore using the attacker's supplied config file, including the inserted XSS strings.	3.5	LOW	AV:N/AC:M/Au:S/C:N/I:P/A:N		
CVE-2017-5259	2017-12-20T22:29:00.510	2025-04-20T01:37:25.860	In versions 4.3.2-R4 and prior of Cambium Networks cnPilot firmware, an undocumented, root-privilege administration web shell is available using the HTTP path https://<device-ip-or-hostname>/adm/syscmd.asp.	9.0	HIGH	AV:N/AC:L/Au:S/C:C/I:C/A:C		
CVE-2017-5260	2017-12-20T22:29:00.557	2025-04-20T01:37:25.860	In versions 4.3.2-R4 and prior of Cambium Networks cnPilot firmware, although the option to access the configuration file is not available in the normal web administrative console for the 'user' account, the configuration file is accessible via direct object reference (DRO) at http://<device-ip-or-hostname>/goform/down_cfg_file by this otherwise low privilege 'user' account.	9.0	HIGH	AV:N/AC:L/Au:S/C:C/I:C/A:C		
CVE-2017-5261	2017-12-20T22:29:00.603	2025-04-20T01:37:25.860	In versions 4.3.2-R4 and prior of Cambium Networks cnPilot firmware, the 'ping' and 'traceroute' functions of the web administrative console expose a file path traversal vulnerability, accessible to all authenticated users.	4.0	MEDIUM	AV:N/AC:L/Au:S/C:P/I:N/A:N		
CVE-2017-5262	2017-12-20T22:29:00.637	2025-04-20T01:37:25.860	In versions 4.3.2-R4 and prior of Cambium Networks cnPilot firmware, the SNMP read-only (RO) community string has access to sensitive information by OID reference.	7.7	HIGH	AV:A/AC:L/Au:S/C:C/I:C/A:C		
CVE-2017-5263	2017-12-20T22:29:00.683	2025-04-20T01:37:25.860	Versions 4.3.2-R4 and prior of Cambium Networks cnPilot firmware lack CSRF controls that can mitigate the effects of CSRF attacks, which are most typically implemented as randomized per-session tokens associated with any web application function, especially destructive ones.	5.4	MEDIUM	AV:A/AC:M/Au:N/C:P/I:P/A:P		
CVE-2017-14385	2017-12-20T23:29:00.250	2025-04-20T01:37:25.860	An issue was discovered in EMC Data Domain DD OS 5.7 family, versions prior to 5.7.5.6; EMC Data Domain DD OS 6.0 family, versions prior to 6.0.2.9; EMC Data Domain DD OS 6.1 family, versions prior to 6.1.0.21; EMC Data Domain Virtual Edition 2.0 family, all versions; EMC Data Domain Virtual Edition 3.0 family, versions prior to 3.0 SP2 Update 1; and EMC Data Domain Virtual Edition 3.1 family, versions prior to 3.1 Update 2. EMC Data Domain DD OS contains a memory overflow vulnerability in SMBv1 which may potentially be exploited by an unauthenticated remote attacker. An attacker may completely shut down both the SMB service and active directory authentication. This may also allow remote code injection and execution.	5.0	MEDIUM	AV:N/AC:L/Au:N/C:N/I:N/A:P		
CVE-2017-14387	2017-12-20T23:29:00.297	2025-04-20T01:37:25.860	"The NFS service in EMC Isilon OneFS 8.1.0.0, 8.0.1.0 - 8.0.1.1, and 8.0.0.0 - 8.0.0.4 maintains default NFS export settings (including the NFS export security flavor for authentication) that can be leveraged by current and future NFS exports. This NFS service contained a flaw that did not properly propagate changes made to the default security flavor to all new and existing NFS exports that are configured to use default NFS export settings and that are mounted after those changes are made. This flaw may potentially allow NFS clients to access affected NFS exports using the default and potentially weaker security flavor even if a more secure one was selected to be used by the OneFS administrator, aka an ""NFS Export Security Setting Fallback Vulnerability."""	6.4	MEDIUM	AV:N/AC:L/Au:N/C:P/I:P/A:N		
CVE-2017-17805	2017-12-20T23:29:00.327	2025-04-20T01:37:25.860	The Salsa20 encryption algorithm in the Linux kernel before 4.14.8 does not correctly handle zero-length inputs, allowing a local attacker able to use the AF_ALG-based skcipher interface (CONFIG_CRYPTO_USER_API_SKCIPHER) to cause a denial of service (uninitialized-memory free and kernel crash) or have unspecified other impact by executing a crafted sequence of system calls that use the blkcipher_walk API. Both the generic implementation (crypto/salsa20_generic.c) and x86 implementation (arch/x86/crypto/salsa20_glue.c) of Salsa20 were vulnerable.	7.8	HIGH	CVSS:3.1/AV:L/AC:L/PR:L/UI:N/S:U/C:H/I:H/A:H		
CVE-2017-17806	2017-12-20T23:29:00.377	2025-04-20T01:37:25.860	The HMAC implementation (crypto/hmac.c) in the Linux kernel before 4.14.8 does not validate that the underlying cryptographic hash algorithm is unkeyed, allowing a local attacker able to use the AF_ALG-based hash interface (CONFIG_CRYPTO_USER_API_HASH) and the SHA-3 hash algorithm (CONFIG_CRYPTO_SHA3) to cause a kernel stack buffer overflow by executing a crafted sequence of system calls that encounter a missing SHA-3 initialization.	7.8	HIGH	CVSS:3.1/AV:L/AC:L/PR:L/UI:N/S:U/C:H/I:H/A:H		
CVE-2017-17807	2017-12-20T23:29:00.423	2025-04-20T01:37:25.860	"The KEYS subsystem in the Linux kernel before 4.14.6 omitted an access-control check when adding a key to the current task's ""default request-key keyring"" via the request_key() system call, allowing a local user to use a sequence of crafted system calls to add keys to a keyring with only Search permission (not Write permission) to that keyring, related to construct_get_dest_keyring() in security/keys/request_key.c."	2.1	LOW	AV:L/AC:L/Au:N/C:N/I:P/A:N		
CVE-2017-17809	2017-12-20T23:29:00.453	2025-04-20T01:37:25.860	In Golden Frog VyprVPN before 2.15.0.5828 for macOS, the vyprvpnservice launch daemon has an unprotected XPC service that allows attackers to update the underlying OpenVPN configuration and the arguments passed to the OpenVPN binary when executed. An attacker can abuse this vulnerability by forcing the VyprVPN application to load a malicious dynamic library every time a new connection is made.	6.8	MEDIUM	AV:N/AC:M/Au:N/C:P/I:P/A:P		
CVE-2017-17810	2017-12-21T03:29:00.193	2025-04-20T01:37:25.860	"In Netwide Assembler (NASM) 2.14rc0, there is a ""SEGV on unknown address"" that will cause a remote denial of service attack, because asm/preproc.c mishandles macro calls that have the wrong number of arguments."	4.3	MEDIUM	AV:N/AC:M/Au:N/C:N/I:N/A:P		
CVE-2017-17811	2017-12-21T03:29:00.240	2025-04-20T01:37:25.860	In Netwide Assembler (NASM) 2.14rc0, there is a heap-based buffer overflow that will cause a remote denial of service attack, related to a strcpy in paste_tokens in asm/preproc.c, a similar issue to CVE-2017-11111.	4.3	MEDIUM	AV:N/AC:M/Au:N/C:N/I:N/A:P		
CVE-2017-17812	2017-12-21T03:29:00.287	2025-04-20T01:37:25.860	In Netwide Assembler (NASM) 2.14rc0, there is a heap-based buffer over-read in the function detoken() in asm/preproc.c that will cause a remote denial of service attack.	4.3	MEDIUM	AV:N/AC:M/Au:N/C:N/I:N/A:P		
CVE-2017-17813	2017-12-21T03:29:00.317	2025-04-20T01:37:25.860	In Netwide Assembler (NASM) 2.14rc0, there is a use-after-free in the pp_list_one_macro function in asm/preproc.c that will cause a remote denial of service attack, related to mishandling of line-syntax errors.	4.3	MEDIUM	AV:N/AC:M/Au:N/C:N/I:N/A:P		
CVE-2017-17814	2017-12-21T03:29:00.367	2025-04-20T01:37:25.860	In Netwide Assembler (NASM) 2.14rc0, there is a use-after-free in do_directive in asm/preproc.c that will cause a remote denial of service attack.	4.3	MEDIUM	AV:N/AC:M/Au:N/C:N/I:N/A:P		
CVE-2017-17815	2017-12-21T03:29:00.397	2025-04-20T01:37:25.860	In Netwide Assembler (NASM) 2.14rc0, there is an illegal address access in is_mmacro() in asm/preproc.c that will cause a remote denial of service attack, because of a missing check for the relationship between minimum and maximum parameter counts.	4.3	MEDIUM	AV:N/AC:M/Au:N/C:N/I:N/A:P		
CVE-2017-17816	2017-12-21T03:29:00.443	2025-04-20T01:37:25.860	In Netwide Assembler (NASM) 2.14rc0, there is a use-after-free in pp_getline in asm/preproc.c that will cause a remote denial of service attack.	4.3	MEDIUM	AV:N/AC:M/Au:N/C:N/I:N/A:P		
CVE-2017-17817	2017-12-21T03:29:00.477	2025-04-20T01:37:25.860	In Netwide Assembler (NASM) 2.14rc0, there is a use-after-free in pp_verror in asm/preproc.c that will cause a remote denial of service attack.	4.3	MEDIUM	AV:N/AC:M/Au:N/C:N/I:N/A:P		
CVE-2017-17818	2017-12-21T03:29:00.520	2025-04-20T01:37:25.860	In Netwide Assembler (NASM) 2.14rc0, there is a heap-based buffer over-read that will cause a remote denial of service attack, related to a while loop in paste_tokens in asm/preproc.c.	5.0	MEDIUM	AV:N/AC:L/Au:N/C:N/I:N/A:P		
CVE-2017-17819	2017-12-21T03:29:00.553	2025-04-20T01:37:25.860	In Netwide Assembler (NASM) 2.14rc0, there is an illegal address access in the function find_cc() in asm/preproc.c that will cause a remote denial of service attack, because pointers associated with skip_white_ calls are not validated.	4.3	MEDIUM	AV:N/AC:M/Au:N/C:N/I:N/A:P		
CVE-2017-17820	2017-12-21T03:29:00.600	2025-04-20T01:37:25.860	In Netwide Assembler (NASM) 2.14rc0, there is a use-after-free in pp_list_one_macro in asm/preproc.c that will lead to a remote denial of service attack, related to mishandling of operand-type errors.	4.3	MEDIUM	AV:N/AC:M/Au:N/C:N/I:N/A:P		
CVE-2017-17821	2017-12-21T03:29:00.630	2025-04-20T01:37:25.860	WTF/wtf/FastBitVector.h in WebKit, as distributed in Safari Technology Preview Release 46, allows remote attackers to cause a denial of service (buffer overflow) or possibly have unspecified other impact because it calls the FastBitVectorWordOwner::resizeSlow function (in WTF/wtf/FastBitVector.cpp) for a purpose other than initializing a bitvector size, and resizeSlow mishandles cases where the old array length is greater than the new array length.	7.5	HIGH	AV:N/AC:L/Au:N/C:P/I:P/A:P		
CVE-2017-17822	2017-12-21T04:29:00.260	2025-04-20T01:37:25.860	The List Users API of Piwigo 2.9.2 is vulnerable to SQL Injection via the /admin/user_list_backend.php sSortDir_0 parameter. An attacker can exploit this to gain access to the data in a connected MySQL database.	4.0	MEDIUM	AV:N/AC:L/Au:S/C:P/I:N/A:N		
CVE-2017-17823	2017-12-21T04:29:00.307	2025-04-20T01:37:25.860	The Configuration component of Piwigo 2.9.2 is vulnerable to SQL Injection via the admin/configuration.php order_by array parameter. An attacker can exploit this to gain access to the data in a connected MySQL database.	4.0	MEDIUM	AV:N/AC:L/Au:S/C:P/I:N/A:N		
CVE-2017-17824	2017-12-21T04:29:00.353	2025-04-20T01:37:25.860	The Batch Manager component of Piwigo 2.9.2 is vulnerable to SQL Injection via the admin/batch_manager_unit.php element_ids parameter in unit mode. An attacker can exploit this to gain access to the data in a connected MySQL database.	4.0	MEDIUM	AV:N/AC:L/Au:S/C:P/I:N/A:N		
CVE-2017-17825	2017-12-21T04:29:00.400	2025-04-20T01:37:25.860	The Batch Manager component of Piwigo 2.9.2 is vulnerable to Persistent Cross Site Scripting via tags-* array parameters in an admin.php?page=batch_manager&mode=unit request. An attacker can exploit this to hijack a client's browser along with the data stored in it.	3.5	LOW	AV:N/AC:M/Au:S/C:N/I:P/A:N		
CVE-2017-17826	2017-12-21T04:29:00.430	2025-04-20T01:37:25.860	The Configuration component of Piwigo 2.9.2 is vulnerable to Persistent Cross Site Scripting via the gallery_title parameter in an admin.php?page=configuration&section=main request. An attacker can exploit this to hijack a client's browser along with the data stored in it.	4.3	MEDIUM	AV:N/AC:M/Au:N/C:N/I:P/A:N		
CVE-2017-17827	2017-12-21T04:29:00.463	2025-04-20T01:37:25.860	Piwigo 2.9.2 is vulnerable to Cross-Site Request Forgery via /admin.php?page=configuration&section=main or /admin.php?page=batch_manager&mode=unit. An attacker can exploit this to coerce an admin user into performing unintended actions.	6.8	MEDIUM	AV:N/AC:M/Au:N/C:P/I:P/A:P		
CVE-2017-17828	2017-12-21T05:29:00.207	2025-04-20T01:37:25.860	Bus Booking Script has XSS via the results.php datepicker parameter or the admin/new_master.php spemail parameter.	4.8	MEDIUM	CVSS:3.1/AV:N/AC:L/PR:H/UI:R/S:C/C:L/I:L/A:N		
CVE-2017-17829	2017-12-21T05:29:00.253	2025-04-20T01:37:25.860	Bus Booking Script has SQL Injection via the admin/view_seatseller.php sp_id parameter or the admin/view_member.php memid parameter.	6.5	MEDIUM	AV:N/AC:L/Au:S/C:P/I:P/A:P		
CVE-2017-17830	2017-12-21T05:29:00.287	2025-04-20T01:37:25.860	Bus Booking Script has CSRF via admin/new_master.php.	6.0	MEDIUM	AV:N/AC:M/Au:S/C:P/I:P/A:P		
CVE-2017-17831	2017-12-21T06:29:00.243	2025-04-20T01:37:25.860	"GitHub Git LFS before 2.1.1 allows remote attackers to execute arbitrary commands via an ssh URL with an initial dash character in the hostname, located on a ""url ="" line in a .lfsconfig file within a repository."	6.8	MEDIUM	AV:N/AC:M/Au:N/C:P/I:P/A:P		
CVE-2017-17408	2017-12-21T14:29:00.397	2025-04-20T01:37:25.860	This vulnerability allows remote attackers to execute arbitrary code on vulnerable installations of Bitdefender Internet Security 2018. User interaction is required to exploit this vulnerability in that the target must visit a malicious page or open a malicious file. The specific flaw exists within cevakrnl.xmd. The issue results from the lack of proper validation of user-supplied data, which can result in an integer overflow before allocating a buffer. An attacker can leverage this vulnerability to execute code under the context of SYSTEM. Was ZDI-CAN-5101.	9.3	HIGH	AV:N/AC:M/Au:N/C:C/I:C/A:C		
