CVE ID	Published Date	Last Modified Date	Description	Base Score	Base Severity	Vector String	Vendor	Product
CVE-2017-10099	2017-10-19T17:29:00.687	2025-04-20T01:37:25.860	Vulnerability in the SPARC M7, T7, S7 based Servers component of Oracle Sun Systems Products Suite (subcomponent: Firmware). The supported version that is affected is Prior to 9.7.6.b. Easily exploitable vulnerability allows high privileged attacker with logon to the infrastructure where SPARC M7, T7, S7 based Servers executes to compromise SPARC M7, T7, S7 based Servers. Successful attacks of this vulnerability can result in unauthorized ability to cause a hang or frequently repeatable crash (complete DOS) of SPARC M7, T7, S7 based Servers. CVSS 3.0 Base Score 4.4 (Availability impacts). CVSS Vector: (CVSS:3.0/AV:L/AC:L/PR:H/UI:N/S:U/C:N/I:N/A:H).	4.9	MEDIUM	AV:L/AC:L/Au:N/C:N/I:N/A:C		
CVE-2017-10152	2017-10-19T17:29:00.717	2025-04-20T01:37:25.860	Vulnerability in the Oracle WebLogic Server component of Oracle Fusion Middleware (subcomponent: Web Container). Supported versions that are affected are 10.3.6.0.0 and 12.1.3.0.0. Easily exploitable vulnerability allows low privileged attacker with network access via HTTP to compromise Oracle WebLogic Server. Successful attacks of this vulnerability can result in unauthorized access to critical data or complete access to all Oracle WebLogic Server accessible data. CVSS 3.0 Base Score 6.5 (Confidentiality impacts). CVSS Vector: (CVSS:3.0/AV:N/AC:L/PR:L/UI:N/S:U/C:H/I:N/A:N).	4.0	MEDIUM	AV:N/AC:L/Au:S/C:P/I:N/A:N		
CVE-2017-10153	2017-10-19T17:29:00.763	2025-04-20T01:37:25.860	Vulnerability in the Oracle Communications WebRTC Session Controller component of Oracle Communications Applications (subcomponent: Security (Gson)). Supported versions that are affected are 7.0, 7.1 and 7.2. Difficult to exploit vulnerability allows low privileged attacker with network access via multiple protocols to compromise Oracle Communications WebRTC Session Controller. While the vulnerability is in Oracle Communications WebRTC Session Controller, attacks may significantly impact additional products. Successful attacks of this vulnerability can result in unauthorized ability to cause a hang or frequently repeatable crash (complete DOS) of Oracle Communications WebRTC Session Controller. CVSS 3.0 Base Score 6.3 (Availability impacts). CVSS Vector: (CVSS:3.0/AV:N/AC:H/PR:L/UI:N/S:C/C:N/I:N/A:H).	3.5	LOW	AV:N/AC:M/Au:S/C:N/I:N/A:P		
CVE-2017-10154	2017-10-19T17:29:00.797	2025-04-20T01:37:25.860	Vulnerability in the Oracle Access Manager component of Oracle Fusion Middleware (subcomponent: Web Server Plugin). The supported version that is affected is 11.1.2.3.0. Easily exploitable vulnerability allows unauthenticated attacker with network access via HTTP to compromise Oracle Access Manager. Successful attacks of this vulnerability can result in unauthorized read access to a subset of Oracle Access Manager accessible data. CVSS 3.0 Base Score 5.3 (Confidentiality impacts). CVSS Vector: (CVSS:3.0/AV:N/AC:L/PR:N/UI:N/S:U/C:L/I:N/A:N).	5.0	MEDIUM	AV:N/AC:L/Au:N/C:P/I:N/A:N		
CVE-2017-10155	2017-10-19T17:29:00.827	2025-04-20T01:37:25.860	Vulnerability in the MySQL Server component of Oracle MySQL (subcomponent: Server: Pluggable Auth). Supported versions that are affected are 5.6.37 and earlier and 5.7.19 and earlier. Easily exploitable vulnerability allows unauthenticated attacker with network access via multiple protocols to compromise MySQL Server. Successful attacks of this vulnerability can result in unauthorized ability to cause a hang or frequently repeatable crash (complete DOS) of MySQL Server. CVSS 3.0 Base Score 7.5 (Availability impacts). CVSS Vector: (CVSS:3.0/AV:N/AC:L/PR:N/UI:N/S:U/C:N/I:N/A:H).	5.0	MEDIUM	AV:N/AC:L/Au:N/C:N/I:N/A:P		
CVE-2017-10158	2017-10-19T17:29:00.857	2025-04-20T01:37:25.860	Vulnerability in the PeopleSoft Enterprise PeopleTools component of Oracle PeopleSoft Products (subcomponent: Core). Supported versions that are affected are 8.54, 8.55 and 8.56. Easily exploitable vulnerability allows unauthenticated attacker with network access via HTTP to compromise PeopleSoft Enterprise PeopleTools. Successful attacks require human interaction from a person other than the attacker and while the vulnerability is in PeopleSoft Enterprise PeopleTools, attacks may significantly impact additional products. Successful attacks of this vulnerability can result in unauthorized update, insert or delete access to some of PeopleSoft Enterprise PeopleTools accessible data as well as unauthorized read access to a subset of PeopleSoft Enterprise PeopleTools accessible data. CVSS 3.0 Base Score 6.1 (Confidentiality and Integrity impacts). CVSS Vector: (CVSS:3.0/AV:N/AC:L/PR:N/UI:R/S:C/C:L/I:L/A:N).	5.8	MEDIUM	AV:N/AC:M/Au:N/C:P/I:P/A:N		
CVE-2017-10159	2017-10-19T17:29:00.890	2025-04-20T01:37:25.860	Vulnerability in the Oracle Communications Policy Management component of Oracle Communications Applications (subcomponent: Portal, CMP). Supported versions that are affected are 11.5 and 12.x. Easily exploitable vulnerability allows unauthenticated attacker with network access via HTTP to compromise Oracle Communications Policy Management. Successful attacks require human interaction from a person other than the attacker and while the vulnerability is in Oracle Communications Policy Management, attacks may significantly impact additional products. Successful attacks of this vulnerability can result in unauthorized update, insert or delete access to some of Oracle Communications Policy Management accessible data as well as unauthorized read access to a subset of Oracle Communications Policy Management accessible data. CVSS 3.0 Base Score 6.1 (Confidentiality and Integrity impacts). CVSS Vector: (CVSS:3.0/AV:N/AC:L/PR:N/UI:R/S:C/C:L/I:L/A:N).	5.8	MEDIUM	AV:N/AC:M/Au:N/C:P/I:P/A:N		
CVE-2017-10161	2017-10-19T17:29:00.937	2025-04-20T01:37:25.860	Vulnerability in the Oracle Engineering Data Management component of Oracle Supply Chain Products Suite (subcomponent: Web Services Security). Supported versions that are affected are 6.1.3.0 and 6.2.2.0. Difficult to exploit vulnerability allows unauthenticated attacker with network access via HTTP to compromise Oracle Engineering Data Management. Successful attacks of this vulnerability can result in unauthorized update, insert or delete access to some of Oracle Engineering Data Management accessible data as well as unauthorized read access to a subset of Oracle Engineering Data Management accessible data. CVSS 3.0 Base Score 4.8 (Confidentiality and Integrity impacts). CVSS Vector: (CVSS:3.0/AV:N/AC:H/PR:N/UI:N/S:U/C:L/I:L/A:N).	5.8	MEDIUM	AV:N/AC:M/Au:N/C:P/I:P/A:N		
CVE-2017-10162	2017-10-19T17:29:00.967	2025-04-20T01:37:25.860	Vulnerability in the Siebel Core - Server Framework component of Oracle Siebel CRM (subcomponent: Services). Supported versions that are affected are 16.0 and 17.0. Easily exploitable vulnerability allows low privileged attacker with network access via HTTP to compromise Siebel Core - Server Framework. Successful attacks of this vulnerability can result in unauthorized update, insert or delete access to some of Siebel Core - Server Framework accessible data as well as unauthorized read access to a subset of Siebel Core - Server Framework accessible data. CVSS 3.0 Base Score 5.4 (Confidentiality and Integrity impacts). CVSS Vector: (CVSS:3.0/AV:N/AC:L/PR:L/UI:N/S:U/C:L/I:L/A:N).	5.5	MEDIUM	AV:N/AC:L/Au:S/C:P/I:P/A:N		
CVE-2017-10163	2017-10-19T17:29:00.997	2025-04-20T01:37:25.860	"Vulnerability in the Oracle Business Intelligence Enterprise Edition component of Oracle Fusion Middleware (subcomponent: Analytics Web General). Supported versions that are affected are 11.1.1.7.0, 11.1.1.9.0, 12.2.1.1.0 and 12.2.1.2.0. Easily exploitable vulnerability allows low privileged attacker with network access via HTTP to compromise Oracle Business Intelligence Enterprise Edition. Successful attacks require human interaction from a person other than the attacker. Successful attacks of this vulnerability can result in unauthorized creation, deletion or modification access to critical data or all Oracle Business Intelligence Enterprise Edition accessible data as well as unauthorized read access to a subset of Oracle Business Intelligence Enterprise Edition accessible data. Note: Please refer to Doc ID <a href=""http://support.oracle.com/CSP/main/article?cmd=show&type=NOT&id=2310021.1"">My Oracle Support Note 2310021.1 for instructions on how to address this issue. CVSS 3.0 Base Score 6.3 (Confidentiality and Integrity impacts). CVSS Vector: (CVSS:3.0/AV:N/AC:L/PR:L/UI:R/S:U/C:L/I:H/A:N)."	4.9	MEDIUM	AV:N/AC:M/Au:S/C:P/I:P/A:N		
CVE-2017-10164	2017-10-19T17:29:01.047	2025-04-20T01:37:25.860	Vulnerability in the PeopleSoft Enterprise FSCM component of Oracle PeopleSoft Products (subcomponent: Staffing Front Office). The supported version that is affected is 9.2. Easily exploitable vulnerability allows low privileged attacker with network access via HTTP to compromise PeopleSoft Enterprise FSCM. Successful attacks of this vulnerability can result in unauthorized read access to a subset of PeopleSoft Enterprise FSCM accessible data. CVSS 3.0 Base Score 4.3 (Confidentiality impacts). CVSS Vector: (CVSS:3.0/AV:N/AC:L/PR:L/UI:N/S:U/C:L/I:N/A:N).	4.0	MEDIUM	AV:N/AC:L/Au:S/C:P/I:N/A:N		
CVE-2017-10165	2017-10-19T17:29:01.077	2025-04-20T01:37:25.860	Vulnerability in the MySQL Server component of Oracle MySQL (subcomponent: Server: Replication). Supported versions that are affected are 5.7.19 and earlier. Easily exploitable vulnerability allows high privileged attacker with network access via multiple protocols to compromise MySQL Server. Successful attacks of this vulnerability can result in unauthorized ability to cause a hang or frequently repeatable crash (complete DOS) of MySQL Server. CVSS 3.0 Base Score 4.9 (Availability impacts). CVSS Vector: (CVSS:3.0/AV:N/AC:L/PR:H/UI:N/S:U/C:N/I:N/A:H).	4.0	MEDIUM	AV:N/AC:L/Au:S/C:N/I:N/A:P		
CVE-2017-10166	2017-10-19T17:29:01.107	2025-04-20T01:37:25.860	Vulnerability in the Oracle Security Service component of Oracle Fusion Middleware (subcomponent: C Oracle SSL API). Supported versions that are affected are FMW: 11.1.1.9.0 and 12.1.3.0.0. Difficult to exploit vulnerability allows unauthenticated attacker with network access via HTTPS to compromise Oracle Security Service. Successful attacks of this vulnerability can result in unauthorized update, insert or delete access to some of Oracle Security Service accessible data. CVSS 3.0 Base Score 3.7 (Integrity impacts). CVSS Vector: (CVSS:3.0/AV:N/AC:H/PR:N/UI:N/S:U/C:N/I:L/A:N).	4.3	MEDIUM	AV:N/AC:M/Au:N/C:N/I:P/A:N		
CVE-2017-10167	2017-10-19T17:29:01.140	2025-04-20T01:37:25.860	Vulnerability in the MySQL Server component of Oracle MySQL (subcomponent: Server: Optimizer). Supported versions that are affected are 5.7.19 and earlier. Easily exploitable vulnerability allows low privileged attacker with network access via multiple protocols to compromise MySQL Server. Successful attacks of this vulnerability can result in unauthorized ability to cause a hang or frequently repeatable crash (complete DOS) of MySQL Server. CVSS 3.0 Base Score 6.5 (Availability impacts). CVSS Vector: (CVSS:3.0/AV:N/AC:L/PR:L/UI:N/S:U/C:N/I:N/A:H).	4.0	MEDIUM	AV:N/AC:L/Au:S/C:N/I:N/A:P		
CVE-2017-10190	2017-10-19T17:29:01.170	2025-04-20T01:37:25.860	Vulnerability in the Java VM component of Oracle Database Server. Supported versions that are affected are 11.2.0.4, 12.1.0.2 and 12.2.0.1. Easily exploitable vulnerability allows high privileged attacker having Create Session, Create Procedure privilege with logon to the infrastructure where Java VM executes to compromise Java VM. While the vulnerability is in Java VM, attacks may significantly impact additional products. Successful attacks of this vulnerability can result in takeover of Java VM. CVSS 3.0 Base Score 8.2 (Confidentiality, Integrity and Availability impacts). CVSS Vector: (CVSS:3.0/AV:L/AC:L/PR:H/UI:N/S:C/C:H/I:H/A:H).	4.3	MEDIUM	AV:L/AC:L/Au:S/C:P/I:P/A:P		
CVE-2017-10194	2017-10-19T17:29:01.200	2025-04-20T01:37:25.860	Vulnerability in the Oracle Integrated Lights Out Manager (ILOM) component of Oracle Sun Systems Products Suite (subcomponent: System Management). The supported version that is affected is Prior to 3.2.6. Easily exploitable vulnerability allows high privileged attacker with network access via HTTP to compromise Oracle Integrated Lights Out Manager (ILOM). Successful attacks of this vulnerability can result in unauthorized read access to a subset of Oracle Integrated Lights Out Manager (ILOM) accessible data. CVSS 3.0 Base Score 2.7 (Confidentiality impacts). CVSS Vector: (CVSS:3.0/AV:N/AC:L/PR:H/UI:N/S:U/C:L/I:N/A:N).	4.0	MEDIUM	AV:N/AC:L/Au:S/C:P/I:N/A:N		
CVE-2017-10197	2017-10-19T17:29:01.233	2025-04-20T01:37:25.860	Vulnerability in the Oracle Hospitality OPERA 5 Property Services component of Oracle Hospitality Applications (subcomponent: Folios). The supported version that is affected is 5.4.2.x through 5.5.1.x. Easily exploitable vulnerability allows physical access to compromise Oracle Hospitality OPERA 5 Property Services. Successful attacks of this vulnerability can result in unauthorized access to critical data or complete access to all Oracle Hospitality OPERA 5 Property Services accessible data. CVSS 3.0 Base Score 4.6 (Confidentiality impacts). CVSS Vector: (CVSS:3.0/AV:P/AC:L/PR:N/UI:N/S:U/C:H/I:N/A:N).	2.1	LOW	AV:L/AC:L/Au:N/C:P/I:N/A:N		
CVE-2017-10203	2017-10-19T17:29:01.263	2025-04-20T01:37:25.860	Vulnerability in the MySQL Connectors component of Oracle MySQL (subcomponent: Connector/Net). Supported versions that are affected are 6.9.9 and earlier. Easily exploitable vulnerability allows unauthenticated attacker with network access via multiple protocols to compromise MySQL Connectors. Successful attacks of this vulnerability can result in unauthorized ability to cause a partial denial of service (partial DOS) of MySQL Connectors. CVSS 3.0 Base Score 5.3 (Availability impacts). CVSS Vector: (CVSS:3.0/AV:N/AC:L/PR:N/UI:N/S:U/C:N/I:N/A:L).	5.0	MEDIUM	AV:N/AC:L/Au:N/C:N/I:N/A:P		
CVE-2017-10227	2017-10-19T17:29:01.297	2025-04-20T01:37:25.860	Vulnerability in the MySQL Server component of Oracle MySQL (subcomponent: Server: Optimizer). Supported versions that are affected are 5.6.37 and earlier and 5.7.19 and earlier. Easily exploitable vulnerability allows high privileged attacker with network access via multiple protocols to compromise MySQL Server. Successful attacks of this vulnerability can result in unauthorized ability to cause a hang or frequently repeatable crash (complete DOS) of MySQL Server. CVSS 3.0 Base Score 4.9 (Availability impacts). CVSS Vector: (CVSS:3.0/AV:N/AC:L/PR:H/UI:N/S:U/C:N/I:N/A:H).	4.0	MEDIUM	AV:N/AC:L/Au:S/C:N/I:N/A:P		
CVE-2017-10259	2017-10-19T17:29:01.343	2025-04-20T01:37:25.860	Vulnerability in the Oracle Access Manager component of Oracle Fusion Middleware (subcomponent: Web Server Plugin). The supported version that is affected is 11.1.2.3.0. Easily exploitable vulnerability allows unauthenticated attacker with network access via HTTP to compromise Oracle Access Manager. Successful attacks of this vulnerability can result in unauthorized access to critical data or complete access to all Oracle Access Manager accessible data. CVSS 3.0 Base Score 7.5 (Confidentiality impacts). CVSS Vector: (CVSS:3.0/AV:N/AC:L/PR:N/UI:N/S:U/C:H/I:N/A:N).	5.0	MEDIUM	AV:N/AC:L/Au:N/C:P/I:N/A:N		
CVE-2017-10260	2017-10-19T17:29:01.373	2025-04-20T01:37:25.860	Vulnerability in the Oracle Integrated Lights Out Manager (ILOM) component of Oracle Sun Systems Products Suite (subcomponent: System Management). The supported version that is affected is Prior to 3.2.6. Easily exploitable vulnerability allows unauthenticated attacker with network access via HTTP to compromise Oracle Integrated Lights Out Manager (ILOM). Successful attacks of this vulnerability can result in unauthorized ability to cause a hang or frequently repeatable crash (complete DOS) of Oracle Integrated Lights Out Manager (ILOM). CVSS 3.0 Base Score 7.5 (Availability impacts). CVSS Vector: (CVSS:3.0/AV:N/AC:L/PR:N/UI:N/S:U/C:N/I:N/A:H).	7.8	HIGH	AV:N/AC:L/Au:N/C:N/I:N/A:C		
CVE-2017-10261	2017-10-19T17:29:01.403	2025-04-20T01:37:25.860	Vulnerability in the XML Database component of Oracle Database Server. Supported versions that are affected are 11.2.0.4 and 12.1.0.2. Easily exploitable vulnerability allows low privileged attacker having Create Session privilege with logon to the infrastructure where XML Database executes to compromise XML Database. While the vulnerability is in XML Database, attacks may significantly impact additional products. Successful attacks of this vulnerability can result in unauthorized access to critical data or complete access to all XML Database accessible data. Note: This score is for Windows platform version 11.2.0.4 of Database. For Windows platform version 12.1.0.2 and Linux, the score is 5.5 with scope Unchanged. CVSS 3.0 Base Score 6.5 (Confidentiality impacts). CVSS Vector: (CVSS:3.0/AV:L/AC:L/PR:L/UI:N/S:C/C:H/I:N/A:N).	4.0	MEDIUM	AV:N/AC:L/Au:S/C:P/I:N/A:N		
CVE-2017-10263	2017-10-19T17:29:01.483	2025-04-20T01:37:25.860	Vulnerability in the Siebel UI Framework component of Oracle Siebel CRM (subcomponent: UIF Open UI). Supported versions that are affected are 16.0 and 17.0. Easily exploitable vulnerability allows unauthenticated attacker with network access via HTTP to compromise Siebel UI Framework. Successful attacks require human interaction from a person other than the attacker and while the vulnerability is in Siebel UI Framework, attacks may significantly impact additional products. Successful attacks of this vulnerability can result in unauthorized access to critical data or complete access to all Siebel UI Framework accessible data as well as unauthorized update, insert or delete access to some of Siebel UI Framework accessible data. CVSS 3.0 Base Score 8.2 (Confidentiality and Integrity impacts). CVSS Vector: (CVSS:3.0/AV:N/AC:L/PR:N/UI:R/S:C/C:H/I:L/A:N).	5.8	MEDIUM	AV:N/AC:M/Au:N/C:P/I:P/A:N		
CVE-2017-10264	2017-10-19T17:29:01.530	2025-04-20T01:37:25.860	Vulnerability in the Siebel UI Framework component of Oracle Siebel CRM (subcomponent: UIF Open UI). Supported versions that are affected are 16.0 and 17.0. Easily exploitable vulnerability allows unauthenticated attacker with network access via HTTP to compromise Siebel UI Framework. Successful attacks of this vulnerability can result in unauthorized ability to cause a partial denial of service (partial DOS) of Siebel UI Framework. CVSS 3.0 Base Score 5.3 (Availability impacts). CVSS Vector: (CVSS:3.0/AV:N/AC:L/PR:N/UI:N/S:U/C:N/I:N/A:L).	5.0	MEDIUM	AV:N/AC:L/Au:N/C:N/I:N/A:P		
CVE-2017-10265	2017-10-19T17:29:01.593	2025-04-20T01:37:25.860	Vulnerability in the Oracle Integrated Lights Out Manager (ILOM) component of Oracle Sun Systems Products Suite (subcomponent: System Management). The supported version that is affected is Prior to 3.2.6. Easily exploitable vulnerability allows unauthenticated attacker with network access via HTTP to compromise Oracle Integrated Lights Out Manager (ILOM). Successful attacks of this vulnerability can result in unauthorized update, insert or delete access to some of Oracle Integrated Lights Out Manager (ILOM) accessible data as well as unauthorized read access to a subset of Oracle Integrated Lights Out Manager (ILOM) accessible data and unauthorized ability to cause a partial denial of service (partial DOS) of Oracle Integrated Lights Out Manager (ILOM). CVSS 3.0 Base Score 7.3 (Confidentiality, Integrity and Availability impacts). CVSS Vector: (CVSS:3.0/AV:N/AC:L/PR:N/UI:N/S:U/C:L/I:L/A:L).	7.5	HIGH	AV:N/AC:L/Au:N/C:P/I:P/A:P		
CVE-2017-10268	2017-10-19T17:29:01.623	2025-04-20T01:37:25.860	Vulnerability in the MySQL Server component of Oracle MySQL (subcomponent: Server: Replication). Supported versions that are affected are 5.5.57 and earlier, 5.6.37 and earlier and 5.7.19 and earlier. Difficult to exploit vulnerability allows high privileged attacker with logon to the infrastructure where MySQL Server executes to compromise MySQL Server. Successful attacks of this vulnerability can result in unauthorized access to critical data or complete access to all MySQL Server accessible data. CVSS 3.0 Base Score 4.1 (Confidentiality impacts). CVSS Vector: (CVSS:3.0/AV:L/AC:H/PR:H/UI:N/S:U/C:H/I:N/A:N).	4.1	MEDIUM	CVSS:3.1/AV:L/AC:H/PR:H/UI:N/S:U/C:H/I:N/A:N		
CVE-2017-10270	2017-10-19T17:29:01.687	2025-04-20T01:37:25.860	Vulnerability in the Oracle Identity Manager Connector component of Oracle Fusion Middleware (subcomponent: Microsoft Active Directory). The supported version that is affected is 9.1.1.5.0. Easily exploitable vulnerability allows unauthenticated attacker with logon to the infrastructure where Oracle Identity Manager Connector executes to compromise Oracle Identity Manager Connector. Successful attacks require human interaction from a person other than the attacker and while the vulnerability is in Oracle Identity Manager Connector, attacks may significantly impact additional products. Successful attacks of this vulnerability can result in unauthorized creation, deletion or modification access to critical data or all Oracle Identity Manager Connector accessible data and unauthorized ability to cause a hang or frequently repeatable crash (complete DOS) of Oracle Identity Manager Connector. CVSS 3.0 Base Score 8.2 (Integrity and Availability impacts). CVSS Vector: (CVSS:3.0/AV:L/AC:L/PR:N/UI:R/S:C/C:N/I:H/A:H).	3.3	LOW	AV:L/AC:M/Au:N/C:N/I:P/A:P		
CVE-2017-10271	2017-10-19T17:29:01.747	2025-04-20T01:37:25.860	Vulnerability in the Oracle WebLogic Server component of Oracle Fusion Middleware (subcomponent: WLS Security). Supported versions that are affected are 10.3.6.0.0, 12.1.3.0.0, 12.2.1.1.0 and 12.2.1.2.0. Easily exploitable vulnerability allows unauthenticated attacker with network access via T3 to compromise Oracle WebLogic Server. Successful attacks of this vulnerability can result in takeover of Oracle WebLogic Server. CVSS 3.0 Base Score 7.5 (Availability impacts). CVSS Vector: (CVSS:3.0/AV:N/AC:L/PR:N/UI:N/S:U/C:N/I:N/A:H).	7.5	HIGH	CVSS:3.1/AV:N/AC:L/PR:N/UI:N/S:U/C:N/I:N/A:H		
CVE-2017-10274	2017-10-19T17:29:01.873	2025-04-20T01:37:25.860	Vulnerability in the Java SE component of Oracle Java SE (subcomponent: Smart Card IO). Supported versions that are affected are Java SE: 6u161, 7u151, 8u144 and 9. Difficult to exploit vulnerability allows unauthenticated attacker with network access via multiple protocols to compromise Java SE. Successful attacks require human interaction from a person other than the attacker. Successful attacks of this vulnerability can result in unauthorized creation, deletion or modification access to critical data or all Java SE accessible data as well as unauthorized access to critical data or complete access to all Java SE accessible data. Note: This vulnerability applies to Java deployments, typically in clients running sandboxed Java Web Start applications or sandboxed Java applets, that load and run untrusted code (e.g., code that comes from the internet) and rely on the Java sandbox for security. This vulnerability does not apply to Java deployments, typically in servers, that load and run only trusted code (e.g., code installed by an administrator). CVSS 3.0 Base Score 6.8 (Confidentiality and Integrity impacts). CVSS Vector: (CVSS:3.0/AV:N/AC:H/PR:N/UI:R/S:U/C:H/I:H/A:N).	6.8	MEDIUM	CVSS:3.1/AV:N/AC:H/PR:N/UI:R/S:U/C:H/I:H/A:N		
CVE-2017-10275	2017-10-19T17:29:01.920	2025-04-20T01:37:25.860	Vulnerability in the Sun ZFS Storage Appliance Kit (AK) component of Oracle Sun Systems Products Suite (subcomponent: Filesystem). The supported version that is affected is AK 2013. Easily exploitable vulnerability allows low privileged attacker with logon to the infrastructure where Sun ZFS Storage Appliance Kit (AK) executes to compromise Sun ZFS Storage Appliance Kit (AK). Successful attacks require human interaction from a person other than the attacker. Successful attacks of this vulnerability can result in unauthorized ability to cause a hang or frequently repeatable crash (complete DOS) of Sun ZFS Storage Appliance Kit (AK). CVSS 3.0 Base Score 5.0 (Availability impacts). CVSS Vector: (CVSS:3.0/AV:L/AC:L/PR:L/UI:R/S:U/C:N/I:N/A:H).	6.3	MEDIUM	AV:N/AC:M/Au:S/C:N/I:N/A:C		
CVE-2017-10276	2017-10-19T17:29:01.967	2025-04-20T01:37:25.860	Vulnerability in the MySQL Server component of Oracle MySQL (subcomponent: Server: FTS). Supported versions that are affected are 5.6.37 and earlier and 5.7.19 and earlier. Easily exploitable vulnerability allows low privileged attacker with network access via multiple protocols to compromise MySQL Server. Successful attacks of this vulnerability can result in unauthorized ability to cause a hang or frequently repeatable crash (complete DOS) of MySQL Server. CVSS 3.0 Base Score 6.5 (Availability impacts). CVSS Vector: (CVSS:3.0/AV:N/AC:L/PR:L/UI:N/S:U/C:N/I:N/A:H).	5.0	MEDIUM	AV:N/AC:L/Au:N/C:N/I:N/A:P		
