CVE ID	Published Date	Last Modified Date	Description	Base Score	Base Severity	Vector String	Vendor	Product
CVE-2017-17624	2017-12-13T09:29:02.497	2025-04-20T01:37:25.860	PHP Multivendor Ecommerce 1.0 has SQL Injection via the single_detail.php sid parameter, or the category.php searchcat or chid1 parameter.	7.5	HIGH	AV:N/AC:L/Au:N/C:P/I:P/A:P		
CVE-2017-17625	2017-12-13T09:29:02.527	2025-04-20T01:37:25.860	Professional Service Script 1.0 has SQL Injection via the service-list city parameter.	9.8	CRITICAL	CVSS:3.1/AV:N/AC:L/PR:N/UI:N/S:U/C:H/I:H/A:H		
CVE-2017-17626	2017-12-13T09:29:02.573	2025-04-20T01:37:25.860	Readymade PHP Classified Script 3.3 has SQL Injection via the /categories subctid or mctid parameter.	7.5	HIGH	AV:N/AC:L/Au:N/C:P/I:P/A:P		
CVE-2017-17627	2017-12-13T09:29:02.607	2025-04-20T01:37:25.860	Readymade Video Sharing Script 3.2 has SQL Injection via the single-video-detail.php report_videos array parameter.	7.5	HIGH	AV:N/AC:L/Au:N/C:P/I:P/A:P		
CVE-2017-17628	2017-12-13T09:29:02.637	2025-04-20T01:37:25.860	Responsive Realestate Script 3.2 has SQL Injection via the property-list tbud parameter.	7.5	HIGH	AV:N/AC:L/Au:N/C:P/I:P/A:P		
CVE-2017-17629	2017-12-13T09:29:02.683	2025-04-20T01:37:25.860	Secure E-commerce Script 2.0.1 has SQL Injection via the category.php searchmain or searchcat parameter, or the single_detail.php sid parameter.	7.5	HIGH	AV:N/AC:L/Au:N/C:P/I:P/A:P		
CVE-2017-17630	2017-12-13T09:29:02.730	2025-04-20T01:37:25.860	Yoga Class Script 1.0 has SQL Injection via the /list city parameter.	7.5	HIGH	AV:N/AC:L/Au:N/C:P/I:P/A:P		
CVE-2017-17631	2017-12-13T09:29:02.760	2025-04-20T01:37:25.860	Multireligion Responsive Matrimonial 4.7.2 has SQL Injection via the success-story.php succid parameter.	7.5	HIGH	AV:N/AC:L/Au:N/C:P/I:P/A:P		
CVE-2017-17632	2017-12-13T09:29:02.793	2025-04-20T01:37:25.860	Responsive Events And Movie Ticket Booking Script 3.2.1 has SQL Injection via the findcity.php q parameter.	7.5	HIGH	AV:N/AC:L/Au:N/C:P/I:P/A:P		
CVE-2017-17633	2017-12-13T09:29:02.840	2025-04-20T01:37:25.860	Multiplex Movie Theater Booking Script 3.1.5 has SQL Injection via the trailer-detail.php moid parameter, show-time.php moid parameter, or event-detail.php eid parameter.	7.5	HIGH	AV:N/AC:L/Au:N/C:P/I:P/A:P		
CVE-2017-17634	2017-12-13T09:29:02.870	2025-04-20T01:37:25.860	Single Theater Booking Script 3.2.1 has SQL Injection via the findcity.php q parameter.	7.5	HIGH	AV:N/AC:L/Au:N/C:P/I:P/A:P		
CVE-2017-17635	2017-12-13T09:29:02.903	2025-04-20T01:37:25.860	MLM Forex Market Plan Script 2.0.4 has SQL Injection via the news_detail.php newid parameter or the event_detail.php eventid parameter.	7.5	HIGH	AV:N/AC:L/Au:N/C:P/I:P/A:P		
CVE-2017-17636	2017-12-13T09:29:02.950	2025-04-20T01:37:25.860	MLM Forced Matrix 2.0.9 has SQL Injection via the news-detail.php newid parameter.	7.5	HIGH	AV:N/AC:L/Au:N/C:P/I:P/A:P		
CVE-2017-17637	2017-12-13T09:29:02.980	2025-04-20T01:37:25.860	Car Rental Script 2.0.4 has SQL Injection via the countrycode1.php val parameter.	7.5	HIGH	AV:N/AC:L/Au:N/C:P/I:P/A:P		
CVE-2017-17638	2017-12-13T09:29:03.013	2025-04-20T01:37:25.860	Groupon Clone Script 3.01 has SQL Injection via the city_ajax.php state_id parameter.	7.5	HIGH	AV:N/AC:L/Au:N/C:P/I:P/A:P		
CVE-2017-17639	2017-12-13T09:29:03.057	2025-04-20T01:37:25.860	Muslim Matrimonial Script 3.02 has SQL Injection via the success-story.php succid parameter.	7.5	HIGH	AV:N/AC:L/Au:N/C:P/I:P/A:P		
CVE-2017-17640	2017-12-13T09:29:03.090	2025-04-20T01:37:25.860	Advanced World Database 2.0.5 has SQL Injection via the city.php country or state parameter, or the state.php country parameter.	7.5	HIGH	AV:N/AC:L/Au:N/C:P/I:P/A:P		
CVE-2017-17641	2017-12-13T09:29:03.137	2025-04-20T01:37:25.860	Resume Clone Script 2.0.5 has SQL Injection via the preview.php id parameter.	7.5	HIGH	AV:N/AC:L/Au:N/C:P/I:P/A:P		
CVE-2017-17642	2017-12-13T09:29:03.167	2025-04-20T01:37:25.860	Basic Job Site Script 2.0.5 has SQL Injection via the keyword parameter to /job.	7.5	HIGH	AV:N/AC:L/Au:N/C:P/I:P/A:P		
CVE-2017-14589	2017-12-13T15:29:00.217	2025-04-20T01:37:25.860	It was possible for double OGNL evaluation in FreeMarker templates through Struts FreeMarker tags to occur. An attacker who has restricted administration rights to Bamboo or who hosts a website that a Bamboo administrator visits, is able to exploit this vulnerability to execute Java code of their choice on systems that run a vulnerable version of Bamboo. All versions of Bamboo before 6.1.6 (the fixed version for 6.1.x) and from 6.2.0 before 6.2.5 (the fixed version for 6.2.x) are affected by this vulnerability.	6.8	MEDIUM	AV:N/AC:M/Au:N/C:P/I:P/A:P		
CVE-2017-14590	2017-12-13T15:29:00.297	2025-04-20T01:37:25.860	Bamboo did not check that the name of a branch in a Mercurial repository contained argument parameters. An attacker who has permission to create a repository in Bamboo, edit an existing plan that has a non-linked Mercurialrepository, create or edit a plan when there is at least one linked Mercurial repository that the attacker has permission to use, or commit to a Mercurial repository used by a Bamboo plan which has branch detection enabled can execute code of their choice on systems that run a vulnerable version of Bamboo Server. Versions of Bamboo starting with 2.7.0 before 6.1.6 (the fixed version for 6.1.x) and from 6.2.0 before 6.2.5 (the fixed version for 6.2.x) are affected by this vulnerability.	9.0	HIGH	AV:N/AC:L/Au:S/C:C/I:C/A:C		
CVE-2017-17382	2017-12-13T16:29:00.253	2025-04-20T01:37:25.860	Citrix NetScaler Application Delivery Controller (ADC) and NetScaler Gateway 10.5 before build 67.13, 11.0 before build 71.22, 11.1 before build 56.19, and 12.0 before build 53.22 might allow remote attackers to decrypt TLS ciphertext data by leveraging a Bleichenbacher RSA padding oracle, aka a ROBOT attack.	4.3	MEDIUM	AV:N/AC:M/Au:N/C:P/I:N/A:N		
CVE-2017-17427	2017-12-13T16:29:00.317	2025-04-20T01:37:25.860	"Radware Alteon devices with a firmware version between 31.0.0.0-31.0.3.0 are vulnerable to an adaptive-chosen ciphertext attack (""Bleichenbacher attack""). This allows an attacker to decrypt observed traffic that has been encrypted with the RSA cipher and to perform other private key operations."	4.3	MEDIUM	AV:N/AC:M/Au:N/C:P/I:N/A:N		
CVE-2017-17537	2017-12-13T16:29:00.363	2025-04-20T01:37:25.860	MikroTik RouterBOARD v6.39.2 and v6.40.5 allows an unauthenticated remote attacker to cause a denial of service by connecting to TCP port 53 and sending data that begins with many '\0' characters, possibly related to DNS.	5.0	MEDIUM	AV:N/AC:L/Au:N/C:N/I:N/A:P		
CVE-2017-17549	2017-12-13T16:29:00.393	2025-04-20T01:37:25.860	Citrix NetScaler Application Delivery Controller (ADC) and NetScaler Gateway 10.5 before build 67.13, 11.0 before build 71.22, 11.1 before build 56.19, and 12.0 before build 53.22 allow remote attackers to obtain sensitive information from the backend client TLS handshake by leveraging use of TLS with Client Certificates and a Diffie-Hellman Ephemeral (DHE) key exchange.	4.3	MEDIUM	AV:N/AC:M/Au:N/C:P/I:N/A:N		
CVE-2017-17648	2017-12-13T16:29:00.440	2025-04-20T01:37:25.860	Entrepreneur Dating Script 2.0.1 has SQL Injection via the search_result.php marital, gender, country, or profileid parameter.	7.5	HIGH	AV:N/AC:L/Au:N/C:P/I:P/A:P		
CVE-2017-1421	2017-12-13T18:29:00.237	2025-04-20T01:37:25.860	IBM iNotes is vulnerable to cross-site scripting. This vulnerability allows users to embed arbitrary JavaScript code in the Web UI thus altering the intended functionality potentially leading to credentials disclosure within a trusted session.	4.3	MEDIUM	AV:N/AC:M/Au:N/C:N/I:P/A:N		
CVE-2017-1546	2017-12-13T18:29:00.283	2025-04-20T01:37:25.860	IBM DOORS Next Generation (DNG/RRC) 4.07, 5.0, and 6.0 is vulnerable to cross-site scripting. This vulnerability allows users to embed arbitrary JavaScript code in the Web UI thus altering the intended functionality potentially leading to credentials disclosure within a trusted session. IBM X-Force ID: 130915.	3.5	LOW	AV:N/AC:M/Au:S/C:N/I:P/A:N		
CVE-2017-1558	2017-12-13T18:29:00.317	2025-04-20T01:37:25.860	IBM Maximo Asset Management 7.5 and 7.6 could allow a remote attacker to conduct phishing attacks, using an open redirect attack. By persuading a victim to visit a specially-crafted Web site, a remote attacker could exploit this vulnerability to spoof the URL displayed to redirect a user to a malicious Web site that would appear to be trusted. This could allow the attacker to obtain highly sensitive information or conduct further attacks against the victim. IBM X-Force ID: 131548.	5.8	MEDIUM	AV:N/AC:M/Au:N/C:P/I:P/A:N		
CVE-2017-1635	2017-12-13T18:29:00.363	2025-04-20T01:37:25.860	IBM Tivoli Monitoring V6 6.2.2.x could allow a remote attacker to execute arbitrary code on the system, caused by a use-after-free error. A remote attacker could exploit this vulnerability to execute arbitrary code on the system or cause the application to crash. IBM X-Force ID: 133243.	5.2	MEDIUM	AV:A/AC:L/Au:S/C:P/I:P/A:P		
CVE-2017-1716	2017-12-13T18:29:00.393	2025-04-20T01:37:25.860	IBM Tivoli Workload Scheduler 8.6.0, 9.1.0, and 9.2.0 could disclose sensitive information to a local attacker due to improper permission settings. IBM X-Force ID: 134638.	2.1	LOW	AV:L/AC:L/Au:N/C:P/I:N/A:N		
CVE-2017-15529	2017-12-13T19:29:00.223	2025-04-20T01:37:25.860	Prior to 4.4.1.10, the Norton Family Android App can be susceptible to a Denial of Service (DoS) exploit. A DoS attack is a type of attack whereby the perpetrator attempts to make a particular device unavailable to its intended user by temporarily or indefinitely disrupting services of a specific host within a network.	2.1	LOW	AV:L/AC:L/Au:N/C:N/I:N/A:P		
CVE-2017-15530	2017-12-13T19:29:00.283	2025-04-20T01:37:25.860	Prior to 4.4.1.10, the Norton Family Android App can be susceptible to an Information Disclosure issue. Information disclosure is a very common issue that attackers will attempt to exploit as a first pass across the application. As they probe the application they will take note of anything that may seem out of place or any bit of information they can use to their advantage such as error messages, system information, user data, version numbers, component names, URL paths, or even simple typos and misspellings.	2.1	LOW	AV:L/AC:L/Au:N/C:P/I:N/A:N		
CVE-2017-14380	2017-12-13T20:29:00.207	2025-04-20T01:37:25.860	In EMC Isilon OneFS 8.1.0.0, 8.0.1.0 - 8.0.1.1, 8.0.0.0 - 8.0.0.4, 7.2.1.0 - 7.2.1.5, 7.2.0.x, and 7.1.1.x, a malicious compliance admin (compadmin) account user could exploit a vulnerability in isi_get_itrace or isi_get_profile maintenance scripts to run any shell script as system root on a cluster in compliance mode. This could potentially lead to an elevation of privilege for the compadmin user and violate compliance mode.	7.2	HIGH	AV:L/AC:L/Au:N/C:C/I:C/A:C		
CVE-2017-17664	2017-12-13T20:29:00.253	2025-04-20T01:37:25.860	A Remote Crash issue was discovered in Asterisk Open Source 13.x before 13.18.4, 14.x before 14.7.4, and 15.x before 15.1.4 and Certified Asterisk before 13.13-cert9. Certain compound RTCP packets cause a crash in the RTCP Stack.	4.3	MEDIUM	AV:N/AC:M/Au:N/C:N/I:N/A:P		
CVE-2017-17665	2017-12-13T20:29:00.300	2025-04-20T01:37:25.860	In Octopus Deploy before 4.1.3, the machine update process doesn't check that the user has access to all environments. This allows an access-control bypass because the set of environments to which a machine is scoped may include environments in which the user lacks access.	6.5	MEDIUM	AV:N/AC:L/Au:S/C:P/I:P/A:P		
CVE-2017-11305	2017-12-13T21:29:00.230	2025-04-20T01:37:25.860	A regression affecting Adobe Flash Player version 27.0.0.187 (and earlier versions) causes the unintended reset of the global settings preference file when a user clears browser data.	6.5	MEDIUM	CVSS:3.1/AV:N/AC:L/PR:N/UI:R/S:U/C:N/I:H/A:N		
CVE-2017-17669	2017-12-13T22:29:00.237	2025-04-20T01:37:25.860	There is a heap-based buffer over-read in the Exiv2::Internal::PngChunk::keyTXTChunk function of pngchunk_int.cpp in Exiv2 0.26. A crafted PNG file will lead to a remote denial of service attack.	5.5	MEDIUM	CVSS:3.1/AV:L/AC:L/PR:N/UI:R/S:U/C:N/I:N/A:H		
CVE-2017-7738	2017-12-13T22:29:00.283	2025-04-20T01:37:25.860	An Information Disclosure vulnerability in Fortinet FortiOS 5.6.0 to 5.6.2, 5.4.0 to 5.4.5, 5.2 and below versions allow an admin user with super_admin privileges to view the current SSL VPN web portal session info which may contains user credentials through the fnsysctl CLI command.	4.0	MEDIUM	AV:N/AC:L/Au:S/C:P/I:N/A:N		
CVE-2017-17671	2017-12-14T00:29:00.217	2025-04-20T01:37:25.860	"vBulletin through 5.3.x on Windows allows remote PHP code execution because a require_once call is reachable with an unauthenticated request that can include directory traversal sequences to specify an arbitrary pathname, and because ../ traversal is blocked but ..\ traversal is not blocked. For example, an attacker can make an invalid HTTP request containing PHP code, and then make an index.php?routestring= request with enough instances of "".."" to reach an Apache HTTP Server log file."	9.8	CRITICAL	CVSS:3.1/AV:N/AC:L/PR:N/UI:N/S:U/C:H/I:H/A:H		
CVE-2017-17672	2017-12-14T00:29:00.263	2025-04-20T01:37:25.860	In vBulletin through 5.3.x, there is an unauthenticated deserialization vulnerability that leads to arbitrary file deletion and, under certain circumstances, code execution, because of unsafe usage of PHP's unserialize() in vB_Library_Template's cacheTemplates() function, which is a publicly exposed API. This is exploited with the templateidlist parameter to ajax/api/template/cacheTemplates.	7.5	HIGH	AV:N/AC:L/Au:N/C:P/I:P/A:P		
CVE-2017-17680	2017-12-14T06:29:00.217	2025-04-20T01:37:25.860	In ImageMagick 7.0.7-12 Q16, a memory leak vulnerability was found in the function ReadXPMImage in coders/xpm.c, which allows attackers to cause a denial of service via a crafted xpm image file.	4.3	MEDIUM	AV:N/AC:M/Au:N/C:N/I:N/A:P		
CVE-2017-17681	2017-12-14T06:29:00.277	2025-04-20T01:37:25.860	In ImageMagick 7.0.7-12 Q16, an infinite loop vulnerability was found in the function ReadPSDChannelZip in coders/psd.c, which allows attackers to cause a denial of service (CPU exhaustion) via a crafted psd image file.	7.1	HIGH	AV:N/AC:M/Au:N/C:N/I:N/A:C		
CVE-2017-17682	2017-12-14T06:29:00.310	2025-04-20T01:37:25.860	In ImageMagick 7.0.7-12 Q16, a large loop vulnerability was found in the function ExtractPostscript in coders/wpg.c, which allows attackers to cause a denial of service (CPU exhaustion) via a crafted wpg image file that triggers a ReadWPGImage call.	7.1	HIGH	AV:N/AC:M/Au:N/C:N/I:N/A:C		
CVE-2017-17683	2017-12-14T06:29:00.340	2025-04-20T01:37:25.860	Panda Global Protection 17.0.1 allows a system crash via a 0xb3702c44 \\.\PSMEMDriver DeviceIoControl request.	7.8	HIGH	AV:N/AC:L/Au:N/C:N/I:N/A:C		
CVE-2017-17684	2017-12-14T06:29:00.387	2025-04-20T01:37:25.860	Panda Global Protection 17.0.1 allows a system crash via a 0xb3702c04 \\.\PSMEMDriver DeviceIoControl request.	7.8	HIGH	AV:N/AC:L/Au:N/C:N/I:N/A:C		
CVE-2017-5663	2017-12-14T15:29:00.227	2025-04-20T01:37:25.860	In Apache Fineract 0.4.0-incubating, 0.5.0-incubating, and 0.6.0-incubating, an authenticated user with client/loan/center/staff/group read permissions is able to inject malicious SQL into SELECT queries. The 'sqlSearch' parameter on a number of endpoints is not sanitized and appended directly to the query.	6.5	MEDIUM	AV:N/AC:L/Au:S/C:P/I:P/A:P		
CVE-2017-17511	2017-12-14T16:29:00.230	2025-04-20T01:37:25.860	KildClient 3.1.0 does not validate strings before launching the program specified by the BROWSER environment variable, which might allow remote attackers to conduct argument-injection attacks via a crafted URL, related to prefs.c and worldgui.c.	6.8	MEDIUM	AV:N/AC:M/Au:N/C:P/I:P/A:P		
CVE-2017-17513	2017-12-14T16:29:00.293	2025-04-20T01:37:25.860	TeX Live through 20170524 does not validate strings before launching the program specified by the BROWSER environment variable, which might allow remote attackers to conduct argument-injection attacks via a crafted URL, related to linked_scripts/context/stubs/unix/mtxrun, texmf-dist/scripts/context/stubs/mswin/mtxrun.lua, and texmf-dist/tex/luatex/lualibs/lualibs-os.lua.	6.8	MEDIUM	AV:N/AC:M/Au:N/C:P/I:P/A:P		
CVE-2017-17514	2017-12-14T16:29:00.370	2025-04-20T01:37:25.860	boxes.c in nip2 8.4.0 does not validate strings before launching the program specified by the BROWSER environment variable, which might allow remote attackers to conduct argument-injection attacks via a crafted URL. NOTE: a software maintainer indicates that this product does not use the BROWSER environment variable	8.8	HIGH	CVSS:3.1/AV:N/AC:L/PR:N/UI:R/S:U/C:H/I:H/A:H		
CVE-2017-17515	2017-12-14T16:29:00.447	2025-04-20T01:37:25.860	etc/ObjectList in Metview 4.7.3 does not validate strings before launching the program specified by the BROWSER environment variable, which might allow remote attackers to conduct argument-injection attacks via a crafted URL. NOTE: a third party has indicated that the code to access this environment variable is not enabled in the shipped product	6.8	MEDIUM	AV:N/AC:M/Au:N/C:P/I:P/A:P		
CVE-2017-17516	2017-12-14T16:29:00.480	2025-04-20T01:37:25.860	scripts/inspect_webbrowser.py in Reddit Terminal Viewer (RTV) 1.19.0 does not validate strings before launching the program specified by the BROWSER environment variable, which might allow remote attackers to conduct argument-injection attacks via a crafted URL.	6.8	MEDIUM	AV:N/AC:M/Au:N/C:P/I:P/A:P		
CVE-2017-17517	2017-12-14T16:29:00.527	2025-04-20T01:37:25.860	libsylph/utils.c in Sylpheed through 3.6 does not validate strings before launching the program specified by the BROWSER environment variable, which might allow remote attackers to conduct argument-injection attacks via a crafted URL.	6.8	MEDIUM	AV:N/AC:M/Au:N/C:P/I:P/A:P		
CVE-2017-17518	2017-12-14T16:29:00.557	2025-04-20T01:37:25.860	"swt/motif/browser.c in White_dune (aka whitedune) 0.30.10 does not validate strings before launching the program specified by the BROWSER environment variable, which might allow remote attackers to conduct argument-injection attacks via a crafted URL. NOTE: This issue is being disputed as not being a vulnerability because the current version of white_dune (1.369 at https://wdune.ourproject.org/) do not use a ""BROWSER environment variable"". Instead, the ""browser"" variable is read from the $HOME/.dunerc file (or from the M$Windows registry). It is configurable in the ""options"" menu. The default is chosen in the ./configure script, which tests various programs, first tested is ""xdg-open""."	6.8	MEDIUM	AV:N/AC:M/Au:N/C:P/I:P/A:P		
CVE-2017-17519	2017-12-14T16:29:00.587	2025-04-20T01:37:25.860	batteriesConfig.mlp in OCaml Batteries Included (aka ocaml-batteries) 2.6 does not validate strings before launching the program specified by the BROWSER environment variable, which might allow remote attackers to conduct argument-injection attacks via a crafted URL.	6.8	MEDIUM	AV:N/AC:M/Au:N/C:P/I:P/A:P		
CVE-2017-17520	2017-12-14T16:29:00.620	2025-04-20T01:37:25.860	"tools/url_handler.pl in TIN 2.4.1 does not validate strings before launching the program specified by the BROWSER environment variable, which might allow remote attackers to conduct argument-injection attacks via a crafted URL. NOTE: a third party has reported that this is intentional behavior, because the documentation states ""url_handler.pl was designed to work together with tin which only issues shell escaped absolute URLs."	8.8	HIGH	CVSS:3.1/AV:N/AC:L/PR:N/UI:R/S:U/C:H/I:H/A:H		
CVE-2017-17521	2017-12-14T16:29:00.683	2025-04-20T01:37:25.860	uiutil.c in FontForge through 20170731 does not validate strings before launching the program specified by the BROWSER environment variable, which might allow remote attackers to conduct argument-injection attacks via a crafted URL, a different vulnerability than CVE-2017-17534.	6.8	MEDIUM	AV:N/AC:M/Au:N/C:P/I:P/A:P		
CVE-2017-17522	2017-12-14T16:29:00.713	2025-04-20T01:37:25.860	Lib/webbrowser.py in Python through 3.6.3 does not validate strings before launching the program specified by the BROWSER environment variable, which might allow remote attackers to conduct argument-injection attacks via a crafted URL. NOTE: a software maintainer indicates that exploitation is impossible because the code relies on subprocess.Popen and the default shell=False setting	6.8	MEDIUM	AV:N/AC:M/Au:N/C:P/I:P/A:P		
CVE-2017-17524	2017-12-14T16:29:00.760	2025-04-20T01:37:25.860	library/www_browser.pl in SWI-Prolog 7.2.3 does not validate strings before launching the program specified by the BROWSER environment variable, which might allow remote attackers to conduct argument-injection attacks via a crafted URL.	6.8	MEDIUM	AV:N/AC:M/Au:N/C:P/I:P/A:P		
CVE-2017-17525	2017-12-14T16:29:00.793	2025-04-20T01:37:25.860	guiclient/guiclient.cpp in xTuple PostBooks 4.7.0 does not validate strings before launching the program specified by the BROWSER environment variable, which might allow remote attackers to conduct argument-injection attacks via a crafted URL.	6.8	MEDIUM	AV:N/AC:M/Au:N/C:P/I:P/A:P		
CVE-2017-17526	2017-12-14T16:29:00.837	2025-04-20T01:37:25.860	Input.cc in Bernard Parisse Giac 1.2.3.57 does not validate strings before launching the program specified by the BROWSER environment variable, which might allow remote attackers to conduct argument-injection attacks via a crafted URL.	6.8	MEDIUM	AV:N/AC:M/Au:N/C:P/I:P/A:P		
CVE-2017-17527	2017-12-14T16:29:00.887	2025-04-20T01:37:25.860	delphi_gui/WWWBrowserRunnerDM.pas in PasDoc 0.14 does not validate strings before launching the program specified by the BROWSER environment variable, which might allow remote attackers to conduct argument-injection attacks via a crafted URL. NOTE: a software maintainer has indicated that the code referencing the BROWSER environment variable is never used	6.8	MEDIUM	AV:N/AC:M/Au:N/C:P/I:P/A:P		
CVE-2017-17528	2017-12-14T16:29:00.917	2025-04-20T01:37:25.860	backends/platform/sdl/posix/posix.cpp in ScummVM 1.9.0 does not validate strings before launching the program specified by the BROWSER environment variable, which might allow remote attackers to conduct argument-injection attacks via a crafted URL.	6.8	MEDIUM	AV:N/AC:M/Au:N/C:P/I:P/A:P		
CVE-2017-17529	2017-12-14T16:29:00.947	2025-04-20T01:37:25.860	af/util/xp/ut_go_file.cpp in AbiWord 3.0.2-2 does not validate strings before launching the program specified by the BROWSER environment variable, which might allow remote attackers to conduct argument-injection attacks via a crafted URL.	6.8	MEDIUM	AV:N/AC:M/Au:N/C:P/I:P/A:P		
CVE-2017-17530	2017-12-14T16:29:00.997	2025-04-20T01:37:25.860	common/help.c in Geomview 1.9.5 does not validate strings before launching the program specified by the BROWSER environment variable, which might allow remote attackers to conduct argument-injection attacks via a crafted URL. NOTE: this is disputed by a third party because no untrusted input can be used for the injection	8.8	HIGH	CVSS:3.1/AV:N/AC:L/PR:N/UI:R/S:U/C:H/I:H/A:H		
CVE-2017-17531	2017-12-14T16:29:01.027	2025-04-20T01:37:25.860	gozilla.c in GNU GLOBAL 4.8.6 does not validate strings before launching the program specified by the BROWSER environment variable, which might allow remote attackers to conduct argument-injection attacks via a crafted URL.	6.8	MEDIUM	AV:N/AC:M/Au:N/C:P/I:P/A:P		
CVE-2017-17532	2017-12-14T16:29:01.057	2025-04-20T01:37:25.860	examples/framework/news/news3.py in Kiwi 1.9.22 does not validate strings before launching the program specified by the BROWSER environment variable, which might allow remote attackers to conduct argument-injection attacks via a crafted URL.	6.8	MEDIUM	AV:N/AC:M/Au:N/C:P/I:P/A:P		
CVE-2017-17533	2017-12-14T16:29:01.120	2025-04-20T01:37:25.860	default.tcl in Tkabber 1.1 does not validate strings before launching the program specified by the BROWSER environment variable, which might allow remote attackers to conduct argument-injection attacks via a crafted URL. NOTE: a third party has indicated that the attack cannot occur because of the argument-parsing behavior of the Tcl exec function	6.8	MEDIUM	AV:N/AC:M/Au:N/C:P/I:P/A:P		
CVE-2017-17534	2017-12-14T16:29:01.150	2025-04-20T01:37:25.860	uiutil.c in Mensis 0.0.080507 does not validate strings before launching the program specified by the BROWSER environment variable, which might allow remote attackers to conduct argument-injection attacks via a crafted URL, a different vulnerability than CVE-2017-17521.	6.8	MEDIUM	AV:N/AC:M/Au:N/C:P/I:P/A:P		
CVE-2017-17535	2017-12-14T16:29:01.230	2025-04-20T01:37:25.860	lib/gui.py in Bob Hepple gjots2 2.4.1 does not validate strings before launching the program specified by the BROWSER environment variable, which might allow remote attackers to conduct argument-injection attacks via a crafted URL.	6.8	MEDIUM	AV:N/AC:M/Au:N/C:P/I:P/A:P		
CVE-2017-7344	2017-12-14T18:29:00.210	2025-04-20T01:37:25.860	"A privilege escalation in Fortinet FortiClient Windows 5.4.3 and earlier as well as 5.6.0 allows attacker to gain privilege via exploiting the Windows ""security alert"" dialog thereby popping up when the ""VPN before logon"" feature is enabled and an untrusted certificate chain."	7.6	HIGH	AV:N/AC:H/Au:N/C:C/I:C/A:C		
CVE-2016-10703	2017-12-14T19:29:00.197	2025-04-20T01:37:25.860	A regular expression Denial of Service (DoS) vulnerability in the file lib/ecstatic.js of the ecstatic npm package, before version 2.0.0, allows a remote attacker to overload and crash a server by passing a maliciously crafted string.	7.5	HIGH	CVSS:3.1/AV:N/AC:L/PR:N/UI:N/S:U/C:N/I:N/A:H		
