CVE ID	Published Date	Last Modified Date	Description	Base Score	Base Severity	Vector String	Vendor	Product
CVE-2017-14102	2017-09-01T05:29:00.250	2025-04-20T01:37:25.860	"MIMEDefang 2.80 and earlier creates a PID file after dropping privileges to a non-root account, which might allow local users to kill arbitrary processes by leveraging access to this non-root account for PID file modification before a root script executes a ""kill `cat /pathname`"" command, as demonstrated by the init-script.in and mimedefang-init.in scripts."	4.6	MEDIUM	AV:L/AC:L/Au:N/C:P/I:P/A:P		
CVE-2015-7746	2017-09-01T13:29:00.193	2025-04-20T01:37:25.860	NetApp Data ONTAP before 8.2.4, when operating in 7-Mode, allows remote attackers to bypass authentication and (1) obtain sensitive information from or (2) modify volumes via vectors related to UTF-8 in the volume language.	7.5	HIGH	AV:N/AC:L/Au:N/C:P/I:P/A:P		
CVE-2017-12868	2017-09-01T13:29:00.240	2025-04-20T01:37:25.860	The secureCompare method in lib/SimpleSAML/Utils/Crypto.php in SimpleSAMLphp 1.14.13 and earlier, when used with PHP before 5.6, allows attackers to conduct session fixation attacks or possibly bypass authentication by leveraging missing character conversions before an XOR operation.	7.5	HIGH	AV:N/AC:L/Au:N/C:P/I:P/A:P		
CVE-2017-12869	2017-09-01T13:29:00.303	2025-04-20T01:37:25.860	The multiauth module in SimpleSAMLphp 1.14.13 and earlier allows remote attackers to bypass authentication context restrictions and use an authentication source defined in config/authsources.php via vectors related to improper validation of user input.	5.0	MEDIUM	AV:N/AC:L/Au:N/C:N/I:P/A:N		
CVE-2017-12870	2017-09-01T13:29:00.333	2025-04-20T01:37:25.860	SimpleSAMLphp 1.14.12 and earlier make it easier for man-in-the-middle attackers to obtain sensitive information by leveraging use of the aesEncrypt and aesDecrypt methods in the SimpleSAML/Utils/Crypto class to protect session identifiers in replies to non-HTTPS service providers.	4.3	MEDIUM	AV:N/AC:M/Au:N/C:P/I:N/A:N		
CVE-2017-13672	2017-09-01T13:29:00.367	2025-04-20T01:37:25.860	QEMU (aka Quick Emulator), when built with the VGA display emulator support, allows local guest OS privileged users to cause a denial of service (out-of-bounds read and QEMU process crash) via vectors involving display update.	5.5	MEDIUM	CVSS:3.1/AV:L/AC:L/PR:L/UI:N/S:U/C:N/I:N/A:H		
CVE-2017-13674	2017-09-01T13:29:00.397	2025-04-20T01:37:25.860	Symantec ProxyClient 3.4 for Windows is susceptible to a privilege escalation vulnerability. A malicious local Windows user can, under certain circumstances, exploit this vulnerability to escalate their privileges on the system and execute arbitrary code with LocalSystem privileges.	7.2	HIGH	AV:L/AC:L/Au:N/C:C/I:C/A:C		
CVE-2017-13711	2017-09-01T13:29:00.427	2025-04-20T01:37:25.860	Use-after-free vulnerability in the sofree function in slirp/socket.c in QEMU (aka Quick Emulator) allows attackers to cause a denial of service (QEMU instance crash) by leveraging failure to properly clear ifq_so from pending packets.	7.5	HIGH	CVSS:3.1/AV:N/AC:L/PR:N/UI:N/S:U/C:N/I:N/A:H		
CVE-2017-14103	2017-09-01T13:29:00.477	2025-04-20T01:37:25.860	The ReadJNGImage and ReadOneJNGImage functions in coders/png.c in GraphicsMagick 1.3.26 do not properly manage image pointers after certain error conditions, which allows remote attackers to conduct use-after-free attacks via a crafted file, related to a ReadMNGImage out-of-order CloseBlob call. NOTE: this vulnerability exists because of an incomplete fix for CVE-2017-11403.	6.8	MEDIUM	AV:N/AC:M/Au:N/C:P/I:P/A:P		
CVE-2017-3897	2017-09-01T13:29:00.507	2025-04-20T01:37:25.860	A Code Injection vulnerability in the non-certificate-based authentication mechanism in McAfee Live Safe versions prior to 16.0.3 and McAfee Security Scan Plus (MSS+) versions prior to 3.11.599.3 allows network attackers to perform a malicious file execution via a HTTP backend-response.	7.5	HIGH	AV:N/AC:L/Au:N/C:P/I:P/A:P		
CVE-2017-3898	2017-09-01T13:29:00.537	2025-04-20T01:37:25.860	A man-in-the-middle attack vulnerability in the non-certificate-based authentication mechanism in McAfee LiveSafe (MLS) versions prior to 16.0.3 allows network attackers to modify the Windows registry value associated with the McAfee update via the HTTP backend-response.	4.3	MEDIUM	AV:N/AC:M/Au:N/C:N/I:P/A:N		
CVE-2017-10829	2017-09-01T14:29:00.180	2025-04-20T01:37:25.860	Untrusted search path vulnerability in Remote Support Tool (Enkaku Support Tool) All versions distributed through the website till 2017 August 10 allow an attacker to gain privileges via a Trojan horse DLL in an unspecified directory.	9.3	HIGH	AV:N/AC:M/Au:N/C:C/I:C/A:C		
CVE-2017-10848	2017-09-01T14:29:00.227	2025-04-20T01:37:25.860	Untrusted search path vulnerability in Installers for DocuWorks 8.0.7 and earlier and DocuWorks Viewer Light published in Jul 2017 and earlier allows an attacker to gain privileges via a Trojan horse DLL in an unspecified directory.	9.3	HIGH	AV:N/AC:M/Au:N/C:C/I:C/A:C		
CVE-2017-10849	2017-09-01T14:29:00.257	2025-04-20T01:37:25.860	Untrusted search path vulnerability in Self-extracting document generated by DocuWorks 8.0.7 and earlier allows an attacker to gain privileges via a Trojan horse DLL in an unspecified directory.	9.3	HIGH	AV:N/AC:M/Au:N/C:C/I:C/A:C		
CVE-2017-10850	2017-09-01T14:29:00.290	2025-04-20T01:37:25.860	Untrusted search path vulnerability in Installers of ART EX Driver for ApeosPort-VI C7771/C6671/C5571/C4471/C3371/C2271, DocuCentre-VI C7771/C6671/C5571/C4471/C3371/C2271 (Timestamp of code signing is before 12 Apr 2017 02:04 UTC.), PostScript? Driver + Additional Feature Plug-in + PPD File for ApeosPort-VI C7771/C6671/C5571/C4471/C3371/C2271, DocuCentre-VI C7771/C6671/C5571/C4471/C3371/C2271 (Timestamp of code signing is before 12 Apr 2017 02:10 UTC.), XPS Print Driver for ApeosPort-VI C7771/C6671/C5571/C4471/C3371/C2271, DocuCentre-VI C7771/C6671/C5571/C4471/C3371/C2271 (Timestamp of code signing is before 3 Nov 2017 23:48 UTC.), ART EX Direct FAX Driver for ApeosPort-VI C7771/C6671/C5571/C4471/C3371/C2271, DocuCentre-VI C7771/C6671/C5571/C4471/C3371/C2271 (Timestamp of code signing is before 26 May 2017 07:44 UTC.), Setting Restore Tool for ApeosPort-VI C7771/C6671/C5571/C4471/C3371/C2271, DocuCentre-VI C7771/C6671/C5571/C4471/C3371/C2271 (Timestamp of code signing is before 25 Aug 2015 08:51 UTC.) allows an attacker to gain privileges via a Trojan horse DLL in an unspecified directory.	7.8	HIGH	CVSS:3.1/AV:L/AC:L/PR:N/UI:R/S:U/C:H/I:H/A:H		
CVE-2017-10851	2017-09-01T14:29:00.320	2025-04-20T01:37:25.860	Untrusted search path vulnerability in Installer for ContentsBridge Utility for Windows 7.4.0 and earlier allows an attacker to gain privileges via a Trojan horse DLL in an unspecified directory.	9.3	HIGH	AV:N/AC:M/Au:N/C:C/I:C/A:C		
CVE-2017-14106	2017-09-01T16:29:00.377	2025-04-20T01:37:25.860	The tcp_disconnect function in net/ipv4/tcp.c in the Linux kernel before 4.12 allows local users to cause a denial of service (__tcp_select_window divide-by-zero error and system crash) by triggering a disconnect within a certain tcp_recvmsg code path.	4.9	MEDIUM	AV:L/AC:L/Au:N/C:N/I:N/A:C		
CVE-2017-14105	2017-09-01T17:29:00.213	2025-04-20T01:37:25.860	HiveManager Classic through 8.1r1 allows arbitrary JSP code execution by modifying a backup archive before a restore, because the restore feature does not validate pathnames within the archive. An authenticated, local attacker - even restricted as a tenant - can add a jsp at HiveManager/tomcat/webapps/hm/domains/$yourtenant/maps (it will be exposed at the web interface).	7.2	HIGH	AV:L/AC:L/Au:N/C:C/I:C/A:C		
CVE-2017-14107	2017-09-01T17:29:00.260	2025-04-20T01:37:25.860	The _zip_read_eocd64 function in zip_open.c in libzip before 1.3.0 mishandles EOCD records, which allows remote attackers to cause a denial of service (memory allocation failure in _zip_cdir_grow in zip_dirent.c) via a crafted ZIP archive.	6.5	MEDIUM	CVSS:3.1/AV:N/AC:L/PR:N/UI:R/S:U/C:N/I:N/A:H		
CVE-2016-1895	2017-09-01T21:29:00.267	2025-04-20T01:37:25.860	NetApp Data ONTAP before 8.2.5 and 8.3.x before 8.3.2P12 allow remote authenticated users to cause a denial of service via vectors related to unsafe user input string handling.	4.0	MEDIUM	AV:N/AC:L/Au:S/C:N/I:N/A:P		
CVE-2017-12421	2017-09-01T21:29:00.313	2025-04-20T01:37:25.860	NetApp Clustered Data ONTAP 8.3.x before 8.3.2P12 allows remote authenticated users to execute arbitrary code on the storage controller via unspecified vectors.	6.5	MEDIUM	AV:N/AC:L/Au:S/C:P/I:P/A:P		
CVE-2017-12423	2017-09-01T21:29:00.360	2025-04-20T01:37:25.860	NetApp Clustered Data ONTAP 8.3.x before 8.3.2P12 allows remote authenticated users to read data on other Storage Virtual Machines (SVMs) via unspecified vectors.	4.0	MEDIUM	AV:N/AC:L/Au:S/C:P/I:N/A:N		
CVE-2017-12691	2017-09-01T21:29:00.390	2025-04-20T01:37:25.860	The ReadOneLayer function in coders/xcf.c in ImageMagick 7.0.6-6 allows remote attackers to cause a denial of service (memory consumption) via a crafted file.	7.1	HIGH	AV:N/AC:M/Au:N/C:N/I:N/A:C		
CVE-2017-12692	2017-09-01T21:29:00.467	2025-04-20T01:37:25.860	The ReadVIFFImage function in coders/viff.c in ImageMagick 7.0.6-6 allows remote attackers to cause a denial of service (memory consumption) via a crafted VIFF file.	7.1	HIGH	AV:N/AC:M/Au:N/C:N/I:N/A:C		
CVE-2017-12693	2017-09-01T21:29:00.500	2025-04-20T01:37:25.860	The ReadBMPImage function in coders/bmp.c in ImageMagick 7.0.6-6 allows remote attackers to cause a denial of service (memory consumption) via a crafted BMP file.	7.1	HIGH	AV:N/AC:M/Au:N/C:N/I:N/A:C		
CVE-2017-12871	2017-09-01T21:29:00.530	2025-04-20T01:37:25.860	The aesEncrypt method in lib/SimpleSAML/Utils/Crypto.php in SimpleSAMLphp 1.14.x through 1.14.11 makes it easier for context-dependent attackers to bypass the encryption protection mechanism by leveraging use of the first 16 bytes of the secret key as the initialization vector (IV).	4.3	MEDIUM	AV:N/AC:M/Au:N/C:P/I:N/A:N		
CVE-2017-12872	2017-09-01T21:29:00.563	2025-04-20T01:37:25.860	The (1) Htpasswd authentication source in the authcrypt module and (2) SimpleSAML_Session class in SimpleSAMLphp 1.14.11 and earlier allow remote attackers to conduct timing side-channel attacks by leveraging use of the standard comparison operator to compare secret material against user input.	4.3	MEDIUM	AV:N/AC:M/Au:N/C:P/I:N/A:N		
CVE-2017-12873	2017-09-01T21:29:00.593	2025-04-20T01:37:25.860	SimpleSAMLphp 1.7.0 through 1.14.10 might allow attackers to obtain sensitive information, gain unauthorized access, or have unspecified other impacts by leveraging incorrect persistent NameID generation when an Identity Provider (IdP) is misconfigured.	7.5	HIGH	AV:N/AC:L/Au:N/C:P/I:P/A:P		
CVE-2017-12874	2017-09-01T21:29:00.640	2025-04-20T01:37:25.860	The InfoCard module 1.0 for SimpleSAMLphp allows attackers to spoof XML messages by leveraging an incorrect check of return values in signature validation utilities.	5.0	MEDIUM	AV:N/AC:L/Au:N/C:N/I:P/A:N		
CVE-2017-14053	2017-09-01T21:29:00.670	2025-04-20T01:37:25.860	NetApp OnCommand Unified Manager for Clustered Data ONTAP before 7.2P1 does not set the secure flag for an unspecified cookie in an HTTPS session, which makes it easier for remote attackers to capture this cookie by intercepting its transmission within an HTTP session.	5.0	MEDIUM	AV:N/AC:L/Au:N/C:P/I:N/A:N		
CVE-2017-14098	2017-09-02T16:29:00.240	2025-04-20T01:37:25.860	In the pjsip channel driver (res_pjsip) in Asterisk 13.x before 13.17.1 and 14.x before 14.6.1, a carefully crafted tel URI in a From, To, or Contact header could cause Asterisk to crash.	5.0	MEDIUM	AV:N/AC:L/Au:N/C:N/I:N/A:P		
CVE-2017-14099	2017-09-02T16:29:00.287	2025-04-20T01:37:25.860	"In res/res_rtp_asterisk.c in Asterisk 11.x before 11.25.2, 13.x before 13.17.1, and 14.x before 14.6.1 and Certified Asterisk 11.x before 11.6-cert17 and 13.x before 13.13-cert5, unauthorized data disclosure (media takeover in the RTP stack) is possible with careful timing by an attacker. The ""strictrtp"" option in rtp.conf enables a feature of the RTP stack that learns the source address of media for a session and drops any packets that do not originate from the expected address. This option is enabled by default in Asterisk 11 and above. The ""nat"" and ""rtp_symmetric"" options (for chan_sip and chan_pjsip, respectively) enable symmetric RTP support in the RTP stack. This uses the source address of incoming media as the target address of any sent media. This option is not enabled by default, but is commonly enabled to handle devices behind NAT. A change was made to the strict RTP support in the RTP stack to better tolerate late media when a reinvite occurs. When combined with the symmetric RTP support, this introduced an avenue where media could be hijacked. Instead of only learning a new address when expected, the new code allowed a new source address to be learned at all times. If a flood of RTP traffic was received, the strict RTP support would allow the new address to provide media, and (with symmetric RTP enabled) outgoing traffic would be sent to this new address, allowing the media to be hijacked. Provided the attacker continued to send traffic, they would continue to receive traffic as well."	5.0	MEDIUM	AV:N/AC:L/Au:N/C:P/I:N/A:N		
CVE-2017-14100	2017-09-02T16:29:00.333	2025-04-20T01:37:25.860	"In Asterisk 11.x before 11.25.2, 13.x before 13.17.1, and 14.x before 14.6.1 and Certified Asterisk 11.x before 11.6-cert17 and 13.x before 13.13-cert5, unauthorized command execution is possible. The app_minivm module has an ""externnotify"" program configuration option that is executed by the MinivmNotify dialplan application. The application uses the caller-id name and number as part of a built string passed to the OS shell for interpretation and execution. Since the caller-id name and number can come from an untrusted source, a crafted caller-id name or number allows an arbitrary shell command injection."	7.5	HIGH	AV:N/AC:L/Au:N/C:P/I:P/A:P		
CVE-2017-14114	2017-09-02T16:29:00.363	2025-04-20T01:37:25.860	RTPproxy through 2.2.alpha.20160822 has a NAT feature that results in not properly determining the IP address and port number of the legitimate recipient of RTP traffic, which allows remote attackers to obtain sensitive information or cause a denial of service (communication outage) via crafted RTP packets.	6.4	MEDIUM	AV:N/AC:L/Au:N/C:P/I:N/A:P		
CVE-2017-10793	2017-09-03T19:29:00.207	2025-04-20T01:37:25.860	The AT&T U-verse 9.2.2h0d83 firmware for the Arris NVG589, NVG599, and unspecified other devices, when IP Passthrough mode is not used, configures an sbdc.ha WAN TCP service on port 61001 with the bdctest account and the bdctest password, which allows remote attackers to obtain sensitive information (such as the Wi-Fi password) by leveraging knowledge of a hardware identifier, related to the Bulk Data Collection (BDC) mechanism defined in Broadband Forum technical reports.	4.3	MEDIUM	AV:N/AC:M/Au:N/C:P/I:N/A:N		
CVE-2017-14115	2017-09-03T19:29:00.267	2025-04-20T01:37:25.860	"The AT&T U-verse 9.2.2h0d83 firmware for the Arris NVG589 and NVG599 devices, when IP Passthrough mode is not used, configures ssh-permanent-enable WAN SSH logins to the remotessh account with the 5SaP9I26 password, which allows remote attackers to access a ""Terminal shell v1.0"" service, and subsequently obtain unrestricted root privileges, by establishing an SSH session and then entering certain shell metacharacters and BusyBox commands."	9.3	HIGH	AV:N/AC:M/Au:N/C:C/I:C/A:C		
CVE-2017-14116	2017-09-03T19:29:00.300	2025-04-20T01:37:25.860	"The AT&T U-verse 9.2.2h0d83 firmware for the Arris NVG599 device, when IP Passthrough mode is not used, configures WAN access to a caserver https service with the tech account and an empty password, which allows remote attackers to obtain root privileges by establishing a session on port 49955 and then installing new software, such as BusyBox with ""nc -l"" support."	9.3	HIGH	AV:N/AC:M/Au:N/C:C/I:C/A:C		
CVE-2017-14117	2017-09-03T19:29:00.330	2025-04-20T01:37:25.860	The AT&T U-verse 9.2.2h0d83 firmware for the Arris NVG589 and NVG599 devices, when IP Passthrough mode is not used, configures an unauthenticated proxy service on WAN TCP port 49152, which allows remote attackers to establish arbitrary TCP connections to intranet hosts by sending \x2a\xce\x01 followed by other predictable values.	4.3	MEDIUM	AV:N/AC:M/Au:N/C:N/I:P/A:N		
CVE-2017-14118	2017-09-03T20:29:00.193	2025-04-20T01:37:25.860	In the EyesOfNetwork web interface (aka eonweb) 5.1-0, module\tool_all\tools\interface.php does not properly restrict exec calls, which allows remote attackers to execute arbitrary commands via shell metacharacters in the host_list parameter to module/tool_all/select_tool.php.	6.5	MEDIUM	AV:N/AC:L/Au:S/C:P/I:P/A:P		
CVE-2017-14119	2017-09-03T20:29:00.240	2025-04-20T01:37:25.860	In the EyesOfNetwork web interface (aka eonweb) 5.1-0, module\tool_all\tools\snmpwalk.php does not properly restrict popen calls, which allows remote attackers to execute arbitrary commands via shell metacharacters in a parameter.	6.5	MEDIUM	AV:N/AC:L/Au:S/C:P/I:P/A:P		
CVE-2017-14120	2017-09-03T20:29:00.287	2025-04-20T01:37:25.860	unrar 0.0.1 (aka unrar-free or unrar-gpl) suffers from a directory traversal vulnerability for RAR v2 archives: pathnames of the form ../[filename] are unpacked into the upper directory.	7.5	HIGH	CVSS:3.1/AV:N/AC:L/PR:N/UI:N/S:U/C:H/I:N/A:N		
CVE-2017-14121	2017-09-03T20:29:00.317	2025-04-20T01:37:25.860	The DecodeNumber function in unrarlib.c in unrar 0.0.1 (aka unrar-free or unrar-gpl) suffers from a NULL pointer dereference flaw triggered by a crafted RAR archive. NOTE: this may be the same as one of the several test cases in the CVE-2017-11189 references.	5.5	MEDIUM	CVSS:3.1/AV:L/AC:L/PR:N/UI:R/S:U/C:N/I:N/A:H		
CVE-2017-14122	2017-09-03T20:29:00.350	2025-04-20T01:37:25.860	unrar 0.0.1 (aka unrar-free or unrar-gpl) suffers from a stack-based buffer over-read in unrarlib.c, related to ExtrFile and stricomp.	9.1	CRITICAL	CVSS:3.1/AV:N/AC:L/PR:N/UI:N/S:U/C:H/I:N/A:H		
CVE-2017-14123	2017-09-04T20:29:00.197	2025-04-20T01:37:25.860	"Zoho ManageEngine Firewall Analyzer 12200 has an unrestricted File Upload vulnerability in the ""Group Chat"" section. Any user can upload files with any extensions. By uploading a PHP file to the server, an attacker can cause it to execute in the server context, as demonstrated by /itplus/FileStorage/302/shell.jsp."	8.8	HIGH	CVSS:3.1/AV:N/AC:L/PR:L/UI:N/S:U/C:H/I:H/A:H		
CVE-2017-14126	2017-09-04T20:29:00.243	2025-04-20T01:37:25.860	The Participants Database plugin before 1.7.5.10 for WordPress has XSS.	4.3	MEDIUM	AV:N/AC:M/Au:N/C:N/I:P/A:N		
CVE-2017-14127	2017-09-04T20:29:00.290	2025-04-20T01:37:25.860	Command Injection in the Ping Module in the Web Interface on Technicolor TD5336 OI_Fw_v7 devices allows remote attackers to execute arbitrary OS commands as root via shell metacharacters in the pingAddr parameter to mnt_ping.cgi.	10.0	HIGH	AV:N/AC:L/Au:N/C:C/I:C/A:C		
CVE-2017-14128	2017-09-04T20:29:00.320	2025-04-20T01:37:25.860	The decode_line_info function in dwarf2.c in the Binary File Descriptor (BFD) library (aka libbfd), as distributed in GNU Binutils 2.29, allows remote attackers to cause a denial of service (read_1_byte heap-based buffer over-read and application crash) via a crafted ELF file.	4.3	MEDIUM	AV:N/AC:M/Au:N/C:N/I:N/A:P		
CVE-2017-14129	2017-09-04T20:29:00.350	2025-04-20T01:37:25.860	The read_section function in dwarf2.c in the Binary File Descriptor (BFD) library (aka libbfd), as distributed in GNU Binutils 2.29, allows remote attackers to cause a denial of service (parse_comp_unit heap-based buffer over-read and application crash) via a crafted ELF file.	4.3	MEDIUM	AV:N/AC:M/Au:N/C:N/I:N/A:P		
CVE-2017-14130	2017-09-04T20:29:00.397	2025-04-20T01:37:25.860	The _bfd_elf_parse_attributes function in elf-attrs.c in the Binary File Descriptor (BFD) library (aka libbfd), as distributed in GNU Binutils 2.29, allows remote attackers to cause a denial of service (_bfd_elf_attr_strdup heap-based buffer over-read and application crash) via a crafted ELF file.	4.3	MEDIUM	AV:N/AC:M/Au:N/C:N/I:N/A:P		
CVE-2017-14132	2017-09-04T20:29:00.430	2025-04-20T01:37:25.860	JasPer 1.900.8, 1.900.9, 1.900.10, 1.900.11, 1.900.12, 1.900.13, 1.900.14, 1.900.15, 1.900.16, 1.900.17, 1.900.18, 1.900.19, 1.900.20, 1.900.21, 1.900.22, 1.900.23, 1.900.24, 1.900.25, 1.900.26, 1.900.27, 1.900.28, 1.900.29, 1.900.30, 1.900.31, 2.0.0, 2.0.1, 2.0.2, 2.0.3, 2.0.4, 2.0.5, 2.0.6, 2.0.7, 2.0.8, 2.0.9, 2.0.10, 2.0.11, 2.0.12, 2.0.13, 2.0.14, 2.0.15, 2.0.16 allows remote attackers to cause a denial of service (heap-based buffer over-read and application crash) via a crafted image, related to the jas_image_ishomosamp function in libjasper/base/jas_image.c.	4.3	MEDIUM	AV:N/AC:M/Au:N/C:N/I:N/A:P		
CVE-2017-14135	2017-09-04T23:29:00.173	2025-04-20T01:37:25.860	enigma2-plugins/blob/master/webadmin/src/WebChilds/Script.py in the webadmin plugin for opendreambox 2.0.0 allows remote attackers to execute arbitrary OS commands via shell metacharacters in the command parameter to the /script URI.	10.0	HIGH	AV:N/AC:L/Au:N/C:C/I:C/A:C		
CVE-2017-14136	2017-09-04T23:29:00.220	2025-04-20T01:37:25.860	OpenCV (Open Source Computer Vision Library) 3.3 has an out-of-bounds write error in the function FillColorRow1 in utils.cpp when reading an image file by using cv::imread. NOTE: this vulnerability exists because of an incomplete fix for CVE-2017-12597.	4.3	MEDIUM	AV:N/AC:M/Au:N/C:N/I:N/A:P		
CVE-2017-14137	2017-09-04T23:29:00.267	2025-04-20T01:37:25.860	ReadWEBPImage in coders/webp.c in ImageMagick 7.0.6-5 has an issue where memory allocation is excessive because it depends only on a length field in a header.	5.0	MEDIUM	AV:N/AC:L/Au:N/C:N/I:N/A:P		
CVE-2017-14138	2017-09-04T23:29:00.313	2025-04-20T01:37:25.860	ImageMagick 7.0.6-5 has a memory leak vulnerability in ReadWEBPImage in coders/webp.c because memory is not freed in certain error cases, as demonstrated by VP8 errors.	7.5	HIGH	AV:N/AC:L/Au:N/C:P/I:P/A:P		
CVE-2017-14139	2017-09-04T23:29:00.347	2025-04-20T01:37:25.860	ImageMagick 7.0.6-2 has a memory leak vulnerability in WriteMSLImage in coders/msl.c.	4.3	MEDIUM	AV:N/AC:M/Au:N/C:N/I:N/A:P		
CVE-2017-1000083	2017-09-05T06:29:00.180	2025-04-20T01:37:25.860	"backend/comics/comics-document.c (aka the comic book backend) in GNOME Evince before 3.24.1 allows remote attackers to execute arbitrary commands via a .cbt file that is a TAR archive containing a filename beginning with a ""--"" command-line option substring, as demonstrated by a --checkpoint-action=exec=bash at the beginning of the filename."	6.8	MEDIUM	AV:N/AC:M/Au:N/C:P/I:P/A:P		
CVE-2017-14108	2017-09-05T06:29:00.243	2025-04-20T01:37:25.860	libgedit.a in GNOME gedit through 3.22.1 allows remote attackers to cause a denial of service (CPU consumption) via a file that begins with many '\0' characters.	7.1	HIGH	AV:N/AC:M/Au:N/C:N/I:N/A:C		
CVE-2017-14140	2017-09-05T06:29:00.273	2025-04-20T01:37:25.860	The move_pages system call in mm/migrate.c in the Linux kernel before 4.12.9 doesn't check the effective uid of the target process, enabling a local attacker to learn the memory layout of a setuid executable despite ASLR.	2.1	LOW	AV:L/AC:L/Au:N/C:P/I:N/A:N		
CVE-2017-14145	2017-09-05T07:29:00.180	2025-04-20T01:37:25.860	HelpDEZk 1.1.1 has SQL Injection in app\modules\admin\controllers\loginController.php via the admin/login/getWarningInfo/id/ PATH_INFO, related to the selectWarning function.	7.5	HIGH	AV:N/AC:L/Au:N/C:P/I:P/A:P		
CVE-2017-14146	2017-09-05T07:29:00.243	2025-04-20T01:37:25.860	HelpDEZk 1.1.1 allows remote authenticated users to execute arbitrary PHP code by uploading a .php attachment and then requesting it in the helpdezk\app\uploads\helpdezk\attachments\ directory.	6.5	MEDIUM	AV:N/AC:L/Au:S/C:P/I:P/A:P		
CVE-2017-14149	2017-09-05T07:29:00.273	2025-04-20T01:37:25.860	"GoAhead 3.4.0 through 3.6.5 has a NULL Pointer Dereference in the websDecodeUrl function in http.c, leading to a crash for a ""POST / HTTP/1.1"" request."	5.0	MEDIUM	AV:N/AC:L/Au:N/C:N/I:N/A:P		
CVE-2016-3086	2017-09-05T13:29:00.187	2025-04-20T01:37:25.860	The YARN NodeManager in Apache Hadoop 2.6.x before 2.6.5 and 2.7.x before 2.7.3 can leak the password for credential store provider used by the NodeManager to YARN Applications.	5.0	MEDIUM	AV:N/AC:L/Au:N/C:P/I:N/A:N		
CVE-2017-14151	2017-09-05T16:29:00.213	2025-04-20T01:37:25.860	An off-by-one error was discovered in opj_tcd_code_block_enc_allocate_data in lib/openjp2/tcd.c in OpenJPEG 2.2.0. The vulnerability causes an out-of-bounds write, which may lead to remote denial of service (heap-based buffer overflow affecting opj_mqc_flush in lib/openjp2/mqc.c and opj_t1_encode_cblk in lib/openjp2/t1.c) or possibly remote code execution.	8.8	HIGH	CVSS:3.1/AV:N/AC:L/PR:N/UI:R/S:U/C:H/I:H/A:H		
CVE-2017-14152	2017-09-05T16:29:00.243	2025-04-20T01:37:25.860	A mishandled zero case was discovered in opj_j2k_set_cinema_parameters in lib/openjp2/j2k.c in OpenJPEG 2.2.0. The vulnerability causes an out-of-bounds write, which may lead to remote denial of service (heap-based buffer overflow affecting opj_write_bytes_LE in lib/openjp2/cio.c and opj_j2k_write_sot in lib/openjp2/j2k.c) or possibly remote code execution.	8.8	HIGH	CVSS:3.1/AV:N/AC:L/PR:N/UI:R/S:U/C:H/I:H/A:H		
CVE-2017-14156	2017-09-05T17:29:00.200	2025-04-20T01:37:25.860	The atyfb_ioctl function in drivers/video/fbdev/aty/atyfb_base.c in the Linux kernel through 4.12.10 does not initialize a certain data structure, which allows local users to obtain sensitive information from kernel stack memory by reading locations associated with padding bytes.	2.1	LOW	AV:L/AC:L/Au:N/C:P/I:N/A:N		
