CVE ID	Published Date	Last Modified Date	Description	Base Score	Base Severity	Vector String	Vendor	Product
CVE-2019-0073	2019-10-09T20:15:18.287	2024-11-21T04:16:11.720	"The PKI keys exported using the command ""run request security pki key-pair export"" on Junos OS may have insecure file permissions. This may allow another user on the Junos OS device with shell access to read them. This issue affects: Juniper Networks Junos OS 15.1X49 versions prior to 15.1X49-D180; 17.3 versions prior to 17.3R3-S7; 17.4 versions prior to 17.4R2-S8, 17.4R3; 18.1 versions prior to 18.1R3-S8; 18.2 versions prior to 18.2R3; 18.3 versions prior to 18.3R2; 18.4 versions prior to 18.4R2."	6.6	MEDIUM	CVSS:3.1/AV:L/AC:L/PR:L/UI:R/S:U/C:H/I:H/A:N		
CVE-2019-0074	2019-10-09T20:15:18.393	2024-11-21T04:16:11.870	A path traversal vulnerability in NFX150 Series and QFX10K Series, EX9200 Series, MX Series and PTX Series devices with Next-Generation Routing Engine (NG-RE) allows a local authenticated user to read sensitive system files. This issue only affects NFX150 Series and QFX10K Series, EX9200 Series, MX Series and PTX Series with Next-Generation Routing Engine (NG-RE) which uses vmhost. This issue affects Juniper Networks Junos OS on NFX150 Series and QFX10K, EX9200 Series, MX Series and PTX Series with NG-RE and vmhost: 15.1F versions prior to 15.1F6-S12 16.1 versions starting from 16.1R6 and later releases, including the Service Releases, prior to 16.1R6-S6, 16.1R7-S3; 17.1 versions prior to 17.1R3; 17.2 versions starting from 17.2R1-S3, 17.2R3 and later releases, including the Service Releases, prior to 17.2R3-S1; 17.3 versions starting from 17.3R1-S1, 17.3R2 and later releases, including the Service Releases, prior to 17.3R3-S3; 17.4 versions starting from 17.4R1 and later releases, including the Service Releases, prior to 17.4R1-S6, 17.4R2-S2, 17.4R3; 18.1 versions prior to 18.1R2-S4, 18.1R3-S3; 18.2 versions prior to 18.2R2; 18.2X75 versions prior to 18.2X75-D40; 18.3 versions prior to 18.3R1-S2, 18.3R2; 18.4 versions prior to 18.4R1-S1, 18.4R2. This issue does not affect: Juniper Networks Junos OS 15.1 and 16.2.	5.5	MEDIUM	CVSS:3.1/AV:L/AC:L/PR:L/UI:N/S:U/C:H/I:N/A:N		
CVE-2019-0075	2019-10-09T20:15:18.520	2024-11-21T04:16:12.037	A vulnerability in the srxpfe process on Protocol Independent Multicast (PIM) enabled SRX series devices may lead to crash of the srxpfe process and an FPC reboot while processing (PIM) messages. Sustained receipt of these packets may lead to an extended denial of service condition. Affected releases are Juniper Networks Junos OS on SRX Series: 12.3X48 versions prior to 12.3X48-D80; 15.1X49 versions prior to 15.1X49-D160; 17.3 versions prior to 17.3R3-S7 17.4 versions prior to 17.4R2-S8, 17.4R3; 18.1 versions prior to 18.1R3-S8; 18.2 versions prior to 18.2R2; 18.3 versions prior to 18.3R2.	7.5	HIGH	CVSS:3.1/AV:N/AC:L/PR:N/UI:N/S:U/C:N/I:N/A:H		
CVE-2019-15715	2019-10-09T20:15:23.207	2024-11-21T04:29:18.840	MantisBT before 1.3.20 and 2.22.1 allows Post Authentication Command Injection, leading to Remote Code Execution.	7.2	HIGH	CVSS:3.1/AV:N/AC:L/PR:H/UI:N/S:U/C:H/I:H/A:H		
CVE-2019-16905	2019-10-09T20:15:23.503	2025-04-23T16:15:20.437	OpenSSH 7.7 through 7.9 and 8.x before 8.1, when compiled with an experimental key type, has a pre-authentication integer overflow if a client or server is configured to use a crafted XMSS key. This leads to memory corruption and local code execution because of an error in the XMSS key parsing algorithm. NOTE: the XMSS implementation is considered experimental in all released OpenSSH versions, and there is no supported way to enable it when building portable OpenSSH.	7.8	HIGH	CVSS:3.1/AV:L/AC:L/PR:L/UI:N/S:U/C:H/I:H/A:H		
CVE-2019-17112	2019-10-09T20:15:23.690	2024-11-21T04:31:42.907	"An issue was discovered in Zoho ManageEngine DataSecurity Plus before 5.0.1 5012. An exposed service allows a basic user (""Operator"" access level) to access the configuration file of the mail server (except for the password)."	4.3	MEDIUM	CVSS:3.1/AV:N/AC:L/PR:L/UI:N/S:U/C:L/I:N/A:N		
CVE-2019-3765	2019-10-09T20:15:27.800	2024-11-21T04:42:29.283	Dell EMC Avamar Server versions 7.4.1, 7.5.0, 7.5.1, 18.2 and 19.1 and Dell EMC Integrated Data Protection Appliance (IDPA) versions 2.0, 2.1, 2.2, 2.3 and 2.4 contain an Incorrect Permission Assignment for Critical Resource vulnerability. A remote authenticated malicious user potentially could exploit this vulnerability to view or modify sensitive backup data. This could be used to make backups corrupt or potentially to trick a user into restoring a backup with malicious files in place.	8.1	HIGH	CVSS:3.1/AV:N/AC:L/PR:L/UI:N/S:U/C:H/I:H/A:N		
CVE-2019-9535	2019-10-09T20:15:33.363	2024-11-21T04:51:48.433	A vulnerability exists in the way that iTerm2 integrates with tmux's control mode, which may allow an attacker to execute arbitrary commands by providing malicious output to the terminal. This affects versions of iTerm2 up to and including 3.3.5. This vulnerability may allow an attacker to execute arbitrary commands on their victim's computer by providing malicious output to the terminal. It could be exploited using command-line utilities that print attacker-controlled content.	9.8	CRITICAL	CVSS:3.1/AV:N/AC:L/PR:N/UI:N/S:U/C:H/I:H/A:H		
CVE-2019-15014	2019-10-09T21:15:12.600	2024-11-21T04:27:52.547	A command injection vulnerability exists in the Zingbox Inspector versions 1.286 and earlier, that allows for an authenticated user to execute arbitrary system commands in the CLI.	8.8	HIGH	CVSS:3.1/AV:N/AC:L/PR:L/UI:N/S:U/C:H/I:H/A:H		
CVE-2019-15015	2019-10-09T21:15:12.680	2024-11-21T04:27:52.657	In the Zingbox Inspector, versions 1.294 and earlier, hardcoded credentials for root and inspector user accounts are present in the system software, which can result in unauthorized users gaining access to the system.	8.4	HIGH	CVSS:3.1/AV:L/AC:L/PR:N/UI:N/S:U/C:H/I:H/A:H		
CVE-2019-15016	2019-10-09T21:15:12.757	2024-11-21T04:27:52.773	An SQL injection vulnerability exists in the management interface of Zingbox Inspector versions 1.288 and earlier, that allows for unsanitized data provided by an authenticated user to be passed from the web UI into the database.	8.8	HIGH	CVSS:3.1/AV:N/AC:L/PR:L/UI:N/S:U/C:H/I:H/A:H		
CVE-2019-15017	2019-10-09T21:15:12.837	2024-11-21T04:27:52.883	The SSH service is enabled on the Zingbox Inspector versions 1.294 and earlier, exposing SSH to the local network. When combined with PAN-SA-2019-0027, this can allow an attacker to authenticate to the service using hardcoded credentials.	8.4	HIGH	CVSS:3.1/AV:L/AC:L/PR:N/UI:N/S:U/C:H/I:H/A:H		
CVE-2019-15018	2019-10-09T21:15:12.930	2024-11-21T04:27:52.990	A security vulnerability exists in the Zingbox Inspector versions 1.280 and earlier, where authentication is not required when binding the Inspector instance to a different customer tenant.	7.5	HIGH	CVSS:3.1/AV:N/AC:L/PR:N/UI:N/S:U/C:N/I:H/A:N		
CVE-2019-15019	2019-10-09T21:15:13.007	2024-11-21T04:27:53.100	A security vulnerability exists in the Zingbox Inspector versions 1.294 and earlier, that could allow an attacker to supply an invalid software update image to the Zingbox Inspector.	9.8	CRITICAL	CVSS:3.1/AV:N/AC:L/PR:N/UI:N/S:U/C:H/I:H/A:H		
CVE-2019-15020	2019-10-09T21:15:13.070	2024-11-21T04:27:53.210	A security vulnerability exists in the Zingbox Inspector versions 1.293 and earlier, that could allow an attacker to supply an invalid software update image to the Zingbox Inspector that could result in command injection.	9.8	CRITICAL	CVSS:3.1/AV:N/AC:L/PR:N/UI:N/S:U/C:H/I:H/A:H		
CVE-2019-15021	2019-10-09T21:15:13.133	2024-11-21T04:27:53.323	A security vulnerability exists in the Zingbox Inspector versions 1.294 and earlier, that can allow an attacker to easily identify instances of Zingbox Inspectors in a local area network.	5.3	MEDIUM	CVSS:3.1/AV:N/AC:L/PR:N/UI:N/S:U/C:L/I:N/A:N		
CVE-2019-15022	2019-10-09T21:15:13.210	2024-11-21T04:27:53.433	A security vulnerability exists in Zingbox Inspector versions 1.294 and earlier, that allows for the Inspector to be susceptible to ARP spoofing.	7.5	HIGH	CVSS:3.1/AV:N/AC:L/PR:N/UI:N/S:U/C:N/I:H/A:N		
CVE-2019-15023	2019-10-09T21:15:13.273	2024-11-21T04:27:53.543	A security vulnerability exists in Zingbox Inspector versions 1.294 and earlier, that results in passwords for 3rd party integrations being stored in cleartext in device configuration.	7.5	HIGH	CVSS:3.1/AV:N/AC:L/PR:N/UI:N/S:U/C:H/I:N/A:N		
CVE-2019-1584	2019-10-09T21:15:13.490	2024-11-21T04:36:51.517	A security vulnerability exists in Zingbox Inspector version 1.293 and earlier, that allows for remote code execution if the Inspector were sent a malicious command from the Zingbox cloud, or if the Zingbox Inspector were tampered with to connect to an attacker's cloud endpoint.	9.8	CRITICAL	CVSS:3.1/AV:N/AC:L/PR:N/UI:N/S:U/C:H/I:H/A:H		
CVE-2019-5045	2019-10-09T21:15:13.570	2024-11-21T04:44:14.490	A specifically crafted jpeg2000 file embedded in a PDF file can lead to a heap corruption when opening a PDF document in NitroPDF 12.12.1.522. With careful memory manipulation, this can lead to arbitrary code execution. In order to trigger this vulnerability, the victim would need to open the malicious file.	7.8	HIGH	CVSS:3.1/AV:L/AC:L/PR:N/UI:R/S:U/C:H/I:H/A:H		
CVE-2019-5046	2019-10-09T21:15:13.663	2024-11-21T04:44:14.607	A specifically crafted jpeg2000 file embedded in a PDF file can lead to a heap corruption when opening a PDF document in NitroPDF 12.12.1.522. With careful memory manipulation, this can lead to arbitrary code execution. In order to trigger this vulnerability, the victim would need to open the malicious file.	7.8	HIGH	CVSS:3.1/AV:L/AC:L/PR:N/UI:R/S:U/C:H/I:H/A:H		
CVE-2019-5047	2019-10-09T21:15:13.740	2024-11-21T04:44:14.723	An exploitable Use After Free vulnerability exists in the CharProcs parsing functionality of NitroPDF. A specially crafted PDF can cause a type confusion, resulting in a Use After Free. An attacker can craft a malicious PDF to trigger this vulnerability.	7.8	HIGH	CVSS:3.1/AV:L/AC:L/PR:N/UI:R/S:U/C:H/I:H/A:H		
CVE-2019-5048	2019-10-09T21:15:13.803	2024-11-21T04:44:14.840	A specifically crafted PDF file can lead to a heap corruption when opened in NitroPDF 12.12.1.522. With careful memory manipulation, this can lead to arbitrary code execution. In order to trigger this vulnerability, the victim would need to open the malicious file.	7.8	HIGH	CVSS:3.1/AV:L/AC:L/PR:N/UI:R/S:U/C:H/I:H/A:H		
CVE-2019-5050	2019-10-09T21:15:13.867	2024-11-21T04:44:15.063	A specifically crafted PDF file can lead to a heap corruption when opened in NitroPDF 12.12.1.522. With careful memory manipulation, this can lead to arbitrary code execution. In order to trigger this vulnerability, the victim would need to open the malicious file.	7.8	HIGH	CVSS:3.1/AV:L/AC:L/PR:N/UI:R/S:U/C:H/I:H/A:H		
CVE-2019-5053	2019-10-09T21:15:13.947	2024-11-21T04:44:15.470	An exploitable use-after-free vulnerability exists in the Length parsing function of NitroPDF. A specially crafted PDF can cause a type confusion, resulting in a use-after-free condition. An attacker can craft a malicious PDF to trigger this vulnerability.	7.8	HIGH	CVSS:3.1/AV:L/AC:L/PR:N/UI:R/S:U/C:H/I:H/A:H		
CVE-2019-17109	2019-10-09T22:15:10.577	2024-11-21T04:31:42.737	Koji through 1.18.0 allows remote Directory Traversal, with resultant Privilege Escalation.	6.5	MEDIUM	CVSS:3.1/AV:N/AC:L/PR:L/UI:N/S:U/C:N/I:H/A:N		
CVE-2019-17365	2019-10-09T22:15:10.670	2025-01-15T14:29:23.370	Nix through 2.3 allows local users to gain access to an arbitrary user's account because the parent directory of the user-profile directories is world writable.	7.8	HIGH	CVSS:3.1/AV:L/AC:L/PR:L/UI:N/S:U/C:H/I:H/A:H		
CVE-2019-17366	2019-10-09T22:15:10.733	2024-11-21T04:32:11.563	Citrix Application Delivery Management (ADM) 12.1 before build 54.13 has Incorrect Access Control.	8.8	HIGH	CVSS:3.1/AV:N/AC:L/PR:L/UI:N/S:U/C:H/I:H/A:H		
CVE-2019-17414	2019-10-09T22:15:10.827	2024-11-21T04:32:17.250	"tinylcy Vino through 2017-12-15 allows remote attackers to cause a denial of service (""vn_get_string error: Resource temporarily unavailable"" error and daemon crash) via a long URL."	7.5	HIGH	CVSS:3.1/AV:N/AC:L/PR:N/UI:N/S:U/C:N/I:N/A:H		
CVE-2019-17415	2019-10-09T22:15:10.887	2024-11-21T04:32:17.383	A Structured Exception Handler (SEH) based buffer overflow in File Sharing Wizard 1.5.0 26-8-2008 allows remote unauthenticated attackers to execute arbitrary code via the HTTP DELETE method, a similar issue to CVE-2019-16724 and CVE-2010-2331.	9.8	CRITICAL	CVSS:3.1/AV:N/AC:L/PR:N/UI:N/S:U/C:H/I:H/A:H		
CVE-2019-5699	2019-10-09T22:15:10.950	2024-11-21T04:45:22.170	NVIDIA Shield TV Experience prior to v8.0.1, NVIDIA Tegra bootloader contains a vulnerability where the software performs an incorrect bounds check, which may lead to buffer overflow resulting in escalation of privileges and code execution. escalation of privileges, and information disclosure, code execution, denial of service, or escalation of privileges.	7.8	HIGH	CVSS:3.1/AV:L/AC:L/PR:L/UI:N/S:U/C:H/I:H/A:H		
CVE-2019-5700	2019-10-09T22:15:11.030	2024-11-21T04:45:22.280	NVIDIA Shield TV Experience prior to v8.0.1, NVIDIA Tegra software contains a vulnerability in the bootloader, where it does not validate the fields of the boot image, which may lead to code execution, denial of service, escalation of privileges, and information disclosure.	7.8	HIGH	CVSS:3.1/AV:L/AC:L/PR:L/UI:N/S:U/C:H/I:H/A:H		
CVE-2017-2676	2019-10-09T23:27:04.773	2023-11-07T02:43:55.143	Rejected reason: DO NOT USE THIS CANDIDATE NUMBER. ConsultIDs: none. Reason: The CNA or individual who requested this candidate did not associate it with any vulnerability during 2017. Notes: none					
CVE-2017-2677	2019-10-09T23:27:04.837	2023-11-07T02:43:55.580	Rejected reason: DO NOT USE THIS CANDIDATE NUMBER. ConsultIDs: none. Reason: The CNA or individual who requested this candidate did not associate it with any vulnerability during 2017. Notes: none					
CVE-2017-2678	2019-10-09T23:27:04.897	2023-11-07T02:43:55.963	Rejected reason: DO NOT USE THIS CANDIDATE NUMBER. ConsultIDs: none. Reason: The CNA or individual who requested this candidate did not associate it with any vulnerability during 2017. Notes: none					
CVE-2017-2679	2019-10-09T23:27:04.960	2023-11-07T02:43:56.347	Rejected reason: DO NOT USE THIS CANDIDATE NUMBER. ConsultIDs: none. Reason: The CNA or individual who requested this candidate did not associate it with any vulnerability during 2017. Notes: none					
CVE-2019-17417	2019-10-10T01:06:09.373	2024-11-21T04:32:17.520	PbootCMS 2.0.2 allows XSS via vectors involving the Pboot/admin.php?p=/Single/index/mcode/1 and Pboot/?contact/ URIs.	4.8	MEDIUM	CVSS:3.1/AV:N/AC:L/PR:H/UI:R/S:C/C:L/I:L/A:N		
CVE-2019-17418	2019-10-10T01:06:09.437	2024-11-21T04:32:17.650	An issue was discovered in MetInfo 7.0. There is SQL injection via the admin/?n=language&c=language_general&a=doSearchParameter appno parameter, a different issue than CVE-2019-16997.	7.2	HIGH	CVSS:3.1/AV:N/AC:L/PR:H/UI:N/S:U/C:H/I:H/A:H		
CVE-2019-17419	2019-10-10T01:06:09.497	2024-11-21T04:32:17.777	An issue was discovered in MetInfo 7.0. There is SQL injection via the admin/?n=user&c=admin_user&a=doGetUserInfo id parameter.	7.2	HIGH	CVSS:3.1/AV:N/AC:L/PR:H/UI:N/S:U/C:H/I:H/A:H		
CVE-2019-17420	2019-10-10T01:06:09.560	2024-11-21T04:32:17.907	In OISF LibHTP before 0.5.31, as used in Suricata 4.1.4 and other products, an HTTP protocol parsing error causes the http_header signature to not alert on a response with a single \r\n ending.	5.3	MEDIUM	CVSS:3.1/AV:N/AC:L/PR:N/UI:N/S:U/C:N/I:L/A:N		
CVE-2019-17426	2019-10-10T02:05:46.833	2024-11-21T04:32:18.333	"Automattic Mongoose through 5.7.4 allows attackers to bypass access control (in some applications) because any query object with a _bsontype attribute is ignored. For example, adding ""_bsontype"":""a"" can sometimes interfere with a query filter. NOTE: this CVE is about Mongoose's failure to work around this _bsontype special case that exists in older versions of the bson parser (aka the mongodb/js-bson project)."	9.1	CRITICAL	CVSS:3.1/AV:N/AC:L/PR:N/UI:N/S:U/C:H/I:H/A:N		
CVE-2019-17427	2019-10-10T02:05:46.897	2024-11-21T04:32:18.470	In Redmine before 3.4.11 and 4.0.x before 4.0.4, persistent XSS exists due to textile formatting errors.	6.1	MEDIUM	CVSS:3.1/AV:N/AC:L/PR:N/UI:R/S:C/C:L/I:L/A:N		
CVE-2019-17070	2019-10-10T12:10:19.730	2024-11-21T04:31:38.800	The liquid-speech-balloon (aka LIQUID SPEECH BALLOON) plugin before 1.0.7 for WordPress allows XSS with Internet Explorer.	6.1	MEDIUM	CVSS:3.1/AV:N/AC:L/PR:N/UI:R/S:C/C:L/I:L/A:N		
CVE-2019-17071	2019-10-10T12:10:19.857	2024-11-21T04:31:38.940	The client-dash (aka Client Dash) plugin 2.1.4 for WordPress allows XSS.	6.1	MEDIUM	CVSS:3.1/AV:N/AC:L/PR:N/UI:R/S:C/C:L/I:L/A:N		
CVE-2019-17072	2019-10-10T12:10:19.917	2024-11-21T04:31:39.077	The new-contact-form-widget (aka Contact Form Widget - Contact Query, Form Maker) plugin 1.0.9 for WordPress has SQL Injection via all-query-page.php.	9.8	CRITICAL	CVSS:3.1/AV:N/AC:L/PR:N/UI:N/S:U/C:H/I:H/A:H		
CVE-2019-17429	2019-10-10T12:10:23.340	2024-11-21T04:32:18.750	Adhouma CMS through 2019-10-09 has SQL Injection via the post.php p_id parameter.	9.8	CRITICAL	CVSS:3.1/AV:N/AC:L/PR:N/UI:N/S:U/C:H/I:H/A:H		
CVE-2019-17430	2019-10-10T12:10:23.403	2024-11-21T04:32:18.873	EyouCms through 2019-07-11 has XSS related to the login.php web_recordnum parameter.	6.1	MEDIUM	CVSS:3.1/AV:N/AC:L/PR:N/UI:R/S:C/C:L/I:L/A:N		
CVE-2019-17431	2019-10-10T12:15:09.577	2024-11-21T04:32:19.003	An issue was discovered in fastadmin 1.0.0.20190705_beta. There is a public/index.php/admin/auth/admin/add CSRF vulnerability.	8.8	HIGH	CVSS:3.1/AV:N/AC:L/PR:N/UI:R/S:U/C:H/I:H/A:H		
CVE-2019-17432	2019-10-10T12:15:09.657	2024-11-21T04:32:19.140	An issue was discovered in fastadmin 1.0.0.20190705_beta. There is a public/admin/general.config/edit CSRF vulnerability, as demonstrated by resultant XSS via the row&#91;name&#93; parameter.	6.5	MEDIUM	CVSS:3.1/AV:N/AC:L/PR:N/UI:R/S:U/C:N/I:H/A:N		
CVE-2019-17433	2019-10-10T12:15:09.733	2024-11-21T04:32:19.277	"z-song laravel-admin 1.7.3 has XSS via the Slug or Name on the Roles screen, because of mishandling on the ""Operation log"" screen."	4.8	MEDIUM	CVSS:3.1/AV:N/AC:L/PR:H/UI:R/S:C/C:L/I:L/A:N		
CVE-2019-17434	2019-10-10T12:15:09.813	2024-11-21T04:32:19.410	LavaLite through 5.7 has XSS via a crafted account name that is mishandled on the Manage Clients screen.	5.4	MEDIUM	CVSS:3.1/AV:N/AC:L/PR:L/UI:R/S:C/C:L/I:L/A:N		
CVE-2019-0608	2019-10-10T14:15:14.157	2024-11-21T04:16:57.290	A spoofing vulnerability exists when Microsoft Browsers does not properly parse HTTP content, aka 'Microsoft Browser Spoofing Vulnerability'. This CVE ID is unique from CVE-2019-1357.	4.3	MEDIUM	CVSS:3.1/AV:N/AC:L/PR:N/UI:R/S:U/C:N/I:L/A:N		
CVE-2019-10923	2019-10-10T14:15:14.503	2024-11-21T04:20:09.600	An attacker with network access to an affected product may cause a denial of service condition by breaking the real-time synchronization (IRT) of the affected installation.	7.5	HIGH	CVSS:3.1/AV:N/AC:L/PR:N/UI:N/S:U/C:N/I:N/A:H		
CVE-2019-10936	2019-10-10T14:15:14.707	2024-11-21T04:20:11.257	"Affected devices improperly handle large amounts of specially crafted UDP packets.

This could allow an unauthenticated remote attacker to trigger a denial of service condition."	7.5	HIGH	CVSS:3.1/AV:N/AC:L/PR:N/UI:N/S:U/C:N/I:N/A:H		
CVE-2019-13921	2019-10-10T14:15:14.783	2024-11-21T04:25:42.200	A vulnerability has been identified in SIMATIC WinAC RTX (F) 2010 (All versions < SP3 Update 1). Affected versions of the software contain a vulnerability that could allow an unauthenticated attacker to trigger a denial-of-service condition. The vulnerability can be triggered if a large HTTP request is sent to the executing service. The security vulnerability could be exploited by an attacker with network access to the affected systems. Successful exploitation requires no system privileges and no user interaction. An attacker could use the vulnerability to compromise availability of the service provided by the software.	7.5	HIGH	CVSS:3.1/AV:N/AC:L/PR:N/UI:N/S:U/C:N/I:N/A:H		
CVE-2019-13929	2019-10-10T14:15:14.860	2024-11-21T04:25:43.067	A vulnerability has been identified in SIMATIC IT UADM (All versions < V1.3). An authenticated remote attacker with network access to port 1434/tcp of SIMATIC IT UADM could potentially recover a password that can be used to gain read and write access to the related TeamCenter station. The security vulnerability could be exploited only if the attacker is authenticated. No user interaction is required to exploit this security vulnerability. Successful exploitation of the security vulnerability compromises the confidentiality of the targeted system. At the time of advisory publication no public exploitation of this security vulnerability was known.	6.5	MEDIUM	CVSS:3.1/AV:N/AC:L/PR:L/UI:N/S:U/C:H/I:N/A:N		
CVE-2019-1060	2019-10-10T14:15:14.957	2024-11-21T04:35:56.317	A remote code execution vulnerability exists when the Microsoft XML Core Services MSXML parser processes user input, aka 'MS XML Remote Code Execution Vulnerability'.	8.8	HIGH	CVSS:3.1/AV:N/AC:L/PR:N/UI:R/S:U/C:H/I:H/A:H		
CVE-2019-1070	2019-10-10T14:15:15.003	2024-11-21T04:35:57.387	A cross-site-scripting (XSS) vulnerability exists when Microsoft SharePoint Server does not properly sanitize a specially crafted web request to an affected SharePoint server, aka 'Microsoft Office SharePoint XSS Vulnerability'.	5.4	MEDIUM	CVSS:3.1/AV:N/AC:L/PR:L/UI:R/S:C/C:L/I:L/A:N		
CVE-2019-1166	2019-10-10T14:15:15.080	2024-11-21T04:36:09.543	A tampering vulnerability exists in Microsoft Windows when a man-in-the-middle attacker is able to successfully bypass the NTLM MIC (Message Integrity Check) protection, aka 'Windows NTLM Tampering Vulnerability'.	5.9	MEDIUM	CVSS:3.1/AV:N/AC:H/PR:N/UI:N/S:U/C:N/I:H/A:N		
CVE-2019-1230	2019-10-10T14:15:15.173	2024-11-21T04:36:17.533	An information disclosure vulnerability exists when the Windows Hyper-V Network Switch on a host operating system fails to properly validate input from an authenticated user on a guest operating system, aka 'Hyper-V Information Disclosure Vulnerability'.	6.8	MEDIUM	CVSS:3.1/AV:N/AC:L/PR:H/UI:N/S:C/C:H/I:N/A:N		
CVE-2019-1238	2019-10-10T14:15:15.237	2024-11-21T04:36:18.533	A remote code execution vulnerability exists in the way that the VBScript engine handles objects in memory, aka 'VBScript Remote Code Execution Vulnerability'. This CVE ID is unique from CVE-2019-1239.	6.4	MEDIUM	CVSS:3.1/AV:N/AC:H/PR:H/UI:R/S:U/C:H/I:H/A:H		
CVE-2019-1239	2019-10-10T14:15:15.300	2024-11-21T04:36:18.667	A remote code execution vulnerability exists in the way that the VBScript engine handles objects in memory, aka 'VBScript Remote Code Execution Vulnerability'. This CVE ID is unique from CVE-2019-1238.	7.5	HIGH	CVSS:3.1/AV:N/AC:H/PR:N/UI:R/S:U/C:H/I:H/A:H		
CVE-2019-1307	2019-10-10T14:15:15.360	2024-11-21T04:36:26.817	A remote code execution vulnerability exists in the way that the Chakra scripting engine handles objects in memory in Microsoft Edge, aka 'Chakra Scripting Engine Memory Corruption Vulnerability'. This CVE ID is unique from CVE-2019-1308, CVE-2019-1335, CVE-2019-1366.	7.5	HIGH	CVSS:3.1/AV:N/AC:H/PR:N/UI:R/S:U/C:H/I:H/A:H		
CVE-2019-1308	2019-10-10T14:15:15.423	2024-11-21T04:36:26.970	A remote code execution vulnerability exists in the way that the Chakra scripting engine handles objects in memory in Microsoft Edge, aka 'Chakra Scripting Engine Memory Corruption Vulnerability'. This CVE ID is unique from CVE-2019-1307, CVE-2019-1335, CVE-2019-1366.	7.5	HIGH	CVSS:3.1/AV:N/AC:H/PR:N/UI:R/S:U/C:H/I:H/A:H		
CVE-2019-1311	2019-10-10T14:15:15.487	2024-11-21T04:36:27.327	A remote code execution vulnerability exists when the Windows Imaging API improperly handles objects in memory, aka 'Windows Imaging API Remote Code Execution Vulnerability'.	7.8	HIGH	CVSS:3.1/AV:L/AC:L/PR:N/UI:R/S:U/C:H/I:H/A:H		
CVE-2019-1313	2019-10-10T14:15:15.567	2024-11-21T04:36:27.467	An information disclosure vulnerability exists in Microsoft SQL Server Management Studio (SSMS) when it improperly enforces permissions, aka 'SQL Server Management Studio Information Disclosure Vulnerability'. This CVE ID is unique from CVE-2019-1376.	6.5	MEDIUM	CVSS:3.1/AV:N/AC:L/PR:L/UI:N/S:U/C:H/I:N/A:N		
CVE-2019-1314	2019-10-10T14:15:15.673	2024-11-21T04:36:27.577	A security feature bypass vulnerability exists in Windows 10 Mobile when Cortana allows a user to access files and folders through the locked screen, aka 'Windows 10 Mobile Security Feature Bypass Vulnerability'.	6.8	MEDIUM	CVSS:3.1/AV:P/AC:L/PR:N/UI:N/S:U/C:H/I:H/A:H		
CVE-2019-1315	2019-10-10T14:15:15.737	2025-04-08T15:44:44.283	An elevation of privilege vulnerability exists when Windows Error Reporting manager improperly handles hard links, aka 'Windows Error Reporting Manager Elevation of Privilege Vulnerability'. This CVE ID is unique from CVE-2019-1339, CVE-2019-1342.	7.8	HIGH	CVSS:3.1/AV:L/AC:L/PR:L/UI:N/S:U/C:H/I:H/A:H		
CVE-2019-1316	2019-10-10T14:15:15.800	2024-11-21T04:36:27.823	An elevation of privilege vulnerability exists in Microsoft Windows Setup when it does not properly handle privileges, aka 'Microsoft Windows Setup Elevation of Privilege Vulnerability'.	7.8	HIGH	CVSS:3.1/AV:L/AC:L/PR:L/UI:N/S:U/C:H/I:H/A:H		
CVE-2019-1317	2019-10-10T14:15:15.860	2024-11-21T04:36:27.953	A denial of service vulnerability exists when Windows improperly handles hard links, aka 'Microsoft Windows Denial of Service Vulnerability'.	7.3	HIGH	CVSS:3.1/AV:L/AC:L/PR:L/UI:N/S:C/C:N/I:L/A:H		
