CVE ID	Published Date	Last Modified Date	Description	Base Score	Base Severity	Vector String	Vendor	Product
CVE-2019-10475	2019-10-23T13:15:11.487	2024-11-21T04:19:12.967	A reflected cross-site scripting vulnerability in Jenkins build-metrics Plugin allows attackers to inject arbitrary HTML and JavaScript into web pages provided by this plugin.	6.1	MEDIUM	CVSS:3.1/AV:N/AC:L/PR:N/UI:R/S:C/C:L/I:L/A:N		
CVE-2019-10476	2019-10-23T13:15:11.550	2024-11-21T04:19:13.080	Jenkins Zulip Plugin 1.1.0 and earlier stored credentials unencrypted in its global configuration file on the Jenkins master where they could be viewed by users with access to the master file system.	7.8	HIGH	CVSS:3.1/AV:L/AC:L/PR:L/UI:N/S:U/C:H/I:H/A:H		
CVE-2019-18219	2019-10-23T14:15:10.387	2024-11-21T04:32:51.590	Sitemagic CMS 4.4.1 is affected by a Cross-Site-Scripting (XSS) vulnerability, as it fails to validate user input. The affected components (index.php, upgrade.php) allow for JavaScript injection within both GET or POST requests, via a crafted URL or via the UpgradeMode POST parameter.	6.1	MEDIUM	CVSS:3.1/AV:N/AC:L/PR:N/UI:R/S:C/C:L/I:L/A:N		
CVE-2019-18220	2019-10-23T14:15:10.463	2024-11-21T04:32:51.740	Sitemagic CMS 4.4.1 is affected by a Cross-Site-Request-Forgery (CSRF) issue as it doesn't implement any method to validate incoming requests, allowing the execution of critical functionalities via spoofed requests. This behavior could be abused by a remote unauthenticated attacker to trick Sitemagic users into performing unwarranted actions.	8.8	HIGH	CVSS:3.1/AV:N/AC:L/PR:N/UI:R/S:U/C:H/I:H/A:H		
CVE-2019-18277	2019-10-23T14:15:10.557	2024-11-21T04:32:57.377	"A flaw was found in HAProxy before 2.0.6. In legacy mode, messages featuring a transfer-encoding header missing the ""chunked"" value were not being correctly rejected. The impact was limited but if combined with the ""http-reuse always"" setting, it could be used to help construct an HTTP request smuggling attack against a vulnerable component employing a lenient parser that would ignore the content-length header as soon as it saw a transfer-encoding one (even if not entirely valid according to the specification)."	7.5	HIGH	CVSS:3.1/AV:N/AC:L/PR:N/UI:N/S:U/C:N/I:H/A:N		
CVE-2019-18278	2019-10-23T14:15:10.667	2024-11-21T04:32:57.520	When executing VideoLAN VLC media player 3.0.8 with libqt on Windows, Data from a Faulting Address controls Code Flow starting at libqt_plugin!vlc_entry_license__3_0_0f+0x00000000003b9aba. NOTE: the VideoLAN security team indicates that they have not been contacted, and have no way of reproducing this issue.	7.8	HIGH	CVSS:3.1/AV:L/AC:L/PR:L/UI:N/S:U/C:H/I:H/A:H		
CVE-2019-18280	2019-10-23T14:15:10.743	2024-11-21T04:32:57.857	Sourcecodester Online Grading System 1.0 is affected by a Cross Site Request Forgery vulnerability due to a lack of CSRF protection. This could lead to an attacker tricking the administrator into executing arbitrary code via a crafted HTML page, as demonstrated by a Create User action at the admin/modules/user/controller.php?action=add URI.	8.8	HIGH	CVSS:3.1/AV:N/AC:L/PR:N/UI:R/S:U/C:H/I:H/A:H		
CVE-2019-16976	2019-10-23T15:15:13.827	2024-11-21T04:31:27.593	"In FusionPBX up to 4.5.7, the file app\destinations\destination_imports.php uses an unsanitized ""query_string"" variable coming from the URL, which is reflected on 2 occasions in HTML, leading to XSS."	6.1	MEDIUM	CVSS:3.1/AV:N/AC:L/PR:N/UI:R/S:C/C:L/I:L/A:N		
CVE-2019-18281	2019-10-23T15:15:14.343	2024-11-21T04:32:57.990	An out-of-bounds memory access in the generateDirectionalRuns() function in qtextengine.cpp in Qt qtbase 5.11.x and 5.12.x before 5.12.5 allows attackers to cause a denial of service by crashing an application via a text file containing many directional characters.	4.3	MEDIUM	CVSS:3.1/AV:N/AC:L/PR:N/UI:R/S:U/C:N/I:N/A:L		
CVE-2019-18344	2019-10-23T15:15:14.390	2024-11-21T04:33:05.243	Sourcecodester Online Grading System 1.0 is vulnerable to unauthenticated SQL injection and can allow remote attackers to execute arbitrary SQL commands via the student, instructor, department, room, class, or user page (id or classid parameter).	9.8	CRITICAL	CVSS:3.1/AV:N/AC:L/PR:N/UI:N/S:U/C:H/I:H/A:H		
CVE-2015-9525	2019-10-23T16:15:10.527	2025-02-07T19:44:53.660	The Easy Digital Downloads (EDD) Recurring Payments extension for WordPress, as used with EDD 1.8.x before 1.8.7, 1.9.x before 1.9.10, 2.0.x before 2.0.5, 2.1.x before 2.1.11, 2.2.x before 2.2.9, and 2.3.x before 2.3.7, has XSS because add_query_arg is misused.	6.1	MEDIUM	CVSS:3.1/AV:N/AC:L/PR:N/UI:R/S:C/C:L/I:L/A:N		
CVE-2015-9526	2019-10-23T16:15:10.590	2025-02-07T19:44:53.660	The Easy Digital Downloads (EDD) Reviews extension for WordPress, as used with EDD 1.8.x before 1.8.7, 1.9.x before 1.9.10, 2.0.x before 2.0.5, 2.1.x before 2.1.11, 2.2.x before 2.2.9, and 2.3.x before 2.3.7, has XSS because add_query_arg is misused.	6.1	MEDIUM	CVSS:3.1/AV:N/AC:L/PR:N/UI:R/S:C/C:L/I:L/A:N		
CVE-2015-9527	2019-10-23T16:15:10.667	2025-02-07T19:44:53.660	The Easy Digital Downloads (EDD) Simple Shipping extension for WordPress, as used with EDD 1.8.x before 1.8.7, 1.9.x before 1.9.10, 2.0.x before 2.0.5, 2.1.x before 2.1.11, 2.2.x before 2.2.9, and 2.3.x before 2.3.7, has XSS because add_query_arg is misused.	6.1	MEDIUM	CVSS:3.1/AV:N/AC:L/PR:N/UI:R/S:C/C:L/I:L/A:N		
CVE-2015-9528	2019-10-23T16:15:10.747	2025-02-07T19:44:53.660	The Easy Digital Downloads (EDD) Software Licensing extension for WordPress, as used with EDD 1.8.x before 1.8.7, 1.9.x before 1.9.10, 2.0.x before 2.0.5, 2.1.x before 2.1.11, 2.2.x before 2.2.9, and 2.3.x before 2.3.7, has XSS because add_query_arg is misused.	6.1	MEDIUM	CVSS:3.1/AV:N/AC:L/PR:N/UI:R/S:C/C:L/I:L/A:N		
CVE-2015-9529	2019-10-23T16:15:10.807	2025-02-07T19:44:53.660	The Easy Digital Downloads (EDD) Stripe extension for WordPress, as used with EDD 1.8.x before 1.8.7, 1.9.x before 1.9.10, 2.0.x before 2.0.5, 2.1.x before 2.1.11, 2.2.x before 2.2.9, and 2.3.x before 2.3.7, has XSS because add_query_arg is misused.	6.1	MEDIUM	CVSS:3.1/AV:N/AC:L/PR:N/UI:R/S:C/C:L/I:L/A:N		
CVE-2015-9530	2019-10-23T16:15:10.903	2025-02-07T19:44:53.660	The Easy Digital Downloads (EDD) Upload File extension for WordPress, as used with EDD 1.8.x before 1.8.7, 1.9.x before 1.9.10, 2.0.x before 2.0.5, 2.1.x before 2.1.11, 2.2.x before 2.2.9, and 2.3.x before 2.3.7, has XSS because add_query_arg is misused.	6.1	MEDIUM	CVSS:3.1/AV:N/AC:L/PR:N/UI:R/S:C/C:L/I:L/A:N		
CVE-2015-9531	2019-10-23T16:15:10.963	2025-02-07T19:44:53.660	The Easy Digital Downloads (EDD) Wish Lists extension for WordPress, as used with EDD 1.8.x before 1.8.7, 1.9.x before 1.9.10, 2.0.x before 2.0.5, 2.1.x before 2.1.11, 2.2.x before 2.2.9, and 2.3.x before 2.3.7, has XSS because add_query_arg is misused.	6.1	MEDIUM	CVSS:3.1/AV:N/AC:L/PR:N/UI:R/S:C/C:L/I:L/A:N		
CVE-2015-9532	2019-10-23T16:15:11.027	2025-02-07T19:44:53.660	The Easy Digital Downloads (EDD) Digital Store theme for WordPress, as used with EDD 1.8.x before 1.8.7, 1.9.x before 1.9.10, 2.0.x before 2.0.5, 2.1.x before 2.1.11, 2.2.x before 2.2.9, and 2.3.x before 2.3.7, has XSS because add_query_arg is misused.	6.1	MEDIUM	CVSS:3.1/AV:N/AC:L/PR:N/UI:R/S:C/C:L/I:L/A:N		
CVE-2015-9533	2019-10-23T16:15:11.107	2025-02-07T19:44:53.660	The Easy Digital Downloads (EDD) Lattice theme for WordPress, as used with EDD 1.8.x before 1.8.7, 1.9.x before 1.9.10, 2.0.x before 2.0.5, 2.1.x before 2.1.11, 2.2.x before 2.2.9, and 2.3.x before 2.3.7, has XSS because add_query_arg is misused.	6.1	MEDIUM	CVSS:3.1/AV:N/AC:L/PR:N/UI:R/S:C/C:L/I:L/A:N		
CVE-2015-9534	2019-10-23T16:15:11.200	2025-02-07T19:44:53.660	The Easy Digital Downloads (EDD) Quota theme for WordPress, as used with EDD 1.8.x before 1.8.7, 1.9.x before 1.9.10, 2.0.x before 2.0.5, 2.1.x before 2.1.11, 2.2.x before 2.2.9, and 2.3.x before 2.3.7, has XSS because add_query_arg is misused.	6.1	MEDIUM	CVSS:3.1/AV:N/AC:L/PR:N/UI:R/S:C/C:L/I:L/A:N		
CVE-2015-9535	2019-10-23T16:15:11.277	2025-02-07T19:44:53.660	The Easy Digital Downloads (EDD) Shoppette theme for WordPress, as used with EDD 1.8.x before 1.8.7, 1.9.x before 1.9.10, 2.0.x before 2.0.5, 2.1.x before 2.1.11, 2.2.x before 2.2.9, and 2.3.x before 2.3.7, has XSS because add_query_arg is misused.	6.1	MEDIUM	CVSS:3.1/AV:N/AC:L/PR:N/UI:R/S:C/C:L/I:L/A:N		
CVE-2015-9536	2019-10-23T16:15:11.340	2025-02-07T19:44:53.660	The Easy Digital Downloads (EDD) Twenty-Twelve theme for WordPress, as used with EDD 1.8.x before 1.8.7, 1.9.x before 1.9.10, 2.0.x before 2.0.5, 2.1.x before 2.1.11, 2.2.x before 2.2.9, and 2.3.x before 2.3.7, has XSS because add_query_arg is misused.	6.1	MEDIUM	CVSS:3.1/AV:N/AC:L/PR:N/UI:R/S:C/C:L/I:L/A:N		
CVE-2019-11282	2019-10-23T16:15:11.480	2024-11-21T04:20:50.833	Cloud Foundry UAA, versions prior to v74.3.0, contains an endpoint that is vulnerable to SCIM injection attack. A remote authenticated malicious user with scim.invite scope can craft a request with malicious content which can leak information about users of the UAA.	4.3	MEDIUM	CVSS:3.1/AV:N/AC:L/PR:L/UI:N/S:U/C:L/I:N/A:N		
CVE-2019-11283	2019-10-23T16:15:11.590	2024-11-21T04:20:50.950	Cloud Foundry SMB Volume, versions prior to v2.0.3, accidentally outputs sensitive information to the logs. A remote user with access to the SMB Volume logs can discover the username and password for volumes that have been recently created, allowing the user to take control of the SMB Volume.	8.8	HIGH	CVSS:3.1/AV:N/AC:L/PR:L/UI:N/S:U/C:H/I:H/A:H		
CVE-2019-11933	2019-10-23T16:15:11.730	2024-11-21T04:22:00.680	A heap buffer overflow bug in libpl_droidsonroids_gif before 1.2.19, as used in WhatsApp for Android before version 2.19.291 could allow remote attackers to execute arbitrary code or cause a denial of service.	9.8	CRITICAL	CVSS:3.1/AV:N/AC:L/PR:N/UI:N/S:U/C:H/I:H/A:H		
CVE-2019-16975	2019-10-23T16:15:11.823	2024-11-21T04:31:27.460	"In FusionPBX up to 4.5.7, the file app\contacts\contact_notes.php uses an unsanitized ""id"" variable coming from the URL, which is reflected in HTML, leading to XSS."	6.1	MEDIUM	CVSS:3.1/AV:N/AC:L/PR:N/UI:R/S:C/C:L/I:L/A:N		
CVE-2013-7333	2019-10-23T17:15:10.613	2024-11-21T02:00:46.250	A vulnerability in version 0.90 of the Open Floodlight SDN controller software could allow an attacker with access to the OpenFlow control network to selectively disconnect individual switches from the SDN controller, causing degradation and eventually denial of network access to all devices connected to the targeted switch.	7.5	HIGH	CVSS:3.1/AV:N/AC:L/PR:N/UI:N/S:U/C:N/I:N/A:H		
CVE-2015-9502	2019-10-23T17:15:10.693	2024-11-21T02:40:47.317	The Auberge theme before 1.4.5 for WordPress has XSS via the genericons/example.html anchor identifier.	6.1	MEDIUM	CVSS:3.1/AV:N/AC:L/PR:N/UI:R/S:C/C:L/I:L/A:N		
CVE-2015-9503	2019-10-23T17:15:10.770	2024-11-21T02:40:47.460	The Modern theme before 1.4.2 for WordPress has XSS via the genericons/example.html anchor identifier.	6.1	MEDIUM	CVSS:3.1/AV:N/AC:L/PR:N/UI:R/S:C/C:L/I:L/A:N		
CVE-2015-9504	2019-10-23T17:15:10.863	2024-11-21T02:40:47.593	The weeklynews theme before 2.2.9 for WordPress has XSS via the s parameter.	6.1	MEDIUM	CVSS:3.1/AV:N/AC:L/PR:N/UI:R/S:C/C:L/I:L/A:N		
CVE-2015-9505	2019-10-23T17:15:10.910	2025-02-07T19:44:53.660	The Easy Digital Downloads (EDD) core component 1.8.x before 1.8.7, 1.9.x before 1.9.10, 2.0.x before 2.0.5, 2.1.x before 2.1.11, 2.2.x before 2.2.9, and 2.3.x before 2.3.7 for WordPress has XSS because add_query_arg is misused.	6.1	MEDIUM	CVSS:3.1/AV:N/AC:L/PR:N/UI:R/S:C/C:L/I:L/A:N		
CVE-2015-9506	2019-10-23T17:15:11.007	2025-02-07T19:44:53.660	The Easy Digital Downloads (EDD) Amazon S3 extension for WordPress, as used with EDD 1.8.x before 1.8.7, 1.9.x before 1.9.10, 2.0.x before 2.0.5, 2.1.x before 2.1.11, 2.2.x before 2.2.9, and 2.3.x before 2.3.7, has XSS because add_query_arg is misused.	6.1	MEDIUM	CVSS:3.1/AV:N/AC:L/PR:N/UI:R/S:C/C:L/I:L/A:N		
CVE-2015-9507	2019-10-23T17:15:11.083	2025-02-07T19:44:53.660	The Easy Digital Downloads (EDD) Attach Accounts to Orders extension for WordPress, as used with EDD 1.8.x before 1.8.7, 1.9.x before 1.9.10, 2.0.x before 2.0.5, 2.1.x before 2.1.11, 2.2.x before 2.2.9, and 2.3.x before 2.3.7, has XSS because add_query_arg is misused.	6.1	MEDIUM	CVSS:3.1/AV:N/AC:L/PR:N/UI:R/S:C/C:L/I:L/A:N		
CVE-2015-9508	2019-10-23T17:15:11.147	2025-02-07T19:44:53.660	The Easy Digital Downloads (EDD) Commissions extension for WordPress, as used with EDD 1.8.x before 1.8.7, 1.9.x before 1.9.10, 2.0.x before 2.0.5, 2.1.x before 2.1.11, 2.2.x before 2.2.9, and 2.3.x before 2.3.7, has XSS because add_query_arg is misused.	6.1	MEDIUM	CVSS:3.1/AV:N/AC:L/PR:N/UI:R/S:C/C:L/I:L/A:N		
CVE-2015-9509	2019-10-23T17:15:11.223	2025-02-07T19:44:53.660	The Easy Digital Downloads (EDD) Content Restriction extension for WordPress, as used with EDD 1.8.x before 1.8.7, 1.9.x before 1.9.10, 2.0.x before 2.0.5, 2.1.x before 2.1.11, 2.2.x before 2.2.9, and 2.3.x before 2.3.7, has XSS because add_query_arg is misused.	6.1	MEDIUM	CVSS:3.1/AV:N/AC:L/PR:N/UI:R/S:C/C:L/I:L/A:N		
CVE-2015-9510	2019-10-23T17:15:11.270	2025-02-07T19:44:53.660	The Easy Digital Downloads (EDD) Cross-sell Upsell extension for WordPress, as used with EDD 1.8.x before 1.8.7, 1.9.x before 1.9.10, 2.0.x before 2.0.5, 2.1.x before 2.1.11, 2.2.x before 2.2.9, and 2.3.x before 2.3.7, has XSS because add_query_arg is misused.	6.1	MEDIUM	CVSS:3.1/AV:N/AC:L/PR:N/UI:R/S:C/C:L/I:L/A:N		
CVE-2015-9511	2019-10-23T17:15:11.350	2025-02-07T19:44:53.660	The Easy Digital Downloads (EDD) Conditional Success Redirects extension for WordPress, as used with EDD 1.8.x before 1.8.7, 1.9.x before 1.9.10, 2.0.x before 2.0.5, 2.1.x before 2.1.11, 2.2.x before 2.2.9, and 2.3.x before 2.3.7, has XSS because add_query_arg is misused.	6.1	MEDIUM	CVSS:3.1/AV:N/AC:L/PR:N/UI:R/S:C/C:L/I:L/A:N		
CVE-2015-9512	2019-10-23T17:15:11.427	2025-02-07T19:44:53.660	The Easy Digital Downloads (EDD) CSV Manager extension for WordPress, as used with EDD 1.8.x before 1.8.7, 1.9.x before 1.9.10, 2.0.x before 2.0.5, 2.1.x before 2.1.11, 2.2.x before 2.2.9, and 2.3.x before 2.3.7, has XSS because add_query_arg is misused.	6.1	MEDIUM	CVSS:3.1/AV:N/AC:L/PR:N/UI:R/S:C/C:L/I:L/A:N		
CVE-2015-9513	2019-10-23T17:15:11.490	2025-02-07T19:44:53.660	The Easy Digital Downloads (EDD) Favorites extension for WordPress, as used with EDD 1.8.x before 1.8.7, 1.9.x before 1.9.10, 2.0.x before 2.0.5, 2.1.x before 2.1.11, 2.2.x before 2.2.9, and 2.3.x before 2.3.7, has XSS because add_query_arg is misused.	6.1	MEDIUM	CVSS:3.1/AV:N/AC:L/PR:N/UI:R/S:C/C:L/I:L/A:N		
CVE-2015-9514	2019-10-23T17:15:11.553	2025-02-07T19:44:53.660	The Easy Digital Downloads (EDD) Free Downloads extension for WordPress, as used with EDD 1.8.x before 1.8.7, 1.9.x before 1.9.10, 2.0.x before 2.0.5, 2.1.x before 2.1.11, 2.2.x before 2.2.9, and 2.3.x before 2.3.7, has XSS because add_query_arg is misused.	6.1	MEDIUM	CVSS:3.1/AV:N/AC:L/PR:N/UI:R/S:C/C:L/I:L/A:N		
CVE-2015-9515	2019-10-23T17:15:11.617	2025-02-07T19:44:53.660	The Easy Digital Downloads (EDD) htaccess Editor extension for WordPress, as used with EDD 1.8.x before 1.8.7, 1.9.x before 1.9.10, 2.0.x before 2.0.5, 2.1.x before 2.1.11, 2.2.x before 2.2.9, and 2.3.x before 2.3.7, has XSS because add_query_arg is misused.	6.1	MEDIUM	CVSS:3.1/AV:N/AC:L/PR:N/UI:R/S:C/C:L/I:L/A:N		
CVE-2015-9516	2019-10-23T17:15:11.677	2025-02-07T19:44:53.660	The Easy Digital Downloads (EDD) Invoices extension for WordPress, as used with EDD 1.8.x before 1.8.7, 1.9.x before 1.9.10, 2.0.x before 2.0.5, 2.1.x before 2.1.11, 2.2.x before 2.2.9, and 2.3.x before 2.3.7, has XSS because add_query_arg is misused.	6.1	MEDIUM	CVSS:3.1/AV:N/AC:L/PR:N/UI:R/S:C/C:L/I:L/A:N		
CVE-2015-9517	2019-10-23T17:15:11.740	2025-02-07T19:44:53.660	The Easy Digital Downloads (EDD) Manual Purchases extension for WordPress, as used with EDD 1.8.x before 1.8.7, 1.9.x before 1.9.10, 2.0.x before 2.0.5, 2.1.x before 2.1.11, 2.2.x before 2.2.9, and 2.3.x before 2.3.7, has XSS because add_query_arg is misused.	6.1	MEDIUM	CVSS:3.1/AV:N/AC:L/PR:N/UI:R/S:C/C:L/I:L/A:N		
CVE-2015-9518	2019-10-23T17:15:11.803	2025-02-07T19:44:53.660	The Easy Digital Downloads (EDD) PDF Invoices extension for WordPress, as used with EDD 1.8.x before 1.8.7, 1.9.x before 1.9.10, 2.0.x before 2.0.5, 2.1.x before 2.1.11, 2.2.x before 2.2.9, and 2.3.x before 2.3.7, has XSS because add_query_arg is misused.	6.1	MEDIUM	CVSS:3.1/AV:N/AC:L/PR:N/UI:R/S:C/C:L/I:L/A:N		
CVE-2015-9519	2019-10-23T17:15:11.867	2025-02-07T19:44:53.660	The Easy Digital Downloads (EDD) PDF Stamper extension for WordPress, as used with EDD 1.8.x before 1.8.7, 1.9.x before 1.9.10, 2.0.x before 2.0.5, 2.1.x before 2.1.11, 2.2.x before 2.2.9, and 2.3.x before 2.3.7, has XSS because add_query_arg is misused.	6.1	MEDIUM	CVSS:3.1/AV:N/AC:L/PR:N/UI:R/S:C/C:L/I:L/A:N		
CVE-2015-9520	2019-10-23T17:15:11.927	2025-02-07T19:44:53.660	The Easy Digital Downloads (EDD) Per Product Emails extension for WordPress, as used with EDD 1.8.x before 1.8.7, 1.9.x before 1.9.10, 2.0.x before 2.0.5, 2.1.x before 2.1.11, 2.2.x before 2.2.9, and 2.3.x before 2.3.7, has XSS because add_query_arg is misused.	6.1	MEDIUM	CVSS:3.1/AV:N/AC:L/PR:N/UI:R/S:C/C:L/I:L/A:N		
CVE-2015-9521	2019-10-23T17:15:12.007	2025-02-07T19:44:53.660	The Easy Digital Downloads (EDD) Pushover Notifications extension for WordPress, as used with EDD 1.8.x before 1.8.7, 1.9.x before 1.9.10, 2.0.x before 2.0.5, 2.1.x before 2.1.11, 2.2.x before 2.2.9, and 2.3.x before 2.3.7, has XSS because add_query_arg is misused.	6.1	MEDIUM	CVSS:3.1/AV:N/AC:L/PR:N/UI:R/S:C/C:L/I:L/A:N		
CVE-2015-9522	2019-10-23T17:15:12.067	2025-02-07T19:44:53.660	The Easy Digital Downloads (EDD) QR Code extension for WordPress, as used with EDD 1.8.x before 1.8.7, 1.9.x before 1.9.10, 2.0.x before 2.0.5, 2.1.x before 2.1.11, 2.2.x before 2.2.9, and 2.3.x before 2.3.7, has XSS because add_query_arg is misused.	6.1	MEDIUM	CVSS:3.1/AV:N/AC:L/PR:N/UI:R/S:C/C:L/I:L/A:N		
CVE-2015-9523	2019-10-23T17:15:12.130	2025-02-07T19:44:53.660	The Easy Digital Downloads (EDD) Recommended Products extension for WordPress, as used with EDD 1.8.x before 1.8.7, 1.9.x before 1.9.10, 2.0.x before 2.0.5, 2.1.x before 2.1.11, 2.2.x before 2.2.9, and 2.3.x before 2.3.7, has XSS because add_query_arg is misused.	6.1	MEDIUM	CVSS:3.1/AV:N/AC:L/PR:N/UI:R/S:C/C:L/I:L/A:N		
CVE-2015-9524	2019-10-23T17:15:12.177	2025-02-07T19:44:53.660	The Easy Digital Downloads (EDD) Recount Earnings extension for WordPress, as used with EDD 1.8.x before 1.8.7, 1.9.x before 1.9.10, 2.0.x before 2.0.5, 2.1.x before 2.1.11, 2.2.x before 2.2.9, and 2.3.x before 2.3.7, has XSS because add_query_arg is misused.	6.1	MEDIUM	CVSS:3.1/AV:N/AC:L/PR:N/UI:R/S:C/C:L/I:L/A:N		
CVE-2019-16977	2019-10-23T17:15:12.803	2024-11-21T04:31:27.733	"In FusionPBX up to 4.5.7, the file app\extensions\extension_imports.php uses an unsanitized ""query_string"" variable coming from the URL, which is reflected in HTML, leading to XSS."	6.1	MEDIUM	CVSS:3.1/AV:N/AC:L/PR:N/UI:R/S:C/C:L/I:L/A:N		
CVE-2019-17093	2019-10-23T17:15:12.850	2024-11-21T04:31:40.653	An issue was discovered in Avast antivirus before 19.8 and AVG antivirus before 19.8. A DLL Preloading vulnerability allows an attacker to implant %WINDIR%\system32\wbemcomn.dll, which is loaded into a protected-light process (PPL) and might bypass some of the self-defense mechanisms. This affects all components that use WMI, e.g., AVGSvc.exe 19.6.4546.0 and TuneupSmartScan.dll 19.1.884.0.	7.8	HIGH	CVSS:3.1/AV:L/AC:L/PR:N/UI:R/S:U/C:H/I:H/A:H		
CVE-2019-17606	2019-10-23T17:15:12.910	2024-11-21T04:32:37.777	The Post editor functionality in the hexo-admin plugin versions 2.3.0 and earlier for Node.js is vulnerable to stored XSS via the content of a post.	6.1	MEDIUM	CVSS:3.1/AV:N/AC:L/PR:N/UI:R/S:C/C:L/I:L/A:N		
CVE-2019-18348	2019-10-23T17:15:12.973	2024-11-21T04:33:06.653	An issue was discovered in urllib2 in Python 2.x through 2.7.17 and urllib in Python 3.x through 3.8.0. CRLF injection is possible if the attacker controls a url parameter, as demonstrated by the first argument to urllib.request.urlopen with \r\n (specifically in the host component of a URL) followed by an HTTP header. This is similar to the CVE-2019-9740 query string issue and the CVE-2019-9947 path string issue. (This is not exploitable when glibc has CVE-2016-10739 fixed.). This is fixed in: v2.7.18, v2.7.18rc1; v3.5.10, v3.5.10rc1; v3.6.11, v3.6.11rc1, v3.6.12; v3.7.8, v3.7.8rc1, v3.7.9; v3.8.3, v3.8.3rc1, v3.8.4, v3.8.4rc1, v3.8.5, v3.8.6, v3.8.6rc1.	6.1	MEDIUM	CVSS:3.1/AV:N/AC:L/PR:N/UI:R/S:C/C:L/I:L/A:N		
CVE-2002-2439	2019-10-23T18:15:11.007	2024-11-20T23:43:41.680	Integer overflow in the new[] operator in gcc before 4.8.0 allows attackers to have unspecified impacts.	7.8	HIGH	CVSS:3.1/AV:L/AC:L/PR:L/UI:N/S:U/C:H/I:H/A:H		
CVE-2014-2304	2019-10-23T18:15:11.163	2024-11-21T02:06:02.460	A vulnerability in version 0.90 of the Open Floodlight SDN controller software could result in a denial of service attack and crashing of the controller service. This effect is the result of a flaw in OpenFlow protocol processing, where specific malformed and mistimed FEATURES_REPLY messages cause the controller service to not delete switch and port data from its internal tracking structures.	7.5	HIGH	CVSS:3.1/AV:N/AC:L/PR:N/UI:N/S:U/C:N/I:N/A:H		
CVE-2019-18350	2019-10-23T18:15:11.727	2024-11-21T04:33:06.953	In Ant Design Pro 4.0.0, reflected XSS in the user/login redirect GET parameter affects the authorization component, leading to execution of JavaScript code in the login after-action script.	6.1	MEDIUM	CVSS:3.1/AV:N/AC:L/PR:N/UI:R/S:C/C:L/I:L/A:N		
CVE-2019-18355	2019-10-23T19:15:11.857	2024-11-21T04:33:07.240	An SSRF issue was discovered in the legacy Web launcher in Thycotic Secret Server before 10.7.	9.8	CRITICAL	CVSS:3.1/AV:N/AC:L/PR:N/UI:N/S:U/C:H/I:H/A:H		
CVE-2019-18356	2019-10-23T19:15:11.920	2024-11-21T04:33:07.370	An XSS issue was discovered in Thycotic Secret Server before 10.7 (issue 1 of 2).	6.1	MEDIUM	CVSS:3.1/AV:N/AC:L/PR:N/UI:R/S:C/C:L/I:L/A:N		
CVE-2019-18357	2019-10-23T19:15:11.983	2024-11-21T04:33:07.493	An XSS issue was discovered in Thycotic Secret Server before 10.7 (issue 2 of 2).	6.1	MEDIUM	CVSS:3.1/AV:N/AC:L/PR:N/UI:R/S:C/C:L/I:L/A:N		
CVE-2019-3982	2019-10-23T19:15:12.047	2024-11-21T04:43:00.100	Nessus versions 8.6.0 and earlier were found to contain a Denial of Service vulnerability due to improper validation of specific imported scan types. An authenticated, remote attacker could potentially exploit this vulnerability to cause a Nessus scanner to become temporarily unresponsive.	6.5	MEDIUM	CVSS:3.1/AV:N/AC:L/PR:L/UI:N/S:U/C:N/I:N/A:H		
CVE-2019-6144	2019-10-23T19:15:12.107	2024-11-21T04:46:01.733	This vulnerability allows a normal (non-admin) user to disable the Forcepoint One Endpoint (versions 19.04 through 19.08) and bypass DLP and Web protection.	6.5	MEDIUM	CVSS:3.1/AV:N/AC:L/PR:L/UI:N/S:U/C:N/I:H/A:N		
CVE-2019-9596	2019-10-23T19:15:12.217	2024-11-21T04:51:55.930	Darktrace Enterprise Immune System before 3.1 allows CSRF via the /whitelisteddomains endpoint.	6.5	MEDIUM	CVSS:3.1/AV:N/AC:L/PR:N/UI:R/S:U/C:N/I:H/A:N		
CVE-2019-9597	2019-10-23T19:15:12.310	2024-11-21T04:51:56.090	Darktrace Enterprise Immune System before 3.1 allows CSRF via the /config endpoint.	6.5	MEDIUM	CVSS:3.1/AV:N/AC:L/PR:N/UI:R/S:U/C:N/I:H/A:N		
CVE-2019-12415	2019-10-23T20:15:12.707	2024-11-21T04:22:47.553	In Apache POI up to 4.1.0, when using the tool XSSFExportToXml to convert user-provided Microsoft Excel documents, a specially crafted document can allow an attacker to read files from the local filesystem or from internal network resources via XML External Entity (XXE) Processing.	5.5	MEDIUM	CVSS:3.1/AV:L/AC:L/PR:L/UI:N/S:U/C:H/I:N/A:N		
CVE-2019-18359	2019-10-23T20:15:14.007	2024-11-21T04:33:07.623	A buffer over-read was discovered in ReadMP3APETag in apetag.c in MP3Gain 1.6.2. The vulnerability causes an application crash, which leads to remote denial of service.	5.5	MEDIUM	CVSS:3.1/AV:L/AC:L/PR:N/UI:R/S:U/C:N/I:N/A:H		
CVE-2019-18370	2019-10-23T21:15:10.760	2024-11-21T04:33:09.060	An issue was discovered on Xiaomi Mi WiFi R3G devices before 2.28.23-stable. The backup file is in tar.gz format. After uploading, the application uses the tar zxf command to decompress, so one can control the contents of the files in the decompressed directory. In addition, the application's sh script for testing upload and download speeds reads a URL list from /tmp/speedtest_urls.xml, and there is a command injection vulnerability, as demonstrated by api/xqnetdetect/netspeed.	9.8	CRITICAL	CVSS:3.1/AV:N/AC:L/PR:N/UI:N/S:U/C:H/I:H/A:H		
CVE-2019-18371	2019-10-23T21:15:10.823	2024-11-21T04:33:09.193	An issue was discovered on Xiaomi Mi WiFi R3G devices before 2.28.23-stable. There is a directory traversal vulnerability to read arbitrary files via a misconfigured NGINX alias, as demonstrated by api-third-party/download/extdisks../etc/config/account. With this vulnerability, the attacker can bypass authentication.	7.5	HIGH	CVSS:3.1/AV:N/AC:L/PR:N/UI:N/S:U/C:H/I:N/A:N		
CVE-2019-18382	2019-10-23T21:15:10.887	2024-11-21T04:33:10.297	An issue was discovered on AVStar PE204 3.10.70 IP camera devices. A denial of service can occur on open TCP port 23456. After a TELNET connection, no TCP ports are open.	7.5	HIGH	CVSS:3.1/AV:N/AC:L/PR:N/UI:N/S:U/C:N/I:N/A:H		
CVE-2019-18383	2019-10-23T21:15:10.950	2024-11-21T04:33:10.427	An issue was discovered on TerraMaster FS-210 4.0.19 devices. One can download backup files remotely from terramaster_TNAS-00E43A_config_backup.bin without permission.	7.5	HIGH	CVSS:3.1/AV:N/AC:L/PR:N/UI:N/S:U/C:H/I:N/A:N		
