CVE ID	Published Date	Last Modified Date	Description	Base Score	Base Severity	Vector String	Vendor	Product
CVE-2019-16508	2019-10-01T12:15:10.967	2024-11-21T04:30:43.603	The Imagination Technologies driver for Chrome OS before R74-11895.B, R75 before R75-12105.B, and R76 before R76-12208.0.0 allows attackers to trigger an Integer Overflow and gain privileges via a malicious application. This occurs because of intentional access for the GPU process to /dev/dri/card1 and the PowerVR ioctl handler, as demonstrated by PVRSRVBridgeSyncPrimOpCreate.	7.8	HIGH	CVSS:3.1/AV:L/AC:L/PR:N/UI:R/S:U/C:H/I:H/A:H		
CVE-2019-15940	2019-10-01T13:15:10.257	2024-11-21T04:29:46.843	Victure PC530 devices allow unauthenticated TELNET access as root.	9.8	CRITICAL	CVSS:3.1/AV:N/AC:L/PR:N/UI:N/S:U/C:H/I:H/A:H		
CVE-2019-10431	2019-10-01T14:15:18.507	2024-11-21T04:19:07.500	A sandbox bypass vulnerability in Jenkins Script Security Plugin 1.64 and earlier related to the handling of default parameter expressions in constructors allowed attackers to execute arbitrary code in sandboxed scripts.	9.9	CRITICAL	CVSS:3.1/AV:N/AC:L/PR:L/UI:N/S:C/C:H/I:H/A:H		
CVE-2019-10432	2019-10-01T14:15:23.817	2024-11-21T04:19:07.643	Jenkins HTML Publisher Plugin 1.20 and earlier did not escape the project and build display names in the HTML report frame, resulting in a cross-site scripting vulnerability exploitable by users able to change those.	5.4	MEDIUM	CVSS:3.1/AV:N/AC:L/PR:L/UI:R/S:C/C:L/I:L/A:N		
CVE-2019-10433	2019-10-01T14:15:28.507	2024-11-21T04:19:07.787	Jenkins Dingding[钉钉] Plugin stores credentials unencrypted in job config.xml files on the Jenkins master where they can be viewed by users with Extended Read permission, or access to the master file system.	3.3	LOW	CVSS:3.1/AV:L/AC:L/PR:L/UI:N/S:U/C:L/I:N/A:N		
CVE-2019-10434	2019-10-01T14:15:30.443	2024-11-21T04:19:07.917	Jenkins LDAP Email Plugin transmits configured credentials in plain text as part of the global Jenkins configuration form, potentially resulting in their exposure.	7.5	HIGH	CVSS:3.1/AV:N/AC:L/PR:N/UI:N/S:U/C:H/I:N/A:N		
CVE-2019-10435	2019-10-01T14:15:31.817	2024-11-21T04:19:08.043	Jenkins SourceGear Vault Plugin transmits configured credentials in plain text as part of job configuration forms, potentially resulting in their exposure.	7.5	HIGH	CVSS:3.1/AV:N/AC:L/PR:N/UI:N/S:U/C:H/I:N/A:N		
CVE-2019-14952	2019-10-01T14:15:32.820	2024-11-21T04:27:45.567	JetBrains YouTrack versions before 2019.1.52584 had a possible XSS in the issue titles.	6.1	MEDIUM	CVSS:3.1/AV:N/AC:L/PR:N/UI:R/S:C/C:L/I:L/A:N		
CVE-2019-14954	2019-10-01T14:15:34.367	2024-11-21T04:27:45.880	JetBrains IntelliJ IDEA before 2019.2 was resolving the markdown plantuml artifact download link via a cleartext http connection.	5.9	MEDIUM	CVSS:3.1/AV:N/AC:H/PR:N/UI:N/S:U/C:H/I:N/A:N		
CVE-2019-15039	2019-10-01T14:15:38.177	2024-11-21T04:27:55.853	An issue was discovered in JetBrains TeamCity 2018.2.4. It had a possible remote code execution issue. This was fixed in TeamCity 2019.1.	9.8	CRITICAL	CVSS:3.1/AV:N/AC:L/PR:N/UI:N/S:U/C:H/I:H/A:H		
CVE-2019-17052	2019-10-01T14:15:40.397	2024-11-21T04:31:36.250	ax25_create in net/ax25/af_ax25.c in the AF_AX25 network module in the Linux kernel 3.16 through 5.3.2 does not enforce CAP_NET_RAW, which means that unprivileged users can create a raw socket, aka CID-0614e2b73768.	3.3	LOW	CVSS:3.1/AV:L/AC:L/PR:L/UI:N/S:U/C:N/I:L/A:N		
CVE-2019-17053	2019-10-01T14:15:42.070	2024-11-21T04:31:36.420	ieee802154_create in net/ieee802154/socket.c in the AF_IEEE802154 network module in the Linux kernel through 5.3.2 does not enforce CAP_NET_RAW, which means that unprivileged users can create a raw socket, aka CID-e69dbd4619e7.	3.3	LOW	CVSS:3.1/AV:L/AC:L/PR:L/UI:N/S:U/C:N/I:L/A:N		
CVE-2019-17054	2019-10-01T14:15:46.727	2024-11-21T04:31:36.573	atalk_create in net/appletalk/ddp.c in the AF_APPLETALK network module in the Linux kernel through 5.3.2 does not enforce CAP_NET_RAW, which means that unprivileged users can create a raw socket, aka CID-6cc03e8aa36c.	3.3	LOW	CVSS:3.1/AV:L/AC:L/PR:L/UI:N/S:U/C:N/I:L/A:N		
CVE-2019-17055	2019-10-01T14:15:51.897	2024-11-21T04:31:36.720	base_sock_create in drivers/isdn/mISDN/socket.c in the AF_ISDN network module in the Linux kernel through 5.3.2 does not enforce CAP_NET_RAW, which means that unprivileged users can create a raw socket, aka CID-b91ee4aa2a21.	3.3	LOW	CVSS:3.1/AV:L/AC:L/PR:L/UI:N/S:U/C:N/I:L/A:N		
CVE-2019-17056	2019-10-01T14:15:55.773	2024-11-21T04:31:36.897	llcp_sock_create in net/nfc/llcp_sock.c in the AF_NFC network module in the Linux kernel through 5.3.2 does not enforce CAP_NET_RAW, which means that unprivileged users can create a raw socket, aka CID-3a359798b176.	3.3	LOW	CVSS:3.1/AV:L/AC:L/PR:L/UI:N/S:U/C:N/I:L/A:N		
CVE-2019-10202	2019-10-01T15:15:11.337	2024-11-21T04:18:38.770	A series of deserialization vulnerabilities have been discovered in Codehaus 1.9.x implemented in EAP 7. This CVE fixes CVE-2017-17485, CVE-2017-7525, CVE-2017-15095, CVE-2018-5968, CVE-2018-7489, CVE-2018-1000873, CVE-2019-12086 reported for FasterXML jackson-databind by implementing a whitelist approach that will mitigate these vulnerabilities and future ones alike.	9.8	CRITICAL	CVSS:3.1/AV:N/AC:L/PR:N/UI:N/S:U/C:H/I:H/A:H		
CVE-2019-11275	2019-10-01T15:15:11.650	2024-11-21T04:20:50.037	Pivotal Application Manager, versions 666.0.x prior to 666.0.36, versions 667.0.x prior to 667.0.22, versions 668.0.x prior to 668.0.21, versions 669.0.x prior to 669.0.13, and versions 670.0.x prior to 670.0.7, contain a vulnerability where a remote authenticated user can create an app with a name such that a csv program can interpret into a formula and gets executed. The malicious user can possibly gain access to a usage report that requires a higher privilege.	4.3	MEDIUM	CVSS:3.1/AV:N/AC:L/PR:L/UI:N/S:U/C:L/I:N/A:N		
CVE-2019-4246	2019-10-01T15:15:11.713	2024-11-21T04:43:22.390	IBM Daeja ViewONE Virtual 5.0 through 5.0.6 could expose internal parameters to ViewONE clients that could be used in further attacks against the system. IBM X-Force ID: 159521.	5.3	MEDIUM	CVSS:3.1/AV:N/AC:L/PR:N/UI:N/S:U/C:L/I:N/A:N		
CVE-2019-4494	2019-10-01T15:15:11.790	2024-11-21T04:43:39.970	IBM Jazz Reporting Service (JRS) 6.0, 6.0.1, 6.0.2, 6.0.3, 6.0.4, 6.0.5, 6.0.6, and 6.0.6.1 is vulnerable to cross-site scripting. This vulnerability allows users to embed arbitrary JavaScript code in the Web UI thus altering the intended functionality potentially leading to credentials disclosure within a trusted session. IBM X-Force ID: 164115.	5.4	MEDIUM	CVSS:3.1/AV:N/AC:L/PR:L/UI:R/S:C/C:L/I:L/A:N		
CVE-2019-4495	2019-10-01T15:15:11.837	2024-11-21T04:43:40.097	IBM Jazz Reporting Service (JRS) 6.0, 6.0.1, 6.0.2, 6.0.3, 6.0.4, 6.0.5, 6.0.6, and 6.0.6.1 is vulnerable to cross-site scripting. This vulnerability allows users to embed arbitrary JavaScript code in the Web UI thus altering the intended functionality potentially leading to credentials disclosure within a trusted session. IBM X-Force ID: 164116.	5.4	MEDIUM	CVSS:3.1/AV:N/AC:L/PR:L/UI:R/S:C/C:L/I:L/A:N		
CVE-2019-4497	2019-10-01T15:15:11.917	2024-11-21T04:43:40.217	IBM Jazz Reporting Service (JRS) 6.0, 6.0.1, 6.0.2, 6.0.3, 6.0.4, 6.0.5, 6.0.6, and 6.0.6.1 is vulnerable to cross-site scripting. This vulnerability allows users to embed arbitrary JavaScript code in the Web UI thus altering the intended functionality potentially leading to credentials disclosure within a trusted session. IBM X-Force ID: 164118.	5.4	MEDIUM	CVSS:3.1/AV:N/AC:L/PR:L/UI:R/S:C/C:L/I:L/A:N		
CVE-2019-14953	2019-10-01T16:15:10.967	2024-11-21T04:27:45.723	JetBrains YouTrack versions before 2019.2.53938 had a possible XSS through issue attachments when using the Firefox browser.	6.1	MEDIUM	CVSS:3.1/AV:N/AC:L/PR:N/UI:R/S:C/C:L/I:L/A:N		
CVE-2019-14955	2019-10-01T16:15:11.030	2024-11-21T04:27:46.043	In JetBrains Hub versions earlier than 2018.4.11436, there was no option to force a user to change the password and no password expiration policy was implemented.	5.3	MEDIUM	CVSS:3.1/AV:N/AC:L/PR:N/UI:N/S:U/C:N/I:L/A:N		
CVE-2019-14957	2019-10-01T16:15:11.110	2024-11-21T04:27:46.350	The JetBrains Vim plugin before version 0.52 was storing individual project data in the global vim_settings.xml file. This xml file could be synchronized to a publicly accessible GitHub repository.	5.3	MEDIUM	CVSS:3.1/AV:N/AC:L/PR:N/UI:N/S:U/C:L/I:N/A:N		
CVE-2019-14960	2019-10-01T16:15:11.170	2024-11-21T04:27:46.790	JetBrains Rider before 2019.1.2 was using an unsigned JetBrains.Rider.Unity.Editor.Plugin.Repacked.dll file.	7.8	HIGH	CVSS:3.1/AV:L/AC:L/PR:L/UI:N/S:U/C:H/I:H/A:H		
CVE-2019-15038	2019-10-01T16:15:11.250	2024-11-21T04:27:55.717	An issue was discovered in JetBrains TeamCity 2018.2.4. The TeamCity server was not using some security-related HTTP headers. The issue was fixed in TeamCity 2019.1.	7.5	HIGH	CVSS:3.1/AV:N/AC:L/PR:N/UI:N/S:U/C:N/I:H/A:N		
CVE-2019-17063	2019-10-01T16:15:11.530	2024-11-21T04:31:37.923	In Snowtide PDFxStream before 3.7.1 (for Java), a crafted PDF file can trigger an extremely long running computation because of page-tree mishandling.	5.5	MEDIUM	CVSS:3.1/AV:L/AC:L/PR:N/UI:R/S:U/C:N/I:N/A:H		
CVE-2019-17064	2019-10-01T16:15:11.593	2024-11-21T04:31:38.073	Catalog.cc in Xpdf 4.02 has a NULL pointer dereference because Catalog.pageLabels is initialized too late in the Catalog constructor.	5.5	MEDIUM	CVSS:3.1/AV:L/AC:L/PR:N/UI:R/S:U/C:N/I:N/A:H		
CVE-2019-14961	2019-10-01T17:15:10.150	2024-11-21T04:27:46.933	JetBrains Upsource before 2019.1.1412 was not properly escaping HTML tags in a code block comments, leading to XSS.	6.1	MEDIUM	CVSS:3.1/AV:N/AC:L/PR:N/UI:R/S:C/C:L/I:L/A:N		
CVE-2019-15042	2019-10-01T17:15:10.197	2024-11-21T04:27:56.273	An issue was discovered in JetBrains TeamCity 2018.2.4. It had no SSL certificate validation for some external https connections. This was fixed in TeamCity 2019.1.	7.5	HIGH	CVSS:3.1/AV:N/AC:L/PR:N/UI:N/S:U/C:N/I:H/A:N		
CVE-2019-16942	2019-10-01T17:15:10.323	2024-11-21T04:31:23.477	A Polymorphic Typing issue was discovered in FasterXML jackson-databind 2.0.0 through 2.9.10. When Default Typing is enabled (either globally or for a specific property) for an externally exposed JSON endpoint and the service has the commons-dbcp (1.4) jar in the classpath, and an attacker can find an RMI service endpoint to access, it is possible to make the service execute a malicious payload. This issue exists because of org.apache.commons.dbcp.datasources.SharedPoolDataSource and org.apache.commons.dbcp.datasources.PerUserPoolDataSource mishandling.	9.8	CRITICAL	CVSS:3.1/AV:N/AC:L/PR:N/UI:N/S:U/C:H/I:H/A:H		
CVE-2019-16943	2019-10-01T17:15:10.400	2024-11-21T04:31:23.737	A Polymorphic Typing issue was discovered in FasterXML jackson-databind 2.0.0 through 2.9.10. When Default Typing is enabled (either globally or for a specific property) for an externally exposed JSON endpoint and the service has the p6spy (3.8.6) jar in the classpath, and an attacker can find an RMI service endpoint to access, it is possible to make the service execute a malicious payload. This issue exists because of com.p6spy.engine.spy.P6DataSource mishandling.	9.8	CRITICAL	CVSS:3.1/AV:N/AC:L/PR:N/UI:N/S:U/C:H/I:H/A:H		
CVE-2019-17067	2019-10-01T17:15:10.463	2024-11-21T04:31:38.360	PuTTY before 0.73 on Windows improperly opens port-forwarding listening sockets, which allows attackers to listen on the same port to steal an incoming connection.	9.8	CRITICAL	CVSS:3.1/AV:N/AC:L/PR:N/UI:N/S:U/C:H/I:H/A:H		
CVE-2019-17068	2019-10-01T17:15:10.527	2024-11-21T04:31:38.500	"PuTTY before 0.73 mishandles the ""bracketed paste mode"" protection mechanism, which may allow a session to be affected by malicious clipboard content."	7.5	HIGH	CVSS:3.1/AV:N/AC:L/PR:N/UI:N/S:U/C:N/I:H/A:N		
CVE-2019-17069	2019-10-01T17:15:10.573	2024-11-21T04:31:38.653	PuTTY before 0.73 might allow remote SSH-1 servers to cause a denial of service by accessing freed memory locations via an SSH1_MSG_DISCONNECT message.	7.5	HIGH	CVSS:3.1/AV:N/AC:L/PR:N/UI:N/S:U/C:N/I:N/A:H		
CVE-2019-7618	2019-10-01T18:15:13.987	2024-11-21T04:48:24.797	A local file disclosure flaw was found in Elastic Code versions 7.3.0, 7.3.1, and 7.3.2. If a malicious code repository is imported into Code it is possible to read arbitrary files from the local filesystem of the Kibana instance running Code with the permission of the Kibana system user.	6.5	MEDIUM	CVSS:3.1/AV:N/AC:L/PR:L/UI:N/S:U/C:H/I:N/A:N		
CVE-2019-0231	2019-10-01T20:15:11.010	2024-11-21T04:16:33.110	Handling of the close_notify SSL/TLS message does not lead to a connection closure, leading the server to retain the socket opened and to have the client potentially receive clear text messages afterward. Mitigation: 2.0.20 users should migrate to 2.0.21, 2.1.0 users should migrate to 2.1.1. This issue affects: Apache MINA.	7.5	HIGH	CVSS:3.1/AV:N/AC:L/PR:N/UI:N/S:U/C:H/I:N/A:N		
CVE-2019-15035	2019-10-01T20:15:11.087	2024-11-21T04:27:55.293	An issue was discovered in JetBrains TeamCity 2018.2.4. A TeamCity Project administrator could get access to potentially confidential server-level data. The issue was fixed in TeamCity 2018.2.5 and 2019.1.	4.9	MEDIUM	CVSS:3.1/AV:N/AC:L/PR:H/UI:N/S:U/C:H/I:N/A:N		
CVE-2019-15041	2019-10-01T20:15:11.150	2024-11-21T04:27:56.133	JetBrains YouTrack versions before 2019.1.52545 allowed unbounded URL whitelisting because of Inclusion of Functionality from an Untrusted Control Sphere.	6.1	MEDIUM	CVSS:3.1/AV:N/AC:L/PR:N/UI:R/S:C/C:L/I:L/A:N		
CVE-2019-17073	2019-10-01T20:15:11.213	2024-11-21T04:31:39.220	emlog through 6.0.0beta allows remote authenticated users to delete arbitrary files via admin/template.php?action=del&tpl=../ directory traversal.	6.5	MEDIUM	CVSS:3.1/AV:N/AC:L/PR:L/UI:N/S:U/C:N/I:H/A:N		
CVE-2019-17074	2019-10-01T20:15:11.307	2024-11-21T04:31:39.357	An issue was discovered in XunRuiCMS 4.3.1. There is a stored XSS in the module_category area.	5.4	MEDIUM	CVSS:3.1/AV:N/AC:L/PR:L/UI:R/S:C/C:L/I:L/A:N		
CVE-2019-8288	2019-10-01T20:15:11.367	2024-11-21T04:49:39.133	Vulnerability in Online Store v1.0, Stored XSS in user_view.php where adidas_member_user variable is not sanitized.	5.4	MEDIUM	CVSS:3.1/AV:N/AC:L/PR:L/UI:R/S:C/C:L/I:L/A:N		
CVE-2019-8289	2019-10-01T20:15:11.430	2024-11-21T04:49:39.243	Vulnerability in Online Store v1.0, stored XSS in admin/user_view.php adidas_member_email variable	5.4	MEDIUM	CVSS:3.1/AV:N/AC:L/PR:L/UI:R/S:C/C:L/I:L/A:N		
CVE-2019-8290	2019-10-01T20:15:11.527	2024-11-21T04:49:39.353	Vulnerability in Online Store v1.0, The registration form requirements for the member email format can be bypassed by posting directly to sent_register.php allowing special characters to be included and an XSS payload to be injected.	6.1	MEDIUM	CVSS:3.1/AV:N/AC:L/PR:N/UI:R/S:C/C:L/I:L/A:N		
CVE-2019-8291	2019-10-01T20:15:11.603	2024-11-21T04:49:39.467	Online Store System v1.0 delete_file.php doesn't check to see if a user has administrative rights nor does it check for path traversal.	7.5	HIGH	CVSS:3.1/AV:N/AC:L/PR:N/UI:N/S:U/C:N/I:H/A:N		
CVE-2019-8292	2019-10-01T20:15:11.713	2024-11-21T04:49:39.580	Online Store System v1.0 delete_product.php doesn't check to see if a user authtenticated or has administrative rights allowing arbitrary product deletion.	5.3	MEDIUM	CVSS:3.1/AV:N/AC:L/PR:N/UI:N/S:U/C:N/I:L/A:N		
CVE-2019-17075	2019-10-01T21:15:11.523	2024-11-21T04:31:39.500	An issue was discovered in write_tpt_entry in drivers/infiniband/hw/cxgb4/mem.c in the Linux kernel through 5.3.2. The cxgb4 driver is directly calling dma_map_single (a DMA function) from a stack variable. This could allow an attacker to trigger a Denial of Service, exploitable if this driver is used on an architecture for which this stack/DMA interaction has security relevance.	7.5	HIGH	CVSS:3.1/AV:N/AC:L/PR:N/UI:N/S:U/C:N/I:N/A:H		
CVE-2019-13335	2019-10-02T12:15:11.507	2024-11-21T04:24:44.263	SalesAgility SuiteCRM 7.10.x 7.10.19 and 7.11.x before and 7.11.7 has SSRF.	9.8	CRITICAL	CVSS:3.1/AV:N/AC:L/PR:N/UI:N/S:U/C:H/I:H/A:H		
CVE-2019-14454	2019-10-02T12:15:11.647	2024-11-21T04:26:46.557	SuiteCRM 7.11.x and 7.10.x before 7.11.8 and 7.10.20 is vulnerable to vertical privilege escalation.	9.8	CRITICAL	CVSS:3.1/AV:N/AC:L/PR:N/UI:N/S:U/C:H/I:H/A:H		
CVE-2019-17080	2019-10-02T13:15:11.373	2024-11-21T04:31:39.823	mintinstall (aka Software Manager) 7.9.9 for Linux Mint allows code execution if a REVIEWS_CACHE file is controlled by an attacker, because an unpickle occurs. This is resolved in 8.0.0 and backports.	7.8	HIGH	CVSS:3.1/AV:L/AC:L/PR:N/UI:R/S:U/C:H/I:H/A:H		
CVE-2019-17091	2019-10-02T14:15:12.600	2024-11-21T04:31:40.197	faces/context/PartialViewContextImpl.java in Eclipse Mojarra, as used in Mojarra for Eclipse EE4J before 2.3.10 and Mojarra JavaServer Faces before 2.2.20, allows Reflected XSS because a client window field is mishandled.	6.1	MEDIUM	CVSS:3.1/AV:N/AC:L/PR:N/UI:R/S:C/C:L/I:L/A:N		
CVE-2019-13025	2019-10-02T15:15:10.357	2024-11-21T04:24:03.430	Compal CH7465LG CH7465LG-NCIP-6.12.18.24-5p8-NOSH devices have Incorrect Access Control because of Improper Input Validation. The attacker can send a maliciously modified POST (HTTP) request containing shell commands, which will be executed on the device, to an backend API endpoint of the cable modem.	9.8	CRITICAL	CVSS:3.1/AV:N/AC:L/PR:N/UI:N/S:U/C:H/I:H/A:H		
CVE-2019-4520	2019-10-02T15:15:10.450	2024-11-21T04:43:41.167	IBM Security Directory Server 6.4.0 uses an inadequate account lockout setting that could allow a remote attacker to brute force account credentials. IBM X-Force ID: 165178.	7.5	HIGH	CVSS:3.1/AV:N/AC:L/PR:N/UI:N/S:U/C:H/I:N/A:N		
CVE-2019-4538	2019-10-02T15:15:10.497	2024-11-21T04:43:42.027	IBM Security Directory Server 6.4.0 could allow a remote attacker to conduct phishing attacks, using an open redirect attack. By persuading a victim to visit a specially-crafted Web site, a remote attacker could exploit this vulnerability to spoof the URL displayed to redirect a user to a malicious Web site that would appear to be trusted. This could allow the attacker to obtain highly sensitive information or conduct further attacks against the victim. IBM X-Force ID: 165660.	8.2	HIGH	CVSS:3.1/AV:N/AC:L/PR:N/UI:R/S:C/C:L/I:H/A:N		
CVE-2019-4539	2019-10-02T15:15:10.547	2024-11-21T04:43:42.150	IBM Security Directory Server 6.4.0 does not properly neutralize special elements that are used in XML, allowing attackers to modify the syntax, content, or commands of the XML before it is processed by an end system. IBM X-Force ID: 165812.	7.1	HIGH	CVSS:3.1/AV:N/AC:L/PR:L/UI:N/S:U/C:N/I:L/A:H		
CVE-2019-4542	2019-10-02T15:15:10.607	2024-11-21T04:43:42.530	IBM Security Directory Server 6.4.0 is vulnerable to cross-site scripting. This vulnerability allows users to embed arbitrary JavaScript code in the Web UI thus altering the intended functionality potentially leading to credentials disclosure within a trusted session. IBM X-Force ID: 165815.	6.1	MEDIUM	CVSS:3.1/AV:N/AC:L/PR:N/UI:R/S:C/C:L/I:L/A:N		
CVE-2019-4549	2019-10-02T15:15:10.670	2024-11-21T04:43:43.170	IBM Security Directory Server 6.4.0 discloses sensitive information to unauthorized users. The information can be used to mount further attacks on the system. IBM X-Force ID: 165951.	5.3	MEDIUM	CVSS:3.1/AV:N/AC:L/PR:N/UI:N/S:U/C:L/I:N/A:N		
CVE-2019-13343	2019-10-02T16:15:14.227	2024-11-21T04:24:45.243	Butor Portal before 1.0.27 is affected by a Path Traversal vulnerability leading to a pre-authentication arbitrary file download. Effectively, a remote anonymous user can download any file on servers running Butor Portal. WhiteLabelingServlet is responsible for this vulnerability. It does not properly sanitize user input on the theme t parameter before reusing it in a path. This path is then used without validation to fetch a file and return its raw content to the user via the /wl?t=../../...&h= substring followed by a filename.	7.5	HIGH	CVSS:3.1/AV:N/AC:L/PR:N/UI:N/S:U/C:N/I:H/A:N		
CVE-2019-16116	2019-10-02T16:15:14.287	2024-11-21T04:30:04.810	EnterpriseDT CompleteFTP Server prior to version 12.1.3 is vulnerable to information exposure in the Bootstrap.log file. This allows an attacker to obtain the administrator password hash.	4.3	MEDIUM	CVSS:3.1/AV:N/AC:L/PR:L/UI:N/S:U/C:L/I:N/A:N		
CVE-2019-5031	2019-10-02T16:15:14.350	2024-11-21T04:44:12.947	An exploitable memory corruption vulnerability exists in the JavaScript engine of Foxit Software's Foxit PDF Reader, version 9.4.1.16828. A specially crafted PDF document can trigger an out-of-memory condition which isn't handled properly, resulting in arbitrary code execution. An attacker needs to trick the user to open the malicious file to trigger this vulnerability. If the browser plugin extension is enabled, visiting a malicious site can also trigger the vulnerability.	8.8	HIGH	CVSS:3.1/AV:N/AC:L/PR:N/UI:R/S:U/C:H/I:H/A:H		
CVE-2019-13658	2019-10-02T17:15:11.967	2024-11-21T04:25:27.403	CA Network Flow Analysis 9.x and 10.0.x have a default credential vulnerability that can allow a remote attacker to execute arbitrary commands and compromise system security.	9.8	CRITICAL	CVSS:3.1/AV:N/AC:L/PR:N/UI:N/S:U/C:H/I:H/A:H		
CVE-2019-8462	2019-10-02T17:15:12.403	2024-11-21T04:49:57.107	In a rare scenario, Check Point R80.30 Security Gateway before JHF Take 50 managed by Check Point R80.30 Management crashes with a unique configuration of enhanced logging.	7.5	HIGH	CVSS:3.1/AV:N/AC:L/PR:N/UI:N/S:U/C:N/I:N/A:H		
CVE-2019-10212	2019-10-02T19:15:11.703	2024-11-21T04:18:39.980	A flaw was found in, all under 2.0.20, in the Undertow DEBUG log for io.undertow.request.security. If enabled, an attacker could abuse this flaw to obtain the user's credentials from the log files.	9.8	CRITICAL	CVSS:3.1/AV:N/AC:L/PR:N/UI:N/S:U/C:H/I:H/A:H		
CVE-2019-11929	2019-10-02T19:15:11.780	2024-11-21T04:22:00.190	Insufficient boundary checks when formatting numbers in number_format allows read/write access to out-of-bounds memory, potentially leading to remote code execution. This issue affects HHVM versions prior to 3.30.10, all versions between 4.0.0 and 4.8.5, all versions between 4.9.0 and 4.18.2, and versions 4.19.0, 4.19.1, 4.20.0, 4.20.1, 4.20.2, 4.21.0, 4.22.0, 4.23.0.	9.8	CRITICAL	CVSS:3.1/AV:N/AC:L/PR:N/UI:N/S:U/C:H/I:H/A:H		
CVE-2019-12156	2019-10-02T19:15:11.827	2024-11-21T04:22:19.723	Server metadata could be exposed because one of the error messages reflected the whole response back to the client in JetBrains TeamCity versions before 2018.2.5 and UpSource versions before 2018.2 build 1293.	5.3	MEDIUM	CVSS:3.1/AV:N/AC:L/PR:N/UI:N/S:U/C:L/I:N/A:N		
CVE-2019-12157	2019-10-02T19:15:11.890	2024-11-21T04:22:19.863	In JetBrains UpSource versions before 2018.2 build 1293, there is credential disclosure via RPC commands.	9.8	CRITICAL	CVSS:3.1/AV:N/AC:L/PR:N/UI:N/S:U/C:H/I:H/A:H		
CVE-2019-12630	2019-10-02T19:15:11.953	2024-11-21T04:23:13.470	A vulnerability in the Java deserialization function used by Cisco Security Manager could allow an unauthenticated, remote attacker to execute arbitrary commands on an affected device. The vulnerability is due to insecure deserialization of user-supplied content by the affected software. An attacker could exploit this vulnerability by sending a malicious serialized Java object to a specific listener on an affected system. A successful exploit could allow the attacker to execute arbitrary commands on the device with the privileges of casuser.	9.8	CRITICAL	CVSS:3.1/AV:N/AC:L/PR:N/UI:N/S:U/C:H/I:H/A:H		
CVE-2019-12631	2019-10-02T19:15:12.000	2024-11-21T04:23:13.600	A vulnerability in the web-based guest portal of Cisco Identity Services Engine (ISE) could allow an unauthenticated, remote attacker to conduct a cross-site scripting (XSS) attack against a user of the web-based management interface. The vulnerability is due to insufficient validation of user-supplied input that is processed by the web-based management interface. An attacker could exploit this vulnerability by persuading a user to click a crafted link. A successful exploit could allow the attacker to execute arbitrary script code in the context of the interface or access sensitive browser-based information.	6.1	MEDIUM	CVSS:3.1/AV:N/AC:L/PR:N/UI:R/S:C/C:L/I:L/A:N		
CVE-2019-12673	2019-10-02T19:15:12.077	2024-11-21T04:23:19.777	A vulnerability in the FTP inspection engine of Cisco Adaptive Security (ASA) Software and Cisco Firepower Threat Defense (FTD) Software could allow an unauthenticated, remote attacker to cause a denial of service (DoS) condition on an affected device. The vulnerability is due to insufficient validation of FTP data. An attacker could exploit this vulnerability by sending malicious FTP traffic through an affected device. A successful exploit could allow the attacker to cause a DoS condition on the affected device.	7.5	HIGH	CVSS:3.1/AV:N/AC:L/PR:N/UI:N/S:U/C:N/I:N/A:H		
CVE-2019-12674	2019-10-02T19:15:12.123	2024-11-21T04:23:19.917	Multiple vulnerabilities in the multi-instance feature of Cisco Firepower Threat Defense (FTD) Software could allow an authenticated, local attacker to escape the container for their FTD instance and execute commands with root privileges in the host namespace. These vulnerabilities are due to insufficient protections on the underlying filesystem. An attacker could exploit these vulnerabilities by modifying critical files on the underlying filesystem. A successful exploit could allow the attacker to execute commands with root privileges within the host namespace. This could allow the attacker to impact other running FTD instances.	8.2	HIGH	CVSS:3.1/AV:L/AC:L/PR:H/UI:N/S:C/C:H/I:H/A:H		
