CVE ID	Published Date	Last Modified Date	Description	Base Score	Base Severity	Vector String	Vendor	Product
CVE-2019-20902	2020-10-01T02:15:12.450	2024-11-21T04:39:39.210	Upgrading Crowd via XML Data Transfer can reactivate a disabled user from OpenLDAP. The affected versions are from before version 3.4.6 and from 3.5.0 before 3.5.1.	7.5	HIGH	CVSS:3.1/AV:N/AC:L/PR:N/UI:N/S:U/C:N/I:H/A:N		
CVE-2019-20903	2020-10-01T02:15:12.513	2024-11-21T04:39:39.330	The hyperlinks functionality in atlaskit/editor-core in before version 113.1.5 allows remote attackers to inject arbitrary HTML or JavaScript via a Cross-Site Scripting (XSS) vulnerability in link targets.	5.4	MEDIUM	CVSS:3.1/AV:N/AC:L/PR:L/UI:R/S:C/C:L/I:L/A:N		
CVE-2020-8109	2020-10-01T13:15:12.443	2024-11-21T05:38:18.793	A vulnerability has been discovered in the ace.xmd parser that results from a lack of proper validation of user-supplied data, which can result in a write past the end of an allocated buffer. This can result in denial-of-service. This issue affects: Bitdefender Engines version 7.84892 and prior versions.	5.9	MEDIUM	CVSS:3.1/AV:N/AC:H/PR:N/UI:N/S:U/C:N/I:N/A:H		
CVE-2020-24860	2020-10-01T14:15:15.223	2024-11-21T05:16:08.420	CMS Made Simple 2.2.14 allows an authenticated user with access to the Content Manager to edit content and put persistent XSS payload in the affected text fields. The user can get cookies from every authenticated user who visits the website.	5.4	MEDIUM	CVSS:3.1/AV:N/AC:L/PR:L/UI:R/S:C/C:L/I:L/A:N		
CVE-2020-24861	2020-10-01T14:15:15.287	2024-11-21T05:16:08.603	GetSimple CMS 3.3.16 allows in parameter 'permalink' on the Settings page persistent Cross Site Scripting which is executed when you create and open a new page	5.4	MEDIUM	CVSS:3.1/AV:N/AC:L/PR:L/UI:R/S:C/C:L/I:L/A:N		
CVE-2020-25990	2020-10-01T14:15:15.583	2024-11-21T05:19:02.673	WebsiteBaker 2.12.2 allows SQL Injection via parameter 'display_name' in /websitebaker/admin/preferences/save.php. Exploiting this issue could allow an attacker to compromise the application, access or modify data, or exploit latent vulnerabilities in the underlying database.	9.8	CRITICAL	CVSS:3.1/AV:N/AC:L/PR:N/UI:N/S:U/C:H/I:H/A:H		
CVE-2020-4576	2020-10-01T16:15:12.520	2024-11-21T05:32:55.830	IBM WebSphere Application Server 7.5, 8.0, 8.5, and 9.0 traditional could allow a remote attacker to obtain sensitive information with a specially-crafted sequence of serialized objects. IBM X-Force ID: 184428.	7.5	HIGH	CVSS:3.1/AV:N/AC:L/PR:N/UI:N/S:U/C:H/I:N/A:N		
CVE-2019-19393	2020-10-01T17:15:13.057	2024-11-21T04:34:42.700	The Web application on Rittal CMC PU III 7030.000 V3.00 V3.11.00_2 to V3.15.70_4 devices fails to sanitize user input on the system configurations page. This allows an attacker to backdoor the device with HTML and browser-interpreted content (such as JavaScript or other client-side scripts) as the content is always displayed after and before login. Persistent XSS allows an attacker to modify displayed content or to change the victim's information. Successful exploitation requires access to the web management interface, either with valid credentials or a hijacked session.	6.1	MEDIUM	CVSS:3.1/AV:N/AC:L/PR:N/UI:R/S:C/C:L/I:L/A:N		
CVE-2020-16844	2020-10-01T17:15:13.150	2024-11-21T05:07:15.150	In Istio 1.5.0 though 1.5.8 and Istio 1.6.0 through 1.6.7, when users specify an AuthorizationPolicy resource with DENY actions using wildcard suffixes (e.g. *-some-suffix) for source principals or namespace fields, callers will never be denied access, bypassing the intended policy.	6.8	MEDIUM	CVSS:3.1/AV:N/AC:H/PR:L/UI:N/S:U/C:H/I:H/A:N		
CVE-2020-24620	2020-10-01T17:15:13.213	2024-11-21T05:15:12.087	Unisys Stealth(core) before 4.0.134 stores passwords in a recoverable format. Therefore, a search of Enterprise Manager can potentially reveal credentials.	7.8	HIGH	CVSS:3.1/AV:L/AC:L/PR:L/UI:N/S:U/C:H/I:H/A:H		
CVE-2020-25017	2020-10-01T17:15:13.337	2024-11-21T05:16:31.453	Envoy through 1.15.0 only considers the first value when multiple header values are present for some HTTP headers. Envoy’s setCopy() header map API does not replace all existing occurences of a non-inline header.	8.3	HIGH	CVSS:3.1/AV:N/AC:L/PR:N/UI:N/S:C/C:L/I:L/A:L		
CVE-2020-25018	2020-10-01T17:15:13.387	2024-11-21T05:16:32.960	Envoy master between 2d69e30 and 3b5acb2 may fail to parse request URL that requires host canonicalization.	7.5	HIGH	CVSS:3.1/AV:N/AC:L/PR:N/UI:N/S:U/C:N/I:N/A:H		
CVE-2020-15228	2020-10-01T18:15:12.480	2024-11-21T05:05:08.327	In the `@actions/core` npm module before version 1.2.6,`addPath` and `exportVariable` functions communicate with the Actions Runner over stdout by generating a string in a specific format. Workflows that log untrusted data to stdout may invoke these commands, resulting in the path or environment variables being modified without the intention of the workflow or action author. The runner will release an update that disables the `set-env` and `add-path` workflow commands in the near future. For now, users should upgrade to `@actions/core v1.2.6` or later, and replace any instance of the `set-env` or `add-path` commands in their workflows with the new Environment File Syntax. Workflows and actions using the old commands or older versions of the toolkit will start to warn, then error out during workflow execution.	3.5	LOW	CVSS:3.1/AV:N/AC:H/PR:L/UI:N/S:C/C:L/I:N/A:N		
CVE-2020-25200	2020-10-01T18:15:12.577	2024-11-21T05:17:37.810	Pritunl 1.29.2145.25 allows attackers to enumerate valid VPN usernames via a series of /auth/session login attempts. Initially, the server will return error 401. However, if the username is valid, then after 20 login attempts, the server will start responding with error 400. Invalid usernames will receive error 401 indefinitely. Note: This has been disputed by the vendor as not a vulnerability. They argue that this is an intended design	5.3	MEDIUM	CVSS:3.1/AV:N/AC:L/PR:N/UI:N/S:U/C:L/I:N/A:N		
CVE-2020-15227	2020-10-01T19:15:12.797	2024-11-21T05:05:08.170	Nette versions before 2.0.19, 2.1.13, 2.2.10, 2.3.14, 2.4.16, 3.0.6 are vulnerable to an code injection attack by passing specially formed parameters to URL that may possibly leading to RCE. Nette is a PHP/Composer MVC Framework.	8.7	HIGH	CVSS:3.1/AV:N/AC:H/PR:N/UI:N/S:C/C:H/I:H/A:N		
CVE-2020-15533	2020-10-01T19:15:12.893	2024-11-21T05:05:42.700	In Zoho ManageEngine Application Manager 14.7 Build 14730 (before 14684, and between 14689 and 14750), the AlarmEscalation module is vulnerable to unauthenticated SQL Injection attack.	9.8	CRITICAL	CVSS:3.1/AV:N/AC:L/PR:N/UI:N/S:U/C:H/I:H/A:H		
CVE-2020-15663	2020-10-01T19:15:12.970	2024-11-21T05:05:58.227	If Firefox is installed to a user-writable directory, the Mozilla Maintenance Service would execute updater.exe from the install location with system privileges. Although the Mozilla Maintenance Service does ensure that updater.exe is signed by Mozilla, the version could have been rolled back to a previous version which would have allowed exploitation of an older bug and arbitrary code execution with System Privileges. *Note: This issue only affected Windows operating systems. Other operating systems are unaffected.*. This vulnerability affects Firefox < 80, Thunderbird < 78.2, Thunderbird < 68.12, Firefox ESR < 68.12, and Firefox ESR < 78.2.	8.8	HIGH	CVSS:3.1/AV:N/AC:L/PR:N/UI:R/S:U/C:H/I:H/A:H		
CVE-2020-15664	2020-10-01T19:15:13.047	2024-11-21T05:05:58.347	By holding a reference to the eval() function from an about:blank window, a malicious webpage could have gained access to the InstallTrigger object which would allow them to prompt the user to install an extension. Combined with user confusion, this could result in an unintended or malicious extension being installed. This vulnerability affects Firefox < 80, Thunderbird < 78.2, Thunderbird < 68.12, Firefox ESR < 68.12, Firefox ESR < 78.2, and Firefox for Android < 80.	6.5	MEDIUM	CVSS:3.1/AV:N/AC:L/PR:N/UI:R/S:U/C:N/I:H/A:N		
CVE-2020-15665	2020-10-01T19:15:13.127	2024-11-21T05:05:58.470	Firefox did not reset the address bar after the beforeunload dialog was shown if the user chose to remain on the page. This could have resulted in an incorrect URL being shown when used in conjunction with other unexpected browser behaviors. This vulnerability affects Firefox < 80.	4.3	MEDIUM	CVSS:3.1/AV:N/AC:L/PR:N/UI:R/S:U/C:N/I:L/A:N		
CVE-2020-15666	2020-10-01T19:15:13.203	2024-11-21T05:05:58.577	When trying to load a non-video in an audio/video context the exact status code (200, 302, 404, 500, 412, 403, etc.) was disclosed via the MediaError Message. This level of information leakage is inconsistent with the standardized onerror/onsuccess disclosure and can lead to inferring login status to services or device discovery on a local network among other attacks. This vulnerability affects Firefox < 80 and Firefox for Android < 80.	6.5	MEDIUM	CVSS:3.1/AV:N/AC:L/PR:N/UI:R/S:U/C:H/I:N/A:N		
CVE-2020-15667	2020-10-01T19:15:13.267	2024-11-21T05:05:58.690	When processing a MAR update file, after the signature has been validated, an invalid name length could result in a heap overflow, leading to memory corruption and potentially arbitrary code execution. Within Firefox as released by Mozilla, this issue is only exploitable with the Mozilla-controlled signing key. This vulnerability affects Firefox < 80.	8.8	HIGH	CVSS:3.1/AV:N/AC:L/PR:N/UI:R/S:U/C:H/I:H/A:H		
CVE-2020-15668	2020-10-01T19:15:13.330	2024-11-21T05:05:58.793	A lock was missing when accessing a data structure and importing certificate information into the trust database. This vulnerability affects Firefox < 80 and Firefox for Android < 80.	4.3	MEDIUM	CVSS:3.1/AV:N/AC:L/PR:N/UI:R/S:U/C:L/I:N/A:N		
CVE-2020-15669	2020-10-01T19:15:13.407	2024-11-21T05:05:58.903	When aborting an operation, such as a fetch, an abort signal may be deleted while alerting the objects to be notified. This results in a use-after-free and we presume that with enough effort it could have been exploited to run arbitrary code. This vulnerability affects Firefox ESR < 68.12 and Thunderbird < 68.12.	8.8	HIGH	CVSS:3.1/AV:N/AC:L/PR:N/UI:R/S:U/C:H/I:H/A:H		
CVE-2020-15670	2020-10-01T19:15:13.470	2024-11-21T05:05:59.020	Mozilla developers reported memory safety bugs present in Firefox for Android 79. Some of these bugs showed evidence of memory corruption and we presume that with enough effort some of these could have been exploited to run arbitrary code. This vulnerability affects Firefox < 80, Firefox ESR < 78.2, Thunderbird < 78.2, and Firefox for Android < 80.	8.8	HIGH	CVSS:3.1/AV:N/AC:L/PR:N/UI:R/S:U/C:H/I:H/A:H		
CVE-2020-15671	2020-10-01T19:15:13.533	2024-11-21T05:05:59.140	When typing in a password under certain conditions, a race may have occured where the InputContext was not being correctly set for the input field, resulting in the typed password being saved to the keyboard dictionary. This vulnerability affects Firefox for Android < 80.	3.1	LOW	CVSS:3.1/AV:N/AC:H/PR:N/UI:R/S:U/C:L/I:N/A:N		
CVE-2020-15673	2020-10-01T19:15:13.580	2024-11-21T05:05:59.247	Mozilla developers reported memory safety bugs present in Firefox 80 and Firefox ESR 78.2. Some of these bugs showed evidence of memory corruption and we presume that with enough effort some of these could have been exploited to run arbitrary code. This vulnerability affects Firefox < 81, Thunderbird < 78.3, and Firefox ESR < 78.3.	8.8	HIGH	CVSS:3.1/AV:N/AC:L/PR:N/UI:R/S:U/C:H/I:H/A:H		
CVE-2020-15674	2020-10-01T19:15:13.643	2024-11-21T05:05:59.387	Mozilla developers reported memory safety bugs present in Firefox 80. Some of these bugs showed evidence of memory corruption and we presume that with enough effort some of these could have been exploited to run arbitrary code. This vulnerability affects Firefox < 81.	8.8	HIGH	CVSS:3.1/AV:N/AC:L/PR:N/UI:R/S:U/C:H/I:H/A:H		
CVE-2020-15675	2020-10-01T19:15:13.720	2024-11-21T05:05:59.497	When processing surfaces, the lifetime may outlive a persistent buffer leading to memory corruption and a potentially exploitable crash. This vulnerability affects Firefox < 81.	8.8	HIGH	CVSS:3.1/AV:N/AC:L/PR:N/UI:R/S:U/C:H/I:H/A:H		
CVE-2020-15676	2020-10-01T19:15:13.783	2024-11-21T05:05:59.653	Firefox sometimes ran the onload handler for SVG elements that the DOM sanitizer decided to remove, resulting in JavaScript being executed after pasting attacker-controlled data into a contenteditable element. This vulnerability affects Firefox < 81, Thunderbird < 78.3, and Firefox ESR < 78.3.	6.1	MEDIUM	CVSS:3.1/AV:N/AC:L/PR:N/UI:R/S:C/C:L/I:L/A:N		
CVE-2020-15677	2020-10-01T19:15:13.830	2024-11-21T05:05:59.787	By exploiting an Open Redirect vulnerability on a website, an attacker could have spoofed the site displayed in the download file dialog to show the original site (the one suffering from the open redirect) rather than the site the file was actually downloaded from. This vulnerability affects Firefox < 81, Thunderbird < 78.3, and Firefox ESR < 78.3.	6.1	MEDIUM	CVSS:3.1/AV:N/AC:L/PR:N/UI:R/S:C/C:L/I:L/A:N		
CVE-2020-15678	2020-10-01T19:15:13.893	2024-11-21T05:05:59.923	When recursing through graphical layers while scrolling, an iterator may have become invalid, resulting in a potential use-after-free. This occurs because the function APZCTreeManager::ComputeClippedCompositionBounds did not follow iterator invalidation rules. This vulnerability affects Firefox < 81, Thunderbird < 78.3, and Firefox ESR < 78.3.	8.8	HIGH	CVSS:3.1/AV:N/AC:L/PR:N/UI:R/S:U/C:H/I:H/A:H		
CVE-2020-11979	2020-10-01T20:15:13.033	2024-11-21T04:59:02.170	As mitigation for CVE-2020-1945 Apache Ant 1.10.8 changed the permissions of temporary files it created so that only the current user was allowed to access them. Unfortunately the fixcrlf task deleted the temporary file and created a new one without said protection, effectively nullifying the effort. This would still allow an attacker to inject modified source files into the build process.	7.5	HIGH	CVSS:3.1/AV:N/AC:L/PR:N/UI:N/S:U/C:N/I:H/A:N		
CVE-2020-13940	2020-10-01T20:15:13.097	2024-11-21T05:02:11.600	In Apache NiFi 1.0.0 to 1.11.4, the notification service manager and various policy authorizer and user group provider objects allowed trusted administrators to inadvertently configure a potentially malicious XML file. The XML file has the ability to make external calls to services (via XXE).	5.5	MEDIUM	CVSS:3.1/AV:L/AC:L/PR:N/UI:R/S:U/C:H/I:N/A:N		
CVE-2020-14223	2020-10-01T20:15:13.143	2024-11-21T05:02:53.557	HCL Digital Experience 8.5, 9.0, 9.5 is susceptible to cross-site scripting (XSS). The vulnerability could be employed in a reflected or non-persistent XSS attack.	6.1	MEDIUM	CVSS:3.1/AV:N/AC:L/PR:N/UI:R/S:C/C:L/I:L/A:N		
CVE-2020-5387	2020-10-01T20:15:13.550	2024-11-21T05:34:02.590	Dell XPS 13 9370 BIOS versions prior to 1.13.1 contains an Improper Exception Handling vulnerability. A local attacker with physical access could exploit this vulnerability to prevent the system from booting until the exploited boot device is removed.	2.3	LOW	CVSS:3.1/AV:L/AC:L/PR:H/UI:N/S:U/C:N/I:N/A:L		
CVE-2020-5784	2020-10-01T20:15:13.783	2024-11-21T05:34:35.603	Server-Side Request Forgery in Teltonika firmware TRB2_R_00.02.04.3 allows a low privileged user to cause the application to perform HTTP GET requests to arbitrary URLs.	6.5	MEDIUM	CVSS:3.1/AV:N/AC:L/PR:L/UI:N/S:U/C:N/I:H/A:N		
CVE-2020-5785	2020-10-01T20:15:13.863	2024-11-21T05:34:35.697	Insufficient output sanitization in Teltonika firmware TRB2_R_00.02.04.3 allows an unauthenticated attacker to conduct reflected cross-site scripting via a crafted ‘action’ or ‘pkg_name’ parameter.	6.1	MEDIUM	CVSS:3.1/AV:N/AC:L/PR:N/UI:R/S:C/C:L/I:L/A:N		
CVE-2020-5786	2020-10-01T20:15:13.910	2024-11-21T05:34:35.787	Cross-site request forgery in Teltonika firmware TRB2_R_00.02.04.3 allows a remote attacker to perform sensitive application actions by tricking legitimate users into clicking a crafted link.	8.8	HIGH	CVSS:3.1/AV:N/AC:L/PR:N/UI:R/S:U/C:H/I:H/A:H		
CVE-2020-5787	2020-10-01T20:15:13.987	2024-11-21T05:34:35.877	Relative Path Traversal in Teltonika firmware TRB2_R_00.02.04.3 allows a remote, authenticated attacker to delete arbitrary files on disk via the admin/services/packages/remove action.	6.5	MEDIUM	CVSS:3.1/AV:N/AC:L/PR:H/UI:N/S:U/C:N/I:H/A:H		
CVE-2020-5788	2020-10-01T20:15:14.033	2024-11-21T05:34:35.970	Relative Path Traversal in Teltonika firmware TRB2_R_00.02.04.3 allows a remote, authenticated attacker to delete arbitrary files on disk via the admin/system/admin/certificates/delete action.	6.5	MEDIUM	CVSS:3.1/AV:N/AC:L/PR:H/UI:N/S:U/C:N/I:H/A:H		
CVE-2020-5789	2020-10-01T20:15:14.097	2024-11-21T05:34:36.080	Relative Path Traversal in Teltonika firmware TRB2_R_00.02.04.3 allows a remote, authenticated attacker to read the contents of arbitrary files on disk.	6.5	MEDIUM	CVSS:3.1/AV:N/AC:L/PR:L/UI:N/S:U/C:H/I:N/A:N		
CVE-2020-9486	2020-10-01T20:15:14.190	2024-11-21T05:40:44.833	In Apache NiFi 1.10.0 to 1.11.4, the NiFi stateless execution engine produced log output which included sensitive property values. When a flow was triggered, the flow definition configuration JSON was printed, potentially containing sensitive values in plaintext.	7.5	HIGH	CVSS:3.1/AV:N/AC:L/PR:N/UI:N/S:U/C:H/I:N/A:N		
CVE-2020-9487	2020-10-01T20:15:14.253	2024-11-21T05:40:44.937	In Apache NiFi 1.0.0 to 1.11.4, the NiFi download token (one-time password) mechanism used a fixed cache size and did not authenticate a request to create a download token, only when attempting to use the token to access the content. An unauthenticated user could repeatedly request download tokens, preventing legitimate users from requesting download tokens.	7.5	HIGH	CVSS:3.1/AV:N/AC:L/PR:N/UI:N/S:U/C:N/I:N/A:H		
CVE-2020-9491	2020-10-01T20:15:14.330	2024-11-21T05:40:45.750	In Apache NiFi 1.2.0 to 1.11.4, the NiFi UI and API were protected by mandating TLS v1.2, as well as listening connections established by processors like ListenHTTP, HandleHttpRequest, etc. However intracluster communication such as cluster request replication, Site-to-Site, and load balanced queues continued to support TLS v1.0 or v1.1.	7.5	HIGH	CVSS:3.1/AV:N/AC:L/PR:N/UI:N/S:U/C:H/I:N/A:N		
CVE-2020-26511	2020-10-02T05:15:12.457	2024-11-21T05:19:56.513	The wpo365-login plugin before v11.7 for WordPress allows use of a symmetric algorithm to decrypt a JWT token. This leads to authentication bypass.	7.5	HIGH	CVSS:3.1/AV:N/AC:L/PR:N/UI:N/S:U/C:N/I:H/A:N		
CVE-2020-26518	2020-10-02T05:15:12.643	2024-11-21T05:19:58.797	Artica Pandora FMS before 743 allows unauthenticated attackers to conduct SQL injection attacks via the pandora_console/include/chart_generator.php session_id parameter.	9.8	CRITICAL	CVSS:3.1/AV:N/AC:L/PR:N/UI:N/S:U/C:H/I:H/A:H		
CVE-2020-26519	2020-10-02T06:15:12.487	2024-11-21T05:19:59.017	Artifex MuPDF before 1.18.0 has a heap based buffer over-write when parsing JBIG2 files allowing attackers to cause a denial of service.	5.5	MEDIUM	CVSS:3.1/AV:L/AC:L/PR:N/UI:R/S:U/C:N/I:N/A:H		
CVE-2020-26523	2020-10-02T07:15:12.027	2024-11-21T05:20:00.523	Froala Editor before 3.2.2 allows XSS via pasted content.	6.1	MEDIUM	CVSS:3.1/AV:N/AC:L/PR:N/UI:R/S:C/C:L/I:L/A:N		
CVE-2020-26524	2020-10-02T07:15:12.090	2024-11-21T05:20:00.813	CodeLathe FileCloud before 20.2.0.11915 allows username enumeration.	5.3	MEDIUM	CVSS:3.1/AV:N/AC:L/PR:N/UI:N/S:U/C:L/I:N/A:N		
CVE-2020-26534	2020-10-02T08:15:12.447	2024-11-21T05:20:01.517	An issue was discovered in Foxit Reader and PhantomPDF before 10.1. There is an Opt object use-after-free related to Field::ClearItems and Field::DeleteOptions, during AcroForm JavaScript execution.	9.8	CRITICAL	CVSS:3.1/AV:N/AC:L/PR:N/UI:N/S:U/C:H/I:H/A:H		
CVE-2020-26535	2020-10-02T08:15:12.493	2024-11-21T05:20:01.667	An issue was discovered in Foxit Reader and PhantomPDF before 10.1. If TslAlloc attempts to allocate thread local storage but obtains an unacceptable index value, V8 throws an exception that leads to a write access violation (and read access violation).	9.8	CRITICAL	CVSS:3.1/AV:N/AC:L/PR:N/UI:N/S:U/C:H/I:H/A:H		
CVE-2020-26536	2020-10-02T08:15:12.557	2024-11-21T05:20:01.817	An issue was discovered in Foxit Reader and PhantomPDF before 10.1. There is a NULL pointer dereference via a crafted PDF document.	5.5	MEDIUM	CVSS:3.1/AV:L/AC:L/PR:N/UI:R/S:U/C:N/I:N/A:H		
CVE-2020-26537	2020-10-02T08:15:12.617	2024-11-21T05:20:01.967	An issue was discovered in Foxit Reader and PhantomPDF before 10.1. In a certain Shading calculation, the number of outputs is unequal to the number of color components in a color space. This causes an out-of-bounds write.	9.8	CRITICAL	CVSS:3.1/AV:N/AC:L/PR:N/UI:N/S:U/C:H/I:H/A:H		
CVE-2020-26538	2020-10-02T08:15:12.680	2024-11-21T05:20:02.120	An issue was discovered in Foxit Reader and PhantomPDF before 10.1. It allows attackers to execute arbitrary code via a Trojan horse taskkill.exe in the current working directory.	7.8	HIGH	CVSS:3.1/AV:L/AC:L/PR:N/UI:R/S:U/C:H/I:H/A:H		
CVE-2020-26539	2020-10-02T08:15:12.743	2024-11-21T05:20:02.260	An issue was discovered in Foxit Reader and PhantomPDF before 10.1. When there is a multiple interpretation error for /V (in the Additional Action and Field dictionaries), a use-after-free can occur with resultant remote code execution (or an information leak).	9.8	CRITICAL	CVSS:3.1/AV:N/AC:L/PR:N/UI:N/S:U/C:H/I:H/A:H		
CVE-2020-26540	2020-10-02T08:15:12.807	2024-11-21T05:20:02.400	An issue was discovered in Foxit Reader and PhantomPDF before 4.1 on macOS. Because the Hardened Runtime protection mechanism is not applied to code signing, code injection (or an information leak) can occur.	7.5	HIGH	CVSS:3.1/AV:N/AC:L/PR:N/UI:N/S:U/C:H/I:N/A:N		
CVE-2019-19199	2020-10-02T09:15:12.977	2024-11-21T04:34:18.783	REDDOXX MailDepot 2032 SP2 2.2.1242 has Insufficient Session Expiration because tokens are not invalidated upon a logout.	7.4	HIGH	CVSS:3.1/AV:N/AC:H/PR:N/UI:N/S:U/C:H/I:H/A:N		
CVE-2020-12123	2020-10-02T09:15:13.040	2024-11-21T04:59:17.677	CSRF vulnerabilities in the /cgi-bin/ directory of the WAVLINK WN530H4 M30H4.V5030.190403 allow an attacker to remotely access router endpoints, because these endpoints do not contain CSRF tokens. If a user is authenticated in the router portal, then this attack will work.	8.1	HIGH	CVSS:3.1/AV:N/AC:L/PR:N/UI:R/S:U/C:N/I:H/A:H		
CVE-2020-12124	2020-10-02T09:15:13.087	2024-11-21T04:59:17.810	A remote command-line injection vulnerability in the /cgi-bin/live_api.cgi endpoint of the WAVLINK WN530H4 M30H4.V5030.190403 allows an attacker to execute arbitrary Linux commands as root without authentication.	9.8	CRITICAL	CVSS:3.1/AV:N/AC:L/PR:N/UI:N/S:U/C:H/I:H/A:H		
CVE-2020-12125	2020-10-02T09:15:13.147	2024-11-21T04:59:17.937	A remote buffer overflow vulnerability in the /cgi-bin/makeRequest.cgi endpoint of the WAVLINK WN530H4 M30H4.V5030.190403 allows an attacker to execute arbitrary machine instructions as root without authentication.	9.8	CRITICAL	CVSS:3.1/AV:N/AC:L/PR:N/UI:N/S:U/C:H/I:H/A:H		
CVE-2020-12126	2020-10-02T09:15:13.197	2024-11-21T04:59:18.067	Multiple authentication bypass vulnerabilities in the /cgi-bin/ endpoint of the WAVLINK WN530H4 M30H4.V5030.190403 allow an attacker to leak router settings, change configuration variables, and cause denial of service via an unauthenticated endpoint.	9.8	CRITICAL	CVSS:3.1/AV:N/AC:L/PR:N/UI:N/S:U/C:H/I:H/A:H		
CVE-2020-12127	2020-10-02T09:15:13.257	2024-11-21T04:59:18.207	An information disclosure vulnerability in the /cgi-bin/ExportAllSettings.sh endpoint of the WAVLINK WN530H4 M30H4.V5030.190403 allows an attacker to leak router settings, including cleartext login details, DNS settings, and other sensitive information without authentication.	7.5	HIGH	CVSS:3.1/AV:N/AC:L/PR:N/UI:N/S:U/C:H/I:N/A:N		
CVE-2020-13168	2020-10-02T09:15:13.320	2024-11-21T05:00:47.603	SysAid 20.1.11b26 allows reflected XSS via the ForgotPassword.jsp accountid parameter.	6.1	MEDIUM	CVSS:3.1/AV:N/AC:L/PR:N/UI:R/S:C/C:L/I:L/A:N		
CVE-2020-14293	2020-10-02T09:15:13.383	2024-11-21T05:02:56.503	conf_datetime in Secudos DOMOS 5.8 allows remote attackers to execute arbitrary commands as root via shell metacharacters in the zone field (obtained from the web interface).	7.5	HIGH	CVSS:3.1/AV:N/AC:H/PR:L/UI:N/S:U/C:H/I:H/A:H		
CVE-2020-14294	2020-10-02T09:15:13.447	2024-11-21T05:02:56.667	An issue was discovered in Secudos Qiata FTA 1.70.19. The comment feature allows persistent XSS that is executed when reading transfer comments or the global notice board.	6.1	MEDIUM	CVSS:3.1/AV:N/AC:L/PR:N/UI:R/S:C/C:L/I:L/A:N		
CVE-2020-17382	2020-10-02T09:15:13.507	2024-11-21T05:07:58.753	The MSI AmbientLink MsIo64 driver 1.0.0.8 has a Buffer Overflow (0x80102040, 0x80102044, 0x80102050,and 0x80102054).	7.8	HIGH	CVSS:3.1/AV:L/AC:L/PR:L/UI:N/S:U/C:H/I:H/A:H		
CVE-2020-17482	2020-10-02T09:15:13.570	2024-11-21T05:08:12.210	An issue has been found in PowerDNS Authoritative Server before 4.3.1 where an authorized user with the ability to insert crafted records into a zone might be able to leak the content of uninitialized memory.	4.3	MEDIUM	CVSS:3.1/AV:N/AC:L/PR:L/UI:N/S:U/C:L/I:N/A:N		
CVE-2020-24696	2020-10-02T09:15:13.633	2024-11-21T05:15:49.430	An issue was discovered in PowerDNS Authoritative through 4.3.0 when --enable-experimental-gss-tsig is used. A remote, unauthenticated attacker can trigger a race condition leading to a crash, or possibly arbitrary code execution, by sending crafted queries with a GSS-TSIG signature.	8.1	HIGH	CVSS:3.1/AV:N/AC:H/PR:N/UI:N/S:U/C:H/I:H/A:H		
CVE-2020-24697	2020-10-02T09:15:13.697	2024-11-21T05:15:49.620	An issue was discovered in PowerDNS Authoritative through 4.3.0 when --enable-experimental-gss-tsig is used. A remote, unauthenticated attacker can cause a denial of service by sending crafted queries with a GSS-TSIG signature.	7.5	HIGH	CVSS:3.1/AV:N/AC:L/PR:N/UI:N/S:U/C:N/I:N/A:H		
