CVE ID	Published Date	Last Modified Date	Description	Base Score	Base Severity	Vector String	Vendor	Product
CVE-2020-9534	2020-03-02T00:15:10.623	2024-11-21T05:40:49.220	fmwlan.c on D-Link DIR-615Jx10 devices has a stack-based buffer overflow via the formWlanSetup webpage parameter when f_radius_ip1 is malformed.	8.8	HIGH	CVSS:3.1/AV:N/AC:L/PR:L/UI:N/S:U/C:H/I:H/A:H		
CVE-2020-9535	2020-03-02T00:15:10.703	2024-11-21T05:40:49.367	fmwlan.c on D-Link DIR-615Jx10 devices has a stack-based buffer overflow via the formWlanSetup_Wizard webpage parameter when f_radius_ip1 is malformed.	8.8	HIGH	CVSS:3.1/AV:N/AC:L/PR:L/UI:N/S:U/C:H/I:H/A:H		
CVE-2020-9540	2020-03-02T00:15:10.813	2024-11-21T05:40:49.547	Sophos HitmanPro.Alert before build 861 allows local elevation of privilege.	7.8	HIGH	CVSS:3.1/AV:L/AC:L/PR:L/UI:N/S:U/C:H/I:H/A:H		
CVE-2020-9545	2020-03-02T01:15:11.027	2024-11-21T05:40:49.987	Pale Moon 28.x before 28.8.4 has a segmentation fault related to module scripting, as demonstrated by a Lacoste web site.	7.5	HIGH	CVSS:3.1/AV:N/AC:L/PR:N/UI:N/S:U/C:N/I:N/A:H		
CVE-2020-9546	2020-03-02T04:15:10.843	2024-11-21T05:40:50.133	FasterXML jackson-databind 2.x before 2.9.10.4 mishandles the interaction between serialization gadgets and typing, related to org.apache.hadoop.shaded.com.zaxxer.hikari.HikariConfig (aka shaded hikari-config).	9.8	CRITICAL	CVSS:3.1/AV:N/AC:L/PR:N/UI:N/S:U/C:H/I:H/A:H		
CVE-2020-9547	2020-03-02T04:15:11.017	2024-11-21T05:40:50.387	FasterXML jackson-databind 2.x before 2.9.10.4 mishandles the interaction between serialization gadgets and typing, related to com.ibatis.sqlmap.engine.transaction.jta.JtaTransactionConfig (aka ibatis-sqlmap).	9.8	CRITICAL	CVSS:3.1/AV:N/AC:L/PR:N/UI:N/S:U/C:H/I:H/A:H		
CVE-2020-9548	2020-03-02T04:15:11.077	2024-11-21T05:40:50.670	FasterXML jackson-databind 2.x before 2.9.10.4 mishandles the interaction between serialization gadgets and typing, related to br.com.anteros.dbcp.AnterosDBCPConfig (aka anteros-core).	9.8	CRITICAL	CVSS:3.1/AV:N/AC:L/PR:N/UI:N/S:U/C:H/I:H/A:H		
CVE-2019-17026	2020-03-02T05:15:12.010	2025-03-21T19:22:53.820	Incorrect alias information in IonMonkey JIT compiler for setting array elements could lead to a type confusion. We are aware of targeted attacks in the wild abusing this flaw. This vulnerability affects Firefox ESR < 68.4.1, Thunderbird < 68.4.1, and Firefox < 72.0.1.	8.8	HIGH	CVSS:3.1/AV:N/AC:L/PR:N/UI:R/S:U/C:H/I:H/A:H		
CVE-2020-6792	2020-03-02T05:15:12.103	2024-11-21T05:36:11.523	When deriving an identifier for an email message, uninitialized memory was used in addition to the message contents. This vulnerability affects Thunderbird < 68.5.	4.3	MEDIUM	CVSS:3.1/AV:N/AC:L/PR:N/UI:R/S:U/C:L/I:N/A:N		
CVE-2020-6793	2020-03-02T05:15:12.183	2024-11-21T05:36:11.643	When processing an email message with an ill-formed envelope, Thunderbird could read data from a random memory location. This vulnerability affects Thunderbird < 68.5.	6.5	MEDIUM	CVSS:3.1/AV:N/AC:L/PR:N/UI:R/S:U/C:H/I:N/A:N		
CVE-2020-6794	2020-03-02T05:15:12.260	2024-11-21T05:36:11.730	If a user saved passwords before Thunderbird 60 and then later set a master password, an unencrypted copy of these passwords is still accessible. This is because the older stored password file was not deleted when the data was copied to a new format starting in Thunderbird 60. The new master password is added only on the new file. This could allow the exposure of stored password data outside of user expectations. This vulnerability affects Thunderbird < 68.5.	6.5	MEDIUM	CVSS:3.1/AV:N/AC:L/PR:N/UI:R/S:U/C:H/I:N/A:N		
CVE-2020-6795	2020-03-02T05:15:12.353	2024-11-21T05:36:11.830	When processing a message that contains multiple S/MIME signatures, a bug in the MIME processing code caused a null pointer dereference, leading to an unexploitable crash. This vulnerability affects Thunderbird < 68.5.	6.5	MEDIUM	CVSS:3.1/AV:N/AC:L/PR:N/UI:R/S:U/C:N/I:N/A:H		
CVE-2020-6796	2020-03-02T05:15:13.183	2024-11-21T05:36:11.937	A content process could have modified shared memory relating to crash reporting information, crash itself, and cause an out-of-bound write. This could have caused memory corruption and a potentially exploitable crash. This vulnerability affects Firefox < 73 and Firefox < ESR68.5.	8.8	HIGH	CVSS:3.1/AV:N/AC:L/PR:N/UI:R/S:U/C:H/I:H/A:H		
CVE-2020-6797	2020-03-02T05:15:13.277	2024-11-21T05:36:12.037	By downloading a file with the .fileloc extension, a semi-privileged extension could launch an arbitrary application on the user's computer. The attacker is restricted as they are unable to download non-quarantined files or supply command line arguments to the application, limiting the impact. Note: this issue only occurs on Mac OSX. Other operating systems are unaffected. This vulnerability affects Thunderbird < 68.5, Firefox < 73, and Firefox < ESR68.5.	4.3	MEDIUM	CVSS:3.1/AV:N/AC:L/PR:N/UI:R/S:U/C:N/I:L/A:N		
CVE-2020-6798	2020-03-02T05:15:13.400	2024-11-21T05:36:12.143	If a template tag was used in a select tag, the parser could be confused and allow JavaScript parsing and execution when it should not be allowed. A site that relied on the browser behaving correctly could suffer a cross-site scripting vulnerability as a result. In general, this flaw cannot be exploited through email in the Thunderbird product because scripting is disabled when reading mail, but is potentially a risk in browser or browser-like contexts. This vulnerability affects Thunderbird < 68.5, Firefox < 73, and Firefox < ESR68.5.	6.1	MEDIUM	CVSS:3.1/AV:N/AC:L/PR:N/UI:R/S:C/C:L/I:L/A:N		
CVE-2020-6799	2020-03-02T05:15:13.590	2024-11-21T05:36:12.247	Command line arguments could have been injected during Firefox invocation as a shell handler for certain unsupported file types. This required Firefox to be configured as the default handler for a given file type and for a file downloaded to be opened in a third party application that insufficiently sanitized URL data. In that situation, clicking a link in the third party application could have been used to retrieve and execute files whose location was supplied through command line arguments. Note: This issue only affects Windows operating systems and when Firefox is configured as the default handler for non-default filetypes. Other operating systems are unaffected. This vulnerability affects Firefox < 73 and Firefox < ESR68.5.	8.8	HIGH	CVSS:3.1/AV:N/AC:L/PR:N/UI:R/S:U/C:H/I:H/A:H		
CVE-2020-6800	2020-03-02T05:15:13.683	2024-11-21T05:36:12.350	Mozilla developers and community members reported memory safety bugs present in Firefox 72 and Firefox ESR 68.4. Some of these bugs showed evidence of memory corruption and we presume that with enough effort some of these could have been exploited to run arbitrary code. In general, these flaws cannot be exploited through email in the Thunderbird product because scripting is disabled when reading mail, but are potentially risks in browser or browser-like contexts. This vulnerability affects Thunderbird < 68.5, Firefox < 73, and Firefox < ESR68.5.	8.8	HIGH	CVSS:3.1/AV:N/AC:L/PR:N/UI:R/S:U/C:H/I:H/A:H		
CVE-2020-6801	2020-03-02T05:15:13.777	2024-11-21T05:36:12.460	Mozilla developers reported memory safety bugs present in Firefox 72. Some of these bugs showed evidence of memory corruption and we presume that with enough effort some of these could have been exploited to run arbitrary code. This vulnerability affects Firefox < 73.	8.8	HIGH	CVSS:3.1/AV:N/AC:L/PR:N/UI:R/S:U/C:H/I:H/A:H		
CVE-2020-9549	2020-03-02T05:15:13.870	2024-11-21T05:40:50.910	In PDFResurrect 0.12 through 0.19, get_type in pdf.c has an out-of-bounds write via a crafted PDF document.	7.8	HIGH	CVSS:3.1/AV:L/AC:L/PR:N/UI:R/S:U/C:H/I:H/A:H		
CVE-2020-5539	2020-03-02T08:15:10.660	2024-11-21T05:34:14.390	GRANDIT Ver.1.6, Ver.2.0, Ver.2.1, Ver.2.2, Ver.2.3, and Ver.3.0 do not properly manage sessions, which allows remote attackers to impersonate an arbitrary user and then alter or disclose the information via unspecified vectors.	6.5	MEDIUM	CVSS:3.1/AV:N/AC:L/PR:N/UI:N/S:U/C:L/I:L/A:N		
CVE-2018-17058	2020-03-02T14:15:10.917	2024-11-21T03:53:47.640	An issue was discovered in JABA XPress Online Shop through 2018-09-14. It contains an arbitrary file upload vulnerability in the picture-upload feature of ProductEdit.aspx. An authenticated attacker may bypass the frontend filename validation and upload an arbitrary file via FileUploader.aspx.cs in FileUploader.aspx by using empty w and h parameters. This file may contain arbitrary aspx code that may be executed by accessing /Jec/ProductImages/<number>/<filename>. Accessing the file once uploaded does not require authentication.	8.8	HIGH	CVSS:3.1/AV:N/AC:L/PR:L/UI:N/S:U/C:H/I:H/A:H		
CVE-2020-4283	2020-03-02T14:15:11.213	2024-11-21T05:32:31.107	IBM Security Information Queue (ISIQ) 1.0.0, 1.0.1, 1.0.2, 1.0.3, and 1.0.4 contains hard-coded credentials, such as a password or cryptographic key, which it uses for its own inbound authentication, outbound communication to external components, or encryption of internal data. IBM X-Force ID: 176206.	8.6	HIGH	CVSS:3.1/AV:N/AC:L/PR:N/UI:N/S:C/C:H/I:N/A:N		
CVE-2020-4292	2020-03-02T14:15:11.307	2024-11-21T05:32:32.207	IBM Security Information Queue (ISIQ) 1.0.0, 1.0.1, 1.0.2, 1.0.3, and 1.0.4 uses a cross-domain policy file that includes domains that should not be trusted which could disclose sensitive information. IBM X-Force ID: 176335.	5.3	MEDIUM	CVSS:3.1/AV:N/AC:L/PR:N/UI:N/S:U/C:L/I:N/A:N		
CVE-2015-1583	2020-03-02T16:15:11.300	2024-11-21T02:25:42.733	Multiple cross-site request forgery (CSRF) vulnerabilities in ATutor 2.2 allow remote attackers to hijack the authentication of administrators for requests that (1) create an administrator account via a request to mods/_core/users/admins/create.php or (2) create a user account via a request to mods/_core/users/create_user.php.	8.8	HIGH	CVSS:3.1/AV:N/AC:L/PR:N/UI:R/S:U/C:H/I:H/A:H		
CVE-2017-12580	2020-03-02T16:15:11.643	2024-11-21T03:09:47.610	"An issue was discovered in IDM UltraEdit through 24.10.0.32. To exploit the vulnerability, on unpatched Windows systems, an attacker could include in the same directory as the affected executable a DLL using the name of a Windows DLL. This DLL must be preloaded by the executable (for example, ""ntmarta.dll""). When the installer EXE is executed by the user, the DLL located in the EXE's current directory will be loaded instead of the Windows DLL, allowing the attacker to run arbitrary code on the affected system."	7.8	HIGH	CVSS:3.1/AV:L/AC:L/PR:N/UI:R/S:U/C:H/I:H/A:H		
CVE-2019-12183	2020-03-02T16:15:11.770	2024-11-21T04:22:23.253	Incorrect Access Control in Safescan Timemoto TM-616 and TA-8000 series allows remote attackers to read any file via the administrative API.	7.5	HIGH	CVSS:3.1/AV:N/AC:L/PR:N/UI:N/S:U/C:H/I:N/A:N		
CVE-2019-18897	2020-03-02T16:15:11.847	2024-11-21T04:33:48.030	A UNIX Symbolic Link (Symlink) Following vulnerability in the packaging of salt of SUSE Linux Enterprise Server 12, SUSE Linux Enterprise Server 15; openSUSE Factory allows local attackers to escalate privileges from user salt to root. This issue affects: SUSE Linux Enterprise Server 12 salt-master version 2019.2.0-46.83.1 and prior versions. SUSE Linux Enterprise Server 15 salt-master version 2019.2.0-6.21.1 and prior versions. openSUSE Factory salt-master version 2019.2.2-3.1 and prior versions.	8.4	HIGH	CVSS:3.1/AV:L/AC:L/PR:N/UI:N/S:U/C:H/I:H/A:H		
CVE-2019-18901	2020-03-02T16:15:11.940	2024-11-21T04:33:48.580	A UNIX Symbolic Link (Symlink) Following vulnerability in the mysql-systemd-helper of the mariadb packaging of SUSE Linux Enterprise Server 12, SUSE Linux Enterprise Server 15 allows local attackers to change the permissions of arbitrary files to 0640. This issue affects: SUSE Linux Enterprise Server 12 mariadb versions prior to 10.2.31-3.25.1. SUSE Linux Enterprise Server 15 mariadb versions prior to 10.2.31-3.26.1.	5.1	MEDIUM	CVSS:3.1/AV:L/AC:L/PR:N/UI:N/S:U/C:L/I:N/A:L		
CVE-2019-20486	2020-03-02T16:15:12.020	2024-11-21T04:38:35.710	An issue was discovered on NETGEAR WNR1000V4 1.1.0.54 devices. Multiple pages (setup.cgi and adv_index.htm) within the web management console are vulnerable to stored XSS, as demonstrated by the configuration of the UI language.	6.1	MEDIUM	CVSS:3.1/AV:N/AC:L/PR:N/UI:R/S:C/C:L/I:L/A:N		
CVE-2019-20487	2020-03-02T16:15:12.097	2024-11-21T04:38:35.853	An issue was discovered on NETGEAR WNR1000V4 1.1.0.54 devices. Multiple actions within the WNR1000V4 web management console are vulnerable to an unauthenticated GET request (exploitable directly or through CSRF), as demonstrated by the setup.cgi?todo=save_htp_account URI.	8.8	HIGH	CVSS:3.1/AV:N/AC:L/PR:N/UI:R/S:U/C:H/I:H/A:H		
CVE-2019-20488	2020-03-02T16:15:12.160	2024-11-21T04:38:35.990	An issue was discovered on NETGEAR WNR1000V4 1.1.0.54 devices. Multiple actions within the web management interface (setup.cgi) are vulnerable to command injection, allowing remote attackers to execute arbitrary commands, as demonstrated by shell metacharacters in the sysDNSHost parameter.	9.8	CRITICAL	CVSS:3.1/AV:N/AC:L/PR:N/UI:N/S:U/C:H/I:H/A:H		
CVE-2019-20489	2020-03-02T16:15:12.253	2024-11-21T04:38:36.130	An issue was discovered on NETGEAR WNR1000V4 1.1.0.54 devices. The web management interface (setup.cgi) has an authentication bypass and other problems that ultimately allow an attacker to remotely compromise the device from a malicious webpage. The attacker sends an FW_remote.htm&todo=cfg_init request without a cookie, reads the Set-Cookie header in the 401 Unauthorized response, and then repeats the FW_remote.htm&todo=cfg_init request with the specified cookie.	9.8	CRITICAL	CVSS:3.1/AV:N/AC:L/PR:N/UI:N/S:U/C:H/I:H/A:H		
CVE-2020-5249	2020-03-02T16:15:12.330	2024-11-21T05:33:45.830	In Puma (RubyGem) before 4.3.3 and 3.12.4, if an application using Puma allows untrusted input in an early-hints header, an attacker can use a carriage return character to end the header and inject malicious content, such as additional headers or an entirely new response body. This vulnerability is known as HTTP Response Splitting. While not an attack in itself, response splitting is a vector for several other attacks, such as cross-site scripting (XSS). This is related to CVE-2020-5247, which fixed this vulnerability but only for regular responses. This has been fixed in 4.3.3 and 3.12.4.	6.5	MEDIUM	CVSS:3.1/AV:N/AC:L/PR:L/UI:R/S:C/C:L/I:L/A:L		
CVE-2020-6764	2020-03-02T16:15:12.440	2023-11-07T03:25:30.760	Rejected reason: DO NOT USE THIS CANDIDATE NUMBER. ConsultIDs: none. Reason: This candidate was withdrawn by its CNA. Further investigation showed that it was not a security issue. Notes: none					
CVE-2020-8500	2020-03-02T16:15:12.503	2024-11-21T05:38:57.143	In Artica Pandora FMS 7.42, Web Admin users can execute arbitrary code by uploading a .php file via the Updater or Extension component. NOTE: The vendor reports that this is intended functionality	7.2	HIGH	CVSS:3.1/AV:N/AC:L/PR:H/UI:N/S:U/C:H/I:H/A:H		
CVE-2018-11675	2020-03-02T17:15:11.907	2023-11-07T02:51:43.590	Rejected reason: DO NOT USE THIS CANDIDATE NUMBER. ConsultIDs: none. Reason: This candidate was withdrawn by its CNA. Further investigation showed that it was not a security issue. Notes: none					
CVE-2018-14384	2020-03-02T17:15:11.967	2024-11-21T03:48:58.007	The Website Manager module in SEO Panel 3.13.0 and earlier is affected by a stored Cross-Site Scripting (XSS) vulnerability, allowing remote authenticated attackers to inject arbitrary web script or HTML via the websites.php name parameter.	4.8	MEDIUM	CVSS:3.1/AV:N/AC:L/PR:H/UI:R/S:C/C:L/I:L/A:N		
CVE-2019-14892	2020-03-02T17:15:17.813	2024-11-21T04:27:37.527	A flaw was discovered in jackson-databind in versions before 2.9.10, 2.8.11.5 and 2.6.7.3, where it would permit polymorphic deserialization of a malicious object using commons-configuration 1 and 2 JNDI classes. An attacker could use this flaw to execute arbitrary code.	9.8	CRITICAL	CVSS:3.1/AV:N/AC:L/PR:N/UI:N/S:U/C:H/I:H/A:H		
CVE-2019-18902	2020-03-02T17:15:18.547	2024-11-21T04:33:48.707	A Use After Free vulnerability in wicked of SUSE Linux Enterprise Server 12, SUSE Linux Enterprise Server 15; openSUSE Leap 15.1, Factory allows remote attackers to cause DoS or potentially code execution. This issue affects: SUSE Linux Enterprise Server 12 wicked versions prior to 0.6.60-3.5.1. SUSE Linux Enterprise Server 15 wicked versions prior to 0.6.60-3.21.1. openSUSE Leap 15.1 wicked versions prior to 0.6.60-lp151.2.6.1. openSUSE Factory wicked versions prior to 0.6.62.	7.5	HIGH	CVSS:3.1/AV:A/AC:H/PR:N/UI:N/S:U/C:H/I:H/A:H		
CVE-2019-18903	2020-03-02T17:15:18.610	2024-11-21T04:33:48.830	A Use After Free vulnerability in wicked of SUSE Linux Enterprise Server 12, SUSE Linux Enterprise Server 15; openSUSE Leap 15.1, Factory allows remote attackers to cause DoS or potentially code execution. This issue affects: SUSE Linux Enterprise Server 12 wicked versions prior to 0.6.60-2.18.1. SUSE Linux Enterprise Server 15 wicked versions prior to 0.6.60-28.26.1. openSUSE Leap 15.1 wicked versions prior to 0.6.60-lp151.2.9.1. openSUSE Factory wicked versions prior to 0.6.62.	7.5	HIGH	CVSS:3.1/AV:A/AC:H/PR:N/UI:N/S:U/C:H/I:H/A:H		
CVE-2020-1731	2020-03-02T17:15:19.437	2024-11-21T05:11:15.743	A flaw was found in all versions of the Keycloak operator, before version 8.0.2,(community only) where the operator generates a random admin password when installing Keycloak, however the password remains the same when deployed to the same OpenShift namespace.	9.1	CRITICAL	CVSS:3.1/AV:N/AC:L/PR:N/UI:N/S:U/C:H/I:N/A:H		
CVE-2020-8013	2020-03-02T17:15:19.593	2024-11-21T05:38:13.043	A UNIX Symbolic Link (Symlink) Following vulnerability in chkstat of SUSE Linux Enterprise Server 12, SUSE Linux Enterprise Server 15, SUSE Linux Enterprise Server 11 set permissions intended for specific binaries on other binaries because it erroneously followed symlinks. The symlinks can't be controlled by attackers on default systems, so exploitation is difficult. This issue affects: SUSE Linux Enterprise Server 12 permissions versions prior to 2015.09.28.1626-17.27.1. SUSE Linux Enterprise Server 15 permissions versions prior to 20181116-9.23.1. SUSE Linux Enterprise Server 11 permissions versions prior to 2013.1.7-0.6.12.1.	2.2	LOW	CVSS:3.1/AV:L/AC:H/PR:L/UI:R/S:U/C:N/I:L/A:N		
CVE-2019-18863	2020-03-02T18:15:10.667	2024-11-21T04:33:44.357	A key length vulnerability in the implementation of the SRTP 128-bit key on Mitel 6800 and 6900 SIP series phones, versions 5.1.0.2051 SP2 and earlier, could allow an attacker to launch a man-in-the-middle attack when SRTP is used in a call. A successful exploit may allow the attacker to intercept sensitive information.	5.9	MEDIUM	CVSS:3.1/AV:N/AC:H/PR:N/UI:N/S:U/C:H/I:N/A:N		
CVE-2019-19370	2020-03-02T18:15:11.293	2024-11-21T04:34:39.540	A cross-site scripting (XSS) vulnerability in the web conferencing component of the Mitel MiCollab application before 9.0.15 for Android could allow an unauthenticated attacker to conduct a reflected cross-site scripting (XSS) attack due to insufficient validation in the file upload interface. A successful exploit could allow an attacker to execute arbitrary scripts.	6.1	MEDIUM	CVSS:3.1/AV:N/AC:L/PR:N/UI:R/S:C/C:L/I:L/A:N		
CVE-2019-19371	2020-03-02T18:15:11.387	2024-11-21T04:34:39.683	A cross-site scripting (XSS) vulnerability in the web conferencing component of Mitel MiCollab AWV before 8.1.2.2 could allow an unauthenticated attacker to conduct a reflected cross-site scripting (XSS) attack due to insufficient validation in the join meeting interface. A successful exploit could allow an attacker to execute arbitrary scripts.	6.1	MEDIUM	CVSS:3.1/AV:N/AC:L/PR:N/UI:R/S:C/C:L/I:L/A:N		
CVE-2019-19607	2020-03-02T18:15:11.433	2024-11-21T04:35:02.683	A SQL injection vulnerability in the web conferencing component of Mitel MiCollab AWV before 8.1.2.2 could allow an unauthenticated attack due to insufficient input validation for the session parameter. A successful exploit could allow an attacker to extract sensitive information from the database and execute arbitrary scripts.	9.8	CRITICAL	CVSS:3.1/AV:N/AC:L/PR:N/UI:N/S:U/C:H/I:H/A:H		
CVE-2019-19608	2020-03-02T18:15:11.497	2024-11-21T04:35:02.853	A SQL injection vulnerability in in the web conferencing component of Mitel MiCollab AWV before 8.1.2.2 could allow an unauthenticated attack due to insufficient input validation for the registeredList.cgi page. A successful exploit could allow an attacker to extract sensitive information from the database and execute arbitrary scripts.	9.8	CRITICAL	CVSS:3.1/AV:N/AC:L/PR:N/UI:N/S:U/C:H/I:H/A:H		
CVE-2018-15819	2020-03-02T19:15:12.023	2024-11-21T03:51:30.963	EasyIO EasyIO-30P devices before 2.0.5.27 have Incorrect Access Control, related to webuser.js.	7.5	HIGH	CVSS:3.1/AV:N/AC:L/PR:N/UI:N/S:U/C:H/I:N/A:N		
CVE-2018-15820	2020-03-02T19:15:12.133	2024-11-21T03:51:31.123	EasyIO EasyIO-30P devices before 2.0.5.27 allow XSS via the dev.htm GDN parameter.	6.1	MEDIUM	CVSS:3.1/AV:N/AC:L/PR:N/UI:R/S:C/C:L/I:L/A:N		
CVE-2020-8437	2020-03-02T19:15:12.757	2024-11-21T05:38:51.123	The bencoding parser in BitTorrent uTorrent through 3.5.5 (build 45505) misparses nested bencoded dictionaries, which allows a remote attacker to cause a denial of service.	7.5	HIGH	CVSS:3.1/AV:N/AC:L/PR:N/UI:N/S:U/C:N/I:N/A:H		
CVE-2020-8776	2020-03-02T19:15:12.820	2024-11-21T05:39:25.050	Alfresco Enterprise before 5.2.7 and Alfresco Community before 6.2.0 (rb65251d6-b368) has XSS via the URL property of a file.	5.4	MEDIUM	CVSS:3.1/AV:N/AC:L/PR:L/UI:R/S:C/C:L/I:L/A:N		
CVE-2020-8777	2020-03-02T19:15:12.883	2024-11-21T05:39:25.187	Alfresco Enterprise before 5.2.7 and Alfresco Community before 6.2.0 (rb65251d6-b368) has XSS via a user profile photo, as demonstrated by a SCRIPT element in an SVG document.	5.4	MEDIUM	CVSS:3.1/AV:N/AC:L/PR:L/UI:R/S:C/C:L/I:L/A:N		
CVE-2020-8778	2020-03-02T19:15:12.930	2024-11-21T05:39:25.350	Alfresco Enterprise before 5.2.7 and Alfresco Community before 6.2.0 (rb65251d6-b368) has XSS via an uploaded document, when the attacker has write access to a project.	5.4	MEDIUM	CVSS:3.1/AV:N/AC:L/PR:L/UI:R/S:C/C:L/I:L/A:N		
CVE-2018-16356	2020-03-02T20:15:11.053	2024-11-21T03:52:35.380	An issue was discovered in PbootCMS. There is a SQL injection via the api.php/List/index order parameter.	9.8	CRITICAL	CVSS:3.1/AV:N/AC:L/PR:N/UI:N/S:U/C:H/I:H/A:H		
CVE-2018-16357	2020-03-02T20:15:11.100	2024-11-21T03:52:35.530	An issue was discovered in PbootCMS. There is a SQL injection via the api.php/Cms/search order parameter.	9.8	CRITICAL	CVSS:3.1/AV:N/AC:L/PR:N/UI:N/S:U/C:H/I:H/A:H		
CVE-2018-17572	2020-03-02T20:15:11.147	2024-11-21T03:54:37.983	InfluxDB 0.9.5 has Reflected XSS in the Write Data module.	4.8	MEDIUM	CVSS:3.1/AV:N/AC:L/PR:H/UI:R/S:C/C:L/I:L/A:N		
CVE-2018-18479	2020-03-02T20:15:11.210	2023-11-07T02:55:17.593	Rejected reason: DO NOT USE THIS CANDIDATE NUMBER. ConsultIDs: none. Reason: This candidate was withdrawn by its CNA. Notes: none					
CVE-2018-19284	2020-03-02T20:15:11.257	2023-11-07T02:55:31.290	Rejected reason: DO NOT USE THIS CANDIDATE NUMBER. ConsultIDs: none. Reason: This candidate was withdrawn by its CNA. Notes: none					
CVE-2018-19599	2020-03-02T20:15:11.320	2024-11-21T03:58:15.940	Monstra CMS 1.6 allows XSS via an uploaded SVG document to the admin/index.php?id=filesmanager&path=uploads/ URI. NOTE: this is a discontinued product.	5.4	MEDIUM	CVSS:3.1/AV:N/AC:L/PR:L/UI:R/S:C/C:L/I:L/A:N		
CVE-2018-19658	2020-03-02T20:15:11.367	2024-11-21T03:58:22.113	The Markdown editor in YXBJ before 8.3.2 on macOS has stored XSS. This behavior may be encountered by some Evernote users; however, it is a vulnerability in YXBJ, not a vulnerability in Evernote.	5.4	MEDIUM	CVSS:3.1/AV:N/AC:L/PR:L/UI:R/S:C/C:L/I:L/A:N		
CVE-2018-19798	2020-03-02T21:15:11.737	2024-11-21T03:58:35.093	"Fleetco Fleet Maintenance Management (FMM) 1.2 and earlier allows uploading an arbitrary "".php"" file with the application/x-php Content-Type to the accidents_add.php?submit=1 URI, as demonstrated by the value_Images_1 field, which leads to remote command execution on the remote server. Any authenticated user can exploit this."	8.8	HIGH	CVSS:3.1/AV:N/AC:L/PR:L/UI:N/S:U/C:H/I:H/A:H		
CVE-2018-20343	2020-03-02T21:15:11.783	2024-11-21T04:01:16.907	Multiple buffer overflow vulnerabilities have been found in Ken Silverman Build Engine 1. An attacker could craft a special map file to execute arbitrary code when the map file is loaded.	7.8	HIGH	CVSS:3.1/AV:L/AC:L/PR:N/UI:R/S:U/C:H/I:H/A:H		
CVE-2019-14893	2020-03-02T21:15:17.520	2024-11-21T04:27:37.670	A flaw was discovered in FasterXML jackson-databind in all versions before 2.9.10 and 2.10.0, where it would permit polymorphic deserialization of malicious objects using the xalan JNDI gadget when used in conjunction with polymorphic type handling methods such as `enableDefaultTyping()` or when @JsonTypeInfo is using `Id.CLASS` or `Id.MINIMAL_CLASS` or in any other way which ObjectMapper.readValue might instantiate objects from unsafe sources. An attacker could use this flaw to execute arbitrary code.	9.8	CRITICAL	CVSS:3.1/AV:N/AC:L/PR:N/UI:N/S:U/C:H/I:H/A:H		
CVE-2018-20347	2020-03-02T22:15:12.653	2023-11-07T02:56:16.463	Rejected reason: DO NOT USE THIS CANDIDATE NUMBER. ConsultIDs: none. Reason: This candidate was withdrawn by its CNA. Notes: none					
CVE-2018-5951	2020-03-02T22:15:12.827	2024-11-21T04:09:44.273	An issue was discovered in Mikrotik RouterOS. Crafting a packet that has a size of 1 byte and sending it to an IPv6 address of a RouterOS box with IP Protocol 97 will cause RouterOS to reboot imminently. All versions of RouterOS that supports EoIPv6 are vulnerable to this attack.	7.5	HIGH	CVSS:3.1/AV:N/AC:L/PR:N/UI:N/S:U/C:N/I:N/A:H		
