CVE ID	Published Date	Last Modified Date	Description	Base Score	Base Severity	Vector String	Vendor	Product
CVE-2020-27153	2020-10-15T03:15:12.120	2024-11-21T05:20:47.440	In BlueZ before 5.55, a double free was found in the gatttool disconnect_cb() routine from shared/att.c. A remote attacker could potentially cause a denial of service or code execution, during service discovery, due to a redundant disconnect MGMT event.	8.6	HIGH	CVSS:3.1/AV:N/AC:L/PR:N/UI:N/S:U/C:L/I:L/A:H		
CVE-2020-5642	2020-10-15T03:15:12.183	2024-11-21T05:34:24.650	Cross-site request forgery (CSRF) vulnerability in Live Chat - Live support version 3.1.0 and earlier allows remote attackers to hijack the authentication of administrators via unspecified vectors.	8.8	HIGH	CVSS:3.1/AV:N/AC:L/PR:N/UI:R/S:U/C:H/I:H/A:H		
CVE-2020-6365	2020-10-15T03:15:12.247	2024-11-21T05:35:35.180	SAP NetWeaver AS Java, versions - 7.10, 7.11, 7.20, 7.30, 7.31, 7.40, 7.50, Start Page allows an unauthenticated remote attacker to redirect users to a malicious site due to insufficient reverse tabnabbing URL validation. The attacker could execute phishing attacks to steal credentials of the victim or to redirect users to untrusted web pages containing malware or similar malicious exploits.	6.1	MEDIUM	CVSS:3.1/AV:N/AC:L/PR:N/UI:R/S:C/C:L/I:L/A:N		
CVE-2020-27156	2020-10-15T05:15:12.243	2024-11-21T05:20:47.813	Veritas APTARE versions prior to 10.5 did not perform adequate authorization checks. This vulnerability could allow for remote code execution by an unauthenticated user.	9.8	CRITICAL	CVSS:3.1/AV:N/AC:L/PR:N/UI:N/S:U/C:H/I:H/A:H		
CVE-2020-27157	2020-10-15T05:15:12.337	2024-11-21T05:20:47.937	Veritas APTARE versions prior to 10.5 included code that bypassed the normal login process when specific authentication credentials were provided to the server. An unauthenticated user could login to the application and gain access to the data and functionality accessible to the targeted user account.	8.1	HIGH	CVSS:3.1/AV:N/AC:H/PR:N/UI:N/S:U/C:H/I:H/A:H		
CVE-2020-7334	2020-10-15T09:15:11.523	2024-11-21T05:37:04.993	Improper privilege assignment vulnerability in the installer McAfee Application and Change Control (MACC) prior to 8.3.2 allows local administrators to change or update the configuration settings via a carefully constructed MSI configured to mimic the genuine installer. This version adds further controls for installation/uninstallation of software.	7.7	HIGH	CVSS:3.1/AV:L/AC:L/PR:H/UI:R/S:C/C:H/I:H/A:H		
CVE-2020-7326	2020-10-15T10:15:11.760	2024-11-21T05:37:04.030	Improperly implemented security check in McAfee Active Response (MAR) prior to 2.4.4 may allow local administrators to execute malicious code via stopping a core Windows service leaving McAfee core trust component in an inconsistent state resulting in MAR failing open rather than closed	6.0	MEDIUM	CVSS:3.1/AV:L/AC:L/PR:H/UI:N/S:U/C:N/I:H/A:H		
CVE-2020-7327	2020-10-15T10:15:11.837	2024-11-21T05:37:04.153	Improperly implemented security check in McAfee MVISION Endpoint Detection and Response Client (MVEDR) prior to 3.2.0 may allow local administrators to execute malicious code via stopping a core Windows service leaving McAfee core trust component in an inconsistent state resulting in MVEDR failing open rather than closed	6.0	MEDIUM	CVSS:3.1/AV:L/AC:L/PR:H/UI:N/S:U/C:N/I:H/A:H		
CVE-2019-4552	2020-10-15T13:15:12.807	2024-11-21T04:43:43.507	IBM Security Access Manager 9.0.7 and IBM Security Verify Access 10.0.0 are vulnerable to HTTP response splitting attacks. A remote attacker could exploit this vulnerability using specially-crafted URL to cause the server to return a split response, once the URL is clicked. This would allow the attacker to perform further attacks, such as Web cache poisoning, cross-site scripting, and possibly obtain sensitive information. IBM X-Force ID: 165960.	6.1	MEDIUM	CVSS:3.1/AV:N/AC:L/PR:N/UI:R/S:C/C:L/I:L/A:N		
CVE-2020-4499	2020-10-15T13:15:12.913	2024-11-21T05:32:49.257	IBM Security Access Manager 9.0.7 and IBM Security Verify Access 10.0.0 could allow an unauthorized public Oauth client to bypass some or all of the authentication checks and gain access to applications. IBM X-Force ID: 182216.	9.8	CRITICAL	CVSS:3.1/AV:N/AC:L/PR:N/UI:N/S:U/C:H/I:H/A:H		
CVE-2020-7744	2020-10-15T13:15:12.993	2024-11-21T05:37:43.243	This affects all versions of package com.mintegral.msdk:alphab. The Android SDK distributed by the company contains malicious functionality in this module that tracks: 1. Downloads from Google urls either within Google apps or via browser including file downloads, e-mail attachments and Google Docs links. 2. All apk downloads, either organic or not. Mintegral listens to download events in Android's download manager and detects if the downloaded file's url contains: a. google.com or comes from a Google app (the com.android.vending package) b. Ends with .apk for apk downloads In both cases, the module sends the captured data back to Mintegral's servers. Note that the malicious functionality keeps running even if the app is currently not in focus (running in the background).	4.7	MEDIUM	CVSS:3.1/AV:N/AC:L/PR:N/UI:R/S:C/C:L/I:N/A:N		
CVE-2020-11641	2020-10-15T15:15:10.797	2024-11-21T04:58:18.393	A local file inclusion vulnerability in B&R SiteManager versions <9.2.620236042 allows authenticated users to read sensitive files from SiteManager instances.	7.7	HIGH	CVSS:3.1/AV:N/AC:L/PR:L/UI:N/S:C/C:H/I:N/A:N		
CVE-2020-11642	2020-10-15T15:15:10.873	2024-11-21T04:58:18.527	The local file inclusion vulnerability present in B&R SiteManager versions <9.2.620236042 allows authenticated users to impact availability of SiteManager instances.	7.7	HIGH	CVSS:3.1/AV:N/AC:L/PR:L/UI:N/S:C/C:N/I:N/A:H		
CVE-2020-11643	2020-10-15T15:15:10.953	2024-11-21T04:58:18.660	An information disclosure vulnerability in B&R GateManager 4260 and 9250 versions <9.0.20262 and GateManager 8250 versions <9.2.620236042 allows authenticated users to view information of devices belonging to foreign domains.	6.5	MEDIUM	CVSS:3.1/AV:N/AC:L/PR:L/UI:N/S:U/C:H/I:N/A:N		
CVE-2020-11644	2020-10-15T15:15:11.030	2024-11-21T04:58:18.807	The information disclosure vulnerability present in B&R GateManager 4260 and 9250 versions <9.0.20262 and GateManager 8250 versions <9.2.620236042 allows authenticated users to generate fake audit log messages.	6.5	MEDIUM	CVSS:3.1/AV:N/AC:L/PR:L/UI:N/S:U/C:N/I:N/A:H		
CVE-2020-11645	2020-10-15T15:15:11.123	2024-11-21T04:58:18.970	A denial of service vulnerability in B&R GateManager 4260 and 9250 versions <9.0.20262 and GateManager 8250 versions <9.2.620236042 allows authenticated users to limit availability of GateManager instances.	6.5	MEDIUM	CVSS:3.1/AV:N/AC:L/PR:L/UI:N/S:U/C:N/I:N/A:H		
CVE-2020-11646	2020-10-15T15:15:11.203	2024-11-21T04:58:19.110	A log information disclosure vulnerability in B&R GateManager 4260 and 9250 versions <9.0.20262 and GateManager 8250 versions <9.2.620236042 allows authenticated users to view log information reserved for other users.	4.3	MEDIUM	CVSS:3.1/AV:N/AC:L/PR:L/UI:N/S:U/C:L/I:N/A:N		
CVE-2020-21674	2020-10-15T15:15:11.280	2024-11-21T05:12:46.557	Heap-based buffer overflow in archive_string_append_from_wcs() (archive_string.c) in libarchive-3.4.1dev allows remote attackers to cause a denial of service (out-of-bounds write in heap memory resulting into a crash) via a crafted archive file. NOTE: this only affects users who downloaded the development code from GitHub. Users of the product's official releases are unaffected.	6.5	MEDIUM	CVSS:3.1/AV:N/AC:L/PR:N/UI:R/S:U/C:N/I:N/A:H		
CVE-2020-6104	2020-10-15T15:15:11.343	2024-11-21T05:35:06.197	An exploitable information disclosure vulnerability exists in the get_dnode_of_data functionality of F2fs-Tools F2fs.Fsck 1.13. A specially crafted f2fs filesystem can cause information disclosure resulting in a information disclosure. An attacker can provide a malicious file to trigger this vulnerability.	5.5	MEDIUM	CVSS:3.1/AV:L/AC:L/PR:N/UI:R/S:U/C:H/I:N/A:N		
CVE-2020-6105	2020-10-15T15:15:11.437	2024-11-21T05:35:06.313	An exploitable code execution vulnerability exists in the multiple devices functionality of F2fs-Tools F2fs.Fsck 1.13. A specially crafted f2fs filesystem can cause Information overwrite resulting in a code execution. An attacker can provide a malicious file to trigger this vulnerability.	7.8	HIGH	CVSS:3.1/AV:L/AC:L/PR:N/UI:R/S:U/C:H/I:H/A:H		
CVE-2020-6106	2020-10-15T15:15:11.703	2024-11-21T05:35:06.423	An exploitable information disclosure vulnerability exists in the init_node_manager functionality of F2fs-Tools F2fs.Fsck 1.12 and 1.13. A specially crafted filesystem can be used to disclose information. An attacker can provide a malicious file to trigger this vulnerability.	5.5	MEDIUM	CVSS:3.1/AV:L/AC:L/PR:N/UI:R/S:U/C:H/I:N/A:N		
CVE-2020-6107	2020-10-15T15:15:11.763	2024-11-21T05:35:06.553	An exploitable information disclosure vulnerability exists in the dev_read functionality of F2fs-Tools F2fs.Fsck 1.13. A specially crafted f2fs filesystem can cause an uninitialized read resulting in an information disclosure. An attacker can provide a malicious file to trigger this vulnerability.	5.5	MEDIUM	CVSS:3.1/AV:L/AC:L/PR:N/UI:R/S:U/C:H/I:N/A:N		
CVE-2020-6108	2020-10-15T15:15:11.843	2024-11-21T05:35:06.663	An exploitable code execution vulnerability exists in the fsck_chk_orphan_node functionality of F2fs-Tools F2fs.Fsck 1.13. A specially crafted f2fs filesystem can cause a heap buffer overflow resulting in a code execution. An attacker can provide a malicious file to trigger this vulnerability.	7.8	HIGH	CVSS:3.1/AV:L/AC:L/PR:N/UI:R/S:U/C:H/I:H/A:H		
CVE-2019-12411	2020-10-15T16:15:11.697	2023-11-07T03:03:34.020	Rejected reason: DO NOT USE THIS CANDIDATE NUMBER. ConsultIDs: none. Reason: This candidate was withdrawn by its CNA. Further investigation showed that it was not a security issue. Notes: none					
CVE-2020-11637	2020-10-15T16:15:11.773	2024-11-21T04:58:18.000	A memory leak in the TFTP service in B&R Automation Runtime versions <N4.26, <N4.34, <F4.45, <E4.53, <D4.63, <A4.73 and prior could allow an unauthenticated attacker with network access to cause a denial of service (DoS) condition.	5.8	MEDIUM	CVSS:3.1/AV:N/AC:L/PR:N/UI:N/S:C/C:N/I:N/A:L		
CVE-2020-13939	2020-10-15T16:15:11.853	2023-11-07T03:17:01.170	Rejected reason: DO NOT USE THIS CANDIDATE NUMBER. ConsultIDs: none. Reason: This candidate was withdrawn by its CNA. Further investigation showed that it was not a security issue. Notes: none					
CVE-2020-25858	2020-10-15T16:15:12.087	2024-11-21T05:18:55.137	The QCMAP_Web_CLIENT binary in the Qualcomm QCMAP software suite prior to versions released in October 2020 does not validate the return value of a strstr() or strchr() call in the Tokenizer() function. An attacker who invokes the web interface with a crafted URL can crash the process, causing denial of service. This version of QCMAP is used in many kinds of networking devices, primarily mobile hotspots and LTE routers.	7.5	HIGH	CVSS:3.1/AV:N/AC:L/PR:N/UI:N/S:U/C:N/I:N/A:H		
CVE-2020-25859	2020-10-15T16:15:12.180	2024-11-21T05:18:55.293	The QCMAP_CLI utility in the Qualcomm QCMAP software suite prior to versions released in October 2020 uses a system() call without validating the input, while handling a SetGatewayUrl() request. A local attacker with shell access can pass shell metacharacters and run arbitrary commands. If QCMAP_CLI can be run via sudo or setuid, this also allows elevating privileges to root. This version of QCMAP is used in many kinds of networking devices, primarily mobile hotspots and LTE routers.	6.7	MEDIUM	CVSS:3.1/AV:L/AC:L/PR:H/UI:N/S:U/C:H/I:H/A:H		
CVE-2020-12500	2020-10-15T19:15:11.440	2024-11-21T04:59:48.630	Improper Authorization vulnerability of Pepperl+Fuchs P+F Comtrol RocketLinx ES7510-XT, ES8509-XT, ES8510-XT, ES9528-XTv2, ES7506, ES7510, ES7528, ES8508, ES8508F, ES8510, ES8510-XTE, ES9528/ES9528-XT (all versions) allows unauthenticated device administration.	9.8	CRITICAL	CVSS:3.1/AV:N/AC:L/PR:N/UI:N/S:U/C:H/I:H/A:H		
CVE-2020-12501	2020-10-15T19:15:11.550	2024-11-21T04:59:48.783	Improper Authorization vulnerability of Pepperl+Fuchs P+F Comtrol RocketLinx ES7510-XT, ES8509-XT, ES8510-XT, ES9528-XTv2, ES7506, ES7510, ES7528, ES8508, ES8508F, ES8510, ES8510-XTE, ES9528/ES9528-XT (all versions) use undocumented accounts.	9.8	CRITICAL	CVSS:3.1/AV:N/AC:L/PR:N/UI:N/S:U/C:H/I:H/A:H		
CVE-2020-12502	2020-10-15T19:15:11.643	2024-11-21T04:59:48.970	Improper Authorization vulnerability of Pepperl+Fuchs P+F Comtrol RocketLinx ES7510-XT, ES8509-XT, ES8510-XT, ES9528-XTv2, ES7506, ES7510, ES7528, ES8508, ES8508F, ES8510, ES8510-XTE, ES9528/ES9528-XT (all versions) and ICRL-M-8RJ45/4SFP-G-DIN, ICRL-M-16RJ45/4CP-G-DIN FW 1.2.3 and below is prone to unauthenticated device administration.	8.8	HIGH	CVSS:3.1/AV:N/AC:L/PR:N/UI:R/S:U/C:H/I:H/A:H		
CVE-2020-12503	2020-10-15T19:15:11.753	2024-11-21T04:59:49.137	Improper Authorization vulnerability of Pepperl+Fuchs P+F Comtrol RocketLinx ES7510-XT, ES8509-XT, ES8510-XT, ES9528-XTv2, ES7506, ES7510, ES7528, ES8508, ES8508F, ES8510, ES8510-XTE, ES9528/ES9528-XT (all versions) and ICRL-M-8RJ45/4SFP-G-DIN, ICRL-M-16RJ45/4CP-G-DIN FW 1.2.3 and below is prone to multiple authenticated command injections.	7.2	HIGH	CVSS:3.1/AV:N/AC:L/PR:H/UI:N/S:U/C:H/I:H/A:H		
CVE-2020-12504	2020-10-15T19:15:11.993	2024-11-21T04:59:49.320	Improper Authorization vulnerability of Pepperl+Fuchs P+F Comtrol RocketLinx ES7510-XT, ES8509-XT, ES8510-XT, ES9528-XTv2, ES7506, ES7510, ES7528, ES8508, ES8508F, ES8510, ES8510-XTE, ES9528/ES9528-XT (all versions) and ICRL-M-8RJ45/4SFP-G-DIN, ICRL-M-16RJ45/4CP-G-DIN FW 1.2.3 and below has an active TFTP-Service.	9.8	CRITICAL	CVSS:3.1/AV:N/AC:L/PR:N/UI:N/S:U/C:H/I:H/A:H		
CVE-2020-15792	2020-10-15T19:15:12.767	2024-11-21T05:06:11.397	A vulnerability has been identified in Desigo Insight (All versions). The web service does not properly apply input validation for some query parameters in a reserved area. This could allow an authenticated attacker to retrieve data via a content-based blind SQL injection attack.	4.3	MEDIUM	CVSS:3.1/AV:N/AC:L/PR:L/UI:N/S:U/C:L/I:N/A:N		
CVE-2020-15793	2020-10-15T19:15:12.847	2024-11-21T05:06:11.510	A vulnerability has been identified in Desigo Insight (All versions). The device does not properly set the X-Frame-Options HTTP Header which makes it vulnerable to Clickjacking attacks. This could allow an unauthenticated attacker to retrieve or modify data in the context of a legitimate user by tricking that user to click on a website controlled by the attacker.	5.4	MEDIUM	CVSS:3.1/AV:N/AC:L/PR:N/UI:R/S:U/C:L/I:L/A:N		
CVE-2020-15794	2020-10-15T19:15:12.923	2024-11-21T05:06:11.627	A vulnerability has been identified in Desigo Insight (All versions). Some error messages in the web application show the absolute path to the requested resource. This could allow an authenticated attacker to retrieve additional information about the host system.	4.3	MEDIUM	CVSS:3.1/AV:N/AC:L/PR:L/UI:N/S:U/C:L/I:N/A:N		
CVE-2020-1777	2020-10-15T19:15:13.003	2024-11-21T05:11:22.173	Agent names that participates in a chat conversation are revealed in certain parts of the external interface as well as in chat transcriptions inside the tickets, when system is configured to mask real agent names. This issue affects OTRS; 7.0.21 and prior versions, 8.0.6 and prior versions.	4.3	MEDIUM	CVSS:3.1/AV:N/AC:L/PR:N/UI:R/S:U/C:L/I:N/A:N		
CVE-2020-7591	2020-10-15T19:15:13.080	2024-11-21T05:37:25.990	"A vulnerability has been identified in SIPORT MP (All versions < 3.2.1). Vulnerable versions of the device could allow an authenticated attacker to impersonate other users of the system and perform (potentially administrative) actions on behalf of those users if the single sign-on feature (""Allow logon without password"") is enabled."	8.8	HIGH	CVSS:3.1/AV:N/AC:L/PR:L/UI:N/S:U/C:H/I:H/A:H		
CVE-2019-17640	2020-10-15T21:15:11.427	2024-11-21T04:32:41.150	In Eclipse Vert.x 3.4.x up to 3.9.4, 4.0.0.milestone1, 4.0.0.milestone2, 4.0.0.milestone3, 4.0.0.milestone4, 4.0.0.milestone5, 4.0.0.Beta1, 4.0.0.Beta2, and 4.0.0.Beta3, StaticHandler doesn't correctly processes back slashes on Windows Operating systems, allowing, escape the webroot folder to the current working directory.	9.8	CRITICAL	CVSS:3.1/AV:N/AC:L/PR:N/UI:N/S:U/C:H/I:H/A:H		
CVE-2020-14185	2020-10-15T22:15:11.570	2024-11-21T05:02:49.850	Affected versions of Jira Server allow remote unauthenticated attackers to enumerate issue keys via a missing permissions check in the ActionsAndOperations resource. The affected versions are before 7.13.18, from version 8.0.0 before 8.5.9, and from version 8.6.0 before version 8.12.2.	5.3	MEDIUM	CVSS:3.1/AV:N/AC:L/PR:N/UI:N/S:U/C:L/I:N/A:N		
CVE-2020-27163	2020-10-16T03:15:12.777	2024-11-21T05:20:48.447	phpRedisAdmin before 1.13.2 allows XSS via the login.php username parameter.	6.1	MEDIUM	CVSS:3.1/AV:N/AC:L/PR:N/UI:R/S:C/C:L/I:L/A:N		
CVE-2020-27173	2020-10-16T04:15:12.070	2024-11-21T05:20:48.993	In vm-superio before 0.1.1, the serial console FIFO can grow to unlimited memory usage when data is sent to the input source (i.e., standard input). This behavior cannot be reproduced from the guest side. When no rate limiting is in place, the host can be subject to memory pressure, impacting all other VMs running on the same host.	7.5	HIGH	CVSS:3.1/AV:N/AC:L/PR:N/UI:N/S:U/C:N/I:N/A:H		
CVE-2020-27174	2020-10-16T05:15:11.830	2024-11-21T05:20:49.117	In Amazon AWS Firecracker before 0.21.3, and 0.22.x before 0.22.1, the serial console buffer can grow its memory usage without limit when data is sent to the standard input. This can result in a memory leak on the microVM emulation thread, possibly occupying more memory than intended on the host.	7.5	HIGH	CVSS:3.1/AV:N/AC:L/PR:N/UI:N/S:U/C:N/I:N/A:H		
CVE-2020-27176	2020-10-16T05:15:11.910	2024-11-21T05:20:49.240	"Mutation XSS exists in Mark Text through 0.16.2 that leads to Remote Code Execution. NOTE: this might be considered a duplicate of CVE-2020-26870; however, it can also be considered an issue in the design of the ""source code mode"" feature, which parses HTML even though HTML support is not one of the primary advertised roles of the product."	8.3	HIGH	CVSS:3.1/AV:N/AC:H/PR:N/UI:R/S:C/C:H/I:H/A:H		
CVE-2020-24352	2020-10-16T06:15:12.277	2024-11-21T05:14:38.890	An issue was discovered in QEMU through 5.1.0. An out-of-bounds memory access was found in the ATI VGA device implementation. This flaw occurs in the ati_2d_blt() routine in hw/display/ati_2d.c while handling MMIO write operations through the ati_mm_write() callback. A malicious guest could use this flaw to crash the QEMU process on the host, resulting in a denial of service.	5.5	MEDIUM	CVSS:3.1/AV:L/AC:L/PR:L/UI:N/S:U/C:N/I:N/A:H		
CVE-2020-25829	2020-10-16T06:15:12.357	2024-11-21T05:18:51.467	An issue has been found in PowerDNS Recursor before 4.1.18, 4.2.x before 4.2.5, and 4.3.x before 4.3.5. A remote attacker can cause the cached records for a given name to be updated to the Bogus DNSSEC validation state, instead of their actual DNSSEC Secure state, via a DNS ANY query. This results in a denial of service for installation that always validate (dnssec=validate), and for clients requesting validation when on-demand validation is enabled (dnssec=process).	7.5	HIGH	CVSS:3.1/AV:N/AC:L/PR:N/UI:N/S:U/C:N/I:N/A:H		
CVE-2020-26583	2020-10-16T06:15:12.417	2024-11-21T05:20:07.157	An issue was discovered in Sage DPW 2020_06_x before 2020_06_002. It allows unauthenticated users to upload JavaScript (in a file) via the expenses claiming functionality. However, to view the file, authentication is required. By exploiting this vulnerability, an attacker can persistently include arbitrary HTML or JavaScript code into the affected web page. The vulnerability can be used to change the contents of the displayed site, redirect to other sites, or steal user credentials. Additionally, users are potential victims of browser exploits and JavaScript malware.	6.1	MEDIUM	CVSS:3.1/AV:N/AC:L/PR:N/UI:R/S:C/C:L/I:L/A:N		
CVE-2020-26584	2020-10-16T06:15:12.480	2024-11-21T05:20:07.303	"An issue was discovered in Sage DPW 2020_06_x before 2020_06_002. The search field ""Kurs suchen"" on the page Kurskatalog is vulnerable to Reflected XSS. If the attacker can lure a user into clicking a crafted link, he can execute arbitrary JavaScript code in the user's browser. The vulnerability can be used to change the contents of the displayed site, redirect to other sites, or steal user credentials. Additionally, users are potential victims of browser exploits and JavaScript malware."	6.1	MEDIUM	CVSS:3.1/AV:N/AC:L/PR:N/UI:R/S:C/C:L/I:L/A:N		
CVE-2020-26943	2020-10-16T06:15:12.527	2024-11-21T05:20:33.137	An issue was discovered in OpenStack blazar-dashboard before 1.3.1, 2.0.0, and 3.0.0. A user allowed to access the Blazar dashboard in Horizon may trigger code execution on the Horizon host as the user the Horizon service runs under (because the Python eval function is used). This may result in Horizon host unauthorized access and further compromise of the Horizon service. All setups using the Horizon dashboard with the blazar-dashboard plugin are affected.	9.9	CRITICAL	CVSS:3.1/AV:N/AC:L/PR:L/UI:N/S:C/C:H/I:H/A:H		
CVE-2019-18794	2020-10-16T13:15:11.363	2024-11-21T04:33:34.730	The BASS Audio Library 2.4.14 under Windows is prone to a BASS_StreamCreateFile Use after Free vulnerability via a crafted .ogg file. An attacker can exploit this to gain access to sensitive information that may aid in further attacks. A failure in exploitation leads to denial of service.	6.5	MEDIUM	CVSS:3.1/AV:N/AC:L/PR:N/UI:R/S:U/C:H/I:N/A:N		
CVE-2019-18795	2020-10-16T13:15:11.440	2024-11-21T04:33:34.880	The BASS Audio Library 2.4.14 under Windows is prone to a BASS_StreamCreateFile out of bounds read vulnerability via a crafted .wav file. An attacker can exploit this issues to gain access to sensitive information that may aid in further attacks. A failure in exploitation leads to denial of service.	6.5	MEDIUM	CVSS:3.1/AV:N/AC:L/PR:N/UI:R/S:U/C:H/I:N/A:N		
CVE-2019-18796	2020-10-16T13:15:11.503	2024-11-21T04:33:35.027	The BASS Audio Library 2.4.14 under Windows is prone to a BASS_StreamCreateFile Denial of Service vulnerability (infinite loop) via a crafted .mp3 file. This weakness could allow attackers to consume excessive CPU and the application becomes unresponsive.	6.5	MEDIUM	CVSS:3.1/AV:N/AC:L/PR:N/UI:R/S:U/C:N/I:N/A:H		
CVE-2019-19513	2020-10-16T13:15:11.567	2024-11-21T04:34:51.737	The BASSMIDI plugin 2.4.12.1 for Un4seen BASS Audio Library on Windows is prone to an out of bounds write vulnerability. An attacker may exploit this to execute code on the target machine. A failure in exploitation leads to a denial of service.	9.8	CRITICAL	CVSS:3.1/AV:N/AC:L/PR:N/UI:N/S:U/C:H/I:H/A:H		
CVE-2019-19885	2020-10-16T13:15:11.627	2024-11-21T04:35:35.163	In Bender COMTRAXX, user authorization is validated for most, but not all, routes in the system. A user with knowledge about the routes can read and write configuration data without prior authorization. This affects COM465IP, COM465DP, COM465ID, CP700, CP907, and CP915 devices before 4.2.0.	9.1	CRITICAL	CVSS:3.1/AV:N/AC:L/PR:N/UI:N/S:U/C:H/I:H/A:N		
CVE-2020-26893	2020-10-16T13:15:11.707	2024-11-21T05:20:25.740	An issue was discovered in ClamXAV 3 before 3.1.1. A malicious actor could use a properly signed copy of ClamXAV 2 (running with an injected malicious dylib) to communicate with ClamXAV 3's helper tool and perform privileged operations. This occurs because of inadequate client verification in the helper tool.	7.8	HIGH	CVSS:3.1/AV:L/AC:L/PR:L/UI:N/S:U/C:H/I:H/A:H		
CVE-2020-14144	2020-10-16T14:15:11.470	2024-11-21T05:02:43.917	"The git hook feature in Gitea 1.1.0 through 1.12.5 might allow for authenticated remote code execution in customer environments where the documentation was not understood (e.g., one viewpoint is that the dangerousness of this feature should be documented immediately above the ENABLE_GIT_HOOKS line in the config file). NOTE: The vendor has indicated this is not a vulnerability and states ""This is a functionality of the software that is limited to a very limited subset of accounts. If you give someone the privilege to execute arbitrary code on your server, they can execute arbitrary code on your server. We provide very clear warnings to users around this functionality and what it provides."	7.2	HIGH	CVSS:3.1/AV:N/AC:L/PR:H/UI:N/S:U/C:H/I:H/A:H		
CVE-2020-14299	2020-10-16T14:15:11.533	2024-11-21T05:02:57.350	A flaw was found in JBoss EAP, where the authentication configuration is set-up using a legacy SecurityRealm, to delegate to a legacy PicketBox SecurityDomain, and then reloaded to admin-only mode. This flaw allows an attacker to perform a complete authentication bypass by using an arbitrary user and password. The highest threat to vulnerability is to system availability.	6.5	MEDIUM	CVSS:3.1/AV:N/AC:L/PR:L/UI:N/S:U/C:N/I:N/A:H		
CVE-2020-15867	2020-10-16T14:15:11.627	2024-11-21T05:06:20.747	"The git hook feature in Gogs 0.5.5 through 0.12.2 allows for authenticated remote code execution. There can be a privilege escalation if access to this hook feature is granted to a user who does not have administrative privileges. NOTE: because this is mentioned in the documentation but not in the UI, it could be considered a ""Product UI does not Warn User of Unsafe Actions"" issue."	7.2	HIGH	CVSS:3.1/AV:N/AC:L/PR:H/UI:N/S:U/C:H/I:H/A:H		
