CVE ID	Published Date	Last Modified Date	Description	Base Score	Base Severity	Vector String	Vendor	Product
CVE-2020-10800	2020-03-21T15:15:11.107	2024-11-21T04:56:05.913	lix through 15.8.7 allows man-in-the-middle attackers to execute arbitrary code by modifying the HTTP client-server data stream so that the Location header is associated with attacker-controlled executable content in the postDownload field.	8.1	HIGH	CVSS:3.1/AV:N/AC:H/PR:N/UI:N/S:U/C:H/I:H/A:H		
CVE-2020-10804	2020-03-22T04:15:11.297	2024-11-21T04:56:06.423	In phpMyAdmin 4.x before 4.9.5 and 5.x before 5.0.2, a SQL injection vulnerability was found in retrieval of the current username (in libraries/classes/Server/Privileges.php and libraries/classes/UserPassword.php). A malicious user with access to the server could create a crafted username, and then trick the victim into performing specific actions with that user account (such as editing its privileges).	8.0	HIGH	CVSS:3.1/AV:N/AC:L/PR:L/UI:R/S:U/C:H/I:H/A:H		
CVE-2020-10802	2020-03-22T05:15:11.603	2024-11-21T04:56:06.057	In phpMyAdmin 4.x before 4.9.5 and 5.x before 5.0.2, a SQL injection vulnerability has been discovered where certain parameters are not properly escaped when generating certain queries for search actions in libraries/classes/Controllers/Table/TableSearchController.php. An attacker can generate a crafted database or table name. The attack can be performed if a user attempts certain search operations on the malicious database or table.	8.0	HIGH	CVSS:3.1/AV:N/AC:L/PR:L/UI:R/S:U/C:H/I:H/A:H		
CVE-2020-10803	2020-03-22T05:15:11.667	2024-11-21T04:56:06.247	In phpMyAdmin 4.x before 4.9.5 and 5.x before 5.0.2, a SQL injection vulnerability was discovered where malicious code could be used to trigger an XSS attack through retrieving and displaying results (in tbl_get_field.php and libraries/classes/Display/Results.php). The attacker must be able to insert crafted data into certain database tables, which when retrieved (for instance, through the Browse tab) can trigger the XSS attack.	5.4	MEDIUM	CVSS:3.1/AV:N/AC:L/PR:L/UI:R/S:C/C:L/I:L/A:N		
CVE-2020-10806	2020-03-22T16:15:12.307	2024-11-21T04:56:06.587	eZ Publish Kernel before 5.4.14.1, 6.x before 6.13.6.2, and 7.x before 7.5.6.2 and eZ Publish Legacy before 5.4.14.1, 2017 before 2017.12.7.2, and 2019 before 2019.03.4.2 allow remote attackers to execute arbitrary code by uploading PHP code, unless the vhost configuration permits only app.php execution.	9.8	CRITICAL	CVSS:3.1/AV:N/AC:L/PR:N/UI:N/S:U/C:H/I:H/A:H		
CVE-2020-10807	2020-03-22T16:15:12.417	2024-11-21T04:56:06.737	"auth_svc in Caldera before 2.6.5 allows authentication bypass (for REST API requests) via a forged ""localhost"" string in the HTTP Host header."	5.3	MEDIUM	CVSS:3.1/AV:N/AC:L/PR:N/UI:N/S:U/C:L/I:N/A:N		
CVE-2020-10808	2020-03-22T17:15:11.017	2024-11-21T04:56:06.890	Vesta Control Panel (VestaCP) through 0.9.8-26 allows Command Injection via the schedule/backup Backup Listing Endpoint. The attacker must be able to create a crafted filename on the server, as demonstrated by an FTP session that renames .bash_logout to a .bash_logout' substring followed by shell metacharacters.	8.8	HIGH	CVSS:3.1/AV:N/AC:L/PR:L/UI:N/S:U/C:H/I:H/A:H		
CVE-2020-10809	2020-03-22T18:15:14.217	2024-11-21T04:56:07.040	An issue was discovered in HDF5 through 1.12.0. A heap-based buffer overflow exists in the function Decompress() located in decompress.c. It can be triggered by sending a crafted file to the gif2h5 binary. It allows an attacker to cause Denial of Service.	5.5	MEDIUM	CVSS:3.1/AV:L/AC:L/PR:N/UI:R/S:U/C:N/I:N/A:H		
CVE-2020-10810	2020-03-22T18:15:14.277	2024-11-21T04:56:07.183	An issue was discovered in HDF5 through 1.12.0. A NULL pointer dereference exists in the function H5AC_unpin_entry() located in H5AC.c. It allows an attacker to cause Denial of Service.	5.5	MEDIUM	CVSS:3.1/AV:L/AC:L/PR:N/UI:R/S:U/C:N/I:N/A:H		
CVE-2020-10811	2020-03-22T18:15:14.357	2024-11-21T04:56:07.333	An issue was discovered in HDF5 through 1.12.0. A heap-based buffer over-read exists in the function H5O__layout_decode() located in H5Olayout.c. It allows an attacker to cause Denial of Service.	5.5	MEDIUM	CVSS:3.1/AV:L/AC:L/PR:N/UI:R/S:U/C:N/I:N/A:H		
CVE-2020-10812	2020-03-22T18:15:14.433	2024-11-21T04:56:07.487	An issue was discovered in HDF5 through 1.12.0. A NULL pointer dereference exists in the function H5F_get_nrefs() located in H5Fquery.c. It allows an attacker to cause Denial of Service.	5.5	MEDIUM	CVSS:3.1/AV:L/AC:L/PR:N/UI:R/S:U/C:N/I:N/A:H		
CVE-2020-10818	2020-03-22T20:15:11.687	2024-11-21T04:56:08.233	"Artica Proxy 4.26 allows remote command execution for an authenticated user via shell metacharacters in the ""Modify the hostname"" field."	7.2	HIGH	CVSS:3.1/AV:N/AC:L/PR:H/UI:N/S:U/C:H/I:H/A:H		
CVE-2020-10819	2020-03-22T20:15:11.793	2024-11-21T04:56:08.373	Nagios XI 5.6.11 allows XSS via the includes/components/ldap_ad_integration/ username parameter.	4.8	MEDIUM	CVSS:3.1/AV:N/AC:L/PR:H/UI:R/S:C/C:L/I:L/A:N		
CVE-2020-10820	2020-03-22T20:15:11.873	2024-11-21T04:56:08.520	Nagios XI 5.6.11 allows XSS via the includes/components/ldap_ad_integration/ password parameter.	4.8	MEDIUM	CVSS:3.1/AV:N/AC:L/PR:H/UI:R/S:C/C:L/I:L/A:N		
CVE-2020-10821	2020-03-22T20:15:11.950	2024-11-21T04:56:08.660	Nagios XI 5.6.11 allows XSS via the account/main.php theme parameter.	4.8	MEDIUM	CVSS:3.1/AV:N/AC:L/PR:H/UI:R/S:C/C:L/I:L/A:N		
CVE-2020-9752	2020-03-23T03:15:11.167	2024-11-21T05:41:13.107	Naver Cloud Explorer before 2.2.2.11 allows the attacker can move a local file in any path on the filesystem as a system privilege through its named pipe.	9.8	CRITICAL	CVSS:3.1/AV:N/AC:L/PR:N/UI:N/S:U/C:H/I:H/A:H		
CVE-2020-10592	2020-03-23T13:15:12.957	2024-11-21T04:55:39.500	Tor before 0.3.5.10, 0.4.x before 0.4.1.9, and 0.4.2.x before 0.4.2.7 allows remote attackers to cause a Denial of Service (CPU consumption), aka TROVE-2020-002.	7.5	HIGH	CVSS:3.1/AV:N/AC:L/PR:N/UI:N/S:U/C:N/I:N/A:H		
CVE-2020-10593	2020-03-23T13:15:13.033	2024-11-21T04:55:39.640	Tor before 0.3.5.10, 0.4.x before 0.4.1.9, and 0.4.2.x before 0.4.2.7 allows remote attackers to cause a Denial of Service (memory leak), aka TROVE-2020-004. This occurs in circpad_setup_machine_on_circ because a circuit-padding machine can be negotiated twice on the same circuit.	7.5	HIGH	CVSS:3.1/AV:N/AC:L/PR:N/UI:N/S:U/C:N/I:N/A:H		
CVE-2020-10660	2020-03-23T13:15:13.127	2024-11-21T04:55:47.377	HashiCorp Vault and Vault Enterprise versions 0.9.0 through 1.3.3 may, under certain circumstances, have an Entity's Group membership inadvertently include Groups the Entity no longer has permissions to. Fixed in 1.3.4.	5.3	MEDIUM	CVSS:3.1/AV:N/AC:L/PR:N/UI:N/S:U/C:N/I:L/A:N		
CVE-2020-10661	2020-03-23T13:15:13.190	2024-11-21T04:55:47.517	HashiCorp Vault and Vault Enterprise versions 0.11.0 through 1.3.3 may, under certain circumstances, have existing nested-path policies grant access to Namespaces created after-the-fact. Fixed in 1.3.4.	9.1	CRITICAL	CVSS:3.1/AV:N/AC:L/PR:N/UI:N/S:U/C:H/I:H/A:N		
CVE-2019-15510	2020-03-23T14:15:12.987	2024-11-21T04:28:53.897	ManageEngine_DesktopCentral.exe in Zoho ManageEngine Desktop Central 10 allows HTML injection on the user administration page via the description of a role.	6.1	MEDIUM	CVSS:3.1/AV:N/AC:L/PR:N/UI:R/S:C/C:L/I:L/A:N		
CVE-2019-19964	2020-03-23T14:15:13.110	2024-11-21T04:35:45.500	On NETGEAR GS728TPS devices through 5.3.0.35, a remote attacker having network connectivity to the web-administration panel can access part of the web panel, bypassing authentication.	2.7	LOW	CVSS:3.1/AV:N/AC:L/PR:H/UI:N/S:U/C:L/I:N/A:N		
CVE-2019-5184	2020-03-23T14:15:13.190	2024-11-21T04:44:30.623	"An exploitable double free vulnerability exists in the iocheckd service ""I/O-Check"" functionality of WAGO PFC 200. A specially crafted XML cache file written to a specific location on the device can cause a heap pointer to be freed twice, resulting in a denial of service and potentially code execution. An attacker can send a specially crafted packet to trigger the parsing of this cache file."	7.8	HIGH	CVSS:3.1/AV:L/AC:L/PR:L/UI:N/S:U/C:H/I:H/A:H		
CVE-2019-5185	2020-03-23T14:15:13.283	2024-11-21T04:44:30.733	"An exploitable stack buffer overflow vulnerability vulnerability exists in the iocheckd service ""I/O-Check"" functionality of WAGO PFC 200. An attacker can send a specially crafted packet to trigger the parsing of this cache file. At 0x1ea28 the extracted state value from the xml file is used as an argument to /etc/config-tools/config_interfaces interface=X1 state=<contents of state node> using sprintf(). The destination buffer sp+0x40 is overflowed with the call to sprintf() for any state values that are greater than 512-len(""/etc/config-tools/config_interfaces interface=X1 state="") in length. Later, at 0x1ea08 strcpy() is used to copy the contents of the stack buffer that was overflowed sp+0x40 into sp+0x440. The buffer sp+0x440 is immediately adjacent to sp+0x40 on the stack. Therefore, there is no NULL termination on the buffer sp+0x40 since it overflowed into sp+0x440. The strcpy() will result in invalid memory access. An state value of length 0x3c9 will cause the service to crash."	7.0	HIGH	CVSS:3.1/AV:L/AC:H/PR:L/UI:N/S:U/C:H/I:H/A:H		
CVE-2019-5186	2020-03-23T14:15:13.487	2024-11-21T04:44:30.847	"An exploitable stack buffer overflow vulnerability vulnerability exists in the iocheckd service ""I/O-Check"" functionality of WAGO PFC 200. An attacker can send a specially crafted packet to trigger the parsing of this cache file.At 0x1eb9c the extracted interface element name from the xml file is used as an argument to /etc/config-tools/config_interfaces interface=<contents of interface element> using sprintf(). The destination buffer sp+0x40 is overflowed with the call to sprintf() for any interface values that are greater than 512-len(""/etc/config-tools/config_interfaces interface="") in length. Later, at 0x1ea08 strcpy() is used to copy the contents of the stack buffer that was overflowed sp+0x40 into sp+0x440. The buffer sp+0x440 is immediately adjacent to sp+0x40 on the stack. Therefore, there is no NULL termination on the buffer sp+0x40 since it overflowed into sp+0x440. The strcpy() will result in invalid memory access. An interface value of length 0x3c4 will cause the service to crash."	7.0	HIGH	CVSS:3.1/AV:L/AC:H/PR:L/UI:N/S:U/C:H/I:H/A:H		
CVE-2020-1950	2020-03-23T14:15:13.610	2024-11-21T05:11:43.073	A carefully crafted or corrupt PSD file can cause excessive memory usage in Apache Tika's PSDParser in versions 1.0-1.23.	5.5	MEDIUM	CVSS:3.1/AV:L/AC:L/PR:N/UI:R/S:U/C:N/I:N/A:H		
CVE-2020-1951	2020-03-23T14:15:13.690	2024-11-21T05:11:43.267	A carefully crafted or corrupt PSD file can cause an infinite loop in Apache Tika's PSDParser in versions 1.0-1.23.	5.5	MEDIUM	CVSS:3.1/AV:L/AC:L/PR:N/UI:R/S:U/C:N/I:N/A:H		
CVE-2020-6650	2020-03-23T14:15:13.750	2024-11-21T05:36:05.780	UPS companion software v1.05 & Prior is affected by Eval Injection vulnerability. The software does not neutralize or incorrectly neutralizes code syntax before using the input in a dynamic evaluation call e.g.eval in Update Manager class when software attempts to see if there are updates available. This results in arbitrary code execution on the machine where software is installed.	8.3	HIGH	CVSS:3.1/AV:A/AC:H/PR:N/UI:N/S:C/C:H/I:H/A:H		
CVE-2016-11022	2020-03-23T15:15:14.597	2024-11-21T02:45:19.230	NETGEAR Prosafe WC9500 5.1.0.17, WC7600 5.1.0.17, and WC7520 2.5.0.35 devices allow a remote attacker to execute code with root privileges via shell metacharacters in the reqMethod parameter to login_handler.php.	7.2	HIGH	CVSS:3.1/AV:N/AC:L/PR:H/UI:N/S:U/C:H/I:H/A:H		
CVE-2020-10793	2020-03-23T15:15:14.720	2024-11-21T04:56:05.160	"CodeIgniter through 4.0.0 allows remote attackers to gain privileges via a modified Email ID to the ""Select Role of the User"" page. NOTE: A contributor to the CodeIgniter framework argues that the issue should not be attributed to CodeIgniter. Furthermore, the blog post reference shows an unknown website built with the CodeIgniter framework but that CodeIgniter is not responsible for introducing this issue because the framework has never provided a login screen, nor any kind of login or user management facilities beyond a Session library. Also, another reporter indicates the issue is with a custom module/plugin to CodeIgniter, not CodeIgniter itself."	8.8	HIGH	CVSS:3.1/AV:N/AC:L/PR:L/UI:N/S:U/C:H/I:H/A:H		
CVE-2020-8497	2020-03-23T15:15:14.830	2024-11-21T05:38:56.883	In Artica Pandora FMS through 7.42, an unauthenticated attacker can read the chat history. The file is in JSON format and it contains user names, user IDs, private messages, and timestamps.	5.3	MEDIUM	CVSS:3.1/AV:N/AC:L/PR:N/UI:N/S:U/C:L/I:N/A:N		
CVE-2019-4718	2020-03-23T16:15:13.127	2024-11-21T04:44:02.750	IBM Jazz for Service Management 3.13 is vulnerable to cross-site scripting. This vulnerability allows users to embed arbitrary JavaScript code in the Web UI thus altering the intended functionality potentially leading to credentials disclosure within a trusted session. IBM X-Force ID: 172123.	5.4	MEDIUM	CVSS:3.1/AV:N/AC:L/PR:L/UI:R/S:C/C:L/I:L/A:N		
CVE-2020-10364	2020-03-23T16:15:13.220	2024-11-21T04:55:09.437	The SSH daemon on MikroTik routers through v6.44.3 could allow remote attackers to generate CPU activity, trigger refusal of new authorized connections, and cause a reboot via connect and write system calls, because of uncontrolled resource management.	7.5	HIGH	CVSS:3.1/AV:N/AC:L/PR:N/UI:N/S:U/C:N/I:N/A:H		
CVE-2020-6420	2020-03-23T16:15:17.127	2024-11-21T05:35:41.733	Insufficient policy enforcement in media in Google Chrome prior to 80.0.3987.132 allowed a remote attacker to bypass same origin policy via a crafted HTML page.	8.8	HIGH	CVSS:3.1/AV:N/AC:L/PR:N/UI:R/S:U/C:H/I:H/A:H		
CVE-2020-6422	2020-03-23T16:15:17.173	2024-11-21T05:35:41.840	Use after free in WebGL in Google Chrome prior to 80.0.3987.149 allowed a remote attacker to potentially exploit heap corruption via a crafted HTML page.	8.8	HIGH	CVSS:3.1/AV:N/AC:L/PR:N/UI:R/S:U/C:H/I:H/A:H		
CVE-2020-6424	2020-03-23T16:15:17.253	2024-11-21T05:35:42.083	Use after free in media in Google Chrome prior to 80.0.3987.149 allowed a remote attacker to potentially exploit heap corruption via a crafted HTML page.	8.8	HIGH	CVSS:3.1/AV:N/AC:L/PR:N/UI:R/S:U/C:H/I:H/A:H		
CVE-2020-6425	2020-03-23T16:15:17.313	2024-11-21T05:35:42.200	Insufficient policy enforcement in extensions in Google Chrome prior to 80.0.3987.149 allowed an attacker who convinced a user to install a malicious extension to bypass site isolation via a crafted Chrome Extension.	5.4	MEDIUM	CVSS:3.1/AV:N/AC:L/PR:N/UI:R/S:U/C:L/I:L/A:N		
CVE-2020-6426	2020-03-23T16:15:17.377	2024-11-21T05:35:42.317	Inappropriate implementation in V8 in Google Chrome prior to 80.0.3987.149 allowed a remote attacker to potentially exploit heap corruption via a crafted HTML page.	6.5	MEDIUM	CVSS:3.1/AV:N/AC:L/PR:N/UI:R/S:U/C:N/I:H/A:N		
CVE-2020-6427	2020-03-23T16:15:17.457	2024-11-21T05:35:42.450	Use after free in audio in Google Chrome prior to 80.0.3987.149 allowed a remote attacker to potentially exploit heap corruption via a crafted HTML page.	8.8	HIGH	CVSS:3.1/AV:N/AC:L/PR:N/UI:R/S:U/C:H/I:H/A:H		
CVE-2020-6428	2020-03-23T16:15:17.517	2024-11-21T05:35:42.573	Use after free in audio in Google Chrome prior to 80.0.3987.149 allowed a remote attacker to potentially exploit heap corruption via a crafted HTML page.	8.8	HIGH	CVSS:3.1/AV:N/AC:L/PR:N/UI:R/S:U/C:H/I:H/A:H		
CVE-2020-6429	2020-03-23T16:15:17.597	2024-11-21T05:35:42.690	Use after free in audio in Google Chrome prior to 80.0.3987.149 allowed a remote attacker to potentially exploit heap corruption via a crafted HTML page.	8.8	HIGH	CVSS:3.1/AV:N/AC:L/PR:N/UI:R/S:U/C:H/I:H/A:H		
CVE-2020-6449	2020-03-23T16:15:17.657	2024-11-21T05:35:45.060	Use after free in audio in Google Chrome prior to 80.0.3987.149 allowed a remote attacker to potentially exploit heap corruption via a crafted HTML page.	8.8	HIGH	CVSS:3.1/AV:N/AC:L/PR:N/UI:R/S:U/C:H/I:H/A:H		
CVE-2020-7935	2020-03-23T16:15:17.737	2024-11-21T05:38:02.450	Artica Pandora FMS through 7.42 is vulnerable to remote PHP code execution because of an Unrestricted Upload Of A File With A Dangerous Type issue in the File Manager. An attacker can create a (or use an existing) directory that is externally accessible to store PHP files. The filename and the exact path is known by the attacker, so it is possible to execute PHP code in the context of the application. The vulnerability is exploitable only with Administrator access.	7.2	HIGH	CVSS:3.1/AV:N/AC:L/PR:H/UI:N/S:U/C:H/I:H/A:H		
CVE-2020-8511	2020-03-23T16:15:17.797	2024-11-21T05:38:58.343	In Artica Pandora FMS through 7.42, Web Admin users can execute arbitrary code by uploading a .php file via the File Repository component, a different issue than CVE-2020-7935 and CVE-2020-8500.	7.2	HIGH	CVSS:3.1/AV:N/AC:L/PR:H/UI:N/S:U/C:H/I:H/A:H		
CVE-2020-9759	2020-03-23T16:15:17.860	2024-11-21T05:41:13.870	A Vulnerability of LG Electronic web OS TV Emulator could allow an attacker to escalate privileges and overwrite certain files. This vulnerability is due to wrong environment setting. An attacker could exploit this vulnerability through crafted configuration files and executable files.	4.6	MEDIUM	CVSS:3.1/AV:L/AC:L/PR:L/UI:R/S:C/C:L/I:L/A:N		
CVE-2020-9760	2020-03-23T16:15:17.923	2024-11-21T05:41:14.010	An issue was discovered in WeeChat before 2.7.1 (0.3.4 to 2.7 are affected). When a new IRC message 005 is received with longer nick prefixes, a buffer overflow and possibly a crash can happen when a new mode is set for a nick.	9.8	CRITICAL	CVSS:3.1/AV:N/AC:L/PR:N/UI:N/S:U/C:H/I:H/A:H		
CVE-2019-19034	2020-03-23T17:15:15.127	2024-11-21T04:34:02.193	Zoho ManageEngine Asset Explorer 6.5 does not validate the System Center Configuration Manager (SCCM) database username when dynamically generating a command to schedule scans for SCCM. This allows an attacker to execute arbitrary commands on the AssetExplorer Server with NT AUTHORITY/SYSTEM privileges.	7.2	HIGH	CVSS:3.1/AV:N/AC:L/PR:H/UI:N/S:U/C:H/I:H/A:H		
CVE-2019-20626	2020-03-23T17:15:15.237	2024-11-21T04:38:54.570	The remote keyless system on Honda HR-V 2017 vehicles sends the same RF signal for each door-open request, which might allow a replay attack.	6.5	MEDIUM	CVSS:3.1/AV:A/AC:L/PR:N/UI:N/S:U/C:N/I:H/A:N		
CVE-2019-20627	2020-03-23T17:15:15.300	2024-11-21T04:38:54.723	AutoUpdater.cs in AutoUpdater.NET before 1.5.8 allows XXE.	9.8	CRITICAL	CVSS:3.1/AV:N/AC:L/PR:N/UI:N/S:U/C:H/I:H/A:H		
CVE-2020-8838	2020-03-23T17:15:15.427	2024-11-21T05:39:32.317	An issue was discovered in Zoho ManageEngine AssetExplorer 6.5. During an upgrade of the Windows agent, it does not validate the source and binary downloaded. This allows an attacker on an adjacent network to execute code with NT AUTHORITY/SYSTEM privileges on the agent machines by providing an arbitrary executable via a man-in-the-middle attack.	6.4	MEDIUM	CVSS:3.1/AV:A/AC:H/PR:H/UI:N/S:U/C:H/I:H/A:H		
CVE-2020-9392	2020-03-23T17:15:15.487	2024-11-21T05:40:33.047	An issue was discovered in the pricing-table-by-supsystic plugin before 1.8.2 for WordPress. Because there is no permission check on the ImportJSONTable, createFromTpl, and getJSONExportTable endpoints, unauthenticated users can retrieve pricing table information, create new tables, or import/modify a table.	7.3	HIGH	CVSS:3.1/AV:N/AC:L/PR:N/UI:N/S:U/C:L/I:L/A:L		
CVE-2020-8871	2020-03-23T18:15:12.273	2024-11-21T05:39:36.517	This vulnerability allows local attackers to escalate privileges on affected installations of Parallels Desktop 15.1.0-47107 . An attacker must first obtain the ability to execute high-privileged code on the target guest system in order to exploit this vulnerability. The specific flaw exists within the VGA virtual device. The issue results from the lack of proper validation of user-supplied data, which can result in a write past the end of an allocated buffer. An attacker can leverage this vulnerability to escalate privileges and execute code in the context of the hypervisor. Was ZDI-CAN-9403.	6.7	MEDIUM	CVSS:3.1/AV:L/AC:L/PR:H/UI:N/S:U/C:H/I:H/A:H		
CVE-2020-8872	2020-03-23T18:15:12.367	2024-11-21T05:39:36.617	This vulnerability allows local attackers to disclose sensitive information on affected installations of Parallels Desktop 15.1.1-47117. An attacker must first obtain the ability to execute high-privileged code on the target guest system in order to exploit this vulnerability. The specific flaw exists within the xHCI component. The issue results from the lack of proper validation of user-supplied data, which can result in a read past the end of an allocated buffer. An attacker can leverage this in conjunction with other vulnerabilities to execute code in the context of the hypervisor. Was ZDI-CAN-9428.	4.4	MEDIUM	CVSS:3.1/AV:L/AC:L/PR:H/UI:N/S:U/C:H/I:N/A:N		
CVE-2020-8873	2020-03-23T18:15:12.447	2024-11-21T05:39:36.720	This vulnerability allows local attackers to escalate privileges on affected installations of Parallels Desktop 15.1.2-47123. An attacker must first obtain the ability to execute high-privileged code on the target guest system in order to exploit this vulnerability. The specific flaw exists within the xHCI component. The issue results from the lack of proper locking when performing operations on an object. An attacker can leverage this vulnerability to escalate privileges and execute code in the context of the hypervisor. Was ZDI-CAN-10031.	6.7	MEDIUM	CVSS:3.1/AV:L/AC:L/PR:H/UI:N/S:U/C:H/I:H/A:H		
CVE-2020-8874	2020-03-23T18:15:12.523	2024-11-21T05:39:36.820	This vulnerability allows local attackers to escalate privileges on affected installations of Parallels Desktop 15.1.2-47123. An attacker must first obtain the ability to execute high-privileged code on the target guest system in order to exploit this vulnerability. The specific flaw exists within the xHCI component. The issue results from the lack of proper validation of user-supplied data, which can result in an integer overflow before allocating a buffer. An attacker can leverage this vulnerability to escalate privileges and execute code in the context of the hypervisor. Was ZDI-CAN-10032.	6.7	MEDIUM	CVSS:3.1/AV:L/AC:L/PR:H/UI:N/S:U/C:H/I:H/A:H		
CVE-2020-8875	2020-03-23T18:15:12.633	2024-11-21T05:39:36.923	This vulnerability allows local attackers to escalate privileges on affected installations of Parallels Desktop 15.1.2-47123. An attacker must first obtain the ability to execute low-privileged code on the target system in order to exploit this vulnerability. The specific flaw exists within the IOCTL handler. The issue results from the lack of proper validation of user-supplied data, which can result in a write past the end of an allocated buffer. An attacker can leverage this vulnerability to escalate privileges and execute code in the context of the kernel. Was ZDI-CAN-10028.	8.8	HIGH	CVSS:3.1/AV:L/AC:L/PR:L/UI:N/S:C/C:H/I:H/A:H		
CVE-2020-8876	2020-03-23T18:15:12.713	2024-11-21T05:39:37.023	This vulnerability allows local attackers to disclose information on affected installations of Parallels Desktop 15.1.2-47123. An attacker must first obtain the ability to execute low-privileged code on the target system in order to exploit this vulnerability. The specific flaw exists within the IOCTL handler. The issue results from the lack of proper validation of user-supplied data, which can result in a read past the end of an allocated buffer. An attacker can leverage this in conjunction with other vulnerabilities to execute arbitrary code in the context of the kernel. Was ZDI-CAN-10029.	5.5	MEDIUM	CVSS:3.1/AV:L/AC:L/PR:L/UI:N/S:U/C:H/I:N/A:N		
CVE-2020-7474	2020-03-23T19:15:12.337	2024-11-21T05:37:13.103	A CWE-427: Uncontrolled Search Path Element vulnerability exists in ProSoft Configurator (v1.002 and prior), for the PMEPXM0100 (H) module, which could cause the execution of untrusted code when using double click to open a project file which may trigger execution of a malicious DLL.	7.8	HIGH	CVSS:3.1/AV:L/AC:L/PR:N/UI:R/S:U/C:H/I:H/A:H		
CVE-2020-7475	2020-03-23T19:15:12.413	2024-11-21T05:37:13.210	A CWE-74: Improper Neutralization of Special Elements in Output Used by a Downstream Component ('Injection'), reflective DLL, vulnerability exists in EcoStruxure Control Expert (all versions prior to 14.1 Hot Fix), Unity Pro (all versions), Modicon M340 (all versions prior to V3.20), Modicon M580 (all versions prior to V3.10), which, if exploited, could allow attackers to transfer malicious code to the controller.	9.8	CRITICAL	CVSS:3.1/AV:N/AC:L/PR:N/UI:N/S:U/C:H/I:H/A:H		
CVE-2019-6560	2020-03-23T20:15:11.667	2024-11-21T04:46:41.797	In Auto-Maskin RP210E Versions 3.7 and prior, DCU210E Versions 3.7 and prior and Marine Observer Pro (Android App), the software contains a mechanism for users to recover or change their passwords without knowing the original password, but the mechanism is weak.	9.1	CRITICAL	CVSS:3.1/AV:N/AC:L/PR:N/UI:N/S:U/C:H/I:H/A:N		
CVE-2020-10870	2020-03-23T20:15:11.807	2024-11-21T04:56:15.613	Zim through 0.72.1 creates temporary directories with predictable names. A malicious user could predict and create Zim's temporary directories and prevent other users from being able to start Zim, resulting in a denial of service.	5.5	MEDIUM	CVSS:3.1/AV:L/AC:L/PR:L/UI:N/S:U/C:N/I:N/A:H		
