CVE ID	Published Date	Last Modified Date	Description	Base Score	Base Severity	Vector String	Vendor	Product
CVE-2020-15240	2020-10-21T18:15:12.813	2024-11-21T05:05:10.037	omniauth-auth0 (rubygems) versions >= 2.3.0 and < 2.4.1 improperly validate the JWT token signature when using the `jwt_validator.verify` method. Improper validation of the JWT token signature can allow an attacker to bypass authentication and authorization. You are affected by this vulnerability if all of the following conditions apply: 1. You are using `omniauth-auth0`. 2. You are using `JWTValidator.verify` method directly OR you are not authenticating using the SDK’s default Authorization Code Flow. The issue is patched in version 2.4.1.	7.4	HIGH	CVSS:3.1/AV:N/AC:H/PR:N/UI:N/S:U/C:H/I:H/A:N		
CVE-2018-11764	2020-10-21T19:15:13.543	2024-11-21T03:43:59.023	Web endpoint authentication check is broken in Apache Hadoop 3.0.0-alpha4, 3.0.0-beta1, and 3.0.0. Authenticated users may impersonate any user even if no proxy user is configured.	8.8	HIGH	CVSS:3.1/AV:N/AC:L/PR:L/UI:N/S:U/C:H/I:H/A:H		
CVE-2020-17381	2020-10-21T19:15:14.090	2024-11-21T05:07:58.607	An issue was discovered in Ghisler Total Commander 9.51. Due to insufficient access restrictions in the default installation directory, an attacker can elevate privileges by replacing the %SYSTEMDRIVE%\totalcmd\TOTALCMD64.EXE binary.	7.3	HIGH	CVSS:3.1/AV:L/AC:L/PR:L/UI:R/S:U/C:H/I:H/A:H		
CVE-2020-3299	2020-10-21T19:15:15.513	2024-11-21T05:30:45.790	Multiple Cisco products are affected by a vulnerability in the Snort detection engine that could allow an unauthenticated, remote attacker to bypass a configured File Policy for HTTP. The vulnerability is due to incorrect detection of modified HTTP packets used in chunked responses. An attacker could exploit this vulnerability by sending crafted HTTP packets through an affected device. A successful exploit could allow the attacker to bypass a configured File Policy for HTTP packets and deliver a malicious payload.	5.8	MEDIUM	CVSS:3.1/AV:N/AC:L/PR:N/UI:N/S:C/C:N/I:L/A:N		
CVE-2020-3304	2020-10-21T19:15:15.623	2024-11-21T05:30:46.330	A vulnerability in the web interface of Cisco Adaptive Security Appliance (ASA) Software and Firepower Threat Defense (FTD) Software could allow an unauthenticated, remote attacker to cause an affected device to reload unexpectedly, resulting in a denial of service (DoS) condition. The vulnerability is due to a lack of proper input validation of HTTP requests. An attacker could exploit this vulnerability by sending a crafted HTTP request to an affected device. An exploit could allow the attacker to cause a DoS condition. Note: This vulnerability applies to IP Version 4 (IPv4) and IP Version 6 (IPv6) HTTP traffic.	8.6	HIGH	CVSS:3.1/AV:N/AC:L/PR:N/UI:N/S:C/C:N/I:N/A:H		
CVE-2020-3317	2020-10-21T19:15:15.717	2024-11-21T05:30:47.783	A vulnerability in the ssl_inspection component of Cisco Firepower Threat Defense (FTD) Software could allow an unauthenticated, remote attacker to crash Snort instances. The vulnerability is due to insufficient input validation in the ssl_inspection component. An attacker could exploit this vulnerability by sending a malformed TLS packet through a Cisco Adaptive Security Appliance (ASA). A successful exploit could allow the attacker to crash a Snort instance, resulting in a denial of service (DoS) condition.	7.5	HIGH	CVSS:3.1/AV:N/AC:L/PR:N/UI:N/S:U/C:N/I:N/A:H		
CVE-2020-3352	2020-10-21T19:15:15.810	2024-11-21T05:30:51.623	A vulnerability in the CLI of Cisco Firepower Threat Defense (FTD) Software could allow an authenticated, local attacker to access hidden commands. The vulnerability is due to the presence of undocumented configuration commands. An attacker could exploit this vulnerability by performing specific steps that make the hidden commands accessible. A successful exploit could allow the attacker to make configuration changes to various sections of an affected device that should not be exposed to CLI access.	5.5	MEDIUM	CVSS:3.1/AV:L/AC:L/PR:L/UI:N/S:U/C:N/I:H/A:N		
CVE-2020-3373	2020-10-21T19:15:15.903	2024-11-21T05:30:54.193	A vulnerability in the IP fragment-handling implementation of Cisco Adaptive Security Appliance (ASA) Software and Cisco Firepower Threat Defense (FTD) Software could allow an unauthenticated, remote attacker to cause a memory leak on an affected device. This memory leak could prevent traffic from being processed through the device, resulting in a denial of service (DoS) condition. The vulnerability is due to improper error handling when specific failures occur during IP fragment reassembly. An attacker could exploit this vulnerability by sending crafted, fragmented IP traffic to a targeted device. A successful exploit could allow the attacker to continuously consume memory on the affected device and eventually impact traffic, resulting in a DoS condition. The device could require a manual reboot to recover from the DoS condition. Note: This vulnerability applies to both IP Version 4 (IPv4) and IP Version 6 (IPv6) traffic.	8.6	HIGH	CVSS:3.1/AV:N/AC:L/PR:N/UI:N/S:C/C:N/I:N/A:H		
CVE-2020-3410	2020-10-21T19:15:15.997	2024-11-26T16:09:02.407	A vulnerability in the Common Access Card (CAC) authentication feature of Cisco Firepower Management Center (FMC) Software could allow an unauthenticated, remote attacker to bypass authentication and access the FMC system. The attacker must have a valid CAC to initiate the access attempt. The vulnerability is due to incorrect session invalidation during CAC authentication. An attacker could exploit this vulnerability by performing a CAC-based authentication attempt to an affected system. A successful exploit could allow the attacker to access an affected system with the privileges of a CAC-authenticated user who is currently logged in.	8.1	HIGH	CVSS:3.1/AV:N/AC:H/PR:N/UI:N/S:U/C:H/I:H/A:H		
CVE-2020-3436	2020-10-21T19:15:16.077	2024-11-21T05:31:03.880	A vulnerability in the web services interface of Cisco Adaptive Security Appliance (ASA) and Cisco Firepower Threat Defense (FTD) Software could allow an unauthenticated, remote attacker to upload arbitrary-sized files to specific folders on an affected device, which could lead to an unexpected device reload. The vulnerability exists because the affected software does not efficiently handle the writing of large files to specific folders on the local file system. An attacker could exploit this vulnerability by uploading files to those specific folders. A successful exploit could allow the attacker to write a file that triggers a watchdog timeout, which would cause the device to unexpectedly reload, causing a denial of service (DoS) condition.	8.6	HIGH	CVSS:3.1/AV:N/AC:L/PR:N/UI:N/S:C/C:N/I:N/A:H		
CVE-2020-3455	2020-10-21T19:15:16.170	2024-11-21T05:31:06.197	A vulnerability in the secure boot process of Cisco FXOS Software could allow an authenticated, local attacker to bypass the secure boot mechanisms. The vulnerability is due to insufficient protections of the secure boot process. An attacker could exploit this vulnerability by injecting code into a specific file that is then referenced during the device boot process. A successful exploit could allow the attacker to break the chain of trust and inject code into the boot process of the device which would be executed at each boot and maintain persistence across reboots.	7.8	HIGH	CVSS:3.1/AV:L/AC:L/PR:L/UI:N/S:U/C:H/I:H/A:H		
CVE-2020-3456	2020-10-21T19:15:16.263	2024-11-21T05:31:06.343	A vulnerability in the Cisco Firepower Chassis Manager (FCM) of Cisco FXOS Software could allow an unauthenticated, remote attacker to conduct a cross-site request forgery (CSRF) attack against a user of an affected device. The vulnerability is due to insufficient CSRF protections for the FCM interface. An attacker could exploit this vulnerability by persuading a targeted user to click a malicious link. A successful exploit could allow the attacker to send arbitrary requests that could take unauthorized actions on behalf of the targeted user.	8.8	HIGH	CVSS:3.1/AV:N/AC:L/PR:N/UI:R/S:U/C:H/I:H/A:H		
CVE-2020-3457	2020-10-21T19:15:16.357	2024-11-21T05:31:06.517	A vulnerability in the CLI of Cisco FXOS Software could allow an authenticated, local attacker to inject arbitrary commands that are executed with root privileges. The vulnerability is due to insufficient input validation of commands supplied by the user. An attacker could exploit this vulnerability by authenticating to a device and submitting crafted input to the affected command. A successful exploit could allow the attacker to execute commands on the underlying operating system with root privileges.	6.7	MEDIUM	CVSS:3.1/AV:L/AC:L/PR:H/UI:N/S:U/C:H/I:H/A:H		
CVE-2020-3458	2020-10-21T19:15:16.450	2024-11-21T05:31:06.670	Multiple vulnerabilities in the secure boot process of Cisco Adaptive Security Appliance (ASA) Software and Firepower Threat Defense (FTD) Software for the Firepower 1000 Series and Firepower 2100 Series Appliances could allow an authenticated, local attacker to bypass the secure boot mechanism. The vulnerabilities are due to insufficient protections of the secure boot process. An attacker could exploit these vulnerabilities by injecting code into specific files that are then referenced during the device boot process. A successful exploit could allow the attacker to break the chain of trust and inject code into the boot process of the device, which would be executed at each boot and maintain persistence across reboots.	6.7	MEDIUM	CVSS:3.1/AV:L/AC:L/PR:H/UI:N/S:U/C:H/I:H/A:H		
CVE-2020-3459	2020-10-21T19:15:16.543	2024-11-21T05:31:06.810	A vulnerability in the CLI of Cisco FXOS Software could allow an authenticated, local attacker to inject arbitrary commands that are executed with root privileges. The vulnerability is due to insufficient input validation of commands supplied by the user. An attacker could exploit this vulnerability by authenticating to a device and submitting crafted input to the affected command. A successful exploit could allow the attacker to execute commands on the underlying operating system with root privileges.	7.8	HIGH	CVSS:3.1/AV:L/AC:L/PR:L/UI:N/S:U/C:H/I:H/A:H		
CVE-2020-3499	2020-10-21T19:15:16.623	2024-11-26T16:09:02.407	A vulnerability in the licensing service of Cisco Firepower Management Center (FMC) Software could allow an unauthenticated, remote attacker to cause a denial of service (DoS) condition.The vulnerability is due to improper handling of system resource values by the affected system. An attacker could exploit this vulnerability by sending malicious requests to the targeted system. A successful exploit could allow the attacker to cause the affected system to become unresponsive, resulting in a DoS condition and preventing the management of dependent devices.	8.6	HIGH	CVSS:3.1/AV:N/AC:L/PR:N/UI:N/S:C/C:N/I:N/A:H		
CVE-2020-3514	2020-10-21T19:15:16.717	2024-11-26T16:09:02.407	A vulnerability in the multi-instance feature of Cisco Firepower Threat Defense (FTD) Software could allow an authenticated, local attacker to escape the container for their Cisco FTD instance and execute commands with root privileges in the host namespace. The attacker must have valid credentials on the device.The vulnerability exists because a configuration file that is used at container startup has insufficient protections. An attacker could exploit this vulnerability by modifying a specific container configuration file on the underlying file system. A successful exploit could allow the attacker to execute commands with root privileges within the host namespace. This could allow the attacker to impact other running Cisco FTD instances or the host Cisco FXOS device.	8.2	HIGH	CVSS:3.1/AV:L/AC:L/PR:H/UI:N/S:C/C:H/I:H/A:H		
CVE-2020-3515	2020-10-21T19:15:16.793	2024-11-26T16:09:02.407	Multiple vulnerabilities in the web-based management interface of Cisco Firepower Management Center (FMC) Software could allow an unauthenticated, remote attacker to conduct a cross-site scripting (XSS) attack against a user of the interface. These vulnerabilities are due to insufficient validation of user-supplied input by the web-based management interface. An attacker could exploit these vulnerabilities by persuading a user of the interface to click a crafted link. A successful exploit could allow the attacker to execute arbitrary script code in the context of the interface or access sensitive, browser-based information.	6.1	MEDIUM	CVSS:3.1/AV:N/AC:L/PR:N/UI:R/S:C/C:L/I:L/A:N		
CVE-2020-3528	2020-10-21T19:15:16.887	2024-11-21T05:31:15.430	A vulnerability in the OSPF Version 2 (OSPFv2) implementation of Cisco Adaptive Security Appliance (ASA) Software and Cisco Firepower Threat Defense (FTD) Software could allow an unauthenticated, remote attacker to cause an affected device to reload, resulting in a denial of service (DoS) condition. The vulnerability is due to incomplete input validation when the affected software processes certain OSPFv2 packets with Link-Local Signaling (LLS) data. An attacker could exploit this vulnerability by sending a malformed OSPFv2 packet to an affected device. A successful exploit could allow the attacker to cause an affected device to reload, resulting in a DoS condition.	8.6	HIGH	CVSS:3.1/AV:N/AC:L/PR:N/UI:N/S:C/C:N/I:N/A:H		
CVE-2020-3529	2020-10-21T19:15:16.967	2024-11-21T05:31:15.557	A vulnerability in the SSL VPN negotiation process for Cisco Adaptive Security Appliance (ASA) Software and Cisco Firepower Threat Defense (FTD) Software could allow an unauthenticated, remote attacker to cause a reload of an affected device, resulting in a denial of service (DoS) condition. The vulnerability is due to inefficient direct memory access (DMA) memory management during the negotiation phase of an SSL VPN connection. An attacker could exploit this vulnerability by sending a steady stream of crafted Datagram TLS (DTLS) traffic to an affected device. A successful exploit could allow the attacker to exhaust DMA memory on the device and cause a DoS condition.	8.6	HIGH	CVSS:3.1/AV:N/AC:L/PR:N/UI:N/S:C/C:N/I:N/A:H		
CVE-2020-3533	2020-10-21T19:15:17.043	2024-11-21T05:31:15.980	A vulnerability in the Simple Network Management Protocol (SNMP) input packet processor of Cisco Firepower Threat Defense (FTD) Software could allow an unauthenticated, remote attacker to cause an affected device to restart unexpectedly. The vulnerability is due to a lack of sufficient memory management protections under heavy SNMP polling loads. An attacker could exploit this vulnerability by sending a high rate of SNMP requests to the SNMP daemon through the management interface on an affected device. A successful exploit could allow the attacker to cause the SNMP daemon process to consume a large amount of system memory over time, which could then lead to an unexpected device restart, causing a denial of service (DoS) condition. This vulnerability affects all versions of SNMP.	8.6	HIGH	CVSS:3.1/AV:N/AC:L/PR:N/UI:N/S:C/C:N/I:N/A:H		
CVE-2020-3549	2020-10-21T19:15:17.123	2024-11-26T16:09:02.407	A vulnerability in the sftunnel functionality of Cisco Firepower Management Center (FMC) Software and Cisco Firepower Threat Defense (FTD) Software could allow an unauthenticated, remote attacker to obtain the device registration hash. The vulnerability is due to insufficient sftunnel negotiation protection during initial device registration. An attacker in a man-in-the-middle position could exploit this vulnerability by intercepting a specific flow of the sftunnel communication between an FMC device and an FTD device. A successful exploit could allow the attacker to decrypt and modify the sftunnel communication between FMC and FTD devices, allowing the attacker to modify configuration data sent from an FMC device to an FTD device or alert data sent from an FTD device to an FMC device.	8.1	HIGH	CVSS:3.1/AV:N/AC:H/PR:N/UI:N/S:U/C:H/I:H/A:H		
CVE-2020-3550	2020-10-21T19:15:17.217	2024-11-26T16:09:02.407	A vulnerability in the sfmgr daemon of Cisco Firepower Management Center (FMC) Software and Cisco Firepower Threat Defense (FTD) Software could allow an authenticated, remote attacker to perform directory traversal and access directories outside the restricted path. The vulnerability is due to insufficient input validation. An attacker could exploit this vulnerability by using a relative path in specific sfmgr commands. An exploit could allow the attacker to read or write arbitrary files on an sftunnel-connected peer device.	8.1	HIGH	CVSS:3.1/AV:N/AC:L/PR:L/UI:N/S:U/C:H/I:H/A:N		
CVE-2020-3553	2020-10-21T19:15:17.327	2024-11-26T16:09:02.407	Multiple vulnerabilities in the web-based management interface of Cisco Firepower Management Center (FMC) Software could allow an unauthenticated, remote attacker to conduct a cross-site scripting (XSS) attack against a user of the interface. These vulnerabilities are due to insufficient validation of user-supplied input by the web-based management interface. An attacker could exploit these vulnerabilities by persuading a user of the interface to click a crafted link. A successful exploit could allow the attacker to execute arbitrary script code in the context of the interface or access sensitive, browser-based information.	6.1	MEDIUM	CVSS:3.1/AV:N/AC:L/PR:N/UI:R/S:C/C:L/I:L/A:N		
CVE-2020-3554	2020-10-21T19:15:17.420	2024-11-21T05:31:18.257	A vulnerability in the TCP packet processing of Cisco Adaptive Security Appliance (ASA) Software and Cisco Firepower Threat Defense (FTD) Software could allow an unauthenticated, remote attacker to cause a denial of service (DoS) condition on an affected device. The vulnerability is due to a memory exhaustion condition. An attacker could exploit this vulnerability by sending a high rate of crafted TCP traffic through an affected device. A successful exploit could allow the attacker to exhaust device resources, resulting in a DoS condition for traffic transiting the affected device.	7.5	HIGH	CVSS:3.1/AV:N/AC:L/PR:N/UI:N/S:U/C:N/I:N/A:H		
CVE-2020-3555	2020-10-21T19:15:17.513	2024-11-21T05:31:18.387	A vulnerability in the SIP inspection process of Cisco Adaptive Security Appliance (ASA) Software and Cisco Firepower Threat Defense (FTD) Software could allow an unauthenticated, remote attacker to cause a crash and reload of an affected device, resulting in a denial of service (DoS) condition. The vulnerability is due to a watchdog timeout and crash during the cleanup of threads that are associated with a SIP connection that is being deleted from the connection list. An attacker could exploit this vulnerability by sending a high rate of crafted SIP traffic through an affected device. A successful exploit could allow the attacker to cause a watchdog timeout and crash, resulting in a crash and reload of the affected device.	6.8	MEDIUM	CVSS:3.1/AV:N/AC:H/PR:N/UI:N/S:C/C:N/I:N/A:H		
CVE-2020-3557	2020-10-21T19:15:17.607	2024-11-26T16:09:02.407	A vulnerability in the host input API daemon of Cisco Firepower Management Center (FMC) Software could allow an unauthenticated, remote attacker to cause a denial of service (DoS) condition on an affected device. The vulnerability is due to improper certificate validation. An attacker could exploit this vulnerability by sending a crafted data stream to the host input daemon of the affected device. A successful exploit could allow the attacker to cause the host input daemon to restart. The attacker could use repeated attacks to cause the daemon to continuously reload, creating a DoS condition for the API.	5.3	MEDIUM	CVSS:3.1/AV:N/AC:L/PR:N/UI:N/S:U/C:N/I:N/A:L		
CVE-2020-3558	2020-10-21T19:15:17.700	2024-11-26T16:09:02.407	A vulnerability in the web-based management interface of Cisco Firepower Management Center (FMC) Software could allow an unauthenticated, remote attacker to redirect a user to a malicious web page. The vulnerability is due to improper input validation of the parameters of an HTTP request. An attacker could exploit this vulnerability by intercepting an HTTP request from a user. A successful exploit could allow the attacker to modify the HTTP request to cause the interface to redirect the user to a specific, malicious URL. This type of vulnerability is known as an open redirect attack and is used in phishing attacks that get users to unknowingly visit malicious sites.	4.7	MEDIUM	CVSS:3.1/AV:N/AC:L/PR:N/UI:R/S:C/C:N/I:L/A:N		
CVE-2020-3561	2020-10-21T19:15:17.793	2024-11-21T05:31:19.147	A vulnerability in the Clientless SSL VPN (WebVPN) of Cisco Adaptive Security Appliance (ASA) Software and Cisco Firepower Threat Defense (FTD) Software could allow an unauthenticated, remote attacker to inject arbitrary HTTP headers in the responses of the affected system. The vulnerability is due to improper input sanitization. An attacker could exploit this vulnerability by persuading a user of the interface to click a crafted link. A successful exploit could allow the attacker to conduct a CRLF injection attack, adding arbitrary HTTP headers in the responses of the system and redirecting the user to arbitrary websites.	4.7	MEDIUM	CVSS:3.1/AV:N/AC:L/PR:N/UI:R/S:C/C:N/I:L/A:N		
CVE-2020-3562	2020-10-21T19:15:17.887	2024-11-21T05:31:19.267	A vulnerability in the SSL/TLS inspection of Cisco Firepower Threat Defense (FTD) Software for Cisco Firepower 2100 Series firewalls could allow an unauthenticated, remote attacker to cause a denial of service (DoS) condition on an affected device. The vulnerability is due to improper input validation for certain fields of specific SSL/TLS messages. An attacker could exploit this vulnerability by sending a malformed SSL/TLS message through an affected device. A successful exploit could allow the attacker to cause the affected device to reload, resulting in a DoS condition. No manual intervention is needed to recover the device after it has reloaded.	8.6	HIGH	CVSS:3.1/AV:N/AC:L/PR:N/UI:N/S:C/C:N/I:N/A:H		
CVE-2020-3563	2020-10-21T19:15:17.967	2024-11-21T05:31:19.380	A vulnerability in the packet processing functionality of Cisco Firepower Threat Defense (FTD) Software could allow an unauthenticated, remote attacker to cause a denial of service (DoS) condition on an affected device. The vulnerability is due to inefficient memory management. An attacker could exploit this vulnerability by sending a large number of TCP packets to a specific port on an affected device. A successful exploit could allow the attacker to exhaust system memory, which could cause the device to reload unexpectedly. No manual intervention is needed to recover the device after it has reloaded.	8.6	HIGH	CVSS:3.1/AV:N/AC:L/PR:N/UI:N/S:C/C:N/I:N/A:H		
CVE-2020-3564	2020-10-21T19:15:18.060	2024-11-21T05:31:19.510	A vulnerability in the FTP inspection engine of Cisco Adaptive Security Appliance (ASA) Software and Cisco Firepower Threat Defense (FTD) Software could allow an unauthenticated, remote attacker to bypass FTP inspection. The vulnerability is due to ineffective flow tracking of FTP traffic. An attacker could exploit this vulnerability by sending crafted FTP traffic through an affected device. A successful exploit could allow the attacker to bypass FTP inspection and successfully complete FTP connections.	5.3	MEDIUM	CVSS:3.1/AV:N/AC:L/PR:N/UI:N/S:U/C:N/I:L/A:N		
CVE-2020-3565	2020-10-21T19:15:18.137	2024-11-21T05:31:19.623	A vulnerability in the TCP Intercept functionality of Cisco Firepower Threat Defense (FTD) Software could allow an unauthenticated, remote attacker to bypass configured Access Control Policies (including Geolocation) and Service Polices on an affected system. The vulnerability exists because TCP Intercept is invoked when the embryonic connection limit is reached, which can cause the underlying detection engine to process the packet incorrectly. An attacker could exploit this vulnerability by sending a crafted stream of traffic that matches a policy on which TCP Intercept is configured. A successful exploit could allow the attacker to match on an incorrect policy, which could allow the traffic to be forwarded when it should be dropped. In addition, the traffic could incorrectly be dropped.	5.8	MEDIUM	CVSS:3.1/AV:N/AC:L/PR:N/UI:N/S:C/C:N/I:L/A:N		
CVE-2020-3571	2020-10-21T19:15:18.230	2024-11-21T05:31:20.243	A vulnerability in the ICMP ingress packet processing of Cisco Firepower Threat Defense (FTD) Software for Cisco Firepower 4110 appliances could allow an unauthenticated, remote attacker to cause a denial of service (DoS) condition on an affected device. The vulnerability is due to incomplete input validation upon receiving ICMP packets. An attacker could exploit this vulnerability by sending a high number of crafted ICMP or ICMPv6 packets to an affected device. A successful exploit could allow the attacker to cause a memory exhaustion condition that may result in an unexpected reload. No manual intervention is needed to recover the device after the reload.	8.6	HIGH	CVSS:3.1/AV:N/AC:L/PR:N/UI:N/S:C/C:N/I:N/A:H		
CVE-2020-3572	2020-10-21T19:15:18.327	2024-11-21T05:31:20.360	A vulnerability in the SSL/TLS session handler of Cisco Adaptive Security Appliance (ASA) Software and Cisco Firepower Threat Defense (FTD) Software could allow an unauthenticated, remote attacker to cause a denial of service (DoS) condition on an affected device. The vulnerability is due to a memory leak when closing SSL/TLS connections in a specific state. An attacker could exploit this vulnerability by establishing several SSL/TLS sessions and ensuring they are closed under certain conditions. A successful exploit could allow the attacker to exhaust memory resources in the affected device, which would prevent it from processing new SSL/TLS connections, resulting in a DoS. Manual intervention is required to recover an affected device.	8.6	HIGH	CVSS:3.1/AV:N/AC:L/PR:N/UI:N/S:C/C:N/I:N/A:H		
