CVE ID	Published Date	Last Modified Date	Description	Base Score	Base Severity	Vector String	Vendor	Product
CVE-2019-7589	2020-03-10T20:15:20.350	2024-11-21T04:48:23.027	A vulnerability with the SmartService API Service option exists whereby an unauthorized user could potentially exploit this to upload malicious code to the server that could be executed at system level privileges. This affects Johnson Controls' Kantech EntraPass Corporate Edition versions 8.0 and prior; Kantech EntraPass Global Edition versions 8.0 and prior.	9.8	CRITICAL	CVSS:3.1/AV:N/AC:L/PR:N/UI:N/S:U/C:H/I:H/A:H		
CVE-2020-0010	2020-03-10T20:15:20.447	2024-11-21T04:52:44.580	In fpc_ta_get_build_info of fpc_ta_kpi.c, there is a possible out of bounds write due to a missing bounds check. This could lead to local escalation of privilege with System execution privileges needed. User interaction is not needed for exploitation.Product: AndroidVersions: Android kernelAndroid ID: A-137014293References: N/A	6.7	MEDIUM	CVSS:3.1/AV:L/AC:L/PR:H/UI:N/S:U/C:H/I:H/A:H		
CVE-2020-0011	2020-03-10T20:15:20.507	2024-11-21T04:52:44.687	In get_auth_result of fpc_ta_hw_auth.c, there is a possible out of bounds write due to a missing bounds check. This could lead to local escalation of privilege with System execution privileges needed. User interaction is not needed for exploitation.Product: AndroidVersions: Android kernelAndroid ID: A-137648045References: N/A	6.7	MEDIUM	CVSS:3.1/AV:L/AC:L/PR:H/UI:N/S:U/C:H/I:H/A:H		
CVE-2020-0012	2020-03-10T20:15:20.587	2024-11-21T04:52:44.790	In fpc_ta_pn_get_unencrypted_image of fpc_ta_pn.c, there is a possible out of bounds write due to a missing bounds check. This could lead to local escalation of privilege with System execution privileges needed. User interaction is not needed for exploitation.Product: AndroidVersions: Android kernelAndroid ID: A-137648844	6.7	MEDIUM	CVSS:3.1/AV:L/AC:L/PR:H/UI:N/S:U/C:H/I:H/A:H		
CVE-2020-0029	2020-03-10T20:15:20.633	2024-11-21T04:52:46.630	In the WifiConfigManager, there is a possible storage of location history which can only be deleted by triggering a factory reset. This could lead to local information disclosure with System execution privileges needed. User interaction is not needed for exploitation.Product: AndroidVersions: Android-10Android ID: A-140065828	2.3	LOW	CVSS:3.1/AV:L/AC:L/PR:H/UI:N/S:U/C:L/I:N/A:N		
CVE-2020-0031	2020-03-10T20:15:20.710	2024-11-21T04:52:46.847	In triggerAugmentedAutofillLocked and related functions of Session.java, it is possible for Augmented Autofill to display sensitive information to the user inappropriately. This could lead to local information disclosure with no additional execution privileges needed. User interaction is needed for exploitation.Product: AndroidVersions: Android-10Android ID: A-141703197	5.0	MEDIUM	CVSS:3.1/AV:L/AC:L/PR:L/UI:R/S:U/C:H/I:N/A:N		
CVE-2020-0032	2020-03-10T20:15:20.773	2024-11-21T04:52:46.970	In ih264d_release_display_bufs of ih264d_utils.c, there is a possible out of bounds write due to a heap buffer overflow. This could lead to remote code execution with no additional execution privileges needed. User interaction is needed for exploitation.Product: AndroidVersions: Android-8.0 Android-8.1 Android-9 Android-10Android ID: A-145364230	8.8	HIGH	CVSS:3.1/AV:N/AC:L/PR:N/UI:R/S:U/C:H/I:H/A:H		
CVE-2020-0033	2020-03-10T20:15:20.853	2024-11-21T04:52:47.067	In CryptoPlugin::decrypt of CryptoPlugin.cpp, there is a possible out of bounds write due to stale pointer. This could lead to local escalation of privilege with no additional execution privileges needed. User interaction is not needed for exploitation.Product: AndroidVersions: Android-8.0 Android-8.1 Android-9 Android-10Android ID: A-144351324	7.8	HIGH	CVSS:3.1/AV:L/AC:L/PR:L/UI:N/S:U/C:H/I:H/A:H		
CVE-2020-0034	2020-03-10T20:15:20.930	2024-11-21T04:52:47.173	In vp8_decode_frame of decodeframe.c, there is a possible out of bounds read due to improper input validation. This could lead to remote information disclosure if error correction were turned on, with no additional execution privileges needed. User interaction is not needed for exploitation.Product: AndroidVersions: Android-8.0 Android-8.1Android ID: A-62458770	7.5	HIGH	CVSS:3.1/AV:N/AC:L/PR:N/UI:N/S:U/C:H/I:N/A:N		
CVE-2020-0035	2020-03-10T20:15:21.007	2024-11-21T04:52:47.277	In query of TelephonyProvider.java, there is a possible access to SIM card info due to a missing permission check. This could lead to local information disclosure with no additional execution privileges needed. User interaction is not needed for exploitation.Product: AndroidVersions: Android-8.0 Android-8.1 Android-9Android ID: A-140622024	5.5	MEDIUM	CVSS:3.1/AV:L/AC:L/PR:L/UI:N/S:U/C:H/I:N/A:N		
CVE-2020-0036	2020-03-10T20:15:21.070	2024-11-21T04:52:47.380	In hasPermissions of PermissionMonitor.java, there is a possible access to restricted permissions due to a permissions bypass. This could lead to local escalation of privilege with no additional execution privileges needed. User interaction is not needed for exploitation.Product: AndroidVersions: Android-8.0 Android-8.1 Android-9 Android-10Android ID: A-144679405	7.8	HIGH	CVSS:3.1/AV:L/AC:L/PR:L/UI:N/S:U/C:H/I:H/A:H		
CVE-2020-0037	2020-03-10T20:15:21.163	2024-11-21T04:52:47.483	In rw_i93_sm_set_read_only of rw_i93.cc, there is a possible out of bounds read due to a missing bounds check. This could lead to remote information disclosure over NFC with no additional execution privileges needed. User interaction is not needed for exploitation.Product: AndroidVersions: Android-8.0 Android-8.1 Android-9 Android-10Android ID: A-143106535	7.5	HIGH	CVSS:3.1/AV:N/AC:L/PR:N/UI:N/S:U/C:H/I:N/A:N		
CVE-2020-0038	2020-03-10T20:15:21.257	2024-11-21T04:52:47.583	In rw_i93_sm_update_ndef of rw_i93.cc, there is a possible read of uninitialized data due to a missing bounds check. This could lead to remote information disclosure with no additional execution privileges needed. User interaction is not needed for exploitation.Product: AndroidVersions: Android-8.0 Android-8.1 Android-9 Android-10Android ID: A-143109193	7.5	HIGH	CVSS:3.1/AV:N/AC:L/PR:N/UI:N/S:U/C:H/I:N/A:N		
CVE-2020-0039	2020-03-10T20:15:21.320	2024-11-21T04:52:47.683	In rw_i93_sm_update_ndef of rw_i93.cc, there is a possible read of uninitialized data due to a missing bounds check. This could lead to remote information disclosure with no additional execution privileges needed. User interaction is not needed for exploitation.Product: AndroidVersions: Android-8.0 Android-8.1 Android-9 Android-10Android ID: A-143155861	7.5	HIGH	CVSS:3.1/AV:N/AC:L/PR:N/UI:N/S:U/C:H/I:N/A:N		
CVE-2020-0041	2020-03-10T20:15:21.383	2025-04-04T13:01:37.253	In binder_transaction of binder.c, there is a possible out of bounds write due to an incorrect bounds check. This could lead to local escalation of privilege with no additional execution privileges needed. User interaction is not needed for exploitation.Product: AndroidVersions: Android kernelAndroid ID: A-145988638References: Upstream kernel	7.8	HIGH	CVSS:3.1/AV:L/AC:L/PR:L/UI:N/S:U/C:H/I:H/A:H		
CVE-2020-0042	2020-03-10T20:15:21.460	2024-11-21T04:52:47.887	In fpc_ta_hw_auth_unwrap_key of fpc_ta_hw_auth_qsee.c, there is a possible out of bounds read due to a missing bounds check. This could lead to local information disclosure with System execution privileges needed. User interaction is not needed for exploitation.Product: AndroidVersions: Android kernelAndroid ID: A-137649599	4.4	MEDIUM	CVSS:3.1/AV:L/AC:L/PR:H/UI:N/S:U/C:H/I:N/A:N		
CVE-2020-0043	2020-03-10T20:15:21.523	2024-11-21T04:52:48.003	In authorize_enrol of fpc_ta_hw_auth.c, there is a possible out of bounds read due to a missing bounds check. This could lead to local information disclosure with System execution privileges needed. User interaction is not needed for exploitation.Product: AndroidVersions: Android kernelAndroid ID: A-137650218	4.4	MEDIUM	CVSS:3.1/AV:L/AC:L/PR:H/UI:N/S:U/C:H/I:N/A:N		
CVE-2020-0044	2020-03-10T20:15:21.603	2024-11-21T04:52:48.107	In set_nonce of fpc_ta_qc_auth.c, there is a possible out of bounds read due to a missing bounds check. This could lead to local information disclosure with System execution privileges needed. User interaction is not needed for exploitation.Product: AndroidVersions: Android kernelAndroid ID: A-137650219	4.4	MEDIUM	CVSS:3.1/AV:L/AC:L/PR:H/UI:N/S:U/C:H/I:N/A:N		
CVE-2020-0058	2020-03-10T20:15:21.663	2024-11-21T04:52:49.603	In l2c_rcv_acl_data of l2c_main.cc, there is a possible out of bounds read due to an incorrect bounds check. This could lead to local information disclosure with System execution privileges needed. User interaction is not needed for exploitation.Product: AndroidVersions: Android-10Android ID: A-141745011	4.4	MEDIUM	CVSS:3.1/AV:L/AC:L/PR:H/UI:N/S:U/C:H/I:N/A:N		
CVE-2020-0059	2020-03-10T20:15:21.743	2024-11-21T04:52:49.713	In btm_ble_batchscan_filter_track_adv_vse_cback of btm_ble_batchscan.cc, there is a possible out of bounds read due to a missing bounds check. This could lead to local information disclosure with no additional execution privileges needed. User interaction is not needed for exploitation.Product: AndroidVersions: Android-10Android ID: A-142543524	5.5	MEDIUM	CVSS:3.1/AV:L/AC:L/PR:L/UI:N/S:U/C:H/I:N/A:N		
CVE-2020-0060	2020-03-10T20:15:21.820	2024-11-21T04:52:49.813	In query of SmsProvider.java and MmsSmsProvider.java, there is a possible permission bypass due to SQL injection. This could lead to local information disclosure with System execution privileges needed. User interaction is not needed for exploitation.Product: AndroidVersions: Android-10Android ID: A-143229845	4.4	MEDIUM	CVSS:3.1/AV:L/AC:L/PR:H/UI:N/S:U/C:H/I:N/A:N		
CVE-2020-0061	2020-03-10T20:15:21.867	2024-11-21T04:52:49.927	In Pixel Recorder, there is a possible permissions bypass allowing arbitrary apps to record audio. This could lead to local information disclosure with no additional execution privileges needed. User interaction is not needed for exploitation.Product: AndroidVersions: Android kernelAndroid ID: A-145504977	5.5	MEDIUM	CVSS:3.1/AV:L/AC:L/PR:L/UI:N/S:U/C:H/I:N/A:N		
CVE-2020-0069	2020-03-10T20:15:21.947	2025-04-04T13:01:47.817	In the ioctl handlers of the Mediatek Command Queue driver, there is a possible out of bounds write due to insufficient input sanitization and missing SELinux restrictions. This could lead to local escalation of privilege with no additional execution privileges needed. User interaction is not needed for exploitation.Product: AndroidVersions: Android kernelAndroid ID: A-147882143References: M-ALPS04356754	7.8	HIGH	CVSS:3.1/AV:L/AC:L/PR:L/UI:N/S:U/C:H/I:H/A:H		
CVE-2020-0083	2020-03-10T20:15:22.023	2024-11-21T04:52:52.500	In setRequirePmfInternal of sta_network.cpp, there is a possible default value being improperly applied due to a logic error. This could lead to remote denial of service with no additional execution privileges needed. User interaction is not needed for exploitation.Product: AndroidVersions: Android-10Android ID: A-142797954	7.5	HIGH	CVSS:3.1/AV:N/AC:L/PR:N/UI:N/S:U/C:N/I:N/A:H		
CVE-2020-7579	2020-03-10T20:15:22.117	2024-11-21T05:37:24.740	A vulnerability has been identified in Spectrum Power 5 (All versions < v5.50 HF02). The web server could allow Cross-Site Scripting (XSS) attacks if unsuspecting users are tricked into accessing a malicious link. User interaction is required for a successful exploitation. If deployed according to recommended system configuration, Siemens consideres the environmental vector as CR:L/IR:M/AR:H/MAV:A (4.1).	6.1	MEDIUM	CVSS:3.1/AV:N/AC:L/PR:N/UI:R/S:C/C:L/I:L/A:N		
CVE-2020-9044	2020-03-10T20:15:22.197	2024-11-21T05:39:53.377	XXE vulnerability exists in the Metasys family of product Web Services which has the potential to facilitate DoS attacks or harvesting of ASCII server files. This affects Johnson Controls' Metasys Application and Data Server (ADS, ADS-Lite) versions 10.1 and prior; Metasys Extended Application and Data Server (ADX) versions 10.1 and prior; Metasys Open Data Server (ODS) versions 10.1 and prior; Metasys Open Application Server (OAS) version 10.1; Metasys Network Automation Engine (NAE55 only) versions 9.0.1, 9.0.2, 9.0.3, 9.0.5, 9.0.6; Metasys Network Integration Engine (NIE55/NIE59) versions 9.0.1, 9.0.2, 9.0.3, 9.0.5, 9.0.6; Metasys NAE85 and NIE85 versions 10.1 and prior; Metasys LonWorks Control Server (LCS) versions 10.1 and prior; Metasys System Configuration Tool (SCT) versions 13.2 and prior; Metasys Smoke Control Network Automation Engine (NAE55, UL 864 UUKL/ORD-C100-13 UUKLC 10th Edition Listed) version 8.1.	7.5	HIGH	CVSS:3.1/AV:N/AC:L/PR:N/UI:N/S:U/C:N/I:N/A:H		
CVE-2019-11938	2020-03-10T21:15:11.653	2024-11-21T04:22:01.290	Java Facebook Thrift servers would not error upon receiving messages declaring containers of sizes larger than the payload. As a result, malicious clients could send short messages which would result in a large memory allocation, potentially leading to denial of service. This issue affects Facebook Thrift prior to v2019.12.09.00.	7.5	HIGH	CVSS:3.1/AV:N/AC:L/PR:N/UI:N/S:U/C:N/I:N/A:H		
CVE-2019-3553	2020-03-10T21:15:11.747	2024-11-21T04:42:09.317	C++ Facebook Thrift servers would not error upon receiving messages declaring containers of sizes larger than the payload. As a result, malicious clients could send short messages which would result in a large memory allocation, potentially leading to denial of service. This issue affects Facebook Thrift prior to v2020.02.03.00.	7.5	HIGH	CVSS:3.1/AV:N/AC:L/PR:N/UI:N/S:U/C:N/I:N/A:H		
CVE-2020-0045	2020-03-10T21:15:11.870	2024-11-21T04:52:48.207	In StatsService::command of StatsService.cpp, there is possible memory corruption due to a race condition. This could lead to local escalation of privilege with System execution privileges needed. User interaction is not needed for exploitation.Product: AndroidVersions: Android-10Android ID: A-141243101	6.4	MEDIUM	CVSS:3.1/AV:L/AC:H/PR:H/UI:N/S:U/C:H/I:H/A:H		
CVE-2020-0046	2020-03-10T21:15:11.997	2024-11-21T04:52:48.310	In DrmPlugin::releaseSecureStops of DrmPlugin.cpp, there is a possible out of bounds write due to a heap buffer overflow. This could lead to local escalation of privilege with no additional execution privileges needed. User interaction is not needed for exploitation.Product: AndroidVersions: Android-10Android ID: A-137284652	7.8	HIGH	CVSS:3.1/AV:L/AC:L/PR:L/UI:N/S:U/C:H/I:H/A:H		
CVE-2020-0047	2020-03-10T21:15:12.137	2024-11-21T04:52:48.420	In setMasterMute of AudioService.java, there is a missing permission check. This could lead to local silencing of audio with no additional execution privileges needed. User interaction is not needed for exploitation.Product: AndroidVersions: Android-10Android ID: A-141622311	3.3	LOW	CVSS:3.1/AV:L/AC:L/PR:L/UI:N/S:U/C:N/I:L/A:N		
CVE-2020-0048	2020-03-10T21:15:12.200	2024-11-21T04:52:48.520	In onTransact of IAudioFlinger.cpp, there is a possible stack information leak due to uninitialized data. This could lead to local information disclosure with no additional execution privileges needed. User interaction is not needed for exploitation.Product: AndroidVersions: Android-10Android ID: A-139417189	5.5	MEDIUM	CVSS:3.1/AV:L/AC:L/PR:L/UI:N/S:U/C:H/I:N/A:N		
CVE-2020-0049	2020-03-10T21:15:12.293	2024-11-21T04:52:48.623	In onReadBuffer() of StreamingSource.cpp, there is a possible information disclosure due to uninitialized data. This could lead to remote information disclosure with no additional execution privileges needed. User interaction is needed for exploitation.Product: AndroidVersions: Android-10Android ID: A-140177694	6.5	MEDIUM	CVSS:3.1/AV:N/AC:L/PR:N/UI:R/S:U/C:H/I:N/A:N		
CVE-2020-0050	2020-03-10T21:15:12.387	2024-11-21T04:52:48.733	In nfa_hciu_send_msg of nfa_hci_utils.cc, there is a possible out of bounds write due to improper input validation. This could lead to local escalation of privilege in the NFC server with System execution privileges needed. User interaction is not needed for exploitation.Product: AndroidVersions: Android-10Android ID: A-124521372	6.7	MEDIUM	CVSS:3.1/AV:L/AC:L/PR:H/UI:N/S:U/C:H/I:H/A:H		
CVE-2020-0051	2020-03-10T21:15:12.450	2024-11-21T04:52:48.840	In onCreate of SettingsHomepageActivity, there is a possible tapjacking attack. This could lead to local escalation of privilege in Settings with no additional execution privileges needed. User interaction is needed for exploitation.Product: AndroidVersions: Android-10Android ID: A-138442483	7.8	HIGH	CVSS:3.1/AV:L/AC:L/PR:N/UI:R/S:U/C:H/I:H/A:H		
CVE-2020-0052	2020-03-10T21:15:12.543	2024-11-21T04:52:48.943	In smsSelected of AnswerFragment.java, there is a way to send an SMS from the lock screen due to a permissions bypass. This could lead to local escalation of privilege on the lock screen with no additional execution privileges needed. User interaction is needed for exploitation.Product: AndroidVersions: Android-10Android ID: A-137102479	4.3	MEDIUM	CVSS:3.1/AV:P/AC:L/PR:N/UI:R/S:U/C:N/I:H/A:N		
CVE-2020-0053	2020-03-10T21:15:12.607	2024-11-21T04:52:49.053	In convertHidlNanDataPathInitiatorRequestToLegacy, and convertHidlNanDataPathIndicationResponseToLegacy of hidl_struct_util.cpp, there is a possible out of bounds write due to a missing bounds check. This could lead to local escalation of privilege with System execution privileges needed. User interaction is not needed for exploitation.Product: AndroidVersions: Android-10Android ID: A-143789898	6.7	MEDIUM	CVSS:3.1/AV:L/AC:L/PR:H/UI:N/S:U/C:H/I:H/A:H		
CVE-2020-0054	2020-03-10T21:15:12.700	2024-11-21T04:52:49.163	In WifiNetworkSuggestionsManager of WifiNetworkSuggestionsManager.java, there is a possible permission revocation due to a missing permission check. This could lead to local escalation of privilege with no additional execution privileges needed. User interaction is not needed for exploitation.Product: AndroidVersions: Android-10Android ID: A-146642727	7.8	HIGH	CVSS:3.1/AV:L/AC:L/PR:L/UI:N/S:U/C:H/I:H/A:H		
CVE-2020-0055	2020-03-10T21:15:12.810	2024-11-21T04:52:49.270	In l2c_link_process_num_completed_pkts of l2c_link.cc, there is a possible out of bounds read due to a missing bounds check. This could lead to local information disclosure with no additional execution privileges needed. User interaction is not needed for exploitation.Product: AndroidVersions: Android-10Android ID: A-141617601	5.5	MEDIUM	CVSS:3.1/AV:L/AC:L/PR:L/UI:N/S:U/C:H/I:N/A:N		
CVE-2020-0056	2020-03-10T21:15:12.887	2024-11-21T04:52:49.387	In btu_hcif_connection_comp_evt of btu_hcif.cc, there is a possible out of bounds read due to a missing bounds check. This could lead to local information disclosure with no additional execution privileges needed. User interaction is not needed for exploitation.Product: AndroidVersions: Android-10Android ID: A-141619686	5.5	MEDIUM	CVSS:3.1/AV:L/AC:L/PR:L/UI:N/S:U/C:H/I:N/A:N		
CVE-2020-0057	2020-03-10T21:15:12.967	2024-11-21T04:52:49.497	In btm_process_inq_results of btm_inq.cc, there is a possible out of bounds read due to a missing bounds check. This could lead to local information disclosure with no additional execution privileges needed. User interaction is not needed for exploitation.Product: AndroidVersions: Android-10Android ID: A-141620271	5.5	MEDIUM	CVSS:3.1/AV:L/AC:L/PR:L/UI:N/S:U/C:H/I:N/A:N		
CVE-2020-0062	2020-03-10T21:15:13.027	2024-11-21T04:52:50.030	In Euicc, there is a possible information disclosure due to an included test Certificate. This could lead to remote information disclosure with no additional execution privileges needed. User interaction is not needed for exploitation.Product: AndroidVersions: Android kernelAndroid ID: A-143232031	7.5	HIGH	CVSS:3.1/AV:N/AC:L/PR:N/UI:N/S:U/C:H/I:N/A:N		
CVE-2020-0063	2020-03-10T21:15:13.120	2024-11-21T04:52:50.137	In SurfaceFlinger, it is possible to override UI confirmation screen protected by the TEE. This could lead to local escalation of privilege with no additional execution privileges needed. User interaction is needed for exploitation.Product: AndroidVersions: Android kernelAndroid ID: A-143128911	7.3	HIGH	CVSS:3.1/AV:L/AC:L/PR:L/UI:R/S:U/C:H/I:H/A:H		
CVE-2020-0066	2020-03-10T21:15:13.217	2024-11-21T04:52:50.453	In the netlink driver, there is a possible out of bounds write due to a race condition. This could lead to local escalation of privilege with System execution privileges needed. User interaction is not needed for exploitation.Product: AndroidVersions: Android kernelAndroid ID: A-65025077	6.4	MEDIUM	CVSS:3.1/AV:L/AC:H/PR:H/UI:N/S:U/C:H/I:H/A:H		
CVE-2020-0084	2020-03-10T21:15:13.277	2024-11-21T04:52:52.620	In several functions of NotificationManagerService.java, there are missing permission checks. This could lead to local escalation of privilege by creating fake system notifications with no additional execution privileges needed. User interaction is not needed for exploitation.Product: AndroidVersions: Android-10Android ID: A-143339775	7.8	HIGH	CVSS:3.1/AV:L/AC:L/PR:L/UI:N/S:U/C:H/I:H/A:H		
CVE-2020-0085	2020-03-10T21:15:13.357	2024-11-21T04:52:52.740	In setBluetoothTethering of PanService.java, there is a possible permission bypass due to a missing permission check. This could lead to local escalation of privilege to activate tethering with no additional execution privileges needed. User interaction is not needed for exploitation.Product: AndroidVersions: Android-10Android ID: A-134487438	7.8	HIGH	CVSS:3.1/AV:L/AC:L/PR:L/UI:N/S:U/C:H/I:H/A:H		
CVE-2020-0087	2020-03-10T21:15:13.433	2024-11-21T04:52:52.980	In getProcessPss of ActivityManagerService.java, there is a possible side channel information disclosure. This could lead to local information disclosure with no additional execution privileges needed. User interaction is needed for exploitation.Product: AndroidVersions: Android-10Android ID: A-127989044	5.5	MEDIUM	CVSS:3.1/AV:L/AC:L/PR:N/UI:R/S:U/C:H/I:N/A:N		
CVE-2020-10372	2020-03-10T21:15:13.527	2024-11-21T04:55:10.310	Ramp AltitudeCDN Altimeter before 2.4.0 allows authenticated Stored XSS via the vdms/ipmapping.jsp location field to the dms/rest/services/datastore/createOrEditValueForKey URI.	5.4	MEDIUM	CVSS:3.1/AV:N/AC:L/PR:L/UI:R/S:C/C:L/I:L/A:N		
CVE-2020-6178	2020-03-10T21:15:13.637	2024-11-21T05:35:15.053	SAP Enable Now, before version 1911, sends the Session ID cookie value in URL. This might be stolen from the browser history or log files, leading to Information Disclosure.	5.4	MEDIUM	CVSS:3.1/AV:N/AC:L/PR:L/UI:N/S:U/C:L/I:L/A:N		
CVE-2020-6196	2020-03-10T21:15:13.717	2024-11-21T05:35:16.707	SAP BusinessObjects Mobile (MobileBIService), version 4.2, allows an attacker to generate multiple requests, using which he can block all the threads resulting in a Denial of Service.	7.5	HIGH	CVSS:3.1/AV:N/AC:L/PR:N/UI:N/S:U/C:N/I:N/A:H		
CVE-2020-6197	2020-03-10T21:15:13.840	2024-11-21T05:35:16.827	SAP Enable Now, before version 1908, does not invalidate session tokens in a timely manner. The Insufficient Session Expiration may allow attackers with local access, for instance, to still download the portables.	3.3	LOW	CVSS:3.1/AV:L/AC:L/PR:L/UI:N/S:U/C:L/I:N/A:N		
CVE-2020-6198	2020-03-10T21:15:13.933	2024-11-21T05:35:16.937	SAP Solution Manager (Diagnostics Agent), version 720, allows unencrypted connections from unauthenticated sources. This allows an attacker to control all remote functions on the Agent due to Missing Authentication Check.	9.8	CRITICAL	CVSS:3.1/AV:N/AC:L/PR:N/UI:N/S:U/C:H/I:H/A:H		
CVE-2020-6199	2020-03-10T21:15:14.043	2024-11-21T05:35:17.053	The view FIMENAV_COMPCERT in SAP ERP (MENA Certificate Management), EAPPGLO version 607, SAP_FIN versions- 618, 730 and SAP S/4HANA (MENA Certificate Management), S4CORE versions- 100, 101, 102, 103, 104; does not have any authorization check to it due to which an attacker without an authorization group can maintain any company certificate, leading to Missing Authorization Check.	5.4	MEDIUM	CVSS:3.1/AV:N/AC:L/PR:L/UI:N/S:U/C:L/I:L/A:N		
CVE-2020-6200	2020-03-10T21:15:14.107	2024-11-21T05:35:17.177	The SAP Commerce (SmartEdit Extension), versions- 6.6, 6.7, 1808, 1811, is vulnerable to client-side angularjs template injection, a variant of Cross-Site-Scripting (XSS) that exploits the templating facilities of the angular framework.	5.4	MEDIUM	CVSS:3.1/AV:N/AC:L/PR:L/UI:R/S:C/C:L/I:L/A:N		
CVE-2020-6201	2020-03-10T21:15:14.217	2024-11-21T05:35:17.287	The SAP Commerce (Testweb Extension), versions- 6.6, 6.7, 1808, 1811, 1905, does not sufficiently encode user-controlled inputs, due to which certain GET URL parameters are reflected in the HTTP responses without escaping/sanitization, leading to Reflected Cross Site Scripting.	6.1	MEDIUM	CVSS:3.1/AV:N/AC:L/PR:N/UI:R/S:C/C:L/I:L/A:N		
CVE-2020-6202	2020-03-10T21:15:14.327	2024-11-21T05:35:17.407	SAP NetWeaver Application Server Java (User Management Engine), versions- 7.10, 7.11, 7.20, 7.30, 7.31, 7.40, 7.50; does not sufficiently validate the LDAP data source configuration XML document accepted from an untrusted source, leading to Missing XML Validation.	7.2	HIGH	CVSS:3.1/AV:N/AC:L/PR:H/UI:N/S:U/C:H/I:H/A:H		
CVE-2020-6203	2020-03-10T21:15:14.417	2024-11-21T05:35:17.523	SAP NetWeaver UDDI Server (Services Registry), versions- 7.10, 7.11, 7.20, 7.30, 7.31, 7.40, 7.50; allows an attacker to exploit insufficient validation of path information provided by users, thus characters representing 'traverse to parent directory' are passed through to the file APIs, leading to Path Traversal.	9.1	CRITICAL	CVSS:3.1/AV:N/AC:L/PR:N/UI:N/S:U/C:H/I:H/A:N		
