CVE ID	Published Date	Last Modified Date	Description	Base Score	Base Severity	Vector String	Vendor	Product
CVE-2020-7176	2020-10-19T18:15:17.087	2024-11-21T05:36:46.270	A viewtaskresultdetailfact expression language injection remote code execution vulnerability was discovered in HPE Intelligent Management Center (iMC) version(s): Prior to iMC PLAT 7.3 (E0705P07).	8.8	HIGH	CVSS:3.1/AV:N/AC:L/PR:L/UI:N/S:U/C:H/I:H/A:H		
CVE-2020-7177	2020-10-19T18:15:17.133	2024-11-21T05:36:46.400	A wmiconfigcontent expression language injection remote code execution vulnerability was discovered in HPE Intelligent Management Center (iMC) version(s): Prior to iMC PLAT 7.3 (E0705P07).	8.8	HIGH	CVSS:3.1/AV:N/AC:L/PR:L/UI:N/S:U/C:H/I:H/A:H		
CVE-2020-7178	2020-10-19T18:15:17.197	2024-11-21T05:36:46.503	A mediaforaction expression language injection remote code execution vulnerability was discovered in HPE Intelligent Management Center (iMC) version(s): Prior to iMC PLAT 7.3 (E0705P07).	8.8	HIGH	CVSS:3.1/AV:N/AC:L/PR:L/UI:N/S:U/C:H/I:H/A:H		
CVE-2020-7179	2020-10-19T18:15:17.243	2024-11-21T05:36:46.613	A thirdpartyperfselecttask expression language injection remote code execution vulnerability was discovered in HPE Intelligent Management Center (iMC) version(s): Prior to iMC PLAT 7.3 (E0705P07).	8.8	HIGH	CVSS:3.1/AV:N/AC:L/PR:L/UI:N/S:U/C:H/I:H/A:H		
CVE-2020-7180	2020-10-19T18:15:17.320	2024-11-21T05:36:46.720	A ictexpertdownload expression language injection remote code execution vulnerability was discovered in HPE Intelligent Management Center (iMC) version(s): Prior to iMC PLAT 7.3 (E0705P07).	8.8	HIGH	CVSS:3.1/AV:N/AC:L/PR:L/UI:N/S:U/C:H/I:H/A:H		
CVE-2020-7181	2020-10-19T18:15:17.367	2024-11-21T05:36:46.830	A smsrulesdownload expression language injection remote code execution vulnerability was discovered in HPE Intelligent Management Center (iMC) version(s): Prior to iMC PLAT 7.3 (E0705P07).	8.8	HIGH	CVSS:3.1/AV:N/AC:L/PR:L/UI:N/S:U/C:H/I:H/A:H		
CVE-2020-7182	2020-10-19T18:15:17.430	2024-11-21T05:36:46.933	A sshconfig expression language injection remote code execution vulnerability was discovered in HPE Intelligent Management Center (iMC) version(s): Prior to iMC PLAT 7.3 (E0705P07).	8.8	HIGH	CVSS:3.1/AV:N/AC:L/PR:L/UI:N/S:U/C:H/I:H/A:H		
CVE-2020-7183	2020-10-19T18:15:17.493	2024-11-21T05:36:47.047	A forwardredirect expression language injection remote code execution vulnerability was discovered in HPE Intelligent Management Center (iMC) version(s): Prior to iMC PLAT 7.3 (E0705P07).	8.8	HIGH	CVSS:3.1/AV:N/AC:L/PR:L/UI:N/S:U/C:H/I:H/A:H		
CVE-2020-7184	2020-10-19T18:15:17.557	2024-11-21T05:36:47.187	A viewbatchtaskresultdetailfact expression language injection remote code execution vulnerability was discovered in HPE Intelligent Management Center (iMC) version(s): Prior to iMC PLAT 7.3 (E0705P07).	8.8	HIGH	CVSS:3.1/AV:N/AC:L/PR:L/UI:N/S:U/C:H/I:H/A:H		
CVE-2020-7185	2020-10-19T18:15:17.603	2024-11-21T05:36:47.300	A tvxlanlegend expression language injection remote code execution vulnerability was discovered in HPE Intelligent Management Center (iMC) version(s): Prior to iMC PLAT 7.3 (E0705P07).	8.8	HIGH	CVSS:3.1/AV:N/AC:L/PR:L/UI:N/S:U/C:H/I:H/A:H		
CVE-2020-7186	2020-10-19T18:15:17.663	2024-11-21T05:36:47.417	A powershellconfigcontent expression language injection remote code execution vulnerability was discovered in HPE Intelligent Management Center (iMC) version(s): Prior to iMC PLAT 7.3 (E0705P07).	8.8	HIGH	CVSS:3.1/AV:N/AC:L/PR:L/UI:N/S:U/C:H/I:H/A:H		
CVE-2020-7187	2020-10-19T18:15:17.710	2024-11-21T05:36:47.537	A reportpage index expression language injection remote code execution vulnerability was discovered in HPE Intelligent Management Center (iMC) version(s): Prior to iMC PLAT 7.3 (E0705P07).	8.8	HIGH	CVSS:3.1/AV:N/AC:L/PR:L/UI:N/S:U/C:H/I:H/A:H		
CVE-2020-7188	2020-10-19T18:15:17.773	2024-11-21T05:36:47.653	A userselectpagingcontent expression language injection remote code execution vulnerability was discovered in HPE Intelligent Management Center (iMC) version(s): Prior to iMC PLAT 7.3 (E0705P07).	8.8	HIGH	CVSS:3.1/AV:N/AC:L/PR:L/UI:N/S:U/C:H/I:H/A:H		
CVE-2020-7189	2020-10-19T18:15:17.820	2024-11-21T05:36:47.770	A faultflasheventselectfact expression language injectionremote code execution vulnerability was discovered in HPE Intelligent Management Center (iMC) version(s): Prior to iMC PLAT 7.3 (E0705P07).	8.8	HIGH	CVSS:3.1/AV:N/AC:L/PR:L/UI:N/S:U/C:H/I:H/A:H		
CVE-2020-7190	2020-10-19T18:15:17.867	2024-11-21T05:36:47.887	A deviceselect expression language injection remote code execution vulnerability was discovered in HPE Intelligent Management Center (iMC) version(s): Prior to iMC PLAT 7.3 (E0705P07).	8.8	HIGH	CVSS:3.1/AV:N/AC:L/PR:L/UI:N/S:U/C:H/I:H/A:H		
CVE-2020-7191	2020-10-19T18:15:17.930	2024-11-21T05:36:48.003	A devsoftsel expression language injection remote code execution vulnerability was discovered in HPE Intelligent Management Center (iMC) version(s): Prior to iMC PLAT 7.3 (E0705P07).	8.8	HIGH	CVSS:3.1/AV:N/AC:L/PR:L/UI:N/S:U/C:H/I:H/A:H		
CVE-2020-7192	2020-10-19T18:15:17.993	2024-11-21T05:36:48.123	A devicethresholdconfig expression language injection remote code execution vulnerability was discovered in HPE Intelligent Management Center (iMC) version(s): Prior to iMC PLAT 7.3 (E0705P07).	8.8	HIGH	CVSS:3.1/AV:N/AC:L/PR:L/UI:N/S:U/C:H/I:H/A:H		
CVE-2020-7193	2020-10-19T18:15:18.057	2024-11-21T05:36:48.240	A ictexpertcsvdownload expression language injection remote code execution vulnerability was discovered in HPE Intelligent Management Center (iMC) version(s): Prior to iMC PLAT 7.3 (E0705P07).	8.8	HIGH	CVSS:3.1/AV:N/AC:L/PR:L/UI:N/S:U/C:H/I:H/A:H		
CVE-2020-7194	2020-10-19T18:15:18.103	2024-11-21T05:36:48.363	A perfaddormoddevicemonitor expression language injection remote code execution vulnerability was discovered in HPE Intelligent Management Center (iMC) version(s): Prior to iMC PLAT 7.3 (E0705P07).	8.8	HIGH	CVSS:3.1/AV:N/AC:L/PR:L/UI:N/S:U/C:H/I:H/A:H		
CVE-2020-7195	2020-10-19T18:15:18.163	2024-11-21T05:36:48.483	A iccselectrules expression language injection remote code execution vulnerability was discovered in HPE Intelligent Management Center (iMC) version(s): Prior to iMC PLAT 7.3 (E0705P07).	8.8	HIGH	CVSS:3.1/AV:N/AC:L/PR:L/UI:N/S:U/C:H/I:H/A:H		
CVE-2020-11496	2020-10-19T19:15:14.360	2024-11-21T04:58:00.907	Sprecher SPRECON-E firmware prior to 8.64b might allow local attackers with access to engineering data to insert arbitrary code. This firmware lacks the validation of the input values on the device side, which is provided by the engineering software during parameterization. Attackers with access to local configuration files can therefore insert malicious commands that are executed after compiling them to valid parameter files (“PDLs”), transferring them to the device, and restarting the device.	6.7	MEDIUM	CVSS:3.1/AV:L/AC:L/PR:H/UI:N/S:U/C:H/I:H/A:H		
CVE-2020-15822	2020-10-19T19:15:14.423	2024-11-21T05:06:14.993	In JetBrains YouTrack before 2020.2.10514, SSRF is possible because URL filtering can be escaped.	7.3	HIGH	CVSS:3.1/AV:N/AC:L/PR:N/UI:N/S:U/C:L/I:L/A:L		
CVE-2020-24375	2020-10-19T19:15:14.753	2024-11-21T05:14:41.883	A DNS rebinding vulnerability in the UPnP MediaServer implementation in Freebox Server before 4.2.3.	6.5	MEDIUM	CVSS:3.1/AV:N/AC:L/PR:N/UI:R/S:U/C:H/I:N/A:N		
CVE-2019-13633	2020-10-19T20:15:12.587	2024-11-21T04:25:24.400	Blinger.io v.1.0.2519 is vulnerable to Blind/Persistent XSS. An attacker can send arbitrary JavaScript code via a built-in communication channel, such as Telegram, WhatsApp, Viber, Skype, Facebook, Vkontakte, or Odnoklassniki. This is mishandled within the administration panel for conversations/all, conversations/inbox, conversations/unassigned, and conversations/closed.	6.1	MEDIUM	CVSS:3.1/AV:N/AC:L/PR:N/UI:R/S:C/C:L/I:L/A:N		
CVE-2020-15262	2020-10-19T20:15:12.667	2024-11-21T05:05:13.333	In webpack-subresource-integrity before version 1.5.1, all dynamically loaded chunks receive an invalid integrity hash that is ignored by the browser, and therefore the browser cannot validate their integrity. This removes the additional level of protection offered by SRI for such chunks. Top-level chunks are unaffected. This issue is patched in version 1.5.1.	3.7	LOW	CVSS:3.1/AV:N/AC:H/PR:N/UI:N/S:U/C:L/I:N/A:N		
CVE-2020-24387	2020-10-19T20:15:12.947	2024-11-21T05:14:43.313	An issue was discovered in the yh_create_session() function of yubihsm-shell through 2.0.2. The function does not explicitly check the returned session id from the device. An invalid session id would lead to out-of-bounds read and write operations in the session array. This could be used by an attacker to cause a denial of service attack.	7.5	HIGH	CVSS:3.1/AV:N/AC:L/PR:N/UI:N/S:U/C:N/I:N/A:H		
CVE-2020-24388	2020-10-19T20:15:12.993	2024-11-21T05:14:43.467	An issue was discovered in the _send_secure_msg() function of yubihsm-shell through 2.0.2. The function does not validate the embedded length field of a message received from the device. This could lead to an oversized memcpy() call that will crash the running process. This could be used by an attacker to cause a denial of service.	7.5	HIGH	CVSS:3.1/AV:N/AC:L/PR:N/UI:N/S:U/C:N/I:N/A:H		
CVE-2020-9092	2020-10-19T20:15:13.087	2024-11-21T05:40:00.350	HUAWEI Mate 20 versions earlier than 10.1.0.163(C00E160R3P8) have a JavaScript injection vulnerability. A module does not verify a specific input. This could allow attackers to bypass filter mechanism to launch JavaScript injection. This could compromise normal service of the affected module.	4.6	MEDIUM	CVSS:3.1/AV:P/AC:L/PR:N/UI:N/S:U/C:N/I:H/A:N		
CVE-2020-9111	2020-10-19T20:15:13.150	2024-11-21T05:40:03.720	E6878-370 versions 10.0.3.1(H557SP27C233),10.0.3.1(H563SP21C233) and E6878-870 versions 10.0.3.1(H557SP27C233),10.0.3.1(H563SP11C233) have a denial of service vulnerability. The system does not properly check some events, an attacker could launch the events continually, successful exploit could cause reboot of the process.	4.5	MEDIUM	CVSS:3.1/AV:A/AC:L/PR:H/UI:N/S:U/C:N/I:N/A:H		
CVE-2020-9112	2020-10-19T20:15:13.213	2024-11-21T05:40:03.870	Taurus-AN00B versions earlier than 10.1.0.156(C00E155R7P2) have a privilege elevation vulnerability. Due to lack of privilege restrictions on some of the business functions of the device. An attacker could exploit this vulnerability to access the protecting information, resulting in the elevation of the privilege.	7.8	HIGH	CVSS:3.1/AV:L/AC:L/PR:L/UI:N/S:U/C:H/I:H/A:H		
CVE-2020-9113	2020-10-19T20:15:13.260	2024-11-21T05:40:04.010	HUAWEI Mate 20 versions earlier than 10.0.0.188(C00E74R3P8) have a buffer overflow vulnerability in the Bluetooth module. Due to insufficient input validation, an unauthenticated attacker may craft Bluetooth messages after successful paring, causing buffer overflow. Successful exploit may cause code execution.	8.0	HIGH	CVSS:3.1/AV:A/AC:L/PR:N/UI:R/S:U/C:H/I:H/A:H		
CVE-2020-9263	2020-10-19T20:15:13.323	2024-11-21T05:40:17.970	HUAWEI Mate 30 versions earlier than 10.1.0.150(C00E136R5P3) and HUAWEI P30 version earlier than 10.1.0.160(C00E160R2P11) have a use after free vulnerability. There is a condition exists that the system would reference memory after it has been freed, the attacker should trick the user into running a crafted application with common privilege, successful exploit could cause code execution.	7.8	HIGH	CVSS:3.1/AV:L/AC:L/PR:N/UI:R/S:U/C:H/I:H/A:H		
CVE-2020-10746	2020-10-19T21:15:12.437	2024-11-21T04:55:59.030	A flaw was found in Infinispan (org.infinispan:infinispan-server-runtime) version 10, where it permits local access to controls via both REST and HotRod APIs. This flaw allows a user authenticated to the local machine to perform all operations on the caches, including the creation, update, deletion, and shutdown of the entire server.	6.1	MEDIUM	CVSS:3.1/AV:L/AC:L/PR:L/UI:N/S:U/C:N/I:L/A:H		
CVE-2020-13937	2020-10-19T21:15:12.623	2024-11-21T05:02:11.323	Apache Kylin 2.0.0, 2.1.0, 2.2.0, 2.3.0, 2.3.1, 2.3.2, 2.4.0, 2.4.1, 2.5.0, 2.5.1, 2.5.2, 2.6.0, 2.6.1, 2.6.2, 2.6.3, 2.6.4, 2.6.5, 2.6.6, 3.0.0-alpha, 3.0.0-alpha2, 3.0.0-beta, 3.0.0, 3.0.1, 3.0.2, 3.1.0, 4.0.0-alpha has one restful api which exposed Kylin's configuration information without any authentication, so it is dangerous because some confidential information entries will be disclosed to everyone.	5.3	MEDIUM	CVSS:3.1/AV:N/AC:L/PR:N/UI:N/S:U/C:L/I:N/A:N		
CVE-2020-15245	2020-10-19T21:15:12.810	2024-11-21T05:05:10.723	In Sylius before versions 1.6.9, 1.7.9 and 1.8.3, the user may register in a shop by email mail@example.com, verify it, change it to the mail another@domain.com and stay verified and enabled. This may lead to having accounts addressed to totally different emails, that were verified. Note, that this way one is not able to take over any existing account (guest or normal one). The issue has been patched in Sylius 1.6.9, 1.7.9 and 1.8.3. As a workaround, you may resolve this issue on your own by creating a custom event listener, which will listen to the sylius.customer.pre_update event. You can determine that email has been changed if customer email and user username are different. They are synchronized later on. Pay attention, to email changing behavior for administrators. You may need to skip this logic for them. In order to achieve this, you should either check master request path info, if it does not contain /admin prefix or adjust event triggered during customer update in the shop. You can find more information on how to customize the event here.	4.3	MEDIUM	CVSS:3.1/AV:N/AC:L/PR:L/UI:N/S:U/C:N/I:L/A:N		
CVE-2020-15263	2020-10-19T21:15:12.983	2024-11-21T05:05:13.467	In platform before version 9.4.4, inline attributes are not properly escaped. If the data that came from users was not escaped, then an XSS vulnerability is possible. The issue was introduced in 9.0.0 and fixed in 9.4.4.	8.0	HIGH	CVSS:3.1/AV:N/AC:H/PR:N/UI:R/S:C/C:H/I:H/A:N		
CVE-2020-6084	2020-10-19T21:15:13.077	2024-11-21T05:35:03.873	An exploitable denial of service vulnerability exists in the ENIP Request Path Logical Segment functionality of Allen-Bradley Flex IO 1794-AENT/B 4.003. A specially crafted network request can cause a loss of communications with the device resulting in denial-of-service. An attacker can send a malicious packet to trigger this vulnerability by sending an Electronic Key Segment with less bytes than required by the Key Format Table.	7.5	HIGH	CVSS:3.1/AV:N/AC:L/PR:N/UI:N/S:U/C:N/I:N/A:H		
CVE-2020-6085	2020-10-19T21:15:13.157	2024-11-21T05:35:04.000	An exploitable denial of service vulnerability exists in the ENIP Request Path Logical Segment functionality of Allen-Bradley Flex IO 1794-AENT/B 4.003. A specially crafted network request can cause a loss of communications with the device resulting in denial-of-service. An attacker can send a malicious packet to trigger this vulnerability by sending an Electronic Key Segment with less than 0x18 bytes following the Key Format field.	7.5	HIGH	CVSS:3.1/AV:N/AC:L/PR:N/UI:N/S:U/C:N/I:N/A:H		
CVE-2020-15256	2020-10-19T22:15:13.017	2024-11-21T05:05:12.483	A prototype pollution vulnerability has been found in `object-path` <= 0.11.4 affecting the `set()` method. The vulnerability is limited to the `includeInheritedProps` mode (if version >= 0.11.0 is used), which has to be explicitly enabled by creating a new instance of `object-path` and setting the option `includeInheritedProps: true`, or by using the default `withInheritedProps` instance. The default operating mode is not affected by the vulnerability if version >= 0.11.0 is used. Any usage of `set()` in versions < 0.11.0 is vulnerable. The issue is fixed in object-path version 0.11.5 As a workaround, don't use the `includeInheritedProps: true` options or the `withInheritedProps` instance if using a version >= 0.11.0.	7.7	HIGH	CVSS:3.1/AV:N/AC:H/PR:N/UI:N/S:U/C:L/I:H/A:H		
CVE-2020-15261	2020-10-19T22:15:13.093	2024-11-21T05:05:13.180	On Windows the Veyon Service before version 4.4.2 contains an unquoted service path vulnerability, allowing locally authenticated users with administrative privileges to run malicious executables with LocalSystem privileges. Since Veyon users (both students and teachers) usually don't have administrative privileges, this vulnerability is only dangerous in anyway unsafe setups. The problem has been fixed in version 4.4.2. As a workaround, the exploitation of the vulnerability can be prevented by revoking administrative privileges from all potentially untrustworthy users.	8.0	HIGH	CVSS:3.1/AV:N/AC:H/PR:H/UI:N/S:C/C:H/I:H/A:H		
CVE-2020-5640	2020-10-20T08:15:11.977	2024-11-21T05:34:24.420	Local file inclusion vulnerability in OneThird CMS v1.96c and earlier allows a remote unauthenticated attacker to execute arbitrary code or obtain sensitive information via unspecified vectors.	9.8	CRITICAL	CVSS:3.1/AV:N/AC:L/PR:N/UI:N/S:U/C:H/I:H/A:H		
CVE-2020-7747	2020-10-20T11:15:12.487	2024-11-21T05:37:43.607	This affects all versions of package lightning-server. It is possible to inject malicious JavaScript code as part of a session controller.	6.3	MEDIUM	CVSS:3.1/AV:N/AC:L/PR:L/UI:R/S:U/C:H/I:L/A:N		
CVE-2020-7748	2020-10-20T11:15:12.583	2024-11-21T05:37:43.720	This affects the package @tsed/core before 5.65.7. This vulnerability relates to the deepExtend function which is used as part of the utils directory. Depending on if user input is provided, an attacker can overwrite and pollute the object prototype of a program.	5.6	MEDIUM	CVSS:3.1/AV:N/AC:H/PR:N/UI:N/S:U/C:L/I:L/A:L		
CVE-2020-7749	2020-10-20T11:15:12.660	2024-11-21T05:37:43.837	This affects all versions of package osm-static-maps. User input given to the package is passed directly to a template without escaping ({{{ ... }}}). As such, it is possible for an attacker to inject arbitrary HTML/JS code and depending on the context. It will be outputted as an HTML on the page which gives opportunity for XSS or rendered on the server (puppeteer) which also gives opportunity for SSRF and Local File Read.	7.6	HIGH	CVSS:3.1/AV:N/AC:L/PR:L/UI:N/S:U/C:H/I:L/A:L		
CVE-2020-6308	2020-10-20T14:15:14.133	2024-11-21T05:35:28.800	SAP BusinessObjects Business Intelligence Platform (Web Services) versions - 410, 420, 430, allows an unauthenticated attacker to inject arbitrary values as CMS parameters to perform lookups on the internal network which is otherwise not accessible externally. On successful exploitation, attacker can scan internal network to determine internal infrastructure and gather information for further attacks like remote file inclusion, retrieve server files, bypass firewall and force the vulnerable server to perform malicious requests, resulting in a Server-Side Request Forgery vulnerability.	5.3	MEDIUM	CVSS:3.1/AV:N/AC:L/PR:N/UI:N/S:U/C:L/I:N/A:N		
CVE-2020-6315	2020-10-20T14:15:14.197	2024-11-21T05:35:29.640	SAP 3D Visual Enterprise Viewer, version 9, allows an attacker to send certain manipulated file to the victim, which can lead to leakage of sensitive information when the victim loads the malicious file into the VE viewer, leading to Information Disclosure.	5.5	MEDIUM	CVSS:3.1/AV:L/AC:L/PR:N/UI:R/S:U/C:H/I:N/A:N		
CVE-2020-6362	2020-10-20T14:15:14.413	2024-11-21T05:35:34.860	SAP Banking Services version 500, use an incorrect authorization object in some of its reports. Although the affected reports are protected with otherauthorization objects, exploitation of the vulnerability could lead to privilege escalation and violation in segregation of duties, which in turn could lead to Service interruptions and system unavailability for the victim and users of the component.	6.5	MEDIUM	CVSS:3.1/AV:N/AC:L/PR:L/UI:N/S:U/C:N/I:N/A:H		
CVE-2020-6366	2020-10-20T14:15:14.477	2024-11-21T05:35:35.280	SAP NetWeaver (Compare Systems) versions - 7.20, 7.30, 7.40, 7.50, does not sufficiently validate uploaded XML documents. An attacker with administrative privileges can retrieve arbitrary files including files on OS level from the server and/or can execute a denial-of-service.	6.5	MEDIUM	CVSS:3.1/AV:N/AC:L/PR:H/UI:N/S:U/C:H/I:N/A:H		
CVE-2020-6367	2020-10-20T14:15:14.697	2024-11-21T05:35:35.380	There is a reflected cross site scripting vulnerability in SAP NetWeaver Composite Application Framework, versions - 7.20, 7.30, 7.31, 7.40, 7.50. An unauthenticated attacker can trick an unsuspecting authenticated user to click on a malicious link. The end users browser has no way to know that the script should not be trusted, and will execute the script, resulting in sensitive information being disclosed or modified.	6.1	MEDIUM	CVSS:3.1/AV:N/AC:L/PR:N/UI:R/S:C/C:L/I:L/A:N		
CVE-2020-6369	2020-10-20T14:15:14.897	2024-11-21T05:35:35.603	SAP Solution Manager and SAP Focused Run (update provided in WILY_INTRO_ENTERPRISE 9.7, 10.1, 10.5, 10.7), allows an unauthenticated attackers to bypass the authentication if the default passwords for Admin and Guest have not been changed by the administrator.This may impact the confidentiality of the service.	5.9	MEDIUM	CVSS:3.1/AV:N/AC:H/PR:N/UI:N/S:U/C:H/I:N/A:N		
CVE-2020-6370	2020-10-20T14:15:14.960	2024-11-21T05:35:35.710	SAP NetWeaver Design Time Repository (DTR), versions - 7.11, 7.30, 7.31, 7.40, 7.50, does not sufficiently encode user-controlled inputs, resulting in Cross-Site Scripting (XSS) vulnerability.	4.8	MEDIUM	CVSS:3.1/AV:N/AC:L/PR:H/UI:R/S:C/C:L/I:L/A:N		
CVE-2019-4680	2020-10-20T15:15:12.637	2024-11-21T04:43:58.677	IBM Sterling B2B Integrator Standard Edition 5.2.0.0 through 6.0.2.2 is vulnerable to SQL injection. A remote attacker could send specially-crafted SQL statements, which could allow the attacker to view, add, modify or delete information in the back-end database. IBM X-Force ID: 171733.	8.8	HIGH	CVSS:3.1/AV:N/AC:L/PR:L/UI:N/S:U/C:H/I:H/A:H		
CVE-2020-16246	2020-10-20T15:15:12.887	2024-11-21T05:07:01.097	The affected Reason S20 Ethernet Switch is vulnerable to cross-site scripting (XSS), which may allow attackers to trick users into following a link or navigating to a page that posts a malicious JavaScript statement to the vulnerable site, causing the malicious JavaScript to be rendered by the site and executed by the victim client.	6.1	MEDIUM	CVSS:3.1/AV:N/AC:L/PR:N/UI:R/S:C/C:L/I:L/A:N		
CVE-2020-4491	2020-10-20T15:15:12.997	2024-11-21T05:32:48.283	IBM Spectrum Scale V4.2.0.0 through V4.2.3.22 and V5.0.0.0 through V5.0.5 could allow a local attacker to cause a denial of service by sending a large number of RPC requests to the mmfsd daemon which would cause the service to crash. IBM X-Force ID: 181991.	5.5	MEDIUM	CVSS:3.1/AV:L/AC:L/PR:L/UI:N/S:U/C:N/I:N/A:H		
CVE-2020-4564	2020-10-20T15:15:13.060	2024-11-21T05:32:54.657	IBM Sterling B2B Integrator Standard Edition 5.2.0.0 through 6.0.3.1 and IBM Sterling File Gateway 2.2.0.0 through 6.0.3.1 are vulnerable to cross-site scripting. This vulnerability allows users to embed arbitrary JavaScript code in the Web UI thus altering the intended functionality potentially leading to credentials disclosure within a trusted session. IBM X-Force ID: 183933.	5.4	MEDIUM	CVSS:3.1/AV:N/AC:L/PR:L/UI:R/S:C/C:L/I:L/A:N		
CVE-2020-4748	2020-10-20T15:15:13.137	2024-11-21T05:33:12.020	IBM Spectrum Scale 5.0.0 through 5.0.5.2 is vulnerable to cross-site scripting. This vulnerability allows users to embed arbitrary JavaScript code in the Web UI thus altering the intended functionality potentially leading to credentials disclosure within a trusted session. IBM X-Force ID: 188517.	6.1	MEDIUM	CVSS:3.1/AV:N/AC:L/PR:N/UI:R/S:C/C:L/I:L/A:N		
CVE-2020-4749	2020-10-20T15:15:13.217	2024-11-21T05:33:12.130	IBM Spectrum Scale 5.0.0 through 5.0.5.2 does not set the secure attribute on authorization tokens or session cookies. Attackers may be able to get the cookie values by sending a http:// link to a user or by planting this link in a site the user goes to. The cookie will be sent to the insecure link and the attacker can then obtain the cookie value by snooping the traffic. IBM X-Force ID: 188518.	4.3	MEDIUM	CVSS:3.1/AV:N/AC:L/PR:N/UI:R/S:U/C:L/I:N/A:N		
CVE-2020-4755	2020-10-20T15:15:13.293	2024-11-21T05:33:12.230	IBM Spectrum Scale 5.0.0 through 5.0.5.2 is vulnerable to cross-site scripting. This vulnerability allows users to embed arbitrary JavaScript code in the Web UI thus altering the intended functionality potentially leading to credentials disclosure within a trusted session. IBM X-Force ID: 188595.	5.4	MEDIUM	CVSS:3.1/AV:N/AC:L/PR:L/UI:R/S:C/C:L/I:L/A:N		
CVE-2020-4756	2020-10-20T15:15:13.357	2024-11-21T05:33:12.337	IBM Spectrum Scale V4.2.0.0 through V4.2.3.23 and V5.0.0.0 through V5.0.5.2 as well as IBM Elastic Storage System 6.0.0 through 6.0.1.0 could allow a local attacker to invoke a subset of ioctls on the device with invalid arguments that could crash the keneral and cause a denial of service. IBM X-Force ID: 188599.	5.5	MEDIUM	CVSS:3.1/AV:L/AC:L/PR:L/UI:N/S:U/C:N/I:N/A:H		
CVE-2020-3981	2020-10-20T17:15:12.670	2024-11-21T05:32:06.410	VMware ESXi (7.0 before ESXi_7.0.1-0.0.16850804, 6.7 before ESXi670-202008101-SG, 6.5 before ESXi650-202007101-SG), Workstation (15.x), Fusion (11.x before 11.5.6) contain an out-of-bounds read vulnerability due to a time-of-check time-of-use issue in ACPI device. A malicious actor with administrative access to a virtual machine may be able to exploit this issue to leak memory from the vmx process.	5.8	MEDIUM	CVSS:3.1/AV:N/AC:H/PR:H/UI:N/S:C/C:H/I:N/A:N		
