CVE ID	Published Date	Last Modified Date	Description	Base Score	Base Severity	Vector String	Vendor	Product
CVE-2021-38017	2021-12-23T01:15:08.353	2024-11-21T06:16:17.660	Insufficient policy enforcement in iframe sandbox in Google Chrome prior to 96.0.4664.45 allowed a remote attacker to bypass navigation restrictions via a crafted HTML page.	8.8	HIGH	CVSS:3.1/AV:N/AC:L/PR:N/UI:R/S:U/C:H/I:H/A:H		
CVE-2021-38018	2021-12-23T01:15:08.397	2024-11-21T06:16:18.427	Inappropriate implementation in navigation in Google Chrome prior to 96.0.4664.45 allowed a remote attacker to perform domain spoofing via a crafted HTML page.	6.5	MEDIUM	CVSS:3.1/AV:N/AC:L/PR:N/UI:R/S:U/C:N/I:H/A:N		
CVE-2021-38019	2021-12-23T01:15:08.440	2024-11-21T06:16:18.633	Insufficient policy enforcement in CORS in Google Chrome prior to 96.0.4664.45 allowed a remote attacker to leak cross-origin data via a crafted HTML page.	6.5	MEDIUM	CVSS:3.1/AV:N/AC:L/PR:N/UI:R/S:U/C:H/I:N/A:N		
CVE-2021-38020	2021-12-23T01:15:08.483	2024-11-21T06:16:18.843	Insufficient policy enforcement in contacts picker in Google Chrome on Android prior to 96.0.4664.45 allowed a remote attacker to spoof the contents of the Omnibox (URL bar) via a crafted HTML page.	4.3	MEDIUM	CVSS:3.1/AV:N/AC:L/PR:N/UI:R/S:U/C:N/I:L/A:N		
CVE-2021-38021	2021-12-23T01:15:08.527	2024-11-21T06:16:19.037	Inappropriate implementation in referrer in Google Chrome prior to 96.0.4664.45 allowed a remote attacker to bypass navigation restrictions via a crafted HTML page.	6.5	MEDIUM	CVSS:3.1/AV:N/AC:L/PR:N/UI:R/S:U/C:N/I:H/A:N		
CVE-2021-38022	2021-12-23T01:15:08.573	2024-11-21T06:16:19.240	Inappropriate implementation in WebAuthentication in Google Chrome prior to 96.0.4664.45 allowed a remote attacker to leak cross-origin data via a crafted HTML page.	6.5	MEDIUM	CVSS:3.1/AV:N/AC:L/PR:N/UI:R/S:U/C:H/I:N/A:N		
CVE-2021-4052	2021-12-23T01:15:08.617	2024-11-21T06:36:48.250	Use after free in web apps in Google Chrome prior to 96.0.4664.93 allowed an attacker who convinced a user to install a malicious extension to potentially exploit heap corruption via a crafted Chrome Extension.	8.8	HIGH	CVSS:3.1/AV:N/AC:L/PR:N/UI:R/S:U/C:H/I:H/A:H		
CVE-2021-4053	2021-12-23T01:15:08.663	2024-11-21T06:36:48.460	Use after free in UI in Google Chrome on Linux prior to 96.0.4664.93 allowed a remote attacker to potentially exploit heap corruption via a crafted HTML page.	8.8	HIGH	CVSS:3.1/AV:N/AC:L/PR:N/UI:R/S:U/C:H/I:H/A:H		
CVE-2021-4054	2021-12-23T01:15:08.707	2024-11-21T06:36:48.603	Incorrect security UI in autofill in Google Chrome prior to 96.0.4664.93 allowed a remote attacker to perform domain spoofing via a crafted HTML page.	6.5	MEDIUM	CVSS:3.1/AV:N/AC:L/PR:N/UI:R/S:U/C:N/I:H/A:N		
CVE-2021-4055	2021-12-23T01:15:08.747	2024-11-21T06:36:48.747	Heap buffer overflow in extensions in Google Chrome prior to 96.0.4664.93 allowed an attacker who convinced a user to install a malicious extension to potentially exploit heap corruption via a crafted Chrome Extension.	8.8	HIGH	CVSS:3.1/AV:N/AC:L/PR:N/UI:R/S:U/C:H/I:H/A:H		
CVE-2021-4056	2021-12-23T01:15:08.790	2024-11-21T06:36:48.887	Type confusion in loader in Google Chrome prior to 96.0.4664.93 allowed a remote attacker to potentially exploit heap corruption via a crafted HTML page.	8.8	HIGH	CVSS:3.1/AV:N/AC:L/PR:N/UI:R/S:U/C:H/I:H/A:H		
CVE-2021-4057	2021-12-23T01:15:08.830	2024-11-21T06:36:49.027	Use after free in file API in Google Chrome prior to 96.0.4664.93 allowed a remote attacker who had compromised the renderer process to potentially exploit heap corruption via a crafted HTML page.	8.8	HIGH	CVSS:3.1/AV:N/AC:L/PR:N/UI:R/S:U/C:H/I:H/A:H		
CVE-2021-4058	2021-12-23T01:15:08.873	2024-11-21T06:36:49.173	Heap buffer overflow in ANGLE in Google Chrome prior to 96.0.4664.93 allowed a remote attacker to potentially exploit heap corruption via a crafted HTML page.	8.8	HIGH	CVSS:3.1/AV:N/AC:L/PR:N/UI:R/S:U/C:H/I:H/A:H		
CVE-2021-4059	2021-12-23T01:15:08.917	2024-11-21T06:36:49.323	Insufficient data validation in loader in Google Chrome prior to 96.0.4664.93 allowed a remote attacker to leak cross-origin data via a crafted HTML page.	6.5	MEDIUM	CVSS:3.1/AV:N/AC:L/PR:N/UI:R/S:U/C:H/I:N/A:N		
CVE-2021-4061	2021-12-23T01:15:08.960	2024-11-21T06:36:49.470	Type confusion in V8 in Google Chrome prior to 96.0.4664.93 allowed a remote attacker to potentially exploit heap corruption via a crafted HTML page.	8.8	HIGH	CVSS:3.1/AV:N/AC:L/PR:N/UI:R/S:U/C:H/I:H/A:H		
CVE-2021-4062	2021-12-23T01:15:09.003	2024-11-21T06:36:49.617	Heap buffer overflow in BFCache in Google Chrome prior to 96.0.4664.93 allowed a remote attacker who had compromised the renderer process to potentially exploit heap corruption via a crafted HTML page.	8.8	HIGH	CVSS:3.1/AV:N/AC:L/PR:N/UI:R/S:U/C:H/I:H/A:H		
CVE-2021-4063	2021-12-23T01:15:09.047	2024-11-21T06:36:49.770	Use after free in developer tools in Google Chrome prior to 96.0.4664.93 allowed a remote attacker to potentially exploit heap corruption via a crafted HTML page.	8.8	HIGH	CVSS:3.1/AV:N/AC:L/PR:N/UI:R/S:U/C:H/I:H/A:H		
CVE-2021-4064	2021-12-23T01:15:09.087	2024-11-21T06:36:49.903	Use after free in screen capture in Google Chrome on ChromeOS prior to 96.0.4664.93 allowed a remote attacker to potentially exploit heap corruption via a crafted HTML page.	8.8	HIGH	CVSS:3.1/AV:N/AC:L/PR:N/UI:R/S:U/C:H/I:H/A:H		
CVE-2021-4065	2021-12-23T01:15:09.133	2024-11-21T06:36:50.040	Use after free in autofill in Google Chrome prior to 96.0.4664.93 allowed a remote attacker to potentially exploit heap corruption via a crafted HTML page.	8.8	HIGH	CVSS:3.1/AV:N/AC:L/PR:N/UI:R/S:U/C:H/I:H/A:H		
CVE-2021-4066	2021-12-23T01:15:09.187	2024-11-21T06:36:50.167	Integer underflow in ANGLE in Google Chrome prior to 96.0.4664.93 allowed a remote attacker to potentially exploit heap corruption via a crafted HTML page.	8.8	HIGH	CVSS:3.1/AV:N/AC:L/PR:N/UI:R/S:U/C:H/I:H/A:H		
CVE-2021-4067	2021-12-23T01:15:09.240	2024-11-21T06:36:50.300	Use after free in window manager in Google Chrome on ChromeOS prior to 96.0.4664.93 allowed a remote attacker to potentially exploit heap corruption via a crafted HTML page.	8.8	HIGH	CVSS:3.1/AV:N/AC:L/PR:N/UI:R/S:U/C:H/I:H/A:H		
CVE-2021-4068	2021-12-23T01:15:09.290	2024-11-21T06:36:50.433	Insufficient data validation in new tab page in Google Chrome prior to 96.0.4664.93 allowed a remote attacker to leak cross-origin data via a crafted HTML page.	6.5	MEDIUM	CVSS:3.1/AV:N/AC:L/PR:N/UI:R/S:U/C:H/I:N/A:N		
CVE-2021-4078	2021-12-23T01:15:09.337	2024-11-21T06:36:51.560	Type confusion in V8 in Google Chrome prior to 96.0.4664.93 allowed a remote attacker to potentially exploit heap corruption via a crafted HTML page.	8.8	HIGH	CVSS:3.1/AV:N/AC:L/PR:N/UI:R/S:U/C:H/I:H/A:H		
CVE-2021-4079	2021-12-23T01:15:09.377	2024-11-21T06:36:51.700	Out of bounds write in WebRTC in Google Chrome prior to 96.0.4664.93 allowed a remote attacker to potentially exploit heap corruption via crafted WebRTC packets.	8.8	HIGH	CVSS:3.1/AV:N/AC:L/PR:N/UI:R/S:U/C:H/I:H/A:H		
CVE-2021-20049	2021-12-23T02:15:06.583	2024-11-21T05:45:51.337	A vulnerability in SonicWall SMA100 password change API allows a remote unauthenticated attacker to perform SMA100 username enumeration based on the server responses. This vulnerability impacts 10.2.1.2-24sv, 10.2.0.8-37sv and earlier 10.x versions.	7.5	HIGH	CVSS:3.1/AV:N/AC:L/PR:N/UI:N/S:U/C:H/I:N/A:N		
CVE-2021-20050	2021-12-23T02:15:06.637	2024-11-21T05:45:51.470	An Improper Access Control Vulnerability in the SMA100 series leads to multiple restricted management APIs being accessible without a user login, potentially exposing configuration meta-data.	7.5	HIGH	CVSS:3.1/AV:N/AC:L/PR:N/UI:N/S:U/C:H/I:N/A:N		
CVE-2021-45462	2021-12-23T04:15:09.573	2024-11-21T06:32:15.493	In Open5GS 2.4.0, a crafted packet from UE can crash SGW-U/UPF.	7.5	HIGH	CVSS:3.1/AV:N/AC:L/PR:N/UI:N/S:U/C:N/I:N/A:H		
CVE-2021-45463	2021-12-23T06:15:06.787	2024-11-21T06:32:15.640	load_cache in GEGL before 0.4.34 allows shell expansion when a pathname in a constructed command line is not escaped or filtered. This is caused by use of the system library function for execution of the ImageMagick convert fallback in magick-load. NOTE: GEGL releases before 0.4.34 are used in GIMP releases before 2.10.30; however, this does not imply that GIMP builds enable the vulnerable feature.	7.8	HIGH	CVSS:3.1/AV:L/AC:L/PR:N/UI:R/S:U/C:H/I:H/A:H		
CVE-2021-4144	2021-12-23T07:15:06.797	2024-11-21T06:36:59.763	TP-Link wifi router TL-WR802N V4(JP), with firmware version prior to 211202, is vulnerable to OS command injection.	8.8	HIGH	CVSS:3.1/AV:N/AC:L/PR:L/UI:N/S:U/C:H/I:H/A:H		
CVE-2021-44548	2021-12-23T09:15:06.693	2024-11-21T06:31:12.457	An Improper Input Validation vulnerability in DataImportHandler of Apache Solr allows an attacker to provide a Windows UNC path resulting in an SMB network call being made from the Solr host to another host on the network. If the attacker has wider access to the network, this may lead to SMB attacks, which may result in: * The exfiltration of sensitive data such as OS user hashes (NTLM/LM hashes), * In case of misconfigured systems, SMB Relay Attacks which can lead to user impersonation on SMB Shares or, in a worse-case scenario, Remote Code Execution This issue affects all Apache Solr versions prior to 8.11.1. This issue only affects Windows.	9.8	CRITICAL	CVSS:3.1/AV:N/AC:L/PR:N/UI:N/S:U/C:H/I:H/A:H		
CVE-2021-44273	2021-12-23T12:15:07.387	2024-11-21T06:30:41.833	e2guardian v5.4.x <= v5.4.3r is affected by missing SSL certificate validation in the SSL MITM engine. In standalone mode (i.e., acting as a proxy or a transparent proxy), with SSL MITM enabled, e2guardian, if built with OpenSSL v1.1.x, did not validate hostnames in certificates of the web servers that it connected to, and thus was itself vulnerable to MITM attacks.	7.4	HIGH	CVSS:3.1/AV:N/AC:H/PR:N/UI:N/S:U/C:H/I:H/A:N		
CVE-2021-44599	2021-12-23T13:15:10.540	2024-11-21T06:31:15.783	The id parameter from Online Enrollment Management System 1.0 system appears to be vulnerable to SQL injection attacks. A crafted payload injects a SQL sub-query that calls MySQL's load_file function with a UNC file path that references a URL on an external domain. The application interacted with that domain, indicating that the injected SQL query was executed. The attacker can retrieve sensitive information for all users of this system.	7.5	HIGH	CVSS:3.1/AV:N/AC:L/PR:N/UI:N/S:U/C:H/I:N/A:N		
CVE-2021-44600	2021-12-23T14:15:07.303	2025-02-11T15:25:36.557	The password parameter on Simple Online Mens Salon Management System (MSMS) 1.0 appears to be vulnerable to SQL injection attacks through the password parameter. The predictive tests of this application interacted with that domain, indicating that the injected SQL query was executed. The attacker can retrieve all authentication and information about the users of this system.	7.5	HIGH	CVSS:3.1/AV:N/AC:L/PR:N/UI:N/S:U/C:H/I:N/A:N		
CVE-2021-44526	2021-12-23T15:15:07.700	2024-11-21T06:31:09.740	Zoho ManageEngine ServiceDesk Plus before 12003 allows authentication bypass in certain admin configurations.	9.8	CRITICAL	CVSS:3.1/AV:N/AC:L/PR:N/UI:N/S:U/C:H/I:H/A:H		
CVE-2021-23175	2021-12-23T16:15:07.863	2024-11-21T05:51:19.697	NVIDIA GeForce Experience contains a vulnerability in user authorization, where GameStream does not correctly apply individual user access controls for users on the same device, which, with user intervention, may lead to escalation of privileges, information disclosure, data tampering, and denial of service, affecting other resources beyond the intended security authority of GameStream.	8.2	HIGH	CVSS:3.1/AV:L/AC:L/PR:L/UI:R/S:C/C:H/I:H/A:H		
CVE-2021-3892	2021-12-23T16:15:07.937	2023-11-07T03:38:23.137	Rejected reason: DO NOT USE THIS CANDIDATE NUMBER. ConsultIDs: CVE-2019-18198. Reason: This candidate is a reservation duplicate of CVE-2019-18198. Notes: All CVE users should reference CVE-2019-18198 instead of this candidate. All references and descriptions in this candidate have been removed to prevent accidental usage					
CVE-2021-43849	2021-12-23T17:15:07.373	2024-11-21T06:29:55.570	cordova-plugin-fingerprint-aio is a plugin provides a single and simple interface for accessing fingerprint APIs on both Android 6+ and iOS. In versions prior to 5.0.1 The exported activity `de.niklasmerz.cordova.biometric.BiometricActivity` can cause the app to crash. This vulnerability occurred because the activity didn't handle the case where it is requested with invalid or empty data which results in a crash. Any third party app can constantly call this activity with no permission. A 3rd party app/attacker using event listener can continually stop the app from working and make the victim unable to open it. Version 5.0.1 of the cordova-plugin-fingerprint-aio doesn't export the activity anymore and is no longer vulnerable. If you want to fix older versions change the attribute android:exported in plugin.xml to false. Please upgrade to version 5.0.1 as soon as possible.	6.2	MEDIUM	CVSS:3.1/AV:L/AC:L/PR:N/UI:N/S:U/C:N/I:N/A:H		
CVE-2021-43854	2021-12-23T18:15:07.327	2024-11-21T06:29:56.200	NLTK (Natural Language Toolkit) is a suite of open source Python modules, data sets, and tutorials supporting research and development in Natural Language Processing. Versions prior to 3.6.5 are vulnerable to regular expression denial of service (ReDoS) attacks. The vulnerability is present in PunktSentenceTokenizer, sent_tokenize and word_tokenize. Any users of this class, or these two functions, are vulnerable to the ReDoS attack. In short, a specifically crafted long input to any of these vulnerable functions will cause them to take a significant amount of execution time. If your program relies on any of the vulnerable functions for tokenizing unpredictable user input, then we would strongly recommend upgrading to a version of NLTK without the vulnerability. For users unable to upgrade the execution time can be bounded by limiting the maximum length of an input to any of the vulnerable functions. Our recommendation is to implement such a limit.	7.5	HIGH	CVSS:3.1/AV:N/AC:L/PR:N/UI:N/S:U/C:N/I:N/A:H		
CVE-2021-4118	2021-12-23T18:15:07.407	2024-11-21T06:36:56.293	pytorch-lightning is vulnerable to Deserialization of Untrusted Data	7.8	HIGH	CVSS:3.1/AV:L/AC:L/PR:N/UI:R/S:U/C:H/I:H/A:H		
CVE-2021-40160	2021-12-23T19:15:12.117	2024-11-21T06:23:41.700	PDFTron prior to 9.0.7 version may be forced to read beyond allocated boundaries when parsing a maliciously crafted PDF file. This vulnerability can be exploited to execute arbitrary code.	7.8	HIGH	CVSS:3.1/AV:L/AC:L/PR:N/UI:R/S:U/C:H/I:H/A:H		
CVE-2021-40161	2021-12-23T19:15:12.167	2024-11-21T06:23:41.847	A Memory Corruption vulnerability may lead to code execution through maliciously crafted DLL files through PDFTron earlier than 9.0.7 version.	7.8	HIGH	CVSS:3.1/AV:L/AC:L/PR:N/UI:R/S:U/C:H/I:H/A:H		
CVE-2021-45469	2021-12-23T19:15:12.693	2024-11-21T06:32:16.480	In __f2fs_setxattr in fs/f2fs/xattr.c in the Linux kernel through 5.15.11, there is an out-of-bounds memory access when an inode has an invalid last xattr entry.	7.8	HIGH	CVSS:3.1/AV:L/AC:L/PR:L/UI:N/S:U/C:H/I:H/A:H		
CVE-2017-13835	2021-12-23T20:15:08.087	2024-11-21T03:11:46.300	A memory corruption issue was addressed with improved memory handling. This issue is fixed in macOS High Sierra 10.13. An application may be able to execute arbitrary code with elevated privileges.	7.8	HIGH	CVSS:3.1/AV:L/AC:L/PR:N/UI:R/S:U/C:H/I:H/A:H		
CVE-2017-13880	2021-12-23T20:15:08.133	2024-11-21T03:11:50.920	A memory corruption issue was addressed with improved memory handling. This issue is fixed in iOS 11.2, watchOS 4.2. An application may be able to execute arbitrary code with kernel privilege.	7.8	HIGH	CVSS:3.1/AV:L/AC:L/PR:N/UI:R/S:U/C:H/I:H/A:H		
CVE-2017-13892	2021-12-23T20:15:08.177	2024-11-21T03:11:51.970	An issue existed in the handling of Contact sharing. This issue was addressed with improved handling of user information. This issue is fixed in macOS High Sierra 10.13.2, Security Update 2017-002 Sierra, and Security Update 2017-005 El Capitan. Sharing contact information may lead to unexpected data sharing.	7.5	HIGH	CVSS:3.1/AV:N/AC:L/PR:N/UI:N/S:U/C:H/I:N/A:N		
CVE-2017-13905	2021-12-23T20:15:08.217	2024-11-21T03:11:52.447	A race condition was addressed with additional validation. This issue is fixed in tvOS 11.2, iOS 11.2, macOS High Sierra 10.13.2, Security Update 2017-002 Sierra, and Security Update 2017-005 El Capitan, watchOS 4.2. An application may be able to gain elevated privileges.	8.1	HIGH	CVSS:3.1/AV:N/AC:H/PR:N/UI:N/S:U/C:H/I:H/A:H		
CVE-2017-13906	2021-12-23T20:15:08.260	2024-11-21T03:11:52.580	A memory corruption issue was addressed with improved memory handling. This issue is fixed in macOS High Sierra 10.13.1, Security Update 2017-001 Sierra, and Security Update 2017-004 El Capitan, macOS High Sierra 10.13. A malicious application may be able to elevate privileges.	7.8	HIGH	CVSS:3.1/AV:L/AC:L/PR:N/UI:R/S:U/C:H/I:H/A:H		
CVE-2017-13907	2021-12-23T20:15:08.303	2024-11-21T03:11:52.703	A state management issue was addressed with improved state validation. This issue is fixed in macOS High Sierra 10.13.1, Security Update 2017-001 Sierra, and Security Update 2017-004 El Capitan. The screen lock may unexpectedly remain unlocked.	6.8	MEDIUM	CVSS:3.1/AV:P/AC:L/PR:N/UI:N/S:U/C:H/I:H/A:H		
CVE-2017-13908	2021-12-23T20:15:08.343	2024-11-21T03:11:52.850	An issue in handling file permissions was addressed with improved validation. This issue is fixed in macOS High Sierra 10.13.1, Security Update 2017-001 Sierra, and Security Update 2017-004 El Capitan, macOS High Sierra 10.13. A local attacker may be able to execute non-executable text files via an SMB share.	7.8	HIGH	CVSS:3.1/AV:L/AC:L/PR:L/UI:N/S:U/C:H/I:H/A:H		
CVE-2017-13909	2021-12-23T20:15:08.387	2024-11-21T03:11:52.970	An issue existed in the storage of sensitive tokens. This issue was addressed by placing the tokens in Keychain. This issue is fixed in macOS High Sierra 10.13. A local attacker may gain access to iCloud authentication tokens.	5.5	MEDIUM	CVSS:3.1/AV:L/AC:L/PR:L/UI:N/S:U/C:H/I:N/A:N		
CVE-2017-13910	2021-12-23T20:15:08.433	2024-11-21T03:11:53.080	An access issue was addressed with additional sandbox restrictions on applications. This issue is fixed in macOS High Sierra 10.13. An application may be able to access restricted files.	5.5	MEDIUM	CVSS:3.1/AV:L/AC:L/PR:L/UI:N/S:U/C:H/I:N/A:N		
CVE-2017-2375	2021-12-23T20:15:08.480	2024-11-21T03:23:24.040	An issue existed in preventing the uploading of CallKit call history to iCloud. This issue was addressed through improved logic. This issue is fixed in iOS 10.2.1. Updates for CallKit call history are sent to iCloud.	3.3	LOW	CVSS:3.1/AV:L/AC:L/PR:L/UI:N/S:U/C:N/I:L/A:N		
CVE-2017-2488	2021-12-23T20:15:08.523	2024-11-21T03:23:37.690	A cryptographic weakness existed in the authentication protocol of Remote Desktop. This issue was addressed by implementing the Secure Remote Password authentication protocol. This issue is fixed in Apple Remote Desktop 3.9. An attacker may be able to capture cleartext passwords.	7.5	HIGH	CVSS:3.1/AV:N/AC:L/PR:N/UI:N/S:U/C:H/I:N/A:N		
CVE-2018-4302	2021-12-23T20:15:08.577	2024-11-21T04:07:09.207	A null pointer dereference was addressed with improved validation. This issue is fixed in macOS High Sierra 10.13, iCloud for Windows 7.0, watchOS 4, iOS 11, iTunes 12.7 for Windows. Processing maliciously crafted XML may lead to an unexpected application termination or arbitrary code execution.	7.8	HIGH	CVSS:3.1/AV:L/AC:L/PR:N/UI:R/S:U/C:H/I:H/A:H		
CVE-2018-4478	2021-12-23T20:15:08.620	2024-11-21T04:07:27.713	A validation issue was addressed with improved logic. This issue is fixed in macOS High Sierra 10.13.5, Security Update 2018-003 Sierra, Security Update 2018-003 El Capitan. An attacker with physical access to a device may be able to elevate privileges.	6.8	MEDIUM	CVSS:3.1/AV:P/AC:L/PR:N/UI:N/S:U/C:H/I:H/A:H		
CVE-2019-8643	2021-12-23T20:15:08.670	2024-11-21T04:50:13.477	CVE-2019-8643: Arun Sharma of VMWare This issue is fixed in macOS Mojave 10.14. Description: A logic issue was addressed with improved state management..	9.8	CRITICAL	CVSS:3.1/AV:N/AC:L/PR:N/UI:N/S:U/C:H/I:H/A:H		
CVE-2019-8702	2021-12-23T20:15:08.717	2024-11-21T04:50:19.557	This issue was addressed with a new entitlement. This issue is fixed in macOS Mojave 10.14.6, Security Update 2019-004 High Sierra, Security Update 2019-004 Sierra, iOS 12.4, tvOS 12.4. A local user may be able to read a persistent account identifier.	5.5	MEDIUM	CVSS:3.1/AV:L/AC:L/PR:L/UI:N/S:U/C:H/I:N/A:N		
CVE-2019-8703	2021-12-23T20:15:08.760	2024-11-21T04:50:19.670	This issue was addressed with improved entitlements. This issue is fixed in watchOS 6, tvOS 13, macOS Catalina 10.15, iOS 13. An application may be able to gain elevated privileges.	9.8	CRITICAL	CVSS:3.1/AV:N/AC:L/PR:N/UI:N/S:U/C:H/I:H/A:H		
CVE-2020-3886	2021-12-23T20:15:08.827	2024-11-21T05:31:53.890	A use after free issue was addressed with improved memory management. This issue is fixed in macOS Catalina 10.15.4, Security Update 2020-002 Mojave, Security Update 2020-002 High Sierra. A malicious application may be able to execute arbitrary code with kernel privileges.	7.8	HIGH	CVSS:3.1/AV:L/AC:L/PR:N/UI:R/S:U/C:H/I:H/A:H		
CVE-2020-3896	2021-12-23T20:15:08.873	2024-11-21T05:31:55.003	This issue was addressed by removing the vulnerable code. This issue is fixed in macOS Catalina 10.15.4, Security Update 2020-002 Mojave, Security Update 2020-002 High Sierra. A malicious application may be able to overwrite arbitrary files.	5.5	MEDIUM	CVSS:3.1/AV:L/AC:L/PR:N/UI:R/S:U/C:N/I:H/A:N		
CVE-2021-20318	2021-12-23T20:15:08.927	2024-11-21T05:46:22.070	The HornetQ component of Artemis in EAP 7 was not updated with the fix for CVE-2016-4978. A remote attacker could use this flaw to execute arbitrary code with the permissions of the application using a JMS ObjectMessage.	7.2	HIGH	CVSS:3.1/AV:N/AC:L/PR:H/UI:N/S:U/C:H/I:H/A:H		
CVE-2021-22657	2021-12-23T20:15:08.987	2024-11-21T05:50:25.120	mySCADA myPRO: Versions 8.20.0 and prior has a feature where the API password can be specified, which may allow an attacker to inject arbitrary operating system commands through a specific parameter.	10.0	CRITICAL	CVSS:3.1/AV:N/AC:L/PR:N/UI:N/S:C/C:H/I:H/A:H		
CVE-2021-23198	2021-12-23T20:15:09.053	2024-11-21T05:51:21.793	mySCADA myPRO: Versions 8.20.0 and prior has a feature where the password can be specified, which may allow an attacker to inject arbitrary operating system commands through a specific parameter.	10.0	CRITICAL	CVSS:3.1/AV:N/AC:L/PR:N/UI:N/S:C/C:H/I:H/A:H		
CVE-2021-27006	2021-12-23T20:15:09.117	2024-11-21T05:57:10.927	StorageGRID (formerly StorageGRID Webscale) versions 11.5 prior to 11.5.0.5 are susceptible to a vulnerability which may allow an administrative user to escalate their privileges and modify settings in SANtricity System Manager.	4.4	MEDIUM	CVSS:3.1/AV:L/AC:L/PR:H/UI:N/S:U/C:N/I:H/A:N		
CVE-2021-27007	2021-12-23T20:15:09.167	2024-11-21T05:57:11.043	NetApp Virtual Desktop Service (VDS) when used with an HTML5 gateway is susceptible to a vulnerability which when successfully exploited could allow an unauthenticated attacker to takeover a Remote Desktop Session.	9.8	CRITICAL	CVSS:3.1/AV:N/AC:L/PR:N/UI:N/S:U/C:H/I:H/A:H		
CVE-2021-30767	2021-12-23T20:15:09.213	2024-11-21T06:04:40.433	A logic issue was addressed with improved state management. This issue is fixed in macOS Big Sur 11.6.2, macOS Monterey 12.1, Security Update 2021-008 Catalina, iOS 15.2 and iPadOS 15.2, watchOS 8.3. A local user may be able to modify protected parts of the file system.	5.5	MEDIUM	CVSS:3.1/AV:L/AC:L/PR:L/UI:N/S:U/C:N/I:H/A:N		
CVE-2021-35243	2021-12-23T20:15:11.480	2024-11-21T06:12:08.280	The HTTP PUT and DELETE methods were enabled in the Web Help Desk web server (12.7.7 and earlier), allowing users to execute dangerous HTTP requests. The HTTP PUT method is normally used to upload data that is saved on the server with a user-supplied URL. While the DELETE method requests that the origin server removes the association between the target resource and its current functionality. Improper use of these methods may lead to a loss of integrity.	5.3	MEDIUM	CVSS:3.1/AV:N/AC:L/PR:N/UI:N/S:U/C:N/I:L/A:N		
CVE-2021-3584	2021-12-23T20:15:11.533	2024-11-21T06:21:54.377	A server side remote code execution vulnerability was found in Foreman project. A authenticated attacker could use Sendmail configuration options to overwrite the defaults and perform command injection. The highest threat from this vulnerability is to confidentiality, integrity and availability of system. Fixed releases are 2.4.1, 2.5.1, 3.0.0.	7.2	HIGH	CVSS:3.1/AV:N/AC:L/PR:H/UI:N/S:U/C:H/I:H/A:H		
CVE-2021-43981	2021-12-23T20:15:11.590	2024-11-21T06:30:08.420	mySCADA myPRO: Versions 8.20.0 and prior has a feature to send emails, which may allow an attacker to inject arbitrary operating system commands through a specific parameter.	10.0	CRITICAL	CVSS:3.1/AV:N/AC:L/PR:N/UI:N/S:C/C:H/I:H/A:H		
CVE-2021-43984	2021-12-23T20:15:11.650	2024-11-21T06:30:08.980	mySCADA myPRO: Versions 8.20.0 and prior has a feature where the firmware can be updated, which may allow an attacker to inject arbitrary operating system commands through a specific parameter.	10.0	CRITICAL	CVSS:3.1/AV:N/AC:L/PR:N/UI:N/S:C/C:H/I:H/A:H		
CVE-2021-43985	2021-12-23T20:15:11.710	2024-11-21T06:30:09.177	An unauthenticated remote attacker can access mySCADA myPRO Versions 8.20.0 and prior without any form of authentication or authorization.	9.1	CRITICAL	CVSS:3.1/AV:N/AC:L/PR:N/UI:N/S:U/C:H/I:H/A:N		
