CVE ID	Published Date	Last Modified Date	Description	Base Score	Base Severity	Vector String	Vendor	Product
CVE-2021-37189	2021-12-10T13:15:07.753	2024-11-21T06:14:49.620	An issue was discovered on Digi TransPort Gateway devices through 5.2.13.4. They do not set the Secure attribute for sensitive cookies in HTTPS sessions, which could cause the user agent to send those cookies in cleartext over an HTTP session.	7.5	HIGH	CVSS:3.1/AV:N/AC:L/PR:N/UI:N/S:U/C:H/I:N/A:N		
CVE-2021-40834	2021-12-10T14:15:10.093	2024-11-21T06:24:53.117	A user interface overlay vulnerability was discovered in F-secure SAFE Browser for Android. When user click on a specially crafted seemingly legitimate URL SAFE browser goes into full screen and hides the user interface. A remote attacker can leverage this to perform spoofing attack.	4.3	MEDIUM	CVSS:3.1/AV:N/AC:L/PR:H/UI:R/S:U/C:L/I:L/A:L		
CVE-2021-3829	2021-12-10T16:15:09.310	2024-11-21T06:22:33.470	openwhyd is vulnerable to URL Redirection to Untrusted Site	6.1	MEDIUM	CVSS:3.1/AV:N/AC:L/PR:N/UI:R/S:C/C:L/I:L/A:N		
CVE-2021-29214	2021-12-10T17:15:07.480	2024-11-21T06:00:50.433	A security vulnerability has been identified in HPE StoreServ Management Console (SSMC). An authenticated SSMC administrator could exploit the vulnerability to inject code and elevate their privilege in SSMC. The scope of this vulnerability is limited to SSMC. Note: The arrays being managed are not impacted by this vulnerability. This vulnerability impacts SSMC versions 3.4 GA to 3.8.1.	7.2	HIGH	CVSS:3.1/AV:N/AC:L/PR:H/UI:N/S:U/C:H/I:H/A:H		
CVE-2021-36911	2021-12-10T17:15:07.537	2024-11-21T06:14:17.263	Stored Cross-Site Scripting (XSS) vulnerability discovered in WordPress Comment Engine Pro plugin (versions <= 1.0), could be exploited by users with Editor or higher role.	4.8	MEDIUM	CVSS:3.1/AV:N/AC:L/PR:H/UI:R/S:C/C:L/I:L/A:N		
CVE-2021-37934	2021-12-10T17:15:07.593	2024-11-21T06:16:05.917	Due to insufficient server-side login-attempt limit enforcement, a vulnerability in /account/login in Huntflow Enterprise before 3.10.14 could allow an unauthenticated, remote user to perform multiple login attempts for brute-force password guessing.	9.8	CRITICAL	CVSS:3.1/AV:N/AC:L/PR:N/UI:N/S:U/C:H/I:H/A:H		
CVE-2021-37935	2021-12-10T17:15:07.637	2024-11-21T06:16:06.100	"An information disclosure vulnerability in the login page of Huntflow Enterprise before 3.10.4 could allow an unauthenticated, remote user to get information about the domain name of the configured LDAP server. An attacker could exploit this vulnerability by requesting the login page and searching for the ""isLdap"" JavaScript parameter in the HTML source code."	7.5	HIGH	CVSS:3.1/AV:N/AC:L/PR:N/UI:N/S:U/C:H/I:N/A:N		
CVE-2021-31745	2021-12-10T18:15:07.463	2024-11-21T06:06:10.513	Session Fixation vulnerability in login.php in Pluck-CMS Pluck 4.7.15 allows an attacker to sustain unauthorized access to the platform. Because Pluck does not invalidate prior sessions after a password change, access can be sustained even after an administrator performs regular remediation attempts such as resetting their password.	7.5	HIGH	CVSS:3.1/AV:N/AC:L/PR:N/UI:N/S:U/C:H/I:N/A:N		
CVE-2021-31746	2021-12-10T18:15:07.653	2024-11-21T06:06:10.660	Zip Slip vulnerability in Pluck-CMS Pluck 4.7.15 allows an attacker to upload specially crafted zip files, resulting in directory traversal and potentially arbitrary code execution.	9.8	CRITICAL	CVSS:3.1/AV:N/AC:L/PR:N/UI:N/S:U/C:H/I:H/A:H		
CVE-2021-38917	2021-12-10T18:15:07.847	2024-11-21T06:18:12.230	IBM PowerVM Hypervisor FW860, FW940, and FW950 could allow an attacker that gains service access to the FSP can read and write arbitrary host system memory through a series of carefully crafted service procedures. IBM X-Force ID: 210018.	9.1	CRITICAL	CVSS:3.1/AV:N/AC:L/PR:N/UI:N/S:U/C:H/I:H/A:N		
CVE-2021-38937	2021-12-10T18:15:08.083	2024-11-21T06:18:15.047	IBM PowerVM Hypervisor FW940, FW950, and FW1010 could allow an authenticated user to cause the system to crash using a specially crafted IBMi Hypervisor call. IBM X-Force ID: 210894.	6.5	MEDIUM	CVSS:3.1/AV:N/AC:L/PR:L/UI:N/S:U/C:N/I:N/A:H		
CVE-2021-43813	2021-12-10T18:15:08.260	2024-11-21T06:29:50.773	Grafana is an open-source platform for monitoring and observability. Grafana prior to versions 8.3.2 and 7.5.12 contains a directory traversal vulnerability for fully lowercase or fully uppercase .md files. The vulnerability is limited in scope, and only allows access to files with the extension .md to authenticated users only. Grafana Cloud instances have not been affected by the vulnerability. Users should upgrade to patched versions 8.3.2 or 7.5.12. For users who cannot upgrade, running a reverse proxy in front of Grafana that normalizes the PATH of the request will mitigate the vulnerability. The proxy will have to also be able to handle url encoded paths. Alternatively, for fully lowercase or fully uppercase .md files, users can block /api/plugins/.*/markdown/.* without losing any functionality beyond inlined plugin help text.	4.3	MEDIUM	CVSS:3.1/AV:N/AC:L/PR:L/UI:N/S:U/C:L/I:N/A:N		
CVE-2021-27983	2021-12-10T19:15:07.740	2024-11-21T05:58:56.770	Remote Code Execution (RCE) vulnerability exists in MaxSite CMS v107.5 via the Documents page.	9.8	CRITICAL	CVSS:3.1/AV:N/AC:L/PR:N/UI:N/S:U/C:H/I:H/A:H		
CVE-2021-27984	2021-12-10T19:15:07.783	2024-11-21T05:58:56.977	In Pluck-4.7.15 admin background a remote command execution vulnerability exists when uploading files.	8.1	HIGH	CVSS:3.1/AV:N/AC:H/PR:N/UI:N/S:U/C:H/I:H/A:H		
CVE-2021-31747	2021-12-10T19:15:07.827	2024-11-21T06:06:10.800	Missing SSL Certificate Validation issue exists in Pluck 4.7.15 in update_applet.php, which could lead to man-in-the-middle attacks.	4.8	MEDIUM	CVSS:3.1/AV:N/AC:H/PR:N/UI:N/S:U/C:L/I:L/A:N		
CVE-2021-23463	2021-12-10T20:15:07.917	2024-11-21T05:51:47.487	The package com.h2database:h2 from 1.4.198 and before 2.0.202 are vulnerable to XML External Entity (XXE) Injection via the org.h2.jdbc.JdbcSQLXML class object, when it receives parsed string data from org.h2.jdbc.JdbcResultSet.getSQLXML() method. If it executes the getSource() method when the parameter is DOMSource.class it will trigger the vulnerability.	8.1	HIGH	CVSS:3.1/AV:N/AC:L/PR:L/UI:N/S:U/C:H/I:N/A:H		
CVE-2021-23561	2021-12-10T20:15:08.303	2024-11-21T05:51:49.780	All versions of package comb are vulnerable to Prototype Pollution via the deepMerge() function.	6.5	MEDIUM	CVSS:3.1/AV:N/AC:L/PR:N/UI:N/S:U/C:N/I:L/A:L		
CVE-2021-23639	2021-12-10T20:15:08.387	2024-11-21T05:51:51.180	The package md-to-pdf before 5.0.0 are vulnerable to Remote Code Execution (RCE) due to utilizing the library gray-matter to parse front matter content, without disabling the JS engine.	9.8	CRITICAL	CVSS:3.1/AV:N/AC:L/PR:N/UI:N/S:U/C:H/I:H/A:H		
CVE-2021-23663	2021-12-10T20:15:08.453	2024-11-21T05:51:51.607	All versions of package sey are vulnerable to Prototype Pollution via the deepmerge() function.	6.5	MEDIUM	CVSS:3.1/AV:N/AC:L/PR:N/UI:N/S:U/C:N/I:L/A:L		
CVE-2021-23700	2021-12-10T20:15:08.527	2024-11-21T05:51:52.107	All versions of package merge-deep2 are vulnerable to Prototype Pollution via the mergeDeep() function.	6.5	MEDIUM	CVSS:3.1/AV:N/AC:L/PR:N/UI:N/S:U/C:N/I:L/A:L		
CVE-2021-4089	2021-12-10T20:15:08.737	2024-11-21T06:36:52.730	snipe-it is vulnerable to Improper Access Control	4.3	MEDIUM	CVSS:3.1/AV:N/AC:L/PR:L/UI:N/S:U/C:L/I:N/A:N		
CVE-2021-43815	2021-12-10T21:15:09.497	2024-11-21T06:29:51.050	Grafana is an open-source platform for monitoring and observability. Grafana prior to versions 8.3.2 and 7.5.12 has a directory traversal for arbitrary .csv files. It only affects instances that have the developer testing tool called TestData DB data source enabled and configured. The vulnerability is limited in scope, and only allows access to files with the extension .csv to authenticated users only. Grafana Cloud instances have not been affected by the vulnerability. Versions 8.3.2 and 7.5.12 contain a patch for this issue. There is a workaround available for users who cannot upgrade. Running a reverse proxy in front of Grafana that normalizes the PATH of the request will mitigate the vulnerability. The proxy will have to also be able to handle url encoded paths.	4.3	MEDIUM	CVSS:3.1/AV:N/AC:L/PR:L/UI:N/S:U/C:L/I:N/A:N		
CVE-2020-12890	2021-12-10T22:15:07.833	2024-11-21T05:00:30.260	Improper handling of pointers in the System Management Mode (SMM) handling code may allow for a privileged attacker with physical or administrative access to potentially manipulate the AMD Generic Encapsulated Software Architecture (AGESA) to execute arbitrary code undetected by the operating system.	6.7	MEDIUM	CVSS:3.1/AV:L/AC:L/PR:H/UI:N/S:U/C:H/I:H/A:H		
CVE-2021-26340	2021-12-10T22:15:08.323	2024-11-21T05:56:08.917	A malicious hypervisor in conjunction with an unprivileged attacker process inside an SEV/SEV-ES guest VM may fail to flush the Translation Lookaside Buffer (TLB) resulting in unexpected behavior inside the virtual machine (VM).	8.4	HIGH	CVSS:3.1/AV:L/AC:L/PR:L/UI:N/S:C/C:H/I:H/A:N		
CVE-2021-41242	2021-12-10T23:15:09.527	2024-11-21T06:25:51.590	OpenOlat is a web-basedlearning management system. A path traversal vulnerability exists in OpenOlat prior to versions 15.5.12 and 16.0.5. By providing a filename that contains a relative path as a parameter in some REST methods, it is possible to create directory structures and write files anywhere on the target system. The attack could be used to write files anywhere in the web root folder or outside, depending on the configuration of the system and the properly configured permission of the application server user. The attack requires an OpenOlat user account, an enabled REST API and the rights on a business object to call the vulnerable REST calls. The problem is fixed in version 15.5.12 and 16.0.5. There is a workaround available. The vulnerability requires the REST module to be enabled. Disabling the REST module or limiting the REST module via some firewall or web-server access rules to be accessed only be trusted systems will mitigate the risk.	8.1	HIGH	CVSS:3.1/AV:N/AC:L/PR:L/UI:N/S:U/C:N/I:H/A:H		
CVE-2021-4092	2021-12-11T14:15:07.900	2024-11-21T06:36:53.170	yetiforcecrm is vulnerable to Cross-Site Request Forgery (CSRF)	4.3	MEDIUM	CVSS:3.1/AV:N/AC:L/PR:N/UI:R/S:U/C:N/I:L/A:N		
CVE-2021-4097	2021-12-12T00:15:07.743	2024-11-21T06:36:53.713	phpservermon is vulnerable to Improper Neutralization of CRLF Sequences	5.4	MEDIUM	CVSS:3.1/AV:N/AC:L/PR:N/UI:R/S:U/C:L/I:L/A:N		
CVE-2021-41805	2021-12-12T05:15:07.917	2024-11-21T06:26:47.790	HashiCorp Consul Enterprise before 1.8.17, 1.9.x before 1.9.11, and 1.10.x before 1.10.4 has Incorrect Access Control. An ACL token (with the default operator:write permissions) in one namespace can be used for unintended privilege escalation in a different namespace.	8.8	HIGH	CVSS:3.1/AV:N/AC:L/PR:L/UI:N/S:U/C:H/I:H/A:H		
CVE-2021-44515	2021-12-12T05:15:07.997	2025-03-14T16:49:38.220	Zoho ManageEngine Desktop Central is vulnerable to authentication bypass, leading to remote code execution on the server, as exploited in the wild in December 2021. For Enterprise builds 10.1.2127.17 and earlier, upgrade to 10.1.2127.18. For Enterprise builds 10.1.2128.0 through 10.1.2137.2, upgrade to 10.1.2137.3. For MSP builds 10.1.2127.17 and earlier, upgrade to 10.1.2127.18. For MSP builds 10.1.2128.0 through 10.1.2137.2, upgrade to 10.1.2137.3.	9.8	CRITICAL	CVSS:3.1/AV:N/AC:L/PR:N/UI:N/S:U/C:H/I:H/A:H		
CVE-2021-44833	2021-12-12T06:15:06.993	2024-11-21T06:31:35.057	The CLI 1.0.0 for Amazon AWS OpenSearch has weak permissions for the configuration file.	9.8	CRITICAL	CVSS:3.1/AV:N/AC:L/PR:N/UI:N/S:U/C:H/I:H/A:H		
CVE-2018-25021	2021-12-13T01:15:07.533	2024-11-21T04:03:22.417	The TCP Server module in toxcore before 0.2.8 doesn't free the TCP priority queue under certain conditions, which allows a remote attacker to exhaust the system's memory, causing a denial of service (DoS).	7.5	HIGH	CVSS:3.1/AV:N/AC:L/PR:N/UI:N/S:U/C:N/I:N/A:H		
CVE-2018-25022	2021-12-13T01:15:07.587	2024-11-21T04:03:22.563	The Onion module in toxcore before 0.2.2 doesn't restrict which packets can be onion-routed, which allows a remote attacker to discover a target user's IP address (when knowing only their Tox Id) by positioning themselves close to target's Tox Id in the DHT for the target to establish an onion connection with the attacker, guessing the target's DHT public key and creating a DHT node with public key close to it, and finally onion-routing a NAT Ping Request to the target, requesting it to ping the just created DHT node.	3.1	LOW	CVSS:3.1/AV:N/AC:H/PR:L/UI:N/S:U/C:L/I:N/A:N		
CVE-2021-44847	2021-12-13T01:15:07.730	2024-11-21T06:31:36.140	A stack-based buffer overflow in handle_request function in DHT.c in toxcore 0.1.9 through 0.1.11 and 0.2.0 through 0.2.12 (caused by an improper length calculation during the handling of received network packets) allows remote attackers to crash the process or potentially execute arbitrary code via a network packet.	9.8	CRITICAL	CVSS:3.1/AV:N/AC:L/PR:N/UI:N/S:U/C:H/I:H/A:H		
CVE-2021-44848	2021-12-13T02:15:06.790	2024-11-21T06:31:36.300	In Cibele Thinfinity VirtualUI before 3.0, /changePassword returns different responses for invalid authentication requests depending on whether the username exists.	5.3	MEDIUM	CVSS:3.1/AV:N/AC:L/PR:N/UI:N/S:U/C:L/I:N/A:N		
CVE-2021-40856	2021-12-13T04:15:06.973	2024-11-21T06:24:56.600	Auerswald COMfortel 1400 IP and 2600 IP before 2.8G devices allow Authentication Bypass via the /about/../ substring.	7.5	HIGH	CVSS:3.1/AV:N/AC:L/PR:N/UI:N/S:U/C:H/I:N/A:N		
CVE-2021-40857	2021-12-13T04:15:07.023	2024-11-21T06:24:56.803	Auerswald COMpact 5500R devices before 8.2B allow Privilege Escalation via the passwd=1 substring.	8.8	HIGH	CVSS:3.1/AV:N/AC:L/PR:L/UI:N/S:U/C:H/I:H/A:H		
CVE-2021-40858	2021-12-13T04:15:07.087	2024-11-21T06:24:57.007	Auerswald COMpact 5500R devices before 8.2B allow Arbitrary File Disclosure. A sub-admin can read the cleartext Admin password via the fileName=../../etc/passwd substring.	4.9	MEDIUM	CVSS:3.1/AV:N/AC:L/PR:H/UI:N/S:U/C:H/I:N/A:N		
CVE-2021-44151	2021-12-13T04:15:07.137	2025-04-30T21:01:39.110	An issue was discovered in Reprise RLM 14.2. As the session cookies are small, an attacker can hijack any existing sessions by bruteforcing the 4 hex-character session cookie on the Windows version (the Linux version appears to have 8 characters). An attacker can obtain the static part of the cookie (cookie name) by first making a request to any page on the application (e.g., /goforms/menu) and saving the name of the cookie sent with the response. The attacker can then use the name of the cookie and try to request that same page, setting a random value for the cookie. If any user has an active session, the page should return with the authorized content, when a valid cookie value is hit.	7.5	HIGH	CVSS:3.1/AV:N/AC:L/PR:N/UI:N/S:U/C:H/I:N/A:N		
CVE-2021-44152	2021-12-13T04:15:07.180	2024-11-21T06:30:27.213	An issue was discovered in Reprise RLM 14.2. Because /goform/change_password_process does not verify authentication or authorization, an unauthenticated user can change the password of any existing user. This allows an attacker to change the password of any known user, thereby preventing valid users from accessing the system and granting the attacker full access to that user's account.	9.8	CRITICAL	CVSS:3.1/AV:N/AC:L/PR:N/UI:N/S:U/C:H/I:H/A:H		
CVE-2021-44153	2021-12-13T04:15:07.223	2025-04-30T21:03:30.737	"An issue was discovered in Reprise RLM 14.2. When editing the license file, it is possible for an admin user to enable an option to run arbitrary executables, as demonstrated by an ISV demo ""C:\Windows\System32\calc.exe"" entry. An attacker can exploit this to run a malicious binary on startup, or when triggering the Reread/Restart Servers function on the webserver. (Exploitation does not require CVE-2018-15573, because the license file is meant to be changed in the application.)"	7.2	HIGH	CVSS:3.1/AV:N/AC:L/PR:H/UI:N/S:U/C:H/I:H/A:H		
CVE-2021-44154	2021-12-13T04:15:07.263	2025-04-30T20:59:47.577	An issue was discovered in Reprise RLM 14.2. By using an admin account, an attacker can write a payload to /goform/edit_opt, which will then be triggered when running the diagnostics (via /goform/diagnostics_doit), resulting in a buffer overflow.	7.2	HIGH	CVSS:3.1/AV:N/AC:L/PR:H/UI:N/S:U/C:H/I:H/A:H		
CVE-2021-44155	2021-12-13T04:15:07.323	2025-04-30T21:01:02.970	An issue was discovered in /goform/login_process in Reprise RLM 14.2. When an attacker attempts to login, the response if a username is valid includes Login Failed, but does not include this string if the username is invalid. This allows an attacker to enumerate valid users.	5.3	MEDIUM	CVSS:3.1/AV:N/AC:L/PR:N/UI:N/S:U/C:L/I:N/A:N		
CVE-2021-20865	2021-12-13T07:15:06.793	2024-11-21T05:47:18.347	Advanced Custom Fields versions prior to 5.11 and Advanced Custom Fields Pro versions prior to 5.11 contain a missing authorization vulnerability in browsing database which may allow a user to browse unauthorized data via unspecified vectors.	7.5	HIGH	CVSS:3.1/AV:N/AC:L/PR:N/UI:N/S:U/C:H/I:N/A:N		
CVE-2021-20866	2021-12-13T07:15:06.937	2024-11-21T05:47:18.463	Advanced Custom Fields versions prior to 5.11 and Advanced Custom Fields Pro versions prior to 5.11 contain a missing authorization vulnerability in obtaining the user list which may allow a user to obtain the unauthorized information via unspecified vectors.	6.5	MEDIUM	CVSS:3.1/AV:N/AC:L/PR:L/UI:N/S:U/C:H/I:N/A:N		
CVE-2021-20867	2021-12-13T07:15:07.003	2024-11-21T05:47:18.573	Advanced Custom Fields versions prior to 5.11 and Advanced Custom Fields Pro versions prior to 5.11 contain a missing authorization vulnerability in moving the field group which may allow a user to move the unauthorized field group via unspecified vectors.	6.5	MEDIUM	CVSS:3.1/AV:N/AC:L/PR:L/UI:N/S:U/C:N/I:H/A:N		
CVE-2021-24705	2021-12-13T11:15:08.137	2024-11-21T05:53:36.167	The NEX-Forms WordPress plugin before 8.4.3 does not have CSRF checks in place when editing a form, and does not escape some of its settings as well as form fields before outputting them in attributes. This could allow attackers to make a logged in admin edit arbitrary forms with Cross-Site Scripting payloads in them	4.8	MEDIUM	CVSS:3.1/AV:N/AC:L/PR:H/UI:R/S:C/C:L/I:L/A:N		
CVE-2021-24747	2021-12-13T11:15:08.267	2024-11-21T05:53:41.030	"The SEO Booster WordPress plugin before 3.8 allows for authenticated SQL injection via the ""fn_my_ajaxified_dataloader_ajax"" AJAX request as the $_REQUEST['order'][0]['dir'] parameter is not properly escaped leading to blind and error-based SQL injections."	7.2	HIGH	CVSS:3.1/AV:N/AC:L/PR:H/UI:N/S:U/C:H/I:H/A:H		
CVE-2021-24756	2021-12-13T11:15:08.323	2024-11-21T05:53:42.160	The WP System Log WordPress plugin before 1.0.21 does not sanitise, validate and escape the IP address retrieved from login requests before outputting them in the admin dashboard, which could allow unauthenticated attacker to perform Cross-Site Scripting attacks against admins viewing the logs.	6.1	MEDIUM	CVSS:3.1/AV:N/AC:L/PR:N/UI:R/S:C/C:L/I:L/A:N		
CVE-2021-24771	2021-12-13T11:15:08.387	2024-11-21T05:53:43.963	"The Inspirational Quote Rotator WordPress plugin through 1.0.0 does not sanitize and escape some of its quote fields when adding/editing a quote as admin, leading to Stored Cross-Site scripting issues when the quote is output in the ""Quotes list"" even when the unfiltered_html capability is disallowed"	4.8	MEDIUM	CVSS:3.1/AV:N/AC:L/PR:H/UI:R/S:C/C:L/I:L/A:N		
CVE-2021-24780	2021-12-13T11:15:08.440	2024-11-21T05:53:44.953	The Single Post Exporter WordPress plugin through 1.1.1 does not have CSRF checks when saving its settings, which could allow attackers to make a logged in admin change them via a CSRF attack and give access to the export feature to any role such as subscriber. Subscriber users would then be able to export an arbitrary post/page (such as private and password protected) via a direct URL	4.3	MEDIUM	CVSS:3.1/AV:N/AC:L/PR:N/UI:R/S:U/C:N/I:L/A:N		
CVE-2021-24782	2021-12-13T11:15:08.493	2024-11-21T05:53:45.217	The Flex Local Fonts WordPress plugin through 1.0.0 does not escape the Class Name field when adding a font, which could allow hight privilege users to perform Cross-Site Scripting attacks even when the unfiltered_html capability is disallowed.	4.8	MEDIUM	CVSS:3.1/AV:N/AC:L/PR:H/UI:R/S:C/C:L/I:L/A:N		
CVE-2021-24784	2021-12-13T11:15:08.543	2024-11-21T05:53:45.460	The WP Admin Logo Changer WordPress plugin through 1.0 does not have CSRF check when saving its settings, which could allow attackers to make a logged in admin update them via a CSRF attack.	6.5	MEDIUM	CVSS:3.1/AV:N/AC:L/PR:N/UI:R/S:U/C:N/I:H/A:N		
CVE-2021-24790	2021-12-13T11:15:08.593	2024-11-21T05:53:46.170	The Contact Form Advanced Database WordPress plugin through 1.0.8 does not have any authorisation as well as CSRF checks in its delete_cf7_data and export_cf7_data AJAX actions, available to any authenticated users, which could allow users with a role as low as subscriber to call them. The delete_cf7_data would lead to arbitrary metadata deletion, as well as PHP Object Injection if a suitable gadget chain is present in another plugin, as user data is passed to the maybe_unserialize() function without being first validated.	4.3	MEDIUM	CVSS:3.1/AV:N/AC:L/PR:L/UI:N/S:U/C:N/I:L/A:N		
CVE-2021-24792	2021-12-13T11:15:08.643	2024-11-21T05:53:46.403	The Shiny Buttons WordPress plugin through 1.1.0 does not have any authorisation and CSRF in place when saving a template (wpbtn_save_template function hooked to the init action), nor sanitise and escape them before outputting them in the admin dashboard, which allow unauthenticated users to add a malicious template and lead to Stored Cross-Site Scripting issues.	6.1	MEDIUM	CVSS:3.1/AV:N/AC:L/PR:N/UI:R/S:C/C:L/I:L/A:N		
CVE-2021-24795	2021-12-13T11:15:08.697	2024-11-21T05:53:46.750	The Filter Portfolio Gallery WordPress plugin through 1.5 is lacking Cross-Site Request Forgery (CSRF) check when deleting a Gallery, which could allow attackers to make a logged in admin delete arbitrary Gallery.	6.5	MEDIUM	CVSS:3.1/AV:N/AC:L/PR:N/UI:R/S:U/C:N/I:H/A:N		
CVE-2021-24817	2021-12-13T11:15:08.750	2024-11-21T05:53:49.283	The Ultimate NoFollow WordPress plugin through 1.4.8 does not sanitise and escape the href attribute of its shortcodes, allowing users with a role as low as contributor to perform Cross-Site Scripting attacks	5.4	MEDIUM	CVSS:3.1/AV:N/AC:L/PR:L/UI:R/S:C/C:L/I:L/A:N		
CVE-2021-24818	2021-12-13T11:15:08.807	2024-11-21T05:53:49.393	The WP Limits WordPress plugin through 1.0 does not have CSRF check when saving its settings, allowing attacker to make a logged in admin change them, which could make the blog unstable by setting low values	4.3	MEDIUM	CVSS:3.1/AV:N/AC:L/PR:N/UI:R/S:U/C:N/I:L/A:N		
CVE-2021-24819	2021-12-13T11:15:08.857	2024-11-21T05:53:49.513	The Page/Post Content Shortcode WordPress plugin through 1.0 does not have proper authorisation in place, allowing users with a role as low as contributor to access draft/private/password protected/trashed posts/pages they should not be allowed to, including posts created by other users such as admins and editors.	4.3	MEDIUM	CVSS:3.1/AV:N/AC:L/PR:L/UI:N/S:U/C:L/I:N/A:N		
CVE-2021-24836	2021-12-13T11:15:08.910	2024-11-21T05:53:51.567	The Temporary Login Without Password WordPress plugin before 1.7.1 does not have authorisation and CSRF checks when updating its settings, which could allows any logged-in users, such as subscribers to update them	4.3	MEDIUM	CVSS:3.1/AV:N/AC:L/PR:L/UI:N/S:U/C:N/I:L/A:N		
CVE-2021-24845	2021-12-13T11:15:08.963	2024-11-21T05:53:52.593	The Improved Include Page WordPress plugin through 1.2 allows passing shortcode attributes with post_type & post_status which can be used to retrieve arbitrary content. This way, users with a role as low as Contributor can gain access to content they are not supposed to.	6.5	MEDIUM	CVSS:3.1/AV:N/AC:L/PR:L/UI:N/S:U/C:H/I:N/A:N		
CVE-2021-24848	2021-12-13T11:15:09.017	2024-11-21T05:53:52.930	The mediamaticAjaxRenameCategory AJAX action of the Mediamatic WordPress plugin before 2.8.1, available to any authenticated user, does not sanitise the categoryID parameter before using it in a SQL statement, leading to an SQL injection	8.8	HIGH	CVSS:3.1/AV:N/AC:L/PR:L/UI:N/S:U/C:H/I:H/A:H		
CVE-2021-24855	2021-12-13T11:15:09.067	2024-11-21T05:53:53.727	The Display Post Metadata WordPress plugin before 1.5.0 adds a shortcode to print out custom fields, however their content is not sanitised or escaped which could allow users with a role as low as Contributor to perform Cross-Site Scripting attacks	5.4	MEDIUM	CVSS:3.1/AV:N/AC:L/PR:L/UI:R/S:C/C:L/I:L/A:N		
CVE-2021-24857	2021-12-13T11:15:09.117	2024-11-21T05:53:53.957	The ToTop Link WordPress plugin through 1.7.1 passes base64 encoded user input to the unserialize() PHP function, which could lead to PHP Object injection if a plugin installed on the blog has a suitable gadget chain.	9.8	CRITICAL	CVSS:3.1/AV:N/AC:L/PR:N/UI:N/S:U/C:H/I:H/A:H		
CVE-2021-24859	2021-12-13T11:15:09.167	2024-11-21T05:53:54.183	The User Meta Shortcodes WordPress plugin through 0.5 registers a shortcode that allows any user with a role as low as contributor to access other users metadata by specifying the user login as a parameter. This makes the WP instance vulnerable to data extrafiltration, including password hashes	4.3	MEDIUM	CVSS:3.1/AV:N/AC:L/PR:L/UI:N/S:U/C:L/I:N/A:N		
CVE-2021-24861	2021-12-13T11:15:09.217	2024-11-21T05:53:54.410	The Quotes Collection WordPress plugin through 2.5.2 does not validate and escape the bulkcheck parameter before using it in a SQL statement, leading to a SQL injection	7.2	HIGH	CVSS:3.1/AV:N/AC:L/PR:H/UI:N/S:U/C:H/I:H/A:H		
