CVE ID	Published Date	Last Modified Date	Description	Base Score	Base Severity	Vector String	Vendor	Product
CVE-2021-0674	2021-12-17T17:15:10.793	2024-11-21T05:43:07.547	In alac decoder, there is a possible out of bounds read due to an incorrect bounds check. This could lead to local information disclosure with no additional execution privileges needed. User interaction is not needed for exploitation. Patch ID: ALPS06064258; Issue ID: ALPS06064237.	5.5	MEDIUM	CVSS:3.1/AV:L/AC:L/PR:L/UI:N/S:U/C:H/I:N/A:N		
CVE-2021-0676	2021-12-17T17:15:10.933	2024-11-21T05:43:07.780	In geniezone driver, there is a possible out of bounds read due to an incorrect bounds check. This could lead to local information disclosure with System execution privileges needed. User interaction is not needed for exploitation. Patch ID: ALPS05863009; Issue ID: ALPS05863009.	4.4	MEDIUM	CVSS:3.1/AV:L/AC:L/PR:H/UI:N/S:U/C:H/I:N/A:N		
CVE-2021-0677	2021-12-17T17:15:10.983	2024-11-21T05:43:07.900	In ccu driver, there is a possible out of bounds read due to an integer overflow. This could lead to local information disclosure with System execution privileges needed. User interaction is not needed for exploitation. Patch ID: ALPS05827154; Issue ID: ALPS05827154.	4.4	MEDIUM	CVSS:3.1/AV:L/AC:L/PR:H/UI:N/S:U/C:H/I:N/A:N		
CVE-2021-0678	2021-12-17T17:15:11.030	2024-11-21T05:43:08.023	In apusys, there is a possible out of bounds write due to a missing bounds check. This could lead to local escalation of privilege with System execution privileges needed. User interaction is not needed for exploitation. Patch ID: ALPS05672107; Issue ID: ALPS05722511.	6.7	MEDIUM	CVSS:3.1/AV:L/AC:L/PR:H/UI:N/S:U/C:H/I:H/A:H		
CVE-2021-0679	2021-12-17T17:15:11.080	2024-11-21T05:43:08.137	In apusys, there is a possible memory corruption due to a missing bounds check. This could lead to local escalation of privilege with System execution privileges needed. User interaction is not needed for exploitation. Patch ID: ALPS05672107; Issue ID: ALPS05687781.	6.7	MEDIUM	CVSS:3.1/AV:L/AC:L/PR:H/UI:N/S:U/C:H/I:H/A:H		
CVE-2021-0893	2021-12-17T17:15:11.130	2024-11-21T05:43:13.553	In apusys, there is a possible memory corruption due to a use after free. This could lead to local escalation of privilege with System execution privileges needed. User interaction is not needed for exploitation. Patch ID: ALPS05672107; Issue ID: ALPS05687474.	6.7	MEDIUM	CVSS:3.1/AV:L/AC:L/PR:H/UI:N/S:U/C:H/I:H/A:H		
CVE-2021-0894	2021-12-17T17:15:11.180	2024-11-21T05:43:13.650	In apusys, there is a possible out of bounds write due to a missing bounds check. This could lead to local escalation of privilege with System execution privileges needed. User interaction is not needed for exploitation. Patch ID: ALPS05672107; Issue ID: ALPS05672038.	6.7	MEDIUM	CVSS:3.1/AV:L/AC:L/PR:H/UI:N/S:U/C:H/I:H/A:H		
CVE-2021-0895	2021-12-17T17:15:11.230	2024-11-21T05:43:13.747	In apusys, there is a possible out of bounds write due to a missing bounds check. This could lead to local escalation of privilege with System execution privileges needed. User interaction is not needed for exploitation. Patch ID: ALPS05672107; Issue ID: ALPS05672003.	6.7	MEDIUM	CVSS:3.1/AV:L/AC:L/PR:H/UI:N/S:U/C:H/I:H/A:H		
CVE-2021-0896	2021-12-17T17:15:11.283	2024-11-21T05:43:13.843	In apusys, there is a possible out of bounds write due to a missing bounds check. This could lead to local escalation of privilege with System execution privileges needed. User interaction is not needed for exploitation. Patch ID: ALPS05672107; Issue ID: ALPS05671206.	6.7	MEDIUM	CVSS:3.1/AV:L/AC:L/PR:H/UI:N/S:U/C:H/I:H/A:H		
CVE-2021-0897	2021-12-17T17:15:11.337	2024-11-21T05:43:13.943	In apusys, there is a possible out of bounds write due to a missing bounds check. This could lead to local escalation of privilege with System execution privileges needed. User interaction is not needed for exploitation. Patch ID: ALPS05672107; Issue ID: ALPS05670549.	6.7	MEDIUM	CVSS:3.1/AV:L/AC:L/PR:H/UI:N/S:U/C:H/I:H/A:H		
CVE-2021-0898	2021-12-17T17:15:11.387	2024-11-21T05:43:14.050	In apusys, there is a possible memory corruption due to a use after free. This could lead to local escalation of privilege with System execution privileges needed. User interaction is not needed for exploitation. Patch ID: ALPS05672107; Issue ID: ALPS05672071.	6.7	MEDIUM	CVSS:3.1/AV:L/AC:L/PR:H/UI:N/S:U/C:H/I:H/A:H		
CVE-2021-0899	2021-12-17T17:15:11.437	2024-11-21T05:43:14.160	In apusys, there is a possible memory corruption due to a use after free. This could lead to local escalation of privilege with System execution privileges needed. User interaction is not needed for exploitation. Patch ID: ALPS05672107; Issue ID: ALPS05672059.	6.7	MEDIUM	CVSS:3.1/AV:L/AC:L/PR:H/UI:N/S:U/C:H/I:H/A:H		
CVE-2021-0900	2021-12-17T17:15:11.487	2024-11-21T05:43:14.263	In apusys, there is a possible out of bounds read due to an incorrect bounds check. This could lead to local information disclosure with System execution privileges needed. User interaction is not needed for exploitation. Patch ID: ALPS05672107; Issue ID: ALPS05672055.	4.4	MEDIUM	CVSS:3.1/AV:L/AC:L/PR:H/UI:N/S:U/C:H/I:N/A:N		
CVE-2021-0901	2021-12-17T17:15:11.537	2024-11-21T05:43:14.363	In apusys, there is a possible memory corruption due to a missing bounds check. This could lead to local escalation of privilege with System execution privileges needed. User interaction is not needed for exploitation. Patch ID: ALPS05672107; Issue ID: ALPS05664618.	6.7	MEDIUM	CVSS:3.1/AV:L/AC:L/PR:H/UI:N/S:U/C:H/I:H/A:H		
CVE-2021-0902	2021-12-17T17:15:11.587	2024-11-21T05:43:14.457	In apusys, there is a possible out of bounds read due to an incorrect bounds check. This could lead to local information disclosure with System execution privileges needed. User interaction is not needed for exploitation. Patch ID: ALPS05672107; Issue ID: ALPS05656484.	4.4	MEDIUM	CVSS:3.1/AV:L/AC:L/PR:H/UI:N/S:U/C:H/I:N/A:N		
CVE-2021-0903	2021-12-17T17:15:11.707	2024-11-21T05:43:14.557	In apusys, there is a possible out of bounds write due to a missing bounds check. This could lead to local escalation of privilege with System execution privileges needed. User interaction is not needed for exploitation. Patch ID: ALPS05672107; Issue ID: ALPS05656488.	6.7	MEDIUM	CVSS:3.1/AV:L/AC:L/PR:H/UI:N/S:U/C:H/I:H/A:H		
CVE-2021-20606	2021-12-17T17:15:11.833	2024-11-21T05:46:51.817	Out-of-bounds Read vulnerability in Mitsubishi Electric GX Works2 versions 1.606G and prior, Mitsubishi Electric MELSOFT Navigator versions 2.84N and prior and Mitsubishi Electric EZSocket versions 5.4 and prior allows an attacker to cause a DoS condition in the software by getting a user to open malicious project file specially crafted by an attacker.	5.5	MEDIUM	CVSS:3.1/AV:L/AC:L/PR:N/UI:R/S:U/C:N/I:N/A:H		
CVE-2021-20607	2021-12-17T17:15:11.890	2024-11-21T05:46:51.930	Integer Underflow vulnerability in Mitsubishi Electric GX Works2 versions 1.606G and prior, Mitsubishi Electric MELSOFT Navigator versions 2.84N and prior and Mitsubishi Electric EZSocket versions 5.4 and prior allows an attacker to cause a DoS condition in the software by getting a user to open malicious project file specially crafted by an attacker.	5.5	MEDIUM	CVSS:3.1/AV:L/AC:L/PR:N/UI:R/S:U/C:N/I:N/A:H		
CVE-2021-20608	2021-12-17T17:15:11.937	2024-11-21T05:46:52.040	Improper Handling of Length Parameter Inconsistency vulnerability in Mitsubishi Electric GX Works2 versions 1.606G and prior allows a remote unauthenticated attacker to cause a DoS condition in GX Works2 by getting GX Works2 to read a tampered program file from a Mitsubishi Electric PLC by sending malicious crafted packets to tamper with the program file.	7.5	HIGH	CVSS:3.1/AV:N/AC:L/PR:N/UI:N/S:U/C:N/I:N/A:H		
CVE-2021-22054	2021-12-17T17:15:12.590	2024-11-21T05:49:30.550	VMware Workspace ONE UEM console 20.0.8 prior to 20.0.8.37, 20.11.0 prior to 20.11.0.40, 21.2.0 prior to 21.2.0.27, and 21.5.0 prior to 21.5.0.37 contain an SSRF vulnerability. This issue may allow a malicious actor with network access to UEM to send their requests without authentication and to gain access to sensitive information.	7.5	HIGH	CVSS:3.1/AV:N/AC:L/PR:N/UI:N/S:U/C:H/I:N/A:N		
CVE-2021-32497	2021-12-17T17:15:12.647	2024-11-21T06:07:09.167	SICK SOPAS ET before version 4.8.0 allows attackers to wrap any executable file into an SDD and provide this to a SOPAS ET user. When a user starts the emulator the executable is run without further checks.	8.6	HIGH	CVSS:3.1/AV:L/AC:L/PR:N/UI:R/S:C/C:H/I:H/A:H		
CVE-2021-32498	2021-12-17T17:15:12.693	2024-11-21T06:07:09.283	SICK SOPAS ET before version 4.8.0 allows attackers to manipulate the pathname of the emulator and use path traversal to run an arbitrary executable located on the host system. When the user starts the emulator from SOPAS ET the corresponding executable will be started instead of the emulator	8.6	HIGH	CVSS:3.1/AV:L/AC:L/PR:N/UI:R/S:C/C:H/I:H/A:H		
CVE-2021-32499	2021-12-17T17:15:12.747	2024-11-21T06:07:09.393	SICK SOPAS ET before version 4.8.0 allows attackers to manipulate the command line arguments to pass in any value to the Emulator executable.	7.5	HIGH	CVSS:3.1/AV:N/AC:L/PR:N/UI:N/S:U/C:N/I:H/A:N		
CVE-2021-37862	2021-12-17T17:15:12.920	2024-11-21T06:15:59.733	Mattermost 6.0 and earlier fails to sufficiently validate the email address during registration, which allows attackers to trick users into signing up using attacker-controlled email addresses via crafted invitation token.	3.7	LOW	CVSS:3.1/AV:N/AC:H/PR:L/UI:R/S:U/C:L/I:L/A:N		
CVE-2021-37863	2021-12-17T17:15:12.987	2024-11-21T06:15:59.913	Mattermost 6.0 and earlier fails to sufficiently validate parameters during post creation, which allows authenticated attackers to cause a client-side crash of the web application via a maliciously crafted post.	3.5	LOW	CVSS:3.1/AV:N/AC:L/PR:L/UI:R/S:U/C:N/I:N/A:L		
CVE-2021-38883	2021-12-17T17:15:13.053	2024-11-21T06:18:08.877	IBM Business Automation Workflow 18.0, 19.0, 20,0 and 21.0 and IBM Business Process Manager 8.5 and 8.6 are vulnerable to cross-site scripting. This vulnerability allows users to embed arbitrary JavaScript code in the Web UI thus altering the intended functionality potentially leading to credentials disclosure within a trusted session. IBM X-Force ID: 209165.	5.4	MEDIUM	CVSS:3.1/AV:N/AC:L/PR:L/UI:R/S:C/C:L/I:L/A:N		
CVE-2021-40850	2021-12-17T17:15:13.110	2024-11-21T06:24:55.587	TCMAN GIM is vulnerable to a SQL injection vulnerability inside several available webservice methods in /PC/WebService.asmx.	10.0	CRITICAL	CVSS:3.1/AV:N/AC:L/PR:N/UI:N/S:C/C:H/I:H/A:H		
CVE-2021-40851	2021-12-17T17:15:13.173	2024-11-21T06:24:55.740	TCMAN GIM is vulnerable to a lack of authorization in all available webservice methods listed in /PC/WebService.asmx. The exploitation of this vulnerability might allow a remote attacker to obtain information.	7.5	HIGH	CVSS:3.1/AV:N/AC:L/PR:N/UI:N/S:U/C:H/I:N/A:N		
CVE-2021-40852	2021-12-17T17:15:13.233	2024-11-21T06:24:55.907	TCMAN GIM is affected by an open redirect vulnerability. This vulnerability allows the redirection of user navigation to pages controlled by the attacker. The exploitation of this vulnerability might allow a remote attacker to obtain information.	6.1	MEDIUM	CVSS:3.1/AV:N/AC:L/PR:N/UI:R/S:C/C:L/I:L/A:N		
CVE-2021-40853	2021-12-17T17:15:13.297	2024-11-21T06:24:56.063	TCMAN GIM does not perform an authorization check when trying to access determined resources. A remote attacker could exploit this vulnerability to access URL that require privileges without having them. The exploitation of this vulnerability might allow a remote attacker to obtain sensible information.	7.2	HIGH	CVSS:3.1/AV:N/AC:L/PR:N/UI:N/S:C/C:L/I:L/A:N		
CVE-2021-4008	2021-12-17T17:15:13.357	2024-11-21T06:36:42.830	A flaw was found in xorg-x11-server in versions before 21.1.2 and before 1.20.14. An out-of-bounds access can occur in the SProcRenderCompositeGlyphs function. The highest threat from this vulnerability is to data confidentiality and integrity as well as system availability.	7.8	HIGH	CVSS:3.1/AV:L/AC:L/PR:L/UI:N/S:U/C:H/I:H/A:H		
CVE-2021-4009	2021-12-17T17:15:13.417	2024-11-21T06:36:43.000	A flaw was found in xorg-x11-server in versions before 21.1.2 and before 1.20.14. An out-of-bounds access can occur in the SProcXFixesCreatePointerBarrier function. The highest threat from this vulnerability is to data confidentiality and integrity as well as system availability.	7.8	HIGH	CVSS:3.1/AV:L/AC:L/PR:L/UI:N/S:U/C:H/I:H/A:H		
CVE-2021-4010	2021-12-17T17:15:13.473	2024-11-21T06:36:43.153	A flaw was found in xorg-x11-server in versions before 21.1.2 and before 1.20.14. An out-of-bounds access can occur in the SProcScreenSaverSuspend function. The highest threat from this vulnerability is to data confidentiality and integrity as well as system availability.	7.8	HIGH	CVSS:3.1/AV:L/AC:L/PR:L/UI:N/S:U/C:H/I:H/A:H		
CVE-2021-4011	2021-12-17T17:15:13.530	2024-11-21T06:36:43.303	A flaw was found in xorg-x11-server in versions before 21.1.2 and before 1.20.14. An out-of-bounds access can occur in the SwapCreateRegister function. The highest threat from this vulnerability is to data confidentiality and integrity as well as system availability.	7.8	HIGH	CVSS:3.1/AV:L/AC:L/PR:L/UI:N/S:U/C:H/I:H/A:H		
CVE-2021-33430	2021-12-17T19:15:07.500	2024-11-21T06:08:48.743	A Buffer Overflow vulnerability exists in NumPy 1.9.x in the PyArray_NewFromDescr_int function of ctors.c when specifying arrays of large dimensions (over 32) from Python code, which could let a malicious user cause a Denial of Service. NOTE: The vendor does not agree this is a vulneraility; In (very limited) circumstances a user may be able provoke the buffer overflow, the user is most likely already privileged to at least provoke denial of service by exhausting memory. Triggering this further requires the use of uncommon API (complicated structured dtypes), which is very unlikely to be available to an unprivileged user	5.3	MEDIUM	CVSS:3.1/AV:N/AC:H/PR:L/UI:N/S:U/C:N/I:N/A:H		
CVE-2021-34141	2021-12-17T19:15:07.543	2024-11-21T06:09:56.397	"An incomplete string comparison in the numpy.core component in NumPy before 1.22.0 allows attackers to trigger slightly incorrect copying by constructing specific string objects. NOTE: the vendor states that this reported code behavior is ""completely harmless."""	5.3	MEDIUM	CVSS:3.1/AV:N/AC:L/PR:N/UI:N/S:U/C:N/I:N/A:L		
CVE-2021-43838	2021-12-17T19:15:07.683	2024-11-21T06:29:54.097	jsx-slack is a library for building JSON objects for Slack Block Kit surfaces from JSX. In versions prior to 4.5.1 users are vulnerable to a regular expression denial-of-service (ReDoS) attack. If attacker can put a lot of JSX elements into `<blockquote>` tag, an internal regular expression for escaping characters may consume an excessive amount of computing resources. jsx-slack v4.5.1 has patched to a regex for escaping blockquote characters. Users are advised to upgrade as soon as possible.	5.3	MEDIUM	CVSS:3.1/AV:N/AC:L/PR:N/UI:N/S:U/C:N/I:N/A:L		
CVE-2021-43840	2021-12-17T19:15:07.757	2024-11-21T06:29:54.360	message_bus is a messaging bus for Ruby processes and web clients. In versions prior to 3.3.7 users who deployed message bus with diagnostics features enabled (default off) are vulnerable to a path traversal bug, which could lead to disclosure of secret information on a machine if an unintended user were to gain access to the diagnostic route. The impact is also greater if there is no proxy for your web application as the number of steps up the directories is not bounded. For deployments which uses a proxy, the impact varies. For example, If a request goes through a proxy like Nginx with `merge_slashes` enabled, the number of steps up the directories that can be read is limited to 3 levels. This issue has been patched in version 3.3.7. Users unable to upgrade should ensure that MessageBus::Diagnostics is disabled.	4.4	MEDIUM	CVSS:3.1/AV:N/AC:H/PR:H/UI:N/S:U/C:H/I:N/A:N		
CVE-2021-23450	2021-12-17T20:15:08.177	2024-11-21T05:51:46.953	All versions of package dojo are vulnerable to Prototype Pollution via the setObject function.	7.5	HIGH	CVSS:3.1/AV:N/AC:L/PR:N/UI:N/S:U/C:N/I:N/A:H		
CVE-2021-23797	2021-12-17T20:15:08.240	2024-11-21T05:51:53.510	All versions of package http-server-node are vulnerable to Directory Traversal via use of --path-as-is.	7.5	HIGH	CVSS:3.1/AV:N/AC:L/PR:N/UI:N/S:U/C:H/I:N/A:N		
CVE-2021-23803	2021-12-17T20:15:08.287	2024-11-21T05:51:53.627	This affects the package latte/latte before 2.10.6. There is a way to bypass allowFunctions that will affect the security of the application. When the template is set to allow/disallow the use of certain functions, adding control characters (x00-x08) after the function will bypass these restrictions.	9.8	CRITICAL	CVSS:3.1/AV:N/AC:L/PR:N/UI:N/S:U/C:H/I:H/A:H		
CVE-2021-23814	2021-12-17T20:15:08.340	2025-06-17T12:15:20.773	"This affects versions of the package unisharp/laravel-filemanager before 2.6.2. The upload() function does not sufficiently validate the file type when uploading.An attacker may be able to reproduce the following steps:1. Install a package with a web Laravel application.2. Navigate to the Upload window3. Upload an image file, then capture the request4. Edit the request contents with a malicious file (webshell)5. Enter the path of file uploaded on URL - Remote Code Execution**Note:** Prevention for bad extensions can be done by using a whitelist in the config file(lfm.php). Corresponding document can be found in [here](https://unisharp.github.io/laravel-filemanager/configfolder-categories)."	6.7	MEDIUM	CVSS:3.1/AV:N/AC:H/PR:L/UI:R/S:U/C:H/I:H/A:L		
CVE-2021-41495	2021-12-17T20:15:08.477	2024-11-21T06:26:18.940	Null Pointer Dereference vulnerability exists in numpy.sort in NumPy &lt and 1.19 in the PyArray_DescrNew function due to missing return-value validation, which allows attackers to conduct DoS attacks by repetitively creating sort arrays. NOTE: While correct that validation is missing, an error can only occur due to an exhaustion of memory. If the user can exhaust memory, they are already privileged. Further, it should be practically impossible to construct an attack which can target the memory exhaustion to occur at exactly this place	5.3	MEDIUM	CVSS:3.1/AV:N/AC:H/PR:L/UI:N/S:U/C:N/I:N/A:H		
CVE-2021-41496	2021-12-17T20:15:08.517	2024-11-21T06:26:19.130	Buffer overflow in the array_from_pyobj function of fortranobject.c in NumPy < 1.19, which allows attackers to conduct a Denial of Service attacks by carefully constructing an array with negative values. NOTE: The vendor does not agree this is a vulnerability; the negative dimensions can only be created by an already privileged user (or internally)	5.5	MEDIUM	CVSS:3.1/AV:L/AC:L/PR:L/UI:N/S:U/C:N/I:N/A:H		
CVE-2021-41497	2021-12-17T21:15:07.663	2024-11-21T06:26:19.310	Null pointer reference in CMS_Conservative_increment_obj in RaRe-Technologies bounter version 1.01 and 1.10, allows attackers to conduct Denial of Service attacks by inputting a huge width of hash bucket.	7.5	HIGH	CVSS:3.1/AV:N/AC:L/PR:N/UI:N/S:U/C:N/I:N/A:H		
CVE-2021-41498	2021-12-17T21:15:07.700	2024-11-21T06:26:19.470	Buffer overflow in ajaxsoundstudio.com Pyo &lt and 1.03 in the Server_jack_init function. which allows attackers to conduct Denial of Service attacks by arbitrary constructing a overlong server name.	7.5	HIGH	CVSS:3.1/AV:N/AC:L/PR:N/UI:N/S:U/C:N/I:N/A:H		
CVE-2021-41499	2021-12-17T21:15:07.740	2024-11-21T06:26:19.630	Buffer Overflow Vulnerability exists in ajaxsoundstudio.com n Pyo < 1.03 in the Server_debug function, which allows remote attackers to conduct DoS attacks by deliberately passing on an overlong audio file name.	7.5	HIGH	CVSS:3.1/AV:N/AC:L/PR:N/UI:N/S:U/C:N/I:N/A:H		
CVE-2021-41500	2021-12-17T21:15:07.777	2024-11-21T06:26:19.787	Incomplete string comparison vulnerability exits in cvxopt.org cvxop <= 1.2.6 in APIs (cvxopt.cholmod.diag, cvxopt.cholmod.getfactor, cvxopt.cholmod.solve, cvxopt.cholmod.spsolve), which allows attackers to conduct Denial of Service attacks by construct fake Capsule objects.	7.5	HIGH	CVSS:3.1/AV:N/AC:L/PR:N/UI:N/S:U/C:N/I:N/A:H		
CVE-2021-4130	2021-12-18T05:15:08.847	2024-11-21T06:36:57.983	snipe-it is vulnerable to Cross-Site Request Forgery (CSRF)	8.8	HIGH	CVSS:3.1/AV:N/AC:L/PR:N/UI:R/S:U/C:H/I:H/A:H		
CVE-2021-4131	2021-12-18T07:15:06.663	2024-11-21T06:36:58.143	livehelperchat is vulnerable to Cross-Site Request Forgery (CSRF)	8.8	HIGH	CVSS:3.1/AV:N/AC:L/PR:N/UI:R/S:U/C:H/I:H/A:H		
CVE-2021-45105	2021-12-18T12:15:07.433	2024-11-21T06:31:58.170	Apache Log4j2 versions 2.0-alpha1 through 2.16.0 (excluding 2.12.3 and 2.3.1) did not protect from uncontrolled recursion from self-referential lookups. This allows an attacker with control over Thread Context Map data to cause a denial of service when a crafted string is interpreted. This issue was fixed in Log4j 2.17.0, 2.12.3, and 2.3.1.	5.9	MEDIUM	CVSS:3.1/AV:N/AC:H/PR:N/UI:N/S:U/C:N/I:N/A:H		
CVE-2021-43083	2021-12-19T09:15:06.633	2024-11-21T06:28:39.557	Apache PLC4X - PLC4C (Only the C language implementation was effected) was vulnerable to an unsigned integer underflow flaw inside the tcp transport. Users should update to 0.9.1, which addresses this issue. However, in order to exploit this vulnerability, a user would have to actively connect to a mallicious device which could send a response with invalid content. Currently we consider the probability of this being exploited as quite minimal, however this could change in the future, especially with the industrial networks growing more and more together.	8.8	HIGH	CVSS:3.1/AV:N/AC:L/PR:L/UI:N/S:U/C:H/I:H/A:H		
CVE-2021-45041	2021-12-19T09:15:06.853	2024-11-21T06:31:50.993	SuiteCRM before 7.12.2 and 8.x before 8.0.1 allows authenticated SQL injection via the Tooltips action in the Project module, involving resource_id and start_date.	8.8	HIGH	CVSS:3.1/AV:N/AC:L/PR:L/UI:N/S:U/C:H/I:H/A:H		
CVE-2021-4136	2021-12-19T17:15:07.553	2024-11-21T06:36:58.833	vim is vulnerable to Heap-based Buffer Overflow	7.8	HIGH	CVSS:3.1/AV:L/AC:L/PR:N/UI:R/S:U/C:H/I:H/A:H		
CVE-2021-44159	2021-12-20T03:15:06.650	2024-11-21T06:30:28.083	4MOSAn GCB Doctor’s file upload function has improper user privilege control. A remote attacker can upload arbitrary files including webshell files without authentication and execute arbitrary code in order to perform arbitrary system operations or deny of service attack.	9.8	CRITICAL	CVSS:3.1/AV:N/AC:L/PR:N/UI:N/S:U/C:H/I:H/A:H		
CVE-2021-44162	2021-12-20T03:15:06.713	2024-11-21T06:30:28.513	Chain Sea ai chatbot system’s specific file download function has path traversal vulnerability. The function has improper filtering of special characters in URL parameters, which allows a remote attacker to download arbitrary system files without authentication.	7.5	HIGH	CVSS:3.1/AV:N/AC:L/PR:N/UI:N/S:U/C:H/I:N/A:N		
CVE-2021-44163	2021-12-20T03:15:06.770	2024-11-21T06:30:28.650	Chain Sea ai chatbot backend has improper filtering of special characters in URL parameters, which allows a remote attacker to perform JavaScript injection for XSS (reflected Cross-site scripting) attack without authentication.	6.1	MEDIUM	CVSS:3.1/AV:N/AC:L/PR:N/UI:R/S:C/C:L/I:L/A:N		
CVE-2021-44164	2021-12-20T03:15:06.827	2024-11-21T06:30:28.797	Chain Sea ai chatbot system’s file upload function has insufficient filtering for special characters in URLs, which allows a remote attacker to by-pass file type validation, upload malicious script and execute arbitrary code without authentication, in order to take control of the system or terminate service.	9.8	CRITICAL	CVSS:3.1/AV:N/AC:L/PR:N/UI:N/S:U/C:H/I:H/A:H		
CVE-2021-44732	2021-12-20T08:15:06.620	2024-11-21T06:31:28.383	Mbed TLS before 3.0.1 has a double free in certain out-of-memory conditions, as demonstrated by an mbedtls_ssl_set_session() failure.	9.8	CRITICAL	CVSS:3.1/AV:N/AC:L/PR:N/UI:N/S:U/C:H/I:H/A:H		
CVE-2021-42913	2021-12-20T09:15:06.640	2024-11-21T06:28:18.043	The SyncThru Web Service on Samsung SCX-6x55X printers allows an attacker to gain access to a list of SMB users and cleartext passwords by reading the HTML source code. Authentication is not required.	7.5	HIGH	CVSS:3.1/AV:N/AC:L/PR:N/UI:N/S:U/C:H/I:N/A:N		
CVE-2021-44263	2021-12-20T09:15:06.687	2024-11-21T06:30:41.317	Gurock TestRail before 7.2.4 mishandles HTML escaping.	5.4	MEDIUM	CVSS:3.1/AV:N/AC:L/PR:L/UI:R/S:C/C:L/I:L/A:N		
CVE-2021-44554	2021-12-20T09:15:06.727	2024-11-21T06:31:12.863	Thinfinity VirtualUI before 3.0 allows a malicious actor to enumerate users registered in the OS (Windows) through the /changePassword URI. By accessing the vector, an attacker can determine if a username exists thanks to the message returned; it can be presented in different languages according to the configuration of VirtualUI. Common users are administrator, admin, guest and krgtbt.	5.3	MEDIUM	CVSS:3.1/AV:N/AC:L/PR:N/UI:N/S:U/C:L/I:N/A:N		
CVE-2021-44858	2021-12-20T09:15:06.770	2024-11-21T06:31:37.320	An issue was discovered in MediaWiki before 1.35.5, 1.36.x before 1.36.3, and 1.37.x before 1.37.1. It is possible to use action=edit&undo= followed by action=mcrundo and action=mcrrestore to view private pages on a private wiki that has at least one page set in $wgWhitelistRead.	7.5	HIGH	CVSS:3.1/AV:N/AC:L/PR:N/UI:N/S:U/C:H/I:N/A:N		
CVE-2021-41561	2021-12-20T12:15:07.333	2025-07-28T14:54:17.610	Improper Input Validation vulnerability in Parquet-MR of Apache Parquet allows an attacker to DoS by malicious Parquet files. This issue affects Apache Parquet-MR version 1.9.0 and later versions.	7.5	HIGH	CVSS:3.1/AV:N/AC:L/PR:N/UI:N/S:U/C:N/I:N/A:H		
