CVE ID	Published Date	Last Modified Date	Description	Base Score	Base Severity	Vector String	Vendor	Product
CVE-2021-40809	2021-12-01T01:15:07.490	2024-11-21T06:24:49.427	An issue was discovered in Jamf Pro before 10.32.0, aka PI-009921. An account can be granted incorrect privileges in response to authentication that uses specific sign-on workflows.	8.8	HIGH	CVSS:3.1/AV:N/AC:L/PR:L/UI:N/S:U/C:H/I:H/A:H		
CVE-2021-43358	2021-12-01T02:15:07.257	2024-11-21T06:29:07.480	Sunnet eHRD has inadequate filtering for special characters in URLs, which allows a remote attacker to perform path traversal attacks without authentication, access restricted paths and download system files.	7.5	HIGH	CVSS:3.1/AV:N/AC:L/PR:N/UI:N/S:U/C:H/I:N/A:N		
CVE-2021-43359	2021-12-01T02:15:07.343	2024-11-21T06:29:07.600	Sunnet eHRD has broken access control vulnerability, which allows a remote attacker to access account management page after being authenticated as a general user, then perform privilege escalation to execute arbitrary code and control the system or interrupt services.	8.8	HIGH	CVSS:3.1/AV:N/AC:L/PR:L/UI:N/S:U/C:H/I:H/A:H		
CVE-2021-43360	2021-12-01T02:15:07.433	2024-11-21T06:29:07.763	Sunnet eHRD e-mail delivery task schedule’s serialization function has inadequate input object validation and restriction, which allows a post-authenticated remote attacker with database access privilege, to execute arbitrary code and control the system or interrupt services.	8.8	HIGH	CVSS:3.1/AV:N/AC:L/PR:L/UI:N/S:U/C:H/I:H/A:H		
CVE-2021-20847	2021-12-01T03:15:06.590	2024-11-21T05:47:16.443	Cross-site scripting vulnerability in Wi-Fi STATION SH-52A (38JP_1_11G, 38JP_1_11J, 38JP_1_11K, 38JP_1_11L, 38JP_1_26F, 38JP_1_26G, 38JP_1_26J, 38JP_2_03B, and 38JP_2_03C) allows a remote unauthenticated attacker to inject an arbitrary script via WebUI of the device.	6.1	MEDIUM	CVSS:3.1/AV:N/AC:L/PR:N/UI:R/S:C/C:L/I:L/A:N		
CVE-2021-20851	2021-12-01T03:15:06.663	2024-11-21T05:47:16.773	Cross-site request forgery (CSRF) vulnerability in Browser and Operating System Finder versions prior to 1.2 allows a remote unauthenticated attacker to hijack the authentication of an administrator via unspecified vectors.	8.8	HIGH	CVSS:3.1/AV:N/AC:L/PR:N/UI:R/S:U/C:H/I:H/A:H		
CVE-2021-20852	2021-12-01T03:15:06.713	2024-11-21T05:47:16.880	Buffer overflow vulnerability in ELECOM LAN routers (WRH-733GBK firmware v1.02.9 and prior and WRH-733GWH firmware v1.02.9 and prior) allows a network-adjacent attacker with an administrator privilege to execute an arbitrary OS command via unspecified vectors.	6.8	MEDIUM	CVSS:3.1/AV:A/AC:L/PR:H/UI:N/S:U/C:H/I:H/A:H		
CVE-2021-20853	2021-12-01T03:15:06.757	2024-11-21T05:47:16.980	ELECOM LAN routers (WRH-733GBK firmware v1.02.9 and prior and WRH-733GWH firmware v1.02.9 and prior) allows a network-adjacent attacker with an administrator privilege to execute arbitrary OS commands via unspecified vectors.	6.8	MEDIUM	CVSS:3.1/AV:A/AC:L/PR:H/UI:N/S:U/C:H/I:H/A:H		
CVE-2021-20854	2021-12-01T03:15:06.807	2024-11-21T05:47:17.090	ELECOM LAN routers (WRH-733GBK firmware v1.02.9 and prior and WRH-733GWH firmware v1.02.9 and prior) allows a network-adjacent attacker with an administrator privilege to execute arbitrary OS commands via unspecified vectors.	6.8	MEDIUM	CVSS:3.1/AV:A/AC:L/PR:H/UI:N/S:U/C:H/I:H/A:H		
CVE-2021-20855	2021-12-01T03:15:06.850	2024-11-21T05:47:17.197	Cross-site scripting vulnerability in ELECOM LAN routers (WRH-733GBK firmware v1.02.9 and prior and WRH-733GWH firmware v1.02.9 and prior) allows a remote authenticated attacker to inject an arbitrary script via unspecified vectors.	5.4	MEDIUM	CVSS:3.1/AV:N/AC:L/PR:L/UI:R/S:C/C:L/I:L/A:N		
CVE-2021-20856	2021-12-01T03:15:06.897	2024-11-21T05:47:17.300	Cross-site scripting vulnerability in ELECOM LAN routers (WRH-733GBK firmware v1.02.9 and prior and WRH-733GWH firmware v1.02.9 and prior) allows a remote authenticated attacker to inject an arbitrary script via unspecified vectors.	5.4	MEDIUM	CVSS:3.1/AV:N/AC:L/PR:L/UI:R/S:C/C:L/I:L/A:N		
CVE-2021-20857	2021-12-01T03:15:06.940	2024-11-21T05:47:17.400	Cross-site scripting vulnerability in ELECOM LAN router WRC-2533GHBK-I firmware v1.20 and prior allows a remote authenticated attacker to inject an arbitrary script via unspecified vectors.	5.4	MEDIUM	CVSS:3.1/AV:N/AC:L/PR:L/UI:R/S:C/C:L/I:L/A:N		
CVE-2021-20858	2021-12-01T03:15:06.983	2024-11-21T05:47:17.500	Cross-site scripting vulnerability in ELECOM LAN router WRC-2533GHBK-I firmware v1.20 and prior allows a remote authenticated attacker to inject an arbitrary script via unspecified vectors.	5.4	MEDIUM	CVSS:3.1/AV:N/AC:L/PR:L/UI:R/S:C/C:L/I:L/A:N		
CVE-2021-20859	2021-12-01T03:15:07.030	2024-11-21T05:47:17.597	ELECOM LAN routers (WRC-1167GST2 firmware v1.25 and prior, WRC-1167GST2A firmware v1.25 and prior, WRC-1167GST2H firmware v1.25 and prior, WRC-2533GS2-B firmware v1.52 and prior, WRC-2533GS2-W firmware v1.52 and prior, WRC-1750GS firmware v1.03 and prior, WRC-1750GSV firmware v2.11 and prior, WRC-1900GST firmware v1.03 and prior, WRC-2533GST firmware v1.03 and prior, WRC-2533GSTA firmware v1.03 and prior, WRC-2533GST2 firmware v1.25 and prior, WRC-2533GST2SP firmware v1.25 and prior, WRC-2533GST2-G firmware v1.25 and prior, and EDWRC-2533GST2 firmware v1.25 and prior) allows a network-adjacent authenticated attacker to execute an arbitrary OS command via unspecified vectors.	8.0	HIGH	CVSS:3.1/AV:A/AC:L/PR:L/UI:N/S:U/C:H/I:H/A:H		
CVE-2021-20860	2021-12-01T03:15:07.080	2024-11-21T05:47:17.730	Cross-site request forgery (CSRF) vulnerability in ELECOM LAN routers (WRC-1167GST2 firmware v1.25 and prior, WRC-1167GST2A firmware v1.25 and prior, WRC-1167GST2H firmware v1.25 and prior, WRC-2533GS2-B firmware v1.52 and prior, WRC-2533GS2-W firmware v1.52 and prior, WRC-1750GS firmware v1.03 and prior, WRC-1750GSV firmware v2.11 and prior, WRC-1900GST firmware v1.03 and prior, WRC-2533GST firmware v1.03 and prior, WRC-2533GSTA firmware v1.03 and prior, WRC-2533GST2 firmware v1.25 and prior, WRC-2533GST2SP firmware v1.25 and prior, WRC-2533GST2-G firmware v1.25 and prior, and EDWRC-2533GST2 firmware v1.25 and prior) allows a remote authenticated attacker to hijack the authentication of an administrator via a specially crafted page.	8.8	HIGH	CVSS:3.1/AV:N/AC:L/PR:N/UI:R/S:U/C:H/I:H/A:H		
CVE-2021-20861	2021-12-01T03:15:07.130	2024-11-21T05:47:17.850	Improper access control vulnerability in ELECOM LAN routers (WRC-1167GST2 firmware v1.25 and prior, WRC-1167GST2A firmware v1.25 and prior, WRC-1167GST2H firmware v1.25 and prior, WRC-2533GS2-B firmware v1.52 and prior, WRC-2533GS2-W firmware v1.52 and prior, WRC-1750GS firmware v1.03 and prior, WRC-1750GSV firmware v2.11 and prior, WRC-1900GST firmware v1.03 and prior, WRC-2533GST firmware v1.03 and prior, WRC-2533GSTA firmware v1.03 and prior, WRC-2533GST2 firmware v1.25 and prior, WRC-2533GST2SP firmware v1.25 and prior, WRC-2533GST2-G firmware v1.25 and prior, and EDWRC-2533GST2 firmware v1.25 and prior) allows a network-adjacent authenticated attacker to bypass access restriction and to access the management screen of the product via unspecified vectors.	8.8	HIGH	CVSS:3.1/AV:A/AC:L/PR:N/UI:N/S:U/C:H/I:H/A:H		
CVE-2021-20862	2021-12-01T03:15:07.173	2024-11-21T05:47:17.973	Improper access control vulnerability in ELECOM routers (WRC-1167GST2 firmware v1.25 and prior, WRC-1167GST2A firmware v1.25 and prior, WRC-1167GST2H firmware v1.25 and prior, WRC-2533GS2-B firmware v1.52 and prior, WRC-2533GS2-W firmware v1.52 and prior, WRC-1750GS firmware v1.03 and prior, WRC-1750GSV firmware v2.11 and prior, WRC-1900GST firmware v1.03 and prior, WRC-2533GST firmware v1.03 and prior, WRC-2533GSTA firmware v1.03 and prior, WRC-2533GST2 firmware v1.25 and prior, WRC-2533GST2SP firmware v1.25 and prior, WRC-2533GST2-G firmware v1.25 and prior, and EDWRC-2533GST2 firmware v1.25 and prior) allows a network-adjacent unauthenticated attacker to bypass access restriction, and to obtain anti-CSRF tokens and change the product's settings via unspecified vectors.	4.3	MEDIUM	CVSS:3.1/AV:A/AC:L/PR:N/UI:N/S:U/C:N/I:L/A:N		
CVE-2021-20863	2021-12-01T03:15:07.223	2024-11-21T05:47:18.100	OS command injection vulnerability in ELECOM routers (WRC-1167GST2 firmware v1.25 and prior, WRC-1167GST2A firmware v1.25 and prior, WRC-1167GST2H firmware v1.25 and prior, WRC-2533GS2-B firmware v1.52 and prior, WRC-2533GS2-W firmware v1.52 and prior, WRC-1750GS firmware v1.03 and prior, WRC-1750GSV firmware v2.11 and prior, WRC-1900GST firmware v1.03 and prior, WRC-2533GST firmware v1.03 and prior, WRC-2533GSTA firmware v1.03 and prior, WRC-2533GST2 firmware v1.25 and prior, WRC-2533GST2SP firmware v1.25 and prior, WRC-2533GST2-G firmware v1.25 and prior, and EDWRC-2533GST2 firmware v1.25 and prior) allows a network-adjacent authenticated attackers to execute an arbitrary OS command with the root privilege via unspecified vectors.	8.0	HIGH	CVSS:3.1/AV:A/AC:L/PR:L/UI:N/S:U/C:H/I:H/A:H		
CVE-2021-20864	2021-12-01T03:15:07.273	2024-11-21T05:47:18.223	Improper access control vulnerability in ELECOM routers (WRC-1167GST2 firmware v1.25 and prior, WRC-1167GST2A firmware v1.25 and prior, WRC-1167GST2H firmware v1.25 and prior, WRC-2533GS2-B firmware v1.52 and prior, WRC-2533GS2-W firmware v1.52 and prior, WRC-1750GS firmware v1.03 and prior, WRC-1750GSV firmware v2.11 and prior, WRC-1900GST firmware v1.03 and prior, WRC-2533GST firmware v1.03 and prior, WRC-2533GSTA firmware v1.03 and prior, WRC-2533GST2 firmware v1.25 and prior, WRC-2533GST2SP firmware v1.25 and prior, WRC-2533GST2-G firmware v1.25 and prior, and EDWRC-2533GST2 firmware v1.25 and prior) allows a network-adjacent unauthenticated attacker to bypass access restriction, and to start the telnet service and execute an arbitrary OS command via unspecified vectors.	8.8	HIGH	CVSS:3.1/AV:A/AC:L/PR:N/UI:N/S:U/C:H/I:H/A:H		
CVE-2021-34599	2021-12-01T09:15:06.627	2024-11-21T06:10:47.380	Affected versions of CODESYS Git in Versions prior to V1.1.0.0 lack certificate validation in HTTPS handshakes. CODESYS Git does not implement certificate validation by default, so it does not verify that the server provides a valid and trusted HTTPS certificate. Since the certificate of the server to which the connection is made is not properly verified, the server connection is vulnerable to a man-in-the-middle attack.	7.4	HIGH	CVSS:3.1/AV:N/AC:H/PR:N/UI:N/S:U/C:H/I:H/A:N		
CVE-2021-4018	2021-12-01T10:15:07.730	2024-11-21T06:36:43.863	snipe-it is vulnerable to Improper Neutralization of Input During Web Page Generation ('Cross-site Scripting')	5.4	MEDIUM	CVSS:3.1/AV:N/AC:L/PR:L/UI:R/S:C/C:L/I:L/A:N		
CVE-2021-4019	2021-12-01T10:15:07.913	2024-11-21T06:36:44.037	vim is vulnerable to Heap-based Buffer Overflow	7.8	HIGH	CVSS:3.1/AV:L/AC:L/PR:N/UI:R/S:U/C:H/I:H/A:H		
CVE-2021-3984	2021-12-01T11:15:07.797	2024-11-21T06:23:18.473	vim is vulnerable to Heap-based Buffer Overflow	7.8	HIGH	CVSS:3.1/AV:L/AC:L/PR:N/UI:R/S:U/C:H/I:H/A:H		
CVE-2021-3985	2021-12-01T11:15:07.867	2024-11-21T06:23:18.640	kimai2 is vulnerable to Improper Neutralization of Input During Web Page Generation ('Cross-site Scripting')	9.0	CRITICAL	CVSS:3.1/AV:N/AC:L/PR:L/UI:R/S:C/C:H/I:H/A:H		
CVE-2021-3989	2021-12-01T11:15:07.923	2024-11-21T06:23:19.220	showdoc is vulnerable to URL Redirection to Untrusted Site	6.1	MEDIUM	CVSS:3.1/AV:N/AC:L/PR:N/UI:R/S:C/C:L/I:L/A:N		
CVE-2021-3990	2021-12-01T11:15:07.977	2024-11-21T06:23:19.470	showdoc is vulnerable to Use of Cryptographically Weak Pseudo-Random Number Generator (PRNG)	6.5	MEDIUM	CVSS:3.1/AV:N/AC:L/PR:N/UI:R/S:U/C:H/I:N/A:N		
CVE-2021-3992	2021-12-01T11:15:08.037	2024-11-21T06:23:19.783	kimai2 is vulnerable to Improper Access Control	6.5	MEDIUM	CVSS:3.1/AV:N/AC:L/PR:L/UI:N/S:U/C:H/I:N/A:N		
CVE-2021-3993	2021-12-01T11:15:08.097	2024-11-21T06:23:19.927	showdoc is vulnerable to Cross-Site Request Forgery (CSRF)	6.5	MEDIUM	CVSS:3.1/AV:N/AC:L/PR:N/UI:R/S:U/C:N/I:H/A:N		
CVE-2021-3994	2021-12-01T11:15:08.153	2024-11-21T06:23:20.067	django-helpdesk is vulnerable to Improper Neutralization of Input During Web Page Generation ('Cross-site Scripting')	9.6	CRITICAL	CVSS:3.1/AV:N/AC:L/PR:N/UI:R/S:C/C:H/I:H/A:H		
CVE-2021-4015	2021-12-01T11:15:08.210	2024-11-21T06:36:43.463	firefly-iii is vulnerable to Cross-Site Request Forgery (CSRF)	4.3	MEDIUM	CVSS:3.1/AV:N/AC:L/PR:N/UI:R/S:U/C:N/I:L/A:N		
CVE-2021-4017	2021-12-01T11:15:08.273	2024-11-21T06:36:43.727	showdoc is vulnerable to Cross-Site Request Forgery (CSRF)	8.8	HIGH	CVSS:3.1/AV:N/AC:L/PR:N/UI:R/S:U/C:H/I:H/A:H		
CVE-2021-32592	2021-12-01T12:15:07.560	2024-11-21T06:07:20.310	An unsafe search path vulnerability in FortiClientWindows 7.0.0, 6.4.6 and below, 6.2.x, 6.0.x and FortiClientEMS 7.0.0, 6.4.6 and below, 6.2.x, 6.0.x may allow an attacker to perform a DLL Hijack attack on affected devices via a malicious OpenSSL engine library in the search path.	7.8	HIGH	CVSS:3.1/AV:L/AC:L/PR:L/UI:N/S:U/C:H/I:H/A:H		
CVE-2021-3964	2021-12-01T12:15:07.627	2024-11-21T06:23:14.783	elgg is vulnerable to Authorization Bypass Through User-Controlled Key	5.9	MEDIUM	CVSS:3.1/AV:N/AC:H/PR:N/UI:N/S:U/C:N/I:H/A:N		
CVE-2021-3983	2021-12-01T12:15:07.683	2024-11-21T06:23:18.333	kimai2 is vulnerable to Improper Neutralization of Input During Web Page Generation ('Cross-site Scripting')	6.1	MEDIUM	CVSS:3.1/AV:N/AC:L/PR:N/UI:R/S:C/C:L/I:L/A:N		
CVE-2021-43690	2021-12-01T13:15:07.543	2024-11-21T06:29:37.520	YurunProxy v0.01 is affected by a Cross Site Scripting (XSS) vulnerability in src/Client.php. The exit function will terminate the script and print a message which have values from the socket_read.	6.1	MEDIUM	CVSS:3.1/AV:N/AC:L/PR:N/UI:R/S:C/C:L/I:L/A:N		
CVE-2021-44280	2021-12-01T13:15:07.710	2024-11-21T06:30:42.513	attendance management system 1.0 is affected by a SQL injection vulnerability in admin/incFunctions.php through the makeSafe function.	9.8	CRITICAL	CVSS:3.1/AV:N/AC:L/PR:N/UI:N/S:U/C:H/I:H/A:H		
CVE-2021-25967	2021-12-01T14:15:07.737	2024-11-21T05:55:41.713	In CKAN, versions 2.9.0 to 2.9.3 are affected by a stored XSS vulnerability via SVG file upload of users’ profile picture. This allows low privileged application users to store malicious scripts in their profile picture. These scripts are executed in a victim’s browser when they open the malicious profile picture	5.4	MEDIUM	CVSS:3.1/AV:N/AC:L/PR:L/UI:R/S:C/C:L/I:L/A:N		
CVE-2021-44277	2021-12-01T14:15:07.910	2024-11-21T06:30:42.003	Librenms 21.11.0 is affected by a Cross Site Scripting (XSS) vulnerability in includes/html/common/alert-log.inc.php.	6.1	MEDIUM	CVSS:3.1/AV:N/AC:L/PR:N/UI:R/S:C/C:L/I:L/A:N		
CVE-2021-44279	2021-12-01T14:15:07.950	2024-11-21T06:30:42.337	Librenms 21.11.0 is affected by a Cross Site Scripting (XSS) vulnerability in includes/html/forms/poller-groups.inc.php.	6.1	MEDIUM	CVSS:3.1/AV:N/AC:L/PR:N/UI:R/S:C/C:L/I:L/A:N		
CVE-2021-40154	2021-12-01T15:15:07.603	2024-11-21T06:23:40.750	NXP LPC55S69 devices before A3 have a buffer over-read via a crafted wlength value in a GET Descriptor Configuration request during use of USB In-System Programming (ISP) mode. This discloses protected flash memory.	6.1	MEDIUM	CVSS:3.1/AV:L/AC:L/PR:L/UI:N/S:U/C:H/I:N/A:L		
CVE-2021-43689	2021-12-01T15:15:07.657	2024-11-21T06:29:37.370	manage (last update Oct 24, 2017) is affected by a Cross Site Scripting (XSS) vulnerability in Application/Home/Controller/GoodsController.class.php. The exit function will terminate the script and print a message which have values from $_POST.	6.1	MEDIUM	CVSS:3.1/AV:N/AC:L/PR:N/UI:R/S:C/C:L/I:L/A:N		
CVE-2021-44479	2021-12-01T15:15:07.703	2024-11-21T06:31:02.983	NXP Kinetis K82 devices have a buffer over-read via a crafted wlength value in a GET Status-Other request during use of USB In-System Programming (ISP) mode. This discloses protected flash memory.	6.1	MEDIUM	CVSS:3.1/AV:L/AC:L/PR:L/UI:N/S:U/C:H/I:N/A:L		
CVE-2020-10627	2021-12-01T16:15:07.390	2024-11-21T04:55:43.637	Insulet Omnipod Insulin Management System insulin pump product ID 19191 and 40160 is designed to communicate using a wireless RF with an Insulet manufactured Personal Diabetes Manager device. This wireless RF communication protocol does not properly implement authentication or authorization. An attacker with access to one of the affected insulin pump models may be able to modify and/or intercept data. This vulnerability could also allow attackers to change pump settings and control insulin delivery.	7.3	HIGH	CVSS:3.1/AV:L/AC:L/PR:N/UI:N/S:U/C:L/I:H/A:L		
CVE-2021-20609	2021-12-01T16:15:07.467	2024-11-21T05:46:52.170	Uncontrolled Resource Consumption vulnerability in Mitsubishi Electric MELSEC iQ-R Series R00/01/02CPU, MELSEC iQ-R Series R04/08/16/32/120(EN)CPU, MELSEC iQ-R Series R08/16/32/120SFCPU, MELSEC iQ-R Series R08/16/32/120PCPU, MELSEC iQ-R Series R08/16/32/120PSFCPU, MELSEC iQ-R Series R16/32/64MTCPU, MELSEC iQ-R Series R12CCPU-V, MELSEC Q Series Q03UDECPU, MELSEC Q Series Q04/06/10/13/20/26/50/100UDEHCPU, MELSEC Q Series Q03/04/06/13/26UDVCPU, MELSEC Q Series Q04/06/13/26UDPVCPU, MELSEC Q Series Q12DCCPU-V, MELSEC Q Series Q24DHCCPU-V(G), MELSEC Q Series Q24/26DHCCPU-LS, MELSEC Q Series MR-MQ100, MELSEC Q Series Q172/173DCPU-S1, MELSEC Q Series Q172/173DSCPU, MELSEC Q Series Q170MCPU, MELSEC Q Series Q170MSCPU(-S1), MELSEC L Series L02/06/26CPU(-P), MELSEC L Series L26CPU-(P)BT and MELIPC Series MI5122-VW allows a remote unauthenticated attacker to cause a denial-of-service (DoS) condition by sending specially crafted packets. System reset is required for recovery.	7.5	HIGH	CVSS:3.1/AV:N/AC:L/PR:N/UI:N/S:U/C:N/I:N/A:H		
CVE-2021-20610	2021-12-01T16:15:07.510	2024-11-21T05:46:52.427	Improper Handling of Length Parameter Inconsistency vulnerability in Mitsubishi Electric MELSEC iQ-R Series R00/01/02CPU, MELSEC iQ-R Series R04/08/16/32/120(EN)CPU, MELSEC iQ-R Series R08/16/32/120SFCPU, MELSEC iQ-R Series R08/16/32/120PCPU, MELSEC iQ-R Series R08/16/32/120PSFCPU, MELSEC iQ-R Series R16/32/64MTCPU, MELSEC iQ-R Series R12CCPU-V, MELSEC Q Series Q03UDECPU, MELSEC Q Series Q04/06/10/13/20/26/50/100UDEHCPU, MELSEC Q Series Q03/04/06/13/26UDVCPU, MELSEC Q Series Q04/06/13/26UDPVCPU, MELSEC Q Series Q12DCCPU-V, MELSEC Q Series Q24DHCCPU-V(G), MELSEC Q Series Q24/26DHCCPU-LS, MELSEC Q Series MR-MQ100, MELSEC Q Series Q172/173DCPU-S1, MELSEC Q Series Q172/173DSCPU, MELSEC Q Series Q170MCPU, MELSEC Q Series Q170MSCPU(-S1), MELSEC L Series L02/06/26CPU(-P), MELSEC L Series L26CPU-(P)BT and MELIPC Series MI5122-VW allows a remote unauthenticated attacker to cause a denial-of-service (DoS) condition by sending specially crafted packets. System reset is required for recovery.	7.5	HIGH	CVSS:3.1/AV:N/AC:L/PR:N/UI:N/S:U/C:N/I:N/A:H		
CVE-2021-20611	2021-12-01T16:15:07.550	2024-11-21T05:46:52.650	Improper Input Validation vulnerability in Mitsubishi Electric MELSEC iQ-R Series R00/01/02CPU, MELSEC iQ-R Series R04/08/16/32/120(EN)CPU, MELSEC iQ-R Series R08/16/32/120SFCPU, MELSEC iQ-R Series R08/16/32/120PCPU, MELSEC iQ-R Series R08/16/32/120PSFCPU, MELSEC iQ-R Series R16/32/64MTCPU, MELSEC iQ-R Series R12CCPU-V, MELSEC Q Series Q03UDECPU, MELSEC Q Series Q04/06/10/13/20/26/50/100UDEHCPU, MELSEC Q Series Q03/04/06/13/26UDVCPU, MELSEC Q Series Q04/06/13/26UDPVCPU, MELSEC Q Series Q12DCCPU-V, MELSEC Q Series Q24DHCCPU-V(G), MELSEC Q Series Q24/26DHCCPU-LS, MELSEC Q Series MR-MQ100, MELSEC Q Series Q172/173DCPU-S1, MELSEC Q Series Q172/173DSCPU, MELSEC Q Series Q170MCPU, MELSEC Q Series Q170MSCPU(-S1), MELSEC L Series L02/06/26CPU(-P), MELSEC L Series L26CPU-(P)BT and MELIPC Series MI5122-VW allows a remote unauthenticated attacker to cause a denial-of-service (DoS) condition by sending specially crafted packets. System reset is required for recovery.	7.5	HIGH	CVSS:3.1/AV:N/AC:L/PR:N/UI:N/S:U/C:N/I:N/A:H		
CVE-2021-26334	2021-12-01T16:15:07.590	2024-11-21T05:56:07.740	The AMDPowerProfiler.sys driver of AMD μProf tool may allow lower privileged users to access MSRs in kernel which may lead to privilege escalation and ring-0 code execution by the lower privileged user.	9.9	CRITICAL	CVSS:3.1/AV:N/AC:L/PR:L/UI:N/S:C/C:H/I:H/A:H		
CVE-2021-43685	2021-12-01T16:15:07.737	2024-11-21T06:29:36.903	libretime hv3.0.0-alpha.10 is affected by a path manipulation vulnerability in /blob/master/legacy/application/modules/rest/controllers/ShowImageController.php through the rename function.	9.8	CRITICAL	CVSS:3.1/AV:N/AC:L/PR:N/UI:N/S:U/C:H/I:H/A:H		
CVE-2021-43687	2021-12-01T16:15:07.777	2024-11-21T06:29:37.210	chamilo-lms v1.11.14 is affected by a Cross Site Scripting (XSS) vulnerability in /plugin/jcapture/applet.php if an attacker passes a message hex2bin in the cookie.	6.1	MEDIUM	CVSS:3.1/AV:N/AC:L/PR:N/UI:R/S:C/C:L/I:L/A:N		
CVE-2021-44480	2021-12-01T16:15:07.817	2024-11-21T06:31:03.153	Wokka Lokka Q50 devices through 2021-11-30 allow remote attackers (who know the SIM phone number and password) to listen to a device's surroundings via a callback in an SMS command, as demonstrated by the 123456 and 523681 default passwords.	8.1	HIGH	CVSS:3.1/AV:N/AC:H/PR:N/UI:N/S:U/C:H/I:H/A:H		
CVE-2021-20400	2021-12-01T17:15:07.387	2024-11-21T05:46:31.310	IBM QRadar SIEM 7.3 and 7.4 uses weaker than expected cryptographic algorithms that could allow an attacker to decrypt highly sensitive information. IBM X-Force ID: 196074.	7.5	HIGH	CVSS:3.1/AV:N/AC:L/PR:N/UI:N/S:U/C:H/I:N/A:N		
CVE-2021-29779	2021-12-01T17:15:07.443	2024-11-21T06:01:47.513	IBM QRadar SIEM 7.3 and 7.4 could allow an attacker to obtain sensitive information due to the server performing key exchange without entity authentication on inter-host communications using man in the middle techniques. IBM X-Force ID: 203033.	5.9	MEDIUM	CVSS:3.1/AV:N/AC:H/PR:N/UI:N/S:U/C:H/I:N/A:N		
CVE-2021-29849	2021-12-01T17:15:07.487	2024-11-21T06:01:54.927	IBM QRadar SIEM 7.3 and 7.4 is vulnerable to cross-site scripting. This vulnerability allows users to embed arbitrary JavaScript code in the Web UI thus altering the intended functionality potentially leading to credentials disclosure within a trusted session. IBM X-Force ID: 205281.	6.1	MEDIUM	CVSS:3.1/AV:N/AC:L/PR:N/UI:R/S:C/C:L/I:L/A:N		
CVE-2021-29863	2021-12-01T17:15:07.533	2024-11-21T06:01:56.267	IBM QRadar SIEM 7.3 and 7.4 is vulnerable to server side request forgery (SSRF). This may allow an authenticated attacker to send unauthorized requests from the system, potentially leading to network enumeration or facilitating other attacks. This vulnerability is due to an incomplete fix for CVE-2020-4786. IBM X-Force ID: 206087.	4.3	MEDIUM	CVSS:3.1/AV:N/AC:L/PR:L/UI:N/S:U/C:L/I:N/A:N		
CVE-2021-42776	2021-12-01T17:15:07.583	2024-11-21T06:28:09.150	CloverDX Server before 5.11.2 and and 5.12.x before 5.12.1 allows XXE during configuration import.	7.7	HIGH	CVSS:3.1/AV:N/AC:L/PR:L/UI:N/S:C/C:H/I:N/A:N		
CVE-2021-38575	2021-12-01T18:15:07.760	2024-11-21T06:17:32.553	NetworkPkg/IScsiDxe has remotely exploitable buffer overflows.	8.1	HIGH	CVSS:3.1/AV:N/AC:H/PR:N/UI:N/S:U/C:H/I:H/A:H		
CVE-2021-43451	2021-12-01T19:15:07.747	2024-11-21T06:29:15.007	SQL Injection vulnerability exists in PHPGURUKUL Employee Record Management System 1.2 via the Email POST parameter in /forgetpassword.php.	9.8	CRITICAL	CVSS:3.1/AV:N/AC:L/PR:N/UI:N/S:U/C:H/I:H/A:H		
CVE-2021-41039	2021-12-01T20:15:07.933	2024-11-21T06:25:20.313	In versions 1.6 to 2.0.11 of Eclipse Mosquitto, an MQTT v5 client connecting with a large number of user-property properties could cause excessive CPU usage, leading to a loss of performance and possible denial of service.	7.5	HIGH	CVSS:3.1/AV:N/AC:L/PR:N/UI:N/S:U/C:N/I:N/A:H		
CVE-2021-43137	2021-12-01T20:15:08.327	2024-11-21T06:28:43.250	Cross-Site Scripting (XSS) and Cross-Site Request Forgery (CSRF) vulnerability exits in hostel management system 2.1 via the name field in my-profile.php. Chaining to this both vulnerabilities leads to account takeover.	8.8	HIGH	CVSS:3.1/AV:N/AC:L/PR:N/UI:R/S:U/C:H/I:H/A:H		
CVE-2021-43792	2021-12-01T20:15:08.433	2024-11-21T06:29:47.963	"Discourse is an open source discussion platform. In affected versions a vulnerability affects users of tag groups who use the ""Tags are visible only to the following groups"" feature. A tag group may only allow a certain group (e.g. staff) to view certain tags. Users who were tracking or watching the tags via /preferences/tags, then have their staff status revoked will still see notifications related to the tag, but will not see the tag on each topic. This issue has been patched in stable version 2.7.11. Users are advised to upgrade as soon as possible."	4.3	MEDIUM	CVSS:3.1/AV:N/AC:L/PR:L/UI:N/S:U/C:L/I:N/A:N		
CVE-2021-43793	2021-12-01T20:15:08.587	2024-11-21T06:29:48.100	Discourse is an open source discussion platform. In affected versions a vulnerability in the Polls feature allowed users to vote multiple times in a single-option poll. The problem is patched in the latest tests-passed, beta and stable versions of Discourse	4.3	MEDIUM	CVSS:3.1/AV:N/AC:L/PR:L/UI:N/S:U/C:N/I:L/A:N		
CVE-2021-43794	2021-12-01T20:15:08.727	2024-11-21T06:29:48.233	Discourse is an open source discussion platform. In affected versions an attacker can poison the cache for anonymous (i.e. not logged in) users, such that the users are shown a JSON blob instead of the HTML page. This can lead to a partial denial-of-service. This issue is patched in the latest stable, beta and tests-passed versions of Discourse.	5.3	MEDIUM	CVSS:3.1/AV:N/AC:L/PR:N/UI:N/S:U/C:N/I:N/A:L		
CVE-2021-33265	2021-12-01T22:15:07.557	2024-11-21T06:08:34.490	D-Link DIR-809 devices with firmware through DIR-809Ax_FW1.12WWB03_20190410 were discovered to contain a stack buffer overflow vulnerability in the function FUN_80046eb4 in /formSetPortTr. This vulnerability is triggered via a crafted POST request.	9.8	CRITICAL	CVSS:3.1/AV:N/AC:L/PR:N/UI:N/S:U/C:H/I:H/A:H		
