CVE ID	Published Date	Last Modified Date	Description	Base Score	Base Severity	Vector String	Vendor	Product
CVE-2022-30620	2022-07-18T13:15:09.953	2024-11-21T07:03:02.507	"On Cellinx Camera with guest enabled, attacker with web access can elevate privileges to administrative: ""1"" to ""0"" privileges by changing the following cookie values from ""is_admin"", ""showConfig"". Administrative Privileges which allows changing various configuration in the camera."	8.2	HIGH	CVSS:3.1/AV:N/AC:L/PR:L/UI:R/S:C/C:L/I:L/A:H		
CVE-2022-30621	2022-07-18T13:15:10.007	2024-11-21T07:03:02.637	"Allows a remote user to read files on the camera's OS ""GetFileContent.cgi"". Reading arbitrary files on the camera's OS as root user."	7.6	HIGH	CVSS:3.1/AV:N/AC:L/PR:L/UI:R/S:C/C:N/I:L/A:H		
CVE-2022-30623	2022-07-18T13:15:10.073	2024-11-21T07:03:02.903	The server checks the user's cookie in a non-standard way, and a value is entered in the cookie value name of the status and its value is set to true to bypass the identification with the system using a username and password.	5.9	MEDIUM	CVSS:3.1/AV:L/AC:L/PR:N/UI:N/S:U/C:L/I:L/A:L		
CVE-2022-30624	2022-07-18T13:15:10.133	2024-11-21T07:03:03.040	Browsing the admin.html page allows the user to reset the admin password. Also appears in the JS code for the password.	6.8	MEDIUM	CVSS:3.1/AV:L/AC:L/PR:N/UI:N/S:C/C:L/I:L/A:L		
CVE-2022-30625	2022-07-18T13:15:10.193	2024-11-21T07:03:03.170	Directory listing is a web server function that displays the directory contents when there is no index file in a specific website directory. A directory listing provides an attacker with the complete index of all the resources located inside of the directory. The specific risks and consequences vary depending on which files are listed and accessible.	5.7	MEDIUM	CVSS:3.1/AV:L/AC:L/PR:L/UI:R/S:C/C:L/I:L/A:L		
CVE-2022-30626	2022-07-18T13:15:10.250	2024-11-21T07:03:03.313	Browsing the path: http://ip/wifi_ap_pata_get.cmd, will show in the name of the existing access point on the component, and a password in clear text.	6.3	MEDIUM	CVSS:3.1/AV:L/AC:L/PR:L/UI:N/S:C/C:L/I:L/A:L		
CVE-2022-30627	2022-07-18T13:15:10.313	2024-11-21T07:03:03.450	This vulnerability affects all of the company's products that also include the FW versions: update_i90_cv2.021_b20210104, update_i50_v1.0.55_b20200509, update_x6_v2.1.2_b202001127, update_b5_v2.0.9_b20200706. This vulnerability makes it possible to extract from the FW the existing user passwords on their operating systems and passwords.	5.7	MEDIUM	CVSS:3.1/AV:L/AC:L/PR:L/UI:R/S:C/C:L/I:L/A:L		
CVE-2022-32450	2022-07-18T13:15:10.460	2024-11-21T07:06:22.693	AnyDesk 7.0.9 allows a local user to gain SYSTEM privileges via a symbolic link because the user can write to their own %APPDATA% folder (used for ad.trace and chat) but the product runs as SYSTEM when writing chat-room data there.	7.1	HIGH	CVSS:3.1/AV:L/AC:L/PR:L/UI:N/S:U/C:N/I:H/A:H		
CVE-2022-35404	2022-07-18T13:15:10.510	2024-11-21T07:11:06.367	ManageEngine Password Manager Pro 12100 and prior and OPManager 126100 and prior are vulnerable to unauthorized file and directory creation on a server machine.	8.2	HIGH	CVSS:3.1/AV:N/AC:L/PR:N/UI:N/S:U/C:N/I:L/A:H		
CVE-2021-33655	2022-07-18T15:15:07.990	2024-11-21T06:09:17.423	When sending malicous data to kernel by ioctl cmd FBIOPUT_VSCREENINFO,kernel will write memory out of bounds.	6.7	MEDIUM	CVSS:3.1/AV:L/AC:L/PR:H/UI:N/S:U/C:H/I:H/A:H		
CVE-2021-33656	2022-07-18T15:15:08.043	2025-04-02T18:33:53.340	When setting font with malicous data by ioctl cmd PIO_FONT,kernel will write memory out of bounds.	6.8	MEDIUM	CVSS:3.1/AV:P/AC:L/PR:N/UI:N/S:U/C:H/I:H/A:H		
CVE-2022-23142	2022-07-18T15:15:08.107	2024-11-21T06:48:05.243	ZXEN CG200 has a DoS vulnerability. An attacker could construct and send a large number of HTTP GET requests in a short time, which can make the product management websites not accessible.	5.3	MEDIUM	CVSS:3.1/AV:N/AC:L/PR:N/UI:N/S:U/C:N/I:N/A:L		
CVE-2022-2400	2022-07-18T15:15:08.153	2024-11-21T07:00:54.880	External Control of File Name or Path in GitHub repository dompdf/dompdf prior to 2.0.0.	5.3	MEDIUM	CVSS:3.1/AV:N/AC:L/PR:N/UI:N/S:U/C:L/I:N/A:N		
CVE-2022-34889	2022-07-18T15:15:08.220	2024-11-21T07:10:23.000	This vulnerability allows local attackers to escalate privileges on affected installations of Parallels Desktop 17.1.1 (51537). An attacker must first obtain the ability to execute high-privileged code on the target guest system in order to exploit this vulnerability. The specific flaw exists within the ACPI virtual device. The issue results from the lack of proper validation of user-supplied data, which can result in a read past the end of an allocated buffer. An attacker can leverage this vulnerability to escalate privileges and execute arbitrary code in the context of the hypervisor. Was ZDI-CAN-16554.	8.2	HIGH	CVSS:3.1/AV:L/AC:L/PR:H/UI:N/S:C/C:H/I:H/A:H		
CVE-2022-34890	2022-07-18T15:15:08.420	2024-11-21T07:10:23.127	This vulnerability allows local attackers to disclose sensitive information on affected installations of Parallels Desktop 17.1.1 (51537). An attacker must first obtain the ability to execute low-privileged code on the target guest system in order to exploit this vulnerability. The specific flaw exists within the Parallels Tools component. The issue results from the lack of proper validation of a user-supplied value prior to dereferencing it as a pointer. An attacker can leverage this in conjunction with other vulnerabilities to escalate privileges and execute arbitrary code in the context of the kernel. Was ZDI-CAN-16653.	8.8	HIGH	CVSS:3.1/AV:L/AC:L/PR:L/UI:N/S:C/C:H/I:H/A:H		
CVE-2022-34891	2022-07-18T15:15:08.480	2024-11-21T07:10:23.263	This vulnerability allows local attackers to escalate privileges on affected installations of Parallels Desktop Parallels Desktop 17.1.1. An attacker must first obtain the ability to execute low-privileged code on the target system in order to exploit this vulnerability. The specific flaw exists within the update machanism. The product sets incorrect permissions on sensitive files. An attacker can leverage this vulnerability to escalate privileges and execute arbitrary code in the context of root. Was ZDI-CAN-16395.	7.8	HIGH	CVSS:3.1/AV:L/AC:L/PR:L/UI:N/S:U/C:H/I:H/A:H		
CVE-2022-34892	2022-07-18T15:15:08.540	2024-11-21T07:10:23.383	This vulnerability allows local attackers to escalate privileges on affected installations of Parallels Desktop Parallels Desktop 17.1.1. An attacker must first obtain the ability to execute low-privileged code on the target system in order to exploit this vulnerability. The specific flaw exists within the update machanism. The issue results from the lack of proper locking when performing operations on an object. An attacker can leverage this vulnerability to escalate privileges and execute arbitrary code in the context of root. Was ZDI-CAN-16396.	7.8	HIGH	CVSS:3.1/AV:L/AC:L/PR:L/UI:N/S:U/C:H/I:H/A:H		
CVE-2022-34899	2022-07-18T15:15:08.603	2024-11-21T07:10:23.750	This vulnerability allows local attackers to escalate privileges on affected installations of Parallels Access 6.5.4 (39316) Agent. An attacker must first obtain the ability to execute low-privileged code on the target host system in order to exploit this vulnerability. The specific flaw exists within the Parallels service. By creating a symbolic link, an attacker can abuse the service to execute a file. An attacker can leverage this vulnerability to escalate privileges and execute arbitrary code in the context of root. Was ZDI-CAN-16134.	7.8	HIGH	CVSS:3.1/AV:L/AC:L/PR:L/UI:N/S:U/C:H/I:H/A:H		
CVE-2022-34900	2022-07-18T15:15:08.663	2024-11-21T07:10:23.883	This vulnerability allows local attackers to escalate privileges on affected installations of Parallels Access 6.5.3 (39313) Agent. An attacker must first obtain the ability to execute low-privileged code on the target system in order to exploit this vulnerability. The specific flaw exists within the Dispatcher service. The service loads an OpenSSL configuration file from an unsecured location. An attacker can leverage this vulnerability to escalate privileges and execute arbitrary code in the context of SYSTEM. Was ZDI-CAN-15213.	7.8	HIGH	CVSS:3.1/AV:L/AC:L/PR:L/UI:N/S:U/C:H/I:H/A:H		
CVE-2022-34901	2022-07-18T15:15:08.720	2024-11-21T07:10:24.000	This vulnerability allows local attackers to escalate privileges on affected installations of Parallels Access 6.5.4 (39316) Agent. An attacker must first obtain the ability to execute low-privileged code on the target host system in order to exploit this vulnerability. The specific flaw exists within the Parallels Service. The service executes files from an unsecured location. An attacker can leverage this vulnerability to escalate privileges and execute arbitrary code in the context of root. Was ZDI-CAN-16137.	7.8	HIGH	CVSS:3.1/AV:L/AC:L/PR:L/UI:N/S:U/C:H/I:H/A:H		
CVE-2022-34902	2022-07-18T15:15:08.780	2024-11-21T07:10:24.113	This vulnerability allows local attackers to escalate privileges on affected installations of Parallels Access 6.5.4 (39316) Agent. An attacker must first obtain the ability to execute low-privileged code on the target system in order to exploit this vulnerability. The specific flaw exists within the Desktop Control Agent service. The service loads Qt plugins from an unsecured location. An attacker can leverage this vulnerability to escalate privileges and execute arbitrary code in the context of SYSTEM. Was ZDI-CAN-15787.	7.8	HIGH	CVSS:3.1/AV:L/AC:L/PR:L/UI:N/S:U/C:H/I:H/A:H		
CVE-2022-35741	2022-07-18T15:15:08.837	2024-11-21T07:11:34.990	Apache CloudStack version 4.5.0 and later has a SAML 2.0 authentication Service Provider plugin which is found to be vulnerable to XML external entity (XXE) injection. This plugin is not enabled by default and the attacker would require that this plugin be enabled to exploit the vulnerability. When the SAML 2.0 plugin is enabled in affected versions of Apache CloudStack could potentially allow the exploitation of XXE vulnerabilities. The SAML 2.0 messages constructed during the authentication flow in Apache CloudStack are XML-based and the XML data is parsed by various standard libraries that are now understood to be vulnerable to XXE injection attacks such as arbitrary file reading, possible denial of service, server-side request forgery (SSRF) on the CloudStack management server.	9.8	CRITICAL	CVSS:3.1/AV:N/AC:L/PR:N/UI:N/S:U/C:H/I:H/A:H		
CVE-2021-42755	2022-07-18T17:15:08.413	2024-11-21T06:28:06.293	An integer overflow / wraparound vulnerability [CWE-190] in FortiSwitch 7.0.2 and below, 6.4.9 and below, 6.2.x, 6.0.x; FortiRecorder 6.4.2 and below, 6.0.10 and below; FortiOS 7.0.2 and below, 6.4.8 and below, 6.2.10 and below, 6.0.x; FortiProxy 7.0.0, 2.0.6 and below, 1.2.x, 1.1.x, 1.0.x; FortiVoiceEnterprise 6.4.3 and below, 6.0.10 and below dhcpd daemon may allow an unauthenticated and network adjacent attacker to crash the dhcpd deamon, resulting in potential denial of service.	4.3	MEDIUM	CVSS:3.1/AV:A/AC:L/PR:N/UI:N/S:U/C:N/I:N/A:L		
CVE-2021-44170	2022-07-18T17:15:08.483	2024-11-21T06:30:29.760	A stack-based buffer overflow vulnerability [CWE-121] in the command line interpreter of FortiOS before 7.0.4 and FortiProxy before 2.0.8 may allow an authenticated attacker to execute unauthorized code or commands via specially crafted command line arguments.	6.7	MEDIUM	CVSS:3.1/AV:L/AC:L/PR:H/UI:N/S:U/C:H/I:H/A:H		
CVE-2022-1565	2022-07-18T17:15:08.537	2024-11-21T06:40:58.827	The plugin WP All Import is vulnerable to arbitrary file uploads due to missing file type validation via the wp_all_import_get_gz.php file in versions up to, and including, 3.6.7. This makes it possible for authenticated attackers, with administrator level permissions and above, to upload arbitrary files on the affected sites server which may make remote code execution possible.	7.2	HIGH	CVSS:3.1/AV:N/AC:L/PR:H/UI:N/S:U/C:H/I:H/A:H		
CVE-2022-1912	2022-07-18T17:15:08.603	2025-05-05T17:17:36.590	The Button Widget Smartsoft plugin for WordPress is vulnerable to Cross-Site Request Forgery in versions up to, and including, 1.0.1. This is due to missing nonce validation on the smartsoftbutton_settings page. This makes it possible for unauthenticated attackers to update the plugins settings and inject malicious web scripts via a forged request granted they can trick a site administrator into performing an action such as clicking on a link.	8.8	HIGH	CVSS:3.1/AV:N/AC:L/PR:N/UI:R/S:U/C:H/I:H/A:H		
CVE-2022-22304	2022-07-18T17:15:08.667	2024-11-21T06:46:36.213	An improper neutralization of input during web page generation vulnerability [CWE-79] in FortiAuthenticator OWA Agent for Microsoft version 2.2 and 2.1 may allow an unauthenticated attacker to perform an XSS attack via crafted HTTP GET requests.	6.1	MEDIUM	CVSS:3.1/AV:N/AC:L/PR:N/UI:R/S:C/C:L/I:L/A:N		
CVE-2022-23745	2022-07-18T17:15:08.717	2024-11-21T06:49:13.593	A potential memory corruption issue was found in Capsule Workspace Android app (running on GrapheneOS). This could result in application crashing but could not be used to gather any sensitive information.	7.5	HIGH	CVSS:3.1/AV:N/AC:L/PR:N/UI:N/S:U/C:N/I:N/A:H		
CVE-2022-2001	2022-07-18T17:15:08.770	2025-05-05T17:18:08.413	The DX Share Selection plugin for WordPress is vulnerable to Cross-Site Request Forgery in versions up to, and including 1.4. This is due to missing nonce protection on the dxss_admin_page() function found in the ~/dx-share-selection.php file. This makes it possible for unauthenticated attackers to inject malicious web scripts into the page, granted they can trick a site's administrator into performing an action such as clicking on a link.	8.8	HIGH	CVSS:3.1/AV:N/AC:L/PR:N/UI:R/S:U/C:H/I:H/A:H		
CVE-2022-2039	2022-07-18T17:15:08.827	2024-11-21T07:00:13.000	The Free Live Chat Support plugin for WordPress is vulnerable to Cross-Site Request Forgery in versions up to, and including 1.0.11. This is due to missing nonce protection on the livesupporti_settings() function found in the ~/livesupporti.php file. This makes it possible for unauthenticated attackers to inject malicious web scripts into the page, granted they can trick a site's administrator into performing an action such as clicking on a link.	8.8	HIGH	CVSS:3.1/AV:N/AC:L/PR:N/UI:R/S:U/C:H/I:H/A:H		
CVE-2022-2101	2022-07-18T17:15:08.887	2025-03-21T16:07:09.227	The Download Manager plugin for WordPress is vulnerable to Stored Cross-Site Scripting via the `file[files][]` parameter in versions up to, and including, 3.2.46 due to insufficient input sanitization and output escaping. This makes it possible for authenticated attackers with contributor level permissions and above to inject arbitrary web scripts on the file's page that will execute whenever an administrator accesses the editor area for the injected file page.	6.4	MEDIUM	CVSS:3.1/AV:N/AC:L/PR:L/UI:N/S:C/C:L/I:L/A:N		
CVE-2022-2108	2022-07-18T17:15:08.947	2025-05-05T17:18:08.893	The plugin Wbcom Designs  BuddyPress Group Reviews for WordPress is vulnerable to unauthorized settings changes and review modification due to missing capability checks and improper nonce checks in several functions related to said actions in versions up to, and including, 2.8.3. This makes it possible for unauthenticated attackers to modify reviews and plugin settings on the affected site.	6.5	MEDIUM	CVSS:3.1/AV:N/AC:L/PR:N/UI:N/S:U/C:L/I:L/A:N		
CVE-2022-2117	2022-07-18T17:15:09.007	2024-11-21T07:00:20.830	The GiveWP plugin for WordPress is vulnerable to Sensitive Information Disclosure in versions up to, and including, 2.20.2 via the /donor-wall REST-API endpoint which provides unauthenticated users with donor information even when the donor wall is not enabled. This functionality has been completely removed in version 2.20.2.	5.3	MEDIUM	CVSS:3.1/AV:N/AC:L/PR:N/UI:N/S:U/C:L/I:N/A:N		
CVE-2022-2223	2022-07-18T17:15:09.067	2025-05-05T17:18:09.080	The WordPress plugin Image Slider is vulnerable to Cross-Site Request Forgery in versions up to, and including 1.1.121 due to failure to properly check for the existence of a nonce in the function ewic_duplicate_slider. This make it possible for unauthenticated attackers to duplicate existing posts or pages granted they can trick a site administrator into performing an action such as clicking on a link.	5.4	MEDIUM	CVSS:3.1/AV:N/AC:L/PR:N/UI:R/S:U/C:L/I:L/A:N		
CVE-2022-2224	2022-07-18T17:15:09.127	2024-11-21T07:00:34.397	The WordPress plugin Gallery for Social Photo is vulnerable to Cross-Site Request Forgery in versions up to, and including 1.0.0.27 due to failure to properly check for the existence of a nonce in the function gifeed_duplicate_feed. This make it possible for unauthenticated attackers to duplicate existing posts or pages granted they can trick a site administrator into performing an action such as clicking on a link.	5.4	MEDIUM	CVSS:3.1/AV:N/AC:L/PR:N/UI:R/S:U/C:L/I:L/A:N		
CVE-2022-2435	2022-07-18T17:15:09.187	2025-05-05T17:18:09.773	The AnyMind Widget plugin for WordPress is vulnerable to Cross-Site Request Forgery in versions up to, and including 1.1. This is due to missing nonce protection on the createDOMStructure() function found in the ~/anymind-widget-id.php file. This makes it possible for unauthenticated attackers to inject malicious web scripts into the page, granted they can trick a sites administrator into performing an action such as clicking on a link.	8.8	HIGH	CVSS:3.1/AV:N/AC:L/PR:N/UI:R/S:U/C:H/I:H/A:H		
CVE-2022-2437	2022-07-18T17:15:09.243	2025-05-05T17:18:10.120	The Feed Them Social  for Twitter feed, Youtube and more plugin for WordPress is vulnerable to deserialization of untrusted input via the 'fts_url' parameter in versions up to, and including 2.9.8.5. This makes it possible for unauthenticated attackers to call files using a PHAR wrapper that will deserialize the data and call arbitrary PHP Objects that can be used to perform a variety of malicious actions granted a POP chain is also present. It also requires that the attacker is successful in uploading a file with the serialized payload.	9.8	CRITICAL	CVSS:3.1/AV:N/AC:L/PR:N/UI:N/S:U/C:H/I:H/A:H		
CVE-2022-2443	2022-07-18T17:15:09.307	2024-11-21T07:01:00.140	The FreeMind WP Browser plugin for WordPress is vulnerable to Cross-Site Request Forgery in versions up to, and including 1.2. This is due to missing nonce protection on the FreemindOptions() function found in the ~/freemind-wp-browser.php file. This makes it possible for unauthenticated attackers to inject malicious web scripts into the page, granted they can trick a site's administrator into performing an action such as clicking on a link.	8.8	HIGH	CVSS:3.1/AV:N/AC:L/PR:N/UI:R/S:U/C:H/I:H/A:H		
CVE-2022-2444	2022-07-18T17:15:09.363	2025-05-05T17:18:10.473	The Visualizer: Tables and Charts Manager for WordPress plugin for WordPress is vulnerable to deserialization of untrusted input via the 'remote_data' parameter in versions up to, and including 3.7.9. This makes it possible for authenticated attackers with contributor privileges and above to call files using a PHAR wrapper that will deserialize the data and call arbitrary PHP Objects that can be used to perform a variety of malicious actions granted a POP chain is also present. It also requires that the attacker is successful in uploading a file with the serialized payload.	8.8	HIGH	CVSS:3.1/AV:N/AC:L/PR:L/UI:N/S:U/C:H/I:H/A:H		
CVE-2022-32387	2022-07-18T17:15:09.427	2024-11-21T07:06:17.280	In Kentico before 13.0.66, attackers can achieve Denial of Service via a crafted request to the GetResource handler.	7.5	HIGH	CVSS:3.1/AV:N/AC:L/PR:N/UI:N/S:U/C:N/I:N/A:H		
CVE-2021-22131	2022-07-18T18:15:08.620	2024-11-21T05:49:33.903	A improper validation of certificate with host mismatch in Fortinet FortiTokenAndroid version 5.0.3 and below, Fortinet FortiTokeniOS version 5.2.0 and below, Fortinet FortiTokenWinApp version 4.0.3 and below allows attacker to retrieve information disclosed via man-in-the-middle attacks.	6.4	MEDIUM	CVSS:3.1/AV:A/AC:H/PR:N/UI:R/S:U/C:H/I:N/A:H		
CVE-2021-29788	2022-07-18T18:15:08.677	2024-11-21T06:01:49.013	IBM Engineering Requirements Quality Assistant On-Premises (All versions) is vulnerable to cross-site scripting. This vulnerability allows users to embed arbitrary JavaScript code in the Web UI thus altering the intended functionality potentially leading to credentials disclosure within a trusted session. IBM X-Force ID: 203310.	5.4	MEDIUM	CVSS:3.1/AV:N/AC:L/PR:L/UI:R/S:C/C:L/I:L/A:N		
CVE-2021-29790	2022-07-18T18:15:08.723	2024-11-21T06:01:49.133	IBM Engineering Requirements Quality Assistant On-Premises (All versions) is vulnerable to cross-site scripting. This vulnerability allows users to embed arbitrary JavaScript code in the Web UI thus altering the intended functionality potentially leading to credentials disclosure within a trusted session. IBM X-Force ID: 203440.	5.4	MEDIUM	CVSS:3.1/AV:N/AC:L/PR:L/UI:R/S:C/C:L/I:L/A:N		
CVE-2021-29799	2022-07-18T18:15:08.770	2024-11-21T06:01:49.890	IBM Engineering Requirements Quality Assistant On-Premises (All versions) could allow an authenticated user to obtain sensitive information due to improper client side validation. IBM X-Force ID: 203738.	6.5	MEDIUM	CVSS:3.1/AV:N/AC:L/PR:L/UI:N/S:U/C:H/I:N/A:N		
CVE-2021-38868	2022-07-18T18:15:08.820	2024-11-21T06:18:06.843	IBM Engineering Requirements Quality Assistant On-Premises (All versions) is vulnerable to cross-site request forgery which could allow an attacker to execute malicious and unauthorized actions transmitted from a user that the website trusts. IBM X-Force Id: 208310.	6.5	MEDIUM	CVSS:3.1/AV:N/AC:L/PR:N/UI:R/S:U/C:N/I:H/A:N		
CVE-2021-41031	2022-07-18T18:15:08.867	2024-11-21T06:25:18.773	A relative path traversal vulnerability [CWE-23] in FortiClient for Windows versions 7.0.2 and prior, 6.4.6 and prior and 6.2.9 and below may allow a local unprivileged attacker to escalate their privileges to SYSTEM via the named pipe responsible for FortiESNAC service.	7.8	HIGH	CVSS:3.1/AV:L/AC:L/PR:L/UI:N/S:U/C:H/I:H/A:H		
CVE-2022-22445	2022-07-18T18:15:08.920	2024-11-21T06:46:48.983	An attacker that gains service access to the FSP (POWER9 only) or gains admin authority to a partition can compromise partition firmware.	6.5	MEDIUM	CVSS:3.1/AV:N/AC:L/PR:L/UI:N/S:U/C:N/I:H/A:N		
CVE-2022-23438	2022-07-18T18:15:08.963	2024-11-21T06:48:33.510	An improper neutralization of input during web page generation ('Cross-site Scripting') [CWE-79] vulnerability in FortiOS version 7.0.5 and prior and 6.4.9 and prior may allow an unauthenticated remote attacker to perform a reflected cross site scripting (XSS) attack in the captive portal authentication replacement page.	4.7	MEDIUM	CVSS:3.1/AV:N/AC:H/PR:N/UI:R/S:C/C:L/I:L/A:N		
CVE-2022-26117	2022-07-18T18:15:09.017	2024-11-21T06:53:27.890	An empty password in configuration file vulnerability [CWE-258] in FortiNAC version 8.3.7 and below, 8.5.2 and below, 8.5.4, 8.6.0, 8.6.5 and below, 8.7.6 and below, 8.8.11 and below, 9.1.5 and below, 9.2.3 and below may allow an authenticated attacker to access the MySQL databases via the CLI.	8.8	HIGH	CVSS:3.1/AV:N/AC:L/PR:L/UI:N/S:U/C:H/I:H/A:H		
CVE-2022-26118	2022-07-18T18:15:09.070	2024-11-21T06:53:28.007	A privilege chaining vulnerability [CWE-268] in FortiManager and FortiAnalyzer 6.0.x, 6.2.x, 6.4.0 through 6.4.7, 7.0.0 through 7.0.3 may allow a local and authenticated attacker with a restricted shell to escalate their privileges to root due to incorrect permissions of some folders and executable files on the system.	6.7	MEDIUM	CVSS:3.1/AV:L/AC:L/PR:H/UI:N/S:U/C:H/I:H/A:H		
CVE-2022-26120	2022-07-18T18:15:09.120	2024-11-21T06:53:28.307	Multiple improper neutralization of special elements used in an SQL Command ('SQL Injection') vulnerabilities [CWE-89] in FortiADC management interface 7.0.0 through 7.0.1, 5.0.0 through 6.2.2 may allow an authenticated attacker to execute unauthorized code or commands via specifically crafted HTTP requests.	5.4	MEDIUM	CVSS:3.1/AV:N/AC:L/PR:L/UI:N/S:U/C:L/I:L/A:N		
CVE-2022-28669	2022-07-18T19:15:08.500	2024-11-21T06:57:41.530	This vulnerability allows remote attackers to execute arbitrary code on affected installations of Foxit PDF Reader 11.2.1.53537. User interaction is required to exploit this vulnerability in that the target must visit a malicious page or open a malicious file. The specific flaw exists within the handling of Doc objects. The issue results from the lack of validating the existence of an object prior to performing operations on the object. An attacker can leverage this vulnerability to execute code in the context of the current process. Was ZDI-CAN-16420.	7.8	HIGH	CVSS:3.1/AV:L/AC:L/PR:N/UI:R/S:U/C:H/I:H/A:H		
CVE-2022-28670	2022-07-18T19:15:08.553	2024-11-21T06:57:41.653	This vulnerability allows remote attackers to disclose sensitive information on affected installations of Foxit PDF Reader 11.2.1.53537. User interaction is required to exploit this vulnerability in that the target must visit a malicious page or open a malicious file. The specific flaw exists within the processing of AcroForms. Crafted data in an AcroForm can trigger a read past the end of an allocated buffer. An attacker can leverage this in conjunction with other vulnerabilities to execute arbitrary code in the context of the current process. Was ZDI-CAN-16523.	7.8	HIGH	CVSS:3.1/AV:L/AC:L/PR:N/UI:R/S:U/C:H/I:H/A:H		
