CVE ID	Published Date	Last Modified Date	Description	Base Score	Base Severity	Vector String	Vendor	Product
CVE-2022-20902	2022-07-22T04:15:12.927	2024-11-21T06:43:46.980	Multiple vulnerabilities in the web-based management interface of Cisco Small Business RV110W, RV130, RV130W, and RV215W Routers could allow an authenticated, remote attacker to execute arbitrary code on an affected device or cause the device to restart unexpectedly, resulting in a denial of service (DoS) condition. These vulnerabilities are due to insufficient validation of user fields within incoming HTTP packets. An attacker could exploit these vulnerabilities by sending a crafted request to the web-based management interface. A successful exploit could allow the attacker to execute arbitrary commands on an affected device with root-level privileges or to cause the device to restart unexpectedly, resulting in a DoS condition. To exploit these vulnerabilities, an attacker would need to have valid Administrator credentials on the affected device. Cisco has not released software updates that address these vulnerabilities.	4.7	MEDIUM	CVSS:3.1/AV:N/AC:L/PR:H/UI:N/S:U/C:L/I:L/A:L		
CVE-2022-20903	2022-07-22T04:15:12.987	2024-11-21T06:43:47.093	Multiple vulnerabilities in the web-based management interface of Cisco Small Business RV110W, RV130, RV130W, and RV215W Routers could allow an authenticated, remote attacker to execute arbitrary code on an affected device or cause the device to restart unexpectedly, resulting in a denial of service (DoS) condition. These vulnerabilities are due to insufficient validation of user fields within incoming HTTP packets. An attacker could exploit these vulnerabilities by sending a crafted request to the web-based management interface. A successful exploit could allow the attacker to execute arbitrary commands on an affected device with root-level privileges or to cause the device to restart unexpectedly, resulting in a DoS condition. To exploit these vulnerabilities, an attacker would need to have valid Administrator credentials on the affected device. Cisco has not released software updates that address these vulnerabilities.	4.7	MEDIUM	CVSS:3.1/AV:N/AC:L/PR:H/UI:N/S:U/C:L/I:L/A:L		
CVE-2022-20904	2022-07-22T04:15:13.057	2024-11-21T06:43:47.210	Multiple vulnerabilities in the web-based management interface of Cisco Small Business RV110W, RV130, RV130W, and RV215W Routers could allow an authenticated, remote attacker to execute arbitrary code on an affected device or cause the device to restart unexpectedly, resulting in a denial of service (DoS) condition. These vulnerabilities are due to insufficient validation of user fields within incoming HTTP packets. An attacker could exploit these vulnerabilities by sending a crafted request to the web-based management interface. A successful exploit could allow the attacker to execute arbitrary commands on an affected device with root-level privileges or to cause the device to restart unexpectedly, resulting in a DoS condition. To exploit these vulnerabilities, an attacker would need to have valid Administrator credentials on the affected device. Cisco has not released software updates that address these vulnerabilities.	4.7	MEDIUM	CVSS:3.1/AV:N/AC:L/PR:H/UI:N/S:U/C:L/I:L/A:L		
CVE-2022-20906	2022-07-22T04:15:13.127	2024-11-21T06:43:47.450	Multiple vulnerabilities in Cisco Nexus Dashboard could allow an authenticated, local attacker to elevate privileges on an affected device. These vulnerabilities are due to insufficient input validation during CLI command execution on an affected device. An attacker could exploit these vulnerabilities by authenticating as the rescue-user and executing vulnerable CLI commands using a malicious payload. A successful exploit could allow the attacker to elevate privileges to root on an affected device.	6.0	MEDIUM	CVSS:3.1/AV:L/AC:L/PR:H/UI:N/S:U/C:H/I:H/A:N		
CVE-2022-20907	2022-07-22T04:15:13.207	2024-11-21T06:43:47.557	Multiple vulnerabilities in Cisco Nexus Dashboard could allow an authenticated, local attacker to elevate privileges on an affected device. These vulnerabilities are due to insufficient input validation during CLI command execution on an affected device. An attacker could exploit these vulnerabilities by authenticating as the rescue-user and executing vulnerable CLI commands using a malicious payload. A successful exploit could allow the attacker to elevate privileges to root on an affected device.	6.0	MEDIUM	CVSS:3.1/AV:L/AC:L/PR:H/UI:N/S:U/C:H/I:H/A:N		
CVE-2022-20908	2022-07-22T04:15:13.283	2024-11-21T06:43:47.670	Multiple vulnerabilities in Cisco Nexus Dashboard could allow an authenticated, local attacker to elevate privileges on an affected device. These vulnerabilities are due to insufficient input validation during CLI command execution on an affected device. An attacker could exploit these vulnerabilities by authenticating as the rescue-user and executing vulnerable CLI commands using a malicious payload. A successful exploit could allow the attacker to elevate privileges to root on an affected device.	6.0	MEDIUM	CVSS:3.1/AV:L/AC:L/PR:H/UI:N/S:U/C:H/I:H/A:N		
CVE-2022-20909	2022-07-22T04:15:13.347	2024-11-21T06:43:47.777	Multiple vulnerabilities in Cisco Nexus Dashboard could allow an authenticated, local attacker to elevate privileges on an affected device. These vulnerabilities are due to insufficient input validation during CLI command execution on an affected device. An attacker could exploit these vulnerabilities by authenticating as the rescue-user and executing vulnerable CLI commands using a malicious payload. A successful exploit could allow the attacker to elevate privileges to root on an affected device.	6.0	MEDIUM	CVSS:3.1/AV:L/AC:L/PR:H/UI:N/S:U/C:H/I:H/A:N		
CVE-2022-20910	2022-07-22T04:15:13.413	2024-11-21T06:43:47.890	Multiple vulnerabilities in the web-based management interface of Cisco Small Business RV110W, RV130, RV130W, and RV215W Routers could allow an authenticated, remote attacker to execute arbitrary code on an affected device or cause the device to restart unexpectedly, resulting in a denial of service (DoS) condition. These vulnerabilities are due to insufficient validation of user fields within incoming HTTP packets. An attacker could exploit these vulnerabilities by sending a crafted request to the web-based management interface. A successful exploit could allow the attacker to execute arbitrary commands on an affected device with root-level privileges or to cause the device to restart unexpectedly, resulting in a DoS condition. To exploit these vulnerabilities, an attacker would need to have valid Administrator credentials on the affected device. Cisco has not released software updates that address these vulnerabilities.	4.7	MEDIUM	CVSS:3.1/AV:N/AC:L/PR:H/UI:N/S:U/C:L/I:L/A:L		
CVE-2022-20911	2022-07-22T04:15:13.477	2024-11-21T06:43:48.003	Multiple vulnerabilities in the web-based management interface of Cisco Small Business RV110W, RV130, RV130W, and RV215W Routers could allow an authenticated, remote attacker to execute arbitrary code on an affected device or cause the device to restart unexpectedly, resulting in a denial of service (DoS) condition. These vulnerabilities are due to insufficient validation of user fields within incoming HTTP packets. An attacker could exploit these vulnerabilities by sending a crafted request to the web-based management interface. A successful exploit could allow the attacker to execute arbitrary commands on an affected device with root-level privileges or to cause the device to restart unexpectedly, resulting in a DoS condition. To exploit these vulnerabilities, an attacker would need to have valid Administrator credentials on the affected device. Cisco has not released software updates that address these vulnerabilities.	4.7	MEDIUM	CVSS:3.1/AV:N/AC:L/PR:H/UI:N/S:U/C:L/I:L/A:L		
CVE-2022-20912	2022-07-22T04:15:13.547	2024-11-21T06:43:48.120	Multiple vulnerabilities in the web-based management interface of Cisco Small Business RV110W, RV130, RV130W, and RV215W Routers could allow an authenticated, remote attacker to execute arbitrary code on an affected device or cause the device to restart unexpectedly, resulting in a denial of service (DoS) condition. These vulnerabilities are due to insufficient validation of user fields within incoming HTTP packets. An attacker could exploit these vulnerabilities by sending a crafted request to the web-based management interface. A successful exploit could allow the attacker to execute arbitrary commands on an affected device with root-level privileges or to cause the device to restart unexpectedly, resulting in a DoS condition. To exploit these vulnerabilities, an attacker would need to have valid Administrator credentials on the affected device. Cisco has not released software updates that address these vulnerabilities.	4.7	MEDIUM	CVSS:3.1/AV:N/AC:L/PR:H/UI:N/S:U/C:L/I:L/A:L		
CVE-2022-20913	2022-07-22T04:15:13.613	2024-11-21T06:43:48.237	A vulnerability in Cisco Nexus Dashboard could allow an authenticated, remote attacker to write arbitrary files on an affected device. This vulnerability is due to insufficient input validation in the web-based management interface of Cisco Nexus Dashboard. An attacker with Administrator credentials could exploit this vulnerability by uploading a crafted file. A successful exploit could allow the attacker to overwrite arbitrary files on an affected device.	4.9	MEDIUM	CVSS:3.1/AV:N/AC:L/PR:H/UI:N/S:U/C:N/I:H/A:N		
CVE-2022-20916	2022-07-22T04:15:13.687	2024-11-21T06:43:48.587	A vulnerability in the web-based management interface of Cisco IoT Control Center could allow an unauthenticated, remote attacker to conduct a cross-site scripting (XSS) attack against a user of the interface. This vulnerability exists because the web-based management interface does not properly validate user-supplied input. An attacker could exploit this vulnerability by persuading a user of the interface to click a crafted link. A successful exploit could allow the attacker to execute arbitrary script code in the context of the affected interface or access sensitive, browser-based information.	6.1	MEDIUM	CVSS:3.1/AV:N/AC:L/PR:N/UI:R/S:C/C:L/I:L/A:N		
CVE-2022-2493	2022-07-22T04:15:13.780	2024-11-21T07:01:06.700	Data Access from Outside Expected Data Manager Component in GitHub repository openemr/openemr prior to 7.0.0.	8.1	HIGH	CVSS:3.1/AV:N/AC:L/PR:L/UI:N/S:U/C:H/I:H/A:N		
CVE-2022-2494	2022-07-22T04:15:13.857	2024-11-21T07:01:06.830	Cross-site Scripting (XSS) - Stored in GitHub repository openemr/openemr prior to 7.0.0.	5.4	MEDIUM	CVSS:3.1/AV:N/AC:L/PR:L/UI:R/S:C/C:L/I:L/A:N		
CVE-2022-2495	2022-07-22T04:15:13.930	2024-11-21T07:01:06.970	Cross-site Scripting (XSS) - Stored in GitHub repository microweber/microweber prior to 1.2.21.	4.8	MEDIUM	CVSS:3.1/AV:N/AC:L/PR:H/UI:R/S:C/C:L/I:L/A:N		
CVE-2022-31162	2022-07-22T04:15:14.187	2024-11-21T07:04:01.930	Slack Morphism is an async client library for Rust. Prior to 0.41.0, it was possible for Slack OAuth client information to leak in application debug logs. Stricter and more secure debug formatting was introduced in v0.41.0 for OAuth secret types to reduce the possibility of printing sensitive information in application logs. As a workaround, do not print/output requests and responses for OAuth and client configurations in logs.	7.5	HIGH	CVSS:3.1/AV:N/AC:L/PR:N/UI:N/S:U/C:H/I:N/A:N		
CVE-2022-31163	2022-07-22T04:15:14.273	2024-11-21T07:04:02.060	TZInfo is a Ruby library that provides access to time zone data and allows times to be converted using time zone rules. Versions prior to 0.36.1, as well as those prior to 1.2.10 when used with the Ruby data source tzinfo-data, are vulnerable to relative path traversal. With the Ruby data source, time zones are defined in Ruby files. There is one file per time zone. Time zone files are loaded with `require` on demand. In the affected versions, `TZInfo::Timezone.get` fails to validate time zone identifiers correctly, allowing a new line character within the identifier. With Ruby version 1.9.3 and later, `TZInfo::Timezone.get` can be made to load unintended files with `require`, executing them within the Ruby process. Versions 0.3.61 and 1.2.10 include fixes to correctly validate time zone identifiers. Versions 2.0.0 and later are not vulnerable. Version 0.3.61 can still load arbitrary files from the Ruby load path if their name follows the rules for a valid time zone identifier and the file has a prefix of `tzinfo/definition` within a directory in the load path. Applications should ensure that untrusted files are not placed in a directory on the load path. As a workaround, the time zone identifier can be validated before passing to `TZInfo::Timezone.get` by ensuring it matches the regular expression `\A[A-Za-z0-9+\-_]+(?:\/[A-Za-z0-9+\-_]+)*\z`.	7.5	HIGH	CVSS:3.1/AV:N/AC:H/PR:N/UI:R/S:U/C:H/I:H/A:H		
CVE-2022-31164	2022-07-22T04:15:14.377	2024-11-21T07:04:02.223	Tovy is a a staff management system for Roblox groups. A vulnerability in versions prior to 0.7.51 allows users to log in as other users, including privileged users such as the other of the instance. The problem has been patched in version 0.7.51.	7.5	HIGH	CVSS:3.1/AV:N/AC:L/PR:N/UI:N/S:U/C:N/I:H/A:N		
CVE-2022-31169	2022-07-22T04:15:14.463	2024-11-21T07:04:02.800	Wasmtime is a standalone runtime for WebAssembly. There is a bug in Wasmtime's code generator, Cranelift, for AArch64 targets where constant divisors can result in incorrect division results at runtime. This affects Wasmtime prior to version 0.38.2 and Cranelift prior to 0.85.2. This issue only affects the AArch64 platform. Other platforms are not affected. The translation rules for constants did not take into account whether sign or zero-extension should happen which resulted in an incorrect value being placed into a register when a division was encountered. The impact of this bug is that programs executing within the WebAssembly sandbox would not behave according to the WebAssembly specification. This means that it is hypothetically possible for execution within the sandbox to go awry and WebAssembly programs could produce unexpected results. This should not impact hosts executing WebAssembly but does affect the correctness of guest programs. This bug has been patched in Wasmtime version 0.38.2 and cranelift-codegen 0.85.2. There are no known workarounds.	5.9	MEDIUM	CVSS:3.1/AV:N/AC:H/PR:N/UI:N/S:U/C:N/I:H/A:N		
CVE-2022-31170	2022-07-22T04:15:14.547	2024-11-21T07:04:02.930	OpenZeppelin Contracts is a library for smart contract development. Versions 4.0.0 until 4.7.1 are vulnerable to ERC165Checker reverting instead of returning `false`. `ERC165Checker.supportsInterface` is designed to always successfully return a boolean, and under no circumstance revert. However, an incorrect assumption about Solidity 0.8's `abi.decode` allows some cases to revert, given a target contract that doesn't implement EIP-165 as expected, specifically if it returns a value other than 0 or 1. The contracts that may be affected are those that use `ERC165Checker` to check for support for an interface and then handle the lack of support in a way other than reverting. The issue was patched in version 4.7.1.	7.5	HIGH	CVSS:3.1/AV:N/AC:L/PR:N/UI:N/S:U/C:N/I:H/A:N		
CVE-2022-31172	2022-07-22T04:15:14.633	2024-11-21T07:04:03.080	OpenZeppelin Contracts is a library for smart contract development. Versions 4.1.0 until 4.7.1 are vulnerable to the SignatureChecker reverting. `SignatureChecker.isValidSignatureNow` is not expected to revert. However, an incorrect assumption about Solidity 0.8's `abi.decode` allows some cases to revert, given a target contract that doesn't implement EIP-1271 as expected. The contracts that may be affected are those that use `SignatureChecker` to check the validity of a signature and handle invalid signatures in a way other than reverting. The issue was patched in version 4.7.1.	7.5	HIGH	CVSS:3.1/AV:N/AC:L/PR:N/UI:N/S:U/C:N/I:H/A:N		
CVE-2022-2327	2022-07-22T10:15:08.257	2024-11-21T07:00:46.610	io_uring use work_flags to determine which identity need to grab from the calling process to make sure it is consistent with the calling process when executing IORING_OP. Some operations are missing some types, which can lead to incorrect reference counts which can then lead to a double free. We recommend upgrading the kernel past commit df3f3bb5059d20ef094d6b2f0256c4bf4127a859	7.5	HIGH	CVSS:3.1/AV:L/AC:H/PR:L/UI:N/S:C/C:H/I:H/A:N		
CVE-2022-2209	2022-07-22T11:15:07.923	2023-11-07T03:46:17.390	Rejected reason: DO NOT USE THIS CANDIDATE NUMBER. Reason: This CVE has been rejected as it was incorrectly assigned. All references and descriptions in this candidate have been removed to prevent accidental usage					
CVE-2022-31168	2022-07-22T13:15:08.540	2024-11-21T07:04:02.643	Zulip is an open source team chat tool. Due to an incorrect authorization check in Zulip Server 5.4 and earlier, a member of an organization could craft an API call that grants organization administrator privileges to one of their bots. The vulnerability is fixed in Zulip Server 5.5. Members who dont own any bots, and lack permission to create them, cant exploit the vulnerability. As a workaround for the vulnerability, an organization administrator can restrict the `Who can create bots` permission to administrators only, and change the ownership of existing bots.	5.4	MEDIUM	CVSS:3.1/AV:N/AC:L/PR:L/UI:N/S:U/C:L/I:L/A:N		
CVE-2022-36131	2022-07-22T13:15:08.703	2024-11-21T07:12:27.817	The Better PDF Exporter add-on 10.0.0 for Atlassian Jira is prone to stored XSS via a crafted description to the PDF Templates overview page.	6.1	MEDIUM	CVSS:3.1/AV:N/AC:L/PR:N/UI:R/S:C/C:L/I:L/A:N		
CVE-2021-36200	2022-07-22T15:15:07.910	2024-11-21T06:13:18.243	Under certain circumstances an unauthenticated user could access the the web API for Metasys ADS/ADX/OAS 10 versions prior to 10.1.6 and 11 versions prior to 11.0.2 and enumerate users.	5.3	MEDIUM	CVSS:3.1/AV:N/AC:L/PR:N/UI:N/S:U/C:L/I:N/A:N		
CVE-2022-1655	2022-07-22T15:15:08.057	2024-11-21T06:41:11.280	An Incorrect Permission Assignment for Critical Resource flaw was found in Horizon on Red Hat OpenStack. Horizon session cookies are created without the HttpOnly flag despite HorizonSecureCookies being set to true in the environmental files, possibly leading to a loss of confidentiality and integrity.	6.5	MEDIUM	CVSS:3.1/AV:N/AC:L/PR:N/UI:N/S:U/C:L/I:L/A:N		
CVE-2022-2135	2022-07-22T15:15:08.117	2024-11-21T07:00:24.077	The affected product is vulnerable to multiple SQL injections, which may allow an unauthorized attacker to disclose information.	7.5	HIGH	CVSS:3.1/AV:N/AC:L/PR:N/UI:N/S:U/C:H/I:N/A:N		
CVE-2022-2136	2022-07-22T15:15:08.180	2024-11-21T07:00:24.203	The affected product is vulnerable to multiple SQL injections that require low privileges for exploitation and may allow an unauthorized attacker to disclose information.	8.8	HIGH	CVSS:3.1/AV:N/AC:L/PR:L/UI:N/S:U/C:H/I:H/A:H		
CVE-2022-2137	2022-07-22T15:15:08.237	2024-11-21T07:00:24.330	The affected product is vulnerable to two SQL injections that require high privileges for exploitation and may allow an unauthorized attacker to disclose information	4.9	MEDIUM	CVSS:3.1/AV:N/AC:L/PR:H/UI:N/S:U/C:H/I:N/A:N		
CVE-2022-2138	2022-07-22T15:15:08.293	2024-11-21T07:00:24.470	The affected product is vulnerable due to missing authentication, which may allow an attacker to read or modify sensitive data and execute arbitrary code, resulting in a denial-of-service condition.	8.2	HIGH	CVSS:3.1/AV:N/AC:L/PR:N/UI:N/S:U/C:N/I:L/A:H		
CVE-2022-2139	2022-07-22T15:15:08.350	2024-11-21T07:00:24.583	The affected product is vulnerable to directory traversal, which may allow an attacker to access unauthorized files and execute arbitrary code.	6.5	MEDIUM	CVSS:3.1/AV:N/AC:L/PR:L/UI:N/S:U/C:H/I:N/A:N		
CVE-2022-2142	2022-07-22T15:15:08.407	2024-11-21T07:00:24.970	The affected product is vulnerable to a SQL injection with high attack complexity, which may allow an unauthorized attacker to disclose information.	8.1	HIGH	CVSS:3.1/AV:N/AC:H/PR:N/UI:N/S:U/C:H/I:H/A:H		
CVE-2022-2143	2022-07-22T15:15:08.463	2024-11-21T07:00:25.093	The affected product is vulnerable to two instances of command injection, which may allow an attacker to remotely execute arbitrary code.	9.8	CRITICAL	CVSS:3.1/AV:N/AC:L/PR:N/UI:N/S:U/C:H/I:H/A:H		
CVE-2022-2470	2022-07-22T15:15:08.520	2024-11-21T07:01:03.380	Cross-site Scripting (XSS) - Reflected in GitHub repository microweber/microweber prior to 1.2.21.	6.1	MEDIUM	CVSS:3.1/AV:N/AC:L/PR:N/UI:R/S:C/C:L/I:L/A:N		
CVE-2022-34037	2022-07-22T15:15:08.580	2024-11-21T07:08:49.080	An out-of-bounds read in the rewrite function at /modules/caddyhttp/rewrite/rewrite.go in Caddy v2.5.1 allows attackers to cause a Denial of Service (DoS) via a crafted URI. Note: This has been disputed as a bug, not a security vulnerability, in the Caddy web server that emerged when an administrator's bad configuration containing a malformed request URI caused the server to return an empty reply instead of a valid HTTP response to the client.	7.5	HIGH	CVSS:3.1/AV:N/AC:L/PR:N/UI:N/S:U/C:N/I:N/A:H		
CVE-2022-34500	2022-07-22T15:15:08.620	2024-11-21T07:09:41.150	The bin-collect package in PyPI before v0.1 included a code execution backdoor inserted by a third party.	9.8	CRITICAL	CVSS:3.1/AV:N/AC:L/PR:N/UI:N/S:U/C:H/I:H/A:H		
CVE-2022-34501	2022-07-22T15:15:08.660	2024-11-21T07:09:41.303	The bin-collection package in PyPI before v0.1 included a code execution backdoor inserted by a third party.	9.8	CRITICAL	CVSS:3.1/AV:N/AC:L/PR:N/UI:N/S:U/C:H/I:H/A:H		
CVE-2022-34502	2022-07-22T15:15:08.703	2024-11-21T07:09:41.457	Radare2 v5.7.0 was discovered to contain a heap buffer overflow via the function consume_encoded_name_new at format/wasm/wasm.c. This vulnerability allows attackers to cause a Denial of Service (DoS) via a crafted binary file.	5.5	MEDIUM	CVSS:3.1/AV:L/AC:L/PR:N/UI:R/S:U/C:N/I:N/A:H		
CVE-2022-34503	2022-07-22T15:15:08.743	2024-11-21T07:09:41.600	QPDF v8.4.2 was discovered to contain a heap buffer overflow via the function QPDF::processXRefStream. This vulnerability allows attackers to cause a Denial of Service (DoS) via a crafted PDF file.	6.5	MEDIUM	CVSS:3.1/AV:N/AC:L/PR:N/UI:R/S:U/C:N/I:N/A:H		
CVE-2022-34509	2022-07-22T15:15:08.787	2024-11-21T07:09:41.757	The wikifaces package in PyPI v1.0 included a code execution backdoor inserted by a third party.	9.8	CRITICAL	CVSS:3.1/AV:N/AC:L/PR:N/UI:N/S:U/C:H/I:H/A:H		
CVE-2022-34520	2022-07-22T15:15:08.827	2024-11-21T07:09:41.927	Radare2 v5.7.2 was discovered to contain a NULL pointer dereference via the function r_bin_file_xtr_load_buffer at bin/bfile.c. This vulnerability allows attackers to cause a Denial of Service (DOS) via a crafted binary file.	5.5	MEDIUM	CVSS:3.1/AV:L/AC:L/PR:N/UI:R/S:U/C:N/I:N/A:H		
CVE-2022-34981	2022-07-22T15:15:08.873	2024-11-21T07:10:31.540	The PyCrowdTangle package in PyPI before v0.0.1 included a code execution backdoor inserted by a third party.	9.8	CRITICAL	CVSS:3.1/AV:N/AC:L/PR:N/UI:N/S:U/C:H/I:H/A:H		
CVE-2022-34982	2022-07-22T15:15:08.917	2024-11-21T07:10:31.697	The eziod package in PyPI before v0.0.1 included a code execution backdoor inserted by a third party.	9.8	CRITICAL	CVSS:3.1/AV:N/AC:L/PR:N/UI:N/S:U/C:H/I:H/A:H		
CVE-2022-34983	2022-07-22T15:15:08.960	2024-11-21T07:10:31.880	The scu-captcha package in PyPI v0.0.1 to v0.0.4 included a code execution backdoor inserted by a third party.	9.8	CRITICAL	CVSS:3.1/AV:N/AC:L/PR:N/UI:N/S:U/C:H/I:H/A:H		
CVE-2020-14114	2022-07-22T16:15:08.000	2024-11-21T05:02:40.850	information leakage vulnerability exists in the Xiaomi SmartHome APP. This vulnerability is caused by illegal calls of some sensitive JS interfaces, which can be exploited by attackers to leak sensitive information.	7.5	HIGH	CVSS:3.1/AV:N/AC:L/PR:N/UI:N/S:U/C:H/I:N/A:N		
CVE-2020-14126	2022-07-22T16:15:08.123	2024-11-21T05:02:42.743	Information leakage vulnerability exists in the Mi Sound APP. This vulnerability is caused by illegal calls of some sensitive JS interfaces, which can be exploited by attackers to leak sensitive information.	7.5	HIGH	CVSS:3.1/AV:N/AC:L/PR:N/UI:N/S:U/C:H/I:N/A:N		
CVE-2022-28878	2022-07-22T16:15:08.193	2024-11-21T06:58:07.227	A Denial-of-Service vulnerability was discovered in the F-Secure Atlant and in certain WithSecure products while scanning fuzzed APK file it is possible that can crash the scanning engine.	4.3	MEDIUM	CVSS:3.1/AV:N/AC:L/PR:H/UI:R/S:U/C:L/I:L/A:L		
CVE-2022-28879	2022-07-22T16:15:08.247	2024-11-21T06:58:07.350	A Denial-of-Service (DoS) vulnerability was discovered in F-Secure Atlant and in certain WithSecure products whereby the scanning the aepack.dll component can crash the scanning engine.	4.3	MEDIUM	CVSS:3.1/AV:N/AC:L/PR:H/UI:R/S:U/C:L/I:L/A:L		
CVE-2022-2510	2022-07-22T16:15:08.297	2024-11-21T07:01:08.623	"Cross-site Scripting (XSS) vulnerability in ""Extension:ExtendedSearch"" of Hallo Welt! GmbH BlueSpice allows attacker to inject arbitrary HTML (XSS) on page ""Special:SearchCenter"", using the search term in the URL."	4.3	MEDIUM	CVSS:3.1/AV:N/AC:L/PR:N/UI:R/S:U/C:L/I:N/A:N		
CVE-2022-2511	2022-07-22T16:15:08.367	2024-11-21T07:01:08.747	"Cross-site Scripting (XSS) vulnerability in the ""commonuserinterface"" component of BlueSpice allows an attacker to inject arbitrary HTML into a page using the title parameter of the call URL."	4.3	MEDIUM	CVSS:3.1/AV:N/AC:L/PR:N/UI:R/S:U/C:L/I:N/A:N		
