CVE ID	Published Date	Last Modified Date	Description	Base Score	Base Severity	Vector String	Vendor	Product
CVE-2021-32428	2022-07-01T00:15:08.717	2024-11-21T06:07:02.513	SQL Injection vulnerability in viaviwebtech Android EBook App (Books App, PDF, ePub, Online Book Reading, Download Books) 10 via the author_id parameter to api.php.	9.8	CRITICAL	CVSS:3.1/AV:N/AC:L/PR:N/UI:N/S:U/C:H/I:H/A:H		
CVE-2022-27904	2022-07-01T00:15:08.773	2024-11-21T06:56:26.553	Automox Agent for macOS before version 39 was vulnerable to a time-of-check/time-of-use (TOCTOU) race-condition attack during the agent install process.	7.0	HIGH	CVSS:3.1/AV:L/AC:H/PR:L/UI:N/S:U/C:H/I:H/A:H		
CVE-2022-32295	2022-07-01T00:15:08.813	2024-11-21T07:06:07.587	On Ampere Altra and AltraMax devices before SRP 1.09, the Altra reference design of UEFI accesses allows insecure access to SPI-NOR by the OS/hypervisor component.	9.8	CRITICAL	CVSS:3.1/AV:N/AC:L/PR:N/UI:N/S:U/C:H/I:H/A:H		
CVE-2022-32988	2022-07-01T00:15:08.857	2024-11-21T07:07:21.980	"Cross Site Scripting (XSS) vulnerability in router Asus DSL-N14U-B1 1.1.2.3_805 via the ""*list"" parameters (e.g. filter_lwlist, keyword_rulelist, etc) in every "".asp"" page containing a list of stored strings. The following asp files are affected: (1) cgi-bin/APP_Installation.asp, (2) cgi-bin/Advanced_ACL_Content.asp, (3) cgi-bin/Advanced_ADSL_Content.asp, (4) cgi-bin/Advanced_ASUSDDNS_Content.asp, (5) cgi-bin/Advanced_AiDisk_ftp.asp, (6) cgi-bin/Advanced_AiDisk_samba.asp, (7) cgi-bin/Advanced_DSL_Content.asp, (8) cgi-bin/Advanced_Firewall_Content.asp, (9) cgi-bin/Advanced_FirmwareUpgrade_Content.asp, (10) cgi-bin/Advanced_GWStaticRoute_Content.asp, (11) cgi-bin/Advanced_IPTV_Content.asp, (12) cgi-bin/Advanced_IPv6_Content.asp, (13) cgi-bin/Advanced_KeywordFilter_Content.asp, (14) cgi-bin/Advanced_LAN_Content.asp, (15) cgi-bin/Advanced_Modem_Content.asp, (16) cgi-bin/Advanced_PortTrigger_Content.asp, (17) cgi-bin/Advanced_QOSUserPrio_Content.asp, (18) cgi-bin/Advanced_QOSUserRules_Content.asp, (19) cgi-bin/Advanced_SettingBackup_Content.asp, (20) cgi-bin/Advanced_System_Content.asp, (21) cgi-bin/Advanced_URLFilter_Content.asp, (22) cgi-bin/Advanced_VPN_PPTP.asp, (23) cgi-bin/Advanced_VirtualServer_Content.asp, (24) cgi-bin/Advanced_WANPort_Content.asp, (25) cgi-bin/Advanced_WAdvanced_Content.asp, (26) cgi-bin/Advanced_WMode_Content.asp, (27) cgi-bin/Advanced_WWPS_Content.asp, (28) cgi-bin/Advanced_Wireless_Content.asp, (29) cgi-bin/Bandwidth_Limiter.asp, (30) cgi-bin/Guest_network.asp, (31) cgi-bin/Main_AccessLog_Content.asp, (32) cgi-bin/Main_AdslStatus_Content.asp, (33) cgi-bin/Main_Spectrum_Content.asp, (34) cgi-bin/Main_WebHistory_Content.asp, (35) cgi-bin/ParentalControl.asp, (36) cgi-bin/QIS_wizard.asp, (37) cgi-bin/QoS_EZQoS.asp, (38) cgi-bin/aidisk.asp, (39) cgi-bin/aidisk/Aidisk-1.asp, (40) cgi-bin/aidisk/Aidisk-2.asp, (41) cgi-bin/aidisk/Aidisk-3.asp, (42) cgi-bin/aidisk/Aidisk-4.asp, (43) cgi-bin/blocking.asp, (44) cgi-bin/cloud_main.asp, (45) cgi-bin/cloud_router_sync.asp, (46) cgi-bin/cloud_settings.asp, (47) cgi-bin/cloud_sync.asp, (48) cgi-bin/device-map/DSL_dashboard.asp, (49) cgi-bin/device-map/clients.asp, (50) cgi-bin/device-map/disk.asp, (51) cgi-bin/device-map/internet.asp, (52) cgi-bin/error_page.asp, (53) cgi-bin/index.asp, (54) cgi-bin/index2.asp, (55) cgi-bin/qis/QIS_PTM_manual_setting.asp, (56) cgi-bin/qis/QIS_admin_pass.asp, (57) cgi-bin/qis/QIS_annex_setting.asp, (58) cgi-bin/qis/QIS_bridge_cfg_tmp.asp, (59) cgi-bin/qis/QIS_detect.asp, (60) cgi-bin/qis/QIS_finish.asp, (61) cgi-bin/qis/QIS_ipoa_cfg_tmp.asp, (62) cgi-bin/qis/QIS_manual_setting.asp, (63) cgi-bin/qis/QIS_mer_cfg.asp, (64) cgi-bin/qis/QIS_mer_cfg_tmp.asp, (65) cgi-bin/qis/QIS_ppp_cfg.asp, (66) cgi-bin/qis/QIS_ppp_cfg_tmp.asp, (67) cgi-bin/qis/QIS_wireless.asp, (68) cgi-bin/query_wan_status.asp, (69) cgi-bin/query_wan_status2.asp, and (70) cgi-bin/start_apply.asp."	5.4	MEDIUM	CVSS:3.1/AV:N/AC:L/PR:L/UI:R/S:C/C:L/I:L/A:N		
CVE-2022-2274	2022-07-01T08:15:07.687	2024-11-21T07:00:40.030	The OpenSSL 3.0.4 release introduced a serious bug in the RSA implementation for X86_64 CPUs supporting the AVX512IFMA instructions. This issue makes the RSA implementation with 2048 bit private keys incorrect on such machines and memory corruption will happen during the computation. As a consequence of the memory corruption an attacker may be able to trigger a remote code execution on the machine performing the computation. SSL/TLS servers or other servers using 2048 bit RSA private keys running on machines supporting AVX512IFMA instructions of the X86_64 architecture are affected by this issue.	9.8	CRITICAL	CVSS:3.1/AV:N/AC:L/PR:N/UI:N/S:U/C:H/I:H/A:H		
CVE-2022-2279	2022-07-01T09:15:09.067	2024-11-21T07:00:40.670	NULL Pointer Dereference in GitHub repository bfabiszewski/libmobi prior to 0.11.	5.5	MEDIUM	CVSS:3.1/AV:L/AC:L/PR:N/UI:R/S:U/C:N/I:N/A:H		
CVE-2022-2280	2022-07-01T09:15:09.320	2024-11-21T07:00:40.807	Cross-site Scripting (XSS) - Stored in GitHub repository microweber/microweber prior to 1.2.19.	5.4	MEDIUM	CVSS:3.1/AV:N/AC:L/PR:L/UI:R/S:C/C:L/I:L/A:N		
CVE-2022-34894	2022-07-01T10:15:10.003	2024-11-21T07:10:23.627	In JetBrains Hub before 2022.2.14799, insufficient access control allowed the hijacking of untrusted services	3.5	LOW	CVSS:3.1/AV:N/AC:L/PR:L/UI:R/S:U/C:L/I:N/A:N		
CVE-2022-2264	2022-07-01T11:15:07.833	2024-11-21T07:00:38.747	Heap-based Buffer Overflow in GitHub repository vim/vim prior to 9.0.	7.8	HIGH	CVSS:3.1/AV:L/AC:L/PR:N/UI:R/S:U/C:H/I:H/A:H		
CVE-2022-33099	2022-07-01T12:15:08.173	2024-11-21T07:07:32.560	An issue in the component luaG_runerror of Lua v5.4.4 and below leads to a heap-buffer overflow when a recursive error occurs.	7.5	HIGH	CVSS:3.1/AV:N/AC:L/PR:N/UI:N/S:U/C:N/I:N/A:H		
CVE-2022-33103	2022-07-01T12:15:08.223	2024-11-21T07:07:32.737	Das U-Boot from v2020.10 to v2022.07-rc3 was discovered to contain an out-of-bounds write via the function sqfs_readdir().	7.8	HIGH	CVSS:3.1/AV:L/AC:L/PR:L/UI:N/S:U/C:H/I:H/A:H		
CVE-2022-2282	2022-07-01T13:15:08.137	2023-11-07T03:46:24.137	Rejected reason: DO NOT USE THIS CANDIDATE NUMBER. Reason: This CVE has been rejected as it was incorrectly assigned. All references and descriptions in this candidate have been removed to prevent accidental usage					
CVE-2014-3648	2022-07-01T14:15:08.107	2024-11-21T02:08:34.710	The simplepush server iterates through the application installations and pushes a notification to the server provided by deviceToken. But this is user controlled. If a bogus applications is registered with bad deviceTokens, one can generate endless exceptions when those endpoints can't be reached or can slow the server down by purposefully wasting it's time with slow endpoints. Similarly, one can provide whatever HTTP end point they want. This turns the server into a DDOS vector or an anonymizer for the posting of malware and so on.	7.5	HIGH	CVSS:3.1/AV:N/AC:L/PR:N/UI:N/S:U/C:N/I:N/A:H		
CVE-2014-3650	2022-07-01T14:15:08.160	2024-11-21T02:08:34.923	Multiple persistent cross-site scripting (XSS) flaws were found in the way Aerogear handled certain user-supplied content. A remote attacker could use these flaws to compromise the application with specially crafted input.	5.4	MEDIUM	CVSS:3.1/AV:N/AC:L/PR:L/UI:R/S:C/C:L/I:L/A:N		
CVE-2022-2253	2022-07-01T15:15:07.937	2024-11-21T07:00:37.417	A user with administrative privileges in Distributed Data Systems WebHMI 4.1.1.7662 may send OS commands to execute on the host server.	9.1	CRITICAL	CVSS:3.1/AV:N/AC:L/PR:H/UI:N/S:C/C:H/I:H/A:H		
CVE-2022-1983	2022-07-01T16:15:08.007	2024-11-21T06:41:53.150	Incorrect authorization in GitLab EE affecting all versions from 10.7 prior to 14.10.5, 15.0 prior to 15.0.4, and 15.1 prior to 15.1.1, allowed an attacker already in possession of a valid Deploy Key or a Deploy Token to misuse it from any location to access Container Registries even when IP address restrictions were configured.	6.5	MEDIUM	CVSS:3.1/AV:N/AC:L/PR:H/UI:N/S:U/C:H/I:H/A:N		
CVE-2022-2185	2022-07-01T16:15:08.093	2024-11-21T07:00:30.037	A critical issue has been discovered in GitLab affecting all versions starting from 14.0 prior to 14.10.5, 15.0 prior to 15.0.4, and 15.1 prior to 15.1.1 where an authenticated user authorized to import projects could import a maliciously crafted project leading to remote code execution.	9.9	CRITICAL	CVSS:3.1/AV:N/AC:L/PR:L/UI:N/S:C/C:H/I:H/A:H		
CVE-2022-2227	2022-07-01T16:15:08.163	2024-11-21T07:00:34.777	Improper access control in the runner jobs API in GitLab CE/EE affecting all versions prior to 14.10.5, 15.0 prior to 15.0.4, and 15.1 prior to 15.1.1 allows a previous maintainer of a project with a specific runner to access job and project meta data under certain conditions	3.1	LOW	CVSS:3.1/AV:N/AC:H/PR:L/UI:N/S:U/C:L/I:N/A:N		
CVE-2022-2230	2022-07-01T16:15:08.227	2024-11-21T07:00:35.153	A Stored Cross-Site Scripting vulnerability in the project settings page in GitLab CE/EE affecting all versions from 14.4 prior to 14.10.5, 15.0 prior to 15.0.4, and 15.1 prior to 15.1.1, allows an attacker to execute arbitrary JavaScript code in GitLab on a victim's behalf.	8.1	HIGH	CVSS:3.1/AV:N/AC:L/PR:H/UI:R/S:C/C:H/I:H/A:N		
CVE-2022-2235	2022-07-01T16:15:08.300	2024-11-21T07:00:35.750	Insufficient sanitization in GitLab EE's external issue tracker affecting all versions from 14.5 prior to 14.10.5, 15.0 prior to 15.0.4, and 15.1 prior to 15.1.1 allows an attacker to perform cross-site scripting when a victim clicks on a maliciously crafted ZenTao link	8.7	HIGH	CVSS:3.1/AV:N/AC:L/PR:L/UI:R/S:C/C:H/I:H/A:N		
CVE-2022-2243	2022-07-01T16:15:08.367	2024-11-21T07:00:36.590	An access control vulnerability in GitLab EE/CE affecting all versions from 14.8 prior to 14.10.5, 15.0 prior to 15.0.4, and 15.1 prior to 15.1.1, allows authenticated users to enumerate issues in non-linked sentry projects.	5.0	MEDIUM	CVSS:3.1/AV:N/AC:L/PR:L/UI:N/S:C/C:L/I:N/A:N		
CVE-2022-2244	2022-07-01T16:15:08.437	2024-11-21T07:00:36.710	An improper authorization vulnerability in GitLab EE/CE affecting all versions from 14.8 prior to 14.10.5, 15.0 prior to 15.0.4, and 15.1 prior to 15.1.1, allows project memebers with reporter role to manage issues in project's error tracking feature.	4.3	MEDIUM	CVSS:3.1/AV:N/AC:L/PR:L/UI:N/S:U/C:N/I:L/A:N		
CVE-2022-2250	2022-07-01T16:15:08.503	2024-11-21T07:00:37.063	An open redirect vulnerability in GitLab EE/CE affecting all versions from 11.1 prior to 14.10.5, 15.0 prior to 15.0.4, and 15.1 prior to 15.1.1, allows an attacker to redirect users to an arbitrary location if they trust the URL.	4.7	MEDIUM	CVSS:3.1/AV:N/AC:L/PR:N/UI:R/S:C/C:N/I:L/A:N		
CVE-2022-2254	2022-07-01T16:15:08.570	2024-11-21T07:00:37.533	A user with administrative privileges in Distributed Data Systems WebHMI 4.1.1.7662 can store a script that could impact other logged in users.	6.2	MEDIUM	CVSS:3.1/AV:N/AC:L/PR:H/UI:R/S:C/C:H/I:N/A:N		
CVE-2022-2281	2022-07-01T16:15:08.647	2024-11-21T07:00:40.933	An information disclosure vulnerability in GitLab EE affecting all versions from 12.5 prior to 14.10.5, 15.0 prior to 15.0.4, and 15.1 prior to 15.1.1, allows disclosure of release titles if group milestones are associated with any project releases.	2.6	LOW	CVSS:3.1/AV:N/AC:H/PR:L/UI:R/S:U/C:L/I:N/A:N		
CVE-2022-1963	2022-07-01T17:15:07.143	2024-11-21T06:41:50.857	An issue has been discovered in GitLab CE/EE affecting all versions starting from 13.4 before 14.10.5, all versions starting from 15.0 before 15.0.4, all versions starting from 15.1 before 15.1.1. GitLab reveals if a user has enabled two-factor authentication on their account in the HTML source, to unauthenticated users.	5.3	MEDIUM	CVSS:3.1/AV:N/AC:L/PR:N/UI:N/S:U/C:L/I:N/A:N		
CVE-2022-1981	2022-07-01T17:15:07.217	2024-11-21T06:41:52.883	An issue has been discovered in GitLab EE affecting all versions starting from 12.2 prior to 14.10.5, 15.0 prior to 15.0.4, and 15.1 prior to 15.1.1. In GitLab, if a group enables the setting to restrict access to users belonging to specific domains, that allow-list may be bypassed if a Maintainer uses the 'Invite a group' feature to invite a group that has members that don't comply with domain allow-list.	2.7	LOW	CVSS:3.1/AV:N/AC:L/PR:H/UI:N/S:U/C:N/I:L/A:N		
CVE-2022-1999	2022-07-01T17:15:07.283	2024-11-21T06:41:55.330	An issue has been discovered in GitLab CE/EE affecting all versions from 8.13 prior to 14.10.5, 15.0 prior to 15.0.4, and 15.1 prior to 15.1.1. Under certain conditions, using the REST API an unprivileged user was able to change labels description.	3.1	LOW	CVSS:3.1/AV:N/AC:H/PR:N/UI:R/S:U/C:N/I:L/A:N		
CVE-2022-2228	2022-07-01T17:15:07.437	2024-11-21T07:00:34.900	Information exposure in GitLab EE affecting all versions from 12.0 prior to 14.10.5, 15.0 prior to 15.0.4, and 15.1 prior to 15.1.1 allows an attacker with the appropriate access tokens to obtain CI variables in a group with using IP-based access restrictions even if the GitLab Runner is calling from outside the allowed IP range	5.3	MEDIUM	CVSS:3.1/AV:N/AC:H/PR:N/UI:R/S:U/C:H/I:N/A:N		
CVE-2022-2229	2022-07-01T17:15:07.487	2024-11-21T07:00:35.023	An improper authorization issue in GitLab CE/EE affecting all versions from 13.7 prior to 14.10.5, 15.0 prior to 15.0.4, and 15.1 prior to 15.1.1 allows an attacker to extract the value of an unprotected variable they know the name of in public projects or private projects they're a member of.	7.5	HIGH	CVSS:3.1/AV:N/AC:L/PR:N/UI:N/S:U/C:H/I:N/A:N		
CVE-2022-2270	2022-07-01T17:15:07.550	2024-11-21T07:00:39.537	An issue has been discovered in GitLab affecting all versions starting from 12.4 before 14.10.5, all versions starting from 15.0 before 15.0.4, all versions starting from 15.1 before 15.1.1. GitLab was leaking Conan packages names due to incorrect permissions verification.	3.5	LOW	CVSS:3.1/AV:N/AC:L/PR:L/UI:R/S:U/C:L/I:N/A:N		
CVE-2022-31113	2022-07-01T17:15:07.693	2024-11-21T07:03:55.397	Canarytokens is an open source tool which helps track activity and actions on your network. A Cross-Site Scripting vulnerability was identified in the history page of triggered Canarytokens. This permits an attacker who recognised an HTTP-based Canarytoken (a URL) to execute Javascript in the Canarytoken's history page (domain: canarytokens.org) when the history page is later visited by the Canarytoken's creator. This vulnerability could be used to disable or delete the affected Canarytoken, or view its activation history. It might also be used as a stepping stone towards revealing more information about the Canarytoken's creator to the attacker. For example, an attacker could recover the email address tied to the Canarytoken, or place Javascript on the history page that redirect the creator towards an attacker-controlled Canarytoken to show the creator's network location. An attacker could only act on the discovered Canarytoken. This issue did not expose other Canarytokens or other Canarytoken creators. The issue has been patched on Canarytokens.org and in the latest release. No signs of successful exploitation of this vulnerability have been found. Users are advised to upgrade. There are no known workarounds for this issue.	6.3	MEDIUM	CVSS:3.1/AV:N/AC:L/PR:N/UI:R/S:U/C:L/I:L/A:L		
CVE-2021-37524	2022-07-01T18:15:08.467	2024-11-21T06:15:18.640	"Cross Site Scripting (XSS) vulnerability in FusionPBX 4.5.26 allows remote unauthenticated users to inject arbitrary web script or HTML via an unsanitized ""path"" parameter in resources/login.php."	6.1	MEDIUM	CVSS:3.1/AV:N/AC:L/PR:N/UI:R/S:C/C:L/I:L/A:N		
CVE-2022-0167	2022-07-01T18:15:08.517	2024-11-21T06:38:03.477	An issue has been discovered in GitLab affecting all versions starting from 14.0 before 14.4.5, all versions starting from 14.5.0 before 14.5.3, all versions starting from 14.6.0 before 14.6.2. GitLab was not disabling the Autocomplete attribute of fields related to sensitive information making it possible to be retrieved under certain conditions.	3.1	LOW	CVSS:3.1/AV:N/AC:H/PR:H/UI:R/S:U/C:L/I:L/A:N		
CVE-2022-1954	2022-07-01T18:15:08.570	2024-11-21T06:41:49.643	A Regular Expression Denial of Service vulnerability in GitLab CE/EE affecting all versions from 1.0.2 prior to 14.10.5, 15.0 prior to 15.0.4, and 15.1 prior to 15.1.1 allows an attacker to make a GitLab instance inaccessible via specially crafted web server response headers	4.3	MEDIUM	CVSS:3.1/AV:N/AC:L/PR:L/UI:N/S:U/C:N/I:N/A:L		
CVE-2022-22366	2022-07-01T18:15:08.623	2024-11-21T06:46:42.450	IBM UrbanCode Deploy (UCD) 6.2.7.15, 7.0.5.10, 7.1.2.6, and 7.2.2.1 stores user credentials in plain clear text which can be read by a local user. IBM X-Force ID: 22106.	4.4	MEDIUM	CVSS:3.1/AV:L/AC:L/PR:H/UI:N/S:U/C:H/I:N/A:N		
CVE-2022-22367	2022-07-01T18:15:08.673	2024-11-21T06:46:42.593	IBM UrbanCode Deploy (UCD) 6.2.7.15, 7.0.5.10, 7.1.2.6, and 7.2.2.1 could disclose sensitive database information to a local user in plain text. IBM X-Force ID: 221008.	5.5	MEDIUM	CVSS:3.1/AV:L/AC:L/PR:L/UI:N/S:U/C:H/I:N/A:N		
CVE-2022-22373	2022-07-01T18:15:08.720	2024-11-21T06:46:43.190	An improper validation vulnerability in IBM InfoSphere Information Server 11.7 Pack for SAP Apps and BW Packs may lead to creation of directories and files on the server file system that may contain non-sensitive debugging information like stack traces. IBM X-Force ID: 221323.	5.4	MEDIUM	CVSS:3.1/AV:N/AC:L/PR:L/UI:N/S:U/C:L/I:L/A:N		
CVE-2022-31604	2022-07-01T18:15:08.773	2024-11-21T07:04:49.937	NVFLARE, versions prior to 2.1.2, contains a vulnerability in its PKI implementation module, where The CA credentials are transported via pickle and no safe deserialization. The deserialization of Untrusted Data may allow an unprivileged network attacker to cause Remote Code Execution, Denial Of Service, and Impact to both Confidentiality and Integrity.	9.8	CRITICAL	CVSS:3.1/AV:N/AC:L/PR:N/UI:N/S:U/C:H/I:H/A:H		
CVE-2022-31605	2022-07-01T18:15:08.837	2024-11-21T07:04:50.067	NVFLARE, versions prior to 2.1.2, contains a vulnerability in its utils module, where YAML files are loaded via yaml.load() instead of yaml.safe_load(). The deserialization of Untrusted Data, may allow an unprivileged network attacker to cause Remote Code Execution, Denial Of Service, and Impact to both Confidentiality and Integrity.	9.8	CRITICAL	CVSS:3.1/AV:N/AC:L/PR:N/UI:N/S:U/C:H/I:H/A:H		
CVE-2022-32030	2022-07-01T18:15:08.890	2024-11-21T07:05:39.810	Tenda AX1806 v1.0.0.1 was discovered to contain a stack overflow via the list parameter in the function formSetQosBand.	7.5	HIGH	CVSS:3.1/AV:N/AC:L/PR:N/UI:N/S:U/C:N/I:N/A:H		
CVE-2022-32031	2022-07-01T18:15:08.927	2024-11-21T07:05:39.980	Tenda AX1806 v1.0.0.1 was discovered to contain a stack overflow via the list parameter in the function fromSetRouteStatic.	7.5	HIGH	CVSS:3.1/AV:N/AC:L/PR:N/UI:N/S:U/C:N/I:N/A:H		
CVE-2022-32032	2022-07-01T18:15:08.970	2024-11-21T07:05:40.140	Tenda AX1806 v1.0.0.1 was discovered to contain a stack overflow via the deviceList parameter in the function formAddMacfilterRule.	9.8	CRITICAL	CVSS:3.1/AV:N/AC:L/PR:N/UI:N/S:U/C:H/I:H/A:H		
CVE-2022-32033	2022-07-01T18:15:09.010	2024-11-21T07:05:40.283	Tenda AX1806 v1.0.0.1 was discovered to contain a stack overflow via the function formSetVirtualSer.	7.5	HIGH	CVSS:3.1/AV:N/AC:L/PR:N/UI:N/S:U/C:N/I:N/A:H		
CVE-2022-32034	2022-07-01T18:15:09.053	2024-11-21T07:05:40.420	Tenda M3 V1.0.0.12 was discovered to contain a stack overflow via the items parameter in the function formdelMasteraclist.	7.5	HIGH	CVSS:3.1/AV:N/AC:L/PR:N/UI:N/S:U/C:N/I:N/A:H		
CVE-2022-32035	2022-07-01T18:15:09.093	2024-11-21T07:05:40.587	Tenda M3 V1.0.0.12 was discovered to contain a stack overflow via the function formMasterMng.	7.5	HIGH	CVSS:3.1/AV:N/AC:L/PR:N/UI:N/S:U/C:N/I:N/A:H		
CVE-2022-32036	2022-07-01T18:15:09.130	2024-11-21T07:05:40.747	Tenda M3 V1.0.0.12 was discovered to contain multiple stack overflow vulnerabilities via the ssidList, storeName, and trademark parameters in the function formSetStoreWeb.	7.5	HIGH	CVSS:3.1/AV:N/AC:L/PR:N/UI:N/S:U/C:N/I:N/A:H		
CVE-2022-32037	2022-07-01T18:15:09.170	2024-11-21T07:05:40.897	Tenda M3 V1.0.0.12 was discovered to contain a stack overflow via the function formSetAPCfg.	7.5	HIGH	CVSS:3.1/AV:N/AC:L/PR:N/UI:N/S:U/C:N/I:N/A:H		
CVE-2022-32039	2022-07-01T18:15:09.207	2024-11-21T07:05:41.040	Tenda M3 V1.0.0.12 was discovered to contain a stack overflow via the listN parameter in the function fromDhcpListClient.	7.5	HIGH	CVSS:3.1/AV:N/AC:L/PR:N/UI:N/S:U/C:N/I:N/A:H		
CVE-2022-32040	2022-07-01T18:15:09.247	2024-11-21T07:05:41.200	Tenda M3 V1.0.0.12 was discovered to contain a stack overflow via the function formSetCfm.	7.5	HIGH	CVSS:3.1/AV:N/AC:L/PR:N/UI:N/S:U/C:N/I:N/A:H		
CVE-2022-32041	2022-07-01T18:15:09.287	2024-11-21T07:05:41.357	Tenda M3 V1.0.0.12 was discovered to contain a stack overflow via the function formGetPassengerAnalyseData.	7.5	HIGH	CVSS:3.1/AV:N/AC:L/PR:N/UI:N/S:U/C:N/I:N/A:H		
CVE-2022-32043	2022-07-01T18:15:09.320	2024-11-21T07:05:41.497	Tenda M3 V1.0.0.12 was discovered to contain a stack overflow via the function formSetAccessCodeInfo.	7.5	HIGH	CVSS:3.1/AV:N/AC:L/PR:N/UI:N/S:U/C:N/I:N/A:H		
CVE-2022-32044	2022-07-01T18:15:09.360	2024-11-21T07:05:41.647	TOTOLINK T6 V4.1.9cu.5179_B20201015 was discovered to contain a stack overflow via the password parameter in the function FUN_00413f80.	7.5	HIGH	CVSS:3.1/AV:N/AC:L/PR:N/UI:N/S:U/C:N/I:N/A:H		
CVE-2022-32045	2022-07-01T18:15:09.397	2024-11-21T07:05:41.800	TOTOLINK T6 V4.1.9cu.5179_B20201015 was discovered to contain a stack overflow via the desc parameter in the function FUN_00413be4.	7.5	HIGH	CVSS:3.1/AV:N/AC:L/PR:N/UI:N/S:U/C:N/I:N/A:H		
CVE-2022-32046	2022-07-01T18:15:09.437	2024-11-21T07:05:41.950	TOTOLINK T6 V4.1.9cu.5179_B20201015 was discovered to contain a stack overflow via the desc parameter in the function FUN_0041880c.	7.5	HIGH	CVSS:3.1/AV:N/AC:L/PR:N/UI:N/S:U/C:N/I:N/A:H		
CVE-2022-32047	2022-07-01T18:15:09.473	2024-11-21T07:05:42.113	TOTOLINK T6 V4.1.9cu.5179_B20201015 was discovered to contain a stack overflow via the desc parameter in the function FUN_00412ef4.	7.5	HIGH	CVSS:3.1/AV:N/AC:L/PR:N/UI:N/S:U/C:N/I:N/A:H		
CVE-2022-32048	2022-07-01T18:15:09.510	2024-11-21T07:05:42.277	TOTOLINK T6 V4.1.9cu.5179_B20201015 was discovered to contain a stack overflow via the command parameter in the function FUN_0041cc88.	7.5	HIGH	CVSS:3.1/AV:N/AC:L/PR:N/UI:N/S:U/C:N/I:N/A:H		
CVE-2022-32049	2022-07-01T18:15:09.550	2024-11-21T07:05:42.430	TOTOLINK T6 V4.1.9cu.5179_B20201015 was discovered to contain a stack overflow via the url parameter in the function FUN_00418540.	7.5	HIGH	CVSS:3.1/AV:N/AC:L/PR:N/UI:N/S:U/C:N/I:N/A:H		
CVE-2022-32050	2022-07-01T18:15:09.590	2024-11-21T07:05:42.580	TOTOLINK T6 V4.1.9cu.5179_B20201015 was discovered to contain a stack overflow via the cloneMac parameter in the function FUN_0041af40.	7.5	HIGH	CVSS:3.1/AV:N/AC:L/PR:N/UI:N/S:U/C:N/I:N/A:H		
CVE-2022-32051	2022-07-01T18:15:09.630	2024-11-21T07:05:42.730	TOTOLINK T6 V4.1.9cu.5179_B20201015 was discovered to contain a stack overflow via the desc, week, sTime, eTime parameters in the function FUN_004133c4.	7.5	HIGH	CVSS:3.1/AV:N/AC:L/PR:N/UI:N/S:U/C:N/I:N/A:H		
CVE-2022-32052	2022-07-01T18:15:09.670	2024-11-21T07:05:42.887	TOTOLINK T6 V4.1.9cu.5179_B20201015 was discovered to contain a stack overflow via the desc parameter in the function FUN_004137a4.	7.5	HIGH	CVSS:3.1/AV:N/AC:L/PR:N/UI:N/S:U/C:N/I:N/A:H		
CVE-2022-32053	2022-07-01T18:15:09.707	2024-11-21T07:05:43.033	TOTOLINK T6 V4.1.9cu.5179_B20201015 was discovered to contain a stack overflow via the cloneMac parameter in the function FUN_0041621c.	7.5	HIGH	CVSS:3.1/AV:N/AC:L/PR:N/UI:N/S:U/C:N/I:N/A:H		
CVE-2022-25758	2022-07-01T20:15:07.847	2024-11-21T06:52:56.980	All versions of package scss-tokenizer are vulnerable to Regular Expression Denial of Service (ReDoS) via the loadAnnotation() function, due to the usage of insecure regex.	5.3	MEDIUM	CVSS:3.1/AV:N/AC:L/PR:N/UI:N/S:U/C:N/I:N/A:L		
CVE-2022-25876	2022-07-01T20:15:07.917	2024-11-21T06:53:09.120	The package link-preview-js before 2.1.16 are vulnerable to Server-side Request Forgery (SSRF) which allows attackers to send arbitrary requests to the local network and read the response. This is due to flawed DNS rebinding protection.	6.2	MEDIUM	CVSS:3.1/AV:L/AC:L/PR:N/UI:N/S:U/C:H/I:N/A:N		
CVE-2022-25896	2022-07-01T20:15:07.970	2024-11-21T06:53:10.917	This affects the package passport before 0.6.0. When a user logs in or logs out, the session is regenerated instead of being closed.	4.8	MEDIUM	CVSS:3.1/AV:N/AC:H/PR:N/UI:N/S:U/C:L/I:N/A:L		
CVE-2022-25898	2022-07-01T20:15:08.023	2024-11-21T06:53:11.150	The package jsrsasign before 10.5.25 are vulnerable to Improper Verification of Cryptographic Signature when JWS or JWT signature with non Base64URL encoding special characters or number escaped characters may be validated as valid by mistake. Workaround: Validate JWS or JWT signature if it has Base64URL and dot safe string before executing JWS.verify() or JWS.verifyJWT() method.	7.7	HIGH	CVSS:3.1/AV:N/AC:H/PR:L/UI:N/S:C/C:L/I:L/A:H		
CVE-2022-25900	2022-07-01T20:15:08.083	2024-11-21T06:53:11.380	All versions of package git-clone are vulnerable to Command Injection due to insecure usage of the --upload-pack feature of git.	8.1	HIGH	CVSS:3.1/AV:N/AC:H/PR:N/UI:N/S:U/C:H/I:H/A:H		
CVE-2022-32081	2022-07-01T20:15:08.143	2024-11-21T07:05:44.577	MariaDB v10.4 to v10.7 was discovered to contain an use-after-poison in prepare_inplace_add_virtual at /storage/innobase/handler/handler0alter.cc.	7.5	HIGH	CVSS:3.1/AV:N/AC:L/PR:N/UI:N/S:U/C:N/I:N/A:H		
CVE-2022-32082	2022-07-01T20:15:08.187	2024-11-21T07:05:44.743	MariaDB v10.5 to v10.7 was discovered to contain an assertion failure at table->get_ref_count() == 0 in dict0dict.cc.	7.5	HIGH	CVSS:3.1/AV:N/AC:L/PR:N/UI:N/S:U/C:N/I:N/A:H		
